number,value,datetime_start,datetime_complete,duration,params_gat_heads,params_gat_hidden_0,params_gat_hidden_1,params_gat_hidden_2,params_gat_layers,params_gat_out,params_kan_arity_0_0,params_kan_arity_0_1,params_kan_arity_0_2,params_kan_arity_0_3,params_kan_arity_0_4,params_kan_arity_0_5,params_kan_arity_0_6,params_kan_arity_0_7,params_kan_arity_0_8,params_kan_arity_0_9,params_kan_arity_1_0,params_kan_arity_1_1,params_kan_arity_1_2,params_kan_arity_1_3,params_kan_arity_1_4,params_kan_arity_1_5,params_kan_arity_1_6,params_kan_arity_1_7,params_kan_arity_1_8,params_kan_arity_1_9,params_kan_arity_2_0,params_kan_arity_2_1,params_kan_arity_2_2,params_kan_arity_2_3,params_kan_arity_2_4,params_kan_arity_2_5,params_kan_arity_2_6,params_kan_arity_2_7,params_kan_arity_2_8,params_kan_arity_2_9,params_kan_arity_3_0,params_kan_arity_3_1,params_kan_arity_3_2,params_kan_arity_3_3,params_kan_arity_3_4,params_kan_arity_3_5,params_kan_arity_3_6,params_kan_arity_3_7,params_kan_arity_3_8,params_kan_arity_3_9,params_kan_grid,params_kan_k,params_kan_layer_type_0,params_kan_layer_type_1,params_kan_layer_type_2,params_kan_layer_type_3,params_kan_mult_nodes_0,params_kan_mult_nodes_1,params_kan_mult_nodes_2,params_kan_mult_nodes_3,params_kan_n_layers,params_kan_neurons_0,params_kan_neurons_1,params_kan_neurons_2,params_kan_neurons_3,params_lr,state
2045,,32:21.5,34:03.3,0 days 00:01:41.794457,1,64,,,1,3,10,6,10,4,3,3,3,7,7,,,,,,,,,,,,7,4,2,2,6,2,,,,,,,,,,,,,,,4,8,mixed,normal,mixed,,9,,6,,3,7,5,7,,0.003592116,FAIL
2046,,34:03.3,35:49.8,0 days 00:01:46.533105,2,96,128,,2,4,,,,,,,,,,,6,10,7,8,6,8,7,,,,5,9,7,9,3,9,6,3,6,,,,,,,,,,,,6,8,normal,mixed,mixed,,,7,9,,3,4,10,7,,0.003813662,FAIL
2047,,35:49.8,37:20.6,0 days 00:01:30.757474,3,32,16,8,3,5,10,,,,,,,,,,,,,,,,,,,,,,,,,,,,,,,,,,,,,,,,6,6,mixed,normal,,,1,,,,2,2,2,,,0.003337361,FAIL
2048,1138.932129,37:20.6,38:54.8,0 days 00:01:34.165684,1,96,64,,2,4,,,,,,,,,,,6,3,5,6,6,,,,,,,,,,,,,,,,,,,,,,,,,,6,8,normal,mixed,,,,5,,,2,4,4,,,0.005250955,COMPLETE
2049,,38:54.8,40:28.0,0 days 00:01:33.203935,2,16,32,32,3,3,4,7,3,6,,,,,,,,,,,,,,,,,,,,,,,,,,,,,,,,,,,,,8,8,mixed,,,,4,,,,1,5,,,,0.001207573,FAIL
2050,,40:28.0,42:05.4,0 days 00:01:37.435422,3,16,64,128,3,3,3,6,6,,,,,,,,,,,,,,,,,,,,,,,,,,,,,,,,,,,,,,6,8,mixed,normal,,,3,,,,2,2,9,,,0.001023699,FAIL
2051,,42:05.4,43:40.2,0 days 00:01:34.742996,3,128,,,1,5,,,,,,,,,,,10,,,,,,,,,,9,10,4,,,,,,,,,,,,,,,,,,7,3,normal,mixed,mixed,normal,,1,3,,4,6,4,5,6,0.001572229,FAIL
2052,3461.01123,43:40.2,45:14.6,0 days 00:01:34.406926,1,16,,,1,3,9,10,5,7,6,2,4,2,,,,,,,,,,,,,,,,,,,,,,,,,,,,,,,,,5,4,mixed,normal,,,8,,,,2,3,9,,,0.003847551,COMPLETE
2053,280.9630127,45:14.6,46:51.3,0 days 00:01:36.780933,4,128,96,8,3,4,,,,,,,,,,,,,,,,,,,,,,,,,,,,,,,,,,,,,,,,,6,8,normal,normal,,,,,,,2,9,9,,,0.002705594,COMPLETE
2054,,46:51.4,48:29.3,0 days 00:01:37.917976,4,64,8,32,3,4,4,3,7,5,8,4,5,3,4,5,,,,,,,,,,,,,,,,,,,,,,,,,,,,,,,6,8,mixed,,,,10,,,,1,3,,,,0.002840347,FAIL
2055,582.6305542,48:29.3,49:54.2,0 days 00:01:24.898384,2,32,32,64,3,2,,,,,,,,,,,,,,,,,,,,,,,,,,,,,,,,,,,,,,,,,3,5,normal,,,,,,,,1,8,,,,0.004109937,COMPLETE
2056,,49:54.2,51:27.3,0 days 00:01:33.140556,4,16,16,64,3,3,5,7,7,2,3,10,,,,,,,,,,,,,,,6,,,,,,,,,,,,,,,,,,,,7,3,mixed,normal,mixed,,6,,1,,3,1,6,2,,0.002480127,FAIL
2057,667.265686,51:27.3,52:51.0,0 days 00:01:23.699740,3,64,16,,2,4,7,,,,,,,,,,,,,,,,,,,,,,,,,,,,,,,,,,,,,,,,4,3,mixed,,,,1,,,,1,5,,,,0.002762333,COMPLETE
2058,3747.236816,52:51.0,54:23.7,0 days 00:01:32.715799,4,96,,,1,5,3,3,7,4,7,9,5,5,3,4,,,,,,,,,,,,,,,,,,,,,,,,,,,,,,,6,3,mixed,normal,normal,,10,,,,3,6,5,2,,0.002350742,COMPLETE
2059,,54:23.7,55:55.6,0 days 00:01:31.857293,2,96,16,,2,2,10,2,9,6,10,,,,,,,,,,,,,,,,,,,,,,,,,,,,,,,,,,,,5,8,mixed,,,,5,,,,1,1,,,,0.001507483,FAIL
2060,572.8265381,55:55.6,57:25.2,0 days 00:01:29.586890,2,8,96,,2,3,,,,,,,,,,,,,,,,,,,,,,,,,,,,,,,,,,,,,,,,,5,7,normal,normal,,,,,,,2,7,9,,,0.001054234,COMPLETE
2061,,57:25.2,59:07.0,0 days 00:01:41.770383,1,96,96,,2,3,4,7,,,,,,,,,,,,,,,,,,,,,,,,,,,,,5,10,3,3,7,7,3,8,10,,3,5,mixed,normal,normal,mixed,2,,,9,4,2,8,1,5,0.009853104,FAIL
2062,,59:07.0,00:48.0,0 days 00:01:41.014363,1,8,16,,2,2,,,,,,,,,,,,,,,,,,,,,7,10,6,8,,,,,,,9,7,2,9,,,,,,,3,7,normal,normal,mixed,mixed,,,4,4,4,9,4,7,3,0.009451061,FAIL
2063,,00:48.0,02:29.0,0 days 00:01:40.999246,3,8,128,,2,5,2,6,3,8,8,9,5,6,6,,4,2,7,5,2,10,2,10,,,,,,,,,,,,,,,,,,,,,,,7,8,mixed,mixed,,,9,8,,,2,4,7,,,0.005115718,FAIL
2064,999.0344849,02:29.0,03:53.8,0 days 00:01:24.778049,3,128,,,1,4,5,,,,,,,,,,,,,,,,,,,,,,,,,,,,,,,,,,,,,,,,6,3,mixed,normal,,,1,,,,2,10,9,,,0.001197136,COMPLETE
2065,,03:53.8,05:29.2,0 days 00:01:35.485451,3,128,,,1,3,9,3,,,,,,,,,5,5,,,,,,,,,,,,,,,,,,,,,,,,,,,,,3,7,mixed,mixed,normal,,2,2,,,3,9,5,6,,0.003385797,FAIL
2066,661.5271606,05:29.2,06:57.3,0 days 00:01:28.084757,2,16,96,16,3,3,,,,,,,,,,,,,,,,,,,,,,,,,,,,,,,,,,,,,,,,,4,8,normal,,,,,,,,1,9,,,,0.001163605,COMPLETE
2067,,06:57.3,08:32.4,0 days 00:01:35.108580,4,16,8,128,3,5,10,9,4,,,,,,,,,,,,,,,,,,,,,,,,,,,,,,,,,,,,,,5,7,mixed,normal,,,3,,,,2,2,2,,,0.005069918,FAIL
2068,,08:32.4,10:08.2,0 days 00:01:35.745665,1,8,96,32,3,3,,,,,,,,,,,8,10,7,4,6,,,,,,9,,,,,,,,,,,,,,,,,,,,5,4,normal,mixed,mixed,,,5,1,,3,3,1,2,,0.005272475,FAIL
2069,3588.627686,10:08.2,11:34.4,0 days 00:01:26.199809,1,128,96,64,3,3,,,,,,,,,,,,,,,,,,,,,,,,,,,,,,,,,,,,,,,,,7,6,normal,,,,,,,,1,3,,,,0.002303509,COMPLETE
2070,330.73526,11:34.4,13:14.2,0 days 00:01:39.775578,4,32,16,,2,4,,,,,,,,,,,,,,,,,,,,,4,2,7,4,3,10,9,5,8,10,,,,,,,,,,,3,4,normal,normal,mixed,,,,10,,3,5,3,2,,0.00230431,COMPLETE
2071,,13:14.2,14:55.7,0 days 00:01:41.524066,1,64,,,1,2,4,7,4,3,10,,,,,,,,,,,,,,,,9,6,5,9,5,10,10,,,,,,,,,,,,,,7,3,mixed,normal,mixed,normal,5,,7,,4,4,10,5,9,0.001616976,FAIL
2072,583.5490723,14:55.7,16:25.5,0 days 00:01:29.835276,2,128,32,96,3,2,4,6,3,,,,,,,,,,,,,,,,,,,,,,,,,,,,,,,,,,,,,,7,5,mixed,,,,3,,,,1,5,,,,0.004537071,COMPLETE
2073,,16:25.5,18:08.1,0 days 00:01:42.573490,4,8,,,1,3,7,,,,,,,,,,7,3,6,5,8,2,7,,,,,,,,,,,,,,,,,,,,,,,,5,8,mixed,mixed,normal,normal,1,7,,,4,5,2,6,9,0.001129806,FAIL
2074,,18:08.1,19:51.3,0 days 00:01:43.151057,2,8,16,,2,4,5,9,10,2,6,7,9,3,3,10,6,9,4,2,,,,,,,2,,,,,,,,,,,,,,,,,,,,4,8,mixed,mixed,mixed,normal,10,4,1,,4,8,7,5,6,0.008568554,FAIL
2075,1490.4729,19:51.3,21:28.2,0 days 00:01:36.968539,2,16,16,128,3,4,5,3,2,3,9,8,10,8,6,,,,,,,,,,,,,,,,,,,,,,,,,,,,,,,,6,3,mixed,normal,normal,normal,9,,,,4,2,2,9,4,0.005353337,COMPLETE
2076,574.8596191,21:28.2,23:03.5,0 days 00:01:35.256991,2,8,,,1,4,,,,,,,,,,,,,,,,,,,,,6,,,,,,,,,,,,,,,,,,,,6,8,normal,normal,mixed,,,,1,,3,5,1,8,,0.005260948,COMPLETE
2077,8.15E+19,23:03.5,24:31.9,0 days 00:01:28.441723,3,96,,,1,4,9,6,3,4,,,,,,,2,,,,,,,,,,,,,,,,,,,,,,,,,,,,,,8,3,mixed,mixed,normal,,4,1,,,3,2,7,6,,0.006209293,COMPLETE
2078,3344.401367,24:31.9,25:59.4,0 days 00:01:27.489915,3,32,128,,2,3,,,,,,,,,,,,,,,,,,,,,,,,,,,,,,,,,,,,,,,,,8,5,normal,normal,,,,,,,2,10,3,,,0.001963549,COMPLETE
2079,,25:59.4,27:38.0,0 days 00:01:38.554713,4,96,,,1,5,10,9,6,5,9,2,5,6,7,,2,2,2,7,5,2,2,,,,,,,,,,,,,,,,,,,,,,,,6,5,mixed,mixed,,,9,7,,,2,1,1,,,0.004314409,FAIL
2080,,27:38.0,29:19.6,0 days 00:01:41.605190,3,32,,,1,4,8,7,8,6,3,5,4,2,6,,5,,,,,,,,,,,,,,,,,,,,2,9,8,,,,,,,,8,7,mixed,mixed,normal,mixed,9,1,,3,4,8,1,9,5,0.003403648,FAIL
2081,,29:19.6,31:02.5,0 days 00:01:42.939006,1,16,32,,2,2,4,5,9,5,3,6,4,4,6,,8,2,7,7,5,4,4,,,,4,4,7,8,4,3,,,,,,,,,,,,,,,4,8,mixed,mixed,mixed,normal,9,7,6,,4,6,10,7,1,0.001806982,FAIL
2082,631.0346069,31:02.5,32:40.1,0 days 00:01:37.532166,4,8,,,1,3,,,,,,,,,,,,,,,,,,,,,,,,,,,,,,,,,,,,,,,,,7,8,normal,normal,normal,normal,,,,,4,2,6,7,2,0.001771699,COMPLETE
2083,475.5913086,32:40.1,34:09.5,0 days 00:01:29.456875,4,32,128,,2,2,,,,,,,,,,,,,,,,,,,,,,,,,,,,,,,,,,,,,,,,,6,5,normal,normal,,,,,,,2,8,2,,,0.001948141,COMPLETE
2084,398.2851257,34:09.5,35:46.7,0 days 00:01:37.122457,1,128,128,8,3,4,,,,,,,,,,,,,,,,,,,,,,,,,,,,,,,2,4,6,9,5,,,,,,8,4,normal,normal,normal,mixed,,,,5,4,6,9,8,4,0.00195878,COMPLETE
2085,,35:46.7,37:35.9,0 days 00:01:49.262356,4,64,96,,2,4,8,3,3,7,5,9,,,,,8,8,5,2,10,7,,,,,7,10,6,8,5,,,,,,4,4,,,,,,,,,6,6,mixed,mixed,mixed,mixed,6,6,5,2,4,6,2,10,4,0.007586036,FAIL
2086,,37:35.9,39:21.0,0 days 00:01:45.068278,3,64,128,,2,3,4,7,6,9,10,6,8,10,,,5,8,3,7,9,6,3,9,9,,5,3,9,7,4,6,9,,,,,,,,,,,,,,4,8,mixed,mixed,mixed,,8,9,7,,3,1,6,6,,0.001733906,FAIL
2087,,39:21.0,41:00.5,0 days 00:01:39.518740,1,16,,,1,2,3,9,3,5,5,8,,,,,,,,,,,,,,,8,2,8,8,7,7,,,,,9,,,,,,,,,,7,3,mixed,normal,mixed,mixed,6,,6,1,4,6,7,2,7,0.001462355,FAIL
2088,575.4284058,41:00.5,42:27.1,0 days 00:01:26.559636,4,64,,,1,3,,,,,,,,,,,,,,,,,,,,,,,,,,,,,,,,,,,,,,,,,8,6,normal,,,,,,,,1,8,,,,0.004980902,COMPLETE
2089,,42:27.1,44:13.3,0 days 00:01:46.184441,4,96,96,,2,5,,,,,,,,,,,8,10,5,8,7,8,5,,,,6,10,4,4,8,,,,,,,,,,,,,,,,6,8,normal,mixed,mixed,,,7,5,,3,6,8,7,,0.001452526,FAIL
2090,332.1051941,44:13.3,45:56.3,0 days 00:01:43.040150,4,96,96,,2,5,,,,,,,,,,,7,,,,,,,,,,5,7,9,10,2,3,9,,,,,,,,,,,,,,7,6,normal,mixed,mixed,,,1,7,,3,2,4,8,,0.003875944,COMPLETE
2091,600.7427979,45:56.3,47:31.1,0 days 00:01:34.796604,1,32,16,,2,4,6,10,5,3,8,9,5,4,,,,,,,,,,,,,,,,,,,,,,,,,,,,,,,,,3,3,mixed,normal,,,8,,,,2,2,10,,,0.008475345,COMPLETE
2092,,47:31.1,49:19.2,0 days 00:01:48.045135,4,8,128,,2,3,5,8,,,,,,,,,3,3,7,4,2,4,2,3,,,5,2,7,5,10,4,3,9,4,,,,,,,,,,,,6,7,mixed,mixed,mixed,normal,2,8,9,,4,6,6,1,3,0.009310772,FAIL
2093,3398.216064,49:19.2,50:48.2,0 days 00:01:29.018721,3,8,32,,2,4,,,,,,,,,,,,,,,,,,,,,,,,,,,,,,,,,,,,,,,,,8,8,normal,,,,,,,,1,2,,,,0.005640198,COMPLETE
2094,,50:48.2,52:29.0,0 days 00:01:40.858341,1,64,8,8,3,2,5,4,8,3,3,6,9,4,4,,4,,,,,,,,,,,,,,,,,,,,,,,,,,,,,,7,5,mixed,mixed,normal,,9,1,,,3,7,7,2,,0.001973179,FAIL
2095,531.9475708,52:29.1,54:09.7,0 days 00:01:40.632644,1,128,,,1,4,,,,,,,,,,,8,5,2,10,3,5,7,2,2,3,6,3,8,,,,,,,,10,8,3,8,,,,,,,6,4,normal,mixed,mixed,mixed,,10,3,4,4,1,7,5,7,0.009601314,COMPLETE
2096,,54:09.7,55:50.3,0 days 00:01:40.663419,2,64,,,1,5,,,,,,,,,,,6,5,7,4,4,7,2,9,,,10,2,6,10,10,,,,,,,,,,,,,,,,3,4,normal,mixed,mixed,normal,,8,5,,4,10,8,7,3,0.007151535,FAIL
2097,265.8424988,55:50.4,57:33.7,0 days 00:01:43.330796,3,128,96,96,3,5,,,,,,,,,,,,,,,,,,,,,6,6,6,3,8,2,5,7,,,3,,,,,,,,,,4,6,normal,normal,mixed,mixed,,,8,1,4,5,5,5,4,0.001096328,COMPLETE
2098,701.3999634,57:33.7,59:03.3,0 days 00:01:29.578649,2,64,32,128,3,4,,,,,,,,,,,,,,,,,,,,,,,,,,,,,,,,,,,,,,,,,8,3,normal,normal,normal,,,,,,3,6,3,2,,0.007892213,COMPLETE
2099,1191.616699,59:03.3,00:37.4,0 days 00:01:34.099579,3,64,,,1,5,,,,,,,,,,,5,6,6,3,5,4,3,,,,,,,,,,,,,,,,,,,,,,,,6,6,normal,mixed,,,,7,,,2,1,8,,,0.009831654,COMPLETE
2100,,00:37.4,02:09.9,0 days 00:01:32.495386,1,32,,,1,2,10,7,,,,,,,,,,,,,,,,,,,,,,,,,,,,,,,,,,,,,,,4,5,mixed,normal,normal,,2,,,,3,8,1,6,,0.00729761,FAIL
2101,2183.873291,02:09.9,03:36.5,0 days 00:01:26.581417,4,128,64,,2,3,,,,,,,,,,,,,,,,,,,,,,,,,,,,,,,,,,,,,,,,,8,3,normal,normal,,,,,,,2,3,1,,,0.006400023,COMPLETE
2102,335.870636,03:36.5,05:07.9,0 days 00:01:31.461574,4,8,8,,2,3,7,3,3,,,,,,,,,,,,,,,,,,,,,,,,,,,,,,,,,,,,,,3,3,mixed,normal,normal,normal,3,,,,4,2,1,4,8,0.004735946,COMPLETE
2103,,05:07.9,06:47.2,0 days 00:01:39.312232,2,64,8,8,3,3,3,7,7,5,,,,,,,7,9,4,7,4,9,6,,,,,,,,,,,,,,,,,,,,,,,,8,8,mixed,mixed,,,4,7,,,2,10,9,,,0.003212316,FAIL
2104,555.1137695,06:47.2,08:15.9,0 days 00:01:28.701668,2,64,,,1,3,7,6,3,5,5,2,,,,,,,,,,,,,,,,,,,,,,,,,,,,,,,,,,,4,5,mixed,,,,6,,,,1,3,,,,0.002198124,COMPLETE
2105,,08:15.9,10:00.1,0 days 00:01:44.143660,3,96,96,96,3,4,3,2,6,3,3,6,8,,,,4,9,3,6,5,4,5,3,4,,,,,,,,,,,,3,8,7,3,5,2,6,,,,3,7,mixed,mixed,normal,mixed,7,9,,7,4,3,3,6,6,0.001407011,FAIL
2106,2383.267578,10:00.1,11:31.2,0 days 00:01:31.147916,4,64,16,16,3,4,,,,,,,,,,,,,,,,,,,,,,,,,,,,,,,,,,,,,,,,,6,6,normal,normal,,,,,,,2,8,1,,,0.004826545,COMPLETE
2107,,11:31.2,13:12.4,0 days 00:01:41.211929,3,16,32,,2,3,,,,,,,,,,,8,6,8,8,9,2,5,9,9,,,,,,,,,,,,,,,,,,,,,,8,7,normal,mixed,,,,9,,,2,10,7,,,0.001960282,FAIL
2108,714.4698486,13:12.5,14:37.7,0 days 00:01:25.254115,3,8,8,16,3,5,,,,,,,,,,,,,,,,,,,,,,,,,,,,,,,,,,,,,,,,,6,3,normal,,,,,,,,1,7,,,,0.001195045,COMPLETE
2109,999.8158569,14:37.7,16:20.9,0 days 00:01:43.176260,4,96,32,,2,5,,,,,,,,,,,,,,,,,,,,,10,7,3,8,7,5,9,5,,,6,10,6,2,7,9,9,10,8,10,8,7,normal,normal,mixed,mixed,,,8,10,4,4,3,2,3,0.00498062,COMPLETE
2110,,16:20.9,17:58.3,0 days 00:01:37.389020,2,8,64,16,3,4,2,9,6,8,7,10,,,,,,,,,,,,,,,,,,,,,,,,,,,,,,,,,,,4,6,mixed,normal,,,6,,,,2,9,10,,,0.00117224,FAIL
2111,,17:58.3,19:34.0,0 days 00:01:35.686700,2,128,96,64,3,4,9,6,4,6,8,3,,,,,,,,,,,,,,,,,,,,,,,,,,,,,,,,,,,4,8,mixed,,,,6,,,,1,4,,,,0.003691446,FAIL
2112,634.0189819,19:34.0,21:06.5,0 days 00:01:32.521332,3,128,128,64,3,2,,,,,,,,,,,,,,,,,,,,,,,,,,,,,,,,,,,,,,,,,7,6,normal,normal,,,,,,,2,3,2,,,0.003562864,COMPLETE
2113,,21:06.5,22:46.6,0 days 00:01:40.127178,1,16,,,1,4,,,,,,,,,,,,,,,,,,,,,10,3,3,4,4,2,,,,,,,,,,,,,,,3,8,normal,normal,mixed,,,,6,,3,9,7,9,,0.008601335,FAIL
2114,,22:46.6,24:15.5,0 days 00:01:28.841726,1,32,,,1,5,8,10,10,3,,,,,,,,,,,,,,,,,,,,,,,,,,,,,,,,,,,,,7,5,mixed,,,,4,,,,1,4,,,,0.006857904,FAIL
2115,402.5544128,24:15.5,25:57.4,0 days 00:01:41.962306,3,16,16,,2,4,,,,,,,,,,,,,,,,,,,,,6,10,3,2,3,8,6,,,,,,,,,,,,,,6,7,normal,normal,mixed,,,,7,,3,6,2,10,,0.001385852,COMPLETE
2116,1458.494141,25:57.4,27:29.5,0 days 00:01:32.040373,2,8,,,1,3,,,,,,,,,,,,,,,,,,,,,,,,,,,,,,,,,,,,,,,,,7,8,normal,normal,,,,,,,2,1,9,,,0.002173978,COMPLETE
2117,,27:29.5,29:13.6,0 days 00:01:44.078493,2,96,32,32,3,5,,,,,,,,,,,4,10,8,2,6,8,2,,,,10,10,6,4,4,3,3,9,3,,,,,,,,,,,,4,6,normal,mixed,mixed,,,7,9,,3,8,10,6,,0.002036392,FAIL
2118,,29:13.6,30:54.6,0 days 00:01:40.998466,3,96,,,1,4,5,2,3,5,9,8,4,3,2,,9,5,3,7,5,,,,,,6,,,,,,,,,,,,,,,,,,,,7,7,mixed,mixed,mixed,,9,5,1,,3,10,3,1,,0.003312953,FAIL
2119,,30:54.6,32:32.9,0 days 00:01:38.299766,1,16,16,,2,4,3,,,,,,,,,,10,7,10,4,3,2,6,2,6,7,3,,,,,,,,,,,,,,,,,,,,7,3,mixed,mixed,mixed,,1,10,1,,3,8,1,4,,0.006057955,FAIL
2120,627.6963501,32:32.9,33:58.2,0 days 00:01:25.366607,1,8,,,1,5,10,,,,,,,,,,,,,,,,,,,,,,,,,,,,,,,,,,,,,,,,6,4,mixed,,,,1,,,,1,4,,,,0.003331889,COMPLETE
2121,380.2258606,33:58.2,35:29.9,0 days 00:01:31.647211,3,64,8,,2,3,,,,,,,,,,,,,,,,,,,,,,,,,,,,,,,,,,,,,,,,,6,7,normal,normal,,,,,,,2,3,8,,,0.003700942,COMPLETE
2122,783.5618286,35:29.9,36:54.0,0 days 00:01:24.083638,1,32,8,,2,4,,,,,,,,,,,,,,,,,,,,,,,,,,,,,,,,,,,,,,,,,8,3,normal,,,,,,,,1,10,,,,0.001240879,COMPLETE
2123,,36:54.0,38:31.6,0 days 00:01:37.664074,2,16,,,1,2,,,,,,,,,,,8,6,10,7,2,,,,,,,,,,,,,,,,,,,,,,,,,,6,8,normal,mixed,,,,5,,,2,10,10,,,0.008322333,FAIL
2124,1.39E+18,38:31.6,40:04.7,0 days 00:01:33.109469,2,128,,,1,4,6,10,8,8,9,4,8,,,,,,,,,,,,,,,,,,,,,,,,,,,,,,,,,,8,4,mixed,,,,7,,,,1,5,,,,0.001399689,COMPLETE
2125,645.5402832,40:04.7,41:33.4,0 days 00:01:28.605929,2,128,64,,2,2,,,,,,,,,,,,,,,,,,,,,,,,,,,,,,,,,,,,,,,,,4,7,normal,,,,,,,,1,2,,,,0.003197872,COMPLETE
2126,2902.226807,41:33.4,43:12.7,0 days 00:01:39.383617,3,128,8,,2,3,,,,,,,,,,,5,4,,,,,,,,,,,,,,,,,,,,,,,,,,,,,3,8,normal,mixed,normal,,,2,,,3,6,5,1,,0.003639133,COMPLETE
2127,,43:12.7,44:56.2,0 days 00:01:43.452095,3,16,96,,2,4,2,4,5,10,9,3,6,,,,2,5,10,4,10,9,9,8,3,5,,,,,,,,,,,9,9,2,5,8,,,,,,3,6,mixed,mixed,normal,mixed,7,10,,5,4,7,4,9,10,0.008252601,FAIL
2128,,44:56.2,46:37.0,0 days 00:01:40.781160,3,96,16,,2,4,5,,,,,,,,,,2,4,7,2,10,,,,,,,,,,,,,,,,6,8,7,3,5,2,,,,,3,5,mixed,mixed,normal,mixed,1,5,,6,4,4,4,7,7,0.003249647,FAIL
2129,,46:37.0,48:17.6,0 days 00:01:40.626567,1,16,,,1,3,10,7,7,,,,,,,,9,,,,,,,,,,7,6,7,7,5,10,9,4,6,,,,,,,,,,,,7,4,mixed,mixed,mixed,,3,1,9,,3,2,3,7,,0.002439894,FAIL
2130,3380.270752,48:17.6,49:47.0,0 days 00:01:29.436657,2,32,,,1,3,,,,,,,,,,,,,,,,,,,,,,,,,,,,,,,,,,,,,,,,,8,6,normal,normal,,,,,,,2,7,2,,,0.004351387,COMPLETE
2131,,49:47.0,51:34.2,0 days 00:01:47.143071,4,16,16,,2,3,3,,,,,,,,,,6,7,10,5,4,2,3,,,,7,9,2,3,4,10,,,,,8,3,6,5,7,2,9,7,7,2,4,4,mixed,mixed,mixed,mixed,1,7,6,10,4,10,8,10,3,0.006916468,FAIL
2132,,51:34.2,53:11.3,0 days 00:01:37.128703,1,64,8,96,3,4,3,6,8,6,10,6,10,,,,,,,,,,,,,,,,,,,,,,,,,,,,,,,,,,5,7,mixed,,,,7,,,,1,2,,,,0.002046917,FAIL
2133,1145.21521,53:11.3,54:35.9,0 days 00:01:24.604856,1,96,,,1,4,,,,,,,,,,,,,,,,,,,,,,,,,,,,,,,,,,,,,,,,,8,5,normal,,,,,,,,1,4,,,,0.001517894,COMPLETE
2134,473.449707,54:35.9,56:01.2,0 days 00:01:25.242156,1,32,16,32,3,2,,,,,,,,,,,,,,,,,,,,,,,,,,,,,,,,,,,,,,,,,7,3,normal,,,,,,,,1,7,,,,0.003178294,COMPLETE
2135,,56:01.2,57:34.0,0 days 00:01:32.783720,4,16,128,,2,3,7,10,,,,,,,,,,,,,,,,,,,,,,,,,,,,,,,,,,,,,,,5,8,mixed,,,,2,,,,1,5,,,,0.002693658,FAIL
2136,,57:34.0,59:15.0,0 days 00:01:41.074980,3,16,,,1,5,,,,,,,,,,,,,,,,,,,,,2,6,2,,,,,,,,7,9,4,7,,,,,,,3,7,normal,normal,mixed,mixed,,,3,4,4,10,7,2,4,0.008481762,FAIL
2137,,59:15.0,00:50.2,0 days 00:01:35.139633,3,8,32,64,3,3,4,6,5,6,4,2,2,8,3,,,,,,,,,,,,,,,,,,,,,,,,,,,,,,,,5,6,mixed,,,,9,,,,1,3,,,,0.002593285,FAIL
2138,,00:50.2,02:23.1,0 days 00:01:32.926562,3,96,,,1,2,4,7,8,,,,,,,,4,4,7,7,,,,,,,,,,,,,,,,,,,,,,,,,,,5,3,mixed,mixed,normal,,3,4,,,3,9,1,2,,0.004052799,FAIL
2139,,02:23.1,04:02.8,0 days 00:01:39.663910,2,96,,,1,2,4,10,10,8,6,6,7,4,10,8,,,,,,,,,,,,,,,,,,,,,,,,,,,,,,,6,8,mixed,,,,10,,,,1,10,,,,0.002565195,FAIL
2140,,04:02.8,05:40.0,0 days 00:01:37.233221,2,8,8,,2,4,10,5,4,3,10,6,2,10,,,,,,,,,,,,,,,,,,,,,,,,,,,,,,,,,6,8,mixed,,,,8,,,,1,1,,,,0.001421911,FAIL
2141,,05:40.0,07:28.9,0 days 00:01:48.871282,4,128,128,32,3,4,6,9,2,5,8,6,8,4,2,3,,,,,,,,,,,8,9,4,6,5,6,10,6,,,,,,,,,,,,,3,6,mixed,normal,mixed,,10,,8,,3,4,6,9,,0.001481437,FAIL
2142,330.8842773,07:28.9,09:10.4,0 days 00:01:41.529740,2,96,96,16,3,2,,,,,,,,,,,,,,,,,,,,,,,,,,,,,,,2,7,8,8,5,,,,,,8,5,normal,normal,normal,mixed,,,,5,4,10,4,6,8,0.003401077,COMPLETE
2143,582.9424438,09:10.4,10:41.4,0 days 00:01:30.989542,3,16,8,128,3,5,,,,,,,,,,,,,,,,,,,,,,,,,,,,,,,,,,,,,,,,,3,8,normal,,,,,,,,1,3,,,,0.005519072,COMPLETE
2144,899.7832642,10:41.4,12:11.5,0 days 00:01:30.062825,1,96,8,32,3,5,,,,,,,,,,,,,,,,,,,,,,,,,,,,,,,,,,,,,,,,,3,8,normal,,,,,,,,1,4,,,,0.004071188,COMPLETE
2145,325.5696716,12:11.5,13:54.7,0 days 00:01:43.241065,2,96,16,,2,5,,,,,,,,,,,,,,,,,,,,,,,,,,,,,,,3,7,9,7,9,,,,,,4,6,normal,normal,normal,mixed,,,,5,4,10,9,9,3,0.001452038,COMPLETE
2146,1375.087891,13:54.7,15:38.5,0 days 00:01:43.803610,2,32,64,96,3,5,9,3,7,8,7,8,5,9,10,,,,,,,,,,,,,,,,,,,,,,,,,,,,,,,,8,4,mixed,normal,normal,normal,9,,,,4,4,5,7,6,0.004226236,COMPLETE
2147,341.6505127,15:38.5,17:14.6,0 days 00:01:36.023403,4,16,16,32,3,5,,,,,,,,,,,7,8,6,10,2,,,,,,,,,,,,,,,,,,,,,,,,,,8,5,normal,mixed,,,,5,,,2,10,7,,,0.004443754,COMPLETE
2148,6.15E+17,17:14.6,18:45.4,0 days 00:01:30.823245,2,8,96,,2,5,8,10,2,2,3,2,,,,,,,,,,,,,,,,,,,,,,,,,,,,,,,,,,,5,3,mixed,normal,,,6,,,,2,5,2,,,0.002486679,COMPLETE
2149,,18:45.4,20:33.3,0 days 00:01:47.958828,2,128,128,,2,3,4,7,4,8,10,6,8,4,4,6,,,,,,,,,,,3,6,7,5,,,,,,,,,,,,,,,,,4,8,mixed,normal,mixed,normal,10,,4,,4,1,9,3,4,0.001282341,FAIL
2150,,20:33.4,22:15.5,0 days 00:01:42.197838,3,96,,,1,4,,,,,,,,,,,,,,,,,,,,,4,3,9,10,3,5,4,7,6,,7,2,,,,,,,,,6,8,normal,normal,mixed,mixed,,,9,2,4,7,7,1,3,0.00197542,FAIL
2151,,22:15.6,23:44.5,0 days 00:01:28.949802,3,8,8,128,3,2,2,8,,,,,,,,,6,,,,,,,,,,,,,,,,,,,,,,,,,,,,,,7,3,mixed,mixed,,,2,1,,,2,1,9,,,0.004854803,FAIL
2152,337.1631775,23:44.5,25:09.7,0 days 00:01:25.197922,2,128,64,,2,5,8,3,5,,,,,,,,,,,,,,,,,,,,,,,,,,,,,,,,,,,,,,4,4,mixed,,,,3,,,,1,9,,,,0.002791422,COMPLETE
2153,,25:09.7,26:53.7,0 days 00:01:44.028174,3,32,16,,2,3,3,6,2,8,9,6,3,7,,,5,10,7,5,7,2,6,8,4,2,7,7,6,8,6,4,5,,,,,,,,,,,,,,3,8,mixed,mixed,mixed,normal,8,10,7,,4,5,3,7,10,0.007200701,FAIL
2154,,26:53.7,28:21.8,0 days 00:01:28.095569,2,128,128,,2,3,7,3,9,,,,,,,,,,,,,,,,,,,,,,,,,,,,,,,,,,,,,,5,5,mixed,,,,3,,,,1,8,,,,0.008164166,FAIL
2155,,28:21.8,30:04.7,0 days 00:01:42.897866,3,16,,,1,3,6,3,3,7,2,10,5,9,,,,,,,,,,,,,3,10,2,3,8,10,10,2,,,,,,,,,,,,,3,4,mixed,normal,mixed,,8,,8,,3,8,8,2,,0.008639524,FAIL
2156,,30:04.7,31:39.7,0 days 00:01:35.003916,4,32,,,1,2,5,5,7,2,10,3,7,2,7,,,,,,,,,,,,,,,,,,,,,,,,,,,,,,,,4,5,mixed,normal,,,9,,,,2,2,3,,,0.001472776,FAIL
2157,,31:39.8,33:27.6,0 days 00:01:47.895846,3,128,64,,2,5,6,6,8,10,10,3,6,9,,,,,,,,,,,,,,,,,,,,,,,7,9,5,3,7,8,,,,,6,7,mixed,normal,normal,mixed,8,,,6,4,8,4,5,2,0.003394724,FAIL
2158,,33:27.7,35:03.3,0 days 00:01:35.607848,2,8,128,,2,3,,,,,,,,,,,3,,,,,,,,,,,,,,,,,,,,10,8,6,2,,,,,,,6,4,normal,mixed,normal,mixed,,1,,4,4,3,1,2,9,0.004529142,FAIL
2159,,35:03.3,36:46.8,0 days 00:01:43.573160,1,96,128,32,3,2,9,4,4,2,10,3,3,2,,,3,9,4,7,10,10,7,,,,,,,,,,,,,,4,5,3,4,,,,,,,8,5,mixed,mixed,normal,mixed,8,7,,4,4,9,1,9,8,0.002838019,FAIL
2160,,36:46.8,38:31.9,0 days 00:01:45.085670,2,32,128,64,3,4,,,,,,,,,,,10,8,10,2,5,2,8,6,,,3,3,9,8,9,,,,,,,,,,,,,,,,4,7,normal,mixed,mixed,normal,,8,5,,4,4,4,2,2,0.002301029,FAIL
2161,,38:31.9,40:20.2,0 days 00:01:48.268820,3,16,64,32,3,4,10,8,9,7,4,6,10,9,3,,5,6,10,6,10,4,6,,,,5,5,,,,,,,,,4,8,6,10,8,4,3,8,3,,5,3,mixed,mixed,mixed,mixed,9,7,2,9,4,8,2,7,7,0.009427937,FAIL
2162,704.5534058,40:20.2,41:43.8,0 days 00:01:23.641962,3,128,,,1,3,,,,,,,,,,,,,,,,,,,,,,,,,,,,,,,,,,,,,,,,,5,4,normal,,,,,,,,1,4,,,,0.001925878,COMPLETE
2163,491.9631958,41:43.8,43:12.9,0 days 00:01:29.035151,3,96,8,,2,2,,,,,,,,,,,,,,,,,,,,,,,,,,,,,,,,,,,,,,,,,5,6,normal,normal,,,,,,,2,8,3,,,0.003395279,COMPLETE
2164,,43:12.9,44:49.0,0 days 00:01:36.130479,4,96,,,1,4,,,,,,,,,,,10,5,3,6,7,3,5,10,4,,,,,,,,,,,,,,,,,,,,,,6,7,normal,mixed,,,,9,,,2,2,3,,,0.005710058,FAIL
2165,742.161377,44:49.0,46:32.5,0 days 00:01:43.456465,1,8,128,64,3,4,,,,,,,,,,,9,4,7,2,3,2,10,8,9,9,,,,,,,,,,,,,,,,,,,,,7,8,normal,mixed,,,,10,,,2,1,6,,,0.002332095,COMPLETE
2166,,46:32.5,48:20.7,0 days 00:01:48.264370,4,16,64,,2,4,2,4,,,,,,,,,7,5,2,6,4,4,8,3,9,2,5,2,5,5,3,8,6,9,,,,,,,,,,,,,7,7,mixed,mixed,mixed,normal,2,10,8,,4,4,9,6,7,0.003497582,FAIL
2167,,48:20.7,50:02.3,0 days 00:01:41.582927,4,32,64,128,3,2,,,,,,,,,,,10,9,9,10,,,,,,,,,,,,,,,,,,,,,,,,,,,6,8,normal,mixed,,,,4,,,2,9,3,,,0.002889041,FAIL
