number,value,datetime_start,datetime_complete,duration,params_gat_heads,params_gat_hidden_0,params_gat_hidden_1,params_gat_hidden_2,params_gat_layers,params_gat_out,params_kan_arity_0_0,params_kan_arity_0_1,params_kan_arity_0_2,params_kan_arity_0_3,params_kan_arity_0_4,params_kan_arity_0_5,params_kan_arity_0_6,params_kan_arity_0_7,params_kan_arity_0_8,params_kan_arity_0_9,params_kan_arity_1_0,params_kan_arity_1_1,params_kan_arity_1_2,params_kan_arity_1_3,params_kan_arity_1_4,params_kan_arity_1_5,params_kan_arity_1_6,params_kan_arity_1_7,params_kan_arity_1_8,params_kan_arity_1_9,params_kan_arity_2_0,params_kan_arity_2_1,params_kan_arity_2_2,params_kan_arity_2_3,params_kan_arity_2_4,params_kan_arity_2_5,params_kan_arity_2_6,params_kan_arity_2_7,params_kan_arity_2_8,params_kan_arity_2_9,params_kan_arity_3_0,params_kan_arity_3_1,params_kan_arity_3_2,params_kan_arity_3_3,params_kan_arity_3_4,params_kan_arity_3_5,params_kan_arity_3_6,params_kan_arity_3_7,params_kan_arity_3_8,params_kan_arity_3_9,params_kan_grid,params_kan_k,params_kan_layer_type_0,params_kan_layer_type_1,params_kan_layer_type_2,params_kan_layer_type_3,params_kan_mult_nodes_0,params_kan_mult_nodes_1,params_kan_mult_nodes_2,params_kan_mult_nodes_3,params_kan_n_layers,params_kan_neurons_0,params_kan_neurons_1,params_kan_neurons_2,params_kan_neurons_3,params_lr,state
115,,13:45.6,14:30.8,0 days 00:00:45.235857,3,64,16,64,3,4,10,8,4,5,,,,,,,,,,,,,,,,,,,,,,,,,,,8,10,3,10,,,,,,,3,8,mixed,normal,normal,mixed,4,,,4,4,3,5,9,7,0.000108518,FAIL
116,,14:30.8,15:10.7,0 days 00:00:39.875286,1,8,,,1,4,6,7,7,7,5,5,5,5,,,,,,,,,,,,,8,4,,,,,,,,,2,,,,,,,,,,8,3,mixed,normal,mixed,mixed,8,,2,1,4,7,8,3,10,0.000136942,FAIL
117,4221.612305,15:10.7,15:44.8,0 days 00:00:34.130393,1,32,128,,2,5,,,,,,,,,,,,,,,,,,,,,,,,,,,,,,,,,,,,,,,,,3,4,normal,,,,,,,,1,10,,,,0.000108547,COMPLETE
118,,15:44.8,16:27.8,0 days 00:00:43.024357,4,32,,,1,4,9,2,9,,,,,,,,6,10,,,,,,,,,,,,,,,,,,,4,2,5,2,4,8,2,,,,4,6,mixed,mixed,normal,mixed,3,2,,7,4,7,3,1,3,0.007115381,FAIL
119,3190.005127,16:27.9,17:02.5,0 days 00:00:34.665310,2,128,128,,2,3,,,,,,,,,,,,,,,,,,,,,,,,,,,,,,,,,,,,,,,,,8,5,normal,,,,,,,,1,3,,,,0.000340046,COMPLETE
120,,17:02.5,17:45.6,0 days 00:00:43.106819,2,32,32,,2,4,,,,,,,,,,,6,7,3,5,2,,,,,,5,2,7,6,2,7,10,9,4,2,,,,,,,,,,,6,6,normal,mixed,mixed,,,5,10,,3,3,7,9,,0.003319983,FAIL
121,326.7610474,17:45.6,18:21.0,0 days 00:00:35.327764,3,32,,,1,4,,,,,,,,,,,8,,,,,,,,,,,,,,,,,,,,,,,,,,,,,,6,4,normal,mixed,,,,1,,,2,7,5,,,0.00810463,COMPLETE
122,1914.106079,18:21.0,18:59.3,0 days 00:00:38.344511,2,32,8,128,3,4,,,,,,,,,,,,,,,,,,,,,6,3,,,,,,,,,,,,,,,,,,,7,5,normal,normal,mixed,,,,2,,3,8,9,10,,0.000522914,COMPLETE
123,,18:59.3,19:48.6,0 days 00:00:49.304348,3,64,8,16,3,5,2,3,7,10,10,2,2,7,,,8,5,6,5,4,7,9,3,,,2,,,,,,,,,,8,10,10,9,7,3,4,8,7,,5,7,mixed,mixed,mixed,mixed,8,8,1,9,4,4,1,9,9,0.008598163,FAIL
124,4928.44043,19:48.6,20:34.1,0 days 00:00:45.519735,4,128,96,,2,3,,,,,,,,,,,3,,,,,,,,,,10,10,10,3,10,3,10,7,,,,,,,,,,,,,5,8,normal,mixed,mixed,normal,,1,8,,4,5,4,6,2,0.000167718,COMPLETE
125,295841.25,20:34.1,21:12.0,0 days 00:00:37.910832,2,96,64,96,3,5,6,4,6,2,5,8,8,4,2,9,,,,,,,,,,,,,,,,,,,,,,,,,,,,,,,4,3,mixed,,,,10,,,,1,1,,,,0.001728505,COMPLETE
126,4976.94043,21:12.1,21:48.9,0 days 00:00:36.862402,3,32,16,,2,2,10,10,7,7,,,,,,,,,,,,,,,,,,,,,,,,,,,,,,,,,,,,,3,3,mixed,normal,,,4,,,,2,2,4,,,0.005564106,COMPLETE
127,617.2139893,21:48.9,22:22.1,0 days 00:00:33.154215,4,16,,,1,4,,,,,,,,,,,,,,,,,,,,,,,,,,,,,,,,,,,,,,,,,6,3,normal,,,,,,,,1,5,,,,0.001812264,COMPLETE
128,,22:22.1,23:01.3,0 days 00:00:39.262111,1,128,,,1,4,10,4,10,5,5,,,,,,5,,,,,,,,,,9,2,,,,,,,,,,,,,,,,,,,3,3,mixed,mixed,mixed,normal,5,1,2,,4,9,2,4,1,0.002232908,FAIL
129,6.74E+17,23:01.3,23:38.0,0 days 00:00:36.664147,1,128,8,,2,2,6,9,6,,,,,,,,,,,,,,,,,,,,,,,,,,,,,,,,,,,,,,7,3,mixed,normal,,,3,,,,2,5,9,,,0.000184316,COMPLETE
130,5.31E+18,23:38.0,24:14.7,0 days 00:00:36.717583,3,32,128,,2,2,,,,,,,,,,,4,,,,,,,,,,3,4,5,,,,,,,,,,,,,,,,,,6,3,normal,mixed,mixed,,,1,3,,3,6,7,9,,0.002025461,COMPLETE
131,342.2804565,24:14.7,24:52.2,0 days 00:00:37.512814,2,96,128,32,3,4,,,,,,,,,,,,,,,,,,,,,,,,,,,,,,,,,,,,,,,,,4,7,normal,normal,,,,,,,2,2,7,,,0.009258202,COMPLETE
132,,24:52.2,25:34.0,0 days 00:00:41.805485,1,32,16,128,3,3,10,3,7,4,6,8,5,2,8,,9,2,6,6,4,2,,,,,,,,,,,,,,,,,,,,,,,,,8,5,mixed,mixed,,,9,6,,,2,5,1,,,0.007040535,FAIL
133,,25:34.1,26:11.5,0 days 00:00:37.498867,4,8,,,1,4,,,,,,,,,,,5,,,,,,,,,,,,,,,,,,,,4,8,5,3,,,,,,,8,3,normal,mixed,normal,mixed,,1,,4,4,5,2,3,3,0.000119744,FAIL
134,494.0976868,26:11.6,26:53.3,0 days 00:00:41.759849,4,64,64,32,3,4,,,,,,,,,,,6,2,3,5,3,5,,,,,,,,,,,,,,,,,,,,,,,,,6,8,normal,mixed,normal,,,6,,,3,4,4,9,,0.00500929,COMPLETE
135,,26:53.3,27:38.1,0 days 00:00:44.767961,2,8,8,,2,3,5,6,10,6,9,9,6,10,3,,,,,,,,,,,,2,9,5,,,,,,,,,,,,,,,,,,8,8,mixed,normal,mixed,normal,9,,3,,4,8,2,1,6,0.002043416,FAIL
136,,27:38.1,28:22.0,0 days 00:00:43.913318,2,8,64,128,3,3,,,,,,,,,,,7,3,7,9,10,,,,,,5,7,5,,,,,,,,,,,,,,,,,,6,8,normal,mixed,mixed,,,5,3,,3,6,2,7,,0.002226722,FAIL
137,2240.650391,28:22.0,29:00.1,0 days 00:00:38.098233,4,16,32,,2,2,2,3,3,9,8,8,,,,,,,,,,,,,,,,,,,,,,,,,,,,,,,,,,,3,4,mixed,normal,,,6,,,,2,5,7,,,0.000196885,COMPLETE
138,363.7784119,29:00.1,29:37.5,0 days 00:00:37.413884,4,128,,,1,2,,,,,,,,,,,,,,,,,,,,,,,,,,,,,,,,,,,,,,,,,4,8,normal,normal,,,,,,,2,7,8,,,0.008633236,COMPLETE
139,,29:37.5,30:19.6,0 days 00:00:42.085565,3,8,16,,2,5,,,,,,,,,,,2,7,8,9,,,,,,,3,3,3,2,2,9,2,,,,,,,,,,,,,,5,5,normal,mixed,mixed,normal,,4,7,,4,8,7,10,2,0.001422764,FAIL
140,4893.129883,30:19.6,31:00.3,0 days 00:00:40.670756,2,128,,,1,3,,,,,,,,,,,,,,,,,,,,,3,4,4,7,2,4,9,3,6,10,,,,,,,,,,,7,6,normal,normal,mixed,,,,10,,3,3,3,1,,0.000302495,COMPLETE
141,1045.110596,31:00.3,31:35.3,0 days 00:00:34.979778,3,8,,,1,5,,,,,,,,,,,,,,,,,,,,,,,,,,,,,,,,,,,,,,,,,7,7,normal,,,,,,,,1,1,,,,0.001293906,COMPLETE
142,,31:35.3,32:16.5,0 days 00:00:41.240799,2,16,32,128,3,3,,,,,,,,,,,8,2,8,7,,,,,,,4,2,3,9,2,4,4,9,,,,,,,,,,,,,3,3,normal,mixed,mixed,normal,,4,8,,4,6,8,9,5,0.000300092,FAIL
143,,32:16.5,33:02.1,0 days 00:00:45.590449,1,96,16,64,3,5,7,5,7,9,5,5,2,10,2,5,,,,,,,,,,,,,,,,,,,,,9,9,4,10,2,6,,,,,7,7,mixed,normal,normal,mixed,10,,,6,4,9,1,6,9,0.000978753,FAIL
144,4949.643555,33:02.1,33:46.0,0 days 00:00:43.865586,4,32,64,32,3,3,,,,,,,,,,,5,3,9,8,3,3,,,,,,,,,,,,,,,9,9,4,7,,,,,,,6,6,normal,mixed,normal,mixed,,6,,4,4,1,9,1,6,0.000107434,COMPLETE
145,,33:46.0,34:28.8,0 days 00:00:42.816507,1,16,16,16,3,4,7,3,9,4,5,,,,,,,,,,,,,,,,3,9,,,,,,,,,,,,,,,,,,,4,8,mixed,normal,mixed,,5,,2,,3,8,5,5,,0.00031485,FAIL
146,1574.734497,34:28.8,35:03.2,0 days 00:00:34.433827,4,96,,,1,5,4,,,,,,,,,,,,,,,,,,,,,,,,,,,,,,,,,,,,,,,,6,5,mixed,,,,1,,,,1,4,,,,0.000488812,COMPLETE
147,,35:03.2,35:41.8,0 days 00:00:38.566936,1,16,,,1,5,7,5,4,6,7,3,5,,,,10,9,5,6,,,,,,,,,,,,,,,,,,,,,,,,,,,8,3,mixed,mixed,,,7,4,,,2,9,3,,,0.000136557,FAIL
148,,35:41.8,36:26.1,0 days 00:00:44.318368,4,16,96,,2,3,5,2,8,4,2,4,2,,,,,,,,,,,,,,6,9,9,6,2,7,2,5,4,,7,5,10,8,,,,,,,4,4,mixed,normal,mixed,mixed,7,,9,4,4,4,9,10,5,0.002564185,FAIL
149,,36:26.1,37:06.0,0 days 00:00:39.925993,3,128,16,16,3,2,4,2,5,9,7,5,5,,,,4,5,8,8,5,,,,,,,,,,,,,,,,,,,,,,,,,,6,3,mixed,mixed,,,7,5,,,2,5,5,,,0.000935081,FAIL
150,,37:06.0,37:45.3,0 days 00:00:39.285577,4,16,16,,2,4,10,8,3,8,8,,,,,,,,,,,,,,,,,,,,,,,,,,,,,,,,,,,,3,7,mixed,normal,,,5,,,,2,4,10,,,0.000133847,FAIL
151,1126.352905,37:45.3,38:21.6,0 days 00:00:36.255830,2,64,64,8,3,4,,,,,,,,,,,,,,,,,,,,,,,,,,,,,,,,,,,,,,,,,4,8,normal,,,,,,,,1,9,,,,0.000626199,COMPLETE
152,529.3503418,38:21.6,39:05.1,0 days 00:00:43.470845,3,64,,,1,2,,,,,,,,,,,8,9,,,,,,,,,8,2,6,,,,,,,,10,,,,,,,,,,4,8,normal,mixed,mixed,mixed,,2,3,1,4,1,10,2,4,0.003389723,COMPLETE
153,237.4688263,39:05.1,39:40.5,0 days 00:00:35.458843,4,96,64,16,3,5,4,,,,,,,,,,,,,,,,,,,,,,,,,,,,,,,,,,,,,,,,4,4,mixed,,,,1,,,,1,7,,,,0.003612934,COMPLETE
154,1975.199097,39:40.5,40:19.2,0 days 00:00:38.647778,1,8,96,,2,3,,,,,,,,,,,,,,,,,,,,,5,7,,,,,,,,,,,,,,,,,,,6,6,normal,normal,mixed,,,,2,,3,7,5,9,,0.00023936,COMPLETE
155,,40:19.2,41:02.5,0 days 00:00:43.349669,2,64,64,,2,4,,,,,,,,,,,6,3,9,9,6,3,2,9,,,,,,,,,,,,,,,,,,,,,,,6,7,normal,mixed,normal,normal,,8,,,4,6,8,5,7,0.006047533,FAIL
156,2868.148193,41:02.5,41:44.6,0 days 00:00:42.055097,3,128,128,,2,5,5,,,,,,,,,,,,,,,,,,,,2,3,9,6,3,5,9,3,3,2,,,,,,,,,,,6,5,mixed,normal,mixed,normal,1,,10,,4,10,1,5,2,0.006364555,COMPLETE
157,2939.026855,41:44.6,42:23.1,0 days 00:00:38.502871,2,96,16,32,3,5,,,,,,,,,,,,,,,,,,,,,,,,,,,,,,,,,,,,,,,,,4,8,normal,normal,,,,,,,2,9,5,,,0.000129009,COMPLETE
158,4976.94043,42:23.1,42:59.9,0 days 00:00:36.842793,1,32,,,1,4,,,,,,,,,,,,,,,,,,,,,,,,,,,,,,,,,,,,,,,,,7,8,normal,normal,,,,,,,2,1,1,,,0.005447038,COMPLETE
159,,42:59.9,43:40.3,0 days 00:00:40.346109,3,16,,,1,2,10,8,5,3,8,10,3,2,8,,,,,,,,,,,,,,,,,,,,,,,,,,,,,,,,5,7,mixed,normal,,,9,,,,2,3,5,,,0.004266983,FAIL
160,,43:40.3,44:21.0,0 days 00:00:40.700301,1,64,,,1,4,4,10,10,10,7,9,,,,,10,5,3,9,4,,,,,,,,,,,,,,,,,,,,,,,,,,3,3,mixed,mixed,normal,,6,5,,,3,9,8,10,,0.000545553,FAIL
161,257.3079224,44:21.0,45:06.1,0 days 00:00:45.074386,2,16,32,8,3,2,,,,,,,,,,,,,,,,,,,,,8,9,5,5,6,3,2,9,,,,,,,,,,,,,8,8,normal,normal,mixed,normal,,,8,,4,7,2,2,10,0.003098226,COMPLETE
162,,45:06.1,45:51.9,0 days 00:00:45.812945,1,64,96,,2,2,,,,,,,,,,,9,8,3,3,7,2,4,,,,10,7,9,3,7,4,2,5,8,,,,,,,,,,,,6,8,normal,mixed,mixed,normal,,7,9,,4,1,1,3,10,0.00041757,FAIL
163,4144.838379,45:51.9,46:30.6,0 days 00:00:38.716830,4,16,128,64,3,2,5,7,8,3,9,3,,,,,,,,,,,,,,,,,,,,,,,,,,,,,,,,,,,6,4,mixed,normal,,,6,,,,2,2,2,,,0.000253961,COMPLETE
164,2735.855713,46:30.6,47:05.8,0 days 00:00:35.202737,1,8,,,1,2,,,,,,,,,,,,,,,,,,,,,,,,,,,,,,,,,,,,,,,,,4,8,normal,,,,,,,,1,4,,,,0.000447862,COMPLETE
165,405.7722473,47:05.8,47:41.8,0 days 00:00:35.940195,2,64,96,96,3,4,5,,,,,,,,,,,,,,,,,,,,,,,,,,,,,,,,,,,,,,,,5,6,mixed,,,,1,,,,1,8,,,,0.003565654,COMPLETE
166,4976.94043,47:41.8,48:19.9,0 days 00:00:38.135059,3,32,96,,2,2,7,6,7,7,5,4,2,2,8,,,,,,,,,,,,,,,,,,,,,,,,,,,,,,,,8,3,mixed,normal,,,9,,,,2,4,2,,,0.000798147,COMPLETE
167,4937.116211,48:19.9,48:59.6,0 days 00:00:39.716529,3,128,64,,2,3,,,,,,,,,,,,,,,,,,,,,3,,,,,,,,,,,,,,,,,,,,8,8,normal,normal,mixed,,,,1,,3,3,2,4,,0.000144763,COMPLETE
168,271.8780518,48:59.6,49:34.8,0 days 00:00:35.227820,2,128,8,64,3,4,8,,,,,,,,,,,,,,,,,,,,,,,,,,,,,,,,,,,,,,,,8,4,mixed,,,,1,,,,1,2,,,,0.008380324,COMPLETE
169,,49:34.8,50:21.2,0 days 00:00:46.384521,4,128,8,128,3,3,4,7,9,10,5,2,,,,,7,2,5,7,10,7,2,4,,,6,10,3,,,,,,,,,,,,,,,,,,4,7,mixed,mixed,mixed,,6,8,3,,3,2,5,7,,0.009529147,FAIL
170,285.443634,50:21.2,51:01.6,0 days 00:00:40.361528,1,96,8,,2,4,,,,,,,,,,,,,,,,,,,,,5,2,4,9,2,10,8,2,10,,,,,,,,,,,,4,5,normal,normal,mixed,,,,9,,3,8,9,3,,0.000636499,COMPLETE
171,4286.083496,51:01.6,51:44.6,0 days 00:00:42.986105,1,32,64,,2,3,,,,,,,,,,,6,6,4,4,,,,,,,,,,,,,,,,,7,9,2,9,5,5,8,4,7,,8,5,normal,mixed,normal,mixed,,4,,9,4,2,8,1,8,0.000722805,COMPLETE
172,,51:44.6,52:25.5,0 days 00:00:40.965720,1,64,128,128,3,3,10,5,7,7,8,3,10,8,,,,,,,,,,,,,,,,,,,,,,,,,,,,,,,,,4,6,mixed,normal,,,8,,,,2,9,3,,,0.00029813,FAIL
173,479.549469,52:25.6,53:02.4,0 days 00:00:36.799248,1,96,16,64,3,3,,,,,,,,,,,9,,,,,,,,,,,,,,,,,,,,,,,,,,,,,,7,3,normal,mixed,normal,,,1,,,3,6,6,8,,0.007410141,COMPLETE
174,242.4742279,53:02.4,53:38.1,0 days 00:00:35.759352,4,8,32,64,3,2,,,,,,,,,,,,,,,,,,,,,,,,,,,,,,,,,,,,,,,,,5,3,normal,normal,,,,,,,2,5,9,,,0.00741049,COMPLETE
175,,53:38.1,54:22.8,0 days 00:00:44.710851,1,128,,,1,4,6,3,10,10,5,2,6,,,,2,,,,,,,,,,6,4,7,9,6,10,7,8,,,,,,,,,,,,,8,7,mixed,mixed,mixed,normal,7,1,8,,4,10,4,9,3,0.000468207,FAIL
176,160.3237,54:22.8,55:01.2,0 days 00:00:38.354802,1,96,96,64,3,2,,,,,,,,,,,10,3,10,7,2,3,,,,,,,,,,,,,,,,,,,,,,,,,4,4,normal,mixed,,,,6,,,2,6,9,,,0.009029501,COMPLETE
177,,55:01.2,55:42.9,0 days 00:00:41.696671,1,32,32,,2,4,3,,,,,,,,,,7,9,8,,,,,,,,5,9,3,2,7,2,4,3,,,,,,,,,,,,,7,5,mixed,mixed,mixed,,1,3,8,,3,6,2,3,,0.000735569,FAIL
178,466.2313538,55:42.9,56:25.1,0 days 00:00:42.218603,1,128,,,1,5,,,,,,,,,,,,,,,,,,,,,4,9,2,6,,,,,,,,,,,,,,,,,6,8,normal,normal,mixed,normal,,,4,,4,4,3,6,8,0.000622604,COMPLETE
179,,56:25.1,57:08.2,0 days 00:00:43.118740,4,64,16,16,3,5,,,,,,,,,,,8,10,7,3,4,5,,,,,,,,,,,,,,,,,,,,,,,,,5,8,normal,mixed,normal,,,6,,,3,1,2,2,,0.005511562,FAIL
180,,57:08.2,57:48.2,0 days 00:00:39.936147,2,32,,,1,5,,,,,,,,,,,3,6,10,,,,,,,,9,5,6,7,9,4,2,,,,,,,,,,,,,,4,4,normal,mixed,mixed,,,3,7,,3,6,4,3,,0.000188205,FAIL
181,,57:48.2,58:34.4,0 days 00:00:46.207794,4,64,32,,2,3,3,6,7,4,2,4,,,,,4,7,7,8,8,7,7,10,,,9,5,6,,,,,,,,,,,,,,,,,,8,8,mixed,mixed,mixed,normal,6,8,3,,4,5,2,1,10,0.001624061,FAIL
182,429.7892151,58:34.4,59:10.8,0 days 00:00:36.414580,2,128,64,,2,4,,,,,,,,,,,,,,,,,,,,,,,,,,,,,,,,,,,,,,,,,7,7,normal,normal,,,,,,,2,4,7,,,0.003466676,COMPLETE
183,,59:10.8,59:53.3,0 days 00:00:42.508163,2,64,,,1,5,,,,,,,,,,,6,7,9,10,3,7,3,5,10,8,9,9,,,,,,,,,,,,,,,,,,,7,6,normal,mixed,mixed,,,10,2,,3,4,1,8,,0.005171917,FAIL
184,,59:53.3,00:34.4,0 days 00:00:41.118480,2,128,,,1,5,2,7,8,10,3,2,4,7,,,4,6,,,,,,,,,,,,,,,,,,,7,,,,,,,,,,7,5,mixed,mixed,normal,mixed,8,2,,1,4,9,5,10,8,0.008981982,FAIL
185,,00:34.4,01:13.6,0 days 00:00:39.200356,1,64,96,16,3,4,8,3,4,6,3,10,5,8,7,3,8,5,,,,,,,,,,,,,,,,,,,,,,,,,,,,,7,3,mixed,mixed,,,10,2,,,2,4,9,,,0.001514509,FAIL
186,,01:13.6,01:58.8,0 days 00:00:45.150611,3,64,16,,2,4,,,,,,,,,,,5,10,7,7,10,10,,,,,4,6,5,7,4,5,6,6,2,,,,,,,,,,,,7,8,normal,mixed,mixed,,,6,9,,3,1,8,4,,0.003876303,FAIL
187,654.3968506,01:58.8,02:37.3,0 days 00:00:38.470677,4,32,,,1,5,,,,,,,,,,,7,3,6,8,8,,,,,,,,,,,,,,,,,,,,,,,,,,5,3,normal,mixed,normal,normal,,5,,,4,8,2,7,10,0.006522542,COMPLETE
188,4640.284668,02:37.3,03:18.4,0 days 00:00:41.160405,4,96,,,1,3,,,,,,,,,,,8,,,,,,,,,,4,9,4,7,8,10,,,,,,,,,,,,,,,8,7,normal,mixed,mixed,,,1,6,,3,3,10,8,,0.000310008,COMPLETE
189,242.1065826,03:18.4,03:55.7,0 days 00:00:37.230066,2,96,64,,2,3,,,,,,,,,,,,,,,,,,,,,,,,,,,,,,,,,,,,,,,,,3,8,normal,normal,,,,,,,2,6,10,,,0.004074316,COMPLETE
190,366.7883606,03:55.7,04:36.0,0 days 00:00:40.372606,4,96,32,16,3,5,,,,,,,,,,,10,4,10,10,5,10,2,10,9,,,,,,,,,,,,,,,,,,,,,,3,4,normal,mixed,,,,9,,,2,10,9,,,0.004345383,COMPLETE
191,336.8053894,04:36.0,05:15.6,0 days 00:00:39.541535,4,96,32,16,3,5,,,,,,,,,,,9,4,4,10,5,9,3,4,,,,,,,,,,,,,,,,,,,,,,,4,5,normal,mixed,,,,8,,,2,10,9,,,0.004227043,COMPLETE
192,457.9183044,05:15.6,05:54.7,0 days 00:00:39.160067,4,96,32,16,3,5,,,,,,,,,,,10,2,5,3,2,8,4,5,7,,,,,,,,,,,,,,,,,,,,,,4,5,normal,mixed,,,,9,,,2,6,9,,,0.009735392,COMPLETE
193,157.5917053,05:54.7,06:33.1,0 days 00:00:38.361286,4,96,32,64,3,5,,,,,,,,,,,9,4,7,9,5,2,5,,,,,,,,,,,,,,,,,,,,,,,,4,4,normal,mixed,,,,7,,,2,10,9,,,0.002396003,COMPLETE
194,185.0125427,06:33.1,07:11.9,0 days 00:00:38.774980,4,96,96,16,3,5,,,,,,,,,,,9,4,7,9,5,2,5,,,,,,,,,,,,,,,,,,,,,,,,4,4,normal,mixed,,,,7,,,2,10,8,,,0.002584298,COMPLETE
195,233.1707611,07:11.9,07:50.8,0 days 00:00:38.913925,4,96,96,16,3,5,,,,,,,,,,,9,4,7,9,5,2,5,,,,,,,,,,,,,,,,,,,,,,,,4,4,normal,mixed,,,,7,,,2,10,8,,,0.002507732,COMPLETE
196,154.7471008,07:50.8,08:29.5,0 days 00:00:38.737291,4,96,96,16,3,5,,,,,,,,,,,9,4,7,9,5,2,5,,,,,,,,,,,,,,,,,,,,,,,,4,4,normal,mixed,,,,7,,,2,10,8,,,0.002416606,COMPLETE
197,177.3093109,08:29.5,09:08.2,0 days 00:00:38.699738,4,96,96,16,3,5,,,,,,,,,,,9,4,7,9,5,2,5,,,,,,,,,,,,,,,,,,,,,,,,4,4,normal,mixed,,,,7,,,2,10,8,,,0.00222725,COMPLETE
198,119.6850739,09:08.2,09:46.9,0 days 00:00:38.692884,4,96,96,16,3,5,,,,,,,,,,,9,3,7,9,5,2,5,,,,,,,,,,,,,,,,,,,,,,,,4,4,normal,mixed,,,,7,,,2,10,8,,,0.002679594,COMPLETE
199,235.1769104,09:46.9,10:25.8,0 days 00:00:38.860640,4,96,96,16,3,5,,,,,,,,,,,9,3,7,9,5,2,5,,,,,,,,,,,,,,,,,,,,,,,,4,4,normal,mixed,,,,7,,,2,10,8,,,0.002178185,COMPLETE
200,114.1145782,10:25.8,11:04.5,0 days 00:00:38.735326,4,96,96,16,3,5,,,,,,,,,,,9,4,7,9,5,3,5,,,,,,,,,,,,,,,,,,,,,,,,4,4,normal,mixed,,,,7,,,2,10,8,,,0.002710925,COMPLETE
201,155.1790466,11:04.5,11:43.2,0 days 00:00:38.681484,4,96,96,16,3,5,,,,,,,,,,,9,4,7,9,5,3,5,,,,,,,,,,,,,,,,,,,,,,,,4,4,normal,mixed,,,,7,,,2,10,8,,,0.002642789,COMPLETE
202,151.0968628,11:43.2,12:21.9,0 days 00:00:38.669785,4,96,96,16,3,5,,,,,,,,,,,10,4,7,9,4,3,5,,,,,,,,,,,,,,,,,,,,,,,,4,4,normal,mixed,,,,7,,,2,10,8,,,0.002647037,COMPLETE
203,231.3904877,12:21.9,13:00.9,0 days 00:00:38.970896,4,96,96,16,3,5,,,,,,,,,,,10,4,7,9,4,3,5,,,,,,,,,,,,,,,,,,,,,,,,4,4,normal,mixed,,,,7,,,2,10,8,,,0.002740923,COMPLETE
204,155.8726501,13:00.9,13:39.9,0 days 00:00:39.015526,4,96,96,16,3,5,,,,,,,,,,,10,4,7,9,5,3,5,,,,,,,,,,,,,,,,,,,,,,,,4,4,normal,mixed,,,,7,,,2,10,8,,,0.002566249,COMPLETE
205,309.4321289,13:39.9,14:18.5,0 days 00:00:38.619064,4,96,96,16,3,5,,,,,,,,,,,10,4,7,9,4,3,5,,,,,,,,,,,,,,,,,,,,,,,,4,4,normal,mixed,,,,7,,,2,10,8,,,0.002264827,COMPLETE
206,311.2678833,14:18.5,14:57.1,0 days 00:00:38.573366,4,96,96,16,3,5,,,,,,,,,,,9,5,8,9,6,2,,,,,,,,,,,,,,,,,,,,,,,,,4,4,normal,mixed,,,,6,,,2,10,8,,,0.00277593,COMPLETE
207,115.9913177,14:57.1,15:36.2,0 days 00:00:39.083201,4,96,96,16,3,5,,,,,,,,,,,10,4,7,10,4,3,6,,,,,,,,,,,,,,,,,,,,,,,,4,4,normal,mixed,,,,7,,,2,10,8,,,0.003097398,COMPLETE
208,454.7325134,15:36.2,16:15.1,0 days 00:00:38.938575,4,96,96,16,3,5,,,,,,,,,,,10,4,7,10,4,3,6,,,,,,,,,,,,,,,,,,,,,,,,4,4,normal,mixed,,,,7,,,2,10,8,,,0.003101498,COMPLETE
209,169.4959106,16:15.1,16:54.2,0 days 00:00:39.124048,4,96,96,16,3,5,,,,,,,,,,,10,5,7,9,5,3,5,,,,,,,,,,,,,,,,,,,,,,,,4,4,normal,mixed,,,,7,,,2,9,7,,,0.00233941,COMPLETE
210,369.8700562,16:54.2,17:33.6,0 days 00:00:39.386640,4,96,96,16,3,5,,,,,,,,,,,10,5,8,10,6,3,5,,,,,,,,,,,,,,,,,,,,,,,,4,4,normal,mixed,,,,7,,,2,9,7,,,0.001616135,COMPLETE
211,221.5086975,17:33.6,18:12.6,0 days 00:00:38.922876,4,96,96,16,3,5,,,,,,,,,,,9,4,7,9,5,2,6,,,,,,,,,,,,,,,,,,,,,,,,4,4,normal,mixed,,,,7,,,2,9,8,,,0.002359391,COMPLETE
212,266.9081421,18:12.6,18:51.6,0 days 00:00:39.011762,4,96,96,16,3,5,,,,,,,,,,,10,4,7,9,5,3,5,,,,,,,,,,,,,,,,,,,,,,,,4,4,normal,mixed,,,,7,,,2,10,8,,,0.002604235,COMPLETE
213,159.3580017,18:51.6,19:30.4,0 days 00:00:38.814770,4,96,96,16,3,5,,,,,,,,,,,9,5,7,9,4,2,5,,,,,,,,,,,,,,,,,,,,,,,,4,4,normal,mixed,,,,7,,,2,10,7,,,0.001908995,COMPLETE
214,193.66362,19:30.4,20:09.1,0 days 00:00:38.691905,4,96,96,16,3,5,,,,,,,,,,,10,3,7,9,4,3,,,,,,,,,,,,,,,,,,,,,,,,,4,4,normal,mixed,,,,6,,,2,10,7,,,0.001961951,COMPLETE
215,227.3727264,20:09.1,20:48.7,0 days 00:00:39.565728,4,96,96,16,3,5,,,,,,,,,,,9,5,7,9,4,4,4,9,,,,,,,,,,,,,,,,,,,,,,,4,4,normal,mixed,,,,8,,,2,10,7,,,0.003170574,COMPLETE
216,258.3410339,20:48.7,21:27.7,0 days 00:00:39.088733,4,96,96,16,3,5,,,,,,,,,,,10,3,8,10,5,2,6,,,,,,,,,,,,,,,,,,,,,,,,4,4,normal,mixed,,,,7,,,2,10,8,,,0.002071912,COMPLETE
217,471.6766357,21:27.7,22:06.4,0 days 00:00:38.641745,4,96,96,16,3,5,,,,,,,,,,,9,4,7,8,4,4,,,,,,,,,,,,,,,,,,,,,,,,,4,4,normal,mixed,,,,6,,,2,9,8,,,0.002366313,COMPLETE
218,152.9091034,22:06.4,22:45.6,0 days 00:00:39.178304,4,96,96,16,3,5,,,,,,,,,,,10,5,8,8,5,3,4,,,,,,,,,,,,,,,,,,,,,,,,4,4,normal,mixed,,,,7,,,2,10,9,,,0.004563894,COMPLETE
219,169.185318,22:45.6,23:24.7,0 days 00:00:39.139718,4,96,96,16,3,5,,,,,,,,,,,10,5,8,8,5,3,4,,,,,,,,,,,,,,,,,,,,,,,,4,4,normal,mixed,,,,7,,,2,10,9,,,0.001847058,COMPLETE
220,211.7931824,23:24.7,24:04.3,0 days 00:00:39.630516,4,96,96,16,3,5,,,,,,,,,,,10,5,8,7,6,3,4,3,,,,,,,,,,,,,,,,,,,,,,,4,4,normal,mixed,,,,8,,,2,9,9,,,0.004645906,COMPLETE
221,280.3454285,24:04.3,24:43.3,0 days 00:00:38.927726,4,96,96,16,3,5,,,,,,,,,,,10,5,7,7,5,3,5,,,,,,,,,,,,,,,,,,,,,,,,4,4,normal,mixed,,,,7,,,2,10,9,,,0.001830386,COMPLETE
222,248.5072021,24:43.3,25:22.0,0 days 00:00:38.673583,4,96,96,16,3,5,,,,,,,,,,,9,5,9,8,5,2,4,,,,,,,,,,,,,,,,,,,,,,,,4,4,normal,mixed,,,,7,,,2,10,9,,,0.00147435,COMPLETE
223,173.3675995,25:22.0,26:02.0,0 days 00:00:40.014066,4,96,96,128,3,5,,,,,,,,,,,10,4,7,9,5,3,5,,,,,,,,,,,,,,,,,,,,,,,,4,4,normal,mixed,,,,7,,,2,10,7,,,0.002829906,COMPLETE
224,279.972168,26:02.0,26:41.6,0 days 00:00:39.658933,4,96,96,128,3,5,,,,,,,,,,,10,5,8,7,6,3,,,,,,,,,,,,,,,,,,,,,,,,,4,4,normal,mixed,,,,6,,,2,9,7,,,0.002826527,COMPLETE
225,237.6037598,26:41.6,27:22.0,0 days 00:00:40.347405,4,96,96,128,3,5,,,,,,,,,,,10,4,6,9,4,4,5,7,,,,,,,,,,,,,,,,,,,,,,,4,4,normal,mixed,,,,8,,,2,10,7,,,0.003230051,COMPLETE
226,163.1780701,27:22.0,28:01.9,0 days 00:00:39.917647,4,96,96,128,3,5,,,,,,,,,,,10,6,10,8,5,3,4,,,,,,,,,,,,,,,,,,,,,,,,4,4,normal,mixed,,,,7,,,2,10,9,,,0.00380115,COMPLETE
227,133.1927948,28:01.9,28:41.4,0 days 00:00:39.480310,4,96,96,64,3,5,,,,,,,,,,,10,6,10,8,6,3,4,,,,,,,,,,,,,,,,,,,,,,,,4,4,normal,mixed,,,,7,,,2,10,9,,,0.003782185,COMPLETE
228,194.0765076,28:41.4,29:20.5,0 days 00:00:39.107661,4,96,96,64,3,5,,,,,,,,,,,8,6,10,8,6,3,,,,,,,,,,,,,,,,,,,,,,,,,4,4,normal,mixed,,,,6,,,2,10,9,,,0.003644512,COMPLETE
229,121.7666473,29:20.5,29:59.8,0 days 00:00:39.338583,4,96,96,64,3,5,,,,,,,,,,,9,6,10,8,7,4,4,,,,,,,,,,,,,,,,,,,,,,,,4,4,normal,mixed,,,,7,,,2,10,9,,,0.004856721,COMPLETE
230,199.8802185,29:59.8,30:39.7,0 days 00:00:39.828028,4,96,96,64,3,5,,,,,,,,,,,9,7,10,8,8,4,4,5,,,,,,,,,,,,,,,,,,,,,,,4,4,normal,mixed,,,,8,,,2,10,9,,,0.00381225,COMPLETE
231,183.3487854,30:39.7,31:18.9,0 days 00:00:39.227209,4,96,96,64,3,5,,,,,,,,,,,9,6,10,8,2,2,4,,,,,,,,,,,,,,,,,,,,,,,,4,4,normal,mixed,,,,7,,,2,10,9,,,0.00470228,COMPLETE
232,503.4903564,31:18.9,31:58.6,0 days 00:00:39.681188,4,96,96,64,3,5,,,,,,,,,,,10,6,10,7,7,3,4,,,,,,,,,,,,,,,,,,,,,,,,4,4,normal,mixed,,,,7,,,2,10,9,,,0.003011046,COMPLETE
233,174.5634766,31:58.6,32:38.1,0 days 00:00:39.488102,4,96,96,64,3,5,,,,,,,,,,,10,6,9,8,7,4,,,,,,,,,,,,,,,,,,,,,,,,,4,4,normal,mixed,,,,6,,,2,10,9,,,0.00261971,COMPLETE
234,156.6806488,32:38.1,33:17.8,0 days 00:00:39.725767,4,96,96,64,3,5,,,,,,,,,,,8,7,10,8,7,3,6,,,,,,,,,,,,,,,,,,,,,,,,4,4,normal,mixed,,,,7,,,2,10,10,,,0.003305384,COMPLETE
235,294.0758667,33:17.8,33:58.3,0 days 00:00:40.507949,4,96,96,64,3,5,,,,,,,,,,,8,7,10,8,7,3,6,9,,,,,,,,,,,,,,,,,,,,,,,4,4,normal,mixed,,,,8,,,2,10,10,,,0.003312375,COMPLETE
