number,value,datetime_start,datetime_complete,duration,params_gat_heads,params_gat_hidden_0,params_gat_hidden_1,params_gat_hidden_2,params_gat_layers,params_gat_out,params_kan_arity_0_0,params_kan_arity_0_1,params_kan_arity_0_2,params_kan_arity_0_3,params_kan_arity_0_4,params_kan_arity_0_5,params_kan_arity_0_6,params_kan_arity_0_7,params_kan_arity_0_8,params_kan_arity_0_9,params_kan_arity_1_0,params_kan_arity_1_1,params_kan_arity_1_2,params_kan_arity_1_3,params_kan_arity_1_4,params_kan_arity_1_5,params_kan_arity_1_6,params_kan_arity_1_7,params_kan_arity_1_8,params_kan_arity_1_9,params_kan_arity_2_0,params_kan_arity_2_1,params_kan_arity_2_2,params_kan_arity_2_3,params_kan_arity_2_4,params_kan_arity_2_5,params_kan_arity_2_6,params_kan_arity_2_7,params_kan_arity_2_8,params_kan_arity_2_9,params_kan_arity_3_0,params_kan_arity_3_1,params_kan_arity_3_2,params_kan_arity_3_3,params_kan_arity_3_4,params_kan_arity_3_5,params_kan_arity_3_6,params_kan_arity_3_7,params_kan_arity_3_8,params_kan_arity_3_9,params_kan_grid,params_kan_k,params_kan_layer_type_0,params_kan_layer_type_1,params_kan_layer_type_2,params_kan_layer_type_3,params_kan_mult_nodes_0,params_kan_mult_nodes_1,params_kan_mult_nodes_2,params_kan_mult_nodes_3,params_kan_n_layers,params_kan_neurons_0,params_kan_neurons_1,params_kan_neurons_2,params_kan_neurons_3,params_lr,state
0,2174.740723,59:29.1,00:04.9,0 days 00:00:35.732053,4,32,8,8,3,3,,,,,,,,,,,,,,,,,,,,,,,,,,,,,,,,,,,,,,,,,5,8,normal,,,,,,,,1,9,,,,0.000453248,COMPLETE
1,697.6069336,00:04.9,00:39.2,0 days 00:00:34.345188,4,8,,,1,3,,,,,,,,,,,,,,,,,,,,,,,,,,,,,,,,,,,,,,,,,3,8,normal,,,,,,,,1,9,,,,0.00345191,COMPLETE
2,,00:39.2,01:23.7,0 days 00:00:44.448205,1,96,32,128,3,3,8,8,2,,,,,,,,10,4,5,10,8,8,6,5,,,2,7,8,7,2,7,,,,,,,,,,,,,,,5,8,mixed,mixed,mixed,,3,8,6,,3,2,6,3,,0.000130355,FAIL
3,,01:23.7,02:01.1,0 days 00:00:37.437042,1,128,128,64,3,3,10,7,,,,,,,,,5,4,2,,,,,,,,,,,,,,,,,,,,,,,,,,,,6,4,mixed,mixed,,,2,3,,,2,10,5,,,0.000146677,FAIL
4,,02:01.1,02:45.2,0 days 00:00:44.086685,1,16,96,16,3,3,,,,,,,,,,,,,,,,,,,,,7,10,2,9,5,,,,,,9,6,2,3,10,,,,,,6,8,normal,normal,mixed,mixed,,,5,5,4,2,6,10,3,0.000624589,FAIL
5,1983.064575,02:45.2,03:22.5,0 days 00:00:37.259372,1,64,128,96,3,2,,,,,,,,,,,,,,,,,,,,,,,,,,,,,,,,,,,,,,,,,8,6,normal,normal,normal,,,,,,3,4,1,7,,0.00402744,COMPLETE
6,433.8613281,03:22.5,04:01.5,0 days 00:00:39.054500,1,32,16,32,3,2,,,,,,,,,,,2,5,2,2,10,6,8,2,3,4,,,,,,,,,,,,,,,,,,,,,6,3,normal,mixed,normal,,,10,,,3,9,1,8,,0.000478417,COMPLETE
7,,04:01.5,04:42.7,0 days 00:00:41.183915,2,16,128,32,3,5,3,7,7,3,8,3,4,,,,8,6,2,5,8,,,,,,,,,,,,,,,,,,,,,,,,,,3,6,mixed,mixed,,,7,5,,,2,5,8,,,0.000321016,FAIL
8,185.7624207,04:42.7,05:24.6,0 days 00:00:41.859538,2,32,96,,2,5,,,,,,,,,,,,,,,,,,,,,2,,,,,,,,,,9,9,7,,,,,,,,7,7,normal,normal,mixed,mixed,,,1,3,4,10,6,9,7,0.003832389,COMPLETE
9,651.9295654,05:24.6,05:59.1,0 days 00:00:34.507402,3,8,8,,2,5,,,,,,,,,,,,,,,,,,,,,,,,,,,,,,,,,,,,,,,,,7,5,normal,,,,,,,,1,9,,,,0.001938438,COMPLETE
10,,05:59.1,06:43.2,0 days 00:00:44.164527,1,128,32,32,3,5,,,,,,,,,,,3,10,4,3,3,10,10,6,2,2,,,,,,,,,,,4,6,,,,,,,,,5,6,normal,mixed,normal,mixed,,10,,2,4,8,1,3,3,0.005331018,FAIL
11,208.0812836,06:43.3,07:23.9,0 days 00:00:40.664508,4,128,,,1,4,,,,,,,,,,,6,2,5,9,5,10,10,5,5,5,,,,,,,,,,,,,,,,,,,,,7,5,normal,mixed,normal,,,10,,,3,10,7,5,,0.002475407,COMPLETE
12,,07:23.9,08:04.2,0 days 00:00:40.241311,2,32,16,,2,5,2,8,10,6,8,10,9,2,5,,,,,,,,,,,,,,,,,,,,,,,,,,,,,,,,4,6,mixed,normal,,,9,,,,2,1,7,,,0.004071756,FAIL
13,,08:04.2,08:48.6,0 days 00:00:44.388545,1,16,,,1,5,4,10,8,,,,,,,,6,4,10,4,7,10,6,,,,2,4,7,5,7,2,2,7,5,6,,,,,,,,,,,4,5,mixed,mixed,mixed,normal,3,7,10,,4,7,1,9,8,0.000129428,FAIL
14,,08:48.6,09:32.8,0 days 00:00:44.290748,4,32,32,64,3,5,,,,,,,,,,,10,5,4,10,9,7,,,,,10,8,10,6,,,,,,,,,,,,,,,,,3,8,normal,mixed,mixed,normal,,6,4,,4,3,7,2,10,0.008293314,FAIL
15,,09:32.9,10:10.1,0 days 00:00:37.226202,4,128,,,1,4,8,3,10,,,,,,,,2,8,,,,,,,,,5,4,8,,,,,,,,,,,,,,,,,,6,4,mixed,mixed,mixed,,3,2,3,,3,10,8,4,,0.000850789,FAIL
16,,10:10.1,10:51.1,0 days 00:00:41.005371,2,128,64,,2,5,2,10,4,8,5,4,4,6,,,2,5,5,6,9,6,9,4,,,,,,,,,,,,,,,,,,,,,,,6,5,mixed,mixed,normal,,8,8,,,3,10,6,5,,0.001650104,FAIL
17,,10:51.1,11:29.6,0 days 00:00:38.461857,4,64,128,128,3,3,8,9,8,,,,,,,,7,4,7,,,,,,,,,,,,,,,,,,,,,,,,,,,,4,3,mixed,mixed,,,3,3,,,2,7,10,,,0.000360124,FAIL
18,332.5558472,11:29.6,12:05.8,0 days 00:00:36.204382,3,64,,,1,4,,,,,,,,,,,,,,,,,,,,,,,,,,,,,,,,,,,,,,,,,6,6,normal,normal,normal,,,,,,3,10,3,10,,0.002559479,COMPLETE
19,4978.783203,12:05.8,12:40.4,0 days 00:00:34.601280,1,32,8,,2,5,,,,,,,,,,,,,,,,,,,,,,,,,,,,,,,,,,,,,,,,,6,3,normal,normal,normal,,,,,,3,8,4,1,,0.000171452,COMPLETE
20,,12:40.4,13:20.8,0 days 00:00:40.423334,4,96,128,8,3,2,9,9,10,10,4,6,6,,,,,,,,,,,,,,,,,,,,,,,,,,,,,,,,,,8,8,mixed,normal,,,7,,,,2,1,5,,,0.000863907,FAIL
21,,13:20.8,14:03.0,0 days 00:00:42.178395,1,8,96,,2,2,,,,,,,,,,,,,,,,,,,,,2,4,6,6,3,10,4,9,,,10,9,9,2,9,,,,,,3,5,normal,normal,mixed,mixed,,,8,5,4,10,1,9,9,0.006478991,FAIL
22,1014.924011,14:03.0,14:38.9,0 days 00:00:35.971141,2,32,,,1,2,,,,,,,,,,,10,3,5,8,3,6,8,,,,,,,,,,,,,,,,,,,,,,,,5,3,normal,mixed,,,,7,,,2,3,4,,,0.000443559,COMPLETE
23,,14:38.9,15:21.2,0 days 00:00:42.278966,1,32,,,1,2,5,4,6,,,,,,,,,,,,,,,,,,,,,,,,,,,,3,10,8,6,10,6,4,4,7,4,6,6,mixed,normal,normal,mixed,3,,,10,4,8,6,2,10,0.002972055,FAIL
24,1097.376465,15:21.2,15:55.4,0 days 00:00:34.136558,3,16,,,1,2,,,,,,,,,,,,,,,,,,,,,,,,,,,,,,,,,,,,,,,,,5,8,normal,,,,,,,,1,5,,,,0.000578366,COMPLETE
25,325.2989502,15:55.4,16:32.4,0 days 00:00:37.019571,2,128,,,1,3,,,,,,,,,,,4,10,6,8,6,2,6,7,3,9,,,,,,,,,,,,,,,,,,,,,6,3,normal,mixed,,,,10,,,2,2,8,,,0.003879889,COMPLETE
26,2556.484131,16:32.4,17:06.1,0 days 00:00:33.686329,4,8,,,1,3,,,,,,,,,,,,,,,,,,,,,,,,,,,,,,,,,,,,,,,,,5,6,normal,,,,,,,,1,7,,,,0.000107138,COMPLETE
27,,17:06.1,17:48.0,0 days 00:00:41.905860,2,64,,,1,4,10,5,3,10,10,3,,,,,3,2,4,8,3,7,9,5,,,3,7,3,4,2,10,,,,,,,,,,,,,,,5,3,mixed,mixed,mixed,normal,6,8,6,,4,3,7,3,2,0.000542806,FAIL
28,1875.296265,17:48.0,18:23.1,0 days 00:00:35.133660,2,96,16,96,3,5,,,,,,,,,,,,,,,,,,,,,,,,,,,,,,,,,,,,,,,,,8,3,normal,normal,normal,,,,,,3,1,4,8,,0.00637022,COMPLETE
29,359.1979065,18:23.1,18:57.0,0 days 00:00:33.847797,2,16,8,8,3,2,,,,,,,,,,,,,,,,,,,,,,,,,,,,,,,,,,,,,,,,,5,3,normal,,,,,,,,1,9,,,,0.00658124,COMPLETE
30,,18:57.0,19:37.8,0 days 00:00:40.861811,1,128,,,1,2,,,,,,,,,,,9,7,7,10,4,6,7,8,7,,,,,,,,,,,,10,7,5,4,2,,,,,,3,3,normal,mixed,normal,mixed,,9,,5,4,7,5,10,2,0.000473797,FAIL
31,,19:37.8,20:16.0,0 days 00:00:38.137468,4,16,128,,2,2,8,2,10,9,5,3,9,5,,,,,,,,,,,,,,,,,,,,,,,,,,,,,,,,,5,6,mixed,,,,8,,,,1,8,,,,0.004845005,FAIL
32,4449.696777,20:16.0,20:52.3,0 days 00:00:36.291835,4,96,,,1,3,,,,,,,,,,,,,,,,,,,,,,,,,,,,,,,,,,,,,,,,,7,8,normal,normal,,,,,,,2,5,1,,,0.000318281,COMPLETE
33,,20:52.3,21:28.9,0 days 00:00:36.662482,2,8,,,1,4,8,3,4,7,2,3,4,2,6,10,,,,,,,,,,,,,,,,,,,,,,,,,,,,,,,6,5,mixed,,,,10,,,,1,10,,,,0.000590947,FAIL
34,2501096,21:28.9,22:02.2,0 days 00:00:33.232278,4,64,,,1,2,5,,,,,,,,,,,,,,,,,,,,,,,,,,,,,,,,,,,,,,,,7,3,mixed,,,,1,,,,1,10,,,,0.000215577,COMPLETE
35,,22:02.2,22:46.4,0 days 00:00:44.245694,3,16,64,16,3,4,5,8,4,7,10,10,4,,,,5,3,7,2,9,8,7,3,8,,,,,,,,,,,,4,7,8,,,,,,,,8,6,mixed,mixed,normal,mixed,7,9,,3,4,10,7,8,6,0.003349457,FAIL
36,572.5258789,22:46.4,23:20.3,0 days 00:00:33.844179,3,96,,,1,4,6,9,3,2,3,,,,,,,,,,,,,,,,,,,,,,,,,,,,,,,,,,,,8,3,mixed,,,,5,,,,1,7,,,,0.001261305,COMPLETE
37,801.3681641,23:20.3,23:54.3,0 days 00:00:34.008614,1,16,,,1,2,,,,,,,,,,,,,,,,,,,,,,,,,,,,,,,,,,,,,,,,,5,8,normal,,,,,,,,1,5,,,,0.001695454,COMPLETE
38,,23:54.3,24:30.9,0 days 00:00:36.606153,2,8,32,,2,2,6,,,,,,,,,,,,,,,,,,,,,,,,,,,,,,,,,,,,,,,,5,8,mixed,normal,,,1,,,,2,1,7,,,0.000183638,FAIL
39,3869.480225,24:30.9,25:05.0,0 days 00:00:34.139037,1,8,64,96,3,4,,,,,,,,,,,,,,,,,,,,,,,,,,,,,,,,,,,,,,,,,8,5,normal,,,,,,,,1,10,,,,0.000332317,COMPLETE
40,,25:05.0,25:44.7,0 days 00:00:39.617281,2,64,8,8,3,5,,,,,,,,,,,5,9,10,9,7,6,,,,,,,,,,,,,,,,,,,,,,,,,8,8,normal,mixed,,,,6,,,2,2,2,,,0.000215478,FAIL
41,658.71875,25:44.7,26:18.2,0 days 00:00:33.552910,3,32,,,1,5,,,,,,,,,,,,,,,,,,,,,,,,,,,,,,,,,,,,,,,,,8,6,normal,,,,,,,,1,6,,,,0.003611582,COMPLETE
42,3851.478516,26:18.2,26:52.7,0 days 00:00:34.462818,1,8,16,,2,3,,,,,,,,,,,5,7,4,,,,,,,,,,,,,,,,,,,,,,,,,,,,8,3,normal,mixed,,,,3,,,2,1,10,,,0.000387075,COMPLETE
43,3413.121338,26:52.7,27:32.2,0 days 00:00:39.472963,2,128,64,8,3,3,,,,,,,,,,,8,9,8,5,9,4,10,8,4,,,,,,,,,,,,,,,,,,,,,,8,5,normal,mixed,,,,9,,,2,6,9,,,0.000142167,COMPLETE
44,371.915741,27:32.2,28:10.4,0 days 00:00:38.253433,4,128,,,1,2,,,,,,,,,,,9,2,6,8,6,5,10,,,,,,,,,,,,,,,,,,,,,,,,7,5,normal,mixed,normal,,,7,,,3,6,9,6,,0.000939174,COMPLETE
45,178.9957123,28:10.4,28:47.2,0 days 00:00:36.833554,4,96,16,32,3,5,,,,,,,,,,,10,3,,,,,,,,,,,,,,,,,,,,,,,,,,,,,5,6,normal,mixed,,,,2,,,2,5,4,,,0.005759053,COMPLETE
46,,28:47.2,29:27.4,0 days 00:00:40.186777,2,8,8,64,3,2,,,,,,,,,,,7,9,6,6,9,5,9,8,,,5,6,,,,,,,,,,,,,,,,,,,6,3,normal,mixed,mixed,normal,,8,2,,4,10,9,5,9,0.000177677,FAIL
47,,29:27.4,30:09.9,0 days 00:00:42.473627,2,32,,,1,4,3,4,4,8,7,10,2,,,,2,,,,,,,,,,2,7,9,,,,,,,,4,6,5,4,2,9,,,,,6,6,mixed,mixed,mixed,mixed,7,1,3,6,4,6,8,8,10,0.000725865,FAIL
48,2535.244873,30:09.9,30:47.9,0 days 00:00:38.006569,4,32,8,96,3,5,,,,,,,,,,,4,10,9,6,10,6,,,,,,,,,,,,,,,,,,,,,,,,,7,5,normal,mixed,,,,6,,,2,4,5,,,0.000429483,COMPLETE
49,972.5742798,30:47.9,31:22.0,0 days 00:00:34.028737,2,128,64,16,3,2,,,,,,,,,,,,,,,,,,,,,,,,,,,,,,,,,,,,,,,,,4,4,normal,,,,,,,,1,8,,,,0.000938106,COMPLETE
50,,31:22.0,32:05.3,0 days 00:00:43.370162,4,64,16,,2,3,,,,,,,,,,,6,9,7,,,,,,,,8,10,9,3,3,4,4,7,9,8,,,,,,,,,,,6,8,normal,mixed,mixed,,,3,10,,3,8,8,1,,0.001454027,FAIL
51,302.1439819,32:05.3,32:40.4,0 days 00:00:35.057581,2,128,,,1,4,,,,,,,,,,,,,,,,,,,,,,,,,,,,,,,,,,,,,,,,,6,5,normal,normal,normal,,,,,,3,9,4,5,,0.007008066,COMPLETE
52,4582.217285,32:40.4,33:16.8,0 days 00:00:36.370141,2,32,,,1,4,,,,,,,,,,,8,10,7,6,,,,,,,,,,,,,,,,,,,,,,,,,,,7,4,normal,mixed,normal,,,4,,,3,6,6,1,,0.000736168,COMPLETE
53,1294106.75,33:16.8,33:52.3,0 days 00:00:35.564381,3,8,,,1,2,6,9,10,9,,,,,,,,,,,,,,,,,,,,,,,,,,,,,,,,,,,,,5,4,mixed,normal,,,4,,,,2,9,8,,,0.000280459,COMPLETE
54,4912.148438,33:52.3,34:26.5,0 days 00:00:34.163880,1,32,64,,2,4,,,,,,,,,,,,,,,,,,,,,,,,,,,,,,,,,,,,,,,,,3,4,normal,normal,,,,,,,2,1,5,,,0.000295258,COMPLETE
55,5131.12793,34:26.5,35:01.3,0 days 00:00:34.798607,1,8,96,96,3,3,3,,,,,,,,,,,,,,,,,,,,,,,,,,,,,,,,,,,,,,,,4,4,mixed,normal,,,1,,,,2,5,5,,,0.000139281,COMPLETE
56,,35:01.3,35:44.8,0 days 00:00:43.521912,4,96,128,96,3,4,7,6,7,10,,,,,,,,,,,,,,,,,9,5,2,9,4,2,3,4,6,,,,,,,,,,,,5,7,mixed,normal,mixed,,4,,9,,3,7,2,3,,0.000236206,FAIL
57,598.6851807,35:44.8,36:20.0,0 days 00:00:35.198219,2,8,,,1,5,,,,,,,,,,,,,,,,,,,,,,,,,,,,,,,,,,,,,,,,,5,7,normal,normal,,,,,,,2,10,7,,,0.002344287,COMPLETE
58,,36:20.0,37:02.6,0 days 00:00:42.542421,3,32,32,32,3,3,4,7,3,6,5,7,10,4,9,,5,3,7,7,3,8,5,10,,,,,,,,,,,,,,,,,,,,,,,4,7,mixed,mixed,,,9,8,,,2,7,2,,,0.000119462,FAIL
59,434.3604431,37:02.6,37:36.5,0 days 00:00:33.935612,2,96,,,1,3,3,,,,,,,,,,,,,,,,,,,,,,,,,,,,,,,,,,,,,,,,5,4,mixed,normal,,,1,,,,2,5,3,,,0.00710002,COMPLETE
60,,37:36.5,38:18.6,0 days 00:00:42.074801,3,96,16,16,3,4,6,8,7,5,6,4,10,2,7,,2,,,,,,,,,,2,6,3,2,10,2,10,2,3,6,,,,,,,,,,,5,4,mixed,mixed,mixed,,9,1,10,,3,5,8,5,,0.000190067,FAIL
61,,38:18.6,38:57.4,0 days 00:00:38.856772,3,16,96,,2,2,2,4,9,2,7,6,,,,,6,5,10,7,,,,,,,,,,,,,,,,,,,,,,,,,,,7,6,mixed,mixed,,,6,4,,,2,3,9,,,0.000415187,FAIL
62,314.660553,38:57.4,39:40.5,0 days 00:00:43.033995,3,16,16,128,3,2,,,,,,,,,,,2,7,8,2,8,5,8,2,,,,,,,,,,,,,,,,,,,,,,,5,8,normal,mixed,normal,normal,,8,,,4,1,5,2,4,0.006506528,COMPLETE
63,,39:40.5,40:19.1,0 days 00:00:38.639612,4,32,96,64,3,5,3,2,10,10,8,9,2,,,,6,,,,,,,,,,,,,,,,,,,,,,,,,,,,,,4,5,mixed,mixed,,,7,1,,,2,1,6,,,0.000280432,FAIL
64,,40:19.1,40:57.2,0 days 00:00:38.079404,1,64,8,,2,4,7,4,10,5,9,7,6,9,10,9,,,,,,,,,,,,,,,,,,,,,,,,,,,,,,,3,5,mixed,,,,10,,,,1,8,,,,0.000815691,FAIL
65,,40:57.2,41:38.8,0 days 00:00:41.616822,2,16,32,,2,5,,,,,,,,,,,7,,,,,,,,,,10,2,10,8,6,4,10,2,,,,,,,,,,,,,4,8,normal,mixed,mixed,,,1,8,,3,4,2,1,,0.003011095,FAIL
66,919.4593506,41:38.8,42:13.5,0 days 00:00:34.703138,4,96,64,16,3,5,,,,,,,,,,,,,,,,,,,,,,,,,,,,,,,,,,,,,,,,,5,5,normal,,,,,,,,1,3,,,,0.001061259,COMPLETE
67,,42:13.5,42:57.5,0 days 00:00:43.961512,2,32,8,,2,3,,,,,,,,,,,10,9,7,8,8,10,2,6,5,,2,2,10,4,6,5,10,2,7,,,,,,,,,,,,6,8,normal,mixed,mixed,,,9,9,,3,9,10,3,,0.003392916,FAIL
68,611.2297974,42:57.5,43:33.8,0 days 00:00:36.275963,1,64,128,32,3,2,,,,,,,,,,,,,,,,,,,,,,,,,,,,,,,,,,,,,,,,,7,7,normal,normal,,,,,,,2,6,8,,,0.002915411,COMPLETE
69,434.1033325,43:33.8,44:10.9,0 days 00:00:37.088517,1,128,96,32,3,5,,,,,,,,,,,2,8,,,,,,,,,,,,,,,,,,,7,2,,,,,,,,,6,3,normal,mixed,normal,mixed,,2,,2,4,1,8,5,9,0.001881177,COMPLETE
70,4976.94043,44:10.9,44:43.4,0 days 00:00:32.576776,2,8,,,1,3,,,,,,,,,,,,,,,,,,,,,,,,,,,,,,,,,,,,,,,,,7,3,normal,,,,,,,,1,1,,,,0.000513351,COMPLETE
71,482.7716064,44:43.4,45:24.0,0 days 00:00:40.599544,4,64,8,,2,3,,,,,,,,,,,,,,,,,,,,,10,6,5,10,3,2,6,7,7,,8,5,8,8,,,,,,,8,3,normal,normal,mixed,mixed,,,9,4,4,5,8,6,4,0.001243479,COMPLETE
72,,45:24.1,46:05.1,0 days 00:00:41.055942,3,64,8,,2,4,,,,,,,,,,,,,,,,,,,,,3,6,6,2,,,,,,,8,2,5,2,,,,,,,7,7,normal,normal,mixed,mixed,,,4,4,4,8,3,8,3,0.001568528,FAIL
73,,46:05.1,46:42.0,0 days 00:00:36.846489,4,8,8,96,3,4,,,,,,,,,,,9,2,9,,,,,,,,,,,,,,,,,,,,,,,,,,,,5,5,normal,mixed,,,,3,,,2,2,7,,,0.006011041,FAIL
74,4594.54834,46:42.0,47:21.9,0 days 00:00:39.982539,4,32,8,64,3,3,,,,,,,,,,,,,,,,,,,,,9,,,,,,,,,,,,,,,,,,,,6,7,normal,normal,mixed,normal,,,1,,4,10,10,2,6,0.000193961,COMPLETE
75,216.0838776,47:21.9,47:57.4,0 days 00:00:35.405311,2,32,32,16,3,5,,,,,,,,,,,,,,,,,,,,,,,,,,,,,,,,,,,,,,,,,4,5,normal,normal,,,,,,,2,5,9,,,0.008697651,COMPLETE
76,,47:57.4,48:43.8,0 days 00:00:46.495862,4,128,64,,2,2,,,,,,,,,,,5,3,10,8,5,3,7,10,8,5,5,3,9,10,5,5,,,,,2,10,5,4,3,5,8,3,10,,3,7,normal,mixed,mixed,mixed,,10,6,9,4,5,5,1,10,0.000100565,FAIL
77,4626.949707,48:43.9,49:22.7,0 days 00:00:38.839005,3,16,16,,2,4,,,,,,,,,,,,,,,,,,,,,7,3,6,4,6,8,2,10,4,5,,,,,,,,,,,7,3,normal,normal,mixed,normal,,,10,,4,4,1,10,2,0.00154877,COMPLETE
78,,49:22.7,50:01.4,0 days 00:00:38.699261,3,96,32,128,3,2,4,6,8,,,,,,,,,,,,,,,,,,,,,,,,,,,,,,,,,,,,,,8,6,mixed,normal,normal,,3,,,,3,5,8,6,,0.000364755,FAIL
79,,50:01.4,50:41.3,0 days 00:00:39.866087,1,16,8,128,3,4,3,8,9,2,2,,,,,,8,,,,,,,,,,10,,,,,,,,,,8,10,,,,,,,,,7,3,mixed,mixed,mixed,mixed,5,1,1,2,4,7,1,5,10,0.001508996,FAIL
80,,50:41.3,51:18.5,0 days 00:00:37.199610,1,64,8,,2,4,7,8,9,2,9,7,,,,,,,,,,,,,,,,,,,,,,,,,,,,,,,,,,,4,8,mixed,,,,6,,,,1,7,,,,0.003812986,FAIL
81,,51:18.5,51:57.3,0 days 00:00:38.810297,4,8,128,,2,4,4,6,10,8,2,5,8,8,2,5,,,,,,,,,,,,,,,,,,,,,,,,,,,,,,,7,8,mixed,,,,10,,,,1,6,,,,0.002660515,FAIL
82,2562.394043,51:57.3,52:34.0,0 days 00:00:36.688804,1,128,96,,2,4,,,,,,,,,,,,,,,,,,,,,,,,,,,,,,,,,,,,,,,,,4,6,normal,normal,normal,,,,,,3,7,5,3,,0.000441484,COMPLETE
83,,52:34.0,53:16.2,0 days 00:00:42.240544,2,32,,,1,4,,,,,,,,,,,4,3,,,,,,,,,8,8,2,3,4,5,3,,,,,,,,,,,,,,8,8,normal,mixed,mixed,normal,,2,7,,4,5,1,8,6,0.00886379,FAIL
84,,53:16.2,54:00.5,0 days 00:00:44.243900,4,32,32,,2,2,4,,,,,,,,,,2,10,2,7,7,8,9,10,,,5,6,5,3,4,7,3,2,3,5,,,,,,,,,,,6,6,mixed,mixed,mixed,normal,1,8,10,,4,4,1,10,9,0.007829394,FAIL
85,,54:00.5,54:43.4,0 days 00:00:42.885173,3,16,8,8,3,3,8,2,3,7,6,5,6,5,8,,4,9,2,7,9,2,9,7,3,7,,,,,,,,,,,,,,,,,,,,,6,6,mixed,mixed,,,9,10,,,2,3,5,,,0.000348332,FAIL
86,,54:43.4,55:28.4,0 days 00:00:45.078397,3,96,16,16,3,3,3,10,9,,,,,,,,8,3,,,,,,,,,8,9,9,7,8,,,,,,4,5,9,10,5,,,,,,8,7,mixed,mixed,mixed,mixed,3,2,5,5,4,10,9,9,1,0.001813525,FAIL
87,,55:28.4,56:12.5,0 days 00:00:44.058186,4,128,8,,2,2,10,5,4,3,9,6,4,10,6,,6,4,4,10,2,7,3,3,5,,,,,,,,,,,,,,,,,,,,,,7,7,mixed,mixed,normal,,9,9,,,3,3,10,10,,0.0006345,FAIL
88,,56:12.5,56:54.4,0 days 00:00:41.860970,1,96,,,1,2,2,,,,,,,,,,4,3,2,3,2,2,4,3,,,,,,,,,,,,,6,5,,,,,,,,,5,8,mixed,mixed,normal,mixed,1,8,,2,4,6,7,9,6,0.000139168,FAIL
89,,56:54.4,57:38.4,0 days 00:00:44.020206,4,32,8,,2,3,9,6,10,10,,,,,,,8,10,4,4,10,4,8,2,2,6,2,7,8,7,3,,,,,,,,,,,,,,,,7,7,mixed,mixed,mixed,,4,10,5,,3,2,7,8,,0.000239832,FAIL
90,,57:38.4,58:14.1,0 days 00:00:35.752072,3,8,,,1,2,4,2,10,,,,,,,,,,,,,,,,,,,,,,,,,,,,,,,,,,,,,,7,5,mixed,normal,,,3,,,,2,6,1,,,0.000124056,FAIL
91,,58:14.1,58:53.3,0 days 00:00:39.147899,2,128,8,,2,4,,,,,,,,,,,3,7,9,8,10,4,5,6,3,,,,,,,,,,,,,,,,,,,,,,7,6,normal,mixed,,,,9,,,2,8,9,,,0.0002374,FAIL
92,4906.474609,58:53.3,59:31.2,0 days 00:00:37.935580,4,16,128,,2,5,,,,,,,,,,,,,,,,,,,,,2,4,,,,,,,,,5,6,3,,,,,,,,3,4,normal,normal,mixed,mixed,,,2,3,4,9,8,3,9,0.000113291,COMPLETE
93,522.2373657,59:31.2,00:08.2,0 days 00:00:37.019545,2,128,,,1,3,5,5,4,10,8,,,,,,,,,,,,,,,,,,,,,,,,,,,,,,,,,,,,4,3,mixed,normal,normal,normal,5,,,,4,5,6,6,5,0.00706531,COMPLETE
94,1990.95166,00:08.3,00:47.5,0 days 00:00:39.201165,2,128,,,1,5,,,,,,,,,,,6,5,6,5,,,,,,,,,,,,,,,,,,,,,,,,,,,4,8,normal,mixed,normal,,,4,,,3,9,1,2,,0.000130151,COMPLETE
95,,00:47.5,01:27.2,0 days 00:00:39.728612,2,16,,,1,3,10,6,9,,,,,,,,4,4,8,5,8,10,4,9,9,,,,,,,,,,,,,,,,,,,,,,6,3,mixed,mixed,normal,,3,9,,,3,5,3,6,,0.000187837,FAIL
96,313.4208984,01:27.2,02:02.9,0 days 00:00:35.674240,3,64,16,32,3,2,,,,,,,,,,,,,,,,,,,,,,,,,,,,,,,,,,,,,,,,,6,8,normal,,,,,,,,1,7,,,,0.005627514,COMPLETE
97,227.6394043,02:02.9,02:41.4,0 days 00:00:38.551258,1,32,,,1,3,,,,,,,,,,,,,,,,,,,,,9,,,,,,,,,,,,,,,,,,,,4,8,normal,normal,mixed,,,,1,,3,8,9,7,,0.007781823,COMPLETE
98,240.074295,02:41.4,03:18.1,0 days 00:00:36.672971,2,128,128,,2,3,,,,,,,,,,,,,,,,,,,,,,,,,,,,,,,,,,,,,,,,,4,4,normal,normal,normal,normal,,,,,4,9,8,8,8,0.002905479,COMPLETE
99,,03:18.1,04:02.3,0 days 00:00:44.176292,4,128,,,1,5,9,8,5,10,5,,,,,,4,7,10,3,9,10,6,,,,2,4,6,4,2,4,7,9,3,5,,,,,,,,,,,3,5,mixed,mixed,mixed,,5,7,10,,3,10,8,6,,0.003135492,FAIL
100,,04:02.3,04:37.7,0 days 00:00:35.465289,3,128,64,,2,3,8,6,,,,,,,,,8,,,,,,,,,,,,,,,,,,,,,,,,,,,,,,6,3,mixed,mixed,,,2,1,,,2,3,3,,,0.001152949,FAIL
101,,04:37.7,05:19.1,0 days 00:00:41.331050,1,96,16,,2,4,4,6,,,,,,,,,6,,,,,,,,,,,,,,,,,,,,8,9,4,10,,,,,,,5,6,mixed,mixed,normal,mixed,2,1,,4,4,3,4,8,1,0.009914339,FAIL
102,4858.446777,05:19.1,05:59.2,0 days 00:00:40.102511,2,128,64,64,3,2,,,,,,,,,,,10,6,6,5,3,7,8,7,,,,,,,,,,,,,,,,,,,,,,,7,5,normal,mixed,normal,,,8,,,3,2,10,6,,0.000123645,COMPLETE
103,217.2093658,05:59.2,06:36.9,0 days 00:00:37.752331,4,96,,,1,5,,,,,,,,,,,9,3,6,4,5,6,3,10,,,,,,,,,,,,,,,,,,,,,,,7,5,normal,mixed,,,,8,,,2,10,2,,,0.002078758,COMPLETE
104,,06:36.9,07:15.7,0 days 00:00:38.791706,1,16,16,,2,2,9,9,8,,,,,,,,,,,,,,,,,,7,9,,,,,,,,,,,,,,,,,,,5,5,mixed,normal,mixed,,3,,2,,3,6,9,1,,0.000304802,FAIL
105,,07:15.7,07:57.5,0 days 00:00:41.750841,1,32,16,96,3,5,,,,,,,,,,,2,8,7,5,4,,,,,,4,4,10,8,2,,,,,,,,,,,,,,,,5,7,normal,mixed,mixed,,,5,5,,3,3,10,3,,0.003382236,FAIL
106,1159.897705,07:57.5,08:41.5,0 days 00:00:43.980513,2,64,128,32,3,3,,,,,,,,,,,,,,,,,,,,,,,,,,,,,,,4,10,3,8,10,8,7,6,8,,8,7,normal,normal,normal,mixed,,,,9,4,4,4,8,10,0.000170261,COMPLETE
107,,08:41.5,09:21.0,0 days 00:00:39.559775,2,96,,,1,5,5,10,4,9,2,2,,,,,5,3,9,9,,,,,,,,,,,,,,,,,,,,,,,,,,,5,7,mixed,mixed,,,6,4,,,2,5,5,,,0.000196734,FAIL
108,581.803894,09:21.0,09:58.1,0 days 00:00:37.022564,1,16,,,1,3,,,,,,,,,,,,,,,,,,,,,7,6,4,2,,,,,,,,,,,,,,,,,3,5,normal,normal,mixed,,,,4,,3,1,6,7,,0.001451014,COMPLETE
109,1615.316406,09:58.1,10:31.6,0 days 00:00:33.507547,2,32,,,1,5,,,,,,,,,,,,,,,,,,,,,,,,,,,,,,,,,,,,,,,,,6,3,normal,normal,,,,,,,2,1,10,,,0.005240735,COMPLETE
110,,10:31.6,11:11.8,0 days 00:00:40.181418,4,128,64,,2,4,,,,,,,,,,,2,2,4,9,9,,,,,,10,4,6,2,4,2,4,7,,,,,,,,,,,,,8,3,normal,mixed,mixed,normal,,5,8,,4,9,9,7,1,0.001707087,FAIL
111,4956.339844,11:11.8,11:49.3,0 days 00:00:37.529041,1,128,128,,2,5,10,3,4,9,7,5,,,,,,,,,,,,,,,,,,,,,,,,,,,,,,,,,,,5,3,mixed,normal,normal,,6,,,,3,6,7,2,,0.000144687,COMPLETE
112,,11:49.3,12:30.6,0 days 00:00:41.293280,3,64,,,1,2,10,9,3,5,8,9,8,2,,,2,6,5,10,6,2,10,2,,,,,,,,,,,,,,,,,,,,,,,5,6,mixed,mixed,,,8,8,,,2,9,10,,,0.004518516,FAIL
113,532.6508789,12:30.6,13:08.2,0 days 00:00:37.662536,3,64,64,,2,5,,,,,,,,,,,,,,,,,,,,,10,,,,,,,,,,,,,,,,,,,,5,6,normal,normal,mixed,,,,1,,3,5,1,3,,0.000993193,COMPLETE
114,53031.44922,13:08.2,13:45.6,0 days 00:00:37.322719,4,16,,,1,2,10,8,3,6,9,9,,,,,,,,,,,,,,,,,,,,,,,,,,,,,,,,,,,5,4,mixed,normal,,,6,,,,2,8,6,,,0.000191816,COMPLETE
