number,value,datetime_start,datetime_complete,duration,params_gat_heads,params_gat_hidden_0,params_gat_hidden_1,params_gat_hidden_2,params_gat_layers,params_gat_out,params_kan_arity_0_0,params_kan_arity_0_1,params_kan_arity_0_2,params_kan_arity_0_3,params_kan_arity_0_4,params_kan_arity_0_5,params_kan_arity_0_6,params_kan_arity_0_7,params_kan_arity_0_8,params_kan_arity_0_9,params_kan_arity_1_0,params_kan_arity_1_1,params_kan_arity_1_2,params_kan_arity_1_3,params_kan_arity_1_4,params_kan_arity_1_5,params_kan_arity_1_6,params_kan_arity_1_7,params_kan_arity_1_8,params_kan_arity_1_9,params_kan_arity_2_0,params_kan_arity_2_1,params_kan_arity_2_2,params_kan_arity_2_3,params_kan_arity_2_4,params_kan_arity_2_5,params_kan_arity_2_6,params_kan_arity_2_7,params_kan_arity_2_8,params_kan_arity_2_9,params_kan_arity_3_0,params_kan_arity_3_1,params_kan_arity_3_2,params_kan_arity_3_3,params_kan_arity_3_4,params_kan_arity_3_5,params_kan_arity_3_6,params_kan_arity_3_7,params_kan_arity_3_8,params_kan_arity_3_9,params_kan_grid,params_kan_k,params_kan_layer_type_0,params_kan_layer_type_1,params_kan_layer_type_2,params_kan_layer_type_3,params_kan_mult_nodes_0,params_kan_mult_nodes_1,params_kan_mult_nodes_2,params_kan_mult_nodes_3,params_kan_n_layers,params_kan_neurons_0,params_kan_neurons_1,params_kan_neurons_2,params_kan_neurons_3,params_lr,state
968,,59:53.5,00:37.7,0 days 00:00:44.193960,4,64,96,128,3,5,7,7,8,4,6,7,2,6,10,2,10,4,10,10,7,4,,,,,,,,,,,,,,,,,,,,,,,,,5,6,mixed,mixed,,,10,6,,,2,10,9,,,0.005048467,FAIL
969,,00:37.7,01:22.4,0 days 00:00:44.739141,4,64,96,128,3,5,7,7,8,4,6,7,10,6,10,3,10,4,10,10,7,4,,,,,,,,,,,,,,,,,,,,,,,,,5,6,mixed,mixed,,,10,6,,,2,10,9,,,0.004867654,FAIL
970,,01:22.4,02:07.1,0 days 00:00:44.661926,4,64,96,128,3,5,7,10,9,4,6,7,10,6,10,2,10,,,,,,,,,,,,,,,,,,,,,,,,,,,,,,5,6,mixed,mixed,,,10,1,,,2,10,9,,,0.005034091,FAIL
971,,02:07.1,02:52.0,0 days 00:00:44.860220,4,64,96,128,3,5,7,7,8,4,6,7,10,7,10,2,10,4,10,10,7,4,,,,,,,,,,,,,,,,,,,,,,,,,4,6,mixed,mixed,,,10,6,,,2,10,9,,,0.000556647,FAIL
972,,02:52.0,03:36.1,0 days 00:00:44.194861,4,64,96,128,3,5,7,7,9,4,6,7,2,6,10,2,10,4,10,10,7,4,,,,,,,,,,,,,,,,,,,,,,,,,4,6,mixed,mixed,,,10,6,,,2,8,9,,,0.001699839,FAIL
973,,03:36.2,04:20.2,0 days 00:00:44.010056,4,64,96,128,3,5,7,10,8,4,6,7,2,6,10,2,10,4,2,10,7,4,,,,,,,,,,,,,,,,,,,,,,,,,4,6,mixed,mixed,,,10,6,,,2,8,9,,,0.005047414,FAIL
974,,04:20.2,05:04.3,0 days 00:00:44.132000,4,64,96,128,3,5,7,7,8,4,6,7,2,6,10,2,10,4,10,10,7,4,,,,,,,,,,,,,,,,,,,,,,,,,4,6,mixed,mixed,,,10,6,,,2,10,9,,,0.004786204,FAIL
975,,05:04.3,05:42.7,0 days 00:00:38.415551,4,64,96,128,3,5,,,,,,,,,,,10,,,,,,,,,,,,,,,,,,,,,,,,,,,,,,5,6,normal,mixed,,,,1,,,2,10,9,,,0.005101699,FAIL
976,,05:42.7,06:26.9,0 days 00:00:44.178235,4,64,96,128,3,5,7,7,8,4,6,7,2,6,10,2,10,4,10,10,7,4,,,,,,,,,,,,,,,,,,,,,,,,,4,6,mixed,mixed,,,10,6,,,2,10,9,,,0.005029553,FAIL
977,,06:26.9,07:10.1,0 days 00:00:43.234142,4,64,96,128,3,5,7,7,9,5,6,7,2,,,,10,4,10,10,7,4,,,,,,,,,,,,,,,,,,,,,,,,,5,6,mixed,mixed,,,7,6,,,2,10,9,,,0.004965099,FAIL
978,,07:10.1,07:54.3,0 days 00:00:44.146191,4,64,96,128,3,5,7,7,8,4,6,6,2,6,10,2,10,4,10,10,7,4,,,,,,,,,,,,,,,,,,,,,,,,,5,6,mixed,mixed,,,10,6,,,2,8,9,,,0.002662108,FAIL
979,,07:54.3,08:38.4,0 days 00:00:44.094881,4,64,96,128,3,5,3,7,8,4,6,7,10,6,10,2,10,4,4,10,7,4,,,,,,,,,,,,,,,,,,,,,,,,,5,6,mixed,mixed,,,10,6,,,2,8,9,,,0.004812945,FAIL
980,157.44487,08:38.4,09:19.8,0 days 00:00:41.410228,4,64,96,128,3,5,,,,,,,,,,,10,4,10,10,7,4,,,,,,,,,,,,,,,,,,,,,,,,,5,6,normal,mixed,,,,6,,,2,8,9,,,0.002642115,COMPLETE
981,,09:19.8,10:04.4,0 days 00:00:44.588157,4,64,96,128,3,5,7,10,8,4,6,7,2,6,10,2,9,4,9,10,7,3,,,,,,,,,,,,,,,,,,,,,,,,,4,6,mixed,mixed,,,10,6,,,2,10,9,,,0.004891293,FAIL
982,,10:04.4,10:50.1,0 days 00:00:45.660965,4,64,96,128,3,5,7,7,8,4,6,7,10,6,10,2,9,4,9,10,7,3,,,,,,,,,,,,,,,,,,,,,,,,,4,7,mixed,mixed,,,10,6,,,2,10,9,,,0.004999301,FAIL
983,,10:50.1,11:33.9,0 days 00:00:43.850189,4,64,8,128,3,5,7,7,9,4,6,6,2,6,10,2,9,4,9,10,7,3,,,,,,,,,,,,,,,,,,,,,,,,,4,6,mixed,mixed,,,10,6,,,2,10,9,,,0.005036345,FAIL
984,,11:33.9,12:17.4,0 days 00:00:43.501880,4,64,8,128,3,5,7,7,8,4,6,7,2,6,10,2,9,4,9,10,,,,,,,,,,,,,,,,,,,,,,,,,,,4,7,mixed,mixed,,,10,4,,,2,10,9,,,0.004767945,FAIL
985,,12:17.4,13:00.7,0 days 00:00:43.244515,4,64,8,128,3,5,7,7,8,4,6,7,2,6,10,2,9,4,4,10,,,,,,,,,,,,,,,,,,,,,,,,,,,4,6,mixed,mixed,,,10,4,,,2,10,9,,,0.004904716,FAIL
986,125.1009369,13:00.7,13:41.6,0 days 00:00:40.969219,4,64,8,128,3,5,,,,,,,,,,,9,4,9,10,7,3,,,,,,,,,,,,,,,,,,,,,,,,,4,6,normal,mixed,,,,6,,,2,10,9,,,0.005146672,COMPLETE
987,,13:41.6,14:26.6,0 days 00:00:44.950954,4,64,96,128,3,5,7,7,8,4,6,7,10,,,,9,8,9,10,,,,,,,,,,,,,,,,,,,,,,,,,,,4,6,mixed,mixed,,,7,4,,,2,10,9,,,0.005099048,FAIL
988,,14:26.6,15:11.2,0 days 00:00:44.560070,4,64,96,128,3,5,7,7,8,4,6,7,10,6,10,2,9,4,9,10,7,2,,,,,,,,,,,,,,,,,,,,,,,,,4,6,mixed,mixed,,,10,6,,,2,10,9,,,0.005044021,FAIL
989,,15:11.2,15:56.2,0 days 00:00:45.057719,4,64,96,128,3,5,7,7,8,4,2,7,10,6,10,2,9,8,9,10,7,3,,,,,,,,,,,,,,,,,,,,,,,,,3,6,mixed,mixed,,,10,6,,,2,10,9,,,0.005025695,FAIL
990,116.2886581,15:56.2,16:38.6,0 days 00:00:42.343926,4,64,96,128,3,5,,,,,,,,,,,9,4,9,10,7,2,,,,,,,,,,,,,,,,,,,,,,,,,4,7,normal,mixed,,,,6,,,2,10,9,,,0.005107889,COMPLETE
991,,16:38.6,17:23.5,0 days 00:00:44.923631,4,64,96,128,3,5,7,7,8,4,6,7,10,6,10,2,9,3,9,10,7,2,,,,,,,,,,,,,,,,,,,,,,,,,3,3,mixed,mixed,,,10,6,,,2,10,9,,,0.005030457,FAIL
992,,17:23.5,18:07.9,0 days 00:00:44.414117,4,64,96,128,3,5,7,7,8,4,6,7,10,6,10,3,9,3,9,10,7,2,,,,,,,,,,,,,,,,,,,,,,,,,3,5,mixed,mixed,,,10,6,,,2,10,9,,,0.005308176,FAIL
993,,18:07.9,18:51.7,0 days 00:00:43.818568,4,64,96,128,3,5,7,10,8,4,6,7,2,6,10,,9,3,9,10,7,2,,,,,,,,,,,,,,,,,,,,,,,,,4,5,mixed,mixed,,,9,6,,,2,10,9,,,0.005288918,FAIL
994,,18:51.7,19:36.7,0 days 00:00:44.999465,4,64,96,128,3,5,7,7,8,5,6,7,2,6,10,2,9,3,9,10,7,2,,,,,,,,,,,,,,,,,,,,,,,,,4,7,mixed,mixed,,,10,6,,,2,10,9,,,0.005212718,FAIL
995,,19:36.8,20:21.1,0 days 00:00:44.391989,4,64,96,128,3,5,7,7,8,4,6,7,2,6,3,2,9,3,9,10,7,2,,,,,,,,,,,,,,,,,,,,,,,,,4,7,mixed,mixed,,,10,6,,,2,10,9,,,0.005084532,FAIL
996,,20:21.1,21:07.1,0 days 00:00:45.918640,4,64,96,128,3,5,7,7,8,4,6,7,10,6,10,2,9,3,9,10,7,2,,,,,,,,,,,,,,,,,,,,,,,,,4,7,mixed,mixed,,,10,6,,,2,10,9,,,0.00516902,FAIL
997,139.8407135,21:07.1,21:49.5,0 days 00:00:42.460190,4,64,96,128,3,5,,,,,,,,,,,9,3,9,10,7,2,,,,,,,,,,,,,,,,,,,,,,,,,4,7,normal,mixed,,,,6,,,2,10,9,,,0.005018047,COMPLETE
998,,21:49.5,22:35.3,0 days 00:00:45.806186,4,64,96,128,3,5,7,7,8,4,6,7,10,6,10,3,9,4,9,10,7,2,,,,,,,,,,,,,,,,,,,,,,,,,4,7,mixed,mixed,,,10,6,,,2,10,9,,,0.005168531,FAIL
999,250.3878326,22:35.3,23:16.4,0 days 00:00:41.059998,4,64,96,128,3,5,,,,,,,,,,,9,4,9,10,7,2,,,,,,,,,,,,,,,,,,,,,,,,,3,5,normal,mixed,,,,6,,,2,10,9,,,0.006239752,COMPLETE
1000,288.7854614,29:50.4,34:02.0,0 days 00:04:11.630176,4,128,8,16,3,2,,,,,,,,,,,,,,,,,,,,,7,9,4,5,6,5,10,,,,,,,,,,,,,,3,8,normal,normal,mixed,,,,7,,3,5,8,8,,0.00204405,COMPLETE
1001,368.4098816,34:02.0,38:07.3,0 days 00:04:05.269567,4,16,96,,2,4,,,,,,,,,,,7,6,3,2,6,2,,,,,,,,,,,,,,,,,,,,,,,,,3,4,normal,mixed,,,,6,,,2,4,10,,,0.004060202,COMPLETE
1002,,38:07.3,42:12.7,0 days 00:04:05.376138,1,96,96,96,3,2,2,10,6,9,7,9,,,,,,,,,,,,,,,,,,,,,,,,,,,,,,,,,,,7,6,mixed,normal,,,6,,,,2,5,10,,,0.002782943,FAIL
1003,,42:12.7,46:13.6,0 days 00:04:00.949949,1,32,128,,2,3,9,3,8,9,,,,,,,5,,,,,,,,,,,,,,,,,,,,,,,,,,,,,,6,3,mixed,mixed,,,4,1,,,2,10,8,,,0.004450151,FAIL
1004,,46:13.7,50:24.5,0 days 00:04:10.813656,1,8,16,8,3,4,,,,,,,,,,,9,6,5,10,9,5,4,4,,,,,,,,,,,,,,,,,,,,,,,7,6,normal,mixed,normal,,,8,,,3,8,9,3,,0.001133651,FAIL
1005,,50:24.5,54:34.2,0 days 00:04:09.707773,1,32,32,8,3,4,,,,,,,,,,,2,5,,,,,,,,,4,,,,,,,,,,9,4,4,6,,,,,,,6,6,normal,mixed,mixed,mixed,,2,1,4,4,9,2,7,1,0.007953464,FAIL
1006,,54:34.2,58:43.3,0 days 00:04:09.100628,2,8,,,1,2,4,7,,,,,,,,,4,,,,,,,,,,9,7,8,4,10,2,10,,,,,,,,,,,,,,8,7,mixed,mixed,mixed,,2,1,7,,3,8,10,1,,0.001013572,FAIL
1007,,58:43.3,03:01.3,0 days 00:04:17.969193,4,128,64,64,3,4,,,,,,,,,,,5,4,2,2,4,7,9,10,8,4,8,,,,,,,,,,,,,,,,,,,,8,3,normal,mixed,mixed,,,10,1,,3,5,5,10,,0.006930476,FAIL
1008,1299.922485,03:01.3,07:07.4,0 days 00:04:06.097790,4,128,,,1,5,10,9,3,2,4,9,9,4,4,,,,,,,,,,,,,,,,,,,,,,,,,,,,,,,,4,4,mixed,,,,9,,,,1,9,,,,0.00759186,COMPLETE
1009,899.6595459,07:07.4,11:11.4,0 days 00:04:04.016289,3,128,8,64,3,4,,,,,,,,,,,,,,,,,,,,,,,,,,,,,,,,,,,,,,,,,5,7,normal,,,,,,,,1,2,,,,0.003423817,COMPLETE
1010,,11:11.4,15:14.2,0 days 00:04:02.776950,1,32,16,,2,3,10,7,8,4,,,,,,,,,,,,,,,,,,,,,,,,,,,,,,,,,,,,,4,6,mixed,,,,4,,,,1,5,,,,0.008409714,FAIL
1011,,15:14.2,19:15.4,0 days 00:04:01.281079,3,64,,,1,3,2,6,7,6,8,3,10,,,,,,,,,,,,,,,,,,,,,,,,,,,,,,,,,,3,7,mixed,,,,7,,,,1,4,,,,0.007014002,FAIL
1012,882.8570557,19:15.4,23:17.3,0 days 00:04:01.892212,3,8,96,8,3,4,,,,,,,,,,,,,,,,,,,,,,,,,,,,,,,,,,,,,,,,,7,3,normal,normal,,,,,,,2,10,10,,,0.00117785,COMPLETE
1013,,23:17.3,27:28.6,0 days 00:04:11.291663,4,8,64,,2,4,8,3,8,3,7,,,,,,,,,,,,,,,,,,,,,,,,,,,,,,,,,,,,3,7,mixed,normal,normal,normal,5,,,,4,9,10,6,9,0.001287754,FAIL
1014,,27:28.6,31:42.5,0 days 00:04:13.891779,2,96,8,,2,2,5,3,10,9,3,4,10,,,,7,3,,,,,,,,,,,,,,,,,,,2,6,2,8,6,10,5,7,6,5,5,6,mixed,mixed,normal,mixed,7,2,,10,4,2,6,6,2,0.008841911,FAIL
1015,523.7733154,31:42.5,35:51.7,0 days 00:04:09.169498,1,96,32,,2,5,,,,,,,,,,,,,,,,,,,,,10,6,10,,,,,,,,,,,,,,,,,,8,8,normal,normal,mixed,,,,3,,3,5,5,3,,0.001534081,COMPLETE
1016,1887.524536,35:51.7,40:07.5,0 days 00:04:15.758264,4,16,128,128,3,2,,,,,,,,,,,,,,,,,,,,,,,,,,,,,,,,,,,,,,,,,8,8,normal,normal,,,,,,,2,8,4,,,0.009129676,COMPLETE
1017,,40:07.5,44:16.1,0 days 00:04:08.612102,2,32,8,64,3,2,4,8,10,,,,,,,,5,5,7,,,,,,,,8,3,7,5,2,10,7,2,10,,,,,,,,,,,,8,7,mixed,mixed,mixed,,3,3,9,,3,6,3,8,,0.002164546,FAIL
1018,,44:16.1,48:23.3,0 days 00:04:07.187914,3,16,64,,2,4,,,,,,,,,,,,,,,,,,,,,7,9,5,,,,,,,,,,,,,,,,,,8,7,normal,normal,mixed,,,,3,,3,10,4,7,,0.002434955,FAIL
1019,1288.42395,48:23.3,52:31.6,0 days 00:04:08.309739,2,96,128,,2,3,,,,,,,,,,,,,,,,,,,,,9,5,7,8,8,8,,,,,,,,,,,,,,,6,6,normal,normal,mixed,normal,,,6,,4,5,2,7,1,0.004367412,COMPLETE
1020,,52:31.6,56:34.6,0 days 00:04:02.995194,4,16,,,1,5,7,9,7,10,6,9,7,9,7,,,,,,,,,,,,,,,,,,,,,,,,,,,,,,,,4,5,mixed,normal,,,9,,,,2,6,7,,,0.001505651,FAIL
1021,1198.595093,56:34.6,00:34.5,0 days 00:03:59.965529,3,128,,,1,2,,,,,,,,,,,,,,,,,,,,,2,,,,,,,,,,,,,,,,,,,,6,3,normal,normal,mixed,,,,1,,3,1,5,6,,0.00142313,COMPLETE
1022,,00:34.5,04:39.1,0 days 00:04:04.512555,1,32,96,64,3,2,6,9,5,2,4,4,2,,,,,,,,,,,,,,,,,,,,,,,,,,,,,,,,,,7,6,mixed,,,,7,,,,1,7,,,,0.003927914,FAIL
1023,943.3605957,04:39.1,08:31.6,0 days 00:03:52.536237,1,96,,,1,5,,,,,,,,,,,,,,,,,,,,,,,,,,,,,,,,,,,,,,,,,5,7,normal,,,,,,,,1,4,,,,0.002492335,COMPLETE
1024,,08:31.6,12:46.7,0 days 00:04:15.079065,4,128,64,,2,5,10,,,,,,,,,,3,2,3,6,8,,,,,,,,,,,,,,,,,,,,,,,,,,3,8,mixed,mixed,normal,normal,1,5,,,4,6,2,1,4,0.002673172,FAIL
1025,,12:46.7,16:49.1,0 days 00:04:02.425485,1,96,128,96,3,4,3,4,9,5,2,8,5,9,,,,,,,,,,,,,,,,,,,,,,,,,,,,,,,,,6,6,mixed,,,,8,,,,1,9,,,,0.001313045,FAIL
1026,,16:49.1,20:45.6,0 days 00:03:56.485467,1,16,16,16,3,2,8,9,4,4,9,,,,,,,,,,,,,,,,,,,,,,,,,,,,,,,,,,,,5,5,mixed,,,,5,,,,1,6,,,,0.00126413,FAIL
1027,,20:45.6,25:03.0,0 days 00:04:17.377253,4,16,128,96,3,5,,,,,,,,,,,6,2,8,2,2,7,,,,,5,8,9,4,5,5,7,,,,,,,,,,,,,,3,8,normal,mixed,mixed,,,6,7,,3,2,8,3,,0.006577275,FAIL
1028,538.071106,25:03.0,29:06.8,0 days 00:04:03.772647,2,96,,,1,3,,,,,,,,,,,8,3,8,8,,,,,,,,,,,,,,,,,,,,,,,,,,,4,5,normal,mixed,,,,4,,,2,10,3,,,0.001565691,COMPLETE
1029,957.3911743,29:06.8,33:08.6,0 days 00:04:01.856748,3,96,,,1,5,,,,,,,,,,,,,,,,,,,,,,,,,,,,,,,,,,,,,,,,,4,4,normal,normal,normal,,,,,,3,2,6,5,,0.001850375,COMPLETE
1030,,33:08.6,37:16.1,0 days 00:04:07.481114,1,96,16,96,3,5,,,,,,,,,,,9,8,4,,,,,,,,,,,,,,,,,,,,,,,,,,,,6,7,normal,mixed,,,,3,,,2,10,7,,,0.002277984,FAIL
1031,613.3598022,37:16.1,41:18.6,0 days 00:04:02.497593,1,32,,,1,4,,,,,,,,,,,5,3,,,,,,,,,,,,,,,,,,,,,,,,,,,,,7,4,normal,mixed,,,,2,,,2,1,6,,,0.004386626,COMPLETE
1032,382.3652039,41:18.6,45:28.4,0 days 00:04:09.764742,3,32,32,128,3,4,,,,,,,,,,,,,,,,,,,,,,,,,,,,,,,6,4,8,,,,,,,,6,3,normal,normal,normal,mixed,,,,3,4,4,5,3,6,0.007508653,COMPLETE
1033,,45:28.4,49:37.1,0 days 00:04:08.744305,1,16,,,1,5,10,8,6,2,6,9,,,,,,,,,,,,,,,,,,,,,,,,,2,5,10,,,,,,,,5,8,mixed,normal,normal,mixed,6,,,3,4,4,9,9,2,0.007893442,FAIL
1034,648.446228,49:37.1,53:40.8,0 days 00:04:03.719169,3,128,,,1,3,,,,,,,,,,,,,,,,,,,,,,,,,,,,,,,,,,,,,,,,,3,8,normal,normal,,,,,,,2,10,8,,,0.00413947,COMPLETE
1035,503.1065369,53:40.8,57:44.3,0 days 00:04:03.463825,4,8,64,8,3,3,,,,,,,,,,,5,9,4,3,5,3,,,,,,,,,,,,,,,,,,,,,,,,,3,3,normal,mixed,,,,6,,,2,8,9,,,0.001308291,COMPLETE
1036,2818.831543,57:44.3,01:50.0,0 days 00:04:05.697170,4,64,64,,2,5,,,,,,,,,,,,,,,,,,,,,,,,,,,,,,,,,,,,,,,,,6,4,normal,normal,,,,,,,2,4,2,,,0.005314238,COMPLETE
1037,3241.050049,01:50.0,05:53.3,0 days 00:04:03.324385,1,128,64,16,3,5,2,,,,,,,,,,,,,,,,,,,,,,,,,,,,,,,,,,,,,,,,7,7,mixed,normal,,,1,,,,2,2,1,,,0.007788339,COMPLETE
1038,461.2980652,05:53.3,09:54.5,0 days 00:04:01.140510,2,16,16,8,3,3,,,,,,,,,,,,,,,,,,,,,,,,,,,,,,,,,,,,,,,,,7,6,normal,normal,,,,,,,2,7,7,,,0.002492272,COMPLETE
1039,,09:54.5,13:59.8,0 days 00:04:05.366475,1,8,32,8,3,5,4,10,7,8,7,7,7,3,9,,,,,,,,,,,,,,,,,,,,,,,,,,,,,,,,6,6,mixed,normal,,,9,,,,2,7,6,,,0.00993077,FAIL
1040,,13:59.8,18:09.5,0 days 00:04:09.639946,4,96,8,,2,2,6,9,7,5,8,,,,,,7,7,8,2,7,,,,,,8,4,2,7,7,,,,,,,,,,,,,,,,4,7,mixed,mixed,mixed,,5,5,5,,3,8,2,10,,0.003203127,FAIL
1041,5043.686523,18:09.5,22:10.3,0 days 00:04:00.795184,1,64,128,32,3,5,5,6,6,4,10,7,9,8,4,5,,,,,,,,,,,,,,,,,,,,,,,,,,,,,,,7,4,mixed,,,,10,,,,1,3,,,,0.001098237,COMPLETE
1042,858.5903931,22:10.3,26:09.5,0 days 00:03:59.257638,1,64,,,1,5,7,4,7,,,,,,,,,,,,,,,,,,,,,,,,,,,,,,,,,,,,,,6,5,mixed,,,,3,,,,1,5,,,,0.003295361,COMPLETE
1043,,26:09.5,30:22.0,0 days 00:04:12.496226,2,16,64,16,3,5,7,8,7,4,3,,,,,,9,9,8,4,8,7,9,9,,,10,4,2,3,3,8,4,2,7,,,,,,,,,,,,7,3,mixed,mixed,mixed,,5,8,9,,3,8,9,7,,0.009446852,FAIL
1044,,30:22.0,34:35.3,0 days 00:04:13.258181,1,8,128,,2,2,,,,,,,,,,,2,6,2,7,7,8,8,,,,,,,,,,,,,,6,5,2,2,9,10,3,,,,4,8,normal,mixed,normal,mixed,,7,,7,4,5,4,2,10,0.002373875,FAIL
1045,1073.990112,34:35.3,38:40.9,0 days 00:04:05.590639,1,64,96,64,3,4,,,,,,,,,,,,,,,,,,,,,,,,,,,,,,,,,,,,,,,,,6,7,normal,normal,,,,,,,2,5,7,,,0.001579549,COMPLETE
1046,521.2489014,38:40.9,42:49.9,0 days 00:04:09.007072,3,16,96,,2,3,,,,,,,,,,,,,,,,,,,,,4,2,7,3,10,,,,,,,,,,,,,,,,8,8,normal,normal,mixed,,,,5,,3,3,4,10,,0.008212265,COMPLETE
1047,,42:49.9,46:59.3,0 days 00:04:09.353647,1,32,64,,2,2,2,3,9,6,4,6,5,3,4,5,10,9,5,,,,,,,,,,,,,,,,,,,,,,,,,,,,7,4,mixed,mixed,normal,,10,3,,,3,10,3,7,,0.009880944,FAIL
1048,,46:59.3,51:11.3,0 days 00:04:12.061724,2,64,128,128,3,3,6,,,,,,,,,,8,,,,,,,,,,,,,,,,,,,,,,,,,,,,,,7,5,mixed,mixed,normal,,1,1,,,3,2,9,6,,0.001578839,FAIL
1049,945.270813,51:11.3,55:18.1,0 days 00:04:06.744399,1,32,64,8,3,5,,,,,,,,,,,7,9,4,8,2,3,10,,,,,,,,,,,,,,,,,,,,,,,,7,4,normal,mixed,normal,,,7,,,3,1,3,2,,0.001122184,COMPLETE
1050,365.0510864,55:18.1,59:21.8,0 days 00:04:03.696129,1,128,32,,2,4,,,,,,,,,,,,,,,,,,,,,3,2,9,,,,,,,,,,,,,,,,,,4,4,normal,normal,mixed,,,,3,,3,2,9,1,,0.0032488,COMPLETE
1051,,59:21.8,03:28.6,0 days 00:04:06.832434,2,96,32,96,3,4,10,10,10,6,,,,,,,,,,,,,,,,,,,,,,,,,,,,,,,,,,,,,4,5,mixed,,,,4,,,,1,3,,,,0.001593793,FAIL
1052,869.0621948,03:28.6,07:39.4,0 days 00:04:10.833927,4,128,32,32,3,4,5,,,,,,,,,,,,,,,,,,,,,,,,,,,,,,,,,,,,,,,,4,6,mixed,,,,1,,,,1,8,,,,0.003762619,COMPLETE
1053,710.2150269,07:39.4,11:42.1,0 days 00:04:02.708886,3,16,,,1,2,,,,,,,,,,,2,2,9,4,7,5,,,,,,,,,,,,,,,,,,,,,,,,,8,3,normal,mixed,normal,normal,,6,,,4,9,4,6,6,0.001112066,COMPLETE
1054,313.65625,11:42.2,15:44.5,0 days 00:04:02.351670,1,32,,,1,5,8,7,4,7,2,9,9,7,2,,,,,,,,,,,,,,,,,,,,,,,,,,,,,,,,8,4,mixed,normal,,,9,,,,2,2,10,,,0.005088475,COMPLETE
1055,646.9284058,15:44.5,19:43.0,0 days 00:03:58.506335,1,32,96,16,3,5,,,,,,,,,,,,,,,,,,,,,,,,,,,,,,,,,,,,,,,,,7,3,normal,normal,normal,,,,,,3,8,7,9,,0.001583081,COMPLETE
1056,,19:43.0,23:44.2,0 days 00:04:01.208765,3,64,,,1,2,3,10,,,,,,,,,,,,,,,,,,,,,,,,,,,,,,,,,,,,,,,6,5,mixed,normal,,,2,,,,2,8,9,,,0.004335783,FAIL
1057,3004.712891,23:44.2,27:47.9,0 days 00:04:03.722704,3,8,,,1,5,,,,,,,,,,,5,6,6,8,3,3,2,6,9,,,,,,,,,,,,,,,,,,,,,,6,7,normal,mixed,normal,,,9,,,3,7,3,1,,0.005344423,COMPLETE
1058,,27:48.0,31:58.9,0 days 00:04:10.936830,4,8,64,,2,3,2,2,10,4,,,,,,,4,8,3,6,2,,,,,,,,,,,,,,,,,,,,,,,,,,6,6,mixed,mixed,normal,normal,4,5,,,4,10,3,7,2,0.003970065,FAIL
1059,273.0139771,31:58.9,36:06.1,0 days 00:04:07.254440,2,16,,,1,4,,,,,,,,,,,6,8,7,5,10,4,10,9,6,,,,,,,,,,,,,,,,,,,,,,6,4,normal,mixed,normal,,,9,,,3,9,6,10,,0.008623926,COMPLETE
1060,,36:06.1,40:06.8,0 days 00:04:00.624916,1,8,16,128,3,5,,,,,,,,,,,10,10,6,,,,,,,,5,,,,,,,,,,,,,,,,,,,,4,5,normal,mixed,mixed,,,3,1,,3,8,2,1,,0.002732167,FAIL
1061,325.0664368,40:06.8,44:10.6,0 days 00:04:03.796294,2,8,,,1,2,,,,,,,,,,,,,,,,,,,,,8,9,4,2,6,,,,,,,,,,,,,,,,7,4,normal,normal,mixed,,,,5,,3,10,10,8,,0.001699065,COMPLETE
1062,240.8821259,44:10.6,48:26.2,0 days 00:04:15.639258,3,96,96,96,3,4,,,,,,,,,,,,,,,,,,,,,,,,,,,,,,,,,,,,,,,,,7,8,normal,normal,,,,,,,2,10,7,,,0.004888255,COMPLETE
1063,,48:26.2,52:35.9,0 days 00:04:09.687990,2,128,,,1,4,5,10,7,5,,,,,,,,,,,,,,,,,,,,,,,,,,,8,4,,,,,,,,,5,8,mixed,normal,normal,mixed,4,,,2,4,8,6,7,6,0.001483685,FAIL
1064,854.1192627,52:35.9,56:41.9,0 days 00:04:05.962595,1,8,64,96,3,2,,,,,,,,,,,9,,,,,,,,,,,,,,,,,,,,,,,,,,,,,,7,7,normal,mixed,,,,1,,,2,1,2,,,0.002694296,COMPLETE
1065,,56:41.9,00:44.4,0 days 00:04:02.570426,1,32,,,1,5,9,10,,,,,,,,,,,,,,,,,,,,,,,,,,,,,,,,,,,,,,,7,7,mixed,,,,2,,,,1,5,,,,0.003788896,FAIL
1066,,00:44.4,04:57.3,0 days 00:04:12.829793,2,96,,,1,2,8,9,4,9,9,,,,,,10,6,6,3,7,10,7,3,7,2,10,3,,,,,,,,,,,,,,,,,,,8,5,mixed,mixed,mixed,normal,5,10,2,,4,2,1,5,2,0.001619271,FAIL
1067,509.7894287,04:57.3,09:04.6,0 days 00:04:07.318540,1,8,,,1,2,,,,,,,,,,,2,4,,,,,,,,,2,4,3,6,10,7,,,,,,,,,,,,,,,6,4,normal,mixed,mixed,normal,,2,6,,4,9,9,5,2,0.001404486,COMPLETE
1068,250.4047394,09:04.6,13:12.0,0 days 00:04:07.390577,3,128,16,16,3,5,,,,,,,,,,,5,7,,,,,,,,,,,,,,,,,,,,,,,,,,,,,4,6,normal,mixed,,,,2,,,2,6,2,,,0.009584019,COMPLETE
1069,785.847229,13:12.0,17:15.3,0 days 00:04:03.294606,3,64,,,1,3,,,,,,,,,,,,,,,,,,,,,4,9,5,,,,,,,,,,,,,,,,,,4,4,normal,normal,mixed,,,,3,,3,10,5,8,,0.005865807,COMPLETE
1070,,17:15.3,21:25.8,0 days 00:04:10.527354,3,96,,,1,2,5,2,4,7,10,6,6,,,,,,,,,,,,,,10,4,9,2,4,7,5,9,,,5,4,7,9,10,5,,,,,4,8,mixed,normal,mixed,mixed,7,,8,6,4,9,2,9,10,0.008966153,FAIL
1071,,21:25.8,25:30.0,0 days 00:04:04.136755,1,64,,,1,5,8,5,5,6,,,,,,,,,,,,,,,,,,,,,,,,,,,,,,,,,,,,,5,8,mixed,,,,4,,,,1,10,,,,0.002543705,FAIL
1072,241.4588165,25:30.0,29:59.2,0 days 00:04:29.230027,4,128,128,96,3,4,,,,,,,,,,,2,5,10,7,8,7,9,9,8,5,,,,,,,,,,,,,,,,,,,,,8,4,normal,mixed,normal,normal,,10,,,4,8,2,4,3,0.002535746,COMPLETE
1073,,29:59.2,34:03.5,0 days 00:04:04.270232,1,32,,,1,4,,,,,,,,,,,10,6,,,,,,,,,,,,,,,,,,,,,,,,,,,,,7,7,normal,mixed,,,,2,,,2,4,10,,,0.003088805,FAIL
1074,,34:03.5,38:12.2,0 days 00:04:08.767970,1,16,8,,2,2,8,5,5,,,,,,,,4,3,,,,,,,,,,,,,,,,,,,4,2,5,,,,,,,,4,8,mixed,mixed,normal,mixed,3,2,,3,4,10,8,2,9,0.004288367,FAIL
1075,,38:12.2,42:22.9,0 days 00:04:10.662357,1,96,16,,2,5,9,7,3,2,10,8,,,,,5,10,5,3,8,5,4,,,,6,10,,,,,,,,,8,7,10,,,,,,,,7,7,mixed,mixed,mixed,mixed,6,7,2,3,4,8,2,8,5,0.001100139,FAIL
1076,2279.190186,42:22.9,46:25.3,0 days 00:04:02.403621,4,8,8,,2,3,,,,,,,,,,,8,8,2,,,,,,,,,,,,,,,,,,,,,,,,,,,,7,6,normal,mixed,,,,3,,,2,1,10,,,0.00174491,COMPLETE
1077,,46:25.3,50:28.2,0 days 00:04:02.906794,3,64,32,,2,2,9,5,4,2,,,,,,,,,,,,,,,,,,,,,,,,,,,,,,,,,,,,,7,6,mixed,normal,normal,,4,,,,3,3,8,7,,0.001344755,FAIL
1078,511.5044556,50:28.2,54:44.5,0 days 00:04:16.276314,4,96,128,,2,4,,,,,,,,,,,5,,,,,,,,,,,,,,,,,,,,,,,,,,,,,,5,7,normal,mixed,normal,,,1,,,3,1,10,4,,0.009693837,COMPLETE
1079,,54:44.5,58:51.9,0 days 00:04:07.385286,3,32,16,,2,5,6,7,6,10,,,,,,,5,6,7,,,,,,,,,,,,,,,,,,,,,,,,,,,,7,8,mixed,mixed,,,4,3,,,2,1,1,,,0.003389628,FAIL
1080,,58:51.9,02:57.5,0 days 00:04:05.594935,2,32,,,1,5,7,8,9,7,4,8,3,3,,,,,,,,,,,,,,,,,,,,,,,,,,,,,,,,,7,5,mixed,normal,,,8,,,,2,2,3,,,0.001438227,FAIL
1081,,02:57.5,07:08.4,0 days 00:04:10.915966,4,128,,,1,3,7,9,3,2,7,9,9,2,5,5,7,2,6,10,2,2,6,8,9,2,,,,,,,,,,,,,,,,,,,,,8,4,mixed,mixed,,,10,10,,,2,5,9,,,0.007254868,FAIL
1082,,07:08.4,11:21.8,0 days 00:04:13.443525,4,32,8,96,3,2,7,2,8,5,3,4,2,10,10,7,,,,,,,,,,,4,2,10,2,2,4,,,,,,,,,,,,,,,6,5,mixed,normal,mixed,,10,,6,,3,5,6,4,,0.00375948,FAIL
1083,,11:21.8,15:35.1,0 days 00:04:13.288040,3,32,16,64,3,5,3,9,8,7,2,4,8,,,,10,5,10,9,10,10,,,,,4,4,10,4,5,4,10,4,,,,,,,,,,,,,3,3,mixed,mixed,mixed,,7,6,8,,3,6,10,4,,0.0077513,FAIL
1084,948.5166626,15:35.1,19:50.7,0 days 00:04:15.594901,4,128,32,96,3,3,,,,,,,,,,,,,,,,,,,,,,,,,,,,,,,,,,,,,,,,,5,5,normal,normal,,,,,,,2,1,8,,,0.002147872,COMPLETE
1085,,19:50.7,24:01.3,0 days 00:04:10.564733,3,32,,,1,3,2,7,2,9,2,,,,,,7,5,8,5,5,9,5,5,2,8,,,,,,,,,,,,,,,,,,,,,6,8,mixed,mixed,normal,,5,10,,,3,2,4,5,,0.002016691,FAIL
1086,704.333313,24:01.3,28:04.9,0 days 00:04:03.642361,1,128,,,1,3,,,,,,,,,,,3,3,4,5,,,,,,,,,,,,,,,,,,,,,,,,,,,4,4,normal,mixed,normal,,,4,,,3,3,7,4,,0.003728656,COMPLETE
1087,,28:04.9,32:10.6,0 days 00:04:05.638751,2,16,,,1,4,5,4,10,,,,,,,,,,,,,,,,,,7,4,4,9,3,5,9,4,,,,,,,,,,,,,5,6,mixed,normal,mixed,,3,,8,,3,5,5,8,,0.008806213,FAIL
1088,,32:10.6,36:16.3,0 days 00:04:05.739664,2,96,32,32,3,4,8,8,8,9,6,,,,,,,,,,,,,,,,,,,,,,,,,,,,,,,,,,,,7,8,mixed,normal,,,5,,,,2,1,2,,,0.002902719,FAIL
1089,,36:16.3,40:26.4,0 days 00:04:10.101794,2,64,128,8,3,2,4,9,10,9,3,10,6,5,6,,,,,,,,,,,,,,,,,,,,,,,,,,,,,,,,6,5,mixed,normal,,,9,,,,2,9,7,,,0.008396035,FAIL
1090,,40:26.4,44:29.1,0 days 00:04:02.652192,3,128,16,,2,4,3,7,9,10,8,3,2,,,,,,,,,,,,,,,,,,,,,,,,,,,,,,,,,,4,7,mixed,,,,7,,,,1,4,,,,0.001525509,FAIL
