number,value,datetime_start,datetime_complete,duration,params_gat_heads,params_gat_hidden_0,params_gat_hidden_1,params_gat_hidden_2,params_gat_layers,params_gat_out,params_kan_arity_0_0,params_kan_arity_0_1,params_kan_arity_0_2,params_kan_arity_0_3,params_kan_arity_0_4,params_kan_arity_0_5,params_kan_arity_0_6,params_kan_arity_0_7,params_kan_arity_0_8,params_kan_arity_0_9,params_kan_arity_1_0,params_kan_arity_1_1,params_kan_arity_1_2,params_kan_arity_1_3,params_kan_arity_1_4,params_kan_arity_1_5,params_kan_arity_1_6,params_kan_arity_1_7,params_kan_arity_1_8,params_kan_arity_1_9,params_kan_arity_2_0,params_kan_arity_2_1,params_kan_arity_2_2,params_kan_arity_2_3,params_kan_arity_2_4,params_kan_arity_2_5,params_kan_arity_2_6,params_kan_arity_2_7,params_kan_arity_2_8,params_kan_arity_2_9,params_kan_arity_3_0,params_kan_arity_3_1,params_kan_arity_3_2,params_kan_arity_3_3,params_kan_arity_3_4,params_kan_arity_3_5,params_kan_arity_3_6,params_kan_arity_3_7,params_kan_arity_3_8,params_kan_arity_3_9,params_kan_grid,params_kan_k,params_kan_layer_type_0,params_kan_layer_type_1,params_kan_layer_type_2,params_kan_layer_type_3,params_kan_mult_nodes_0,params_kan_mult_nodes_1,params_kan_mult_nodes_2,params_kan_mult_nodes_3,params_kan_n_layers,params_kan_neurons_0,params_kan_neurons_1,params_kan_neurons_2,params_kan_neurons_3,params_lr,state
1213,,04:10.6,08:20.2,0 days 00:04:09.615597,2,96,8,16,3,5,10,4,10,6,2,5,2,10,,,3,7,10,6,10,10,10,10,5,5,8,10,2,5,4,10,10,,,,,,,,,,,,,,8,3,mixed,mixed,mixed,normal,8,10,7,,4,9,8,9,10,0.001213458,FAIL
1214,,08:20.2,12:29.2,0 days 00:04:09.003885,2,96,8,16,3,5,10,4,10,6,2,5,2,10,,,3,7,10,6,10,10,10,10,5,5,8,10,2,5,4,10,10,10,,,,,,,,,,,,,8,3,mixed,mixed,mixed,normal,8,10,8,,4,9,8,9,10,0.001240252,FAIL
1215,,12:29.2,16:41.2,0 days 00:04:11.945876,2,96,8,16,3,5,10,4,10,6,2,5,2,10,,,3,7,10,6,10,10,10,10,5,5,8,10,2,5,4,10,10,,,,,,,,,,,,,,8,3,mixed,mixed,mixed,normal,8,10,7,,4,9,8,9,10,0.004832724,FAIL
1216,,16:41.2,20:52.0,0 days 00:04:10.833232,2,96,8,16,3,5,10,4,10,6,2,10,2,10,,,3,7,10,6,10,9,10,10,5,4,8,10,2,5,4,10,10,10,,,,,,,,,,,,,8,3,mixed,mixed,mixed,normal,8,10,8,,4,9,8,9,10,0.001247024,FAIL
1217,,20:52.0,25:06.4,0 days 00:04:14.368735,2,96,8,16,3,5,10,4,10,6,2,5,2,10,,,3,7,5,5,10,10,10,10,5,,8,10,2,5,4,4,10,10,,,,,,,,,,,,,8,3,mixed,mixed,mixed,normal,8,9,8,,4,9,8,9,10,0.004735731,FAIL
1218,,25:06.4,29:20.9,0 days 00:04:14.507032,2,96,8,16,3,5,10,4,10,6,2,5,2,10,,,3,7,10,6,10,9,10,10,5,5,8,10,2,5,4,10,10,,,,,,,,,,,,,,8,3,mixed,mixed,mixed,normal,8,10,7,,4,9,8,9,10,0.001254974,FAIL
1219,,29:20.9,33:35.6,0 days 00:04:14.637565,2,96,8,16,3,5,10,4,10,6,2,5,2,10,,,3,7,10,6,10,10,10,10,5,5,8,10,2,5,4,10,10,,,,,,,,,,,,,,8,3,mixed,mixed,mixed,normal,8,10,7,,4,9,8,9,10,0.001253547,FAIL
1220,,33:35.6,37:47.2,0 days 00:04:11.603236,2,96,8,16,3,5,10,4,9,6,2,5,2,10,,,3,7,10,6,10,9,10,10,5,5,8,10,2,5,4,10,10,,,,,,,,,,,,,,8,3,mixed,mixed,mixed,normal,8,10,7,,4,9,8,9,10,0.00122602,FAIL
1221,,37:47.2,41:58.7,0 days 00:04:11.574742,2,96,8,16,3,5,10,4,10,6,2,5,2,9,,,3,7,10,6,10,9,10,10,5,5,8,10,2,6,4,10,10,,,,,,,,,,,,,,8,3,mixed,mixed,mixed,normal,8,10,7,,4,9,8,9,4,0.004620159,FAIL
1222,,41:58.7,46:12.3,0 days 00:04:13.558814,2,96,8,16,3,5,10,4,10,6,2,5,2,10,,,3,7,10,6,10,10,10,10,5,5,8,10,2,5,4,10,10,,,,,,,,,,,,,,8,3,mixed,mixed,mixed,normal,8,10,7,,4,9,8,9,10,0.00452853,FAIL
1223,,46:12.3,50:23.5,0 days 00:04:11.198108,2,96,8,16,3,5,10,4,10,6,2,5,3,10,,,3,7,10,6,10,10,10,10,6,5,8,10,2,5,4,10,10,,,,,,,,,,,,,,8,3,mixed,mixed,mixed,normal,8,10,7,,4,9,8,9,10,0.004743463,FAIL
1224,,50:23.5,54:37.8,0 days 00:04:14.245734,2,96,8,16,3,5,10,4,10,6,2,5,2,10,,,3,7,10,6,10,10,10,10,5,5,8,10,2,5,4,10,10,,,,,,,,,,,,,,8,3,mixed,mixed,mixed,normal,8,10,7,,4,9,8,9,10,0.001224003,FAIL
1225,,54:37.8,58:51.9,0 days 00:04:14.171435,2,96,8,16,3,5,10,4,10,6,2,5,2,10,,,3,7,10,6,10,10,10,10,5,5,8,10,2,5,4,10,10,,,,,,,,,,,,,,8,3,mixed,mixed,mixed,normal,8,10,7,,4,9,8,9,10,0.004659842,FAIL
1226,,58:51.9,03:05.1,0 days 00:04:13.215344,2,96,8,16,3,5,10,4,10,6,2,5,2,10,,,3,7,10,6,10,10,10,10,5,5,8,10,2,5,4,10,10,,,,,,,,,,,,,,8,3,mixed,mixed,mixed,normal,8,10,7,,4,9,8,9,10,0.004377503,FAIL
1227,,03:05.2,07:13.5,0 days 00:04:08.327982,2,96,8,16,3,5,10,4,10,6,2,5,2,10,,,3,7,10,6,10,10,10,10,5,5,8,10,2,6,4,10,10,,,,,,,,,,,,,,8,3,mixed,mixed,mixed,normal,8,10,7,,4,9,8,9,10,0.004433094,FAIL
1228,,07:13.5,11:25.6,0 days 00:04:12.095025,2,96,8,16,3,5,10,4,10,6,2,5,2,10,,,3,7,10,6,10,10,10,10,5,5,8,10,2,5,4,10,10,,,,,,,,,,,,,,8,3,mixed,mixed,mixed,normal,8,10,7,,4,9,8,9,4,0.004225791,FAIL
1229,,11:25.6,15:37.8,0 days 00:04:12.210103,2,96,8,16,3,5,10,5,10,6,2,5,3,10,,,3,7,5,6,10,10,10,10,5,4,8,10,2,5,4,10,10,,,,,,,,,,,,,,8,3,mixed,mixed,mixed,normal,8,10,7,,4,9,8,9,4,0.004573023,FAIL
1230,,15:37.8,19:49.5,0 days 00:04:11.695497,2,96,8,16,3,5,10,4,10,6,2,5,2,10,10,,3,7,10,6,10,10,10,10,5,5,7,10,2,5,4,10,10,,,,,,,,,,,,,,8,4,mixed,mixed,mixed,normal,9,10,7,,4,9,8,9,10,0.004259951,FAIL
1231,,19:49.5,24:03.2,0 days 00:04:13.711915,2,96,8,16,3,5,10,4,9,6,2,5,2,10,,,3,7,10,6,10,10,10,10,5,5,8,10,2,5,4,10,10,,,,,,,,,,,,,,8,3,mixed,mixed,mixed,normal,8,10,7,,4,9,8,9,10,0.004655072,FAIL
1232,,24:03.2,28:17.4,0 days 00:04:14.235177,2,96,8,16,3,5,10,4,10,6,2,5,2,10,,,3,7,5,6,9,9,10,10,5,5,8,10,2,5,4,10,10,,,,,,,,,,,,,,8,3,mixed,mixed,mixed,normal,8,10,7,,4,9,8,9,10,0.004412437,FAIL
1233,,28:17.5,32:32.4,0 days 00:04:14.922928,2,96,8,16,3,5,10,4,10,6,2,5,3,10,,,3,7,10,6,10,10,10,10,5,5,8,8,2,5,4,5,10,,,,,,,,,,,,,,8,3,mixed,mixed,mixed,normal,8,10,7,,4,9,8,9,10,0.004495087,FAIL
1234,,32:32.4,36:45.4,0 days 00:04:13.004989,2,96,8,16,3,5,9,5,10,6,2,5,3,10,,,3,7,10,6,10,10,10,10,5,5,8,10,2,5,4,10,10,,,,,,,,,,,,,,8,3,mixed,mixed,mixed,normal,8,10,7,,4,9,8,9,10,0.004644247,FAIL
1235,,36:45.4,40:59.3,0 days 00:04:13.932602,2,96,8,16,3,5,10,4,9,6,2,5,2,10,,,3,7,10,6,10,10,10,10,5,5,8,10,2,5,4,10,10,,,,,,,,,,,,,,8,3,mixed,mixed,mixed,normal,8,10,7,,4,9,2,9,4,0.004959644,FAIL
1236,,40:59.3,45:09.0,0 days 00:04:09.721432,2,96,8,16,3,5,10,4,9,6,2,5,2,10,,,3,7,10,6,10,9,10,10,5,5,8,10,2,5,4,10,10,,,,,,,,,,,,,,8,3,mixed,mixed,mixed,normal,8,10,7,,4,9,8,9,10,0.00445725,FAIL
1237,,45:09.0,49:20.0,0 days 00:04:10.972531,2,96,8,16,3,5,10,4,10,6,2,5,2,10,,,3,7,5,6,10,10,10,10,5,5,8,10,2,5,4,10,10,,,,,,,,,,,,,,8,3,mixed,mixed,mixed,normal,8,10,7,,4,9,8,9,10,0.001258064,FAIL
1238,,49:20.0,53:31.3,0 days 00:04:11.290174,2,96,8,16,3,5,10,5,10,6,2,5,2,10,,,3,7,5,6,10,10,10,10,5,5,8,10,2,5,4,4,10,,,,,,,,,,,,,,8,3,mixed,mixed,mixed,normal,8,10,7,,4,9,8,9,10,0.00123549,FAIL
1239,,53:31.3,57:42.6,0 days 00:04:11.260215,2,96,8,16,3,5,10,4,9,6,2,5,2,10,,,3,7,10,6,10,9,10,10,5,5,8,10,2,5,4,10,10,,,,,,,,,,,,,,8,3,mixed,mixed,mixed,normal,8,10,7,,4,9,8,9,10,0.002854989,FAIL
1240,,57:42.6,01:55.4,0 days 00:04:12.840057,2,96,8,16,3,5,10,4,10,6,2,5,2,9,,,3,7,10,6,10,10,10,10,5,5,8,8,2,5,4,10,10,,,,,,,,,,,,,,8,3,mixed,mixed,mixed,normal,8,10,7,,4,9,8,9,10,0.004667564,FAIL
1241,,01:55.4,06:07.7,0 days 00:04:12.248130,2,96,8,16,3,5,10,4,10,6,2,5,2,10,,,3,7,10,6,10,10,10,10,5,5,8,10,2,5,4,10,6,,,,,,,,,,,,,,8,3,mixed,mixed,mixed,normal,8,10,7,,4,9,8,9,10,0.00491856,FAIL
1242,,06:07.7,10:14.9,0 days 00:04:07.228940,2,96,8,16,3,5,10,4,9,6,2,5,4,10,,,3,7,10,6,10,10,10,10,5,5,8,10,2,5,4,10,10,,,,,,,,,,,,,,8,3,mixed,mixed,mixed,normal,8,10,7,,4,9,8,9,10,0.005035523,FAIL
1243,,10:14.9,14:24.7,0 days 00:04:09.807318,2,96,8,16,3,5,10,4,10,6,2,5,2,9,,,3,7,10,6,10,5,10,10,5,5,8,10,2,5,4,10,10,,,,,,,,,,,,,,8,3,mixed,mixed,mixed,normal,8,10,7,,4,9,8,9,4,0.00476548,FAIL
1244,,14:24.7,18:35.0,0 days 00:04:10.238275,2,96,8,16,3,5,10,4,10,6,2,5,2,10,,,3,7,10,6,10,8,10,10,5,5,8,8,2,5,4,10,10,2,,,,,,,,,,,,,8,3,mixed,mixed,mixed,normal,8,10,8,,4,9,8,9,10,0.004432243,FAIL
1245,,18:35.0,22:44.8,0 days 00:04:09.797832,2,96,8,16,3,5,10,4,10,6,2,5,2,10,,,3,7,5,6,10,10,10,10,5,5,8,10,2,5,4,10,10,,,,,,,,,,,,,,8,3,mixed,mixed,mixed,normal,8,10,7,,4,9,8,9,10,0.004596123,FAIL
1246,,22:44.8,26:54.6,0 days 00:04:09.852569,2,96,8,16,3,5,10,4,10,6,2,5,3,10,,,3,7,10,6,10,10,10,10,5,5,8,10,2,5,4,10,10,,,,,,,,,,,,,,8,3,mixed,mixed,mixed,normal,8,10,7,,4,9,8,9,10,0.003015575,FAIL
1247,,26:54.6,31:06.6,0 days 00:04:11.962692,2,96,8,16,3,5,10,5,10,6,2,5,2,10,,,3,7,5,6,10,9,10,10,5,5,8,10,2,5,4,10,10,,,,,,,,,,,,,,8,3,mixed,mixed,mixed,normal,8,10,7,,4,9,8,9,10,0.004439851,FAIL
1248,,31:06.6,35:15.3,0 days 00:04:08.663447,2,96,8,16,3,5,10,4,8,6,2,10,2,10,,,3,7,10,6,10,9,10,10,6,5,8,10,2,5,4,10,10,,,,,,,,,,,,,,8,3,mixed,mixed,mixed,normal,8,10,7,,4,9,8,9,10,0.004472089,FAIL
1249,,35:15.3,39:23.8,0 days 00:04:08.554423,2,96,8,16,3,5,10,4,10,5,2,10,2,10,,,3,7,10,6,10,10,10,10,5,5,8,10,2,5,4,10,10,,,,,,,,,,,,,,8,3,mixed,mixed,mixed,normal,8,10,7,,4,9,8,9,10,0.004615219,FAIL
1250,,39:23.8,43:33.8,0 days 00:04:10.018527,2,96,8,16,3,5,10,4,10,6,2,5,2,10,,,3,7,10,6,10,10,10,10,5,5,8,10,2,5,4,10,10,,,,,,,,,,,,,,8,3,mixed,mixed,mixed,normal,8,10,7,,4,9,8,9,10,0.00124985,FAIL
1251,,43:33.8,47:41.6,0 days 00:04:07.734998,2,96,8,16,3,5,10,4,10,6,2,5,2,10,,,3,7,10,6,10,10,10,10,5,5,8,10,2,5,4,10,10,,,,,,,,,,,,,,8,4,mixed,mixed,mixed,normal,8,10,7,,4,9,8,9,10,0.002967015,FAIL
1252,,47:41.6,51:51.7,0 days 00:04:10.135082,2,96,8,16,3,5,10,4,10,6,2,5,2,10,,,3,7,10,6,10,9,10,10,5,5,8,10,2,5,4,10,10,,,,,,,,,,,,,,8,3,mixed,mixed,mixed,normal,8,10,7,,4,9,8,9,10,0.001238791,FAIL
1253,,51:51.7,56:02.5,0 days 00:04:10.787288,2,96,8,16,3,5,10,5,10,6,2,10,2,10,,,3,7,10,6,10,10,10,10,5,5,8,10,2,5,4,10,10,,,,,,,,,,,,,,8,3,mixed,mixed,mixed,normal,8,10,7,,4,9,8,9,10,0.002867493,FAIL
1254,,56:02.5,00:15.3,0 days 00:04:12.752307,2,96,8,16,3,5,,,,,,,,,,,3,7,10,6,10,9,10,10,5,5,8,10,2,5,4,10,10,,,,,,,,,,,,,,8,3,normal,mixed,mixed,normal,,10,7,,4,9,8,9,10,0.001256429,FAIL
1255,,00:15.3,04:26.9,0 days 00:04:11.626938,2,96,8,16,3,5,10,4,10,6,2,10,2,10,,,3,7,10,6,10,10,10,10,6,5,7,10,2,5,4,10,10,,,,,,,,,,,,,,8,3,mixed,mixed,mixed,normal,8,10,7,,4,9,8,9,10,0.004581131,FAIL
1256,,04:26.9,08:38.1,0 days 00:04:11.169146,2,96,8,16,3,5,10,4,10,6,2,5,2,10,,,3,7,10,6,10,10,10,10,5,5,8,10,2,5,4,10,10,,,,,,,,,,,,,,8,3,mixed,mixed,mixed,normal,8,10,7,,4,9,8,9,10,0.00480164,FAIL
1257,,08:38.1,12:49.1,0 days 00:04:11.061697,2,96,8,16,3,5,10,4,10,6,2,5,2,10,,,3,7,10,6,10,10,10,10,5,5,8,10,2,5,4,10,10,,,,,,,,,,,,,,8,3,mixed,mixed,mixed,normal,8,10,7,,4,9,8,9,10,0.004607443,FAIL
1258,,12:49.1,17:01.0,0 days 00:04:11.864716,2,96,8,16,3,5,9,4,10,6,2,5,2,10,,,3,7,10,6,10,10,10,10,5,5,8,10,2,5,4,10,10,,,,,,,,,,,,,,8,3,mixed,mixed,mixed,normal,8,10,7,,4,9,8,9,4,0.004544779,FAIL
1259,,17:01.0,21:10.9,0 days 00:04:09.904205,2,96,8,16,3,5,10,4,10,6,2,5,2,10,,,3,7,10,6,10,10,10,10,5,5,8,10,2,5,4,10,10,,,,,,,,,,,,,,8,3,mixed,mixed,mixed,normal,8,10,7,,4,9,8,9,10,0.001240224,FAIL
1260,,21:10.9,25:21.5,0 days 00:04:10.630466,2,96,8,16,3,5,10,4,10,6,2,5,2,10,10,,3,7,10,6,10,10,10,10,5,5,8,10,2,6,4,10,10,,,,,,,,,,,,,,8,3,mixed,mixed,mixed,normal,9,10,7,,4,9,8,9,10,0.004399411,FAIL
1261,,25:21.5,29:27.2,0 days 00:04:05.683182,2,96,8,16,3,5,10,4,10,6,2,10,2,10,,,3,7,10,6,10,9,10,10,5,5,8,10,2,5,5,4,10,,,,,,,,,,,,,,8,3,mixed,mixed,mixed,normal,8,10,7,,4,9,2,9,4,0.004474185,FAIL
1262,,29:27.2,33:35.3,0 days 00:04:08.043555,2,96,8,16,3,5,10,4,9,6,2,5,2,10,,,3,7,10,6,10,9,10,10,5,5,8,10,2,5,4,4,10,,,,,,,,,,,,,,8,3,mixed,mixed,mixed,normal,8,10,7,,4,9,8,9,4,0.004707454,FAIL
1263,,33:35.3,37:40.1,0 days 00:04:04.799846,2,96,8,16,3,5,10,5,9,6,2,10,2,10,,,3,7,10,6,10,10,10,10,5,4,8,10,2,5,4,4,10,,,,,,,,,,,,,,8,3,mixed,mixed,mixed,normal,8,10,7,,4,9,8,9,10,0.001259107,FAIL
1264,,37:40.1,41:49.5,0 days 00:04:09.439713,2,96,8,16,3,5,10,4,10,6,2,5,3,10,,,3,7,10,6,10,10,10,10,5,5,8,10,2,5,4,10,10,,,,,,,,,,,,,,8,3,mixed,mixed,mixed,normal,8,10,7,,4,9,8,9,10,0.004694602,FAIL
1265,,41:49.5,45:55.9,0 days 00:04:06.410568,2,96,8,16,3,5,,,,,,,,,,,3,7,10,6,10,10,10,10,5,5,8,10,2,5,4,10,10,,,,,,,,,,,,,,8,3,normal,mixed,mixed,normal,,10,7,,4,9,8,9,4,0.001219969,FAIL
1266,,45:55.9,50:01.7,0 days 00:04:05.774422,2,96,8,16,3,5,10,4,9,6,2,5,2,10,,,3,7,10,6,10,10,10,10,5,5,8,10,2,5,4,10,10,,,,,,,,,,,,,,8,3,mixed,mixed,mixed,normal,8,10,7,,4,9,8,9,10,0.001229359,FAIL
1267,,50:01.7,54:10.4,0 days 00:04:08.647019,2,96,8,16,3,5,10,4,9,6,2,5,3,10,,,3,7,10,6,10,9,10,10,5,5,7,10,2,5,4,4,10,,,,,,,,,,,,,,8,3,mixed,mixed,mixed,normal,8,10,7,,4,9,2,9,10,0.00463476,FAIL
1268,,54:10.4,58:15.6,0 days 00:04:05.256380,2,96,8,16,3,5,9,5,10,6,2,5,4,10,,,3,7,10,6,10,9,10,10,5,5,8,10,2,6,4,10,10,,,,,,,,,,,,,,8,3,mixed,mixed,mixed,normal,8,10,7,,4,9,8,9,10,0.004872325,FAIL
1269,,58:15.6,02:19.0,0 days 00:04:03.353269,2,96,8,16,3,5,9,4,10,6,7,5,2,10,,,3,7,10,6,10,9,10,10,5,5,8,10,2,5,4,10,10,,,,,,,,,,,,,,8,3,mixed,mixed,mixed,normal,8,10,7,,4,9,8,9,10,0.004632581,FAIL
1270,,02:19.0,06:23.6,0 days 00:04:04.649898,2,96,8,16,3,5,10,4,10,6,2,5,3,10,,,3,7,10,6,10,10,10,10,5,5,8,10,2,5,4,10,10,,,,,,,,,,,,,,8,3,mixed,mixed,mixed,normal,8,10,7,,4,9,8,9,10,0.004556718,FAIL
1271,,06:23.6,10:28.3,0 days 00:04:04.700932,2,96,8,16,3,5,10,4,10,6,2,5,2,10,,,3,7,5,6,10,9,10,10,5,5,8,10,2,5,4,4,10,,,,,,,,,,,,,,8,4,mixed,mixed,mixed,normal,8,10,7,,4,9,8,9,10,0.004621622,FAIL
1272,,10:28.3,14:36.6,0 days 00:04:08.241624,2,96,8,16,3,5,10,4,10,6,2,5,2,8,,,3,7,5,6,10,10,10,10,5,5,8,10,2,5,4,10,10,,,,,,,,,,,,,,8,3,mixed,mixed,mixed,normal,8,10,7,,4,9,8,9,10,0.004523398,FAIL
1273,,14:36.6,18:48.5,0 days 00:04:11.942090,2,96,8,16,3,5,10,4,10,6,2,5,2,10,,,3,7,10,6,10,9,10,10,5,,8,10,2,5,4,10,10,,,,,,,,,,,,,,8,3,mixed,mixed,mixed,normal,8,9,7,,4,9,8,9,10,0.004619607,FAIL
1274,,18:48.5,22:58.7,0 days 00:04:10.159908,2,96,8,16,3,5,10,4,10,6,2,5,2,10,,,3,7,5,6,10,10,10,10,5,5,8,10,2,5,4,10,10,,,,,,,,,,,,,,8,3,mixed,mixed,mixed,normal,8,10,7,,4,9,8,9,10,0.004510162,FAIL
1275,,22:58.7,27:07.3,0 days 00:04:08.557412,2,96,8,16,3,5,9,4,10,6,2,5,3,10,,,3,7,10,6,10,10,10,10,5,5,8,10,2,5,4,10,10,,,,,,,,,,,,,,8,3,mixed,mixed,mixed,normal,8,10,7,,4,9,8,9,4,0.004658015,FAIL
1276,,27:07.3,31:11.1,0 days 00:04:03.877663,2,96,8,16,3,5,10,4,10,6,2,5,4,10,,,3,7,10,6,10,10,10,10,5,5,8,10,2,5,4,4,10,,,,,,,,,,,,,,8,4,mixed,mixed,mixed,normal,8,10,7,,4,9,8,9,10,0.001234299,FAIL
1277,,31:11.1,35:18.1,0 days 00:04:07.009801,2,96,8,16,3,5,10,4,8,6,2,5,2,10,,,3,7,10,6,10,10,10,10,5,5,8,10,2,5,4,4,10,,,,,,,,,,,,,,8,3,mixed,mixed,mixed,normal,8,10,7,,4,9,8,9,10,0.00298323,FAIL
1278,,35:18.2,39:28.8,0 days 00:04:10.662797,2,96,8,16,3,5,10,4,10,6,2,5,2,10,,,3,7,10,6,10,10,10,10,5,5,8,10,2,5,4,4,10,,,,,,,,,,,,,,8,3,mixed,mixed,mixed,normal,8,10,7,,4,9,8,9,4,0.004541351,FAIL
1279,,39:28.8,43:36.7,0 days 00:04:07.859611,2,96,8,16,3,5,10,4,10,6,2,5,2,10,,,3,7,10,6,10,10,10,10,5,5,8,10,2,5,4,10,10,,,,,,,,,,,,,,8,3,mixed,mixed,mixed,normal,8,10,7,,4,9,8,9,10,0.002817195,FAIL
1280,,43:36.7,47:44.6,0 days 00:04:07.965430,2,96,8,16,3,5,10,4,9,6,2,5,2,9,,,3,7,10,6,10,10,10,10,5,5,8,8,2,5,4,10,10,,,,,,,,,,,,,,8,3,mixed,mixed,mixed,normal,8,10,7,,4,9,8,9,10,0.004323349,FAIL
1281,,47:44.6,51:52.0,0 days 00:04:07.393192,2,96,8,16,3,5,10,4,10,6,2,5,2,10,,,3,7,5,6,10,10,10,10,5,5,8,10,2,5,4,4,10,,,,,,,,,,,,,,8,4,mixed,mixed,mixed,normal,8,10,7,,4,9,8,9,10,0.002893664,FAIL
1282,,51:52.0,56:03.8,0 days 00:04:11.729309,2,96,8,16,3,5,10,4,10,6,2,5,3,10,,,3,7,10,6,10,10,10,10,5,5,8,10,2,5,4,5,10,,,,,,,,,,,,,,8,3,mixed,mixed,mixed,normal,8,10,7,,4,9,8,9,10,0.00453198,FAIL
1283,,56:03.8,00:17.4,0 days 00:04:13.589097,2,96,8,16,3,5,10,4,10,6,2,5,2,10,,,3,7,5,6,10,10,10,10,5,5,8,10,2,5,4,10,10,,,,,,,,,,,,,,8,3,mixed,mixed,mixed,normal,8,10,7,,4,9,2,9,10,0.00460966,FAIL
1284,,00:17.4,04:28.9,0 days 00:04:11.545669,2,96,8,16,3,5,10,5,10,6,2,5,2,10,,,3,7,10,6,10,10,10,10,6,5,8,10,2,5,4,10,10,,,,,,,,,,,,,,8,3,mixed,mixed,mixed,normal,8,10,7,,4,9,8,9,10,0.00291266,FAIL
1285,,04:28.9,08:42.2,0 days 00:04:13.291202,2,96,8,16,3,5,10,4,10,6,2,5,2,10,,,3,7,10,6,10,10,10,10,5,5,8,10,2,5,4,10,10,,,,,,,,,,,,,,8,3,mixed,mixed,mixed,normal,8,10,7,,4,9,8,9,10,0.004292767,FAIL
1286,,08:42.2,12:54.5,0 days 00:04:12.298740,2,96,8,16,3,5,10,4,10,6,2,5,2,10,,,3,7,10,6,10,10,10,10,5,5,8,10,4,5,4,10,10,,,,,,,,,,,,,,8,3,mixed,mixed,mixed,normal,8,10,7,,4,9,8,9,4,0.004704114,FAIL
1287,,12:54.5,17:08.4,0 days 00:04:13.874513,2,96,8,16,3,5,10,4,10,6,2,5,2,10,,,3,7,10,6,10,10,10,10,5,,8,10,2,5,4,4,10,,,,,,,,,,,,,,8,3,mixed,mixed,mixed,normal,8,9,7,,4,9,8,9,10,0.004562646,FAIL
1288,,17:08.4,21:23.4,0 days 00:04:14.979534,2,96,8,16,3,5,10,4,9,6,2,5,2,10,,,3,7,10,6,10,9,10,10,5,5,8,10,2,5,4,10,10,,,,,,,,,,,,,,8,3,mixed,mixed,mixed,normal,8,10,7,,4,9,2,9,10,0.004754175,FAIL
1289,,21:23.4,25:36.9,0 days 00:04:13.556020,2,96,8,16,3,5,10,4,9,6,2,5,2,10,,,3,7,10,6,10,10,10,10,5,5,8,10,2,5,4,10,10,,,,,,,,,,,,,,8,3,mixed,mixed,mixed,normal,8,10,7,,4,9,8,9,10,0.001261599,FAIL
1290,,25:36.9,29:52.5,0 days 00:04:15.574841,2,96,8,16,3,5,10,4,9,6,2,5,2,9,,,3,7,10,6,10,9,10,10,5,5,8,10,2,5,4,10,10,,,,,,,,,,,,,,8,3,mixed,mixed,mixed,normal,8,10,7,,4,9,8,9,10,0.004280384,FAIL
1291,,29:52.5,34:05.1,0 days 00:04:12.596149,2,96,8,16,3,5,10,4,10,6,2,5,3,10,,,3,7,10,6,10,10,10,10,5,5,8,10,2,5,4,10,10,,,,,,,,,,,,,,8,3,mixed,mixed,mixed,normal,8,10,7,,4,9,8,9,10,0.001217937,FAIL
1292,,34:05.1,38:19.2,0 days 00:04:14.107363,2,96,8,16,3,5,10,4,9,6,2,5,2,9,,,3,7,10,6,10,10,10,10,5,5,8,10,4,5,4,10,10,,,,,,,,,,,,,,8,3,mixed,mixed,mixed,normal,8,10,7,,4,9,8,9,10,0.00125256,FAIL
1293,,38:19.2,42:31.4,0 days 00:04:12.129741,2,96,8,16,3,5,10,4,10,6,2,5,3,10,,,3,7,10,6,10,9,10,10,5,5,8,10,2,5,4,10,10,,,,,,,,,,,,,,8,3,mixed,mixed,mixed,normal,8,10,7,,4,9,8,9,10,0.004642712,FAIL
1294,,42:31.4,46:44.3,0 days 00:04:12.969475,2,96,8,16,3,5,10,4,10,6,2,5,2,10,,,3,7,10,6,10,10,10,10,5,5,8,10,2,5,4,10,10,,,,,,,,,,,,,,8,3,mixed,mixed,mixed,normal,8,10,7,,4,9,8,9,10,0.004728952,FAIL
1295,,46:44.3,50:55.2,0 days 00:04:10.892791,2,96,8,16,3,5,10,4,10,6,2,5,3,10,,,3,7,10,6,10,10,10,10,5,5,8,10,2,5,4,10,10,,,,,,,,,,,,,,8,3,mixed,mixed,mixed,normal,8,10,7,,4,9,8,9,10,0.00470575,FAIL
1296,,50:55.2,55:00.1,0 days 00:04:04.843523,2,96,8,16,3,5,10,4,9,6,2,5,2,10,,,3,7,10,6,10,10,10,10,5,4,8,10,2,5,4,10,10,,,,,,,,,,,,,,8,3,mixed,mixed,mixed,normal,8,10,7,,4,9,8,9,10,0.004282993,FAIL
1297,,55:00.1,59:07.9,0 days 00:04:07.777870,2,96,8,16,3,5,10,4,10,6,2,5,2,9,10,,3,7,10,6,10,9,10,10,5,5,8,10,2,5,4,10,10,,,,,,,,,,,,,,8,4,mixed,mixed,mixed,normal,9,10,7,,4,9,8,9,10,0.001251163,FAIL
1298,,59:07.9,03:12.8,0 days 00:04:04.931848,2,96,8,16,3,5,10,4,10,6,7,5,3,9,,,3,7,10,6,10,10,10,10,5,5,8,10,2,5,4,10,10,,,,,,,,,,,,,,8,3,mixed,mixed,mixed,normal,8,10,7,,4,9,8,9,10,0.00460407,FAIL
1299,,03:12.8,07:18.9,0 days 00:04:06.057914,2,96,8,16,3,5,10,4,9,6,2,5,3,9,,,3,7,5,6,10,9,10,10,5,5,8,10,2,5,4,10,10,,,,,,,,,,,,,,8,3,mixed,mixed,mixed,normal,8,10,7,,4,9,8,9,10,0.004376793,FAIL
1300,,07:18.9,11:27.5,0 days 00:04:08.634493,2,96,8,16,3,5,10,4,8,6,2,5,3,10,,,3,7,10,6,10,10,10,10,5,5,7,10,2,5,4,10,10,,,,,,,,,,,,,,8,3,mixed,mixed,mixed,normal,8,10,7,,4,9,8,9,10,0.001240924,FAIL
1301,,11:27.5,15:36.0,0 days 00:04:08.553147,2,96,8,16,3,5,10,4,10,6,2,5,2,10,,,3,7,10,6,10,10,10,10,5,5,8,10,2,5,4,10,10,,,,,,,,,,,,,,8,3,mixed,mixed,mixed,normal,8,10,7,,4,9,8,9,10,0.004663861,FAIL
1302,,15:36.1,19:46.0,0 days 00:04:09.904672,2,96,8,16,3,5,10,4,10,6,2,5,2,10,,,3,7,10,6,10,10,10,10,5,5,8,10,2,5,4,10,10,,,,,,,,,,,,,,8,3,mixed,mixed,mixed,normal,8,10,7,,4,9,8,9,4,0.001229169,FAIL
1303,,19:46.0,23:56.5,0 days 00:04:10.561906,2,96,8,16,3,5,10,4,9,6,2,5,3,10,,,3,7,5,6,10,10,10,10,5,5,8,10,2,5,4,10,10,,,,,,,,,,,,,,8,3,mixed,mixed,mixed,normal,8,10,7,,4,9,2,9,10,0.001241633,FAIL
1304,,23:56.5,28:07.8,0 days 00:04:11.240025,2,96,8,16,3,5,10,4,10,6,2,10,2,10,,,3,7,10,6,10,10,10,10,6,5,8,10,2,5,4,10,10,,,,,,,,,,,,,,8,3,mixed,mixed,mixed,normal,8,10,7,,4,9,6,9,10,0.004954048,FAIL
1305,,28:07.8,32:17.7,0 days 00:04:09.914536,2,96,8,16,3,5,10,4,10,6,2,5,2,9,,,3,7,10,6,10,10,10,10,5,,8,10,2,5,4,10,10,,,,,,,,,,,,,,8,3,mixed,mixed,mixed,normal,8,9,7,,4,9,2,9,10,0.001231906,FAIL
1306,,32:17.7,36:27.3,0 days 00:04:09.638628,2,96,8,16,3,5,10,4,10,6,2,5,2,10,,,3,7,10,6,10,10,10,10,6,5,8,10,2,5,4,10,10,,,,,,,,,,,,,,8,3,mixed,mixed,mixed,normal,8,10,7,,4,9,8,9,10,0.004808814,FAIL
1307,,36:27.3,40:34.1,0 days 00:04:06.772355,2,96,8,16,3,5,10,4,10,6,2,5,2,10,,,3,7,10,6,10,10,10,10,5,5,8,10,2,5,4,10,10,,,,,,,,,,,,,,8,3,mixed,mixed,mixed,normal,8,10,7,,4,9,8,9,10,0.00289555,FAIL
1308,,40:34.1,44:41.6,0 days 00:04:07.461242,2,96,8,16,3,5,10,4,10,6,8,5,4,10,,,3,7,10,6,10,10,10,10,5,5,8,10,2,5,4,10,10,,,,,,,,,,,,,,8,3,mixed,mixed,mixed,normal,8,10,7,,4,9,8,9,10,0.004942529,FAIL
1309,,44:41.6,48:54.8,0 days 00:04:13.214879,2,96,8,16,3,5,10,5,10,6,2,5,2,10,,,3,7,10,6,10,10,10,10,5,5,8,10,2,5,4,10,10,,,,,,,,,,,,,,8,3,mixed,mixed,mixed,normal,8,10,7,,4,9,8,9,10,0.004815539,FAIL
1310,,48:54.8,53:07.9,0 days 00:04:13.098130,2,96,8,16,3,5,10,4,10,6,2,5,2,9,,,3,7,5,6,10,10,10,10,5,,8,10,4,5,4,10,10,,,,,,,,,,,,,,8,3,mixed,mixed,mixed,normal,8,9,7,,4,9,8,9,10,0.004433486,FAIL
1311,,53:07.9,57:18.7,0 days 00:04:10.767874,2,96,8,16,3,5,10,4,10,6,2,5,2,9,,,3,7,10,6,10,10,10,10,5,5,8,10,2,5,4,10,10,,,,,,,,,,,,,,8,3,mixed,mixed,mixed,normal,8,10,7,,4,9,8,9,10,0.001259691,FAIL
1312,,57:18.7,01:26.1,0 days 00:04:07.407299,2,96,8,16,3,5,10,4,10,6,2,5,2,10,,,3,7,10,6,10,10,10,10,5,5,8,10,2,5,4,4,10,,,,,,,,,,,,,,8,3,mixed,mixed,mixed,normal,8,10,7,,4,9,8,9,10,0.002900345,FAIL
1313,,01:26.1,05:35.0,0 days 00:04:08.884858,2,96,8,16,3,5,10,4,10,6,2,5,3,10,,,3,7,10,6,10,10,10,10,5,5,8,10,2,5,4,10,10,,,,,,,,,,,,,,8,4,mixed,mixed,mixed,normal,8,10,7,,4,9,8,9,10,0.004342642,FAIL
1314,,05:35.0,09:41.8,0 days 00:04:06.801827,2,96,8,16,3,5,10,4,10,6,2,5,2,9,,,3,7,10,6,10,9,10,10,5,5,8,10,4,5,4,10,10,,,,,,,,,,,,,,8,3,mixed,mixed,mixed,normal,8,10,7,,4,9,8,9,10,0.001243234,FAIL
1315,,09:41.8,13:51.1,0 days 00:04:09.354347,2,96,8,16,3,5,10,4,10,6,2,5,2,9,,,3,7,10,6,10,10,10,10,5,5,8,10,2,5,4,10,10,,,,,,,,,,,,,,8,3,mixed,mixed,mixed,normal,8,10,7,,4,9,8,9,10,0.004671844,FAIL
