number,value,datetime_start,datetime_complete,duration,params_gat_heads,params_gat_hidden_0,params_gat_hidden_1,params_gat_hidden_2,params_gat_layers,params_gat_out,params_kan_arity_0_0,params_kan_arity_0_1,params_kan_arity_0_2,params_kan_arity_0_3,params_kan_arity_0_4,params_kan_arity_0_5,params_kan_arity_0_6,params_kan_arity_0_7,params_kan_arity_0_8,params_kan_arity_0_9,params_kan_arity_1_0,params_kan_arity_1_1,params_kan_arity_1_2,params_kan_arity_1_3,params_kan_arity_1_4,params_kan_arity_1_5,params_kan_arity_1_6,params_kan_arity_1_7,params_kan_arity_1_8,params_kan_arity_1_9,params_kan_arity_2_0,params_kan_arity_2_1,params_kan_arity_2_2,params_kan_arity_2_3,params_kan_arity_2_4,params_kan_arity_2_5,params_kan_arity_2_6,params_kan_arity_2_7,params_kan_arity_2_8,params_kan_arity_2_9,params_kan_arity_3_0,params_kan_arity_3_1,params_kan_arity_3_2,params_kan_arity_3_3,params_kan_arity_3_4,params_kan_arity_3_5,params_kan_arity_3_6,params_kan_arity_3_7,params_kan_arity_3_8,params_kan_arity_3_9,params_kan_grid,params_kan_k,params_kan_layer_type_0,params_kan_layer_type_1,params_kan_layer_type_2,params_kan_layer_type_3,params_kan_mult_nodes_0,params_kan_mult_nodes_1,params_kan_mult_nodes_2,params_kan_mult_nodes_3,params_kan_n_layers,params_kan_neurons_0,params_kan_neurons_1,params_kan_neurons_2,params_kan_neurons_3,params_lr,state
1419,,26:27.9,30:41.3,0 days 00:04:13.433707,2,96,8,16,3,5,10,4,10,6,2,5,2,9,10,,3,7,10,6,10,10,10,10,5,5,8,10,2,5,4,4,10,,,,,,,,,,,,,,8,3,mixed,mixed,mixed,normal,9,10,7,,4,9,8,9,10,0.00452003,FAIL
1420,,30:41.3,34:51.6,0 days 00:04:10.280756,2,96,8,16,3,5,9,4,10,5,2,5,2,10,,,3,7,10,6,10,10,10,10,6,5,8,10,2,5,4,10,10,,,,,,,,,,,,,,8,3,mixed,mixed,mixed,normal,8,10,7,,4,9,8,9,10,0.002884147,FAIL
1421,,34:51.6,39:00.9,0 days 00:04:09.327072,2,96,8,16,3,5,10,4,10,6,2,5,2,10,,,3,7,10,6,10,9,10,10,5,5,8,10,2,5,4,10,10,,,,,,,,,,,,,,8,3,mixed,mixed,mixed,normal,8,10,7,,4,9,8,9,10,0.004522728,FAIL
1422,,39:01.0,43:08.5,0 days 00:04:07.540664,2,96,8,16,3,5,10,4,9,6,2,5,2,10,,,3,7,10,6,10,10,10,10,5,5,8,10,2,5,4,10,10,,,,,,,,,,,,,,8,3,mixed,mixed,mixed,normal,8,10,7,,4,9,8,9,10,0.001234781,FAIL
1423,,43:08.5,47:17.7,0 days 00:04:09.206935,2,96,8,16,3,5,10,4,10,6,2,5,3,10,,,3,7,10,6,10,9,10,10,5,5,8,10,2,5,4,10,10,,,,,,,,,,,,,,8,3,mixed,mixed,mixed,normal,8,10,7,,4,9,8,9,10,0.001252348,FAIL
1424,,47:17.7,51:30.3,0 days 00:04:12.616829,2,96,8,16,3,5,10,4,10,6,2,5,2,10,,,4,7,10,6,10,9,10,10,5,4,8,10,4,5,4,4,10,,,,,,,,,,,,,,8,3,mixed,mixed,mixed,normal,8,10,7,,4,9,8,9,4,0.004739019,FAIL
1425,,51:30.3,55:45.0,0 days 00:04:14.697369,2,96,8,16,3,5,10,4,10,6,2,5,2,10,,,3,7,5,6,10,10,10,10,5,5,7,8,2,5,4,10,10,,,,,,,,,,,,,,8,3,mixed,mixed,mixed,normal,8,10,7,,4,9,8,9,10,0.006978593,FAIL
1426,,55:45.0,59:57.1,0 days 00:04:12.049213,2,96,8,16,3,5,10,4,9,6,2,5,2,10,,,3,7,10,6,10,10,10,10,5,5,8,10,2,5,4,10,10,,,,,,,,,,,,,,8,3,mixed,mixed,mixed,normal,8,10,7,,4,9,8,9,10,0.001234573,FAIL
1427,,59:57.1,04:09.3,0 days 00:04:12.264656,2,96,8,16,3,5,10,4,10,6,2,5,2,10,,,3,7,10,6,10,10,10,10,6,4,8,10,2,5,4,10,10,,,,,,,,,,,,,,8,3,mixed,mixed,mixed,normal,8,10,7,,4,9,8,9,10,0.004626817,FAIL
1428,,04:09.3,08:22.1,0 days 00:04:12.721790,2,96,8,16,3,5,10,4,10,6,2,5,2,10,,,3,7,10,6,10,10,10,10,5,5,8,10,2,5,4,10,10,,,,,,,,,,,,,,8,3,mixed,mixed,mixed,normal,8,10,7,,4,9,8,9,4,0.004644377,FAIL
1429,,08:22.1,12:34.6,0 days 00:04:12.476389,2,96,8,16,3,5,10,4,10,6,2,5,2,10,,,3,7,10,6,10,9,10,10,5,5,8,10,2,5,4,10,10,,,,,,,,,,,,,,8,3,mixed,mixed,mixed,normal,8,10,7,,4,9,8,9,10,0.004606681,FAIL
1430,,12:34.6,16:44.8,0 days 00:04:10.257392,2,96,8,16,3,5,10,4,10,6,2,5,2,10,,,3,7,10,6,10,9,10,10,5,4,8,8,2,5,4,10,10,,,,,,,,,,,,,,8,3,mixed,mixed,mixed,normal,8,10,7,,4,9,8,9,10,0.004477912,FAIL
1431,,16:44.8,20:53.7,0 days 00:04:08.869930,2,96,8,16,3,5,10,4,10,6,2,5,3,10,,,3,7,10,6,10,10,10,10,5,5,8,10,2,5,4,5,10,,,,,,,,,,,,,,8,3,mixed,mixed,mixed,normal,8,10,7,,4,9,2,9,10,0.004711173,FAIL
1432,,20:53.7,25:02.4,0 days 00:04:08.684017,2,96,8,16,3,5,10,4,10,6,2,10,2,10,,,3,7,10,6,10,10,10,10,5,5,8,8,2,5,4,10,10,,,,,,,,,,,,,,8,3,mixed,mixed,mixed,normal,8,10,7,,4,9,8,9,10,0.004634308,FAIL
1433,,25:02.4,29:13.2,0 days 00:04:10.777287,2,96,8,16,3,5,10,4,9,6,2,5,4,10,,,3,7,10,6,10,9,10,10,5,5,8,10,2,5,4,10,2,,,,,,,,,,,,,,8,3,mixed,mixed,mixed,normal,8,10,7,,4,9,8,9,10,0.004406471,FAIL
1434,,29:13.2,33:26.8,0 days 00:04:13.681035,2,96,8,16,3,5,10,4,10,6,2,10,2,10,,,3,7,10,6,10,9,10,10,5,5,8,10,2,5,4,4,10,,,,,,,,,,,,,,8,3,mixed,mixed,mixed,normal,8,10,7,,4,9,8,9,10,0.004733776,FAIL
1435,,33:26.8,37:38.4,0 days 00:04:11.533951,2,96,8,16,3,5,10,4,10,6,2,5,2,10,,,3,7,10,6,10,10,10,10,5,5,8,10,2,6,4,4,10,,,,,,,,,,,,,,8,3,mixed,mixed,mixed,normal,8,10,7,,4,9,2,9,10,0.004563544,FAIL
1436,,37:38.4,41:46.6,0 days 00:04:08.241713,2,96,8,16,3,5,10,4,9,6,7,5,2,10,,,3,7,10,6,10,10,10,10,5,5,8,10,2,5,4,10,10,,,,,,,,,,,,,,8,3,mixed,mixed,mixed,normal,8,10,7,,4,9,2,9,10,0.004557445,FAIL
1437,,41:46.6,45:53.2,0 days 00:04:06.611977,2,96,8,16,3,5,10,4,10,6,2,5,2,10,,,3,7,5,5,10,10,10,10,5,5,8,10,2,5,4,10,10,,,,,,,,,,,,,,8,3,mixed,mixed,mixed,normal,8,10,7,,4,9,8,9,10,0.004526773,FAIL
1438,,45:53.2,50:04.2,0 days 00:04:10.953820,2,96,8,16,3,5,10,4,10,6,2,5,2,10,,,3,7,10,6,10,10,10,10,5,5,8,10,2,5,4,10,10,,,,,,,,,,,,,,8,3,mixed,mixed,mixed,normal,8,10,7,,4,9,8,9,10,0.004582614,FAIL
1439,,50:04.2,54:14.4,0 days 00:04:10.208908,2,96,8,16,3,5,10,4,10,5,2,5,2,10,,,3,7,10,6,10,9,10,10,5,5,7,10,2,5,4,10,10,,,,,,,,,,,,,,8,3,mixed,mixed,mixed,normal,8,10,7,,4,9,8,9,10,0.004365679,FAIL
1440,,54:14.4,58:22.2,0 days 00:04:07.771097,2,96,8,16,3,5,10,4,10,6,2,5,2,10,,,3,7,10,6,10,10,10,9,5,5,8,10,2,5,4,10,10,,,,,,,,,,,,,,8,3,mixed,mixed,mixed,normal,8,10,7,,4,9,8,9,10,0.004414573,FAIL
1441,,58:22.2,02:33.8,0 days 00:04:11.656089,2,96,8,16,3,5,10,4,9,6,2,5,2,10,,,3,7,10,6,10,10,10,10,5,5,8,10,2,5,4,10,10,,,,,,,,,,,,,,8,3,mixed,mixed,mixed,normal,8,10,7,,4,9,8,9,10,0.001262967,FAIL
1442,,02:33.9,06:45.1,0 days 00:04:11.251467,2,96,8,16,3,5,10,4,9,6,2,5,2,10,,,3,7,10,6,10,9,10,10,5,5,8,10,2,5,4,10,10,,,,,,,,,,,,,,8,3,mixed,mixed,mixed,normal,8,10,7,,4,9,8,9,10,0.004588771,FAIL
1443,,06:45.1,10:57.0,0 days 00:04:11.928742,2,96,8,16,3,5,10,4,10,6,2,5,2,10,,,3,7,10,6,10,10,10,10,5,5,8,10,2,5,4,10,10,,,,,,,,,,,,,,8,3,mixed,mixed,mixed,normal,8,10,7,,4,9,8,9,10,0.001221871,FAIL
1444,,10:57.0,15:08.6,0 days 00:04:11.516894,2,96,8,16,3,5,10,4,10,6,2,5,2,10,,,3,7,10,6,10,10,10,10,5,5,8,10,2,5,4,10,10,,,,,,,,,,,,,,8,3,mixed,mixed,mixed,normal,8,10,7,,4,9,8,9,10,0.001235784,FAIL
1445,,15:08.6,19:23.2,0 days 00:04:14.641233,2,96,96,16,3,5,10,4,10,6,2,5,2,10,,,3,7,10,6,10,10,10,10,5,5,8,10,2,5,4,10,10,,,,,,,,,,,,,,8,3,mixed,mixed,mixed,normal,8,10,7,,4,9,8,9,4,0.004585449,FAIL
1446,,19:23.2,23:34.9,0 days 00:04:11.645711,2,96,8,16,3,5,10,4,10,6,2,5,2,10,,,3,7,10,6,10,9,10,10,5,5,8,10,2,5,4,10,10,,,,,,,,,,,,,,8,3,mixed,mixed,mixed,normal,8,10,7,,4,9,8,9,10,0.004659022,FAIL
1447,,23:34.9,27:48.8,0 days 00:04:13.984021,2,96,8,16,3,5,10,4,10,6,2,5,2,10,,,3,7,10,6,10,10,10,10,5,5,8,10,2,5,4,10,10,,,,,,,,,,,,,,8,3,mixed,mixed,mixed,normal,8,10,7,,4,9,8,9,4,0.004415843,FAIL
1448,,27:48.8,31:59.0,0 days 00:04:10.116655,2,96,8,16,3,5,10,4,10,6,2,5,2,10,,,3,7,10,6,10,10,10,10,5,5,8,10,2,5,4,10,10,,,,,,,,,,,,,,8,3,mixed,mixed,mixed,normal,8,10,7,,4,9,8,9,10,0.004583187,FAIL
1449,,31:59.0,36:10.1,0 days 00:04:11.090778,2,96,8,16,3,5,10,4,10,6,2,5,2,10,,,3,7,10,6,10,10,10,10,5,5,8,10,2,5,4,10,10,,,,,,,,,,,,,,8,3,mixed,mixed,mixed,normal,8,10,7,,4,9,8,9,10,0.004554081,FAIL
1450,,36:10.1,40:22.6,0 days 00:04:12.522256,2,96,8,16,3,5,10,4,10,6,2,5,2,10,,,3,7,10,6,10,10,10,10,5,5,8,10,2,5,4,10,10,,,,,,,,,,,,,,8,3,mixed,mixed,mixed,normal,8,10,7,,4,9,8,9,4,0.004547016,FAIL
1451,,40:22.6,44:36.3,0 days 00:04:13.738298,2,96,8,16,3,5,9,4,10,6,2,5,2,9,,,3,7,10,6,10,10,10,10,5,4,7,10,2,5,4,10,10,,,,,,,,,,,,,,8,3,mixed,mixed,mixed,normal,8,10,7,,4,9,8,9,10,0.004505469,FAIL
1452,,44:36.3,48:48.4,0 days 00:04:12.060893,2,96,8,16,3,5,10,4,9,6,2,5,3,10,,,3,7,10,6,10,10,10,10,5,5,8,10,2,5,4,10,10,,,,,,,,,,,,,,8,3,mixed,mixed,mixed,normal,8,10,7,,4,9,8,9,10,0.004483209,FAIL
1453,,48:48.4,52:59.4,0 days 00:04:11.046814,2,96,8,16,3,5,10,4,10,6,2,5,2,10,,,3,7,10,6,10,10,10,10,5,5,8,10,4,5,4,10,10,,,,,,,,,,,,,,8,3,mixed,mixed,mixed,normal,8,10,7,,4,9,2,9,10,0.004563806,FAIL
1454,,52:59.4,57:13.8,0 days 00:04:14.380246,2,96,8,16,3,5,10,4,10,6,2,10,2,10,,,3,7,10,6,10,10,10,10,5,5,8,10,2,5,4,10,10,,,,,,,,,,,,,,8,3,mixed,mixed,mixed,normal,8,10,7,,4,9,8,9,10,0.004898359,FAIL
1455,,57:13.8,01:22.6,0 days 00:04:08.818934,2,96,8,16,3,5,10,4,10,6,2,5,3,10,,,3,7,10,6,10,10,10,10,5,,8,10,2,5,4,10,10,,,,,,,,,,,,,,8,3,mixed,mixed,mixed,normal,8,9,7,,4,9,8,9,10,0.002998018,FAIL
1456,,01:22.7,05:29.7,0 days 00:04:07.066345,2,96,8,16,3,5,10,4,10,6,2,10,2,10,,,3,7,10,6,10,10,10,10,5,5,8,10,2,5,4,10,10,,,,,,,,,,,,,,8,3,mixed,mixed,mixed,normal,8,10,7,,4,9,8,9,10,0.00451772,FAIL
1457,,05:29.7,09:41.9,0 days 00:04:12.183412,2,96,8,16,3,5,10,4,9,6,2,5,3,10,10,,3,7,10,6,10,10,10,10,5,5,8,10,2,5,4,4,10,,,,,,,,,,,,,,8,3,mixed,mixed,mixed,normal,9,10,7,,4,9,8,9,10,0.004429032,FAIL
1458,,09:41.9,13:54.3,0 days 00:04:12.418154,2,96,8,16,3,5,10,4,9,6,2,5,2,10,,,3,7,10,6,10,10,10,10,5,5,8,10,2,5,4,10,10,,,,,,,,,,,,,,8,3,mixed,mixed,mixed,normal,8,10,7,,4,9,8,9,10,0.004483092,FAIL
1459,,13:54.3,18:07.8,0 days 00:04:13.441742,2,96,8,16,3,5,10,4,10,6,2,5,2,10,,,3,7,10,6,10,10,10,10,5,5,8,10,2,6,4,10,10,,,,,,,,,,,,,,8,3,mixed,mixed,mixed,normal,8,10,7,,4,9,8,9,10,0.00495303,FAIL
1460,,18:07.8,22:19.3,0 days 00:04:11.564707,2,96,8,16,3,5,10,4,10,6,2,5,2,9,,,3,7,10,6,10,9,10,10,5,5,8,10,4,5,4,10,10,,,,,,,,,,,,,,8,3,mixed,mixed,mixed,normal,8,10,7,,4,9,8,9,4,0.004293875,FAIL
1461,,22:19.3,26:28.6,0 days 00:04:09.294183,2,96,8,16,3,5,9,4,10,6,2,5,3,10,,,3,7,5,6,10,10,10,10,5,5,8,10,2,5,4,10,10,,,,,,,,,,,,,,8,3,mixed,mixed,mixed,normal,8,10,7,,4,9,8,9,10,0.00453956,FAIL
1462,,26:28.6,30:36.1,0 days 00:04:07.424688,2,96,8,16,3,5,10,4,10,6,2,5,2,10,,,3,7,5,6,10,10,10,10,5,5,8,10,2,5,4,10,10,,,,,,,,,,,,,,8,3,mixed,mixed,mixed,normal,8,10,7,,4,9,8,9,10,0.004415676,FAIL
1463,,30:36.1,34:47.6,0 days 00:04:11.575493,2,96,8,16,3,5,10,4,10,6,2,5,2,10,,,3,7,5,6,10,10,10,10,5,5,8,10,2,5,4,10,10,,,,,,,,,,,,,,8,3,mixed,mixed,mixed,normal,8,10,7,,4,9,8,9,4,0.004309563,FAIL
1464,,34:47.7,38:58.0,0 days 00:04:10.382015,2,96,8,16,3,5,10,4,10,6,2,5,2,10,,,3,7,10,6,10,10,10,10,5,5,8,10,2,5,4,10,10,,,,,,,,,,,,,,8,3,mixed,mixed,mixed,normal,8,10,7,,4,9,8,9,10,0.001247958,FAIL
1465,,38:58.0,43:05.5,0 days 00:04:07.474088,2,96,8,16,3,5,10,4,10,6,2,5,3,10,,,3,7,10,6,10,10,10,10,5,5,8,10,2,5,4,10,10,,,,,,,,,,,,,,8,3,mixed,mixed,mixed,normal,8,10,7,,4,9,8,9,10,0.004397967,FAIL
1466,,43:05.5,47:18.6,0 days 00:04:13.067077,2,96,8,16,3,5,10,4,10,5,2,5,2,10,,,3,7,10,,,,,,,,8,10,2,5,4,10,10,,,,,,,,,,,,,,8,3,mixed,mixed,mixed,normal,8,3,7,,4,9,8,9,10,0.002802583,FAIL
1467,,47:18.6,51:30.8,0 days 00:04:12.251556,2,96,8,16,3,5,9,4,10,6,2,5,3,9,,,3,7,10,6,10,9,10,10,5,4,8,8,2,5,4,10,10,,,,,,,,,,,,,,8,3,mixed,mixed,mixed,normal,8,10,7,,4,9,2,9,10,0.004762932,FAIL
1468,,51:30.8,55:44.7,0 days 00:04:13.813549,2,96,8,16,3,5,10,4,9,6,2,5,3,10,,,3,7,10,6,10,10,10,10,5,5,8,8,2,5,4,10,10,,,,,,,,,,,,,,8,3,mixed,mixed,mixed,normal,8,10,7,,4,9,8,9,10,0.00440468,FAIL
1469,,55:44.7,59:57.3,0 days 00:04:12.686959,2,96,8,16,3,5,10,4,10,6,2,5,2,10,,,3,7,10,6,10,10,10,10,5,5,8,10,2,6,4,10,10,,,,,,,,,,,,,,8,3,mixed,mixed,mixed,normal,8,10,7,,4,9,8,9,10,0.001264903,FAIL
1470,,59:57.3,04:09.5,0 days 00:04:12.139716,2,96,8,16,3,5,10,4,10,6,2,5,2,10,,,3,7,10,6,10,8,10,10,5,5,8,10,2,5,4,10,10,,,,,,,,,,,,,,8,3,mixed,mixed,mixed,normal,8,10,7,,4,9,8,9,10,0.004519845,FAIL
1471,,04:09.5,08:17.2,0 days 00:04:07.753824,2,96,8,16,3,5,9,4,9,6,2,5,2,10,,,3,5,10,6,10,10,10,10,5,5,8,10,2,5,4,10,10,,,,,,,,,,,,,,8,3,mixed,mixed,mixed,normal,8,10,7,,4,9,2,9,10,0.004632006,FAIL
1472,,08:17.3,12:29.2,0 days 00:04:11.975844,2,96,8,16,3,5,10,4,10,6,2,5,2,10,,,3,7,10,6,10,10,10,10,5,5,8,10,2,5,4,10,10,2,,,,,,,,,,,,,8,3,mixed,mixed,mixed,normal,8,10,8,,4,9,8,9,4,0.004520849,FAIL
1473,,12:29.2,16:42.5,0 days 00:04:13.255834,2,96,8,16,3,5,10,4,10,6,2,5,2,10,,,3,7,5,6,10,10,10,10,5,5,8,10,2,5,4,10,10,,,,,,,,,,,,,,8,3,mixed,mixed,mixed,normal,8,10,7,,4,9,8,9,10,0.004353149,FAIL
1474,,16:42.5,20:50.5,0 days 00:04:07.963648,2,96,8,16,3,5,10,4,9,6,2,5,3,10,10,,3,7,10,6,10,10,10,10,5,5,8,10,2,5,4,10,10,,,,,,,,,,,,,,8,3,mixed,mixed,mixed,normal,9,10,7,,4,9,8,9,10,0.004233117,FAIL
1475,,20:50.5,24:58.7,0 days 00:04:08.227981,2,96,8,16,3,5,10,4,10,6,7,5,2,10,,,3,7,10,6,10,10,10,10,5,5,8,10,2,5,4,4,10,,,,,,,,,,,,,,8,3,mixed,mixed,mixed,normal,8,10,7,,4,9,8,9,10,0.001240738,FAIL
1476,,24:58.7,29:08.3,0 days 00:04:09.637394,2,96,8,16,3,5,10,4,10,6,2,10,2,10,,,3,7,10,6,10,9,10,10,5,5,8,10,2,5,4,10,10,,,,,,,,,,,,,,8,3,mixed,mixed,mixed,normal,8,10,7,,4,9,8,9,10,0.004244691,FAIL
1477,,29:08.3,33:21.5,0 days 00:04:13.183666,2,96,8,16,3,5,10,4,10,6,2,5,3,10,,,3,7,10,6,10,10,10,10,5,5,8,10,2,5,4,10,10,,,,,,,,,,,,,,8,3,mixed,mixed,mixed,normal,8,10,7,,4,9,8,9,10,0.00125472,FAIL
1478,,33:21.5,37:35.2,0 days 00:04:13.730338,2,96,8,16,3,5,10,4,10,6,2,5,2,10,,,3,7,10,6,10,10,10,10,5,5,8,10,2,5,4,4,10,,,,,,,,,,,,,,8,3,mixed,mixed,mixed,normal,8,10,7,,4,9,8,9,10,0.004524208,FAIL
1479,,37:35.3,41:44.1,0 days 00:04:08.834898,2,96,8,16,3,5,10,4,10,5,2,5,2,10,,,3,7,10,6,10,9,10,10,5,5,8,10,2,5,4,10,10,,,,,,,,,,,,,,8,3,mixed,mixed,mixed,normal,8,10,7,,4,9,8,9,10,0.004759765,FAIL
1480,,41:44.1,45:53.5,0 days 00:04:09.439294,2,96,8,16,3,5,10,5,10,6,7,5,3,10,,,3,7,10,6,10,10,10,10,5,5,8,10,2,5,4,10,10,,,,,,,,,,,,,,8,3,mixed,mixed,mixed,normal,8,10,7,,4,9,8,9,4,0.004422488,FAIL
1481,,45:53.5,50:01.9,0 days 00:04:08.399447,2,96,8,16,3,5,10,4,10,6,2,5,3,10,9,,3,7,5,6,10,9,10,10,5,5,8,10,2,5,4,10,10,,,,,,,,,,,,,,8,3,mixed,mixed,mixed,normal,9,10,7,,4,9,8,9,10,0.004402342,FAIL
1482,,50:01.9,54:15.2,0 days 00:04:13.216908,2,96,8,16,3,5,10,4,10,6,2,5,2,10,,,3,7,10,6,10,10,10,10,5,5,8,10,2,5,4,10,2,,,,,,,,,,,,,,8,3,mixed,mixed,mixed,normal,8,10,7,,4,9,8,9,10,0.004773894,FAIL
1483,,54:15.2,58:27.6,0 days 00:04:12.408725,2,96,8,16,3,5,8,5,10,6,2,5,2,10,,,3,7,10,6,10,10,10,10,5,,7,10,2,5,4,10,10,,,,,,,,,,,,,,8,3,mixed,mixed,mixed,normal,8,9,7,,4,9,8,9,10,0.004867173,FAIL
1484,,58:27.6,02:37.4,0 days 00:04:09.844325,2,96,8,16,3,5,10,5,9,6,2,5,2,10,,,3,7,10,6,10,10,10,10,6,5,8,10,2,5,4,10,10,,,,,,,,,,,,,,8,3,mixed,mixed,mixed,normal,8,10,7,,4,9,8,9,10,0.004473558,FAIL
1485,,02:37.4,06:46.8,0 days 00:04:09.371264,2,96,8,16,3,5,10,4,10,6,2,5,2,10,,,3,7,10,6,10,9,10,10,5,5,8,10,2,5,4,10,10,,,,,,,,,,,,,,8,3,mixed,mixed,mixed,normal,8,10,7,,4,9,8,9,4,0.004949547,FAIL
1486,,06:46.8,10:56.2,0 days 00:04:09.395079,2,96,8,16,3,5,10,4,10,6,2,5,3,10,,,3,7,10,6,10,10,10,10,5,5,8,10,2,6,4,10,10,,,,,,,,,,,,,,8,3,mixed,mixed,mixed,normal,8,10,7,,4,9,8,9,10,0.004575882,FAIL
1487,,10:56.2,15:09.3,0 days 00:04:13.150388,2,96,8,16,3,5,10,4,10,6,2,5,2,10,,,3,7,10,6,10,10,10,10,6,5,7,10,2,5,4,10,10,,,,,,,,,,,,,,8,3,mixed,mixed,mixed,normal,8,10,7,,4,9,8,9,10,0.00497362,FAIL
1488,,15:09.4,19:16.6,0 days 00:04:07.265596,2,96,8,16,3,5,10,4,10,6,2,5,2,10,,,3,7,10,6,10,10,10,10,5,5,8,10,2,5,4,10,10,,,,,,,,,,,,,,8,3,mixed,mixed,mixed,normal,8,10,7,,4,9,8,9,4,0.004378483,FAIL
1489,,19:16.6,23:23.9,0 days 00:04:07.270923,2,96,8,16,3,5,10,4,10,6,2,5,4,10,,,3,7,10,6,10,10,10,10,5,5,8,10,4,5,4,10,10,,,,,,,,,,,,,,8,3,mixed,mixed,mixed,normal,8,10,7,,4,9,8,9,10,0.001264683,FAIL
1490,,23:23.9,27:32.7,0 days 00:04:08.774961,2,96,8,16,3,5,10,4,10,5,2,5,2,10,,,3,7,10,6,9,10,10,10,6,5,8,10,2,5,4,10,10,,,,,,,,,,,,,,8,3,mixed,mixed,mixed,normal,8,10,7,,4,9,8,9,10,0.00287753,FAIL
1491,,27:32.7,31:42.9,0 days 00:04:10.269482,2,96,8,16,3,5,10,4,10,6,2,5,2,10,,,3,7,10,6,10,10,10,10,5,5,8,10,2,5,4,10,10,,,,,,,,,,,,,,8,3,mixed,mixed,mixed,normal,8,10,7,,4,9,8,9,10,0.001223363,FAIL
1492,,31:42.9,35:53.0,0 days 00:04:10.008909,2,96,8,16,3,5,10,4,10,6,2,5,2,10,,,3,7,10,6,10,10,10,10,5,5,8,10,2,5,4,10,10,,,,,,,,,,,,,,8,3,mixed,mixed,mixed,normal,8,10,7,,4,9,8,9,10,0.001255716,FAIL
1493,,35:53.0,40:02.0,0 days 00:04:08.994201,2,96,8,16,3,5,10,4,9,6,2,5,3,10,,,3,7,10,6,10,10,10,10,5,5,8,10,2,5,4,10,10,,,,,,,,,,,,,,8,3,mixed,mixed,mixed,normal,8,10,7,,4,9,8,9,10,0.002883799,FAIL
1494,,40:02.0,44:15.3,0 days 00:04:13.358573,2,96,8,16,3,5,10,4,9,6,2,10,2,10,,,3,7,10,6,10,10,10,10,5,5,8,10,4,5,4,10,10,,,,,,,,,,,,,,8,3,mixed,mixed,mixed,normal,8,10,7,,4,9,8,9,10,0.004761347,FAIL
1495,,44:15.3,48:29.2,0 days 00:04:13.914675,2,96,8,16,3,5,10,4,10,6,2,5,2,10,,,3,7,5,6,10,10,10,10,5,5,8,10,2,5,4,10,10,,,,,,,,,,,,,,8,3,mixed,mixed,mixed,normal,8,10,7,,4,9,8,9,10,0.004652393,FAIL
1496,,48:29.2,52:42.5,0 days 00:04:13.250842,2,96,8,16,3,5,10,4,9,5,2,5,2,10,,,3,7,10,6,10,9,10,10,5,5,8,10,2,5,4,10,10,,,,,,,,,,,,,,8,3,mixed,mixed,mixed,normal,8,10,7,,4,9,8,9,10,0.004533743,FAIL
1497,,52:42.5,56:55.6,0 days 00:04:13.105073,2,96,8,16,3,5,9,4,10,6,2,5,3,10,9,,3,7,10,6,10,10,9,10,5,5,8,10,2,5,4,10,10,,,,,,,,,,,,,,8,3,mixed,mixed,mixed,normal,9,10,7,,4,9,8,9,10,0.004982949,FAIL
1498,,56:55.6,01:08.4,0 days 00:04:12.770862,2,96,8,16,3,5,10,4,10,6,2,5,3,10,,,3,7,5,6,10,10,10,10,5,5,8,10,2,6,4,10,10,,,,,,,,,,,,,,8,3,mixed,mixed,mixed,normal,8,10,7,,4,9,8,9,10,0.004558922,FAIL
1499,,01:08.4,05:16.5,0 days 00:04:08.087048,2,96,8,16,3,5,10,4,10,6,2,5,2,10,,,3,7,10,6,10,10,10,10,5,5,8,10,2,5,4,4,10,,,,,,,,,,,,,,8,3,mixed,mixed,mixed,normal,8,10,7,,4,9,8,9,10,0.00474488,FAIL
1500,,05:16.5,09:27.4,0 days 00:04:10.883016,2,96,8,16,3,5,10,4,10,6,2,5,3,10,,,3,7,10,6,10,10,10,10,5,5,8,10,2,5,4,10,10,,,,,,,,,,,,,,8,3,mixed,mixed,mixed,normal,8,10,7,,4,9,8,9,10,0.004327674,FAIL
1501,,09:27.4,13:40.0,0 days 00:04:12.644037,2,96,8,16,3,5,10,4,10,6,7,5,2,10,,,3,7,10,6,10,10,10,10,5,5,8,10,2,5,4,10,10,,,,,,,,,,,,,,8,3,mixed,mixed,mixed,normal,8,10,7,,4,9,8,9,10,0.00486282,FAIL
1502,,13:40.0,17:51.2,0 days 00:04:11.149335,2,96,8,16,3,5,10,4,10,6,2,5,2,10,,,3,7,5,6,10,10,10,10,5,5,8,10,2,5,4,10,10,,,,,,,,,,,,,,8,3,mixed,mixed,mixed,normal,8,10,7,,4,9,8,9,10,0.00439424,FAIL
1503,,17:51.2,22:04.4,0 days 00:04:13.275258,2,96,8,16,3,5,10,4,10,6,2,5,2,10,,,3,7,10,6,10,10,10,10,5,5,8,10,2,5,4,10,10,,,,,,,,,,,,,,8,3,mixed,mixed,mixed,normal,8,10,7,,4,9,8,9,4,0.002944233,FAIL
1504,,22:04.4,26:17.7,0 days 00:04:13.278805,2,96,8,16,3,5,10,4,10,6,2,5,3,10,,,3,7,10,6,10,9,10,10,5,4,8,10,2,5,4,10,10,,,,,,,,,,,,,,8,3,mixed,mixed,mixed,normal,8,10,7,,4,9,8,9,4,0.001256223,FAIL
1505,,26:17.7,30:31.2,0 days 00:04:13.513091,2,96,8,16,3,5,10,4,8,6,2,5,2,10,,,3,7,10,6,10,10,10,10,5,5,8,10,2,5,4,10,10,,,,,,,,,,,,,,8,3,mixed,mixed,mixed,normal,8,10,7,,4,9,8,9,10,0.004508121,FAIL
1506,,30:31.2,34:45.7,0 days 00:04:14.423254,2,96,8,16,3,5,,,,,,,,,,,3,7,10,6,10,10,10,10,5,5,8,10,2,5,4,10,10,,,,,,,,,,,,,,8,3,normal,mixed,mixed,normal,,10,7,,4,9,8,9,10,0.001239463,FAIL
1507,,34:45.7,39:00.3,0 days 00:04:14.630562,2,96,8,16,3,5,10,4,10,6,2,5,2,10,10,,3,7,10,6,10,10,10,10,5,5,8,10,2,5,4,10,10,,,,,,,,,,,,,,8,3,mixed,mixed,mixed,normal,9,10,7,,4,9,8,9,10,0.001247558,FAIL
1508,,39:00.3,43:14.2,0 days 00:04:13.948154,2,96,8,16,3,5,10,4,10,6,2,10,2,10,,,3,7,10,6,10,10,10,10,5,5,8,10,2,5,4,10,10,,,,,,,,,,,,,,8,3,mixed,mixed,mixed,normal,8,10,7,,4,9,8,9,4,0.00488401,FAIL
1509,,43:14.3,47:27.4,0 days 00:04:13.137027,2,96,8,16,3,5,10,4,10,6,2,5,2,10,,,3,7,10,6,10,10,10,10,5,5,8,10,2,6,4,10,10,,,,,,,,,,,,,,8,3,mixed,mixed,mixed,normal,8,10,7,,4,9,8,9,10,0.004791386,FAIL
1510,,47:27.4,51:39.6,0 days 00:04:12.193162,2,96,8,16,3,5,10,4,10,6,2,5,3,10,,,3,7,5,6,10,9,10,10,5,5,8,10,2,5,5,10,10,,,,,,,,,,,,,,8,3,mixed,mixed,mixed,normal,8,10,7,,4,9,8,9,10,0.00439046,FAIL
1511,,51:39.6,55:54.2,0 days 00:04:14.604513,2,96,8,16,3,5,10,4,10,5,2,5,2,10,,,3,7,5,6,10,10,10,10,5,5,8,10,2,5,4,10,10,,,,,,,,,,,,,,8,4,mixed,mixed,mixed,normal,8,10,7,,4,9,8,9,10,0.001250831,FAIL
1512,,55:54.2,00:06.7,0 days 00:04:12.533246,2,96,8,16,3,5,10,4,10,6,2,5,2,10,10,,3,7,10,6,10,10,10,10,5,5,8,10,4,5,5,10,10,,,,,,,,,,,,,,8,3,mixed,mixed,mixed,normal,9,10,7,,4,9,8,9,10,0.002810733,FAIL
1513,,00:06.7,04:20.7,0 days 00:04:13.917834,2,96,8,16,3,5,10,4,10,5,2,5,2,10,,,3,7,10,6,10,10,10,10,5,5,8,10,2,5,4,10,10,,,,,,,,,,,,,,8,3,mixed,mixed,mixed,normal,8,10,7,,4,9,8,9,10,0.00479591,FAIL
1514,,04:20.7,08:28.1,0 days 00:04:07.467352,2,96,8,16,3,5,10,4,10,6,2,5,2,10,,,3,7,5,6,10,10,10,10,5,5,8,10,2,5,4,10,10,,,,,,,,,,,,,,8,3,mixed,mixed,mixed,normal,8,10,7,,4,9,8,9,10,0.001244808,FAIL
1515,,08:28.1,12:37.8,0 days 00:04:09.696257,2,96,8,16,3,5,10,4,10,6,2,5,2,10,,,3,7,10,6,10,10,10,10,6,5,8,10,2,5,4,10,10,,,,,,,,,,,,,,8,3,mixed,mixed,mixed,normal,8,10,7,,4,9,8,9,10,0.001224746,FAIL
1516,,12:37.8,16:46.2,0 days 00:04:08.367238,2,96,8,16,3,5,10,4,10,6,2,5,4,9,,,3,7,10,6,10,10,10,10,5,5,8,10,2,5,4,10,10,,,,,,,,,,,,,,8,3,mixed,mixed,mixed,normal,8,10,7,,4,9,2,9,4,0.004418156,FAIL
1517,,16:46.2,20:58.3,0 days 00:04:12.052330,2,96,8,16,3,5,10,4,9,6,2,5,2,10,,,3,7,10,6,10,9,10,10,5,,8,10,2,5,4,4,10,,,,,,,,,,,,,,8,3,mixed,mixed,mixed,normal,8,9,7,,4,9,8,9,10,0.001243756,FAIL
1518,,20:58.3,25:07.0,0 days 00:04:08.772839,2,96,8,16,3,5,10,4,10,6,2,5,2,10,,,3,7,10,6,10,9,10,10,5,5,8,10,2,5,4,10,10,,,,,,,,,,,,,,8,3,mixed,mixed,mixed,normal,8,10,7,,4,9,8,9,10,0.004343586,FAIL
1519,,25:07.0,29:16.6,0 days 00:04:09.589721,2,96,8,16,3,5,10,4,10,6,2,5,2,9,,,3,7,10,6,10,10,10,10,5,4,8,10,2,5,4,10,10,,,,,,,,,,,,,,8,3,mixed,mixed,mixed,normal,8,10,7,,4,9,8,9,10,0.0012306,FAIL
1520,,29:16.6,33:24.4,0 days 00:04:07.776413,2,96,8,16,3,5,10,4,10,6,2,5,2,10,,,3,7,10,6,10,10,10,10,5,5,8,10,2,5,4,10,10,,,,,,,,,,,,,,8,3,mixed,mixed,mixed,normal,8,10,7,,4,9,8,9,10,0.004710489,FAIL
1521,,33:24.4,37:28.8,0 days 00:04:04.359268,2,96,8,16,3,5,10,4,9,6,2,5,2,10,,,3,7,10,6,10,9,10,10,5,5,8,10,2,5,4,10,10,,,,,,,,,,,,,,8,3,mixed,mixed,mixed,normal,8,10,7,,4,9,8,9,10,0.001267458,FAIL
