number,value,datetime_start,datetime_complete,duration,params_gat_heads,params_gat_hidden_0,params_gat_hidden_1,params_gat_hidden_2,params_gat_layers,params_gat_out,params_kan_arity_0_0,params_kan_arity_0_1,params_kan_arity_0_2,params_kan_arity_0_3,params_kan_arity_0_4,params_kan_arity_0_5,params_kan_arity_0_6,params_kan_arity_0_7,params_kan_arity_0_8,params_kan_arity_0_9,params_kan_arity_1_0,params_kan_arity_1_1,params_kan_arity_1_2,params_kan_arity_1_3,params_kan_arity_1_4,params_kan_arity_1_5,params_kan_arity_1_6,params_kan_arity_1_7,params_kan_arity_1_8,params_kan_arity_1_9,params_kan_arity_2_0,params_kan_arity_2_1,params_kan_arity_2_2,params_kan_arity_2_3,params_kan_arity_2_4,params_kan_arity_2_5,params_kan_arity_2_6,params_kan_arity_2_7,params_kan_arity_2_8,params_kan_arity_2_9,params_kan_arity_3_0,params_kan_arity_3_1,params_kan_arity_3_2,params_kan_arity_3_3,params_kan_arity_3_4,params_kan_arity_3_5,params_kan_arity_3_6,params_kan_arity_3_7,params_kan_arity_3_8,params_kan_arity_3_9,params_kan_grid,params_kan_k,params_kan_layer_type_0,params_kan_layer_type_1,params_kan_layer_type_2,params_kan_layer_type_3,params_kan_mult_nodes_0,params_kan_mult_nodes_1,params_kan_mult_nodes_2,params_kan_mult_nodes_3,params_kan_n_layers,params_kan_neurons_0,params_kan_neurons_1,params_kan_neurons_2,params_kan_neurons_3,params_lr,state
236,327.6657715,33:58.3,34:38.1,0 days 00:00:39.772502,4,96,96,64,3,5,,,,,,,,,,,9,8,10,8,7,2,6,,,,,,,,,,,,,,,,,,,,,,,,4,4,normal,mixed,,,,7,,,2,9,10,,,0.003863228,COMPLETE
237,182.4729919,34:38.1,35:17.1,0 days 00:00:39.045726,4,96,96,64,3,5,,,,,,,,,,,9,6,6,10,3,2,7,,,,,,,,,,,,,,,,,,,,,,,,4,4,normal,mixed,,,,7,,,2,10,8,,,0.004645656,COMPLETE
238,343.2039795,35:17.1,35:56.2,0 days 00:00:39.080673,4,96,96,64,3,5,,,,,,,,,,,7,3,9,9,6,3,3,,,,,,,,,,,,,,,,,,,,,,,,4,4,normal,mixed,,,,7,,,2,10,8,,,0.005944623,COMPLETE
239,196.2462158,35:56.2,36:34.6,0 days 00:00:38.399099,4,96,96,8,3,5,,,,,,,,,,,9,3,10,7,4,2,,,,,,,,,,,,,,,,,,,,,,,,,3,4,normal,mixed,,,,6,,,2,10,10,,,0.003932222,COMPLETE
240,139.8074188,36:34.6,37:14.4,0 days 00:00:39.778339,4,96,96,128,3,5,,,,,,,,,,,9,6,10,9,5,,,,,,,,,,,,,,,,,,,,,,,,,,4,4,normal,mixed,,,,5,,,2,10,9,,,0.003396546,COMPLETE
241,204.4645386,37:14.4,37:54.0,0 days 00:00:39.572560,4,96,96,128,3,5,,,,,,,,,,,9,6,10,9,5,,,,,,,,,,,,,,,,,,,,,,,,,,4,4,normal,mixed,,,,5,,,2,10,9,,,0.002963808,COMPLETE
242,116.4413757,37:54.0,38:33.6,0 days 00:00:39.661573,4,96,96,128,3,5,,,,,,,,,,,9,6,10,9,5,,,,,,,,,,,,,,,,,,,,,,,,,,4,4,normal,mixed,,,,5,,,2,10,9,,,0.003379318,COMPLETE
243,193.0274048,38:33.6,39:12.9,0 days 00:00:39.298060,4,96,96,128,3,5,,,,,,,,,,,8,4,10,9,5,,,,,,,,,,,,,,,,,,,,,,,,,,4,4,normal,mixed,,,,5,,,2,10,8,,,0.003472548,COMPLETE
244,261.9335327,39:12.9,39:51.6,0 days 00:00:38.666810,4,96,96,64,3,5,,,,,,,,,,,9,7,9,9,,,,,,,,,,,,,,,,,,,,,,,,,,,4,4,normal,mixed,,,,4,,,2,9,10,,,0.004365899,COMPLETE
245,436.8534851,39:51.6,40:30.8,0 days 00:00:39.165385,4,96,96,96,3,5,,,,,,,,,,,9,4,6,10,7,,,,,,,,,,,,,,,,,,,,,,,,,,4,4,normal,mixed,,,,5,,,2,10,9,,,0.002493853,COMPLETE
246,191.5998688,40:30.8,41:08.8,0 days 00:00:38.031537,4,96,96,16,3,5,,,,,,,,,,,8,6,7,9,5,,,,,,,,,,,,,,,,,,,,,,,,,,4,4,normal,mixed,,,,5,,,2,10,8,,,0.003242251,COMPLETE
247,140.4014435,41:08.8,41:47.1,0 days 00:00:38.328287,4,96,32,64,3,5,,,,,,,,,,,9,3,7,9,6,4,6,3,,,,,,,,,,,,,,,,,,,,,,,4,4,normal,mixed,,,,8,,,2,10,8,,,0.002692483,COMPLETE
248,888.1931152,41:47.1,42:25.3,0 days 00:00:38.138612,4,96,32,16,3,5,,,,,,,,,,,9,2,7,9,6,4,6,3,,,,,,,,,,,,,,,,,,,,,,,4,4,normal,mixed,,,,8,,,2,10,8,,,0.002726179,COMPLETE
249,132.5375214,42:25.3,43:03.8,0 days 00:00:38.472942,4,96,32,128,3,5,,,,,,,,,,,9,7,7,10,4,5,7,,,,,,,,,,,,,,,,,,,,,,,,4,4,normal,mixed,,,,7,,,2,10,8,,,0.00206023,COMPLETE
250,274.0171509,43:03.8,43:42.7,0 days 00:00:38.923963,4,96,32,128,3,5,,,,,,,,,,,9,7,6,10,6,4,7,4,,,,,,,,,,,,,,,,,,,,,,,4,4,normal,mixed,,,,8,,,2,9,8,,,0.002100922,COMPLETE
251,226.1502838,43:42.7,44:21.9,0 days 00:00:39.179361,4,96,32,128,3,5,,,,,,,,,,,9,4,7,10,4,5,7,,,,,,,,,,,,,,,,,,,,,,,,4,4,normal,mixed,,,,7,,,2,10,8,,,0.002522559,COMPLETE
252,146.0010223,44:21.9,45:02.4,0 days 00:00:40.538633,4,96,32,128,3,5,,,,,,,,,,,9,7,7,9,4,5,6,6,10,,,,,,,,,,,,,,,,,,,,,,4,4,normal,mixed,,,,9,,,2,10,8,,,0.005124505,COMPLETE
253,165.352005,45:02.4,45:42.8,0 days 00:00:40.405261,4,96,32,128,3,5,,,,,,,,,,,9,8,7,9,5,5,6,6,9,,,,,,,,,,,,,,,,,,,,,,4,4,normal,mixed,,,,9,,,2,10,8,,,0.004205971,COMPLETE
254,110.3771591,45:42.8,46:23.0,0 days 00:00:40.212545,4,96,32,128,3,5,,,,,,,,,,,8,7,7,10,4,5,6,6,10,,,,,,,,,,,,,,,,,,,,,,4,4,normal,mixed,,,,9,,,2,10,8,,,0.004941945,COMPLETE
255,180.8111877,46:23.0,47:04.2,0 days 00:00:41.125820,4,96,32,128,3,5,,,,,,,,,,,8,7,7,10,4,5,6,6,10,10,,,,,,,,,,,,,,,,,,,,,4,4,normal,mixed,,,,10,,,2,10,8,,,0.004903023,COMPLETE
256,135.1411591,47:04.2,47:44.3,0 days 00:00:40.153567,4,96,32,128,3,5,,,,,,,,,,,8,7,7,10,3,6,7,4,7,,,,,,,,,,,,,,,,,,,,,,4,4,normal,mixed,,,,9,,,2,10,8,,,0.005149499,COMPLETE
257,235.3647766,47:44.3,48:24.7,0 days 00:00:40.374436,4,96,32,128,3,5,,,,,,,,,,,9,8,7,10,3,7,7,4,7,,,,,,,,,,,,,,,,,,,,,,4,4,normal,mixed,,,,9,,,2,10,8,,,0.005163183,COMPLETE
258,215.0810547,48:24.7,49:04.8,0 days 00:00:40.148779,4,96,32,128,3,5,,,,,,,,,,,7,7,7,10,4,6,7,3,10,,,,,,,,,,,,,,,,,,,,,,4,4,normal,mixed,,,,9,,,2,10,8,,,0.004415142,COMPLETE
259,157.5316162,49:04.9,49:44.9,0 days 00:00:40.068437,4,96,32,128,3,5,,,,,,,,,,,9,7,8,10,3,5,6,5,8,,,,,,,,,,,,,,,,,,,,,,4,4,normal,mixed,,,,9,,,2,10,8,,,0.0053349,COMPLETE
260,317.6897888,49:44.9,50:25.9,0 days 00:00:40.978948,4,96,32,128,3,5,,,,,,,,,,,10,7,7,10,4,6,8,6,10,2,,,,,,,,,,,,,,,,,,,,,4,4,normal,mixed,,,,10,,,2,9,8,,,0.002982903,COMPLETE
261,575.8763428,50:25.9,51:05.7,0 days 00:00:39.777482,4,96,32,128,3,5,,,,,,,,,,,7,7,7,9,4,5,6,4,6,,,,,,,,,,,,,,,,,,,,,,4,4,normal,mixed,,,,9,,,2,10,8,,,0.006006476,COMPLETE
262,295.7926331,51:05.7,51:45.1,0 days 00:00:39.451035,4,96,32,128,3,5,,,,,,,,,,,8,7,7,9,5,5,6,,,,,,,,,,,,,,,,,,,,,,,,4,4,normal,mixed,,,,7,,,2,10,8,,,0.003441748,COMPLETE
263,148.2550659,51:45.1,52:24.2,0 days 00:00:39.048543,4,96,32,16,3,5,,,,,,,,,,,8,6,8,9,5,4,7,3,,,,,,,,,,,,,,,,,,,,,,,4,4,normal,mixed,,,,8,,,2,10,8,,,0.003738321,COMPLETE
264,126.589653,52:24.2,53:03.6,0 days 00:00:39.376131,4,96,32,16,3,5,,,,,,,,,,,8,6,7,9,5,4,7,3,8,,,,,,,,,,,,,,,,,,,,,,4,4,normal,mixed,,,,9,,,2,10,8,,,0.004059362,COMPLETE
265,156.9969025,53:03.6,53:42.9,0 days 00:00:39.304122,4,96,32,16,3,5,,,,,,,,,,,8,6,2,9,5,4,7,3,8,,,,,,,,,,,,,,,,,,,,,,4,4,normal,mixed,,,,9,,,2,10,8,,,0.004053364,COMPLETE
266,247.1694641,53:42.9,54:22.4,0 days 00:00:39.521255,4,96,32,16,3,5,,,,,,,,,,,8,6,8,9,6,4,7,2,8,,,,,,,,,,,,,,,,,,,,,,4,4,normal,mixed,,,,9,,,2,10,8,,,0.004956833,COMPLETE
267,305.6436768,54:22.4,55:01.9,0 days 00:00:39.492394,4,96,32,16,3,5,,,,,,,,,,,8,6,6,10,5,4,7,2,9,,,,,,,,,,,,,,,,,,,,,,4,4,normal,mixed,,,,9,,,2,10,8,,,0.005718729,COMPLETE
268,146.1220398,55:01.9,55:41.7,0 days 00:00:39.757372,4,96,32,128,3,5,,,,,,,,,,,9,6,7,9,4,6,8,3,,,,,,,,,,,,,,,,,,,,,,,4,4,normal,mixed,,,,8,,,2,10,8,,,0.003708518,COMPLETE
269,209.517334,55:41.7,56:20.9,0 days 00:00:39.283669,4,96,32,128,3,5,,,,,,,,,,,9,6,7,9,4,6,3,3,,,,,,,,,,,,,,,,,,,,,,,4,4,normal,mixed,,,,8,,,2,10,9,,,0.004404655,COMPLETE
270,137.1703949,56:20.9,57:01.0,0 days 00:00:40.064741,4,96,32,128,3,5,,,,,,,,,,,9,6,8,10,4,7,9,3,,,,,,,,,,,,,,,,,,,,,,,4,4,normal,mixed,,,,8,,,2,10,8,,,0.003749636,COMPLETE
271,116.1331635,57:01.0,57:40.7,0 days 00:00:39.658996,4,96,32,128,3,5,,,,,,,,,,,9,6,8,10,4,5,9,3,,,,,,,,,,,,,,,,,,,,,,,4,4,normal,mixed,,,,8,,,2,10,8,,,0.003750495,COMPLETE
272,207.003479,57:40.7,58:20.7,0 days 00:00:39.987015,4,96,32,128,3,5,,,,,,,,,,,9,6,8,10,4,7,9,3,,,,,,,,,,,,,,,,,,,,,,,4,4,normal,mixed,,,,8,,,2,10,8,,,0.003954816,COMPLETE
273,508.5167236,58:20.7,59:00.7,0 days 00:00:40.068367,4,96,32,128,3,5,,,,,,,,,,,9,6,8,10,4,7,9,3,,,,,,,,,,,,,,,,,,,,,,,4,4,normal,mixed,,,,8,,,2,10,8,,,0.003622546,COMPLETE
274,163.3901672,59:00.7,59:40.6,0 days 00:00:39.837553,4,96,32,128,3,5,,,,,,,,,,,9,6,8,10,3,6,9,2,,,,,,,,,,,,,,,,,,,,,,,4,4,normal,mixed,,,,8,,,2,10,9,,,0.004682006,COMPLETE
275,254.6494751,59:40.6,00:20.5,0 days 00:00:39.885907,4,96,32,128,3,5,,,,,,,,,,,8,6,8,10,4,8,8,4,,,,,,,,,,,,,,,,,,,,,,,4,4,normal,mixed,,,,8,,,2,10,8,,,0.004028096,COMPLETE
276,242.2864075,00:20.5,01:01.1,0 days 00:00:40.676790,4,96,32,128,3,5,,,,,,,,,,,9,6,7,10,4,5,9,3,6,8,,,,,,,,,,,,,,,,,,,,,4,4,normal,mixed,,,,10,,,2,10,8,,,0.00355621,COMPLETE
277,223.4794769,01:01.1,01:40.8,0 days 00:00:39.676457,4,96,32,128,3,5,,,,,,,,,,,9,6,9,9,4,5,8,2,,,,,,,,,,,,,,,,,,,,,,,4,4,normal,mixed,,,,8,,,2,9,9,,,0.005004951,COMPLETE
278,167.7112122,01:40.8,02:18.9,0 days 00:00:38.080806,4,96,32,8,3,5,,,,,,,,,,,7,6,5,10,4,,,,,,,,,,,,,,,,,,,,,,,,,,4,4,normal,mixed,,,,5,,,2,10,8,,,0.003747847,COMPLETE
279,562.1889038,02:18.9,02:59.0,0 days 00:00:40.051929,4,96,32,128,3,5,,,,,,,,,,,10,6,8,9,4,4,9,3,7,,,,,,,,,,,,,,,,,,,,,,4,4,normal,mixed,,,,9,,,2,10,9,,,0.003126446,COMPLETE
280,213.6995544,02:59.0,03:39.0,0 days 00:00:40.064722,4,96,32,128,3,5,,,,,,,,,,,5,5,7,10,3,6,7,4,9,,,,,,,,,,,,,,,,,,,,,,4,4,normal,mixed,,,,9,,,2,10,8,,,0.004425583,COMPLETE
281,498.0389099,03:39.0,04:18.6,0 days 00:00:39.550204,4,96,32,96,3,5,,,,,,,,,,,9,3,7,9,5,4,8,7,,,,,,,,,,,,,,,,,,,,,,,4,4,normal,mixed,,,,8,,,2,10,8,,,0.003120548,COMPLETE
282,248.7103271,04:18.6,04:58.5,0 days 00:00:39.882823,4,96,16,16,3,5,,,,,,,,,,,9,7,7,9,5,5,10,2,10,,,,,,,,,,,,,,,,,,,,,,4,4,normal,mixed,,,,9,,,2,10,8,,,0.004222959,COMPLETE
283,173.8695221,04:58.5,05:38.1,0 days 00:00:39.608530,4,96,32,128,3,5,,,,,,,,,,,9,6,8,9,5,6,5,3,,,,,,,,,,,,,,,,,,,,,,,4,4,normal,mixed,,,,8,,,2,10,8,,,0.002827103,COMPLETE
284,129.4184418,05:38.1,06:17.0,0 days 00:00:38.909784,4,96,32,32,3,5,,,,,,,,,,,9,6,7,9,6,5,4,,,,,,,,,,,,,,,,,,,,,,,,4,4,normal,mixed,,,,7,,,2,10,8,,,0.003329502,COMPLETE
285,231.8104401,06:17.0,06:55.4,0 days 00:00:38.402706,4,96,32,32,3,5,,,,,,,,,,,8,6,7,9,6,,,,,,,,,,,,,,,,,,,,,,,,,,4,4,normal,mixed,,,,5,,,2,10,9,,,0.003458078,COMPLETE
286,196.286499,06:55.4,07:34.7,0 days 00:00:39.327003,4,96,32,32,3,5,,,,,,,,,,,10,6,7,9,6,5,4,4,,,,,,,,,,,,,,,,,,,,,,,4,4,normal,mixed,,,,8,,,2,10,7,,,0.003757878,COMPLETE
287,146.4616547,07:34.7,08:13.3,0 days 00:00:38.567294,4,96,8,32,3,5,,,,,,,,,,,9,7,6,6,6,5,4,,,,,,,,,,,,,,,,,,,,,,,,4,4,normal,mixed,,,,7,,,2,10,8,,,0.005317465,COMPLETE
288,210.0187378,08:13.3,08:52.1,0 days 00:00:38.793555,4,8,8,32,3,5,,,,,,,,,,,9,7,6,3,6,5,4,,,,,,,,,,,,,,,,,,,,,,,,4,4,normal,mixed,,,,7,,,2,10,8,,,0.005610508,COMPLETE
289,166.5750885,08:52.1,09:30.3,0 days 00:00:38.206547,4,96,8,32,3,5,,,,,,,,,,,9,7,6,10,,,,,,,,,,,,,,,,,,,,,,,,,,,4,4,normal,mixed,,,,4,,,2,10,8,,,0.005290826,COMPLETE
290,670.8129272,09:30.3,10:09.4,0 days 00:00:39.097313,4,96,8,32,3,5,,,,,,,,,,,9,7,7,6,6,5,6,,,,,,,,,,,,,,,,,,,,,,,,4,4,normal,mixed,,,,7,,,2,10,8,,,0.006461643,COMPLETE
291,145.2754364,10:09.4,10:48.3,0 days 00:00:38.943996,4,96,32,32,3,5,,,,,,,,,,,9,6,7,6,6,5,4,,,,,,,,,,,,,,,,,,,,,,,,4,4,normal,mixed,,,,7,,,2,10,8,,,0.004084454,COMPLETE
292,148.1503754,10:48.3,11:27.3,0 days 00:00:38.914770,4,96,32,32,3,5,,,,,,,,,,,9,8,7,4,6,5,4,,,,,,,,,,,,,,,,,,,,,,,,4,4,normal,mixed,,,,7,,,2,10,8,,,0.004073374,COMPLETE
293,129.6355743,11:27.3,12:06.5,0 days 00:00:39.238562,4,96,32,32,3,5,,,,,,,,,,,9,6,7,6,6,5,4,,,,,,,,,,,,,,,,,,,,,,,,4,4,normal,mixed,,,,7,,,2,10,8,,,0.004086862,COMPLETE
294,164.7497253,12:06.5,12:45.5,0 days 00:00:38.975965,4,96,32,32,3,5,,,,,,,,,,,9,8,7,6,6,5,4,,,,,,,,,,,,,,,,,,,,,,,,4,4,normal,mixed,,,,7,,,2,10,8,,,0.004921118,COMPLETE
295,137.2349854,12:45.5,13:24.5,0 days 00:00:39.000724,4,96,32,32,3,5,,,,,,,,,,,9,8,7,6,6,5,4,,,,,,,,,,,,,,,,,,,,,,,,4,4,normal,mixed,,,,7,,,2,10,8,,,0.004075459,COMPLETE
296,237.821991,13:24.5,14:03.4,0 days 00:00:38.924764,4,96,32,32,3,5,,,,,,,,,,,9,6,7,6,6,5,4,,,,,,,,,,,,,,,,,,,,,,,,4,4,normal,mixed,,,,7,,,2,9,8,,,0.003386117,COMPLETE
297,172.138382,14:03.4,14:42.6,0 days 00:00:39.186462,4,96,32,32,3,5,,,,,,,,,,,9,9,7,6,6,5,3,,,,,,,,,,,,,,,,,,,,,,,,4,4,normal,mixed,,,,7,,,2,10,8,,,0.004377616,COMPLETE
298,120.3887177,14:42.6,15:21.1,0 days 00:00:38.500270,4,64,32,32,3,5,,,,,,,,,,,9,2,7,6,6,5,,,,,,,,,,,,,,,,,,,,,,,,,4,4,normal,mixed,,,,6,,,2,10,8,,,0.004858803,COMPLETE
299,169.0520172,15:21.1,16:00.0,0 days 00:00:38.866705,4,64,32,32,3,5,,,,,,,,,,,9,9,7,7,6,6,,,,,,,,,,,,,,,,,,,,,,,,,4,4,normal,mixed,,,,6,,,2,10,7,,,0.004090846,COMPLETE
300,176.2765503,16:00.0,16:38.4,0 days 00:00:38.427569,4,64,32,32,3,5,,,,,,,,,,,9,2,10,6,2,5,,,,,,,,,,,,,,,,,,,,,,,,,4,4,normal,mixed,,,,6,,,2,10,8,,,0.0046789,COMPLETE
301,127.9824677,16:38.4,17:17.2,0 days 00:00:38.819473,4,64,32,32,3,5,,,,,,,,,,,9,2,7,6,6,5,4,,,,,,,,,,,,,,,,,,,,,,,,4,4,normal,mixed,,,,7,,,2,10,8,,,0.005391123,COMPLETE
302,166.6969299,17:17.2,17:55.0,0 days 00:00:37.814814,4,64,32,32,3,5,,,,,,,,,,,9,2,7,6,6,,,,,,,,,,,,,,,,,,,,,,,,,,4,4,normal,mixed,,,,5,,,2,10,8,,,0.006038576,COMPLETE
303,134.8855286,17:55.1,18:33.5,0 days 00:00:38.451458,4,64,32,32,3,5,,,,,,,,,,,9,2,7,6,6,5,4,,,,,,,,,,,,,,,,,,,,,,,,4,4,normal,mixed,,,,7,,,2,10,8,,,0.003890203,COMPLETE
304,117.3608856,18:33.5,19:11.2,0 days 00:00:37.650148,4,64,32,32,3,5,,,,,,,,,,,9,2,7,6,6,5,3,,,,,,,,,,,,,,,,,,,,,,,,4,4,normal,mixed,,,,7,,,2,10,8,,,0.00477709,COMPLETE
305,161.3282928,19:11.2,19:48.9,0 days 00:00:37.713380,4,64,32,32,3,5,,,,,,,,,,,9,2,7,6,6,5,3,,,,,,,,,,,,,,,,,,,,,,,,4,4,normal,mixed,,,,7,,,2,10,8,,,0.004092387,COMPLETE
306,155.7588196,19:48.9,20:26.6,0 days 00:00:37.767579,4,64,32,32,3,5,,,,,,,,,,,9,2,7,6,6,5,3,,,,,,,,,,,,,,,,,,,,,,,,4,4,normal,mixed,,,,7,,,2,10,8,,,0.003276795,COMPLETE
307,160.4711914,20:26.6,21:04.3,0 days 00:00:37.697556,4,64,32,32,3,5,,,,,,,,,,,9,2,10,6,6,5,2,,,,,,,,,,,,,,,,,,,,,,,,4,4,normal,mixed,,,,7,,,2,10,8,,,0.004632043,COMPLETE
308,276.0253906,21:04.3,21:42.0,0 days 00:00:37.621146,4,64,32,32,3,5,,,,,,,,,,,9,2,7,6,6,5,4,,,,,,,,,,,,,,,,,,,,,,,,4,4,normal,mixed,,,,7,,,2,10,7,,,0.003855405,COMPLETE
309,182.8796082,21:42.0,22:19.5,0 days 00:00:37.568746,4,64,32,32,3,5,,,,,,,,,,,9,2,7,5,6,5,,,,,,,,,,,,,,,,,,,,,,,,,4,4,normal,mixed,,,,6,,,2,10,9,,,0.002966382,COMPLETE
310,173.4345093,22:19.5,22:57.4,0 days 00:00:37.852917,4,64,32,32,3,5,,,,,,,,,,,9,2,7,5,10,5,4,,,,,,,,,,,,,,,,,,,,,,,,4,4,normal,mixed,,,,7,,,2,10,8,,,0.00343301,COMPLETE
311,112.3972702,22:57.4,23:35.0,0 days 00:00:37.639768,4,64,32,32,3,5,,,,,,,,,,,9,3,7,6,6,5,4,,,,,,,,,,,,,,,,,,,,,,,,4,4,normal,mixed,,,,7,,,2,10,8,,,0.005162749,COMPLETE
312,110.8883896,23:35.0,24:12.7,0 days 00:00:37.631560,4,64,32,32,3,5,,,,,,,,,,,9,3,7,6,6,5,4,,,,,,,,,,,,,,,,,,,,,,,,4,4,normal,mixed,,,,7,,,2,10,8,,,0.004895546,COMPLETE
313,133.3726349,24:12.7,24:50.5,0 days 00:00:37.804916,4,64,32,32,3,5,,,,,,,,,,,9,3,7,6,6,5,4,,,,,,,,,,,,,,,,,,,,,,,,4,4,normal,mixed,,,,7,,,2,10,8,,,0.005469034,COMPLETE
314,131.9393005,24:50.5,25:28.2,0 days 00:00:37.751458,4,64,32,32,3,5,,,,,,,,,,,9,3,7,6,7,5,4,,,,,,,,,,,,,,,,,,,,,,,,4,4,normal,mixed,,,,7,,,2,10,8,,,0.005571899,COMPLETE
315,186.198761,25:28.2,26:05.6,0 days 00:00:37.326804,4,64,32,32,3,5,,,,,,,,,,,3,3,7,6,7,5,4,,,,,,,,,,,,,,,,,,,,,,,,4,4,normal,mixed,,,,7,,,2,10,8,,,0.005718556,COMPLETE
316,149.9958801,26:05.6,26:43.4,0 days 00:00:37.800851,4,64,32,32,3,5,,,,,,,,,,,9,3,7,6,8,5,4,,,,,,,,,,,,,,,,,,,,,,,,4,4,normal,mixed,,,,7,,,2,10,8,,,0.006825819,COMPLETE
317,709.7991943,26:43.4,27:21.0,0 days 00:00:37.636786,4,64,32,32,3,5,,,,,,,,,,,9,3,7,6,7,5,4,,,,,,,,,,,,,,,,,,,,,,,,4,4,normal,mixed,,,,7,,,2,10,8,,,0.005048344,COMPLETE
318,135.3382874,27:21.0,27:58.7,0 days 00:00:37.643152,4,64,32,32,3,5,,,,,,,,,,,9,3,7,6,6,5,4,,,,,,,,,,,,,,,,,,,,,,,,4,4,normal,mixed,,,,7,,,2,10,8,,,0.005942144,COMPLETE
319,256.3663025,27:58.7,28:36.3,0 days 00:00:37.635441,4,64,32,32,3,5,,,,,,,,,,,9,3,7,5,7,5,4,,,,,,,,,,,,,,,,,,,,,,,,4,4,normal,mixed,,,,7,,,2,9,8,,,0.006275777,COMPLETE
320,139.2555084,28:36.3,29:13.9,0 days 00:00:37.641397,4,64,32,32,3,5,,,,,,,,,,,9,3,7,6,6,5,4,,,,,,,,,,,,,,,,,,,,,,,,4,4,normal,mixed,,,,7,,,2,10,8,,,0.00536357,COMPLETE
321,585.1864624,29:13.9,29:51.7,0 days 00:00:37.800337,4,64,32,32,3,5,,,,,,,,,,,9,3,7,6,6,5,4,,,,,,,,,,,,,,,,,,,,,,,,4,4,normal,mixed,,,,7,,,2,10,8,,,0.005829974,COMPLETE
322,115.8340607,29:51.7,30:29.7,0 days 00:00:37.981281,4,64,32,32,3,5,,,,,,,,,,,9,3,7,6,6,5,4,,,,,,,,,,,,,,,,,,,,,,,,4,4,normal,mixed,,,,7,,,2,10,8,,,0.005039285,COMPLETE
323,155.3832855,30:29.7,31:07.5,0 days 00:00:37.773917,4,64,32,32,3,5,,,,,,,,,,,9,3,7,6,6,5,3,,,,,,,,,,,,,,,,,,,,,,,,4,4,normal,mixed,,,,7,,,2,10,8,,,0.004847414,COMPLETE
324,153.0009308,31:07.5,31:46.0,0 days 00:00:38.516851,4,64,32,32,3,5,,,,,,,,,,,9,3,7,6,6,5,4,,,,,,,,,,,,,,,,,,,,,,,,4,4,normal,mixed,,,,7,,,2,10,8,,,0.00549027,COMPLETE
325,175.0311737,31:46.0,32:25.0,0 days 00:00:38.937374,4,64,128,32,3,5,,,,,,,,,,,9,3,7,6,7,5,4,,,,,,,,,,,,,,,,,,,,,,,,4,4,normal,mixed,,,,7,,,2,10,8,,,0.006172801,COMPLETE
326,408.7756653,32:25.0,33:03.5,0 days 00:00:38.502536,4,64,32,32,3,5,,,,,,,,,,,8,3,7,6,6,5,4,,,,,,,,,,,,,,,,,,,,,,,,4,4,normal,mixed,,,,7,,,2,10,8,,,0.004884666,COMPLETE
327,270.0451965,33:03.5,33:41.7,0 days 00:00:38.235626,4,64,16,8,3,5,,,,,,,,,,,9,2,7,6,6,5,,,,,,,,,,,,,,,,,,,,,,,,,4,4,normal,mixed,,,,6,,,2,10,8,,,0.007119149,COMPLETE
328,186.9436035,33:41.7,34:20.2,0 days 00:00:38.501431,4,64,32,32,3,5,,,,,,,,,,,8,3,7,7,6,8,5,,,,,,,,,,,,,,,,,,,,,,,,4,4,normal,mixed,,,,7,,,2,10,8,,,0.005464015,COMPLETE
329,346.6848145,34:20.2,34:58.7,0 days 00:00:38.510181,4,64,32,32,3,5,,,,,,,,,,,9,2,7,10,6,5,4,,,,,,,,,,,,,,,,,,,,,,,,4,4,normal,mixed,,,,7,,,2,10,8,,,0.004517333,COMPLETE
330,541.8695068,34:58.7,35:37.6,0 days 00:00:38.862101,4,64,32,96,3,5,,,,,,,,,,,9,3,9,6,6,6,4,,,,,,,,,,,,,,,,,,,,,,,,4,4,normal,mixed,,,,7,,,2,10,7,,,0.005016262,COMPLETE
331,135.592514,35:37.6,36:16.0,0 days 00:00:38.404415,4,64,32,32,3,5,,,,,,,,,,,9,2,7,6,6,5,4,,,,,,,,,,,,,,,,,,,,,,,,4,4,normal,mixed,,,,7,,,2,10,8,,,0.00454045,COMPLETE
332,138.7455292,36:16.0,36:54.6,0 days 00:00:38.600788,4,64,32,32,3,5,,,,,,,,,,,9,2,7,6,6,5,4,,,,,,,,,,,,,,,,,,,,,,,,4,4,normal,mixed,,,,7,,,2,10,8,,,0.004506946,COMPLETE
333,526.1238403,36:54.6,37:33.3,0 days 00:00:38.661325,4,64,32,32,3,5,,,,,,,,,,,9,2,7,6,6,5,4,,,,,,,,,,,,,,,,,,,,,,,,4,4,normal,mixed,,,,7,,,2,10,8,,,0.005747149,COMPLETE
334,151.6820068,37:33.3,38:12.1,0 days 00:00:38.800615,4,64,32,32,3,5,,,,,,,,,,,9,2,7,10,7,5,4,,,,,,,,,,,,,,,,,,,,,,,,4,4,normal,mixed,,,,7,,,2,10,8,,,0.005095351,COMPLETE
335,176.4377747,38:12.1,38:50.7,0 days 00:00:38.611036,4,64,32,32,3,5,,,,,,,,,,,9,3,7,5,3,7,9,,,,,,,,,,,,,,,,,,,,,,,,4,4,normal,mixed,,,,7,,,2,10,8,,,0.004531103,COMPLETE
336,205.3620911,38:50.7,39:29.5,0 days 00:00:38.803446,4,64,32,32,3,5,,,,,,,,,,,9,2,7,6,9,10,4,,,,,,,,,,,,,,,,,,,,,,,,4,4,normal,mixed,,,,7,,,2,10,8,,,0.005383813,COMPLETE
337,203.9880371,39:29.5,40:07.7,0 days 00:00:38.233801,4,64,32,32,3,5,,,,,,,,,,,8,2,7,7,6,5,5,,,,,,,,,,,,,,,,,,,,,,,,4,4,normal,mixed,,,,7,,,2,10,8,,,0.006343667,COMPLETE
338,142.2995605,40:07.7,40:45.9,0 days 00:00:38.182163,4,64,32,32,3,5,,,,,,,,,,,9,3,6,10,6,4,,,,,,,,,,,,,,,,,,,,,,,,,4,4,normal,mixed,,,,6,,,2,10,8,,,0.004674886,COMPLETE
339,,40:45.9,41:27.1,0 days 00:00:41.156712,4,64,32,32,3,5,8,2,10,4,2,2,10,10,,,9,3,7,6,6,5,2,,,,,,,,,,,,,,,,,,,,,,,,4,4,mixed,mixed,,,8,7,,,2,10,8,,,0.005124627,FAIL
340,,41:27.1,42:08.8,0 days 00:00:41.729055,4,64,32,32,3,5,8,6,10,4,2,10,10,10,,,9,3,5,6,6,5,2,,,,,,,,,,,,,,,,,,,,,,,,4,4,mixed,mixed,,,8,7,,,2,10,8,,,0.005020208,FAIL
341,,42:08.8,42:50.5,0 days 00:00:41.696553,4,64,32,32,3,5,8,2,10,5,2,2,10,10,10,,9,3,7,6,6,5,3,,,,,,,,,,,,,,,,,,,,,,,,4,4,mixed,mixed,,,9,7,,,2,10,8,,,0.004309662,FAIL
342,,42:50.5,43:31.8,0 days 00:00:41.300667,4,64,32,32,3,5,8,2,10,4,2,2,10,9,,,9,3,7,6,6,5,3,,,,,,,,,,,,,,,,,,,,,,,,4,4,mixed,mixed,,,8,7,,,2,10,8,,,0.005130979,FAIL
343,,43:31.8,44:13.3,0 days 00:00:41.451510,4,64,32,32,3,5,8,2,10,4,2,2,10,10,,,9,3,7,6,6,5,3,,,,,,,,,,,,,,,,,,,,,,,,4,4,mixed,mixed,,,8,7,,,2,10,8,,,0.004246276,FAIL
344,,44:13.3,44:54.7,0 days 00:00:41.447816,4,64,32,32,3,5,8,6,10,4,2,2,10,10,,,6,3,7,6,6,5,3,,,,,,,,,,,,,,,,,,,,,,,,4,4,mixed,mixed,,,8,7,,,2,10,8,,,0.004186302,FAIL
345,321.0249634,44:54.7,45:33.3,0 days 00:00:38.607282,4,64,32,32,3,5,,,,,,,,,,,9,3,7,6,6,5,3,,,,,,,,,,,,,,,,,,,,,,,,4,4,normal,mixed,,,,7,,,2,10,8,,,0.004217579,COMPLETE
346,,45:33.3,46:15.4,0 days 00:00:42.024863,4,64,32,64,3,5,8,2,10,4,3,2,10,10,,,7,6,7,10,6,5,4,,,,,,,,,,,,,,,,,,,,,,,,4,4,mixed,mixed,,,8,7,,,2,10,8,,,0.00514115,FAIL
347,,46:15.4,46:57.8,0 days 00:00:42.489769,4,64,32,64,3,5,8,2,10,4,2,2,10,10,10,,10,6,7,10,6,5,4,,,,,,,,,,,,,,,,,,,,,,,,4,4,mixed,mixed,,,9,7,,,2,10,8,,,0.004944914,FAIL
348,,46:57.8,47:39.5,0 days 00:00:41.675245,4,64,32,64,3,5,8,2,10,4,2,2,10,10,,,7,6,7,10,6,5,4,,,,,,,,,,,,,,,,,,,,,,,,4,4,mixed,mixed,,,8,7,,,2,10,8,,,0.005011859,FAIL
349,,47:39.5,48:21.4,0 days 00:00:41.866265,4,64,32,64,3,5,8,2,10,4,2,2,3,10,,,10,6,7,10,6,5,10,,,,,,,,,,,,,,,,,,,,,,,,4,4,mixed,mixed,,,8,7,,,2,10,8,,,0.005181291,FAIL
350,,48:21.4,49:03.2,0 days 00:00:41.783744,4,64,32,64,3,5,8,2,10,4,2,2,10,10,,,10,6,5,10,6,5,4,,,,,,,,,,,,,,,,,,,,,,,,4,4,mixed,mixed,,,8,7,,,2,10,8,,,0.005060431,FAIL
351,,49:03.2,49:45.1,0 days 00:00:41.867430,4,64,32,64,3,5,8,2,10,4,2,2,10,10,,,7,6,7,10,6,5,10,,,,,,,,,,,,,,,,,,,,,,,,4,4,mixed,mixed,,,8,7,,,2,10,8,,,0.004992678,FAIL
352,308.1167908,49:45.1,50:23.6,0 days 00:00:38.593227,4,64,32,64,3,5,,,,,,,,,,,7,6,5,10,6,5,4,,,,,,,,,,,,,,,,,,,,,,,,4,4,normal,mixed,,,,7,,,2,10,8,,,0.005170643,COMPLETE
353,178.3530121,50:23.7,51:02.1,0 days 00:00:38.432368,4,64,32,32,3,5,,,,,,,,,,,10,2,7,6,5,5,10,,,,,,,,,,,,,,,,,,,,,,,,4,4,normal,mixed,,,,7,,,2,10,8,,,0.004844867,COMPLETE
354,,51:02.1,51:44.6,0 days 00:00:42.468815,4,64,32,128,3,5,8,2,10,4,3,2,10,10,,,9,6,7,6,6,4,4,8,5,,,,,,,,,,,,,,,,,,,,,,4,4,mixed,mixed,,,8,9,,,2,10,9,,,0.005798923,FAIL
