number,value,datetime_start,datetime_complete,duration,params_gat_heads,params_gat_hidden_0,params_gat_hidden_1,params_gat_hidden_2,params_gat_layers,params_gat_out,params_kan_arity_0_0,params_kan_arity_0_1,params_kan_arity_0_2,params_kan_arity_0_3,params_kan_arity_0_4,params_kan_arity_0_5,params_kan_arity_0_6,params_kan_arity_0_7,params_kan_arity_0_8,params_kan_arity_0_9,params_kan_arity_1_0,params_kan_arity_1_1,params_kan_arity_1_2,params_kan_arity_1_3,params_kan_arity_1_4,params_kan_arity_1_5,params_kan_arity_1_6,params_kan_arity_1_7,params_kan_arity_1_8,params_kan_arity_1_9,params_kan_arity_2_0,params_kan_arity_2_1,params_kan_arity_2_2,params_kan_arity_2_3,params_kan_arity_2_4,params_kan_arity_2_5,params_kan_arity_2_6,params_kan_arity_2_7,params_kan_arity_2_8,params_kan_arity_2_9,params_kan_arity_3_0,params_kan_arity_3_1,params_kan_arity_3_2,params_kan_arity_3_3,params_kan_arity_3_4,params_kan_arity_3_5,params_kan_arity_3_6,params_kan_arity_3_7,params_kan_arity_3_8,params_kan_arity_3_9,params_kan_grid,params_kan_k,params_kan_layer_type_0,params_kan_layer_type_1,params_kan_layer_type_2,params_kan_layer_type_3,params_kan_mult_nodes_0,params_kan_mult_nodes_1,params_kan_mult_nodes_2,params_kan_mult_nodes_3,params_kan_n_layers,params_kan_neurons_0,params_kan_neurons_1,params_kan_neurons_2,params_kan_neurons_3,params_lr,state
846,,33:12.5,33:56.8,0 days 00:00:44.351604,4,64,96,16,3,5,8,5,5,7,4,6,6,7,,,10,3,10,5,5,,,,,,,,,,,,,,,,,,,,,,,,,,5,6,mixed,mixed,,,8,5,,,2,10,10,,,0.002744487,FAIL
847,,33:56.8,34:41.1,0 days 00:00:44.284852,4,64,96,16,3,5,8,5,5,7,4,6,6,7,,,10,3,10,5,8,,,,,,,,,,,,,,,,,,,,,,,,,,4,6,mixed,mixed,,,8,5,,,2,10,10,,,0.002631234,FAIL
848,,34:41.1,35:25.5,0 days 00:00:44.344022,4,64,96,16,3,5,8,5,5,7,4,6,6,7,,,10,3,10,5,8,,,,,,,,,,,,,,,,,,,,,,,,,,4,6,mixed,mixed,,,8,5,,,2,10,10,,,0.002657757,FAIL
849,363.3571167,35:25.5,36:06.2,0 days 00:00:40.703282,4,64,96,16,3,5,,,,,,,,,,,10,3,10,9,8,,,,,,,,,,,,,,,,,,,,,,,,,,4,6,normal,mixed,,,,5,,,2,10,10,,,0.002573115,COMPLETE
850,,36:06.2,36:46.7,0 days 00:00:40.512667,4,64,96,16,3,5,,,,,,,,,,,10,3,10,5,8,,,,,,,,,,,,,,,,,,,,,,,,,,5,6,normal,mixed,,,,5,,,2,9,10,,,0.002826014,FAIL
851,,36:46.7,37:30.6,0 days 00:00:43.935927,4,64,96,16,3,5,8,5,5,7,4,6,6,7,,,10,3,10,5,8,,,,,,,,,,,,,,,,,,,,,,,,,,3,6,mixed,mixed,,,8,5,,,2,9,10,,,0.002753898,FAIL
852,,37:30.6,38:13.9,0 days 00:00:43.306096,4,64,96,16,3,5,8,5,8,7,4,6,6,7,,,10,3,10,5,8,,,,,,,,,,,,,,,,,,,,,,,,,,4,6,mixed,mixed,,,8,5,,,2,9,10,,,0.002240367,FAIL
853,,38:13.9,38:58.3,0 days 00:00:44.391911,4,64,96,16,3,5,8,5,5,7,4,6,5,7,,,10,3,10,5,8,,,,,,,,,,,,,,,,,,,,,,,,,,4,6,mixed,mixed,,,8,5,,,2,9,10,,,0.002865651,FAIL
854,211.9689484,38:58.3,39:38.9,0 days 00:00:40.587471,4,64,96,16,3,5,,,,,,,,,,,10,3,10,5,8,,,,,,,,,,,,,,,,,,,,,,,,,,3,6,normal,mixed,,,,5,,,2,9,10,,,0.002939321,COMPLETE
855,,39:38.9,40:23.2,0 days 00:00:44.301303,4,64,96,16,3,5,8,5,5,7,5,6,6,7,,,10,3,10,5,5,,,,,,,,,,,,,,,,,,,,,,,,,,4,6,mixed,mixed,,,8,5,,,2,10,10,,,0.002243868,FAIL
856,160.1165619,40:23.2,41:02.9,0 days 00:00:39.683421,4,64,96,16,3,5,,,,,,,,,,,10,3,10,5,8,,,,,,,,,,,,,,,,,,,,,,,,,,5,5,normal,mixed,,,,5,,,2,10,10,,,0.00275267,COMPLETE
857,,41:02.9,41:46.2,0 days 00:00:43.309138,4,64,96,16,3,5,8,5,5,7,4,6,6,7,10,2,10,3,10,5,8,,,,,,,,,,,,,,,,,,,,,,,,,,4,6,mixed,mixed,,,10,5,,,2,7,10,,,0.003124078,FAIL
858,196.720871,41:46.2,42:26.1,0 days 00:00:39.906030,4,64,96,16,3,5,,,,,,,,,,,10,3,10,5,,,,,,,,,,,,,,,,,,,,,,,,,,,4,6,normal,mixed,,,,4,,,2,10,10,,,0.002265268,COMPLETE
859,,42:26.1,43:10.0,0 days 00:00:43.854237,4,64,96,16,3,5,8,5,5,7,4,6,6,7,,,10,3,10,5,8,,,,,,,,,,,,,,,,,,,,,,,,,,4,5,mixed,mixed,,,8,5,,,2,10,10,,,0.003132324,FAIL
860,,43:10.0,43:54.6,0 days 00:00:44.637891,4,64,96,16,3,5,8,5,5,7,4,6,6,7,,,10,3,10,5,8,,,,,,,,,,,,,,,,,,,,,,,,,,4,6,mixed,mixed,,,8,5,,,2,7,10,,,0.003130441,FAIL
861,,43:54.6,44:37.9,0 days 00:00:43.288775,4,64,96,16,3,5,8,5,5,7,4,6,6,7,10,2,10,3,10,5,8,,,,,,,,,,,,,,,,,,,,,,,,,,4,6,mixed,mixed,,,10,5,,,2,10,9,,,0.003120756,FAIL
862,179.7720795,44:37.9,45:18.5,0 days 00:00:40.605256,4,64,96,16,3,5,,,,,,,,,,,10,3,10,5,8,,,,,,,,,,,,,,,,,,,,,,,,,,4,6,normal,mixed,,,,5,,,2,10,9,,,0.003158548,COMPLETE
863,125.2380066,45:18.5,46:00.9,0 days 00:00:42.325421,4,128,96,,2,5,,,,,,,,,,,10,4,10,5,8,4,6,10,4,,,,,,,,,,,,,,,,,,,,,,4,6,normal,mixed,,,,9,,,2,10,10,,,0.002851205,COMPLETE
864,,46:00.9,46:45.9,0 days 00:00:44.998839,4,128,96,128,3,5,8,5,5,7,4,6,6,7,,,10,4,10,5,8,3,6,10,4,,,,,,,,,,,,,,,,,,,,,,4,6,mixed,mixed,,,8,9,,,2,10,10,,,0.002787604,FAIL
865,130.9390869,46:45.9,47:29.2,0 days 00:00:43.329515,4,128,96,128,3,5,,,,,,,,,,,10,4,10,5,8,3,6,10,4,6,,,,,,,,,,,,,,,,,,,,,4,6,normal,mixed,,,,10,,,2,10,10,,,0.002658198,COMPLETE
866,150.9178925,47:29.2,48:11.5,0 days 00:00:42.263416,4,128,96,16,3,5,,,,,,,,,,,10,4,10,5,8,4,6,9,2,,,,,,,,,,,,,,,,,,,,,,4,6,normal,mixed,,,,9,,,2,10,10,,,0.002108432,COMPLETE
867,,48:11.5,48:54.7,0 days 00:00:43.225350,4,128,96,,2,5,8,5,5,7,4,6,6,7,,,10,4,10,5,8,3,6,8,4,,,,,,,,,,,,,,,,,,,,,,4,6,mixed,mixed,,,8,9,,,2,10,10,,,0.002835455,FAIL
868,,48:54.7,49:37.9,0 days 00:00:43.198936,4,128,96,,2,5,8,5,5,7,4,6,6,7,,,10,4,10,5,8,3,6,8,4,,,,,,,,,,,,,,,,,,,,,,4,6,mixed,mixed,,,8,9,,,2,9,10,,,0.002788646,FAIL
869,327.2012024,49:37.9,50:19.3,0 days 00:00:41.355446,4,128,96,,2,5,,,,,,,,,,,10,4,10,5,8,2,6,8,4,,,,,,,,,,,,,,,,,,,,,,4,6,normal,mixed,,,,9,,,2,7,10,,,0.002433826,COMPLETE
870,125.5044403,50:19.3,51:00.3,0 days 00:00:41.065991,4,64,8,,2,5,,,,,,,,,,,10,4,10,5,8,3,6,7,3,,,,,,,,,,,,,,,,,,,,,,4,6,normal,mixed,,,,9,,,2,10,10,,,0.002781245,COMPLETE
871,,51:00.3,51:43.7,0 days 00:00:43.359548,4,128,96,,2,5,8,5,5,7,4,6,6,7,,,10,4,10,5,8,3,6,9,4,,,,,,,,,,,,,,,,,,,,,,4,6,mixed,mixed,,,8,9,,,2,10,10,,,0.002843114,FAIL
872,197.4709625,51:43.7,52:25.0,0 days 00:00:41.325802,4,128,8,,2,5,,,,,,,,,,,10,4,10,5,8,3,6,9,3,,,,,,,,,,,,,,,,,,,,,,4,6,normal,mixed,,,,9,,,2,10,10,,,0.002782874,COMPLETE
873,177.8112335,52:25.0,53:05.4,0 days 00:00:40.408376,4,128,8,,2,5,8,5,5,7,4,6,6,7,,,,,,,,,,,,,,,,,,,,,,,,,,,,,,,,,4,6,mixed,normal,,,8,,,,2,9,10,,,0.002527606,COMPLETE
874,,53:05.4,53:49.5,0 days 00:00:44.056922,4,64,96,,2,5,7,7,8,4,6,7,2,6,10,2,10,4,10,5,8,3,6,10,3,,,,,,,,,,,,,,,,,,,,,,4,6,mixed,mixed,,,10,9,,,2,10,10,,,0.002797591,FAIL
875,,53:49.5,54:33.7,0 days 00:00:44.195280,4,64,8,,2,5,7,7,8,4,6,7,2,7,10,2,10,4,10,5,8,3,6,10,3,,,,,,,,,,,,,,,,,,,,,,4,6,mixed,mixed,,,10,9,,,2,3,10,,,0.002837219,FAIL
876,,54:33.7,55:18.4,0 days 00:00:44.677796,4,64,8,,2,5,7,7,8,4,6,7,10,6,10,2,10,4,10,5,8,3,6,10,3,,,,,,,,,,,,,,,,,,,,,,4,6,mixed,mixed,,,10,9,,,2,10,10,,,0.002908318,FAIL
877,,55:18.4,56:02.9,0 days 00:00:44.544396,4,64,8,,2,5,7,7,8,4,6,7,10,6,10,2,10,4,10,5,8,3,6,10,3,,,,,,,,,,,,,,,,,,,,,,4,6,mixed,mixed,,,10,9,,,2,10,10,,,0.002936203,FAIL
878,,56:02.9,56:47.0,0 days 00:00:44.037182,4,64,96,,2,5,7,7,8,4,2,7,2,6,10,2,10,4,10,5,8,3,6,10,3,,,,,,,,,,,,,,,,,,,,,,4,6,mixed,mixed,,,10,9,,,2,10,10,,,0.002905213,FAIL
879,,56:47.0,57:31.2,0 days 00:00:44.215903,4,64,96,,2,5,7,7,8,4,6,7,2,6,10,2,10,4,10,5,8,3,6,10,3,,,,,,,,,,,,,,,,,,,,,,4,6,mixed,mixed,,,10,9,,,2,10,10,,,0.002990038,FAIL
880,,57:31.2,58:15.9,0 days 00:00:44.675097,4,64,8,,2,5,7,7,8,4,6,7,10,6,10,2,10,4,10,5,8,3,6,10,3,,,,,,,,,,,,,,,,,,,,,,4,6,mixed,mixed,,,10,9,,,2,10,10,,,0.002923072,FAIL
881,183.2590942,58:15.9,58:57.6,0 days 00:00:41.693911,4,64,8,,2,5,,,,,,,,,,,10,4,10,5,8,3,6,8,3,,,,,,,,,,,,,,,,,,,,,,4,6,normal,mixed,,,,9,,,2,10,10,,,0.003049766,COMPLETE
882,,58:57.6,59:40.2,0 days 00:00:42.640199,4,64,,,1,5,7,7,8,4,6,7,10,6,10,2,10,4,10,5,8,,,,,,,,,,,,,,,,,,,,,,,,,,4,6,mixed,mixed,,,10,5,,,2,3,10,,,0.002749355,FAIL
883,,59:40.2,00:22.9,0 days 00:00:42.660169,4,64,96,,2,5,9,7,8,4,6,7,2,6,10,2,10,4,10,5,4,,,,,,,,,,,,,,,,,,,,,,,,,,4,6,mixed,mixed,,,10,5,,,2,10,10,,,0.002783168,FAIL
884,,00:22.9,01:07.0,0 days 00:00:44.112945,4,64,8,128,3,5,7,7,8,4,6,7,2,,,,10,4,10,5,8,,,,,,,,,,,,,,,,,,,,,,,,,,4,6,mixed,mixed,,,7,5,,,2,10,10,,,0.002754831,FAIL
885,,01:07.0,01:50.5,0 days 00:00:43.538767,4,64,8,,2,5,7,7,8,4,6,7,10,6,10,3,10,4,10,5,8,,,,,,,,,,,,,,,,,,,,,,,,,,4,6,mixed,mixed,,,10,5,,,2,10,10,,,0.002717228,FAIL
886,,01:50.5,02:34.0,0 days 00:00:43.423651,4,64,8,,2,5,7,7,8,4,6,7,2,,,,10,4,10,5,8,,,,,,,,,,,,,,,,,,,,,,,,,,4,6,mixed,mixed,,,7,5,,,2,3,10,,,0.002782654,FAIL
887,,02:34.0,03:14.9,0 days 00:00:40.941878,4,64,96,128,3,5,,,,,,,,,,,10,4,10,5,8,,,,,,,,,,,,,,,,,,,,,,,,,,4,6,normal,mixed,,,,5,,,2,10,10,,,0.002691758,FAIL
888,,03:14.9,03:54.6,0 days 00:00:39.697976,4,64,8,,2,5,,,,,,,,,,,10,4,10,5,8,,,,,,,,,,,,,,,,,,,,,,,,,,4,6,normal,mixed,,,,5,,,2,10,10,,,0.002868659,FAIL
889,,03:54.6,04:37.5,0 days 00:00:42.888051,4,64,8,,2,5,7,7,8,4,6,7,2,6,10,2,10,4,10,5,8,,,,,,,,,,,,,,,,,,,,,,,,,,4,6,mixed,mixed,,,10,5,,,2,10,9,,,0.002776222,FAIL
890,,04:37.5,05:18.1,0 days 00:00:40.588018,4,64,8,,2,5,,,,,,,,,,,10,4,10,5,8,,,,,,,,,,,,,,,,,,,,,,,,,,4,7,normal,mixed,,,,5,,,2,10,10,,,0.002818324,FAIL
891,,05:18.1,06:00.8,0 days 00:00:42.726153,4,64,8,,2,5,7,7,8,4,6,7,2,6,10,2,10,4,10,5,8,,,,,,,,,,,,,,,,,,,,,,,,,,4,6,mixed,mixed,,,10,5,,,2,10,10,,,0.00268243,FAIL
892,,06:00.8,06:40.8,0 days 00:00:39.966322,4,64,96,,2,5,,,,,,,,,,,10,4,10,5,8,,,,,,,,,,,,,,,,,,,,,,,,,,4,6,normal,mixed,,,,5,,,2,10,10,,,0.002212871,FAIL
893,,06:40.8,07:23.9,0 days 00:00:43.111051,4,64,96,,2,5,7,7,8,4,6,7,2,6,10,2,10,4,10,5,8,,,,,,,,,,,,,,,,,,,,,,,,,,4,6,mixed,mixed,,,10,5,,,2,10,10,,,0.002608141,FAIL
894,,07:23.9,08:05.4,0 days 00:00:41.530796,4,64,8,,2,5,7,7,8,5,2,7,2,6,10,2,10,4,10,5,8,,,,,,,,,,,,,,,,,,,,,,,,,,4,6,mixed,mixed,,,10,5,,,2,10,10,,,0.002858665,FAIL
895,,08:05.4,08:48.1,0 days 00:00:42.628301,4,64,8,,2,5,7,7,9,4,6,7,10,6,3,2,10,4,10,5,8,,,,,,,,,,,,,,,,,,,,,,,,,,4,6,mixed,mixed,,,10,5,,,2,10,10,,,0.002790269,FAIL
896,,08:48.1,09:28.5,0 days 00:00:40.429489,4,64,8,128,3,5,,,,,,,,,,,10,4,10,5,8,,,,,,,,,,,,,,,,,,,,,,,,,,4,6,normal,mixed,,,,5,,,2,10,10,,,0.002729176,FAIL
897,463.5649719,09:28.5,10:07.0,0 days 00:00:38.490875,4,64,8,,2,5,,,,,,,,,,,10,4,10,5,8,,,,,,,,,,,,,,,,,,,,,,,,,,4,6,normal,mixed,,,,5,,,2,3,10,,,0.002878876,COMPLETE
898,,10:07.0,10:47.5,0 days 00:00:40.461948,4,64,8,,2,4,7,7,8,4,6,7,2,6,10,2,10,4,10,5,8,3,,,,,,,,,,,,,,,,,,,,,,,,,4,6,mixed,mixed,,,10,6,,,2,10,10,,,0.002217507,FAIL
899,897.4084473,10:47.5,11:27.9,0 days 00:00:40.385281,4,64,96,,2,4,,,,,,,,,,,10,4,10,5,8,3,,,,,,,,,,,,,,,,,,,,,,,,,4,6,normal,mixed,,,,6,,,2,10,10,,,0.002686472,COMPLETE
900,,11:27.9,12:10.4,0 days 00:00:42.582485,4,128,,,1,5,7,7,8,4,6,7,10,6,3,2,10,4,10,4,8,3,,,,,,,,,,,,,,,,,,,,,,,,,4,6,mixed,mixed,,,10,6,,,2,10,10,,,0.002260117,FAIL
901,,12:10.4,12:55.3,0 days 00:00:44.891364,4,64,8,,2,5,7,7,8,4,6,7,10,6,10,2,10,4,10,4,8,3,6,10,4,,,,,,,,,,,,,,,,,,,,,,4,6,mixed,mixed,,,10,9,,,2,10,10,,,0.002178374,FAIL
902,218.0621643,12:55.3,13:37.5,0 days 00:00:42.148640,4,128,96,,2,5,,,,,,,,,,,10,4,10,4,8,3,6,10,4,,,,,,,,,,,,,,,,,,,,,,4,6,normal,mixed,,,,9,,,2,10,10,,,0.002251819,COMPLETE
903,253.4169922,13:37.5,14:16.8,0 days 00:00:39.291031,4,64,8,,2,5,,,,,,,,,,,10,3,10,5,8,3,,,,,,,,,,,,,,,,,,,,,,,,,4,5,normal,mixed,,,,6,,,2,10,10,,,0.003017845,COMPLETE
904,,14:16.8,15:00.9,0 days 00:00:44.096904,4,64,96,,2,5,7,7,8,4,6,7,2,6,10,2,10,4,10,5,9,2,6,6,2,,,,,,,,,,,,,,,,,,,,,,4,6,mixed,mixed,,,10,9,,,2,10,10,,,0.00264872,FAIL
905,,15:00.9,15:45.7,0 days 00:00:44.786102,4,64,96,,2,5,7,7,8,4,6,7,2,6,10,2,10,4,10,5,9,2,6,6,2,,,,,,,,,,,,,,,,,,,,,,4,7,mixed,mixed,,,10,9,,,2,10,10,,,0.002650892,FAIL
906,145.8656464,15:45.7,16:26.8,0 days 00:00:41.085431,4,64,96,,2,5,,,,,,,,,,,10,4,10,5,8,2,6,6,2,,,,,,,,,,,,,,,,,,,,,,4,6,normal,mixed,,,,9,,,2,10,10,,,0.002636581,COMPLETE
907,,16:26.8,17:07.5,0 days 00:00:40.736342,4,64,8,,2,5,,,,,,,,,,,10,3,10,5,8,3,,,,,,,,,,,,,,,,,,,,,,,,,4,7,normal,mixed,,,,6,,,2,10,10,,,0.001179357,FAIL
908,,17:07.5,17:48.2,0 days 00:00:40.675619,4,64,8,,2,5,,,,,,,,,,,10,3,10,5,8,3,,,,,,,,,,,,,,,,,,,,,,,,,4,7,normal,mixed,,,,6,,,2,10,10,,,0.003213463,FAIL
909,,17:48.2,18:32.7,0 days 00:00:44.562770,4,64,96,128,3,5,7,7,8,4,6,7,10,6,10,2,10,3,10,5,8,3,,,,,,,,,,,,,,,,,,,,,,,,,4,6,mixed,mixed,,,10,6,,,2,10,10,,,0.003204128,FAIL
910,223.5127716,18:32.8,19:12.9,0 days 00:00:40.115439,4,64,96,,2,5,,,,,,,,,,,10,3,10,5,8,3,,,,,,,,,,,,,,,,,,,,,,,,,4,6,normal,mixed,,,,6,,,2,10,10,,,0.00321996,COMPLETE
911,,19:12.9,19:55.6,0 days 00:00:42.685242,4,64,8,,2,5,7,7,8,4,6,7,2,6,10,2,10,4,10,5,9,,,,,,,,,,,,,,,,,,,,,,,,,,4,6,mixed,mixed,,,10,5,,,2,10,10,,,0.00242631,FAIL
912,,19:55.6,20:38.7,0 days 00:00:43.150840,4,64,8,,2,5,7,7,9,4,6,7,2,6,10,2,10,4,10,5,8,,,,,,,,,,,,,,,,,,,,,,,,,,4,7,mixed,mixed,,,10,5,,,2,10,10,,,0.002809684,FAIL
913,189.4529877,20:38.7,21:18.8,0 days 00:00:40.049176,4,64,96,,2,5,,,,,,,,,,,10,4,10,10,8,,,,,,,,,,,,,,,,,,,,,,,,,,4,6,normal,mixed,,,,5,,,2,10,10,,,0.002431581,COMPLETE
914,,21:18.8,22:01.8,0 days 00:00:43.055093,4,64,8,,2,5,7,7,8,4,6,7,10,6,3,3,10,4,10,5,4,3,5,7,,,,,,,,,,,,,,,,,,,,,,,4,6,mixed,mixed,,,10,8,,,2,10,4,,,0.003208849,FAIL
915,,22:01.8,22:46.1,0 days 00:00:44.310078,4,64,8,128,3,5,7,7,9,4,6,7,10,6,10,2,10,4,10,5,4,3,5,7,,,,,,,,,,,,,,,,,,,,,,,4,6,mixed,mixed,,,10,8,,,2,10,5,,,0.0028519,FAIL
916,,22:46.1,23:28.6,0 days 00:00:42.446801,4,64,96,,2,5,7,7,8,4,6,7,2,6,10,2,10,4,2,5,4,3,2,7,,,,,,,,,,,,,,,,,,,,,,,4,6,mixed,mixed,,,10,8,,,2,10,9,,,0.002869505,FAIL
917,,23:28.6,24:12.3,0 days 00:00:43.745538,4,64,8,,2,5,7,7,8,4,6,7,2,6,10,2,10,4,10,5,4,3,5,7,,,,,,,,,,,,,,,,,,,,,,,4,7,mixed,mixed,,,10,8,,,2,10,9,,,0.002863632,FAIL
918,498.9666443,24:12.3,24:52.8,0 days 00:00:40.452937,4,64,8,,2,5,,,,,,,,,,,10,4,10,5,9,3,2,7,,,,,,,,,,,,,,,,,,,,,,,4,6,normal,mixed,,,,8,,,2,10,4,,,0.001144181,COMPLETE
919,,24:52.8,25:36.0,0 days 00:00:43.174183,4,64,96,128,3,5,7,7,8,4,6,6,2,6,10,2,10,3,10,5,4,3,,,,,,,,,,,,,,,,,,,,,,,,,4,6,mixed,mixed,,,10,6,,,2,10,9,,,0.002931709,FAIL
920,,25:36.0,26:18.4,0 days 00:00:42.446942,4,64,,,1,5,7,7,8,4,6,7,2,6,10,2,10,,,,,,,,,,,,,,,,,,,,,,,,,,,,,,4,7,mixed,mixed,,,10,1,,,2,10,6,,,0.002919708,FAIL
921,,26:18.4,27:02.0,0 days 00:00:43.585925,4,64,96,128,3,5,7,7,8,4,6,7,2,6,3,2,10,3,10,4,4,3,,,,,,,,,,,,,,,,,,,,,,,,,4,6,mixed,mixed,,,10,6,,,2,10,9,,,0.002831091,FAIL
922,206.5578308,27:02.0,27:42.3,0 days 00:00:40.296505,4,64,96,128,3,5,,,,,,,,,,,10,3,10,4,4,3,,,,,,,,,,,,,,,,,,,,,,,,,4,6,normal,mixed,,,,6,,,2,10,9,,,0.002831215,COMPLETE
923,,27:42.3,28:25.0,0 days 00:00:42.685034,4,32,96,,2,5,7,7,8,4,6,7,10,6,10,2,10,3,5,5,8,3,,,,,,,,,,,,,,,,,,,,,,,,,4,6,mixed,mixed,,,10,6,,,2,10,10,,,0.003124891,FAIL
924,,28:25.0,29:07.6,0 days 00:00:42.562088,4,32,96,,2,5,7,7,8,4,6,7,10,6,10,2,10,3,5,5,3,3,,,,,,,,,,,,,,,,,,,,,,,,,4,6,mixed,mixed,,,10,6,,,2,10,10,,,0.002003402,FAIL
925,,29:07.6,29:50.7,0 days 00:00:43.142980,4,32,96,8,3,5,7,7,8,4,6,7,10,6,10,3,10,3,5,5,3,3,,,,,,,,,,,,,,,,,,,,,,,,,4,6,mixed,mixed,,,10,6,,,2,10,6,,,0.00315647,FAIL
926,,29:50.7,30:33.2,0 days 00:00:42.450759,4,64,96,,2,5,7,7,8,4,6,7,2,6,10,2,10,,,,,,,,,,,,,,,,,,,,,,,,,,,,,,4,6,mixed,mixed,,,10,1,,,2,10,10,,,0.00321524,FAIL
927,152.9474182,30:33.2,31:12.9,0 days 00:00:39.691449,4,32,96,,2,5,,,,,,,,,,,10,3,10,5,8,3,,,,,,,,,,,,,,,,,,,,,,,,,4,6,normal,mixed,,,,6,,,2,10,10,,,0.001977603,COMPLETE
928,1012.406921,31:12.9,31:53.6,0 days 00:00:40.721821,4,64,,,1,5,,,,,,,,,,,10,3,5,10,4,2,5,10,,,,,,,,,,,,,,,,,,,,,,,4,7,normal,mixed,,,,8,,,2,10,6,,,0.003176108,COMPLETE
929,,31:53.6,32:38.1,0 days 00:00:44.529275,4,64,128,8,3,5,7,7,8,4,6,7,10,6,10,2,10,3,6,10,2,3,6,6,3,,,,,,,,,,,,,,,,,,,,,,4,6,mixed,mixed,,,10,9,,,2,10,9,,,0.002695429,FAIL
930,,32:38.1,33:22.2,0 days 00:00:44.057709,4,64,64,96,3,5,7,7,8,5,6,7,2,6,10,2,10,3,6,10,3,3,6,6,3,,,,,,,,,,,,,,,,,,,,,,4,6,mixed,mixed,,,10,9,,,2,10,9,,,0.002873901,FAIL
931,,33:22.2,34:05.4,0 days 00:00:43.229278,4,128,128,8,3,5,7,7,8,4,6,7,2,6,10,2,10,3,6,10,3,3,,,,,,,,,,,,,,,,,,,,,,,,,4,6,mixed,mixed,,,10,6,,,2,10,9,,,0.001673066,FAIL
932,,34:05.4,34:49.8,0 days 00:00:44.418704,4,16,96,8,3,5,9,7,8,4,6,7,10,6,2,2,10,3,6,10,8,3,6,6,3,,,,,,,,,,,,,,,,,,,,,,4,6,mixed,mixed,,,10,9,,,2,10,9,,,0.002755822,FAIL
933,,34:49.8,35:34.6,0 days 00:00:44.724620,4,16,64,64,3,5,7,7,8,4,2,7,10,6,10,2,10,3,6,10,3,3,6,6,3,,,,,,,,,,,,,,,,,,,,,,4,7,mixed,mixed,,,10,9,,,2,10,9,,,0.002882304,FAIL
934,,35:34.6,36:19.2,0 days 00:00:44.626467,4,16,128,64,3,5,7,7,8,4,6,7,2,6,10,2,10,3,10,10,8,3,6,6,3,,,,,,,,,,,,,,,,,,,,,,4,6,mixed,mixed,,,10,9,,,2,10,9,,,0.002895857,FAIL
935,,36:19.2,37:04.5,0 days 00:00:45.277042,4,128,128,8,3,5,7,7,8,4,6,7,10,6,10,2,10,3,4,10,8,3,6,6,3,,,,,,,,,,,,,,,,,,,,,,4,6,mixed,mixed,,,10,9,,,2,10,9,,,0.002869054,FAIL
936,,37:04.5,37:46.7,0 days 00:00:42.190919,4,16,128,8,3,5,7,7,8,4,6,7,10,,,,10,,,,,,,,,,,,,,,,,,,,,,,,,,,,,,4,6,mixed,mixed,,,7,1,,,2,10,9,,,0.002831225,FAIL
937,,37:46.7,38:31.7,0 days 00:00:45.035146,4,128,128,8,3,5,7,7,8,4,6,7,2,6,10,2,10,3,6,10,3,3,6,6,3,,,,,,,,,,,,,,,,,,,,,,4,7,mixed,mixed,,,10,9,,,2,10,9,,,0.002911152,FAIL
938,235.5889282,38:31.7,39:11.5,0 days 00:00:39.740584,4,16,128,8,3,5,,,,,,,,,,,10,3,10,10,8,3,6,6,3,,,,,,,,,,,,,,,,,,,,,,4,6,normal,mixed,,,,9,,,2,10,9,,,0.002884671,COMPLETE
939,,39:11.5,39:51.2,0 days 00:00:39.709676,4,64,64,64,3,5,7,7,8,4,6,7,10,6,10,2,9,3,6,5,8,,,,,,,,,,,,,,,,,,,,,,,,,,4,5,mixed,mixed,,,10,5,,,2,9,9,,,0.003287039,FAIL
940,,39:51.2,40:31.1,0 days 00:00:39.909525,4,128,96,64,3,5,7,7,8,4,6,7,10,6,10,2,9,3,2,5,3,,,,,,,,,,,,,,,,,,,,,,,,,,4,5,mixed,mixed,,,10,5,,,2,9,9,,,0.003314499,FAIL
941,,40:31.1,41:14.0,0 days 00:00:42.887746,4,128,64,128,3,5,7,7,8,4,6,7,2,6,10,2,9,3,2,5,8,,,,,,,,,,,,,,,,,,,,,,,,,,4,5,mixed,mixed,,,10,5,,,2,9,9,,,0.003322996,FAIL
942,,41:14.0,41:57.7,0 days 00:00:43.745819,4,128,64,128,3,5,7,7,8,4,6,7,10,,,,9,3,4,5,3,2,,,,,,,,,,,,,,,,,,,,,,,,,4,5,mixed,mixed,,,7,6,,,2,9,9,,,0.003322109,FAIL
943,,41:57.7,42:42.3,0 days 00:00:44.524417,4,128,64,64,3,5,7,7,8,4,6,7,2,6,10,2,9,3,2,5,8,2,,,,,,,,,,,,,,,,,,,,,,,,,4,5,mixed,mixed,,,10,6,,,2,9,9,,,0.00331973,FAIL
944,776.7956543,42:42.3,43:21.6,0 days 00:00:39.353767,4,128,64,64,3,5,,,,,,,,,,,9,3,6,5,8,,,,,,,,,,,,,,,,,,,,,,,,,,4,5,normal,mixed,,,,5,,,2,9,9,,,0.003316527,COMPLETE
945,,43:21.6,44:06.1,0 days 00:00:44.444901,4,64,16,96,3,5,7,7,8,4,6,7,10,6,10,2,10,3,10,10,3,2,,,,,,,,,,,,,,,,,,,,,,,,,4,7,mixed,mixed,,,10,6,,,2,10,10,,,0.002614774,FAIL
946,149.0458221,44:06.1,44:45.8,0 days 00:00:39.697816,4,64,96,96,3,5,,,,,,,,,,,10,3,10,8,2,2,,,,,,,,,,,,,,,,,,,,,,,,,4,5,normal,mixed,,,,6,,,2,10,10,,,0.002636733,COMPLETE
947,,44:45.8,45:30.7,0 days 00:00:44.943430,4,64,96,128,3,5,7,7,8,4,6,7,2,6,10,2,9,4,10,2,3,4,5,7,5,4,,,,,,,,,,,,,,,,,,,,,4,6,mixed,mixed,,,10,10,,,2,10,9,,,0.000557733,FAIL
948,225.4299164,45:30.7,46:10.9,0 days 00:00:40.193483,4,64,16,128,3,5,,,,,,,,,,,9,4,10,2,4,4,,,,,,,,,,,,,,,,,,,,,,,,,4,6,normal,mixed,,,,6,,,2,10,9,,,0.002355466,COMPLETE
949,,46:10.9,46:52.2,0 days 00:00:41.245691,4,64,96,128,3,5,,,,,,,,,,,9,4,4,10,3,3,,,,,,,,,,,,,,,,,,,,,,,,,4,7,normal,mixed,,,,6,,,2,10,9,,,0.003060786,FAIL
950,,46:52.2,47:37.0,0 days 00:00:44.879151,4,64,96,128,3,5,7,7,8,4,6,7,2,6,10,2,9,4,10,10,10,3,,,,,,,,,,,,,,,,,,,,,,,,,4,7,mixed,mixed,,,10,6,,,2,10,9,,,0.003047521,FAIL
951,,47:37.0,48:21.5,0 days 00:00:44.440691,4,64,96,128,3,5,7,7,8,4,6,7,2,6,10,2,9,4,4,10,7,3,,,,,,,,,,,,,,,,,,,,,,,,,4,7,mixed,mixed,,,10,6,,,2,10,9,,,0.002998053,FAIL
952,,48:21.5,49:04.6,0 days 00:00:43.125124,4,64,96,128,3,5,7,7,8,4,6,7,10,,,,9,4,4,10,10,3,,,,,,,,,,,,,,,,,,,,,,,,,4,6,mixed,mixed,,,7,6,,,2,10,9,,,0.002897176,FAIL
953,,49:04.6,49:47.9,0 days 00:00:43.237827,4,64,96,128,3,5,7,7,8,4,6,7,2,6,3,2,9,4,10,10,3,3,,,,,,,,,,,,,,,,,,,,,,,,,4,3,mixed,mixed,,,10,6,,,2,10,9,,,0.003009573,FAIL
954,,49:47.9,50:31.8,0 days 00:00:43.903135,4,64,96,128,3,5,7,7,8,5,6,7,10,6,10,3,9,4,2,10,3,3,,,,,,,,,,,,,,,,,,,,,,,,,4,3,mixed,mixed,,,10,6,,,2,10,9,,,0.002993059,FAIL
955,,50:31.8,51:16.2,0 days 00:00:44.434940,4,64,96,128,3,5,7,7,8,4,6,7,10,6,10,2,9,4,10,10,3,3,,,,,,,,,,,,,,,,,,,,,,,,,4,6,mixed,mixed,,,10,6,,,2,10,9,,,0.003042378,FAIL
956,,51:16.2,52:02.7,0 days 00:00:46.488342,4,64,96,128,3,5,7,10,8,4,6,7,2,5,10,2,9,4,10,10,7,3,5,9,5,4,,,,,,,,,,,,,,,,,,,,,4,7,mixed,mixed,,,10,10,,,2,10,9,,,0.002986343,FAIL
957,,52:02.7,52:46.3,0 days 00:00:43.592055,4,64,96,128,3,5,7,7,8,4,2,7,2,6,10,2,9,4,10,10,3,3,,,,,,,,,,,,,,,,,,,,,,,,,4,6,mixed,mixed,,,10,6,,,2,10,9,,,0.002993324,FAIL
958,,52:46.3,53:31.9,0 days 00:00:45.637426,4,64,96,128,3,5,7,7,8,4,6,7,2,6,10,2,9,4,10,10,3,3,5,9,5,4,,,,,,,,,,,,,,,,,,,,,4,6,mixed,mixed,,,10,10,,,2,10,9,,,0.00299645,FAIL
959,,53:31.9,54:16.4,0 days 00:00:44.429799,4,64,96,128,3,5,7,7,8,4,6,7,2,,,,9,4,10,10,3,3,,,,,,,,,,,,,,,,,,,,,,,,,4,6,mixed,mixed,,,7,6,,,2,10,9,,,0.003033795,FAIL
960,,54:16.4,55:01.9,0 days 00:00:45.512477,4,64,96,128,3,5,9,7,8,4,6,7,2,6,10,2,9,4,10,10,3,3,5,9,5,4,,,,,,,,,,,,,,,,,,,,,4,6,mixed,mixed,,,10,10,,,2,10,9,,,0.003055619,FAIL
961,118.3614197,55:01.9,55:43.2,0 days 00:00:41.322950,4,64,96,128,3,5,,,,,,,,,,,9,4,10,10,7,3,,,,,,,,,,,,,,,,,,,,,,,,,4,6,normal,mixed,,,,6,,,2,10,9,,,0.003009543,COMPLETE
962,237.7606659,55:43.2,56:24.4,0 days 00:00:41.159968,4,64,96,128,3,5,,,,,,,,,,,9,4,10,5,7,3,,,,,,,,,,,,,,,,,,,,,,,,,4,6,normal,mixed,,,,6,,,2,10,9,,,0.00291568,COMPLETE
963,,56:24.4,57:07.6,0 days 00:00:43.230554,3,64,96,128,3,5,7,7,9,4,6,7,10,6,10,2,,,,,,,,,,,,,,,,,,,,,,,,,,,,,,,5,6,mixed,normal,,,10,,,,2,10,9,,,0.005025662,FAIL
964,,57:07.6,57:50.1,0 days 00:00:42.484387,3,64,96,128,3,5,7,7,8,4,6,7,2,6,10,2,,,,,,,,,,,,,,,,,,,,,,,,,,,,,,,4,6,mixed,normal,,,10,,,,2,10,9,,,0.00489413,FAIL
965,,57:50.1,58:32.8,0 days 00:00:42.699227,4,64,96,128,3,5,7,7,8,4,6,7,2,6,10,2,,,,,,,,,,,,,,,,,,,,,,,,,,,,,,,4,6,mixed,normal,,,10,,,,2,10,9,,,0.004865171,FAIL
966,,58:32.8,59:16.2,0 days 00:00:43.438842,3,64,96,128,3,5,7,7,8,4,6,7,10,6,10,2,,,,,,,,,,,,,,,,,,,,,,,,,,,,,,,5,6,mixed,normal,,,10,,,,2,10,9,,,0.004876967,FAIL
967,217.2041321,59:16.3,59:53.5,0 days 00:00:37.228877,3,64,96,128,3,5,,,,,,,,,,,,,,,,,,,,,,,,,,,,,,,,,,,,,,,,,4,6,normal,normal,,,,,,,2,10,9,,,0.003475079,COMPLETE
