number,value,datetime_start,datetime_complete,duration,params_gat_heads,params_gat_hidden_0,params_gat_hidden_1,params_gat_hidden_2,params_gat_layers,params_gat_out,params_kan_arity_0_0,params_kan_arity_0_1,params_kan_arity_0_2,params_kan_arity_0_3,params_kan_arity_0_4,params_kan_arity_0_5,params_kan_arity_0_6,params_kan_arity_0_7,params_kan_arity_0_8,params_kan_arity_0_9,params_kan_arity_1_0,params_kan_arity_1_1,params_kan_arity_1_2,params_kan_arity_1_3,params_kan_arity_1_4,params_kan_arity_1_5,params_kan_arity_1_6,params_kan_arity_1_7,params_kan_arity_1_8,params_kan_arity_1_9,params_kan_arity_2_0,params_kan_arity_2_1,params_kan_arity_2_2,params_kan_arity_2_3,params_kan_arity_2_4,params_kan_arity_2_5,params_kan_arity_2_6,params_kan_arity_2_7,params_kan_arity_2_8,params_kan_arity_2_9,params_kan_arity_3_0,params_kan_arity_3_1,params_kan_arity_3_2,params_kan_arity_3_3,params_kan_arity_3_4,params_kan_arity_3_5,params_kan_arity_3_6,params_kan_arity_3_7,params_kan_arity_3_8,params_kan_arity_3_9,params_kan_grid,params_kan_k,params_kan_layer_type_0,params_kan_layer_type_1,params_kan_layer_type_2,params_kan_layer_type_3,params_kan_mult_nodes_0,params_kan_mult_nodes_1,params_kan_mult_nodes_2,params_kan_mult_nodes_3,params_kan_n_layers,params_kan_neurons_0,params_kan_neurons_1,params_kan_neurons_2,params_kan_neurons_3,params_lr,state
1091,,44:29.1,48:41.1,0 days 00:04:12.013211,3,128,16,128,3,3,3,5,,,,,,,,,,,,,,,,,,,,,,,,,,,,,,,,,,,,,,,3,8,mixed,normal,,,2,,,,2,8,1,,,0.004090643,FAIL
1092,,48:41.1,52:41.0,0 days 00:03:59.843492,2,32,,,1,5,2,9,3,2,8,2,,,,,,,,,,,,,,,,,,,,,,,,,,,,,,,,,,,5,8,mixed,,,,6,,,,1,7,,,,0.002195687,FAIL
1093,,52:41.0,56:59.8,0 days 00:04:18.850082,4,64,128,,2,5,2,4,10,4,10,8,6,7,3,,3,10,6,,,,,,,,,,,,,,,,,,,,,,,,,,,,5,6,mixed,mixed,normal,normal,9,3,,,4,5,9,1,8,0.007985252,FAIL
1094,409.8850403,56:59.8,01:07.5,0 days 00:04:07.693875,2,96,8,96,3,4,,,,,,,,,,,7,3,4,10,3,,,,,,,,,,,,,,,,,,,,,,,,,,6,6,normal,mixed,,,,5,,,2,5,9,,,0.001374775,COMPLETE
1095,,01:07.5,05:09.5,0 days 00:04:01.955493,1,32,8,64,3,5,10,,,,,,,,,,,,,,,,,,,,,,,,,,,,,,,,,,,,,,,,3,6,mixed,,,,1,,,,1,3,,,,0.001018155,FAIL
1096,,05:09.5,09:14.6,0 days 00:04:05.115271,4,32,16,,2,3,9,,,,,,,,,,,,,,,,,,,,,,,,,,,,,,,,,,,,,,,,3,5,mixed,normal,normal,normal,1,,,,4,2,4,6,3,0.007032888,FAIL
1097,,09:14.6,13:26.6,0 days 00:04:11.994656,4,32,32,,2,4,10,6,7,4,6,6,8,,,,8,2,10,,,,,,,,10,10,6,8,2,,,,,,2,,,,,,,,,,5,5,mixed,mixed,mixed,mixed,7,3,5,1,4,9,2,10,7,0.001117465,FAIL
1098,1411.93811,13:26.6,17:31.5,0 days 00:04:04.899102,1,8,,,1,2,,,,,,,,,,,,,,,,,,,,,,,,,,,,,,,,,,,,,,,,,6,7,normal,normal,normal,,,,,,3,3,8,6,,0.005493804,COMPLETE
1099,688.7590332,17:31.5,21:33.0,0 days 00:04:01.512079,2,8,32,,2,4,8,8,5,8,3,,,,,,,,,,,,,,,,,,,,,,,,,,,,,,,,,,,,6,4,mixed,normal,,,5,,,,2,2,10,,,0.002491464,COMPLETE
1100,329.5596313,21:33.0,25:35.0,0 days 00:04:01.978955,2,16,128,,2,5,,,,,,,,,,,3,4,5,,,,,,,,,,,,,,,,,,,,,,,,,,,,4,4,normal,mixed,normal,normal,,3,,,4,10,7,10,10,0.001080128,COMPLETE
1101,823.9334106,25:35.0,29:29.8,0 days 00:03:54.797830,2,8,,,1,4,,,,,,,,,,,,,,,,,,,,,,,,,,,,,,,,,,,,,,,,,7,5,normal,,,,,,,,1,6,,,,0.002225525,COMPLETE
1102,810.5518188,29:29.8,33:34.4,0 days 00:04:04.638840,4,16,64,8,3,4,,,,,,,,,,,,,,,,,,,,,,,,,,,,,,,,,,,,,,,,,8,8,normal,,,,,,,,1,6,,,,0.001961648,COMPLETE
1103,,33:34.4,37:45.9,0 days 00:04:11.452217,3,64,64,,2,3,7,5,3,9,10,4,6,10,4,,3,9,2,,,,,,,,,,,,,,,,,,,,,,,,,,,,6,8,mixed,mixed,,,9,3,,,2,9,9,,,0.007802966,FAIL
1104,,37:45.9,41:56.5,0 days 00:04:10.658176,3,96,128,,2,4,,,,,,,,,,,3,7,3,,,,,,,,5,,,,,,,,,,3,2,5,7,8,,,,,,4,5,normal,mixed,mixed,mixed,,3,1,5,4,10,1,5,2,0.007486703,FAIL
1105,460.7548523,41:56.5,45:55.5,0 days 00:03:58.920255,1,32,32,32,3,3,,,,,,,,,,,,,,,,,,,,,,,,,,,,,,,,,,,,,,,,,6,5,normal,normal,,,,,,,2,10,3,,,0.003289903,COMPLETE
1106,305.1410217,45:55.5,49:53.9,0 days 00:03:58.424210,1,96,8,,2,2,,,,,,,,,,,3,6,5,,,,,,,,,,,,,,,,,,,,,,,,,,,,6,3,normal,mixed,,,,3,,,2,8,10,,,0.003048035,COMPLETE
1107,2018.448364,49:53.9,53:54.8,0 days 00:04:00.964874,2,32,,,1,4,,,,,,,,,,,7,3,4,,,,,,,,,,,,,,,,,,,,,,,,,,,,4,4,normal,mixed,normal,,,3,,,3,3,5,3,,0.005645579,COMPLETE
1108,,53:54.8,58:00.8,0 days 00:04:05.976006,2,96,,,1,3,3,9,2,10,4,,,,,,6,7,7,10,3,5,9,9,4,,,,,,,,,,,,,,,,,,,,,,4,6,mixed,mixed,,,5,9,,,2,2,1,,,0.005293935,FAIL
1109,3809.071533,58:00.8,02:04.5,0 days 00:04:03.659363,3,8,32,,2,3,,,,,,,,,,,5,9,8,10,4,7,,,,,,,,,,,,,,,,,,,,,,,,,5,3,normal,mixed,normal,normal,,6,,,4,2,10,5,1,0.001056175,COMPLETE
1110,,02:04.5,06:10.2,0 days 00:04:05.709913,1,64,,,1,5,,,,,,,,,,,9,8,2,5,8,10,,,,,10,2,2,4,10,3,,,,,,,,,,,,,,,5,8,normal,mixed,mixed,normal,,6,6,,4,10,4,7,2,0.001139916,FAIL
1111,893.8823853,06:10.2,10:13.4,0 days 00:04:03.217206,1,32,16,16,3,4,,,,,,,,,,,5,,,,,,,,,,,,,,,,,,,,,,,,,,,,,,7,5,normal,mixed,normal,,,1,,,3,8,6,4,,0.001963174,COMPLETE
1112,690.5183716,10:13.4,14:25.4,0 days 00:04:12.006669,4,64,128,8,3,5,,,,,,,,,,,,,,,,,,,,,,,,,,,,,,,,,,,,,,,,,6,4,normal,normal,,,,,,,2,6,10,,,0.00141105,COMPLETE
1113,,14:25.4,18:35.1,0 days 00:04:09.687375,2,128,,,1,2,,,,,,,,,,,4,10,2,7,3,8,3,10,10,,9,8,3,,,,,,,,,,,,,,,,,,7,8,normal,mixed,mixed,,,9,3,,3,4,9,6,,0.001110239,FAIL
1114,,18:35.1,22:45.0,0 days 00:04:09.886261,4,8,128,,2,4,,,,,,,,,,,5,4,4,5,10,,,,,,,,,,,,,,,,,,,,,,,,,,4,7,normal,mixed,,,,5,,,2,9,4,,,0.002343139,FAIL
1115,1122.22937,22:45.0,26:48.5,0 days 00:04:03.511778,3,64,64,,2,3,,,,,,,,,,,,,,,,,,,,,,,,,,,,,,,,,,,,,,,,,5,6,normal,,,,,,,,1,4,,,,0.001518461,COMPLETE
1116,,26:48.5,30:57.7,0 days 00:04:09.198503,2,128,,,1,2,,,,,,,,,,,9,2,7,8,9,8,,,,,3,3,8,3,10,5,3,9,,,,,,,,,,,,,6,5,normal,mixed,mixed,normal,,6,8,,4,6,2,6,9,0.008137492,FAIL
1117,,30:57.7,35:00.8,0 days 00:04:03.111982,3,32,,,1,2,8,9,5,10,8,9,4,,,,,,,,,,,,,,,,,,,,,,,,,,,,,,,,,,5,5,mixed,,,,7,,,,1,3,,,,0.00291783,FAIL
1118,310.5828552,35:00.8,39:13.6,0 days 00:04:12.794778,4,96,96,16,3,4,,,,,,,,,,,,,,,,,,,,,3,4,5,6,4,8,,,,,,,,,,,,,,,7,5,normal,normal,mixed,,,,6,,3,7,4,8,,0.003691565,COMPLETE
1119,,39:13.6,43:25.6,0 days 00:04:12.009901,1,96,,,1,3,8,8,7,8,5,2,5,,,,,,,,,,,,,,2,10,7,8,3,7,2,7,,,,,,,,,,,,,5,8,mixed,normal,mixed,normal,7,,8,,4,4,9,5,3,0.001499287,FAIL
1120,,43:25.6,47:35.5,0 days 00:04:09.862342,1,32,8,128,3,4,8,4,6,4,9,3,9,8,4,,8,7,8,2,4,2,6,4,7,,,,,,,,,,,,,,,,,,,,,,8,6,mixed,mixed,normal,normal,9,9,,,4,8,2,2,6,0.002503125,FAIL
1121,,47:35.5,51:39.4,0 days 00:04:03.853901,3,128,,,1,2,4,5,5,4,4,7,,,,,,,,,,,,,,,,,,,,,,,,,,,,,,,,,,,5,7,mixed,normal,,,6,,,,2,3,10,,,0.008868312,FAIL
1122,,51:39.4,55:50.8,0 days 00:04:11.391621,3,96,8,64,3,4,,,,,,,,,,,5,4,5,3,7,3,7,4,4,3,10,10,9,,,,,,,,3,8,7,5,5,10,6,9,,,5,4,normal,mixed,mixed,mixed,,10,3,8,4,4,1,4,6,0.006395416,FAIL
1123,,55:50.8,59:57.3,0 days 00:04:06.546790,3,64,,,1,3,2,6,3,9,4,5,7,3,5,5,6,10,2,10,4,4,5,4,,,,,,,,,,,,,,,,,,,,,,,3,4,mixed,mixed,,,10,8,,,2,9,3,,,0.007185618,FAIL
1124,590.8724976,59:57.3,04:00.6,0 days 00:04:03.258235,1,8,,,1,2,,,,,,,,,,,2,4,7,8,2,2,5,7,,,,,,,,,,,,,,,,,,,,,,,4,6,normal,mixed,,,,8,,,2,5,7,,,0.001424371,COMPLETE
1125,,04:00.6,08:06.2,0 days 00:04:05.665352,2,16,,,1,3,6,8,,,,,,,,,9,2,4,5,4,,,,,,,,,,,,,,,,6,9,7,3,4,,,,,,8,8,mixed,mixed,normal,mixed,2,5,,5,4,1,6,5,7,0.007220826,FAIL
1126,575.6834106,08:06.2,12:08.9,0 days 00:04:02.608573,2,8,128,96,3,2,,,,,,,,,,,,,,,,,,,,,7,5,,,,,,,,,,,,,,,,,,,7,4,normal,normal,mixed,normal,,,2,,4,5,1,5,9,0.007132408,COMPLETE
1127,387.0438538,12:08.9,16:10.4,0 days 00:04:01.572866,1,16,64,,2,4,,,,,,,,,,,,,,,,,,,,,5,3,5,3,,,,,,,,,,,,,,,,,3,6,normal,normal,mixed,,,,4,,3,8,2,8,,0.002164866,COMPLETE
1128,,16:10.4,20:18.0,0 days 00:04:07.616174,3,32,128,32,3,2,6,6,3,9,10,10,,,,,,,,,,,,,,,,,,,,,,,,,,,,,,,,,,,8,7,mixed,normal,,,6,,,,2,6,10,,,0.004151082,FAIL
1129,,20:18.0,24:23.8,0 days 00:04:05.743820,3,128,,,1,5,4,8,10,6,8,6,6,7,,,,,,,,,,,,,,,,,,,,,,,,,,,,,,,,,3,5,mixed,normal,normal,,8,,,,3,10,9,9,,0.002456666,FAIL
1130,,24:23.8,28:25.9,0 days 00:04:02.086036,2,128,64,,2,4,7,3,3,5,7,9,3,7,3,,,,,,,,,,,,,,,,,,,,,,,,,,,,,,,,8,7,mixed,,,,9,,,,1,3,,,,0.00977541,FAIL
1131,475.5560608,28:25.9,32:35.2,0 days 00:04:09.356317,3,32,16,96,3,5,,,,,,,,,,,,,,,,,,,,,6,5,10,9,8,7,8,6,9,,,,,,,,,,,,6,7,normal,normal,mixed,,,,9,,3,7,6,7,,0.001556085,COMPLETE
1132,,32:35.2,36:48.7,0 days 00:04:13.448287,3,8,128,,2,2,,,,,,,,,,,4,7,6,3,5,10,5,6,5,6,6,,,,,,,,,,9,4,5,,,,,,,,5,8,normal,mixed,mixed,mixed,,10,1,3,4,5,1,4,6,0.002778037,FAIL
1133,428.9960632,36:48.7,40:50.9,0 days 00:04:02.202796,2,96,128,,2,4,,,,,,,,,,,,,,,,,,,,,,,,,,,,,,,,,,,,,,,,,7,3,normal,normal,,,,,,,2,5,9,,,0.008329936,COMPLETE
1134,,40:50.9,45:03.9,0 days 00:04:12.986381,3,96,64,16,3,5,9,2,7,5,9,8,5,6,10,3,9,8,6,7,5,6,5,10,6,4,,,,,,,,,,,,,,,,,,,,,4,4,mixed,mixed,normal,normal,10,10,,,4,7,6,10,2,0.009023751,FAIL
1135,,45:03.9,49:12.8,0 days 00:04:08.886178,3,64,64,,2,5,5,5,5,6,3,2,7,8,8,5,,,,,,,,,,,,,,,,,,,,,10,4,2,10,10,7,9,8,,,5,3,mixed,normal,normal,mixed,10,,,8,4,4,2,8,7,0.001790617,FAIL
1136,,49:12.8,53:23.2,0 days 00:04:10.458523,2,128,32,64,3,5,2,4,8,2,2,3,10,7,6,7,8,3,9,4,5,8,,,,,6,,,,,,,,,,,,,,,,,,,,3,3,mixed,mixed,mixed,normal,10,6,1,,4,1,8,2,10,0.00516181,FAIL
1137,,53:23.2,57:32.1,0 days 00:04:08.892276,3,16,128,,2,3,2,2,7,9,9,5,6,7,10,,,,,,,,,,,,,,,,,,,,,,,,,,,,,,,,8,5,mixed,normal,,,9,,,,2,5,6,,,0.00761045,FAIL
1138,,57:32.1,01:41.4,0 days 00:04:09.243509,3,64,96,,2,3,8,5,9,6,,,,,,,6,3,2,9,9,,,,,,,,,,,,,,,,,,,,,,,,,,5,5,mixed,mixed,,,4,5,,,2,10,8,,,0.001723232,FAIL
1139,3578.897461,01:41.4,05:43.6,0 days 00:04:02.215856,2,8,,,1,2,,,,,,,,,,,,,,,,,,,,,,,,,,,,,,,,,,,,,,,,,8,8,normal,normal,,,,,,,2,4,1,,,0.002623172,COMPLETE
1140,388.87854,05:43.6,09:52.4,0 days 00:04:08.766643,4,96,16,16,3,3,5,8,3,9,5,9,,,,,,,,,,,,,,,,,,,,,,,,,,,,,,,,,,,8,3,mixed,normal,normal,,6,,,,3,5,8,7,,0.002675315,COMPLETE
1141,,09:52.4,14:11.7,0 days 00:04:19.354028,4,64,128,16,3,4,7,4,9,8,,,,,,,,,,,,,,,,,7,4,8,8,8,,,,,,,,,,,,,,,,8,6,mixed,normal,mixed,,4,,5,,3,8,5,8,,0.003247839,FAIL
1142,,14:11.7,18:19.4,0 days 00:04:07.635154,1,32,96,128,3,2,4,3,,,,,,,,,,,,,,,,,,,,,,,,,,,,,2,7,,,,,,,,,3,5,mixed,normal,normal,mixed,2,,,2,4,4,5,6,7,0.001149583,FAIL
1143,3899.328857,18:19.4,22:20.6,0 days 00:04:01.199301,1,128,128,64,3,4,6,6,2,,,,,,,,,,,,,,,,,,,,,,,,,,,,,,,,,,,,,,3,4,mixed,normal,,,3,,,,2,8,1,,,0.007894849,COMPLETE
1144,646.5828247,22:20.6,26:21.5,0 days 00:04:00.953440,3,128,64,16,3,3,,,,,,,,,,,,,,,,,,,,,,,,,,,,,,,,,,,,,,,,,4,4,normal,,,,,,,,1,5,,,,0.004847198,COMPLETE
1145,,26:21.5,30:29.8,0 days 00:04:08.275489,2,96,,,1,2,8,4,3,7,,,,,,,,,,,,,,,,,7,6,4,8,,,,,,,,,,,,,,,,,8,7,mixed,normal,mixed,normal,4,,4,,4,9,6,7,2,0.005322253,FAIL
1146,,30:29.8,34:36.6,0 days 00:04:06.773882,1,128,32,,2,2,5,2,8,,,,,,,,4,2,5,4,4,4,8,2,,,2,10,6,10,3,,,,,,,,,,,,,,,,8,7,mixed,mixed,mixed,normal,3,8,5,,4,7,10,3,3,0.001280575,FAIL
1147,,34:36.6,38:40.9,0 days 00:04:04.310602,1,64,8,,2,2,,,,,,,,,,,6,10,4,8,6,2,2,10,,,3,5,8,9,6,10,,,,,,,,,,,,,,,3,6,normal,mixed,mixed,,,8,6,,3,6,1,4,,0.003359106,FAIL
1148,524.7426758,38:40.9,42:39.2,0 days 00:03:58.264164,4,8,,,1,3,,,,,,,,,,,4,5,6,10,9,4,4,4,,,,,,,,,,,,,,,,,,,,,,,7,4,normal,mixed,,,,8,,,2,2,5,,,0.008840906,COMPLETE
1149,3347.491699,42:39.2,46:49.4,0 days 00:04:10.235035,4,128,,,1,4,,,,,,,,,,,,,,,,,,,,,,,,,,,,,,,,,,,,,,,,,6,8,normal,normal,normal,,,,,,3,2,5,4,,0.001491986,COMPLETE
1150,583.5987549,46:49.4,51:02.7,0 days 00:04:13.309875,4,32,96,96,3,5,,,,,,,,,,,,,,,,,,,,,,,,,,,,,,,,,,,,,,,,,5,6,normal,,,,,,,,1,9,,,,0.001991433,COMPLETE
1151,927.1504517,51:02.7,55:04.8,0 days 00:04:02.121824,2,8,32,96,3,3,,,,,,,,,,,,,,,,,,,,,,,,,,,,,,,,,,,,,,,,,5,5,normal,,,,,,,,1,6,,,,0.001339037,COMPLETE
1152,546.4070435,55:04.8,59:04.5,0 days 00:03:59.707599,2,8,,,1,4,,,,,,,,,,,,,,,,,,,,,,,,,,,,,,,,,,,,,,,,,3,4,normal,normal,normal,,,,,,3,4,7,10,,0.006456437,COMPLETE
1153,,59:04.5,03:17.3,0 days 00:04:12.740228,2,32,128,64,3,4,10,2,10,6,3,4,5,,,,5,8,10,8,5,,,,,,3,5,6,7,8,4,,,,,,,,,,,,,,,7,4,mixed,mixed,mixed,,7,5,6,,3,9,5,3,,0.007329553,FAIL
1154,,03:17.3,07:24.9,0 days 00:04:07.583568,3,128,16,,2,3,,,,,,,,,,,9,8,,,,,,,,,,,,,,,,,,,3,2,5,7,8,,,,,,6,3,normal,mixed,normal,mixed,,2,,5,4,5,5,4,7,0.009666596,FAIL
1155,,07:24.9,11:43.3,0 days 00:04:18.452629,4,128,96,16,3,4,9,10,7,9,8,9,9,4,3,,,,,,,,,,,,,,,,,,,,,,,,,,,,,,,,4,7,mixed,,,,9,,,,1,1,,,,0.009260619,FAIL
1156,2229.599365,11:43.3,15:52.7,0 days 00:04:09.357233,4,64,16,64,3,3,,,,,,,,,,,,,,,,,,,,,,,,,,,,,,,,,,,,,,,,,6,7,normal,normal,normal,,,,,,3,7,1,4,,0.003878719,COMPLETE
1157,3899.328857,15:52.7,19:54.3,0 days 00:04:01.651684,4,16,16,32,3,2,,,,,,,,,,,,,,,,,,,,,,,,,,,,,,,,,,,,,,,,,5,6,normal,,,,,,,,1,1,,,,0.009729446,COMPLETE
1158,3307.482422,19:54.3,23:59.2,0 days 00:04:04.823890,1,96,128,128,3,3,,,,,,,,,,,,,,,,,,,,,,,,,,,,,,,,,,,,,,,,,8,8,normal,normal,,,,,,,2,3,1,,,0.003436278,COMPLETE
1159,,23:59.2,28:05.7,0 days 00:04:06.577218,1,16,,,1,3,2,5,4,,,,,,,,3,8,5,10,6,2,3,,,,,,,,,,,,,,,,,,,,,,,,4,5,mixed,mixed,normal,normal,3,7,,,4,3,2,8,6,0.003414892,FAIL
1160,427.0230408,28:05.7,32:05.7,0 days 00:03:59.923407,2,64,,,1,3,5,2,4,,,,,,,,,,,,,,,,,,,,,,,,,,,,,,,,,,,,,,6,5,mixed,,,,3,,,,1,1,,,,0.009396398,COMPLETE
1161,1146.639282,32:05.7,36:07.5,0 days 00:04:01.791809,3,96,,,1,2,,,,,,,,,,,,,,,,,,,,,,,,,,,,,,,,,,,,,,,,,6,6,normal,normal,,,,,,,2,10,4,,,0.002325639,COMPLETE
1162,2159.564697,36:07.5,40:11.8,0 days 00:04:04.330479,4,64,,,1,3,,,,,,,,,,,,,,,,,,,,,,,,,,,,,,,,,,,,,,,,,3,6,normal,normal,normal,normal,,,,,4,5,1,3,7,0.001905718,COMPLETE
1163,2984.158447,40:11.8,44:14.4,0 days 00:04:02.587288,1,8,16,64,3,4,,,,,,,,,,,,,,,,,,,,,,,,,,,,,,,,,,,,,,,,,5,8,normal,normal,,,,,,,2,1,1,,,0.008397999,COMPLETE
1164,,44:14.4,48:17.4,0 days 00:04:02.993717,3,32,,,1,4,7,10,,,,,,,,,4,5,5,,,,,,,,,,,,,,,,,,,,,,,,,,,,7,6,mixed,mixed,,,2,3,,,2,1,6,,,0.005266321,FAIL
1165,474.2523193,48:17.4,52:23.9,0 days 00:04:06.514387,4,16,128,,2,4,,,,,,,,,,,,,,,,,,,,,,,,,,,,,,,,,,,,,,,,,8,8,normal,,,,,,,,1,7,,,,0.005724905,COMPLETE
1166,1532.072266,52:23.9,56:24.7,0 days 00:04:00.827966,2,64,,,1,2,,,,,,,,,,,,,,,,,,,,,,,,,,,,,,,,,,,,,,,,,4,5,normal,normal,,,,,,,2,1,10,,,0.003257199,COMPLETE
1167,634.0598755,56:24.7,00:32.2,0 days 00:04:07.470297,3,8,,,1,3,,,,,,,,,,,6,9,2,7,5,,,,,,10,9,3,,,,,,,,7,5,8,5,4,9,2,2,2,,4,4,normal,mixed,mixed,mixed,,5,3,9,4,2,6,10,3,0.001979442,COMPLETE
1168,595.7667236,00:32.2,04:36.0,0 days 00:04:03.813553,4,64,8,,2,5,,,,,,,,,,,,,,,,,,,,,,,,,,,,,,,,,,,,,,,,,7,5,normal,normal,normal,,,,,,3,4,10,1,,0.002419756,COMPLETE
1169,,04:36.0,08:45.9,0 days 00:04:09.880579,4,128,,,1,2,6,8,8,4,7,4,10,7,2,4,,,,,,,,,,,,,,,,,,,,,,,,,,,,,,,5,5,mixed,normal,,,10,,,,2,2,1,,,0.009818365,FAIL
1170,,08:45.9,12:49.3,0 days 00:04:03.397423,2,64,128,,2,5,10,4,4,3,,,,,,,,,,,,,,,,,,,,,,,,,,,,,,,,,,,,,3,5,mixed,,,,4,,,,1,1,,,,0.001594263,FAIL
1171,,12:49.3,16:55.7,0 days 00:04:06.342296,1,64,64,,2,5,7,4,3,9,4,2,5,,,,10,,,,,,,,,,,,,,,,,,,,,,,,,,,,,,3,3,mixed,mixed,normal,normal,7,1,,,4,10,4,4,6,0.001409253,FAIL
1172,,16:55.7,21:04.6,0 days 00:04:08.953606,4,128,,,1,5,8,4,9,6,3,6,7,10,,,,,,,,,,,,,,,,,,,,,,,,,,,,,,,,,7,5,mixed,normal,,,8,,,,2,10,3,,,0.001036914,FAIL
1173,,21:04.6,25:10.2,0 days 00:04:05.608106,3,32,,,1,4,5,2,3,9,,,,,,,6,10,,,,,,,,,,,,,,,,,,,,,,,,,,,,,4,8,mixed,mixed,,,4,2,,,2,9,2,,,0.008542615,FAIL
1174,,25:10.2,29:23.4,0 days 00:04:13.194279,2,64,96,64,3,4,4,8,9,8,3,3,2,6,7,,8,5,7,,,,,,,,5,4,,,,,,,,,5,2,3,7,,,,,,,5,5,mixed,mixed,mixed,mixed,9,3,2,4,4,10,7,10,1,0.002506248,FAIL
1175,1198.775635,29:23.4,33:13.9,0 days 00:03:50.463620,3,8,16,,2,2,,,,,,,,,,,,,,,,,,,,,,,,,,,,,,,,,,,,,,,,,8,3,normal,,,,,,,,1,6,,,,0.002123967,COMPLETE
1176,,33:13.9,37:20.1,0 days 00:04:06.231384,3,64,64,,2,3,,,,,,,,,,,2,5,3,6,4,9,5,9,,,,,,,,,,,,,8,9,10,8,,,,,,,3,6,normal,mixed,normal,mixed,,8,,4,4,6,4,7,10,0.005284292,FAIL
1177,,37:20.1,41:22.8,0 days 00:04:02.655978,3,96,,,1,5,2,,,,,,,,,,8,10,,,,,,,,,5,10,3,3,8,,,,,,,,,,,,,,,,7,6,mixed,mixed,mixed,,1,2,5,,3,7,5,7,,0.001290858,FAIL
1178,420.3586121,41:22.8,45:28.2,0 days 00:04:05.393979,4,128,64,8,3,3,,,,,,,,,,,,,,,,,,,,,,,,,,,,,,,,,,,,,,,,,3,5,normal,normal,,,,,,,2,3,9,,,0.005614979,COMPLETE
1179,,45:28.2,49:32.9,0 days 00:04:04.696056,2,96,8,,2,4,10,3,2,3,6,5,7,2,,,,,,,,,,,,,,,,,,,,,,,,,,,,,,,,,3,8,mixed,normal,,,8,,,,2,10,4,,,0.003977116,FAIL
1180,3088.207275,49:32.9,53:35.6,0 days 00:04:02.680391,1,128,,,1,5,,,,,,,,,,,,,,,,,,,,,,,,,,,,,,,,,,,,,,,,,8,6,normal,normal,normal,normal,,,,,4,7,3,2,3,0.002261029,COMPLETE
1181,391.7225037,53:35.6,57:39.9,0 days 00:04:04.328645,2,16,96,,2,3,,,,,,,,,,,8,7,6,6,7,6,2,,,,,,,,,,,,,,,,,,,,,,,,6,5,normal,mixed,,,,7,,,2,4,1,,,0.001846169,COMPLETE
1182,3623.225342,57:39.9,01:38.6,0 days 00:03:58.696550,2,16,96,,2,2,,,,,,,,,,,,,,,,,,,,,,,,,,,,,,,,,,,,,,,,,5,4,normal,,,,,,,,1,3,,,,0.002902488,COMPLETE
1183,743.9957886,01:38.6,05:40.4,0 days 00:04:01.818125,4,8,96,,2,4,,,,,,,,,,,,,,,,,,,,,,,,,,,,,,,,,,,,,,,,,5,4,normal,,,,,,,,1,9,,,,0.001643432,COMPLETE
1184,3813.053467,05:40.4,09:43.5,0 days 00:04:03.121652,3,96,96,,2,3,,,,,,,,,,,,,,,,,,,,,,,,,,,,,,,,,,,,,,,,,7,4,normal,,,,,,,,1,3,,,,0.001756131,COMPLETE
1185,,09:43.5,13:58.7,0 days 00:04:15.148737,3,96,128,8,3,3,9,3,10,9,9,3,7,2,3,,8,2,9,,,,,,,,3,9,,,,,,,,,,,,,,,,,,,5,6,mixed,mixed,mixed,,9,3,2,,3,3,10,8,,0.003520575,FAIL
1186,687.496582,13:58.7,18:06.4,0 days 00:04:07.725712,2,16,16,,2,5,,,,,,,,,,,,,,,,,,,,,6,3,5,9,,,,,,,3,8,2,8,4,9,,,,,6,7,normal,normal,mixed,mixed,,,4,6,4,5,9,2,8,0.002053606,COMPLETE
1187,,18:06.4,22:11.7,0 days 00:04:05.263251,4,8,,,1,3,5,3,4,,,,,,,,,,,,,,,,,,5,,,,,,,,,,7,6,5,6,3,,,,,,6,4,mixed,normal,mixed,mixed,3,,1,5,4,8,8,3,1,0.001285807,FAIL
1188,446.1808472,22:11.7,26:14.4,0 days 00:04:02.754161,1,96,,,1,4,,,,,,,,,,,8,4,9,4,6,7,5,5,,,,,,,,,,,,,,,,,,,,,,,7,6,normal,mixed,normal,,,8,,,3,3,10,3,,0.003148496,COMPLETE
1189,,26:14.4,30:15.8,0 days 00:04:01.308961,3,16,,,1,4,10,8,4,4,7,6,2,10,6,,,,,,,,,,,,,,,,,,,,,,8,8,9,8,,,,,,,5,4,mixed,normal,normal,mixed,9,,,4,4,2,4,2,8,0.002022848,FAIL
1190,,30:15.8,34:16.0,0 days 00:04:00.246760,2,32,16,,2,2,2,10,2,6,8,3,5,8,2,,6,,,,,,,,,,,,,,,,,,,,,,,,,,,,,,8,5,mixed,mixed,,,9,1,,,2,6,10,,,0.002155295,FAIL
1191,1055.076904,34:16.0,38:15.4,0 days 00:03:59.415057,3,16,8,,2,4,,,,,,,,,,,10,,,,,,,,,,,,,,,,,,,,,,,,,,,,,,5,6,normal,mixed,normal,,,1,,,3,7,7,4,,0.001125969,COMPLETE
1192,,38:15.4,42:24.6,0 days 00:04:09.196380,4,32,96,16,3,3,,,,,,,,,,,2,3,4,8,6,6,4,10,7,,6,10,,,,,,,,,,,,,,,,,,,8,6,normal,mixed,mixed,,,9,2,,3,2,4,5,,0.001394834,FAIL
1193,,42:24.6,46:31.0,0 days 00:04:06.350044,4,96,,,1,3,,,,,,,,,,,8,3,7,7,5,4,5,2,9,,,,,,,,,,,,7,4,3,7,7,8,9,9,8,,5,3,normal,mixed,normal,mixed,,9,,9,4,3,1,8,7,0.001051931,FAIL
1194,1223.129028,46:31.0,50:27.8,0 days 00:03:56.845581,3,64,,,1,2,,,,,,,,,,,,,,,,,,,,,,,,,,,,,,,,,,,,,,,,,3,7,normal,normal,,,,,,,2,10,7,,,0.001127983,COMPLETE
1195,,50:27.8,54:39.2,0 days 00:04:11.414177,3,128,16,32,3,4,9,7,10,9,7,4,4,5,3,10,7,,,,,,,,,,,,,,,,,,,,,,,,,,,,,,6,4,mixed,mixed,normal,,10,1,,,3,5,6,3,,0.002871762,FAIL
1196,853.5820313,54:39.2,58:37.8,0 days 00:03:58.571860,1,16,,,1,4,7,,,,,,,,,,,,,,,,,,,,,,,,,,,,,,,,,,,,,,,,3,3,mixed,normal,,,1,,,,2,8,7,,,0.002102242,COMPLETE
1197,1396.834839,58:37.8,02:43.7,0 days 00:04:05.926318,4,128,,,1,4,4,,,,,,,,,,,,,,,,,,,,,,,,,,,,,,,,,,,,,,,,6,3,mixed,normal,normal,normal,1,,,,4,10,9,1,4,0.008078619,COMPLETE
1198,,02:43.7,06:47.0,0 days 00:04:03.278467,2,96,,,1,4,4,9,2,2,7,7,,,,,4,4,2,6,9,,,,,,,,,,,,,,,,,,,,,,,,,,6,4,mixed,mixed,normal,normal,6,5,,,4,4,4,1,10,0.003730107,FAIL
1199,,06:47.0,10:56.6,0 days 00:04:09.531440,2,32,,,1,2,8,2,10,8,2,5,7,2,8,,6,8,3,7,5,4,2,8,8,9,,,,,,,,,,,,,,,,,,,,,5,8,mixed,mixed,,,9,10,,,2,9,2,,,0.001319733,FAIL
1200,,10:56.6,15:02.8,0 days 00:04:06.233198,1,128,64,,2,2,7,4,3,4,4,4,3,,,,2,9,2,8,3,,,,,,,,,,,,,,,,,,,,,,,,,,3,7,mixed,mixed,,,7,5,,,2,4,3,,,0.005676362,FAIL
1201,1293.766235,15:02.8,19:05.1,0 days 00:04:02.273833,3,128,8,,2,2,,,,,,,,,,,4,8,8,4,,,,,,,,,,,,,,,,,,,,,,,,,,,3,5,normal,mixed,normal,,,4,,,3,9,5,6,,0.003714181,COMPLETE
1202,,19:05.1,23:10.3,0 days 00:04:05.239397,3,128,32,32,3,5,7,8,3,3,2,,,,,,,,,,,,,,,,,,,,,,,,,,,,,,,,,,,,4,5,mixed,normal,,,5,,,,2,1,2,,,0.003213484,FAIL
1203,713.6842041,23:10.3,27:08.9,0 days 00:03:58.596523,2,32,,,1,4,2,9,8,9,5,3,,,,,,,,,,,,,,,,,,,,,,,,,,,,,,,,,,,7,4,mixed,,,,6,,,,1,8,,,,0.008705865,COMPLETE
1204,584.2302246,27:08.9,31:14.4,0 days 00:04:05.480033,1,16,32,,2,2,,,,,,,,,,,,,,,,,,,,,10,4,6,10,8,5,9,2,7,6,10,3,10,7,7,7,5,3,8,5,4,6,normal,normal,mixed,mixed,,,10,10,4,1,7,4,8,0.002563113,COMPLETE
1205,852.5715332,31:14.4,35:19.3,0 days 00:04:04.932273,1,16,32,96,3,4,,,,,,,,,,,,,,,,,,,,,3,6,8,10,4,2,4,10,,,,,,,,,,,,,5,5,normal,normal,mixed,,,,8,,3,3,9,10,,0.002125959,COMPLETE
1206,1030.320068,35:19.3,39:20.0,0 days 00:04:00.630124,3,64,8,64,3,2,,,,,,,,,,,,,,,,,,,,,,,,,,,,,,,,,,,,,,,,,7,6,normal,normal,,,,,,,2,1,4,,,0.001416792,COMPLETE
1207,1147.880859,39:20.0,43:17.0,0 days 00:03:57.053182,1,96,128,96,3,2,6,8,3,3,10,,,,,,,,,,,,,,,,,,,,,,,,,,,,,,,,,,,,8,4,mixed,,,,5,,,,1,2,,,,0.008193295,COMPLETE
1208,,43:17.0,47:28.8,0 days 00:04:11.743325,2,96,8,16,3,5,9,4,9,6,2,5,3,10,,,3,7,10,6,10,9,10,10,5,5,8,10,2,5,4,10,10,,,,,,,,,,,,,,8,3,mixed,mixed,mixed,normal,8,10,7,,4,9,8,9,10,0.0047803,FAIL
1209,,47:28.8,51:39.1,0 days 00:04:10.309573,2,96,8,16,3,5,10,4,10,6,2,5,2,10,,,3,7,10,6,10,10,10,10,5,5,8,10,4,5,4,10,10,,,,,,,,,,,,,,8,3,mixed,mixed,mixed,normal,8,10,7,,4,9,8,9,10,0.004554891,FAIL
1210,,51:39.1,55:49.5,0 days 00:04:10.414059,2,96,8,16,3,5,10,4,9,6,2,5,2,10,,,3,7,10,6,10,10,10,10,5,5,8,10,2,5,4,10,10,,,,,,,,,,,,,,8,3,mixed,mixed,mixed,normal,8,10,7,,4,9,8,9,10,0.004539117,FAIL
1211,,55:49.5,59:58.3,0 days 00:04:08.778362,2,96,8,16,3,5,10,4,10,6,2,10,2,10,,,3,7,10,6,10,10,10,10,5,5,8,10,2,6,4,10,10,,,,,,,,,,,,,,8,3,mixed,mixed,mixed,normal,8,10,7,,4,9,2,9,10,0.004848146,FAIL
1212,,59:58.3,04:10.6,0 days 00:04:12.328654,2,96,8,16,3,5,10,4,10,6,2,5,2,10,,,3,7,10,6,10,8,9,10,5,4,8,10,2,5,4,10,10,,,,,,,,,,,,,,8,3,mixed,mixed,mixed,normal,8,10,7,,4,9,8,9,10,0.004730476,FAIL
