number,value,datetime_start,datetime_complete,duration,params_gat_heads,params_gat_hidden_0,params_gat_hidden_1,params_gat_hidden_2,params_gat_layers,params_gat_out,params_kan_arity_0_0,params_kan_arity_0_1,params_kan_arity_0_2,params_kan_arity_0_3,params_kan_arity_0_4,params_kan_arity_0_5,params_kan_arity_0_6,params_kan_arity_0_7,params_kan_arity_0_8,params_kan_arity_0_9,params_kan_arity_1_0,params_kan_arity_1_1,params_kan_arity_1_2,params_kan_arity_1_3,params_kan_arity_1_4,params_kan_arity_1_5,params_kan_arity_1_6,params_kan_arity_1_7,params_kan_arity_1_8,params_kan_arity_1_9,params_kan_arity_2_0,params_kan_arity_2_1,params_kan_arity_2_2,params_kan_arity_2_3,params_kan_arity_2_4,params_kan_arity_2_5,params_kan_arity_2_6,params_kan_arity_2_7,params_kan_arity_2_8,params_kan_arity_2_9,params_kan_arity_3_0,params_kan_arity_3_1,params_kan_arity_3_2,params_kan_arity_3_3,params_kan_arity_3_4,params_kan_arity_3_5,params_kan_arity_3_6,params_kan_arity_3_7,params_kan_arity_3_8,params_kan_arity_3_9,params_kan_grid,params_kan_k,params_kan_layer_type_0,params_kan_layer_type_1,params_kan_layer_type_2,params_kan_layer_type_3,params_kan_mult_nodes_0,params_kan_mult_nodes_1,params_kan_mult_nodes_2,params_kan_mult_nodes_3,params_kan_n_layers,params_kan_neurons_0,params_kan_neurons_1,params_kan_neurons_2,params_kan_neurons_3,params_lr,state
2168,,50:02.3,51:39.7,0 days 00:01:37.335145,4,32,16,,2,2,5,8,6,9,3,8,6,8,3,3,,,,,,,,,,,,,,,,,,,,,,,,,,,,,,,5,7,mixed,,,,10,,,,1,3,,,,0.002279331,FAIL
2169,1315.066772,51:39.7,53:23.2,0 days 00:01:43.555256,2,16,8,16,3,4,,,,,,,,,,,3,4,3,,,,,,,,,,,,,,,,,,2,9,,,,,,,,,5,7,normal,mixed,normal,mixed,,3,,2,4,1,5,4,3,0.001660487,COMPLETE
2170,,53:23.2,55:05.2,0 days 00:01:41.996815,1,64,8,32,3,2,4,2,10,5,2,,,,,,,,,,,,,,,,,,,,,,,,,,,,,,,,,,,,6,8,mixed,normal,normal,,5,,,,3,4,9,2,,0.001323821,FAIL
2171,,55:05.2,56:39.1,0 days 00:01:33.868307,1,64,,,1,4,2,5,8,2,7,5,6,3,6,9,,,,,,,,,,,,,,,,,,,,,,,,,,,,,,,5,5,mixed,,,,10,,,,1,3,,,,0.00118589,FAIL
2172,,56:39.1,58:15.5,0 days 00:01:36.429456,2,8,16,,2,2,3,4,9,5,6,2,,,,,,,,,,,,,,,,,,,,,,,,,,,,,,,,,,,7,5,mixed,normal,normal,,6,,,,3,8,7,7,,0.009155469,FAIL
2173,,58:15.5,59:59.2,0 days 00:01:43.659846,1,128,32,96,3,4,7,9,10,8,5,10,4,6,10,,,,,,,,,,,,4,4,3,4,6,7,7,9,7,5,,,,,,,,,,,4,7,mixed,normal,mixed,normal,9,,10,,4,6,2,1,1,0.002103214,FAIL
2174,,59:59.2,01:40.1,0 days 00:01:40.923784,1,96,,,1,3,,,,,,,,,,,7,3,8,2,4,3,10,,,,5,10,8,4,6,8,8,,,,,,,,,,,,,,4,7,normal,mixed,mixed,,,7,7,,3,3,3,4,,0.002358093,FAIL
2175,209.7099609,01:40.1,03:20.7,0 days 00:01:40.579325,4,128,96,,2,5,,,,,,,,,,,,,,,,,,,,,6,5,5,10,5,,,,,,,,,,,,,,,,3,6,normal,normal,mixed,,,,5,,3,8,3,6,,0.004185659,COMPLETE
2176,2861.14502,03:20.7,04:56.0,0 days 00:01:35.313029,4,64,96,32,3,5,,,,,,,,,,,,,,,,,,,,,,,,,,,,,,,,,,,,,,,,,4,8,normal,normal,,,,,,,2,4,1,,,0.004323201,COMPLETE
2177,,04:56.0,06:42.1,0 days 00:01:46.118527,1,64,,,1,3,3,8,6,5,4,10,4,5,3,6,9,2,9,6,7,,,,,,,,,,,,,,,,7,4,10,5,6,9,5,,,,6,4,mixed,mixed,normal,mixed,10,5,,7,4,8,9,3,9,0.001744225,FAIL
2178,,06:42.1,08:22.5,0 days 00:01:40.311395,2,64,32,,2,2,9,3,8,5,3,9,,,,,4,2,,,,,,,,,7,9,5,7,4,,,,,,,,,,,,,,,,6,3,mixed,mixed,mixed,,6,2,5,,3,3,9,10,,0.007520807,FAIL
2179,573.6697388,08:22.5,10:03.4,0 days 00:01:40.927237,3,96,128,64,3,4,,,,,,,,,,,4,2,9,9,10,4,5,,,,,,,,,,,,,,,,,,,,,,,,8,7,normal,mixed,,,,7,,,2,1,9,,,0.004268626,COMPLETE
2180,,10:03.4,11:46.1,0 days 00:01:42.664388,1,16,64,,2,5,4,3,9,5,10,,,,,,4,10,7,3,3,2,6,10,7,,6,4,9,4,8,2,,,,,,,,,,,,,,,7,7,mixed,mixed,mixed,normal,5,9,6,,4,3,10,10,9,0.001402896,FAIL
2181,754.4594727,11:46.1,13:27.0,0 days 00:01:40.939932,1,64,16,96,3,5,,,,,,,,,,,2,2,5,4,6,3,8,5,9,3,,,,,,,,,,,,,,,,,,,,,7,7,normal,mixed,,,,10,,,2,2,5,,,0.001327821,COMPLETE
2182,,13:27.0,15:09.5,0 days 00:01:42.473924,1,96,32,,2,3,,,,,,,,,,,3,7,,,,,,,,,2,5,4,10,,,,,,,4,7,10,10,10,6,5,10,3,4,5,4,normal,mixed,mixed,mixed,,2,4,10,4,9,6,9,8,0.001147686,FAIL
2183,552.2833252,15:09.5,16:37.9,0 days 00:01:28.371866,1,8,64,,2,3,,,,,,,,,,,,,,,,,,,,,,,,,,,,,,,,,,,,,,,,,8,7,normal,,,,,,,,1,9,,,,0.002328347,COMPLETE
2184,642.8469238,16:37.9,18:04.3,0 days 00:01:26.395596,1,128,128,,2,4,,,,,,,,,,,,,,,,,,,,,,,,,,,,,,,,,,,,,,,,,6,5,normal,,,,,,,,1,10,,,,0.001524834,COMPLETE
2185,492.7149048,18:04.3,19:44.4,0 days 00:01:40.189480,3,8,,,1,4,,,,,,,,,,,5,9,4,5,7,10,4,6,,,,,,,,,,,,,,,,,,,,,,,7,8,normal,mixed,,,,8,,,2,6,8,,,0.001150372,COMPLETE
2186,241.9514465,19:44.4,21:16.9,0 days 00:01:32.409374,1,64,,,1,5,,,,,,,,,,,2,5,10,5,,,,,,,,,,,,,,,,,,,,,,,,,,,6,4,normal,mixed,normal,,,4,,,3,10,8,5,,0.003131372,COMPLETE
2187,,21:16.9,22:57.9,0 days 00:01:41.051457,3,128,32,,2,2,8,7,5,6,9,4,2,8,6,,,,,,,,,,,,,,,,,,,,,,,,,,,,,,,,8,8,mixed,normal,normal,,9,,,,3,1,1,9,,0.006797976,FAIL
2188,463.3619995,22:57.9,24:26.5,0 days 00:01:28.560207,2,8,16,64,3,5,,,,,,,,,,,,,,,,,,,,,,,,,,,,,,,,,,,,,,,,,6,8,normal,,,,,,,,1,10,,,,0.007243943,COMPLETE
2189,636.4161987,24:26.5,25:53.8,0 days 00:01:27.358706,4,16,64,,2,4,9,8,7,,,,,,,,,,,,,,,,,,,,,,,,,,,,,,,,,,,,,,3,4,mixed,,,,3,,,,1,7,,,,0.007498035,COMPLETE
2190,,25:53.8,27:28.4,0 days 00:01:34.569708,3,16,32,,2,4,10,,,,,,,,,,2,2,6,5,2,7,7,3,,,,,,,,,,,,,,,,,,,,,,,3,3,mixed,mixed,normal,,1,8,,,3,7,4,1,,0.00858934,FAIL
2191,,27:28.4,28:59.7,0 days 00:01:31.323123,3,64,,,1,4,5,7,9,9,4,,,,,,,,,,,,,,,,,,,,,,,,,,,,,,,,,,,,7,6,mixed,,,,5,,,,1,10,,,,0.001292028,FAIL
2192,,28:59.7,30:39.7,0 days 00:01:39.931745,1,64,64,,2,4,8,4,9,10,10,2,5,2,5,6,3,9,5,9,9,,,,,,,,,,,,,,,,,,,,,,,,,,5,6,mixed,mixed,,,10,5,,,2,8,1,,,0.001366134,FAIL
2193,,30:39.7,32:22.5,0 days 00:01:42.810456,2,96,,,1,4,,,,,,,,,,,7,7,7,,,,,,,,,,,,,,,,,,5,8,8,4,2,9,9,5,9,3,8,4,normal,mixed,normal,mixed,,3,,10,4,8,1,3,1,0.001398545,FAIL
2194,293.0684509,32:22.5,33:50.4,0 days 00:01:27.910642,3,16,,,1,3,,,,,,,,,,,7,9,2,,,,,,,,,,,,,,,,,,,,,,,,,,,,3,3,normal,mixed,,,,3,,,2,8,4,,,0.003568413,COMPLETE
2195,,33:50.4,35:32.7,0 days 00:01:42.295415,2,8,,,1,3,7,8,2,3,,,,,,,4,4,10,8,7,6,4,6,5,,9,7,10,5,4,,,,,,,,,,,,,,,,4,8,mixed,mixed,mixed,normal,4,9,5,,4,3,5,6,8,0.003039543,FAIL
2196,595.6646729,35:32.7,36:58.8,0 days 00:01:26.110357,3,64,128,,2,4,,,,,,,,,,,,,,,,,,,,,,,,,,,,,,,,,,,,,,,,,8,5,normal,,,,,,,,1,9,,,,0.001571856,COMPLETE
2197,,36:58.8,38:43.6,0 days 00:01:44.837917,3,16,64,,2,5,10,9,6,,,,,,,,,,,,,,,,,,4,3,10,6,8,5,4,9,3,10,,,,,,,,,,,8,8,mixed,normal,mixed,,3,,10,,3,5,7,10,,0.001533853,FAIL
2198,717.7961426,38:43.6,40:09.7,0 days 00:01:26.021756,3,64,64,,2,3,,,,,,,,,,,,,,,,,,,,,,,,,,,,,,,,,,,,,,,,,5,4,normal,,,,,,,,1,5,,,,0.001110617,COMPLETE
2199,1273.85376,40:09.7,41:50.0,0 days 00:01:40.287296,3,8,16,128,3,4,,,,,,,,,,,,,,,,,,,,,7,8,10,2,,,,,,,,,,,,,,,,,8,6,normal,normal,mixed,,,,4,,3,1,2,8,,0.002361719,COMPLETE
2200,,41:50.0,43:33.6,0 days 00:01:43.642163,4,128,16,,2,4,6,2,9,5,2,3,5,3,9,,10,3,3,6,,,,,,,8,3,4,7,4,9,,,,,,,,,,,,,,,4,3,mixed,mixed,mixed,,9,4,6,,3,2,2,1,,0.00203934,FAIL
2201,416.5596313,43:33.6,45:04.2,0 days 00:01:30.620336,4,128,16,16,3,2,,,,,,,,,,,,,,,,,,,,,,,,,,,,,,,,,,,,,,,,,4,5,normal,normal,,,,,,,2,10,1,,,0.00289466,COMPLETE
2202,292.0457153,45:04.2,46:41.6,0 days 00:01:37.383617,1,16,64,32,3,5,,,,,,,,,,,,,,,,,,,,,,,,,,,,,,,,,,,,,,,,,8,7,normal,normal,normal,,,,,,3,10,7,7,,0.005397749,COMPLETE
2203,,46:41.6,48:19.4,0 days 00:01:37.781466,2,32,64,,2,5,,,,,,,,,,,6,6,2,2,9,10,3,10,,,,,,,,,,,,,,,,,,,,,,,7,6,normal,mixed,,,,8,,,2,8,9,,,0.001232032,FAIL
2204,,48:19.4,49:59.3,0 days 00:01:39.862937,3,64,,,1,4,8,2,9,4,3,8,10,5,10,,5,8,2,6,5,2,7,3,,,,,,,,,,,,,,,,,,,,,,,4,3,mixed,mixed,,,9,8,,,2,5,6,,,0.003744284,FAIL
2205,1.95E+20,49:59.3,51:32.1,0 days 00:01:32.870400,4,8,32,96,3,3,7,3,8,10,2,3,10,,,,,,,,,,,,,,,,,,,,,,,,,,,,,,,,,,5,3,mixed,,,,7,,,,1,4,,,,0.006133844,COMPLETE
2206,,51:32.1,53:17.1,0 days 00:01:44.989724,4,128,16,64,3,3,9,5,9,4,10,10,7,3,10,4,,,,,,,,,,,7,5,10,5,,,,,,,,,,,,,,,,,5,5,mixed,normal,mixed,normal,10,,4,,4,6,5,3,9,0.00215966,FAIL
2207,639.5697632,53:17.1,54:50.9,0 days 00:01:33.768108,4,64,,,1,4,,,,,,,,,,,3,9,4,3,8,3,7,2,8,10,,,,,,,,,,,,,,,,,,,,,5,3,normal,mixed,,,,10,,,2,4,3,,,0.003791145,COMPLETE
2208,210.8323822,54:50.9,56:32.7,0 days 00:01:41.765133,2,8,32,,2,3,,,,,,,,,,,10,7,8,8,4,4,,,,,,,,,,,,,,,,,,,,,,,,,7,7,normal,mixed,normal,,,6,,,3,8,7,10,,0.007335262,COMPLETE
2209,645.2750854,56:32.7,57:59.8,0 days 00:01:27.088761,2,32,64,128,3,2,,,,,,,,,,,,,,,,,,,,,,,,,,,,,,,,,,,,,,,,,3,3,normal,normal,,,,,,,2,1,7,,,0.001943736,COMPLETE
2210,430.0656433,57:59.8,59:25.5,0 days 00:01:25.743898,3,32,16,,2,5,,,,,,,,,,,,,,,,,,,,,,,,,,,,,,,,,,,,,,,,,8,5,normal,,,,,,,,1,6,,,,0.003084554,COMPLETE
2211,,59:25.5,01:05.7,0 days 00:01:40.164116,3,128,,,1,5,8,6,4,2,,,,,,,,,,,,,,,,,4,2,9,5,7,4,6,3,6,,,,,,,,,,,,6,7,mixed,normal,mixed,,4,,9,,3,4,9,6,,0.001006238,FAIL
2212,,01:05.7,02:47.7,0 days 00:01:42.014159,4,32,16,32,3,4,10,10,7,,,,,,,,2,5,7,10,6,10,2,10,6,,,,,,,,,,,,,,,,,,,,,,7,6,mixed,mixed,,,3,9,,,2,8,5,,,0.00386025,FAIL
2213,334.1338196,02:47.7,04:17.9,0 days 00:01:30.213666,4,32,,,1,2,,,,,,,,,,,,,,,,,,,,,,,,,,,,,,,,,,,,,,,,,7,6,normal,normal,normal,,,,,,3,6,6,10,,0.00630033,COMPLETE
2214,372.6828918,04:17.9,05:48.5,0 days 00:01:30.632834,4,32,128,,2,5,,,,,,,,,,,,,,,,,,,,,,,,,,,,,,,,,,,,,,,,,6,7,normal,normal,,,,,,,2,7,6,,,0.002375102,COMPLETE
2215,558.0189819,05:48.5,07:22.5,0 days 00:01:33.947408,2,16,,,1,3,,,,,,,,,,,,,,,,,,,,,,,,,,,,,,,,,,,,,,,,,3,8,normal,normal,normal,,,,,,3,2,3,10,,0.005183718,COMPLETE
2216,274.9526672,07:22.5,09:04.8,0 days 00:01:42.281054,3,96,96,8,3,2,,,,,,,,,,,,,,,,,,,,,2,2,4,8,,,,,,,6,10,2,7,8,10,9,6,2,4,6,3,normal,normal,mixed,mixed,,,4,10,4,4,9,6,7,0.007137041,COMPLETE
2217,863691.375,09:04.8,10:37.1,0 days 00:01:32.358191,4,64,64,,2,2,4,9,7,10,4,4,9,,,,,,,,,,,,,,,,,,,,,,,,,,,,,,,,,,3,4,mixed,,,,7,,,,1,2,,,,0.001041385,COMPLETE
2218,,10:37.1,12:21.9,0 days 00:01:44.732935,4,32,,,1,2,5,6,9,2,6,4,4,8,,,3,3,10,6,10,6,10,2,9,,3,3,8,10,7,9,10,4,,,,,,,,,,,,,5,3,mixed,mixed,mixed,,8,9,8,,3,1,4,9,,0.001669617,FAIL
2219,894.0446777,12:21.9,14:01.0,0 days 00:01:39.075654,4,128,,,1,3,,,,,,,,,,,9,6,7,,,,,,,,,,,,,,,,,,,,,,,,,,,,7,8,normal,mixed,normal,normal,,3,,,4,4,3,2,9,0.003655358,COMPLETE
2220,,14:01.0,15:37.4,0 days 00:01:36.449293,4,64,,,1,5,,,,,,,,,,,3,4,,,,,,,,,3,8,9,9,,,,,,,,,,,,,,,,,4,4,normal,mixed,mixed,normal,,2,4,,4,7,6,6,1,0.001039541,FAIL
2221,,15:37.4,17:17.7,0 days 00:01:40.280847,2,16,8,32,3,2,7,5,10,9,7,9,4,9,2,,10,4,3,9,2,4,3,9,8,,,,,,,,,,,,,,,,,,,,,,3,3,mixed,mixed,,,9,9,,,2,3,1,,,0.002178048,FAIL
2222,,17:17.7,18:51.5,0 days 00:01:33.832763,1,8,,,1,2,3,7,2,10,4,3,9,8,9,,,,,,,,,,,,,,,,,,,,,,,,,,,,,,,,7,5,mixed,normal,,,9,,,,2,1,6,,,0.00689075,FAIL
2223,,18:51.5,20:33.3,0 days 00:01:41.810398,2,96,64,,2,2,10,3,2,10,2,,,,,,8,5,8,9,3,2,2,6,9,5,,,,,,,,,,,,,,,,,,,,,3,5,mixed,mixed,normal,,5,10,,,3,5,8,2,,0.007068144,FAIL
2224,,20:33.3,22:17.7,0 days 00:01:44.346689,2,128,,,1,2,7,3,5,7,3,,,,,,9,8,8,9,5,5,,,,,7,7,,,,,,,,,7,9,5,3,3,2,9,,,,5,5,mixed,mixed,mixed,mixed,5,6,2,7,4,10,4,4,2,0.005727082,FAIL
2225,3310.950439,22:17.7,23:49.6,0 days 00:01:31.863602,1,8,8,16,3,4,,,,,,,,,,,9,10,7,,,,,,,,,,,,,,,,,,,,,,,,,,,,3,3,normal,mixed,normal,,,3,,,3,5,10,2,,0.001714523,COMPLETE
2226,,23:49.6,25:31.0,0 days 00:01:41.434959,3,96,96,,2,5,,,,,,,,,,,10,7,10,8,,,,,,,2,2,6,5,10,10,2,7,8,10,,,,,,,,,,,4,6,normal,mixed,mixed,,,4,10,,3,9,8,5,,0.006749109,FAIL
2227,,25:31.0,27:12.4,0 days 00:01:41.403175,3,96,96,,2,5,,,,,,,,,,,10,7,10,8,,,,,,,2,2,6,5,10,9,2,7,8,10,,,,,,,,,,,4,6,normal,mixed,mixed,,,4,10,,3,9,8,5,,0.008536611,FAIL
2228,,27:12.4,28:53.9,0 days 00:01:41.507797,3,96,96,,2,5,,,,,,,,,,,10,7,10,8,,,,,,,2,2,6,5,9,9,2,7,8,10,,,,,,,,,,,4,6,normal,mixed,mixed,,,4,10,,3,9,8,5,,0.002689924,FAIL
2229,,28:53.9,30:35.8,0 days 00:01:41.841931,3,96,96,,2,5,,,,,,,,,,,10,7,10,8,,,,,,,2,2,6,5,10,10,2,7,8,10,,,,,,,,,,,4,6,normal,mixed,mixed,,,4,10,,3,9,8,5,,0.009139527,FAIL
2230,,30:35.8,32:17.5,0 days 00:01:41.763568,3,96,96,,2,5,,,,,,,,,,,10,7,10,8,,,,,,,2,2,6,5,9,10,2,7,8,10,,,,,,,,,,,4,6,normal,mixed,mixed,,,4,10,,3,9,8,5,,0.006910947,FAIL
2231,,32:17.5,34:00.5,0 days 00:01:42.982124,3,96,96,,2,5,,,,,,,,,,,10,7,10,8,,,,,,,2,2,6,5,9,10,2,7,8,10,,,,,,,,,,,4,6,normal,mixed,mixed,,,4,10,,3,9,8,5,,0.008972842,FAIL
2232,,34:00.5,35:43.3,0 days 00:01:42.825197,3,96,96,,2,5,,,,,,,,,,,10,7,10,8,,,,,,,2,2,6,5,9,10,2,7,8,10,,,,,,,,,,,4,6,normal,mixed,mixed,,,4,10,,3,9,8,5,,0.009097624,FAIL
2233,,35:43.3,37:24.9,0 days 00:01:41.564271,3,96,96,,2,5,,,,,,,,,,,10,7,10,8,,,,,,,3,2,6,5,8,10,2,7,8,10,,,,,,,,,,,4,6,normal,mixed,mixed,,,4,10,,3,9,8,5,,0.008631867,FAIL
2234,,37:24.9,39:06.7,0 days 00:01:41.743169,3,96,96,,2,5,,,,,,,,,,,10,7,10,8,,,,,,,2,2,6,5,10,9,2,7,8,10,,,,,,,,,,,4,6,normal,mixed,mixed,,,4,10,,3,9,8,5,,0.006745516,FAIL
2235,,39:06.7,40:48.6,0 days 00:01:41.986702,3,96,96,,2,5,,,,,,,,,,,10,8,10,8,,,,,,,2,2,6,5,10,10,3,7,8,10,,,,,,,,,,,4,6,normal,mixed,mixed,,,4,10,,3,9,8,5,,0.006757571,FAIL
2236,,40:48.7,42:31.3,0 days 00:01:42.665455,3,96,96,,2,5,,,,,,,,,,,10,7,10,8,4,,,,,,2,2,6,5,10,10,2,7,8,10,,,,,,,,,,,4,6,normal,mixed,mixed,,,5,10,,3,9,8,5,,0.006675487,FAIL
2237,,42:31.3,44:13.2,0 days 00:01:41.849074,3,96,96,,2,5,,,,,,,,,,,10,7,10,8,,,,,,,3,2,6,5,8,10,2,7,8,10,,,,,,,,,,,3,6,normal,mixed,mixed,,,4,10,,3,9,8,5,,0.006736843,FAIL
2238,,44:13.2,45:54.8,0 days 00:01:41.653284,3,96,96,,2,5,,,,,,,,,,,10,7,10,8,,,,,,,2,2,6,4,10,10,2,7,8,10,,,,,,,,,,,4,6,normal,mixed,mixed,,,4,10,,3,9,8,5,,0.00690978,FAIL
2239,,45:54.8,47:36.8,0 days 00:01:41.941789,3,96,96,,2,5,,,,,,,,,,,10,7,10,8,,,,,,,2,2,6,5,10,10,2,7,8,10,,,,,,,,,,,4,6,normal,mixed,mixed,,,4,10,,3,9,8,5,,0.006837446,FAIL
2240,,47:36.8,49:19.2,0 days 00:01:42.423121,3,96,96,,2,5,,,,,,,,,,,10,7,10,8,,,,,,,2,2,6,5,9,10,3,8,8,10,,,,,,,,,,,4,6,normal,mixed,mixed,,,4,10,,3,9,8,5,,0.006726816,FAIL
2241,,49:19.2,51:02.4,0 days 00:01:43.227691,3,96,96,,2,5,,,,,,,,,,,10,7,10,8,,,,,,,2,2,6,5,10,10,3,7,8,10,,,,,,,,,,,4,6,normal,mixed,mixed,,,4,10,,3,9,8,5,,0.006817325,FAIL
2242,,51:02.4,52:45.7,0 days 00:01:43.295845,3,96,96,,2,5,,,,,,,,,,,10,7,10,8,,,,,,,2,2,6,5,10,10,2,7,8,10,,,,,,,,,,,4,6,normal,mixed,mixed,,,4,10,,3,9,8,5,,0.00894988,FAIL
2243,,52:45.7,54:28.7,0 days 00:01:43.007703,3,96,96,,2,5,,,,,,,,,,,10,7,10,8,,,,,,,2,2,6,5,10,10,2,7,8,10,,,,,,,,,,,4,6,normal,mixed,mixed,,,4,10,,3,9,8,5,,0.006620301,FAIL
2244,,54:28.7,56:12.4,0 days 00:01:43.611072,3,96,96,,2,5,,,,,,,,,,,10,7,10,8,4,,,,,,2,2,6,5,9,10,2,7,8,10,,,,,,,,,,,4,6,normal,mixed,mixed,,,5,10,,3,9,8,5,,0.009121198,FAIL
2245,,56:12.4,57:54.6,0 days 00:01:42.215729,3,96,96,,2,5,,,,,,,,,,,10,7,10,8,,,,,,,2,2,6,5,10,10,2,7,8,,,,,,,,,,,,4,6,normal,mixed,mixed,,,4,9,,3,9,8,5,,0.006863733,FAIL
2246,,57:54.6,59:37.8,0 days 00:01:43.230155,3,96,96,,2,5,,,,,,,,,,,10,7,10,8,,,,,,,2,2,6,5,10,10,2,7,8,10,,,,,,,,,,,3,6,normal,mixed,mixed,,,4,10,,3,9,8,5,,0.006750442,FAIL
2247,,59:37.8,01:20.1,0 days 00:01:42.304196,3,96,96,,2,5,,,,,,,,,,,10,7,10,7,,,,,,,2,2,6,5,10,9,3,7,8,10,,,,,,,,,,,4,6,normal,mixed,mixed,,,4,10,,3,9,8,5,,0.002592004,FAIL
2248,,01:20.1,03:02.0,0 days 00:01:41.911032,3,96,96,,2,5,,,,,,,,,,,10,7,10,8,,,,,,,3,2,6,5,10,10,2,7,8,10,,,,,,,,,,,4,6,normal,mixed,mixed,,,4,10,,3,9,8,5,,0.002610785,FAIL
2249,,03:02.0,04:44.1,0 days 00:01:42.078518,3,96,96,,2,5,,,,,,,,,,,10,7,10,8,,,,,,,2,2,6,5,10,10,2,7,8,10,,,,,,,,,,,4,6,normal,mixed,mixed,,,4,10,,3,9,8,5,,0.002609719,FAIL
2250,,04:44.1,06:25.9,0 days 00:01:41.757053,3,96,96,,2,5,,,,,,,,,,,10,7,10,8,,,,,,,2,2,6,5,10,10,2,7,8,10,,,,,,,,,,,4,6,normal,mixed,mixed,,,4,10,,3,9,8,5,,0.006790844,FAIL
2251,,06:25.9,08:07.9,0 days 00:01:42.016499,3,96,96,,2,5,,,,,,,,,,,10,7,10,8,,,,,,,2,2,6,5,10,10,2,7,8,10,,,,,,,,,,,4,6,normal,mixed,mixed,,,4,10,,3,9,8,5,,0.008685035,FAIL
2252,,08:07.9,09:49.7,0 days 00:01:41.825859,3,96,96,,2,5,,,,,,,,,,,10,7,10,7,,,,,,,2,2,6,5,10,10,2,7,8,10,,,,,,,,,,,4,6,normal,mixed,mixed,,,4,10,,3,9,8,5,,0.008201297,FAIL
2253,,09:49.7,11:31.8,0 days 00:01:42.096339,3,96,96,,2,5,,,,,,,,,,,10,7,10,8,,,,,,,2,2,6,5,10,9,2,7,8,10,,,,,,,,,,,4,6,normal,mixed,mixed,,,4,10,,3,9,8,5,,0.006928903,FAIL
2254,,11:31.8,13:13.6,0 days 00:01:41.740673,3,96,96,,2,5,,,,,,,,,,,10,7,10,8,,,,,,,2,2,6,5,9,10,2,7,8,10,,,,,,,,,,,4,6,normal,mixed,mixed,,,4,10,,3,9,8,5,,0.008880732,FAIL
2255,,13:13.6,14:55.6,0 days 00:01:42.021394,3,96,96,,2,5,,,,,,,,,,,10,7,10,8,,,,,,,2,2,6,5,10,10,2,7,8,10,,,,,,,,,,,4,6,normal,mixed,mixed,,,4,10,,3,9,8,5,,0.006955712,FAIL
2256,,14:55.6,16:37.6,0 days 00:01:42.015806,3,96,96,,2,5,,,,,,,,,,,10,7,10,8,,,,,,,2,2,6,5,10,10,3,7,8,10,,,,,,,,,,,4,6,normal,mixed,mixed,,,4,10,,3,9,8,5,,0.006631457,FAIL
2257,,16:37.6,18:19.3,0 days 00:01:41.676660,3,96,96,,2,5,,,,,,,,,,,10,7,10,8,,,,,,,2,2,6,5,8,10,2,7,8,10,,,,,,,,,,,4,6,normal,mixed,mixed,,,4,10,,3,9,8,5,,0.006956261,FAIL
2258,,18:19.3,20:00.9,0 days 00:01:41.593237,3,96,96,,2,5,,,,,,,,,,,10,7,10,8,,,,,,,2,2,6,5,10,9,2,7,8,10,,,,,,,,,,,4,6,normal,mixed,mixed,,,4,10,,3,9,8,5,,0.007048123,FAIL
2259,,20:00.9,21:42.9,0 days 00:01:42.018904,3,96,96,,2,5,,,,,,,,,,,10,7,10,8,,,,,,,2,2,6,5,10,10,2,7,8,10,,,,,,,,,,,4,6,normal,mixed,mixed,,,4,10,,3,9,8,5,,0.006698454,FAIL
2260,,21:42.9,23:24.4,0 days 00:01:41.521675,3,96,96,,2,5,,,,,,,,,,,10,7,10,8,,,,,,,2,2,6,5,10,10,2,7,8,10,,,,,,,,,,,4,6,normal,mixed,mixed,,,4,10,,3,9,8,5,,0.008907404,FAIL
2261,,23:24.4,25:06.4,0 days 00:01:41.981107,3,96,96,,2,5,,,,,,,,,,,10,7,10,8,,,,,,,2,2,6,5,10,10,2,7,8,10,,,,,,,,,,,4,6,normal,mixed,mixed,,,4,10,,3,9,8,5,,0.002589132,FAIL
2262,,25:06.4,26:48.4,0 days 00:01:41.943944,3,96,96,,2,5,,,,,,,,,,,10,7,10,8,,,,,,,2,2,6,5,10,10,2,7,8,10,,,,,,,,,,,4,6,normal,mixed,mixed,,,4,10,,3,9,8,5,,0.008940778,FAIL
2263,,26:48.4,28:30.5,0 days 00:01:42.102370,3,96,96,,2,5,,,,,,,,,,,10,7,10,8,,,,,,,2,2,6,5,10,10,2,7,8,10,,,,,,,,,,,4,6,normal,mixed,mixed,,,4,10,,3,9,8,5,,0.002609032,FAIL
2264,,28:30.5,30:12.4,0 days 00:01:41.974067,3,96,96,,2,5,,,,,,,,,,,10,7,10,8,,,,,,,3,2,6,5,10,10,2,7,8,10,,,,,,,,,,,4,6,normal,mixed,mixed,,,4,10,,3,9,8,5,,0.006723577,FAIL
2265,,30:12.5,31:54.4,0 days 00:01:41.998130,3,96,96,,2,5,,,,,,,,,,,10,7,10,8,,,,,,,2,2,6,5,9,10,2,7,8,9,,,,,,,,,,,4,6,normal,mixed,mixed,,,4,10,,3,9,8,5,,0.006776288,FAIL
2266,,31:54.5,33:36.2,0 days 00:01:41.768421,3,96,96,,2,5,,,,,,,,,,,10,7,10,8,,,,,,,2,2,6,4,10,10,2,7,8,10,,,,,,,,,,,4,6,normal,mixed,mixed,,,4,10,,3,9,8,5,,0.006763933,FAIL
2267,,33:36.2,35:18.2,0 days 00:01:41.981771,3,96,96,,2,5,,,,,,,,,,,10,7,10,8,,,,,,,2,2,6,5,10,10,2,7,8,10,,,,,,,,,,,4,6,normal,mixed,mixed,,,4,10,,3,9,8,5,,0.009132743,FAIL
2268,,35:18.2,36:59.9,0 days 00:01:41.735063,3,96,96,,2,5,,,,,,,,,,,10,7,10,8,,,,,,,2,2,6,5,10,9,2,7,8,10,,,,,,,,,,,4,6,normal,mixed,mixed,,,4,10,,3,9,8,5,,0.006767793,FAIL
2269,,36:59.9,38:41.9,0 days 00:01:41.917622,3,96,96,,2,5,,,,,,,,,,,10,7,10,8,,,,,,,2,2,6,5,10,10,2,7,8,10,,,,,,,,,,,4,6,normal,mixed,mixed,,,4,10,,3,9,8,5,,0.002598247,FAIL
2270,,38:41.9,40:23.5,0 days 00:01:41.588957,3,96,96,,2,5,,,,,,,,,,,10,7,10,8,,,,,,,2,2,6,5,9,10,2,7,8,10,,,,,,,,,,,4,6,normal,mixed,mixed,,,4,10,,3,9,8,5,,0.002606648,FAIL
2271,,40:23.5,42:05.6,0 days 00:01:42.110599,3,96,96,,2,5,,,,,,,,,,,10,7,10,8,,,,,,,2,2,6,5,10,10,2,7,8,10,,,,,,,,,,,4,6,normal,mixed,mixed,,,4,10,,3,9,8,5,,0.002596454,FAIL
2272,,42:05.6,43:47.2,0 days 00:01:41.603343,3,96,96,,2,5,,,,,,,,,,,10,7,10,8,,,,,,,2,2,6,5,9,10,2,7,8,10,,,,,,,,,,,4,6,normal,mixed,mixed,,,4,10,,3,9,8,5,,0.008194995,FAIL
2273,,43:47.2,45:29.1,0 days 00:01:41.956372,3,96,96,,2,5,,,,,,,,,,,10,7,10,8,,,,,,,2,2,6,5,10,9,3,7,8,10,,,,,,,,,,,4,6,normal,mixed,mixed,,,4,10,,3,9,8,5,,0.002926044,FAIL
2274,,45:29.1,47:10.7,0 days 00:01:41.556305,3,96,96,,2,5,,,,,,,,,,,10,7,10,8,,,,,,,2,2,6,5,10,10,4,7,8,,,,,,,,,,,,4,6,normal,mixed,mixed,,,4,9,,3,9,8,5,,0.006994206,FAIL
2275,,47:10.7,48:51.6,0 days 00:01:40.874507,3,96,96,,2,5,,,,,,,,,,,10,7,10,8,,,,,,,2,2,6,5,10,10,2,7,8,,,,,,,,,,,,4,6,normal,mixed,mixed,,,4,9,,3,9,8,5,,0.006670719,FAIL
2276,,48:51.6,50:33.7,0 days 00:01:42.085562,3,96,96,,2,5,,,,,,,,,,,10,7,9,8,,,,,,,2,2,6,5,10,10,3,7,8,10,,,,,,,,,,,4,6,normal,mixed,mixed,,,4,10,,3,9,8,6,,0.009099669,FAIL
2277,,50:33.7,52:15.9,0 days 00:01:42.214651,3,96,96,,2,5,,,,,,,,,,,10,7,10,8,,,,,,,2,2,6,5,10,10,3,7,8,10,,,,,,,,,,,4,6,normal,mixed,mixed,,,4,10,,3,9,8,5,,0.006705153,FAIL
2278,,52:15.9,53:57.7,0 days 00:01:41.785629,3,96,96,,2,5,,,,,,,,,,,10,7,10,8,,,,,,,3,2,6,5,10,10,2,7,8,10,,,,,,,,,,,4,6,normal,mixed,mixed,,,4,10,,3,9,8,5,,0.008957372,FAIL
2279,,53:57.7,55:39.4,0 days 00:01:41.701618,3,96,96,,2,5,,,,,,,,,,,10,7,10,8,,,,,,,2,2,6,5,9,10,2,7,8,10,,,,,,,,,,,4,6,normal,mixed,mixed,,,4,10,,3,9,8,5,,0.008514026,FAIL
2280,,55:39.4,57:21.3,0 days 00:01:41.941031,3,96,96,,2,5,,,,,,,,,,,10,7,10,8,,,,,,,2,2,6,5,10,10,2,7,8,10,,,,,,,,,,,4,6,normal,mixed,mixed,,,4,10,,3,9,8,5,,0.006813696,FAIL
2281,,57:21.3,59:03.4,0 days 00:01:42.097430,3,96,96,,2,5,,,,,,,,,,,10,7,10,8,,,,,,,2,2,6,5,10,10,2,7,8,10,,,,,,,,,,,4,6,normal,mixed,mixed,,,4,10,,3,9,8,5,,0.006936252,FAIL
2282,,59:03.4,00:45.3,0 days 00:01:41.885933,3,96,96,,2,5,,,,,,,,,,,10,7,10,8,,,,,,,2,2,6,5,10,10,2,7,8,10,,,,,,,,,,,4,6,normal,mixed,mixed,,,4,10,,3,9,8,5,,0.006700923,FAIL
2283,,00:45.3,02:26.9,0 days 00:01:41.634856,3,96,96,,2,5,,,,,,,,,,,10,7,10,8,,,,,,,2,2,6,5,10,10,2,7,8,10,,,,,,,,,,,4,6,normal,mixed,mixed,,,4,10,,3,9,8,5,,0.008803378,FAIL
2284,,02:26.9,04:09.4,0 days 00:01:42.495371,3,96,96,,2,5,,,,,,,,,,,10,7,10,8,,,,,,,2,2,6,5,10,10,2,7,8,10,,,,,,,,,,,4,6,normal,mixed,mixed,,,4,10,,3,9,8,5,,0.006763477,FAIL
2285,,04:09.4,05:53.1,0 days 00:01:43.691872,3,96,96,,2,5,,,,,,,,,,,10,7,10,8,,,,,,,2,2,6,5,10,10,2,7,8,10,,,,,,,,,,,4,6,normal,mixed,mixed,,,4,10,,3,9,8,5,,0.006942571,FAIL
2286,,05:53.1,07:36.7,0 days 00:01:43.550716,3,96,96,,2,5,,,,,,,,,,,10,7,10,8,,,,,,,2,2,6,5,10,10,2,7,8,10,,,,,,,,,,,4,6,normal,mixed,mixed,,,4,10,,3,9,8,5,,0.00833552,FAIL
2287,,07:36.7,09:20.4,0 days 00:01:43.719955,3,96,96,,2,5,,,,,,,,,,,10,7,10,8,,,,,,,2,2,6,5,10,10,2,7,8,10,,,,,,,,,,,4,6,normal,mixed,mixed,,,4,10,,3,9,8,5,,0.006803941,FAIL
