number,value,datetime_start,datetime_complete,duration,params_gat_heads,params_gat_hidden_0,params_gat_hidden_1,params_gat_hidden_2,params_gat_layers,params_gat_out,params_kan_arity_0_0,params_kan_arity_0_1,params_kan_arity_0_2,params_kan_arity_0_3,params_kan_arity_0_4,params_kan_arity_0_5,params_kan_arity_0_6,params_kan_arity_0_7,params_kan_arity_0_8,params_kan_arity_0_9,params_kan_arity_1_0,params_kan_arity_1_1,params_kan_arity_1_2,params_kan_arity_1_3,params_kan_arity_1_4,params_kan_arity_1_5,params_kan_arity_1_6,params_kan_arity_1_7,params_kan_arity_1_8,params_kan_arity_1_9,params_kan_arity_2_0,params_kan_arity_2_1,params_kan_arity_2_2,params_kan_arity_2_3,params_kan_arity_2_4,params_kan_arity_2_5,params_kan_arity_2_6,params_kan_arity_2_7,params_kan_arity_2_8,params_kan_arity_2_9,params_kan_arity_3_0,params_kan_arity_3_1,params_kan_arity_3_2,params_kan_arity_3_3,params_kan_arity_3_4,params_kan_arity_3_5,params_kan_arity_3_6,params_kan_arity_3_7,params_kan_arity_3_8,params_kan_arity_3_9,params_kan_grid,params_kan_k,params_kan_layer_type_0,params_kan_layer_type_1,params_kan_layer_type_2,params_kan_layer_type_3,params_kan_mult_nodes_0,params_kan_mult_nodes_1,params_kan_mult_nodes_2,params_kan_mult_nodes_3,params_kan_n_layers,params_kan_neurons_0,params_kan_neurons_1,params_kan_neurons_2,params_kan_neurons_3,params_lr,state
2760,,40:13.5,41:56.9,0 days 00:01:43.408984,3,96,96,,2,5,,,,,,,,,,,10,7,10,8,,,,,,,2,2,6,5,8,9,2,7,8,10,,,,,,,,,,,4,6,normal,mixed,mixed,,,4,10,,3,9,8,5,,0.006741611,FAIL
2761,,41:56.9,43:39.3,0 days 00:01:42.399624,3,96,96,,2,5,,,,,,,,,,,10,7,10,8,,,,,,,2,2,6,5,10,10,2,7,8,,,,,,,,,,,,4,6,normal,mixed,mixed,,,4,9,,3,9,8,5,,0.006868709,FAIL
2762,,43:39.3,45:23.7,0 days 00:01:44.411155,3,96,96,,2,5,,,,,,,,,,,10,7,10,8,,,,,,,2,2,6,5,10,10,3,7,8,10,,,,,,,,,,,4,6,normal,mixed,mixed,,,4,10,,3,9,8,5,,0.008767025,FAIL
2763,,45:23.7,47:07.0,0 days 00:01:43.262293,3,96,96,,2,5,,,,,,,,,,,10,7,9,8,,,,,,,2,2,6,5,8,10,2,7,8,10,,,,,,,,,,,4,6,normal,mixed,mixed,,,4,10,,3,9,8,5,,0.006805596,FAIL
2764,,47:07.0,48:50.5,0 days 00:01:43.491303,3,96,96,,2,5,,,,,,,,,,,10,7,10,8,,,,,,,2,2,6,5,10,10,2,7,8,10,,,,,,,,,,,4,6,normal,mixed,mixed,,,4,10,,3,9,8,5,,0.006712484,FAIL
2765,,48:50.5,50:32.4,0 days 00:01:41.901283,3,96,96,,2,5,,,,,,,,,,,8,7,10,8,,,,,,,2,2,5,5,10,10,3,7,8,10,,,,,,,,,,,4,6,normal,mixed,mixed,,,4,10,,3,9,8,5,,0.008960125,FAIL
2766,,50:32.4,52:14.4,0 days 00:01:42.037681,3,96,96,,2,5,,,,,,,,,,,10,7,10,8,,,,,,,2,2,6,5,10,10,3,7,8,10,,,,,,,,,,,4,6,normal,mixed,mixed,,,4,10,,3,9,8,5,,0.008864938,FAIL
2767,,52:14.4,53:54.9,0 days 00:01:40.485364,3,96,96,,2,5,,,,,,,,,,,10,7,10,8,,,,,,,2,2,6,5,10,10,2,7,8,,,,,,,,,,,,4,6,normal,mixed,mixed,,,4,9,,3,9,8,5,,0.008381342,FAIL
2768,,53:54.9,55:36.5,0 days 00:01:41.624220,3,96,96,,2,5,,,,,,,,,,,10,7,10,8,,,,,,,2,2,6,5,10,10,2,7,8,10,,,,,,,,,,,4,6,normal,mixed,mixed,,,4,10,,3,9,8,5,,0.00259302,FAIL
2769,,55:36.5,57:18.4,0 days 00:01:41.901178,3,96,96,,2,5,,,,,,,,,,,10,7,10,8,,,,,,,2,2,6,5,8,10,2,7,8,10,,,,,,,,,,,4,6,normal,mixed,mixed,,,4,10,,3,9,8,5,,0.002619732,FAIL
2770,,57:18.4,59:00.3,0 days 00:01:41.877747,3,96,96,,2,5,,,,,,,,,,,10,7,10,8,,,,,,,2,2,6,5,10,10,2,7,9,10,,,,,,,,,,,4,6,normal,mixed,mixed,,,4,10,,3,9,8,5,,0.008799195,FAIL
2771,,59:00.3,00:42.0,0 days 00:01:41.686193,3,96,96,,2,5,,,,,,,,,,,10,7,10,8,,,,,,,2,2,6,4,9,10,2,7,8,10,,,,,,,,,,,4,6,normal,mixed,mixed,,,4,10,,3,9,8,5,,0.00670298,FAIL
2772,,00:42.0,02:23.5,0 days 00:01:41.503690,3,96,96,,2,5,,,,,,,,,,,10,7,10,8,,,,,,,2,2,6,5,10,10,2,7,8,10,,,,,,,,,,,4,6,normal,mixed,mixed,,,4,10,,3,9,8,5,,0.006618516,FAIL
2773,,02:23.5,04:05.5,0 days 00:01:41.979876,3,96,96,,2,5,,,,,,,,,,,10,7,10,8,,,,,,,2,2,6,5,10,10,3,7,8,10,,,,,,,,,,,4,6,normal,mixed,mixed,,,4,10,,3,9,8,5,,0.0089182,FAIL
2774,,04:05.5,05:47.5,0 days 00:01:42.001359,3,96,96,,2,5,,,,,,,,,,,10,7,10,8,,,,,,,2,2,6,5,10,10,2,7,8,10,,,,,,,,,,,4,6,normal,mixed,mixed,,,4,10,,3,9,10,5,,0.006748055,FAIL
2775,,05:47.5,07:29.4,0 days 00:01:41.896534,3,96,96,,2,5,,,,,,,,,,,10,8,10,8,,,,,,,2,2,6,4,9,10,3,7,8,10,,,,,,,,,,,4,6,normal,mixed,mixed,,,4,10,,3,9,8,5,,0.006621318,FAIL
2776,,07:29.4,09:11.3,0 days 00:01:41.903433,3,96,96,,2,5,,,,,,,,,,,10,7,10,8,,,,,,,2,2,6,5,10,10,2,8,8,9,,,,,,,,,,,4,6,normal,mixed,mixed,,,4,10,,3,9,8,5,,0.006861496,FAIL
2777,,09:11.3,10:53.1,0 days 00:01:41.807918,3,96,96,,2,5,,,,,,,,,,,10,7,10,7,,,,,,,2,2,6,5,10,10,2,7,8,10,,,,,,,,,,,4,6,normal,mixed,mixed,,,4,10,,3,9,8,5,,0.006770784,FAIL
2778,,10:53.1,12:35.0,0 days 00:01:41.874981,3,96,96,,2,5,,,,,,,,,,,10,7,10,7,,,,,,,2,2,6,5,10,10,2,7,8,10,,,,,,,,,,,4,6,normal,mixed,mixed,,,4,10,,3,9,8,5,,0.008807543,FAIL
2779,,12:35.0,14:17.2,0 days 00:01:42.250730,3,96,96,,2,5,,,,,,,,,,,10,7,10,8,,,,,,,2,2,6,5,10,10,2,7,8,10,,,,,,,,,,,4,6,normal,mixed,mixed,,,4,10,,3,9,8,5,,0.008494165,FAIL
2780,,14:17.3,16:00.5,0 days 00:01:43.239311,3,96,96,,2,5,,,,,,,,,,,10,7,10,8,,,,,,,2,2,6,5,10,10,2,7,8,10,,,,,,,,,,,4,6,normal,mixed,mixed,,,4,10,,3,9,8,5,,0.006633201,FAIL
2781,,16:00.5,17:43.4,0 days 00:01:42.889515,3,96,96,,2,5,,,,,,,,,,,10,7,10,8,,,,,,,3,2,6,5,10,10,2,7,8,10,,,,,,,,,,,4,6,normal,mixed,mixed,,,4,10,,3,9,8,5,,0.006896508,FAIL
2782,,17:43.4,19:26.6,0 days 00:01:43.203978,3,96,96,,2,5,,,,,,,,,,,10,7,10,8,,,,,,,2,2,6,5,10,10,3,7,8,10,,,,,,,,,,,4,6,normal,mixed,mixed,,,4,10,,3,9,8,5,,0.006508602,FAIL
2783,,19:26.6,21:09.8,0 days 00:01:43.213678,3,96,96,,2,5,,,,,,,,,,,10,7,10,8,,,,,,,2,2,6,5,10,10,2,7,9,10,,,,,,,,,,,4,6,normal,mixed,mixed,,,4,10,,3,9,8,5,,0.006935765,FAIL
2784,,21:09.8,22:52.5,0 days 00:01:42.672770,3,96,96,,2,5,,,,,,,,,,,10,7,10,8,,,,,,,2,2,6,5,10,10,2,7,8,10,,,,,,,,,,,4,6,normal,mixed,mixed,,,4,10,,3,9,8,5,,0.00679011,FAIL
2785,,22:52.5,24:34.9,0 days 00:01:42.463815,3,96,96,,2,5,,,,,,,,,,,10,7,10,8,,,,,,,2,2,6,5,9,9,2,7,8,10,,,,,,,,,,,4,6,normal,mixed,mixed,,,4,10,,3,9,8,5,,0.008623815,FAIL
2786,,24:35.0,26:17.6,0 days 00:01:42.652561,3,96,96,,2,5,,,,,,,,,,,10,7,10,8,,,,,,,2,2,6,5,10,10,2,7,8,10,,,,,,,,,,,4,6,normal,mixed,mixed,,,4,10,,3,9,8,5,,0.006702427,FAIL
2787,,26:17.6,28:00.6,0 days 00:01:42.942415,3,96,96,,2,5,,,,,,,,,,,10,7,10,8,,,,,,,2,2,6,5,10,10,2,7,8,10,,,,,,,,,,,4,6,normal,mixed,mixed,,,4,10,,3,9,8,5,,0.008820199,FAIL
2788,,28:00.6,29:43.4,0 days 00:01:42.805149,3,96,96,,2,5,,,,,,,,,,,10,7,10,8,,,,,,,2,2,6,4,10,10,4,7,8,10,,,,,,,,,,,4,6,normal,mixed,mixed,,,4,10,,3,9,8,5,,0.002530931,FAIL
2789,,29:43.4,31:26.3,0 days 00:01:42.943445,3,96,96,,2,5,,,,,,,,,,,8,7,10,7,4,,,,,,2,2,6,5,10,10,2,7,8,10,,,,,,,,,,,4,6,normal,mixed,mixed,,,5,10,,3,9,8,5,,0.00260472,FAIL
2790,,31:26.3,33:09.8,0 days 00:01:43.469683,3,96,96,,2,5,,,,,,,,,,,10,7,10,8,,,,,,,2,2,6,5,10,10,2,7,8,10,,,,,,,,,,,4,6,normal,mixed,mixed,,,4,10,,3,9,8,5,,0.002595451,FAIL
2791,,33:09.8,34:53.3,0 days 00:01:43.537543,3,96,96,,2,5,,,,,,,,,,,10,7,10,8,,,,,,,2,2,6,5,10,10,2,7,8,10,,,,,,,,,,,4,6,normal,mixed,mixed,,,4,10,,3,9,8,5,,0.006813582,FAIL
2792,,34:53.3,36:36.2,0 days 00:01:42.851404,3,96,96,,2,5,,,,,,,,,,,8,7,10,8,,,,,,,2,2,6,5,10,10,2,7,8,10,,,,,,,,,,,4,6,normal,mixed,mixed,,,4,10,,3,9,8,5,,0.009238036,FAIL
2793,,36:36.2,38:16.5,0 days 00:01:40.322616,3,96,96,,2,5,,,,,,,,,,,10,7,10,8,,,,,,,2,2,6,5,10,10,2,7,8,,,,,,,,,,,,4,6,normal,mixed,mixed,,,4,9,,3,9,8,5,,0.006765486,FAIL
2794,,38:16.5,39:58.3,0 days 00:01:41.763723,3,96,96,,2,5,,,,,,,,,,,10,7,10,8,,,,,,,2,2,6,5,10,10,2,7,8,10,,,,,,,,,,,4,6,normal,mixed,mixed,,,4,10,,3,9,8,5,,0.006593419,FAIL
2795,,39:58.3,41:40.2,0 days 00:01:41.958183,3,96,96,,2,5,,,,,,,,,,,10,7,10,8,,,,,,,2,2,6,4,10,10,3,7,8,10,,,,,,,,,,,4,6,normal,mixed,mixed,,,4,10,,3,9,8,5,,0.006783242,FAIL
2796,,41:40.2,43:22.5,0 days 00:01:42.299482,3,96,96,,2,5,,,,,,,,,,,10,7,10,8,,,,,,,2,2,6,5,10,10,2,7,8,10,,,,,,,,,,,4,6,normal,mixed,mixed,,,4,10,,3,9,8,5,,0.006687129,FAIL
2797,,43:22.5,45:04.6,0 days 00:01:42.063925,3,96,96,,2,5,,,,,,,,,,,10,7,10,8,,,,,,,2,2,6,5,9,10,2,7,8,10,,,,,,,,,,,4,6,normal,mixed,mixed,,,4,10,,3,9,8,5,,0.002925734,FAIL
2798,,45:04.6,46:46.7,0 days 00:01:42.134849,3,96,96,,2,5,,,,,,,,,,,10,7,10,8,,,,,,,2,2,6,5,10,10,2,7,8,10,,,,,,,,,,,4,6,normal,mixed,mixed,,,4,10,,3,9,8,5,,0.006836961,FAIL
2799,,46:46.8,48:28.1,0 days 00:01:41.382416,3,16,96,,2,5,,,,,,,,,,,8,7,10,8,,,,,,,2,2,6,4,10,9,3,7,8,10,,,,,,,,,,,4,6,normal,mixed,mixed,,,4,10,,3,9,8,5,,0.00679042,FAIL
2800,,48:28.1,50:10.2,0 days 00:01:42.016454,3,96,96,,2,5,,,,,,,,,,,10,7,10,8,,,,,,,2,2,6,5,10,10,2,7,8,10,,,,,,,,,,,4,6,normal,mixed,mixed,,,4,10,,3,9,8,5,,0.006743369,FAIL
2801,,50:10.2,51:51.7,0 days 00:01:41.510699,3,96,96,,2,5,,,,,,,,,,,10,7,10,8,,,,,,,2,2,6,5,10,10,2,7,8,10,,,,,,,,,,,4,6,normal,mixed,mixed,,,4,10,,3,9,8,5,,0.00682008,FAIL
2802,,51:51.7,53:32.8,0 days 00:01:41.112480,3,96,96,,2,5,,,,,,,,,,,8,7,10,8,,,,,,,2,2,6,5,10,10,2,7,8,10,,,,,,,,,,,4,6,normal,mixed,mixed,,,4,10,,3,9,8,5,,0.00688074,FAIL
2803,,53:32.8,55:14.8,0 days 00:01:41.958157,3,96,96,,2,5,,,,,,,,,,,10,7,10,8,,,,,,,2,2,6,5,10,10,2,7,8,10,,,,,,,,,,,4,6,normal,mixed,mixed,,,4,10,,3,9,8,5,,0.006699834,FAIL
2804,,55:14.8,56:57.5,0 days 00:01:42.739778,3,96,96,,2,5,,,,,,,,,,,10,7,10,8,,,,,,,2,2,6,5,10,10,3,7,8,10,,,,,,,,,,,4,6,normal,mixed,mixed,,,4,10,,3,9,8,5,,0.002539935,FAIL
2805,,56:57.5,58:38.7,0 days 00:01:41.237850,3,96,96,,2,5,,,,,,,,,,,10,7,10,8,,,,,,,2,2,6,4,10,10,2,7,8,10,,,,,,,,,,,4,6,normal,mixed,mixed,,,4,10,,3,9,8,5,,0.006784604,FAIL
2806,,58:38.7,00:21.1,0 days 00:01:42.370777,3,96,96,,2,5,,,,,,,,,,,10,7,10,8,,,,,,,2,2,6,5,9,10,2,7,8,10,,,,,,,,,,,4,6,normal,mixed,mixed,,,4,10,,3,9,8,5,,0.008866818,FAIL
2807,,00:21.1,02:02.8,0 days 00:01:41.630806,3,96,96,,2,5,,,,,,,,,,,10,7,10,8,,,,,,,2,2,6,5,9,10,2,7,8,10,,,,,,,,,,,4,6,normal,mixed,mixed,,,4,10,,3,9,8,5,,0.006745432,FAIL
2808,,02:02.8,03:44.6,0 days 00:01:41.837622,3,96,96,,2,5,,,,,,,,,,,10,7,10,8,,,,,,,2,2,6,5,10,10,2,7,8,10,,,,,,,,,,,4,6,normal,mixed,mixed,,,4,10,,3,9,8,5,,0.002655912,FAIL
2809,,03:44.6,05:26.7,0 days 00:01:42.107298,3,96,96,,2,5,,,,,,,,,,,10,7,10,8,4,,,,,,2,2,6,5,10,10,2,7,8,10,,,,,,,,,,,4,6,normal,mixed,mixed,,,5,10,,3,9,8,5,,0.006701845,FAIL
2810,,05:26.7,07:08.7,0 days 00:01:41.991935,3,96,96,,2,5,,,,,,,,,,,10,7,10,8,,,,,,,2,2,6,5,9,10,3,7,8,10,,,,,,,,,,,4,6,normal,mixed,mixed,,,4,10,,3,9,8,5,,0.00674981,FAIL
2811,,07:08.7,08:49.2,0 days 00:01:40.530131,3,96,96,,2,5,,,,,,,,,,,10,7,10,8,,,,,,,2,2,6,4,10,10,2,7,8,,,,,,,,,,,,4,6,normal,mixed,mixed,,,4,9,,3,9,8,5,,0.008745871,FAIL
2812,,08:49.2,10:31.3,0 days 00:01:42.111335,3,96,96,,2,5,,,,,,,,,,,10,7,10,8,,,,,,,3,2,6,5,10,10,2,7,8,10,,,,,,,,,,,4,6,normal,mixed,mixed,,,4,10,,3,9,8,5,,0.006727876,FAIL
2813,,10:31.4,12:13.4,0 days 00:01:42.003180,3,96,96,,2,5,,,,,,,,,,,10,7,10,8,,,,,,,2,2,6,5,10,9,3,7,8,10,,,,,,,,,,,4,6,normal,mixed,mixed,,,4,10,,3,9,8,5,,0.006796496,FAIL
2814,,12:13.4,13:55.5,0 days 00:01:42.131878,3,96,96,,2,5,,,,,,,,,,,10,7,10,8,,,,,,,2,2,6,5,10,10,2,7,8,10,,,,,,,,,,,4,6,normal,mixed,mixed,,,4,10,,3,9,8,5,,0.008819445,FAIL
2815,,13:55.5,15:37.2,0 days 00:01:41.688247,3,96,96,,2,5,,,,,,,,,,,10,7,10,8,,,,,,,2,2,6,5,9,10,2,7,8,10,,,,,,,,,,,4,6,normal,mixed,mixed,,,4,10,,3,9,8,5,,0.006678584,FAIL
2816,,15:37.2,17:19.4,0 days 00:01:42.191192,3,96,96,,2,5,,,,,,,,,,,10,7,10,8,,,,,,,2,2,6,5,10,10,4,7,8,10,,,,,,,,,,,4,6,normal,mixed,mixed,,,4,10,,3,9,8,5,,0.009069805,FAIL
2817,,17:19.4,19:00.9,0 days 00:01:41.469377,3,96,96,,2,5,,,,,,,,,,,10,7,10,8,,,,,,,2,2,6,5,10,10,2,7,8,10,,,,,,,,,,,4,6,normal,mixed,mixed,,,4,10,,3,9,8,5,,0.008714499,FAIL
2818,,19:00.9,20:41.8,0 days 00:01:40.987052,3,96,96,,2,5,,,,,,,,,,,10,7,10,8,,,,,,,2,2,6,5,10,10,2,7,8,,,,,,,,,,,,4,6,normal,mixed,mixed,,,4,9,,3,9,8,5,,0.006702934,FAIL
2819,,20:41.8,22:24.1,0 days 00:01:42.273077,3,96,96,,2,5,,,,,,,,,,,10,7,10,8,,,,,,,2,2,6,5,10,10,2,7,8,10,,,,,,,,,,,4,6,normal,mixed,mixed,,,4,10,,3,9,8,5,,0.008606775,FAIL
2820,,22:24.1,24:06.6,0 days 00:01:42.447772,3,96,96,,2,5,,,,,,,,,,,10,7,10,8,,,,,,,2,2,6,5,10,10,3,7,8,10,,,,,,,,,,,4,6,normal,mixed,mixed,,,4,10,,3,9,8,5,,0.00675673,FAIL
2821,,24:06.6,25:48.0,0 days 00:01:41.467662,3,96,96,,2,5,,,,,,,,,,,10,7,10,8,,,,,,,2,2,6,5,10,10,2,7,8,10,,,,,,,,,,,4,6,normal,mixed,mixed,,,4,10,,3,9,8,5,,0.006764486,FAIL
2822,,25:48.0,27:29.7,0 days 00:01:41.657828,3,96,96,,2,5,,,,,,,,,,,10,7,10,8,,,,,,,2,2,6,5,10,10,2,7,8,10,,,,,,,,,,,4,6,normal,mixed,mixed,,,4,10,,3,9,8,5,,0.00882331,FAIL
2823,,27:29.7,29:10.9,0 days 00:01:41.179749,3,96,96,,2,5,,,,,,,,,,,10,7,10,8,,,,,,,2,2,6,4,10,10,2,7,8,10,,,,,,,,,,,4,6,normal,mixed,mixed,,,4,10,,3,9,8,5,,0.006623558,FAIL
2824,,29:10.9,30:52.5,0 days 00:01:41.618457,3,96,96,,2,5,,,,,,,,,,,10,7,10,8,,,,,,,3,2,6,5,10,10,2,8,8,10,,,,,,,,,,,4,6,normal,mixed,mixed,,,4,10,,3,9,8,5,,0.009039341,FAIL
2825,,30:52.5,32:34.5,0 days 00:01:41.962828,3,96,96,,2,5,,,,,,,,,,,10,7,10,8,,,,,,,2,2,6,5,10,10,2,7,8,10,,,,,,,,,,,4,6,normal,mixed,mixed,,,4,10,,3,9,8,5,,0.006862338,FAIL
2826,,32:34.5,34:16.1,0 days 00:01:41.574881,3,96,96,,2,5,,,,,,,,,,,10,7,10,8,,,,,,,2,2,6,5,10,10,2,7,8,10,,,,,,,,,,,4,6,normal,mixed,mixed,,,4,10,,3,9,8,5,,0.00694114,FAIL
2827,,34:16.1,35:58.0,0 days 00:01:41.957642,3,96,96,,2,5,,,,,,,,,,,10,8,10,8,,,,,,,2,2,6,5,10,10,2,7,8,10,,,,,,,,,,,4,6,normal,mixed,mixed,,,4,10,,3,9,8,5,,0.006877239,FAIL
2828,,35:58.0,37:41.3,0 days 00:01:43.315948,3,96,96,,2,5,,,,,,,,,,,10,7,10,8,,,,,,,2,2,6,4,10,10,2,7,8,10,,,,,,,,,,,4,6,normal,mixed,mixed,,,4,10,,3,9,8,5,,0.002526108,FAIL
2829,,37:41.3,39:25.4,0 days 00:01:44.072062,3,96,96,,2,5,,,,,,,,,,,10,7,10,8,,,,,,,2,2,6,5,10,10,2,7,8,10,,,,,,,,,,,4,6,normal,mixed,mixed,,,4,10,,3,9,8,5,,0.002630028,FAIL
2830,,39:25.4,41:09.2,0 days 00:01:43.737371,3,96,96,,2,5,,,,,,,,,,,10,7,10,7,,,,,,,2,2,6,5,10,10,3,7,8,10,,,,,,,,,,,4,6,normal,mixed,mixed,,,4,10,,3,8,8,5,,0.006864742,FAIL
2831,,41:09.2,42:52.9,0 days 00:01:43.789354,3,96,96,,2,5,,,,,,,,,,,10,7,10,8,,,,,,,2,2,6,5,10,10,3,7,8,10,,,,,,,,,,,4,6,normal,mixed,mixed,,,4,10,,3,9,8,5,,0.006736472,FAIL
2832,,42:53.0,44:36.7,0 days 00:01:43.762757,3,96,96,,2,5,,,,,,,,,,,10,7,10,8,,,,,,,2,2,6,5,10,10,2,7,8,10,,,,,,,,,,,4,6,normal,mixed,mixed,,,4,10,,3,9,8,5,,0.009011327,FAIL
2833,,44:36.7,46:20.4,0 days 00:01:43.652452,3,96,96,,2,5,,,,,,,,,,,10,7,10,8,,,,,,,2,2,6,5,10,10,2,7,8,10,,,,,,,,,,,4,6,normal,mixed,mixed,,,4,10,,3,9,8,5,,0.002611014,FAIL
2834,,46:20.4,48:04.6,0 days 00:01:44.244587,3,96,96,,2,5,,,,,,,,,,,10,7,10,8,,,,,,,3,2,6,4,10,10,2,7,8,10,,,,,,,,,,,4,6,normal,mixed,mixed,,,4,10,,3,9,10,5,,0.006799311,FAIL
2835,,48:04.6,49:48.4,0 days 00:01:43.767592,3,96,96,,2,5,,,,,,,,,,,10,7,10,8,,,,,,,2,2,6,5,10,10,3,7,8,10,,,,,,,,,,,4,6,normal,mixed,mixed,,,4,10,,3,9,8,5,,0.00823585,FAIL
2836,,49:48.4,51:32.2,0 days 00:01:43.759356,3,96,96,,2,5,,,,,,,,,,,10,7,10,8,,,,,,,2,2,6,5,10,10,3,7,8,10,,,,,,,,,,,4,6,normal,mixed,mixed,,,4,10,,3,9,8,5,,0.008416349,FAIL
2837,,51:32.2,53:16.2,0 days 00:01:44.013838,3,96,96,,2,5,,,,,,,,,,,10,7,10,8,,,,,,,2,2,6,5,10,10,2,7,8,10,,,,,,,,,,,4,6,normal,mixed,mixed,,,4,10,,3,9,8,5,,0.006596947,FAIL
2838,,53:16.2,55:00.3,0 days 00:01:44.119614,3,96,96,,2,5,,,,,,,,,,,10,7,10,8,,,,,,,2,2,6,5,10,9,3,8,9,10,,,,,,,,,,,4,6,normal,mixed,mixed,,,4,10,,3,9,8,5,,0.008238188,FAIL
2839,,55:00.3,56:43.7,0 days 00:01:43.424138,3,96,96,,2,5,,,,,,,,,,,10,7,10,8,,,,,,,2,2,6,5,10,10,2,7,8,10,,,,,,,,,,,4,6,normal,mixed,mixed,,,4,10,,3,9,8,5,,0.00900519,FAIL
2840,,56:43.7,58:27.6,0 days 00:01:43.852791,3,96,96,,2,5,,,,,,,,,,,10,7,10,8,,,,,,,2,2,6,5,9,10,2,7,8,10,,,,,,,,,,,4,6,normal,mixed,mixed,,,4,10,,3,9,8,5,,0.006725464,FAIL
2841,,58:27.6,00:11.7,0 days 00:01:44.121020,3,96,96,,2,5,,,,,,,,,,,10,7,10,8,,,,,,,2,2,6,5,10,10,2,7,8,10,,,,,,,,,,,4,6,normal,mixed,mixed,,,4,10,,3,8,8,5,,0.008901556,FAIL
2842,,00:11.7,01:55.4,0 days 00:01:43.685609,3,96,96,,2,5,,,,,,,,,,,10,7,10,8,,,,,,,2,2,6,5,10,10,2,7,8,10,,,,,,,,,,,4,6,normal,mixed,mixed,,,4,10,,3,9,8,5,,0.00669889,FAIL
2843,,01:55.4,03:39.0,0 days 00:01:43.638140,3,16,96,,2,5,,,,,,,,,,,10,7,10,8,,,,,,,2,2,6,5,10,10,3,7,8,10,,,,,,,,,,,4,6,normal,mixed,mixed,,,4,10,,3,9,8,5,,0.00893436,FAIL
2844,,03:39.0,05:22.7,0 days 00:01:43.624638,3,96,96,,2,5,,,,,,,,,,,10,7,10,8,,,,,,,2,2,6,5,10,10,2,7,8,10,,,,,,,,,,,4,6,normal,mixed,mixed,,,4,10,,3,9,8,5,,0.009041794,FAIL
2845,,05:22.7,07:05.7,0 days 00:01:43.057282,3,96,96,,2,5,,,,,,,,,,,10,7,10,8,,,,,,,2,2,6,5,9,10,2,7,8,10,,,,,,,,,,,4,6,normal,mixed,mixed,,,4,10,,3,9,8,5,,0.008485822,FAIL
2846,,07:05.7,08:47.6,0 days 00:01:41.916562,3,96,96,,2,5,,,,,,,,,,,10,7,10,8,,,,,,,2,2,6,5,10,10,2,7,8,10,,,,,,,,,,,4,6,normal,mixed,mixed,,,4,10,,3,9,8,6,,0.00683561,FAIL
2847,,08:47.6,10:29.7,0 days 00:01:42.033043,3,96,96,,2,5,,,,,,,,,,,10,7,10,8,,,,,,,2,2,6,5,10,9,3,7,8,10,,,,,,,,,,,4,6,normal,mixed,mixed,,,4,10,,3,9,8,5,,0.002793917,FAIL
2848,,10:29.7,12:13.7,0 days 00:01:43.999220,3,96,96,,2,5,,,,,,,,,,,8,7,10,8,,,,,,,2,3,6,5,10,10,2,7,8,10,,,,,,,,,,,4,6,normal,mixed,mixed,,,4,10,,3,9,8,5,,0.006795642,FAIL
2849,,12:13.7,13:57.5,0 days 00:01:43.862918,3,96,96,,2,5,,,,,,,,,,,10,7,10,8,,,,,,,2,2,6,5,9,10,2,7,8,10,,,,,,,,,,,4,6,normal,mixed,mixed,,,4,10,,3,9,8,5,,0.008346545,FAIL
2850,,13:57.6,15:40.8,0 days 00:01:43.289653,3,96,96,,2,5,,,,,,,,,,,10,7,10,8,,,,,,,2,2,6,5,8,10,2,7,8,10,,,,,,,,,,,4,6,normal,mixed,mixed,,,4,10,,3,9,8,5,,0.008815084,FAIL
2851,,15:40.8,17:25.1,0 days 00:01:44.267946,3,96,96,,2,5,,,,,,,,,,,10,7,10,8,,,,,,,2,2,6,5,10,10,2,7,9,10,,,,,,,,,,,4,6,normal,mixed,mixed,,,4,10,,3,9,8,5,,0.006789317,FAIL
2852,,17:25.1,19:09.3,0 days 00:01:44.211974,3,96,96,,2,5,,,,,,,,,,,10,7,10,8,,,,,,,2,2,6,5,10,10,2,7,8,10,,,,,,,,,,,4,6,normal,mixed,mixed,,,4,10,,3,9,8,5,,0.008295364,FAIL
2853,,19:09.3,20:53.0,0 days 00:01:43.653445,3,96,96,,2,5,,,,,,,,,,,10,7,10,8,,,,,,,2,2,6,5,9,10,2,7,8,10,,,,,,,,,,,4,6,normal,mixed,mixed,,,4,10,,3,9,8,5,,0.002637749,FAIL
2854,,20:53.0,22:36.7,0 days 00:01:43.745600,3,96,96,,2,5,,,,,,,,,,,10,7,10,8,,,,,,,2,2,6,5,9,10,2,7,8,10,,,,,,,,,,,4,6,normal,mixed,mixed,,,4,10,,3,9,8,5,,0.006730333,FAIL
2855,,22:36.7,24:20.6,0 days 00:01:43.904401,3,96,96,,2,5,,,,,,,,,,,10,7,10,8,4,,,,,,2,2,6,5,10,10,2,7,8,10,,,,,,,,,,,4,6,normal,mixed,mixed,,,5,10,,3,9,8,5,,0.002584984,FAIL
2856,,24:20.6,26:04.5,0 days 00:01:43.837776,3,96,96,,2,5,,,,,,,,,,,10,7,10,8,,,,,,,3,2,6,5,10,10,2,7,8,10,,,,,,,,,,,4,6,normal,mixed,mixed,,,4,10,,3,9,8,5,,0.006784134,FAIL
2857,,26:04.5,27:48.3,0 days 00:01:43.763751,3,96,96,,2,5,,,,,,,,,,,10,7,10,8,,,,,,,2,2,6,5,10,10,2,7,8,10,,,,,,,,,,,4,6,normal,mixed,mixed,,,4,10,,3,9,8,5,,0.007024636,FAIL
2858,,27:48.3,29:31.8,0 days 00:01:43.590611,3,96,96,,2,5,,,,,,,,,,,10,7,10,8,,,,,,,2,2,6,5,10,9,2,7,8,10,,,,,,,,,,,4,6,normal,mixed,mixed,,,4,10,,3,9,8,5,,0.006845347,FAIL
2859,,29:31.8,31:15.9,0 days 00:01:44.078978,3,96,96,,2,5,,,,,,,,,,,10,7,10,7,,,,,,,2,2,6,5,10,10,2,8,8,10,,,,,,,,,,,4,6,normal,mixed,mixed,,,4,10,,3,9,8,5,,0.00659616,FAIL
2860,,31:15.9,32:58.9,0 days 00:01:42.977572,3,96,96,,2,5,,,,,,,,,,,10,7,10,8,,,,,,,2,2,6,5,10,10,4,7,8,,,,,,,,,,,,4,6,normal,mixed,mixed,,,4,9,,3,9,8,5,,0.00677349,FAIL
2861,,32:58.9,34:42.8,0 days 00:01:43.857107,3,96,96,,2,5,,,,,,,,,,,10,7,10,8,,,,,,,2,2,6,5,9,9,3,7,8,10,,,,,,,,,,,4,6,normal,mixed,mixed,,,4,10,,3,9,8,5,,0.008718753,FAIL
2862,,34:42.8,36:26.2,0 days 00:01:43.457085,3,96,96,,2,5,,,,,,,,,,,10,7,10,8,,,,,,,2,2,6,5,10,10,3,7,8,10,,,,,,,,,,,4,6,normal,mixed,mixed,,,4,10,,3,9,8,5,,0.006987913,FAIL
2863,,36:26.2,38:10.1,0 days 00:01:43.850141,3,96,96,,2,5,,,,,,,,,,,10,7,10,8,,,,,,,2,2,6,5,10,10,4,7,8,10,,,,,,,,,,,4,6,normal,mixed,mixed,,,4,10,,3,9,8,5,,0.005870005,FAIL
2864,,38:10.1,39:54.1,0 days 00:01:44.002821,3,96,96,,2,5,,,,,,,,,,,10,7,10,8,,,,,,,2,2,6,5,10,10,3,7,8,10,,,,,,,,,,,4,6,normal,mixed,mixed,,,4,10,,3,9,8,5,,0.006992366,FAIL
2865,,39:54.1,41:38.0,0 days 00:01:43.870199,3,96,96,,2,5,,,,,,,,,,,8,7,10,8,,,,,,,2,2,6,5,8,10,2,7,8,10,,,,,,,,,,,4,6,normal,mixed,mixed,,,4,10,,3,9,8,5,,0.008679973,FAIL
2866,,41:38.0,43:21.8,0 days 00:01:43.787761,3,96,96,,2,5,,,,,,,,,,,10,7,10,8,,,,,,,2,2,6,5,10,9,3,7,8,10,,,,,,,,,,,4,6,normal,mixed,mixed,,,4,10,,3,9,8,5,,0.008773053,FAIL
2867,,43:21.8,45:05.3,0 days 00:01:43.534171,3,96,96,,2,5,,,,,,,,,,,10,7,10,8,,,,,,,2,2,6,5,10,10,2,7,8,10,,,,,,,,,,,4,6,normal,mixed,mixed,,,4,10,,3,9,8,5,,0.008933729,FAIL
2868,,45:05.3,46:49.0,0 days 00:01:43.688268,3,96,96,,2,5,,,,,,,,,,,10,7,10,8,,,,,,,2,2,6,4,10,10,2,7,8,10,,,,,,,,,,,4,6,normal,mixed,mixed,,,4,10,,3,9,8,6,,0.00687,FAIL
2869,,46:49.0,48:32.4,0 days 00:01:43.383357,3,96,96,,2,5,,,,,,,,,,,10,7,10,8,,,,,,,2,2,6,5,9,10,4,7,8,10,,,,,,,,,,,4,6,normal,mixed,mixed,,,4,10,,3,9,8,5,,0.00822622,FAIL
2870,,48:32.4,50:14.6,0 days 00:01:42.251794,3,96,96,,2,5,,,,,,,,,,,10,7,10,8,,,,,,,2,2,6,5,9,10,4,7,8,10,,,,,,,,,,,4,6,normal,mixed,mixed,,,4,10,,3,9,8,5,,0.006825296,FAIL
2871,,50:14.6,51:57.4,0 days 00:01:42.726645,3,96,96,,2,5,,,,,,,,,,,10,7,10,8,,,,,,,2,2,6,5,10,10,3,7,8,10,,,,,,,,,,,4,6,normal,mixed,mixed,,,4,10,,3,9,8,5,,0.006670856,FAIL
2872,,51:57.4,53:40.2,0 days 00:01:42.854841,3,96,96,,2,5,,,,,,,,,,,10,7,10,8,,,,,,,2,2,6,5,10,10,2,7,8,10,,,,,,,,,,,4,6,normal,mixed,mixed,,,4,10,,3,9,8,5,,0.008963335,FAIL
2873,,53:40.2,55:23.3,0 days 00:01:43.056374,3,96,96,,2,5,,,,,,,,,,,10,7,10,8,,,,,,,2,2,6,5,9,10,2,7,8,10,,,,,,,,,,,4,6,normal,mixed,mixed,,,4,10,,3,9,8,5,,0.00259166,FAIL
2874,,55:23.3,57:04.5,0 days 00:01:41.257423,3,96,96,,2,5,,,,,,,,,,,10,7,10,8,,,,,,,2,2,6,4,10,9,2,7,8,10,,,,,,,,,,,4,6,normal,mixed,mixed,,,4,10,,3,9,8,5,,0.006932948,FAIL
2875,,57:04.5,58:45.9,0 days 00:01:41.384159,3,96,96,,2,5,,,,,,,,,,,10,7,10,8,,,,,,,2,2,6,5,10,10,2,7,8,10,,,,,,,,,,,4,6,normal,mixed,mixed,,,4,10,,3,9,8,5,,0.006773294,FAIL
2876,,58:45.9,00:27.3,0 days 00:01:41.382989,3,96,96,,2,5,,,,,,,,,,,10,7,10,8,,,,,,,2,2,6,5,10,10,2,7,8,10,,,,,,,,,,,4,6,normal,mixed,mixed,,,4,10,,3,9,8,5,,0.00674065,FAIL
2877,,00:27.3,02:08.9,0 days 00:01:41.570243,3,96,96,,2,5,,,,,,,,,,,10,7,10,8,,,,,,,2,2,6,5,10,10,2,7,8,10,,,,,,,,,,,4,6,normal,mixed,mixed,,,4,10,,3,9,8,6,,0.008750039,FAIL
