number,value,datetime_start,datetime_complete,duration,params_gat_heads,params_gat_hidden_0,params_gat_hidden_1,params_gat_hidden_2,params_gat_layers,params_gat_out,params_kan_arity_0_0,params_kan_arity_0_1,params_kan_arity_0_2,params_kan_arity_0_3,params_kan_arity_0_4,params_kan_arity_0_5,params_kan_arity_0_6,params_kan_arity_0_7,params_kan_arity_0_8,params_kan_arity_0_9,params_kan_arity_1_0,params_kan_arity_1_1,params_kan_arity_1_2,params_kan_arity_1_3,params_kan_arity_1_4,params_kan_arity_1_5,params_kan_arity_1_6,params_kan_arity_1_7,params_kan_arity_1_8,params_kan_arity_1_9,params_kan_arity_2_0,params_kan_arity_2_1,params_kan_arity_2_2,params_kan_arity_2_3,params_kan_arity_2_4,params_kan_arity_2_5,params_kan_arity_2_6,params_kan_arity_2_7,params_kan_arity_2_8,params_kan_arity_2_9,params_kan_arity_3_0,params_kan_arity_3_1,params_kan_arity_3_2,params_kan_arity_3_3,params_kan_arity_3_4,params_kan_arity_3_5,params_kan_arity_3_6,params_kan_arity_3_7,params_kan_arity_3_8,params_kan_arity_3_9,params_kan_grid,params_kan_k,params_kan_layer_type_0,params_kan_layer_type_1,params_kan_layer_type_2,params_kan_layer_type_3,params_kan_mult_nodes_0,params_kan_mult_nodes_1,params_kan_mult_nodes_2,params_kan_mult_nodes_3,params_kan_n_layers,params_kan_neurons_0,params_kan_neurons_1,params_kan_neurons_2,params_kan_neurons_3,params_lr,state
2996,,24:41.4,26:22.6,0 days 00:01:41.265393,3,96,96,,2,5,,,,,,,,,,,10,7,10,8,,,,,,,2,2,6,5,10,10,3,7,8,10,,,,,,,,,,,4,6,normal,mixed,mixed,,,4,10,,3,9,8,6,,0.006816022,FAIL
2997,,26:22.6,28:03.7,0 days 00:01:41.066840,3,96,96,,2,5,,,,,,,,,,,10,7,10,8,,,,,,,2,2,6,5,10,10,2,7,8,10,,,,,,,,,,,4,6,normal,mixed,mixed,,,4,10,,3,9,8,5,,0.002596146,FAIL
2998,,28:03.7,29:44.5,0 days 00:01:40.766574,3,96,96,,2,5,,,,,,,,,,,10,7,10,8,,,,,,,2,2,6,5,8,9,2,7,8,10,,,,,,,,,,,4,6,normal,mixed,mixed,,,4,10,,3,9,8,5,,0.008949353,FAIL
2999,,29:44.5,31:23.9,0 days 00:01:39.467918,3,96,96,,2,5,,,,,,,,,,,10,7,10,8,,,,,,,2,2,6,5,9,10,2,7,8,,,,,,,,,,,,4,6,normal,mixed,mixed,,,4,9,,3,9,8,5,,0.006710691,FAIL
