number,value,datetime_start,datetime_complete,duration,params_gat_heads,params_gat_hidden_0,params_gat_hidden_1,params_gat_hidden_2,params_gat_layers,params_gat_out,params_kan_arity_0_0,params_kan_arity_0_1,params_kan_arity_0_2,params_kan_arity_0_3,params_kan_arity_0_4,params_kan_arity_0_5,params_kan_arity_0_6,params_kan_arity_0_7,params_kan_arity_0_8,params_kan_arity_0_9,params_kan_arity_1_0,params_kan_arity_1_1,params_kan_arity_1_2,params_kan_arity_1_3,params_kan_arity_1_4,params_kan_arity_1_5,params_kan_arity_1_6,params_kan_arity_1_7,params_kan_arity_1_8,params_kan_arity_1_9,params_kan_arity_2_0,params_kan_arity_2_1,params_kan_arity_2_2,params_kan_arity_2_3,params_kan_arity_2_4,params_kan_arity_2_5,params_kan_arity_2_6,params_kan_arity_2_7,params_kan_arity_2_8,params_kan_arity_2_9,params_kan_arity_3_0,params_kan_arity_3_1,params_kan_arity_3_2,params_kan_arity_3_3,params_kan_arity_3_4,params_kan_arity_3_5,params_kan_arity_3_6,params_kan_arity_3_7,params_kan_arity_3_8,params_kan_arity_3_9,params_kan_grid,params_kan_k,params_kan_layer_type_0,params_kan_layer_type_1,params_kan_layer_type_2,params_kan_layer_type_3,params_kan_mult_nodes_0,params_kan_mult_nodes_1,params_kan_mult_nodes_2,params_kan_mult_nodes_3,params_kan_n_layers,params_kan_neurons_0,params_kan_neurons_1,params_kan_neurons_2,params_kan_neurons_3,params_lr,state
477,,14:41.3,15:22.5,0 days 00:00:41.182711,4,8,128,32,3,5,9,2,10,4,2,2,10,10,,,10,5,6,6,5,5,3,,,,,,,,,,,,,,,,,,,,,,,,4,4,mixed,mixed,,,8,7,,,2,10,8,,,0.002829193,FAIL
478,,15:22.5,16:03.8,0 days 00:00:41.328616,4,8,128,32,3,5,8,6,10,4,2,2,10,10,,,10,5,6,6,5,4,3,,,,,,,,,,,,,,,,,,,,,,,,4,4,mixed,mixed,,,8,7,,,2,10,8,,,0.002980126,FAIL
479,139.619339,16:03.8,16:42.3,0 days 00:00:38.534392,4,8,128,32,3,5,,,,,,,,,,,10,5,6,6,5,4,3,,,,,,,,,,,,,,,,,,,,,,,,4,4,normal,mixed,,,,7,,,2,10,8,,,0.00282512,COMPLETE
480,,16:42.3,17:23.6,0 days 00:00:41.282158,4,8,32,32,3,5,8,2,10,4,2,2,10,10,,,9,6,4,8,6,2,4,,,,,,,,,,,,,,,,,,,,,,,,4,4,mixed,mixed,,,8,7,,,2,10,8,,,0.003944379,FAIL
481,184.1236267,17:23.6,18:00.7,0 days 00:00:37.100725,4,8,32,32,3,5,,,,,,,,,,,9,6,7,,,,,,,,,,,,,,,,,,,,,,,,,,,,4,4,normal,mixed,,,,3,,,2,10,8,,,0.003953043,COMPLETE
482,,18:00.7,18:41.9,0 days 00:00:41.170904,4,64,16,16,3,5,8,2,10,4,2,2,10,10,,,9,3,7,8,6,2,,,,,,,,,,,,,,,,,,,,,,,,,4,4,mixed,mixed,,,8,6,,,2,10,8,,,0.003077369,FAIL
483,171.0996704,18:41.9,19:21.5,0 days 00:00:39.591010,4,64,16,16,3,5,,,,,,,,,,,9,3,7,8,6,2,4,9,2,7,,,,,,,,,,,,,,,,,,,,,4,4,normal,mixed,,,,10,,,2,10,8,,,0.003120916,COMPLETE
484,,19:21.5,20:02.9,0 days 00:00:41.419475,4,64,32,32,3,5,8,2,10,4,2,2,10,10,,,9,4,4,9,6,5,,,,,,,,,,,,,,,,,,,,,,,,,4,4,mixed,mixed,,,8,6,,,2,10,9,,,0.004339585,FAIL
485,,20:02.9,20:46.0,0 days 00:00:43.094478,4,64,32,32,3,5,8,2,10,4,2,2,10,9,10,,9,4,7,9,6,5,,,,,,,,,,,,,,,,,,,,,,,,,4,4,mixed,mixed,,,9,6,,,2,10,9,,,0.004713696,FAIL
486,,20:46.0,21:31.0,0 days 00:00:45.022501,4,64,64,32,3,5,8,2,10,4,2,2,10,10,,,9,4,7,9,8,5,,,,,,,,,,,,,,,,,,,,,,,,,4,4,mixed,mixed,,,8,6,,,2,10,9,,,0.004363242,FAIL
487,,21:31.0,22:15.3,0 days 00:00:44.259593,4,64,32,32,3,5,8,2,10,4,2,2,10,10,,,9,4,7,2,6,5,,,,,,,,,,,,,,,,,,,,,,,,,4,4,mixed,mixed,,,8,6,,,2,10,9,,,0.004814502,FAIL
488,,22:15.3,22:59.5,0 days 00:00:44.216113,4,64,64,32,3,5,8,2,10,4,2,2,10,10,,,4,6,4,9,6,5,,,,,,,,,,,,,,,,,,,,,,,,,4,4,mixed,mixed,,,8,6,,,2,10,9,,,0.00442713,FAIL
489,230.6125946,22:59.5,23:39.9,0 days 00:00:40.334226,4,64,64,32,3,5,,,,,,,,,,,9,4,7,9,6,5,,,,,,,,,,,,,,,,,,,,,,,,,4,4,normal,mixed,,,,6,,,2,10,9,,,0.00432602,COMPLETE
490,,23:39.9,24:23.5,0 days 00:00:43.599886,4,8,32,32,3,5,8,2,10,4,2,2,10,10,,,9,6,7,6,5,5,4,8,,,,,,,,,,,,,,,,,,,,,,,4,4,mixed,mixed,,,8,8,,,2,10,8,,,0.004891192,FAIL
491,152.7086639,24:23.5,25:05.1,0 days 00:00:41.638488,4,8,32,32,3,5,,,,,,,,,,,9,6,7,6,8,5,4,8,,,,,,,,,,,,,,,,,,,,,,,4,4,normal,mixed,,,,8,,,2,10,8,,,0.004856925,COMPLETE
492,226.7546692,25:05.1,25:46.2,0 days 00:00:41.146901,4,64,96,64,3,5,,,,,,,,,,,10,5,8,10,7,3,3,,,,,,,,,,,,,,,,,,,,,,,,4,4,normal,mixed,,,,7,,,2,10,8,,,0.003630269,COMPLETE
493,,25:46.2,26:29.6,0 days 00:00:43.329415,4,64,32,8,3,5,8,2,10,4,2,2,10,10,,,9,2,7,6,,,,,,,,,,,,,,,,,,,,,,,,,,,4,4,mixed,mixed,,,8,4,,,2,10,7,,,0.004037991,FAIL
494,,26:29.6,27:14.2,0 days 00:00:44.596766,4,32,32,8,3,5,8,2,10,4,2,2,10,10,,,9,2,7,6,6,5,5,,,,,,,,,,,,,,,,,,,,,,,,4,4,mixed,mixed,,,8,7,,,2,10,8,,,0.0039117,FAIL
495,,27:14.2,27:57.4,0 days 00:00:43.268248,4,16,32,8,3,5,8,2,10,4,2,2,10,9,10,,9,2,7,6,6,5,5,,,,,,,,,,,,,,,,,,,,,,,,4,4,mixed,mixed,,,9,7,,,2,10,7,,,0.004361348,FAIL
496,,27:57.5,28:41.0,0 days 00:00:43.527761,4,16,32,8,3,5,8,2,10,4,2,2,3,10,,,9,6,4,2,6,5,5,,,,,,,,,,,,,,,,,,,,,,,,4,4,mixed,mixed,,,8,7,,,2,10,7,,,0.003363427,FAIL
497,,28:41.0,29:24.9,0 days 00:00:43.934744,4,16,32,8,3,5,8,2,10,4,2,2,10,10,,,4,2,7,6,6,5,5,,,,,,,,,,,,,,,,,,,,,,,,4,4,mixed,mixed,,,8,7,,,2,10,7,,,0.003944534,FAIL
498,,29:24.9,30:07.5,0 days 00:00:42.576774,4,64,32,8,3,5,8,2,10,4,2,2,10,10,,,9,2,7,2,,,,,,,,,,,,,,,,,,,,,,,,,,,4,4,mixed,mixed,,,8,4,,,2,10,7,,,0.003954789,FAIL
499,,30:07.5,30:51.6,0 days 00:00:44.088042,4,16,32,8,3,5,9,2,9,4,2,2,10,9,,,9,2,7,6,6,5,5,,,,,,,,,,,,,,,,,,,,,,,,4,4,mixed,mixed,,,8,7,,,2,10,7,,,0.003968939,FAIL
500,906.5282593,30:51.6,31:30.0,0 days 00:00:38.395004,4,16,32,8,3,5,,,,,,,,,,,9,2,7,6,,,,,,,,,,,,,,,,,,,,,,,,,,,4,4,normal,mixed,,,,4,,,2,10,7,,,0.000386618,COMPLETE
501,,31:30.0,32:14.9,0 days 00:00:44.900052,4,64,32,32,3,5,8,2,10,4,2,2,10,10,,,9,6,7,10,6,5,4,,,,,,,,,,,,,,,,,,,,,,,,4,4,mixed,mixed,,,8,7,,,2,10,8,,,0.003942128,FAIL
502,153.3347626,32:14.9,32:55.6,0 days 00:00:40.716829,4,32,32,32,3,5,,,,,,,,,,,9,6,7,10,6,5,5,,,,,,,,,,,,,,,,,,,,,,,,4,4,normal,mixed,,,,7,,,2,10,8,,,0.004019626,COMPLETE
503,152.7014313,32:55.6,33:35.7,0 days 00:00:40.079003,4,64,96,16,3,5,,,,,,,,,,,9,3,7,9,4,4,4,,,,,,,,,,,,,,,,,,,,,,,,4,4,normal,mixed,,,,7,,,2,9,8,,,0.003362966,COMPLETE
504,,33:35.7,34:20.3,0 days 00:00:44.641767,4,8,32,32,3,5,8,2,10,4,2,2,10,10,,,4,4,7,6,5,5,4,10,,,,,,,,,,,,,,,,,,,,,,,5,4,mixed,mixed,,,8,8,,,2,10,9,,,0.004664233,FAIL
505,374.4553833,34:20.3,35:00.7,0 days 00:00:40.310324,4,8,32,32,3,5,,,,,,,,,,,9,4,7,6,5,5,4,5,,,,,,,,,,,,,,,,,,,,,,,5,4,normal,mixed,,,,8,,,2,10,9,,,0.005036041,COMPLETE
506,,35:00.7,35:45.4,0 days 00:00:44.776009,4,64,32,96,3,5,8,2,10,5,2,2,10,10,,,9,3,6,6,5,4,6,,,,,,,,,,,,,,,,,,,,,,,,4,4,mixed,mixed,,,8,7,,,2,10,5,,,0.004364618,FAIL
507,,35:45.4,36:28.9,0 days 00:00:43.417683,4,64,32,32,3,5,8,2,10,4,2,2,10,10,,,9,3,6,6,5,4,6,,,,,,,,,,,,,,,,,,,,,,,,4,4,mixed,mixed,,,8,7,,,2,10,7,,,0.004453698,FAIL
508,,36:28.9,37:12.2,0 days 00:00:43.378800,4,64,32,96,3,5,8,2,10,4,2,2,3,10,10,,9,3,6,6,5,4,6,,,,,,,,,,,,,,,,,,,,,,,,4,4,mixed,mixed,,,9,7,,,2,10,7,,,0.004437329,FAIL
509,,37:12.2,37:55.3,0 days 00:00:43.021260,4,64,32,96,3,5,8,2,10,4,2,2,10,10,,,9,3,6,6,5,4,6,,,,,,,,,,,,,,,,,,,,,,,,4,4,mixed,mixed,,,8,7,,,2,10,7,,,0.004402099,FAIL
510,262.3300171,37:55.3,38:34.3,0 days 00:00:38.994980,4,64,32,96,3,5,,,,,,,,,,,9,3,4,6,5,4,6,,,,,,,,,,,,,,,,,,,,,,,,4,4,normal,mixed,,,,7,,,2,10,7,,,0.004457717,COMPLETE
511,,38:34.3,39:17.9,0 days 00:00:43.682483,4,64,32,32,3,5,8,2,10,4,2,10,10,10,,,4,6,8,7,6,5,4,,,,,,,,,,,,,,,,,,,,,,,,4,4,mixed,mixed,,,8,7,,,2,10,8,,,0.002816095,FAIL
512,,39:17.9,40:00.7,0 days 00:00:42.769768,4,64,32,32,3,5,2,2,10,4,2,2,10,10,,,7,6,8,7,6,5,4,,,,,,,,,,,,,,,,,,,,,,,,4,4,mixed,mixed,,,8,7,,,2,10,8,,,0.002798044,FAIL
513,156.6646118,40:00.7,40:40.1,0 days 00:00:39.330066,4,64,32,32,3,5,,,,,,,,,,,7,6,8,7,6,5,4,,,,,,,,,,,,,,,,,,,,,,,,4,4,normal,mixed,,,,7,,,2,10,8,,,0.005356882,COMPLETE
514,,40:40.1,41:22.9,0 days 00:00:42.875777,4,96,96,16,3,5,8,2,10,4,2,2,10,10,,,4,6,5,9,6,3,,,,,,,,,,,,,,,,,,,,,,,,,4,4,mixed,mixed,,,8,6,,,2,10,9,,,0.002749592,FAIL
515,,41:22.9,42:06.6,0 days 00:00:43.691435,4,96,96,16,3,5,8,2,10,4,2,2,10,10,,,10,6,5,9,6,3,,,,,,,,,,,,,,,,,,,,,,,,,4,4,mixed,mixed,,,8,6,,,2,10,9,,,0.003088661,FAIL
516,,42:06.6,42:50.4,0 days 00:00:43.780090,4,96,96,16,3,5,8,2,10,4,2,2,10,10,,,10,6,6,9,6,3,,,,,,,,,,,,,,,,,,,,,,,,,4,4,mixed,mixed,,,8,6,,,2,10,9,,,0.002952152,FAIL
517,,42:50.4,43:34.2,0 days 00:00:43.827012,4,96,96,16,3,5,8,2,10,4,2,2,10,10,,,9,6,5,9,6,3,,,,,,,,,,,,,,,,,,,,,,,,,4,4,mixed,mixed,,,8,6,,,2,10,9,,,0.003004691,FAIL
518,136.4649658,43:34.2,44:13.9,0 days 00:00:39.625757,4,96,96,16,3,5,,,,,,,,,,,10,6,6,9,6,3,,,,,,,,,,,,,,,,,,,,,,,,,4,4,normal,mixed,,,,6,,,2,10,9,,,0.002721951,COMPLETE
519,,44:13.9,44:58.0,0 days 00:00:44.090692,4,64,32,32,3,5,8,2,10,4,2,2,10,10,10,,9,2,10,2,6,5,4,,,,,,,,,,,,,,,,,,,,,,,,4,4,mixed,mixed,,,9,7,,,2,10,8,,,0.002979726,FAIL
520,123.1779709,44:58.0,45:37.8,0 days 00:00:39.847424,4,64,32,32,3,5,,,,,,,,,,,9,2,10,10,6,5,4,,,,,,,,,,,,,,,,,,,,,,,,4,4,normal,mixed,,,,7,,,2,10,8,,,0.003099358,COMPLETE
521,,45:37.8,46:21.9,0 days 00:00:44.113122,4,8,32,32,3,5,8,2,10,4,2,2,10,10,,,9,3,10,10,4,5,5,,,,,,,,,,,,,,,,,,,,,,,,4,4,mixed,mixed,,,8,7,,,2,10,8,,,0.003092073,FAIL
522,,46:21.9,47:05.9,0 days 00:00:43.919803,4,8,8,32,3,5,8,2,10,4,2,2,10,10,,,9,3,10,10,4,5,5,,,,,,,,,,,,,,,,,,,,,,,,4,4,mixed,mixed,,,8,7,,,2,10,8,,,0.002518695,FAIL
523,,47:05.9,47:49.9,0 days 00:00:43.999407,4,8,8,32,3,5,8,2,10,4,2,2,10,10,,,9,3,10,10,4,5,5,,,,,,,,,,,,,,,,,,,,,,,,4,4,mixed,mixed,,,8,7,,,2,10,5,,,0.002986276,FAIL
524,,47:49.9,48:33.7,0 days 00:00:43.856110,4,8,32,32,3,5,8,2,10,4,2,2,10,10,,,9,3,10,10,4,5,5,,,,,,,,,,,,,,,,,,,,,,,,4,4,mixed,mixed,,,8,7,,,2,10,8,,,0.003044142,FAIL
525,,48:33.7,49:16.8,0 days 00:00:43.038482,4,8,32,32,3,5,8,2,10,5,3,2,10,10,,,2,3,10,10,4,5,5,,,,,,,,,,,,,,,,,,,,,,,,4,4,mixed,mixed,,,8,7,,,2,10,5,,,0.003074098,FAIL
526,194.1522675,49:16.8,49:56.3,0 days 00:00:39.496720,4,8,8,32,3,5,,,,,,,,,,,9,3,10,10,4,5,5,,,,,,,,,,,,,,,,,,,,,,,,4,4,normal,mixed,,,,7,,,2,10,5,,,0.003097262,COMPLETE
527,,49:56.3,50:39.9,0 days 00:00:43.619588,4,96,32,64,3,5,8,6,10,4,2,2,10,10,,,4,2,10,10,7,5,4,,,,,,,,,,,,,,,,,,,,,,,,4,4,mixed,mixed,,,8,7,,,2,10,8,,,0.002893771,FAIL
528,,50:39.9,51:23.8,0 days 00:00:43.943150,4,96,32,64,3,5,8,2,10,4,2,2,10,10,,,9,2,10,10,7,5,4,,,,,,,,,,,,,,,,,,,,,,,,4,4,mixed,mixed,,,8,7,,,2,10,8,,,0.002823928,FAIL
529,,51:23.8,52:07.9,0 days 00:00:44.045870,4,96,32,64,3,5,8,6,10,4,2,2,10,10,,,9,2,10,10,7,5,4,,,,,,,,,,,,,,,,,,,,,,,,4,4,mixed,mixed,,,8,7,,,2,10,8,,,0.00249965,FAIL
530,,52:07.9,52:52.0,0 days 00:00:44.130464,4,96,32,64,3,5,9,2,10,4,2,2,10,10,,,9,2,10,10,7,5,4,,,,,,,,,,,,,,,,,,,,,,,,4,4,mixed,mixed,,,8,7,,,2,10,8,,,0.002520286,FAIL
531,,52:52.0,53:35.7,0 days 00:00:43.723968,4,96,32,64,3,5,8,2,10,5,2,2,10,10,,,2,2,10,10,7,5,4,,,,,,,,,,,,,,,,,,,,,,,,4,4,mixed,mixed,,,8,7,,,2,10,8,,,0.002552317,FAIL
532,,53:35.7,54:19.5,0 days 00:00:43.703613,4,96,32,64,3,5,8,2,10,4,2,2,10,10,,,2,2,10,10,6,5,4,,,,,,,,,,,,,,,,,,,,,,,,4,4,mixed,mixed,,,8,7,,,2,10,8,,,0.002443959,FAIL
533,,54:19.5,55:03.7,0 days 00:00:44.209977,4,96,32,64,3,5,8,2,10,4,2,2,10,10,,,9,2,10,10,7,5,4,,,,,,,,,,,,,,,,,,,,,,,,4,4,mixed,mixed,,,8,7,,,2,10,8,,,0.00254266,FAIL
534,,55:03.7,55:47.8,0 days 00:00:44.096016,4,96,32,64,3,5,8,2,10,4,2,2,10,10,,,9,2,10,10,6,5,4,,,,,,,,,,,,,,,,,,,,,,,,4,4,mixed,mixed,,,8,7,,,2,10,8,,,0.002509259,FAIL
535,,55:47.8,56:32.1,0 days 00:00:44.324912,4,96,32,64,3,5,8,2,9,5,2,2,10,10,,,9,2,10,10,7,5,4,,,,,,,,,,,,,,,,,,,,,,,,4,4,mixed,mixed,,,8,7,,,2,10,8,,,0.002861754,FAIL
536,,56:32.1,57:16.2,0 days 00:00:44.068077,4,96,32,64,3,5,8,2,10,4,2,2,10,10,,,9,2,9,10,7,5,4,,,,,,,,,,,,,,,,,,,,,,,,4,4,mixed,mixed,,,8,7,,,2,10,8,,,0.002214363,FAIL
537,164.3672485,57:16.2,57:56.3,0 days 00:00:40.120481,4,96,32,64,3,5,,,,,,,,,,,9,2,10,10,7,5,4,,,,,,,,,,,,,,,,,,,,,,,,4,4,normal,mixed,,,,7,,,2,10,8,,,0.002572229,COMPLETE
538,229.4632874,57:56.3,58:37.0,0 days 00:00:40.740477,4,64,96,16,3,5,,,,,,,,,,,10,6,10,10,6,2,4,7,,,,,,,,,,,,,,,,,,,,,,,4,4,normal,mixed,,,,8,,,2,10,8,,,0.002901855,COMPLETE
539,,58:37.0,59:21.4,0 days 00:00:44.357535,4,96,32,32,3,5,8,2,10,4,2,2,10,10,,,4,7,10,10,6,5,6,,,,,,,,,,,,,,,,,,,,,,,,4,4,mixed,mixed,,,8,7,,,2,9,8,,,0.003419493,FAIL
540,,59:21.4,00:06.3,0 days 00:00:44.941057,4,96,32,32,3,5,8,6,10,4,3,2,10,10,,,9,7,10,10,6,5,6,,,,,,,,,,,,,,,,,,,,,,,,4,4,mixed,mixed,,,8,7,,,2,9,8,,,0.002281862,FAIL
541,,00:06.3,00:50.9,0 days 00:00:44.563681,4,96,32,32,3,5,8,2,10,4,2,2,10,10,,,9,7,10,10,6,5,6,,,,,,,,,,,,,,,,,,,,,,,,4,4,mixed,mixed,,,8,7,,,2,10,8,,,0.002276794,FAIL
542,,00:50.9,01:35.4,0 days 00:00:44.523021,4,96,32,32,3,5,8,2,10,4,2,2,10,10,,,9,7,10,10,6,5,6,,,,,,,,,,,,,,,,,,,,,,,,4,4,mixed,mixed,,,8,7,,,2,9,8,,,0.002333747,FAIL
543,,01:35.4,02:20.2,0 days 00:00:44.782832,4,96,32,32,3,5,8,2,10,4,2,2,10,10,,,9,7,10,10,6,5,6,,,,,,,,,,,,,,,,,,,,,,,,4,4,mixed,mixed,,,8,7,,,2,9,8,,,0.002263713,FAIL
544,,02:20.2,03:03.5,0 days 00:00:43.275765,4,96,32,32,3,5,8,2,10,4,2,2,10,10,10,,9,7,10,10,6,5,6,,,,,,,,,,,,,,,,,,,,,,,,4,4,mixed,mixed,,,9,7,,,2,10,8,,,0.004698863,FAIL
545,275.51828,03:03.5,03:42.7,0 days 00:00:39.240587,4,96,32,32,3,5,,,,,,,,,,,2,4,10,10,6,5,6,,,,,,,,,,,,,,,,,,,,,,,,4,4,normal,mixed,,,,7,,,2,9,8,,,0.002290887,COMPLETE
546,,03:42.7,04:26.1,0 days 00:00:43.364682,4,128,32,32,3,5,8,2,10,4,2,2,10,10,,,9,5,10,10,5,,,,,,,,,,,,,,,,,,,,,,,,,,4,4,mixed,mixed,,,8,5,,,2,10,8,,,0.003288154,FAIL
547,,04:26.1,05:09.3,0 days 00:00:43.218431,4,128,32,32,3,5,8,2,10,4,2,2,10,10,,,9,5,10,10,5,,,,,,,,,,,,,,,,,,,,,,,,,,4,4,mixed,mixed,,,8,5,,,2,10,8,,,0.003424976,FAIL
548,,05:09.3,05:52.6,0 days 00:00:43.287211,4,128,32,32,3,5,8,2,9,4,2,2,10,10,,,9,5,9,10,5,,,,,,,,,,,,,,,,,,,,,,,,,,4,4,mixed,mixed,,,8,5,,,2,10,8,,,0.003458723,FAIL
549,179.3603058,05:52.6,06:32.7,0 days 00:00:40.094838,4,128,32,32,3,5,,,,,,,,,,,9,5,10,10,5,3,4,,,,,,,,,,,,,,,,,,,,,,,,4,4,normal,mixed,,,,7,,,2,10,8,,,0.003476224,COMPLETE
550,153.7570038,06:32.7,07:13.0,0 days 00:00:40.314579,4,64,96,128,3,5,,,,,,,,,,,9,7,9,9,6,4,,,,,,,,,,,,,,,,,,,,,,,,,4,4,normal,mixed,,,,6,,,2,10,8,,,0.004780155,COMPLETE
551,,07:13.0,07:57.0,0 days 00:00:43.911387,4,96,32,32,3,5,8,2,10,4,2,2,10,10,,,9,6,7,8,4,5,5,,,,,,,,,,,,,,,,,,,,,,,,4,4,mixed,mixed,,,8,7,,,2,10,9,,,0.003190904,FAIL
552,,07:57.0,08:40.9,0 days 00:00:43.949439,4,96,32,32,3,5,8,2,10,4,2,2,10,10,,,9,6,7,8,4,5,5,,,,,,,,,,,,,,,,,,,,,,,,4,4,mixed,mixed,,,8,7,,,2,10,9,,,0.002976956,FAIL
553,301.9449158,08:40.9,09:20.2,0 days 00:00:39.256576,4,96,32,32,3,5,,,,,,,,,,,9,6,7,2,4,5,5,,,,,,,,,,,,,,,,,,,,,,,,4,4,normal,mixed,,,,7,,,2,10,9,,,0.003026896,COMPLETE
554,,09:20.2,10:03.4,0 days 00:00:43.182218,4,96,32,16,3,5,8,2,10,4,2,2,10,10,,,3,3,10,10,7,,,,,,,,,,,,,,,,,,,,,,,,,,4,4,mixed,mixed,,,8,5,,,2,10,8,,,0.006546358,FAIL
555,,10:03.4,10:46.8,0 days 00:00:43.400663,4,96,32,16,3,5,8,6,10,4,2,2,10,10,,,4,3,10,10,7,,,,,,,,,,,,,,,,,,,,,,,,,,5,4,mixed,mixed,,,8,5,,,2,10,8,,,0.006402263,FAIL
556,,10:46.8,11:30.3,0 days 00:00:43.489681,4,96,32,16,3,5,8,2,10,4,2,2,10,10,,,9,3,10,10,7,,,,,,,,,,,,,,,,,,,,,,,,,,4,4,mixed,mixed,,,8,5,,,2,10,8,,,0.006327358,FAIL
557,,11:30.3,12:13.7,0 days 00:00:43.435952,4,96,32,16,3,5,8,2,10,4,2,2,10,10,,,3,3,10,10,7,3,2,,,,,,,,,,,,,,,,,,,,,,,,4,4,mixed,mixed,,,8,7,,,2,10,8,,,0.005495572,FAIL
558,,12:13.7,12:57.4,0 days 00:00:43.679831,4,96,32,16,3,5,8,2,10,4,2,2,10,10,,,4,3,10,10,7,3,2,,,,,,,,,,,,,,,,,,,,,,,,5,4,mixed,mixed,,,8,7,,,2,10,8,,,0.005392321,FAIL
559,197.5636749,12:57.4,13:37.2,0 days 00:00:39.779674,4,96,32,16,3,5,,,,,,,,,,,9,3,10,10,7,3,2,,,,,,,,,,,,,,,,,,,,,,,,4,4,normal,mixed,,,,7,,,2,10,8,,,0.005168245,COMPLETE
560,,13:37.2,14:20.8,0 days 00:00:43.588708,4,64,96,32,3,5,8,2,10,4,2,2,10,10,,,9,7,7,10,6,,,,,,,,,,,,,,,,,,,,,,,,,,5,4,mixed,mixed,,,8,5,,,2,10,8,,,0.006479209,FAIL
561,328.5114441,14:20.8,15:00.2,0 days 00:00:39.413023,4,64,96,32,3,5,,,,,,,,,,,9,7,7,10,6,,,,,,,,,,,,,,,,,,,,,,,,,,5,4,normal,mixed,,,,5,,,2,10,8,,,0.006593318,COMPLETE
562,,15:00.2,15:44.2,0 days 00:00:44.058111,4,8,32,128,3,5,8,2,10,4,2,2,10,10,,,9,3,7,8,5,5,4,,,,,,,,,,,,,,,,,,,,,,,,4,4,mixed,mixed,,,8,7,,,2,10,8,,,0.004215855,FAIL
563,,15:44.2,16:28.1,0 days 00:00:43.849937,4,8,32,128,3,5,8,2,10,4,2,2,10,10,,,9,3,7,8,5,5,4,,,,,,,,,,,,,,,,,,,,,,,,4,4,mixed,mixed,,,8,7,,,2,10,8,,,0.003308415,FAIL
564,,16:28.1,17:12.3,0 days 00:00:44.163001,4,8,32,128,3,5,8,6,10,4,3,2,10,10,,,9,3,7,8,5,5,4,,,,,,,,,,,,,,,,,,,,,,,,4,4,mixed,mixed,,,8,7,,,2,10,8,,,0.004342004,FAIL
565,,17:12.3,17:56.0,0 days 00:00:43.790867,4,8,32,128,3,5,8,2,10,4,2,2,10,10,,,4,3,7,8,5,5,4,,,,,,,,,,,,,,,,,,,,,,,,4,4,mixed,mixed,,,8,7,,,2,10,8,,,0.004237301,FAIL
566,,17:56.1,18:40.8,0 days 00:00:44.779820,4,8,32,128,3,5,8,2,10,4,2,2,10,10,10,,9,3,7,8,5,5,4,,,,,,,,,,,,,,,,,,,,,,,,4,4,mixed,mixed,,,9,7,,,2,10,8,,,0.004321833,FAIL
567,,18:40.8,19:24.3,0 days 00:00:43.483416,4,8,32,128,3,5,8,2,10,4,2,2,10,10,,,3,3,7,8,5,5,4,,,,,,,,,,,,,,,,,,,,,,,,4,4,mixed,mixed,,,8,7,,,2,10,8,,,0.004401051,FAIL
568,257.2905884,19:24.3,20:04.1,0 days 00:00:39.736456,4,8,32,128,3,5,,,,,,,,,,,9,3,7,8,5,5,4,,,,,,,,,,,,,,,,,,,,,,,,4,4,normal,mixed,,,,7,,,2,10,8,,,0.004454965,COMPLETE
569,,20:04.1,20:47.8,0 days 00:00:43.718201,4,96,32,32,3,5,8,2,10,4,2,2,10,10,,,10,2,5,10,6,5,,,,,,,,,,,,,,,,,,,,,,,,,4,4,mixed,mixed,,,8,6,,,2,10,7,,,0.003346694,FAIL
570,,20:47.8,21:31.4,0 days 00:00:43.597547,4,96,32,32,3,5,8,2,10,4,2,2,10,10,,,10,2,5,10,6,5,,,,,,,,,,,,,,,,,,,,,,,,,4,4,mixed,mixed,,,8,6,,,2,10,7,,,0.003263349,FAIL
571,,21:31.4,22:15.8,0 days 00:00:44.444881,4,96,32,32,3,5,8,2,10,4,2,10,10,10,,,10,2,8,10,6,5,,,,,,,,,,,,,,,,,,,,,,,,,4,4,mixed,mixed,,,8,6,,,2,10,7,,,0.003290822,FAIL
572,,22:15.8,22:59.4,0 days 00:00:43.576770,4,96,32,32,3,5,8,2,10,4,2,2,10,10,,,10,2,5,10,6,5,,,,,,,,,,,,,,,,,,,,,,,,,4,4,mixed,mixed,,,8,6,,,2,10,7,,,0.003295614,FAIL
573,130.1845093,22:59.4,23:38.7,0 days 00:00:39.234833,4,96,32,32,3,5,,,,,,,,,,,4,2,8,10,6,5,,,,,,,,,,,,,,,,,,,,,,,,,4,4,normal,mixed,,,,6,,,2,10,7,,,0.003372159,COMPLETE
574,,23:38.7,24:21.9,0 days 00:00:43.251769,4,96,32,16,3,5,8,2,10,4,2,2,10,10,,,6,2,8,10,4,5,,,,,,,,,,,,,,,,,,,,,,,,,4,4,mixed,mixed,,,8,6,,,2,10,7,,,0.003462268,FAIL
575,,24:21.9,25:03.9,0 days 00:00:42.003152,4,96,32,16,3,5,8,2,10,4,2,2,10,10,,,4,2,8,10,4,5,,,,,,,,,,,,,,,,,,,,,,,,,4,4,mixed,mixed,,,8,6,,,2,10,7,,,0.003324179,FAIL
576,,25:03.9,25:46.1,0 days 00:00:42.173058,4,96,32,16,3,5,8,2,10,4,2,2,10,10,,,10,2,8,10,4,5,,,,,,,,,,,,,,,,,,,,,,,,,4,4,mixed,mixed,,,8,6,,,2,10,7,,,0.003268622,FAIL
577,,25:46.1,26:29.1,0 days 00:00:43.047981,4,96,32,16,3,5,8,6,10,4,3,10,10,10,,,3,2,8,10,4,9,,,,,,,,,,,,,,,,,,,,,,,,,4,4,mixed,mixed,,,8,6,,,2,10,7,,,0.003243289,FAIL
578,253.3296356,26:29.1,27:07.1,0 days 00:00:37.932263,4,96,32,16,3,5,,,,,,,,,,,5,2,8,10,4,5,,,,,,,,,,,,,,,,,,,,,,,,,4,4,normal,mixed,,,,6,,,2,10,7,,,0.003279659,COMPLETE
579,169.5809021,27:07.1,27:44.9,0 days 00:00:37.817008,4,96,96,64,3,5,,,,,,,,,,,6,2,8,10,5,2,,,,,,,,,,,,,,,,,,,,,,,,,4,4,normal,mixed,,,,6,,,2,10,7,,,0.002789676,COMPLETE
580,,27:44.9,28:26.7,0 days 00:00:41.750429,4,96,32,32,3,5,8,2,10,4,2,2,10,10,,,4,2,8,10,6,3,,,,,,,,,,,,,,,,,,,,,,,,,3,4,mixed,mixed,,,8,6,,,2,9,6,,,0.00353578,FAIL
581,,28:26.7,29:07.5,0 days 00:00:40.871108,4,96,32,32,3,5,8,2,10,4,2,2,2,9,,,4,2,8,10,6,,,,,,,,,,,,,,,,,,,,,,,,,,4,4,mixed,mixed,,,8,5,,,2,9,7,,,0.00364925,FAIL
582,,29:07.5,29:49.8,0 days 00:00:42.284093,4,96,32,32,3,5,8,2,10,4,2,2,10,10,,,10,2,10,10,6,3,,,,,,,,,,,,,,,,,,,,,,,,,3,4,mixed,mixed,,,8,6,,,2,9,7,,,0.003603173,FAIL
583,,29:49.8,30:32.1,0 days 00:00:42.235258,4,96,32,32,3,5,8,2,10,4,2,2,10,10,,,10,2,8,10,6,3,,,,,,,,,,,,,,,,,,,,,,,,,4,4,mixed,mixed,,,8,6,,,2,9,7,,,0.003556205,FAIL
584,,30:32.1,31:15.5,0 days 00:00:43.478773,4,96,32,32,3,5,8,2,10,4,2,10,10,9,,,10,2,8,10,6,3,,,,,,,,,,,,,,,,,,,,,,,,,4,4,mixed,mixed,,,8,6,,,2,9,6,,,0.003528414,FAIL
585,,31:15.5,31:57.8,0 days 00:00:42.251155,4,96,32,32,3,5,8,2,10,4,2,2,10,10,,,5,2,8,10,6,3,,,,,,,,,,,,,,,,,,,,,,,,,4,4,mixed,mixed,,,8,6,,,2,9,6,,,0.003699555,FAIL
586,,31:57.8,32:40.1,0 days 00:00:42.260144,4,96,32,32,3,5,8,2,10,4,2,10,10,10,,,3,2,8,10,6,3,,,,,,,,,,,,,,,,,,,,,,,,,3,4,mixed,mixed,,,8,6,,,2,9,6,,,0.003602375,FAIL
587,,32:40.1,33:21.8,0 days 00:00:41.739878,4,96,32,32,3,5,8,2,10,4,2,2,10,10,,,4,2,8,10,6,3,,,,,,,,,,,,,,,,,,,,,,,,,3,4,mixed,mixed,,,8,6,,,2,9,7,,,0.003532695,FAIL
588,,33:21.8,34:04.4,0 days 00:00:42.643562,4,96,32,32,3,5,8,6,10,4,2,2,10,10,,,10,2,8,10,6,3,,,,,,,,,,,,,,,,,,,,,,,,,4,4,mixed,mixed,,,8,6,,,2,9,6,,,0.003586266,FAIL
589,,34:04.5,34:46.0,0 days 00:00:41.590090,4,96,32,32,3,5,8,2,10,4,2,2,10,10,,,3,2,8,10,6,3,,,,,,,,,,,,,,,,,,,,,,,,,4,4,mixed,mixed,,,8,6,,,2,9,6,,,0.00365812,FAIL
590,,34:46.0,35:29.9,0 days 00:00:43.843625,4,96,32,32,3,5,9,6,10,4,2,2,10,10,10,,10,2,8,10,6,3,,,,,,,,,,,,,,,,,,,,,,,,,3,4,mixed,mixed,,,9,6,,,2,9,6,,,0.003772429,FAIL
591,,35:29.9,36:11.3,0 days 00:00:41.378253,4,96,32,32,3,5,8,2,10,4,2,2,3,10,,,3,2,8,10,6,3,,,,,,,,,,,,,,,,,,,,,,,,,3,4,mixed,mixed,,,8,6,,,2,9,7,,,0.003617505,FAIL
592,,36:11.3,36:53.7,0 days 00:00:42.448748,4,96,32,32,3,5,8,2,10,4,2,2,10,10,,,4,2,8,10,6,3,,,,,,,,,,,,,,,,,,,,,,,,,3,4,mixed,mixed,,,8,6,,,2,9,7,,,0.003410528,FAIL
593,188.9245148,36:53.7,37:32.2,0 days 00:00:38.444997,4,96,32,32,3,5,,,,,,,,,,,5,2,8,10,6,3,,,,,,,,,,,,,,,,,,,,,,,,,4,4,normal,mixed,,,,6,,,2,10,7,,,0.003665031,COMPLETE
594,,37:32.2,38:14.5,0 days 00:00:42.346525,4,96,128,32,3,5,8,2,10,4,2,2,3,10,,,4,2,8,9,6,5,,,,,,,,,,,,,,,,,,,,,,,,,4,4,mixed,mixed,,,8,6,,,2,9,6,,,0.003177393,FAIL
595,544.8598022,38:14.5,38:53.0,0 days 00:00:38.513171,4,96,32,32,3,5,,,,,,,,,,,10,2,8,9,6,,,,,,,,,,,,,,,,,,,,,,,,,,4,4,normal,mixed,,,,5,,,2,9,7,,,0.003250548,COMPLETE
596,138.1737823,38:53.0,39:32.0,0 days 00:00:38.993962,4,96,128,16,3,5,,,,,,,,,,,8,6,9,10,5,5,,,,,,,,,,,,,,,,,,,,,,,,,4,4,normal,mixed,,,,6,,,2,10,7,,,0.003855324,COMPLETE
597,,39:32.0,40:16.4,0 days 00:00:44.329951,4,96,96,128,3,5,8,2,10,4,2,2,10,9,,,3,2,10,9,7,5,8,10,,,,,,,,,,,,,,,,,,,,,,,4,4,mixed,mixed,,,8,8,,,2,10,9,,,0.00297994,FAIL
598,,40:16.4,41:00.1,0 days 00:00:43.752192,4,96,96,128,3,5,8,2,10,4,2,2,10,10,,,4,2,10,9,7,6,3,7,,,,,,,,,,,,,,,,,,,,,,,4,4,mixed,mixed,,,8,8,,,2,10,6,,,0.002449759,FAIL
