number,value,datetime_start,datetime_complete,duration,params_gat_heads,params_gat_hidden_0,params_gat_hidden_1,params_gat_hidden_2,params_gat_layers,params_gat_out,params_kan_arity_0_0,params_kan_arity_0_1,params_kan_arity_0_2,params_kan_arity_0_3,params_kan_arity_0_4,params_kan_arity_0_5,params_kan_arity_0_6,params_kan_arity_0_7,params_kan_arity_0_8,params_kan_arity_0_9,params_kan_arity_1_0,params_kan_arity_1_1,params_kan_arity_1_2,params_kan_arity_1_3,params_kan_arity_1_4,params_kan_arity_1_5,params_kan_arity_1_6,params_kan_arity_1_7,params_kan_arity_1_8,params_kan_arity_1_9,params_kan_arity_2_0,params_kan_arity_2_1,params_kan_arity_2_2,params_kan_arity_2_3,params_kan_arity_2_4,params_kan_arity_2_5,params_kan_arity_2_6,params_kan_arity_2_7,params_kan_arity_2_8,params_kan_arity_2_9,params_kan_arity_3_0,params_kan_arity_3_1,params_kan_arity_3_2,params_kan_arity_3_3,params_kan_arity_3_4,params_kan_arity_3_5,params_kan_arity_3_6,params_kan_arity_3_7,params_kan_arity_3_8,params_kan_arity_3_9,params_kan_grid,params_kan_k,params_kan_layer_type_0,params_kan_layer_type_1,params_kan_layer_type_2,params_kan_layer_type_3,params_kan_mult_nodes_0,params_kan_mult_nodes_1,params_kan_mult_nodes_2,params_kan_mult_nodes_3,params_kan_n_layers,params_kan_neurons_0,params_kan_neurons_1,params_kan_neurons_2,params_kan_neurons_3,params_lr,state
2642,,17:22.7,19:06.8,0 days 00:01:44.143499,3,16,96,,2,5,,,,,,,,,,,10,7,10,8,,,,,,,2,2,6,5,10,10,2,7,8,10,,,,,,,,,,,4,6,normal,mixed,mixed,,,4,10,,3,9,8,5,,0.006593565,FAIL
2643,,19:06.8,20:51.5,0 days 00:01:44.640413,3,96,96,,2,5,,,,,,,,,,,8,7,10,8,,,,,,,3,2,6,5,10,10,2,7,8,10,,,,,,,,,,,4,6,normal,mixed,mixed,,,4,10,,3,9,8,5,,0.008291843,FAIL
2644,,20:51.5,22:36.1,0 days 00:01:44.675963,3,96,96,,2,5,,,,,,,,,,,10,7,10,8,,,,,,,2,2,6,5,10,10,2,7,8,10,,,,,,,,,,,4,6,normal,mixed,mixed,,,4,10,,3,9,8,5,,0.008887421,FAIL
2645,,22:36.1,24:20.5,0 days 00:01:44.314575,3,96,96,,2,5,,,,,,,,,,,10,7,10,8,,,,,,,2,2,6,4,10,10,3,7,8,10,,,,,,,,,,,4,6,normal,mixed,mixed,,,4,10,,3,9,8,5,,0.006781168,FAIL
2646,,24:20.5,26:04.9,0 days 00:01:44.399879,3,96,96,,2,5,,,,,,,,,,,10,7,10,7,,,,,,,2,2,6,5,10,10,2,7,8,10,,,,,,,,,,,4,6,normal,mixed,mixed,,,4,10,,3,9,8,5,,0.008835541,FAIL
2647,,26:04.9,27:49.0,0 days 00:01:44.096298,3,96,96,,2,5,,,,,,,,,,,10,7,10,8,,,,,,,2,2,6,4,9,10,2,7,8,10,,,,,,,,,,,4,6,normal,mixed,mixed,,,4,10,,3,9,8,5,,0.002585877,FAIL
2648,,27:49.0,29:31.9,0 days 00:01:42.899078,3,96,96,,2,5,,,,,,,,,,,10,7,10,8,,,,,,,2,2,6,5,9,10,4,7,8,,,,,,,,,,,,4,6,normal,mixed,mixed,,,4,9,,3,9,8,5,,0.008465455,FAIL
2649,,29:31.9,31:13.9,0 days 00:01:42.058954,3,96,96,,2,5,,,,,,,,,,,10,7,10,8,,,,,,,2,2,6,5,10,10,2,7,8,10,,,,,,,,,,,4,6,normal,mixed,mixed,,,4,10,,3,9,8,5,,0.006768364,FAIL
2650,,31:13.9,32:55.5,0 days 00:01:41.611064,3,96,96,,2,5,,,,,,,,,,,10,7,10,8,,,,,,,2,2,6,5,8,10,2,7,8,10,,,,,,,,,,,4,6,normal,mixed,mixed,,,4,10,,3,9,8,5,,0.008924038,FAIL
2651,,32:55.5,34:37.6,0 days 00:01:42.105038,3,96,96,,2,5,,,,,,,,,,,10,7,10,8,,,,,,,2,2,6,5,10,10,2,7,8,10,,,,,,,,,,,4,6,normal,mixed,mixed,,,4,10,,3,9,8,5,,0.00853907,FAIL
2652,,34:37.6,36:19.9,0 days 00:01:42.272751,3,96,96,,2,5,,,,,,,,,,,10,7,10,8,,,,,,,2,2,6,5,10,10,3,7,8,10,,,,,,,,,,,4,6,normal,mixed,mixed,,,4,10,,3,9,8,5,,0.006867974,FAIL
2653,,36:19.9,38:03.5,0 days 00:01:43.551923,3,96,96,,2,5,,,,,,,,,,,10,7,10,8,,,,,,,2,2,6,5,10,10,3,7,8,10,,,,,,,,,,,3,6,normal,mixed,mixed,,,4,10,,3,9,8,5,,0.006748633,FAIL
2654,,38:03.5,39:46.9,0 days 00:01:43.440071,3,96,96,,2,5,,,,,,,,,,,10,7,10,8,,,,,,,2,2,6,5,9,10,3,7,8,10,,,,,,,,,,,4,6,normal,mixed,mixed,,,4,10,,3,9,8,5,,0.006701513,FAIL
2655,,39:46.9,41:30.7,0 days 00:01:43.729807,3,96,96,,2,5,,,,,,,,,,,10,7,10,8,4,,,,,,2,2,6,5,10,10,2,7,8,10,,,,,,,,,,,4,6,normal,mixed,mixed,,,5,10,,3,9,8,5,,0.006695315,FAIL
2656,,41:30.7,43:13.5,0 days 00:01:42.864500,3,96,96,,2,5,,,,,,,,,,,10,7,10,8,,,,,,,2,2,6,5,10,10,2,7,8,10,,,,,,,,,,,4,6,normal,mixed,mixed,,,4,10,,3,9,8,5,,0.008959966,FAIL
2657,,43:13.5,44:55.1,0 days 00:01:41.532626,3,96,96,,2,5,,,,,,,,,,,10,7,10,8,,,,,,,2,2,6,5,10,10,2,7,8,10,,,,,,,,,,,4,6,normal,mixed,mixed,,,4,10,,3,9,8,5,,0.006781333,FAIL
2658,,44:55.1,46:36.2,0 days 00:01:41.153466,3,96,96,,2,5,,,,,,,,,,,10,7,10,8,,,,,,,2,2,6,5,9,10,2,7,8,10,,,,,,,,,,,4,6,normal,mixed,mixed,,,4,10,,3,9,8,5,,0.006935825,FAIL
2659,,46:36.2,48:19.1,0 days 00:01:42.868584,3,96,96,,2,5,,,,,,,,,,,10,8,10,8,,,,,,,2,2,6,5,10,10,2,7,8,10,,,,,,,,,,,4,6,normal,mixed,mixed,,,4,10,,3,9,8,5,,0.006575507,FAIL
2660,,48:19.1,50:02.6,0 days 00:01:43.527705,3,96,96,,2,5,,,,,,,,,,,10,7,10,8,,,,,,,2,2,6,5,10,10,2,7,8,10,,,,,,,,,,,4,6,normal,mixed,mixed,,,4,10,,3,9,8,5,,0.002647915,FAIL
2661,,50:02.6,51:46.1,0 days 00:01:43.512064,3,96,96,,2,5,,,,,,,,,,,10,7,10,8,,,,,,,2,2,6,5,9,10,2,8,8,9,,,,,,,,,,,4,6,normal,mixed,mixed,,,4,10,,3,9,8,5,,0.006781361,FAIL
2662,,51:46.1,53:27.1,0 days 00:01:40.982520,3,96,96,,2,5,,,,,,,,,,,10,7,10,7,,,,,,,2,2,6,5,10,10,2,7,8,10,,,,,,,,,,,4,6,normal,mixed,mixed,,,4,10,,3,9,8,5,,0.009250038,FAIL
2663,,53:27.1,55:09.0,0 days 00:01:41.928783,3,96,96,,2,5,,,,,,,,,,,10,7,10,8,,,,,,,2,2,6,4,10,10,2,7,8,10,,,,,,,,,,,4,6,normal,mixed,mixed,,,4,10,,3,9,8,5,,0.008531173,FAIL
2664,,55:09.1,56:50.6,0 days 00:01:41.573562,3,96,96,,2,5,,,,,,,,,,,10,7,10,8,,,,,,,2,2,6,5,9,10,2,7,8,10,,,,,,,,,,,4,6,normal,mixed,mixed,,,4,10,,3,9,8,5,,0.008531989,FAIL
2665,,56:50.6,58:32.3,0 days 00:01:41.705675,3,96,96,,2,5,,,,,,,,,,,8,7,10,8,,,,,,,2,2,6,5,10,10,3,7,8,10,,,,,,,,,,,4,6,normal,mixed,mixed,,,4,10,,3,9,8,5,,0.006791329,FAIL
2666,,58:32.3,00:15.9,0 days 00:01:43.526336,3,96,96,,2,5,,,,,,,,,,,10,7,10,8,,,,,,,2,2,6,5,10,10,2,7,8,10,,,,,,,,,,,4,6,normal,mixed,mixed,,,4,10,,3,9,8,5,,0.006666195,FAIL
2667,,00:15.9,01:59.8,0 days 00:01:43.951502,3,96,96,,2,5,,,,,,,,,,,10,7,10,8,,,,,,,2,2,6,5,9,10,3,7,8,10,,,,,,,,,,,4,6,normal,mixed,mixed,,,4,10,,3,9,8,5,,0.008897871,FAIL
2668,,01:59.8,03:43.4,0 days 00:01:43.556761,3,96,96,,2,5,,,,,,,,,,,10,7,10,8,,,,,,,2,2,6,5,10,10,3,7,8,10,,,,,,,,,,,4,6,normal,mixed,mixed,,,4,10,,3,9,8,5,,0.006808344,FAIL
2669,,03:43.4,05:26.8,0 days 00:01:43.456637,3,96,96,,2,5,,,,,,,,,,,10,7,10,8,,,,,,,2,2,6,4,10,10,2,7,8,10,,,,,,,,,,,4,6,normal,mixed,mixed,,,4,10,,3,9,8,5,,0.00290078,FAIL
2670,,05:26.8,07:10.3,0 days 00:01:43.504207,3,96,96,,2,5,,,,,,,,,,,10,7,10,8,,,,,,,2,2,6,5,10,10,2,7,8,10,,,,,,,,,,,4,6,normal,mixed,mixed,,,4,10,,3,9,8,5,,0.006639084,FAIL
2671,,07:10.4,08:53.9,0 days 00:01:43.558795,3,96,96,,2,5,,,,,,,,,,,8,7,10,8,,,,,,,2,2,6,5,10,10,2,7,8,10,,,,,,,,,,,4,6,normal,mixed,mixed,,,4,10,,3,9,8,5,,0.008500811,FAIL
2672,,08:53.9,10:37.3,0 days 00:01:43.361489,3,96,96,,2,5,,,,,,,,,,,10,7,10,8,,,,,,,2,2,6,5,10,10,2,7,8,10,,,,,,,,,,,4,6,normal,mixed,mixed,,,4,10,,3,9,8,6,,0.006634304,FAIL
2673,,10:37.3,12:20.4,0 days 00:01:43.165787,3,96,96,,2,5,,,,,,,,,,,10,7,10,8,,,,,,,2,2,6,4,10,10,2,7,8,10,,,,,,,,,,,4,6,normal,mixed,mixed,,,4,10,,3,9,8,5,,0.006830927,FAIL
2674,,12:20.5,14:04.2,0 days 00:01:43.792062,3,96,96,,2,5,,,,,,,,,,,10,7,10,8,,,,,,,2,2,6,5,10,10,3,7,8,10,,,,,,,,,,,4,6,normal,mixed,mixed,,,4,10,,3,9,8,5,,0.002627656,FAIL
2675,,14:04.2,15:47.8,0 days 00:01:43.523930,3,96,96,,2,5,,,,,,,,,,,10,7,10,8,,,,,,,2,2,6,5,9,10,2,7,8,10,,,,,,,,,,,4,6,normal,mixed,mixed,,,4,10,,3,9,8,5,,0.008428974,FAIL
2676,,15:47.8,17:30.8,0 days 00:01:42.980895,3,96,96,,2,5,,,,,,,,,,,10,7,10,8,,,,,,,2,2,6,5,9,10,2,7,8,10,,,,,,,,,,,4,6,normal,mixed,mixed,,,4,10,,3,9,8,5,,0.006899866,FAIL
2677,,17:30.8,19:14.3,0 days 00:01:43.505345,3,96,96,,2,5,,,,,,,,,,,10,7,10,8,,,,,,,2,2,6,5,10,10,3,7,8,10,,,,,,,,,,,4,6,normal,mixed,mixed,,,4,10,,3,9,8,5,,0.009063018,FAIL
2678,,19:14.3,20:57.4,0 days 00:01:43.111317,3,96,96,,2,5,,,,,,,,,,,10,7,10,8,,,,,,,2,2,6,5,9,10,2,7,8,10,,,,,,,,,,,4,6,normal,mixed,mixed,,,4,10,,3,9,8,5,,0.008850175,FAIL
2679,,20:57.4,22:39.1,0 days 00:01:41.665578,3,96,96,,2,5,,,,,,,,,,,10,7,10,8,,,,,,,2,2,6,5,9,10,2,7,9,10,,,,,,,,,,,4,6,normal,mixed,mixed,,,4,10,,3,9,8,5,,0.009122689,FAIL
2680,,22:39.1,24:21.0,0 days 00:01:41.990764,3,96,96,,2,5,,,,,,,,,,,10,7,10,8,,,,,,,2,2,6,5,10,10,2,7,8,10,,,,,,,,,,,4,6,normal,mixed,mixed,,,4,10,,3,9,8,5,,0.008647862,FAIL
2681,,24:21.0,26:02.7,0 days 00:01:41.698003,3,96,96,,2,5,,,,,,,,,,,10,7,10,8,,,,,,,2,2,6,5,10,10,2,7,8,10,,,,,,,,,,,4,6,normal,mixed,mixed,,,4,10,,3,9,8,5,,0.006800149,FAIL
2682,,26:02.7,27:44.1,0 days 00:01:41.327651,3,96,96,,2,5,,,,,,,,,,,10,7,10,8,,,,,,,3,2,6,5,10,9,2,7,8,10,,,,,,,,,,,4,6,normal,mixed,mixed,,,4,10,,3,9,8,5,,0.006904913,FAIL
2683,,27:44.1,29:25.5,0 days 00:01:41.447649,3,16,96,,2,5,,,,,,,,,,,10,7,10,8,,,,,,,2,2,6,5,10,10,2,7,8,10,,,,,,,,,,,4,6,normal,mixed,mixed,,,4,10,,3,9,8,5,,0.006649663,FAIL
2684,,29:25.5,31:07.6,0 days 00:01:42.047811,3,96,96,,2,5,,,,,,,,,,,10,8,10,8,,,,,,,2,2,6,5,10,10,3,7,8,10,,,,,,,,,,,4,6,normal,mixed,mixed,,,4,10,,3,9,8,5,,0.006700708,FAIL
2685,,31:07.6,32:48.7,0 days 00:01:41.152734,3,96,96,,2,5,,,,,,,,,,,10,7,10,8,,,,,,,2,2,6,5,10,10,2,7,8,10,,,,,,,,,,,4,6,normal,mixed,mixed,,,4,10,,3,9,8,5,,0.006691403,FAIL
2686,,32:48.7,34:29.2,0 days 00:01:40.489490,3,96,96,,2,5,,,,,,,,,,,10,7,10,8,,,,,,,2,2,6,5,10,10,2,7,8,,,,,,,,,,,,4,6,normal,mixed,mixed,,,4,9,,3,8,8,5,,0.00891575,FAIL
2687,,34:29.2,36:12.5,0 days 00:01:43.303931,3,96,96,,2,5,,,,,,,,,,,10,7,10,8,,,,,,,2,2,6,5,10,10,2,7,8,10,,,,,,,,,,,4,6,normal,mixed,mixed,,,4,10,,3,9,8,5,,0.006918084,FAIL
2688,,36:12.5,37:55.2,0 days 00:01:42.627451,3,96,96,,2,5,,,,,,,,,,,8,7,9,8,,,,,,,3,2,6,5,10,10,3,7,8,10,,,,,,,,,,,4,6,normal,mixed,mixed,,,4,10,,3,9,8,5,,0.008880033,FAIL
2689,,37:55.2,39:36.7,0 days 00:01:41.496160,3,96,96,,2,5,,,,,,,,,,,10,7,10,8,,,,,,,2,2,6,5,10,10,2,7,8,10,,,,,,,,,,,4,6,normal,mixed,mixed,,,4,10,,3,9,8,5,,0.006994156,FAIL
2690,,39:36.7,41:18.5,0 days 00:01:41.808454,3,96,96,,2,5,,,,,,,,,,,10,7,10,8,,,,,,,2,2,6,5,9,10,2,7,8,10,,,,,,,,,,,4,6,normal,mixed,mixed,,,4,10,,3,9,8,5,,0.006544345,FAIL
2691,,41:18.5,43:00.0,0 days 00:01:41.488320,3,96,96,,2,5,,,,,,,,,,,10,7,10,8,,,,,,,2,2,6,5,10,10,3,7,9,10,,,,,,,,,,,4,6,normal,mixed,mixed,,,4,10,,3,9,8,5,,0.002591971,FAIL
2692,,43:00.0,44:41.3,0 days 00:01:41.285885,3,96,96,,2,5,,,,,,,,,,,10,7,10,8,,,,,,,2,2,6,5,10,9,2,7,9,10,,,,,,,,,,,4,6,normal,mixed,mixed,,,4,10,,3,9,8,5,,0.006682024,FAIL
2693,,44:41.3,46:23.8,0 days 00:01:42.550423,3,96,96,,2,5,,,,,,,,,,,10,7,10,8,,,,,,,2,2,6,5,10,10,2,7,8,10,,,,,,,,,,,4,6,normal,mixed,mixed,,,4,10,,3,9,8,6,,0.008833041,FAIL
2694,,46:23.8,48:07.8,0 days 00:01:44.018635,3,96,96,,2,5,,,,,,,,,,,10,7,10,8,,,,,,,3,2,6,5,9,10,3,8,8,10,,,,,,,,,,,4,6,normal,mixed,mixed,,,4,10,,3,9,8,5,,0.007118012,FAIL
2695,,48:07.8,49:51.7,0 days 00:01:43.867342,3,96,96,,2,5,,,,,,,,,,,10,7,10,8,,,,,,,2,2,6,5,10,10,3,7,8,10,,,,,,,,,,,4,6,normal,mixed,mixed,,,4,10,,3,9,8,5,,0.006991462,FAIL
2696,,49:51.7,51:35.0,0 days 00:01:43.296403,3,96,96,,2,5,,,,,,,,,,,10,7,10,8,,,,,,,2,2,6,5,10,10,3,7,8,9,,,,,,,,,,,3,6,normal,mixed,mixed,,,4,10,,3,9,8,5,,0.006711015,FAIL
2697,,51:35.0,53:17.8,0 days 00:01:42.825481,3,96,96,,2,5,,,,,,,,,,,10,7,10,8,,,,,,,2,2,6,5,10,10,2,7,8,10,,,,,,,,,,,4,6,normal,mixed,mixed,,,4,10,,3,9,8,5,,0.002612001,FAIL
2698,,53:17.8,54:59.5,0 days 00:01:41.635386,3,96,96,,2,5,,,,,,,,,,,10,7,10,8,,,,,,,2,2,6,5,10,10,2,7,8,10,,,,,,,,,,,4,6,normal,mixed,mixed,,,4,10,,3,9,8,5,,0.008742582,FAIL
2699,,54:59.5,56:43.1,0 days 00:01:43.664643,3,96,96,,2,5,,,,,,,,,,,10,7,10,8,,,,,,,2,2,6,5,10,10,2,7,9,10,,,,,,,,,,,4,6,normal,mixed,mixed,,,4,10,,3,9,8,5,,0.006783615,FAIL
2700,,56:43.1,58:26.0,0 days 00:01:42.807799,3,96,96,,2,5,,,,,,,,,,,10,7,10,8,,,,,,,2,2,6,5,10,9,2,7,8,10,,,,,,,,,,,4,6,normal,mixed,mixed,,,4,10,,3,9,8,5,,0.009098867,FAIL
2701,,58:26.0,00:09.6,0 days 00:01:43.664716,3,96,96,,2,5,,,,,,,,,,,10,7,10,8,,,,,,,2,2,6,5,10,10,2,7,8,10,,,,,,,,,,,4,6,normal,mixed,mixed,,,4,10,,3,9,8,5,,0.002615144,FAIL
2702,,00:09.6,01:53.2,0 days 00:01:43.556657,3,96,96,,2,5,,,,,,,,,,,10,7,9,8,,,,,,,2,2,6,5,10,10,2,7,8,10,,,,,,,,,,,4,6,normal,mixed,mixed,,,4,10,,3,9,8,5,,0.00686861,FAIL
2703,,01:53.2,03:37.2,0 days 00:01:44.040236,3,96,96,,2,5,,,,,,,,,,,10,8,10,8,,,,,,,2,2,6,5,10,9,2,7,8,10,,,,,,,,,,,4,6,normal,mixed,mixed,,,4,10,,3,9,8,5,,0.006754987,FAIL
2704,,03:37.2,05:21.8,0 days 00:01:44.545008,3,96,96,,2,5,,,,,,,,,,,10,7,10,8,4,,,,,,2,2,6,5,10,10,3,8,8,10,,,,,,,,,,,4,6,normal,mixed,mixed,,,5,10,,3,9,8,6,,0.002637308,FAIL
2705,,05:21.8,07:05.1,0 days 00:01:43.283173,3,96,96,,2,5,,,,,,,,,,,10,7,10,8,,,,,,,2,2,6,5,10,10,2,7,8,10,,,,,,,,,,,4,6,normal,mixed,mixed,,,4,10,,3,9,8,5,,0.006995792,FAIL
2706,,07:05.1,08:48.8,0 days 00:01:43.696457,3,96,96,,2,5,,,,,,,,,,,10,7,10,8,,,,,,,2,2,6,5,10,10,3,7,8,10,,,,,,,,,,,4,6,normal,mixed,mixed,,,4,10,,3,9,8,5,,0.006610112,FAIL
2707,,08:48.8,10:32.1,0 days 00:01:43.289608,3,96,96,,2,5,,,,,,,,,,,10,7,10,8,,,,,,,2,2,5,5,10,10,2,7,8,10,,,,,,,,,,,4,6,normal,mixed,mixed,,,4,10,,3,9,8,5,,0.009207024,FAIL
2708,,10:32.1,12:15.7,0 days 00:01:43.667818,3,96,96,,2,5,,,,,,,,,,,10,7,10,8,,,,,,,2,2,6,5,10,10,2,7,8,10,,,,,,,,,,,4,6,normal,mixed,mixed,,,4,10,,3,9,8,5,,0.006758516,FAIL
2709,,12:15.7,13:59.1,0 days 00:01:43.370915,3,96,96,,2,5,,,,,,,,,,,10,7,10,8,,,,,,,2,2,6,4,10,10,2,7,8,10,,,,,,,,,,,4,6,normal,mixed,mixed,,,4,10,,3,9,8,5,,0.008809658,FAIL
2710,,13:59.1,15:42.6,0 days 00:01:43.509816,3,96,96,,2,5,,,,,,,,,,,10,7,10,8,,,,,,,2,2,6,5,10,10,2,7,8,10,,,,,,,,,,,4,6,normal,mixed,mixed,,,4,10,,3,9,8,5,,0.009024346,FAIL
2711,,15:42.6,17:25.9,0 days 00:01:43.249414,3,96,96,,2,5,,,,,,,,,,,10,7,10,8,,,,,,,2,2,6,5,10,10,2,7,8,10,,,,,,,,,,,4,6,normal,mixed,mixed,,,4,10,,3,9,8,5,,0.00833833,FAIL
2712,,17:25.9,19:09.6,0 days 00:01:43.726561,3,96,96,,2,5,,,,,,,,,,,10,7,10,8,,,,,,,2,2,6,5,10,10,2,7,8,10,,,,,,,,,,,4,6,normal,mixed,mixed,,,4,10,,3,9,8,5,,0.002654662,FAIL
2713,,19:09.6,20:53.5,0 days 00:01:43.911729,3,96,96,,2,5,,,,,,,,,,,10,7,10,7,,,,,,,2,2,6,5,10,10,2,7,8,10,,,,,,,,,,,4,6,normal,mixed,mixed,,,4,10,,3,9,8,5,,0.008894386,FAIL
2714,,20:53.5,22:36.9,0 days 00:01:43.347675,3,96,96,,2,5,,,,,,,,,,,10,7,10,8,,,,,,,2,2,6,5,10,10,2,7,8,10,,,,,,,,,,,4,6,normal,mixed,mixed,,,4,10,,3,9,8,5,,0.006877494,FAIL
2715,,22:36.9,24:20.5,0 days 00:01:43.648163,3,96,96,,2,5,,,,,,,,,,,10,7,10,8,,,,,,,2,2,6,5,9,10,2,7,8,10,,,,,,,,,,,4,6,normal,mixed,mixed,,,4,10,,3,9,8,5,,0.002658462,FAIL
2716,,24:20.5,26:04.8,0 days 00:01:44.253460,3,96,96,,2,5,,,,,,,,,,,10,7,10,8,,,,,,,2,2,6,5,10,10,3,7,8,10,,,,,,,,,,,4,6,normal,mixed,mixed,,,4,10,,3,9,8,5,,0.00675675,FAIL
2717,,26:04.8,27:48.5,0 days 00:01:43.710449,3,96,96,,2,5,,,,,,,,,,,10,7,10,8,,,,,,,2,2,6,5,10,10,2,7,8,10,,,,,,,,,,,4,6,normal,mixed,mixed,,,4,10,,3,9,8,5,,0.008697112,FAIL
2718,,27:48.5,29:31.8,0 days 00:01:43.289822,3,96,96,,2,5,,,,,,,,,,,10,7,10,8,,,,,,,2,2,6,5,9,10,2,7,8,10,,,,,,,,,,,4,6,normal,mixed,mixed,,,4,10,,3,9,10,5,,0.008596358,FAIL
2719,,29:31.8,31:15.6,0 days 00:01:43.778719,3,96,96,,2,5,,,,,,,,,,,10,7,10,8,,,,,,,2,2,6,5,9,10,2,7,8,10,,,,,,,,,,,4,6,normal,mixed,mixed,,,4,10,,3,9,8,5,,0.009002109,FAIL
2720,,31:15.6,32:59.6,0 days 00:01:44.051357,3,96,96,,2,5,,,,,,,,,,,10,7,10,8,,,,,,,2,2,6,5,10,10,3,7,8,10,,,,,,,,,,,4,6,normal,mixed,mixed,,,4,10,,3,9,8,5,,0.008780055,FAIL
2721,,32:59.6,34:43.4,0 days 00:01:43.769801,3,96,96,,2,5,,,,,,,,,,,10,7,10,8,,,,,,,2,2,6,5,9,10,3,7,8,10,,,,,,,,,,,4,6,normal,mixed,mixed,,,4,10,,3,9,8,5,,0.008892346,FAIL
2722,,34:43.4,36:27.1,0 days 00:01:43.748660,3,96,96,,2,5,,,,,,,,,,,10,7,10,8,,,,,,,2,2,6,5,10,10,2,7,8,10,,,,,,,,,,,4,6,normal,mixed,mixed,,,4,10,,3,9,8,5,,0.002539628,FAIL
2723,,36:27.1,38:09.7,0 days 00:01:42.585374,3,96,96,,2,5,,,,,,,,,,,10,7,10,8,,,,,,,2,2,6,5,10,10,2,7,8,10,,,,,,,,,,,4,6,normal,mixed,mixed,,,4,10,,3,9,8,5,,0.008650348,FAIL
2724,,38:09.7,39:51.4,0 days 00:01:41.637099,3,96,96,,2,5,,,,,,,,,,,10,7,10,8,,,,,,,2,2,6,5,10,10,2,7,8,10,,,,,,,,,,,4,6,normal,mixed,mixed,,,4,10,,3,9,8,5,,0.006696176,FAIL
2725,,39:51.4,41:33.3,0 days 00:01:41.935813,3,96,96,,2,5,,,,,,,,,,,10,7,10,8,,,,,,,2,2,6,5,9,10,2,7,8,10,,,,,,,,,,,4,6,normal,mixed,mixed,,,4,10,,3,9,8,5,,0.009162982,FAIL
2726,,41:33.3,43:16.2,0 days 00:01:42.912979,3,96,96,,2,5,,,,,,,,,,,10,7,10,8,,,,,,,2,2,6,5,10,9,2,7,8,10,,,,,,,,,,,4,6,normal,mixed,mixed,,,4,10,,3,9,8,5,,0.006730011,FAIL
2727,,43:16.2,44:59.7,0 days 00:01:43.470807,3,96,96,,2,5,,,,,,,,,,,8,7,10,8,,,,,,,2,2,6,5,10,10,2,7,8,10,,,,,,,,,,,4,6,normal,mixed,mixed,,,4,10,,3,9,8,5,,0.006686477,FAIL
2728,,44:59.7,46:43.4,0 days 00:01:43.729846,3,96,96,,2,5,,,,,,,,,,,10,7,10,8,,,,,,,3,2,6,5,10,10,2,7,8,10,,,,,,,,,,,4,6,normal,mixed,mixed,,,4,10,,3,9,8,5,,0.006603692,FAIL
2729,,46:43.4,48:27.6,0 days 00:01:44.156862,3,96,96,,2,5,,,,,,,,,,,10,7,10,8,,,,,,,2,2,6,5,10,10,2,7,8,10,,,,,,,,,,,4,6,normal,mixed,mixed,,,4,10,,3,9,8,5,,0.009071563,FAIL
2730,,48:27.6,50:11.2,0 days 00:01:43.582384,3,96,96,,2,5,,,,,,,,,,,10,7,10,8,,,,,,,2,2,6,5,10,10,2,7,8,10,,,,,,,,,,,4,6,normal,mixed,mixed,,,4,10,,3,9,8,5,,0.008445774,FAIL
2731,,50:11.2,51:54.9,0 days 00:01:43.702822,3,16,96,,2,5,,,,,,,,,,,10,7,10,8,,,,,,,2,2,6,5,10,10,2,7,8,10,,,,,,,,,,,4,6,normal,mixed,mixed,,,4,10,,3,9,8,6,,0.002619678,FAIL
2732,,51:54.9,53:38.3,0 days 00:01:43.366824,3,96,96,,2,5,,,,,,,,,,,10,7,10,8,,,,,,,2,2,6,5,10,10,2,7,8,10,,,,,,,,,,,4,6,normal,mixed,mixed,,,4,10,,3,9,8,5,,0.008647268,FAIL
2733,,53:38.3,55:21.8,0 days 00:01:43.568951,3,96,96,,2,5,,,,,,,,,,,10,7,10,8,,,,,,,2,2,6,5,10,9,2,7,8,10,,,,,,,,,,,4,6,normal,mixed,mixed,,,4,10,,3,9,8,5,,0.009157387,FAIL
2734,,55:21.8,57:05.5,0 days 00:01:43.684144,3,96,96,,2,5,,,,,,,,,,,10,7,10,8,,,,,,,2,2,6,5,10,10,3,7,8,10,,,,,,,,,,,4,6,normal,mixed,mixed,,,4,10,,3,9,8,5,,0.002594393,FAIL
2735,,57:05.5,58:49.0,0 days 00:01:43.531765,3,96,96,,2,5,,,,,,,,,,,10,7,10,8,,,,,,,2,2,6,5,10,10,2,7,8,10,,,,,,,,,,,4,6,normal,mixed,mixed,,,4,10,,3,9,8,5,,0.002608616,FAIL
2736,,58:49.0,00:32.9,0 days 00:01:43.836619,3,96,96,,2,5,,,,,,,,,,,10,7,10,7,4,,,,,,2,2,6,5,10,10,2,7,8,10,,,,,,,,,,,4,6,normal,mixed,mixed,,,5,10,,3,9,8,5,,0.006635772,FAIL
2737,,00:32.9,02:16.3,0 days 00:01:43.425203,3,96,96,,2,5,,,,,,,,,,,10,7,10,8,,,,,,,2,2,6,4,10,10,2,7,8,10,,,,,,,,,,,4,6,normal,mixed,mixed,,,4,10,,3,9,8,5,,0.008932724,FAIL
2738,,02:16.3,03:59.7,0 days 00:01:43.419072,3,96,96,,2,5,,,,,,,,,,,10,7,10,8,,,,,,,2,2,6,5,9,10,2,7,8,10,,,,,,,,,,,4,6,normal,mixed,mixed,,,4,10,,3,9,8,5,,0.009033969,FAIL
2739,,03:59.7,05:43.4,0 days 00:01:43.683516,3,96,96,,2,5,,,,,,,,,,,10,7,10,8,,,,,,,2,2,6,5,10,10,2,7,8,10,,,,,,,,,,,4,6,normal,mixed,mixed,,,4,10,,3,9,8,5,,0.006933937,FAIL
2740,,05:43.4,07:27.1,0 days 00:01:43.703642,3,96,96,,2,5,,,,,,,,,,,10,7,10,8,,,,,,,2,2,6,5,10,10,2,7,8,10,,,,,,,,,,,4,6,normal,mixed,mixed,,,4,10,,3,9,8,5,,0.008187935,FAIL
2741,,07:27.1,09:10.9,0 days 00:01:43.734142,3,96,96,,2,5,,,,,,,,,,,10,7,10,8,,,,,,,2,2,6,5,10,10,2,7,8,10,,,,,,,,,,,4,6,normal,mixed,mixed,,,4,10,,3,9,10,5,,0.008861344,FAIL
2742,,09:10.9,10:54.4,0 days 00:01:43.557472,3,96,96,,2,5,,,,,,,,,,,10,7,10,8,,,,,,,2,2,6,5,10,10,2,8,8,10,,,,,,,,,,,4,6,normal,mixed,mixed,,,4,10,,3,9,8,5,,0.00873304,FAIL
2743,,10:54.4,12:38.5,0 days 00:01:44.041380,3,96,96,,2,5,,,,,,,,,,,10,7,10,8,,,,,,,2,2,6,5,9,10,2,7,8,10,,,,,,,,,,,4,6,normal,mixed,mixed,,,4,10,,3,9,8,5,,0.002613062,FAIL
2744,,12:38.5,14:22.4,0 days 00:01:43.941115,3,96,96,,2,5,,,,,,,,,,,10,7,10,8,,,,,,,2,2,6,5,10,10,2,7,8,10,,,,,,,,,,,4,6,normal,mixed,mixed,,,4,10,,3,9,8,5,,0.002620932,FAIL
2745,,14:22.4,16:06.2,0 days 00:01:43.813051,3,96,96,,2,5,,,,,,,,,,,10,7,10,8,,,,,,,3,2,6,4,10,10,2,7,8,10,,,,,,,,,,,4,6,normal,mixed,mixed,,,4,10,,3,9,8,5,,0.008837507,FAIL
2746,,16:06.2,17:49.7,0 days 00:01:43.502679,3,96,96,,2,5,,,,,,,,,,,10,7,10,8,,,,,,,2,2,6,5,10,10,2,7,8,10,,,,,,,,,,,4,6,normal,mixed,mixed,,,4,10,,3,9,8,5,,0.008763161,FAIL
2747,,17:49.7,19:33.5,0 days 00:01:43.736428,3,96,96,,2,5,,,,,,,,,,,10,7,10,8,,,,,,,2,2,6,5,10,10,2,7,8,10,,,,,,,,,,,4,6,normal,mixed,mixed,,,4,10,,3,9,8,5,,0.002568778,FAIL
2748,,19:33.5,21:16.9,0 days 00:01:43.417419,3,96,96,,2,5,,,,,,,,,,,10,7,10,8,,,,,,,2,2,6,5,9,10,3,7,8,10,,,,,,,,,,,4,6,normal,mixed,mixed,,,4,10,,3,9,8,5,,0.002563681,FAIL
2749,,21:16.9,23:00.7,0 days 00:01:43.771994,3,96,96,,2,5,,,,,,,,,,,10,7,10,8,,,,,,,2,2,6,5,10,10,2,7,8,10,,,,,,,,,,,4,6,normal,mixed,mixed,,,4,10,,3,9,8,5,,0.00838098,FAIL
2750,,23:00.7,24:43.8,0 days 00:01:43.157165,3,96,96,,2,5,,,,,,,,,,,8,8,10,8,,,,,,,2,2,6,5,10,9,2,7,8,10,,,,,,,,,,,4,6,normal,mixed,mixed,,,4,10,,3,9,8,5,,0.006587593,FAIL
2751,,24:43.8,26:27.4,0 days 00:01:43.586693,3,96,96,,2,5,,,,,,,,,,,10,7,10,8,,,,,,,2,2,6,5,10,10,2,7,8,10,,,,,,,,,,,4,6,normal,mixed,mixed,,,4,10,,3,9,8,5,,0.008976989,FAIL
2752,,26:27.4,28:10.3,0 days 00:01:42.823417,3,96,96,,2,5,,,,,,,,,,,10,7,10,8,,,,,,,2,2,6,5,10,10,2,7,8,,,,,,,,,,,,4,6,normal,mixed,mixed,,,4,9,,3,9,8,5,,0.002574791,FAIL
2753,,28:10.3,29:53.5,0 days 00:01:43.194524,3,96,96,,2,5,,,,,,,,,,,10,7,10,8,,,,,,,2,2,6,5,10,9,2,7,8,10,,,,,,,,,,,4,6,normal,mixed,mixed,,,4,10,,3,9,8,5,,0.006932094,FAIL
2754,,29:53.5,31:37.3,0 days 00:01:43.811801,3,96,96,,2,5,,,,,,,,,,,10,8,10,8,,,,,,,2,2,6,5,10,10,2,7,8,10,,,,,,,,,,,4,6,normal,mixed,mixed,,,4,10,,3,9,8,5,,0.006577849,FAIL
2755,,31:37.3,33:20.8,0 days 00:01:43.520722,3,96,96,,2,5,,,,,,,,,,,10,7,10,8,,,,,,,2,2,6,5,10,9,3,7,8,10,,,,,,,,,,,4,6,normal,mixed,mixed,,,4,10,,3,9,8,5,,0.008968771,FAIL
2756,,33:20.8,35:04.4,0 days 00:01:43.627808,3,96,96,,2,5,,,,,,,,,,,10,7,10,8,,,,,,,2,2,6,5,10,10,2,7,8,10,,,,,,,,,,,4,6,normal,mixed,mixed,,,4,10,,3,9,8,5,,0.006763473,FAIL
2757,,35:04.4,36:47.8,0 days 00:01:43.392545,3,96,96,,2,5,,,,,,,,,,,10,7,10,8,,,,,,,2,2,6,4,10,10,2,7,8,10,,,,,,,,,,,4,6,normal,mixed,mixed,,,4,10,,3,9,8,6,,0.00910308,FAIL
2758,,36:47.8,38:30.0,0 days 00:01:42.164038,3,96,96,,2,5,,,,,,,,,,,8,7,10,8,,,,,,,2,2,6,5,10,10,2,7,8,,,,,,,,,,,,4,6,normal,mixed,mixed,,,4,9,,3,9,8,5,,0.006844816,FAIL
2759,,38:30.0,40:13.5,0 days 00:01:43.488872,3,96,96,,2,5,,,,,,,,,,,10,7,10,8,,,,,,,2,2,6,5,10,10,2,7,8,10,,,,,,,,,,,4,6,normal,mixed,mixed,,,4,10,,3,9,8,5,,0.00851814,FAIL
