number,value,datetime_start,datetime_complete,duration,params_gat_heads,params_gat_hidden_0,params_gat_hidden_1,params_gat_hidden_2,params_gat_layers,params_gat_out,params_kan_arity_0_0,params_kan_arity_0_1,params_kan_arity_0_2,params_kan_arity_0_3,params_kan_arity_0_4,params_kan_arity_0_5,params_kan_arity_0_6,params_kan_arity_0_7,params_kan_arity_0_8,params_kan_arity_0_9,params_kan_arity_1_0,params_kan_arity_1_1,params_kan_arity_1_2,params_kan_arity_1_3,params_kan_arity_1_4,params_kan_arity_1_5,params_kan_arity_1_6,params_kan_arity_1_7,params_kan_arity_1_8,params_kan_arity_1_9,params_kan_arity_2_0,params_kan_arity_2_1,params_kan_arity_2_2,params_kan_arity_2_3,params_kan_arity_2_4,params_kan_arity_2_5,params_kan_arity_2_6,params_kan_arity_2_7,params_kan_arity_2_8,params_kan_arity_2_9,params_kan_arity_3_0,params_kan_arity_3_1,params_kan_arity_3_2,params_kan_arity_3_3,params_kan_arity_3_4,params_kan_arity_3_5,params_kan_arity_3_6,params_kan_arity_3_7,params_kan_arity_3_8,params_kan_arity_3_9,params_kan_grid,params_kan_k,params_kan_layer_type_0,params_kan_layer_type_1,params_kan_layer_type_2,params_kan_layer_type_3,params_kan_mult_nodes_0,params_kan_mult_nodes_1,params_kan_mult_nodes_2,params_kan_mult_nodes_3,params_kan_n_layers,params_kan_neurons_0,params_kan_neurons_1,params_kan_neurons_2,params_kan_neurons_3,params_lr,state
1934,,20:31.9,24:40.5,0 days 00:04:08.633517,2,96,8,16,3,5,10,4,10,6,2,5,3,10,,,3,7,5,6,10,9,10,10,5,5,8,10,2,5,4,10,10,,,,,,,,,,,,,,8,3,mixed,mixed,mixed,normal,8,10,7,,4,9,8,9,10,0.004203029,FAIL
1935,,24:40.5,28:47.9,0 days 00:04:07.340824,2,96,8,16,3,5,10,4,10,6,2,5,2,10,,,3,7,10,6,10,9,10,10,5,5,8,10,2,5,4,10,10,,,,,,,,,,,,,,8,3,mixed,mixed,mixed,normal,8,10,7,,4,9,8,9,10,0.001240427,FAIL
1936,,28:47.9,32:57.6,0 days 00:04:09.702644,2,96,8,16,3,5,10,3,10,6,2,10,2,10,,,3,7,10,6,10,10,10,10,5,5,8,10,2,5,4,10,10,,,,,,,,,,,,,,8,3,mixed,mixed,mixed,normal,8,10,7,,4,9,2,9,10,0.004535246,FAIL
1937,,32:57.6,37:07.1,0 days 00:04:09.524628,2,96,8,16,3,5,10,4,10,6,7,5,2,10,,,3,7,5,6,10,9,10,10,5,5,8,10,2,5,4,10,10,,,,,,,,,,,,,,8,3,mixed,mixed,mixed,normal,8,10,7,,4,9,8,9,10,0.004861524,FAIL
1938,,37:07.1,41:15.5,0 days 00:04:08.361799,2,96,8,16,3,5,10,4,10,6,2,5,3,10,,,3,7,5,6,10,10,10,10,5,5,8,10,2,5,5,10,10,,,,,,,,,,,,,,8,3,mixed,mixed,mixed,normal,8,10,7,,4,9,8,9,4,0.004559625,FAIL
1939,,41:15.5,45:23.8,0 days 00:04:08.360570,2,96,8,16,3,5,10,4,10,6,2,5,2,10,,,3,7,10,6,10,10,10,10,5,5,8,10,2,5,4,10,10,,,,,,,,,,,,,,8,3,mixed,mixed,mixed,normal,8,10,7,,4,9,8,9,10,0.004571081,FAIL
1940,,45:23.8,49:33.7,0 days 00:04:09.876698,2,96,8,16,3,5,10,5,10,6,2,5,2,10,,,3,7,10,6,10,9,10,10,5,5,8,10,2,5,4,10,10,,,,,,,,,,,,,,8,3,mixed,mixed,mixed,normal,8,10,7,,4,10,8,9,10,0.004537172,FAIL
1941,,49:33.7,53:43.0,0 days 00:04:09.241948,2,96,8,16,3,5,10,4,10,6,2,5,2,10,,,3,7,10,6,10,10,10,10,5,5,8,10,2,5,4,10,10,,,,,,,,,,,,,,8,3,mixed,mixed,mixed,normal,8,10,7,,4,9,8,9,4,0.004540294,FAIL
1942,,53:43.0,57:52.1,0 days 00:04:09.144011,2,96,8,16,3,5,10,4,10,6,2,5,2,10,10,,3,7,10,6,10,10,10,10,5,,8,10,2,5,4,10,10,,,,,,,,,,,,,,8,3,mixed,mixed,mixed,normal,9,9,7,,4,9,8,9,10,0.004653002,FAIL
1943,,57:52.1,02:01.2,0 days 00:04:09.048675,2,96,8,16,3,5,10,4,10,6,2,5,2,10,,,3,7,10,6,10,10,10,10,5,5,8,10,2,5,4,10,10,,,,,,,,,,,,,,8,3,mixed,mixed,mixed,normal,8,10,7,,4,9,8,9,10,0.001256495,FAIL
1944,,02:01.2,06:14.0,0 days 00:04:12.829798,2,96,8,16,3,5,10,4,10,6,2,5,2,10,,,3,7,5,6,10,10,10,10,5,5,8,10,4,5,4,4,10,,,,,,,,,,,,,,8,3,mixed,mixed,mixed,normal,8,10,7,,4,9,8,9,10,0.004311816,FAIL
1945,,06:14.0,10:24.2,0 days 00:04:10.208014,2,96,8,16,3,5,10,4,10,6,2,5,2,10,,,3,7,10,6,10,10,10,10,5,5,8,10,2,5,4,10,10,,,,,,,,,,,,,,8,3,mixed,mixed,mixed,normal,8,10,7,,4,9,8,9,10,0.00125899,FAIL
1946,,10:24.2,14:36.2,0 days 00:04:11.959984,2,96,8,16,3,5,10,4,10,6,2,5,2,10,,,3,7,10,6,10,10,10,10,5,,8,10,2,5,4,10,10,,,,,,,,,,,,,,8,3,mixed,mixed,mixed,normal,8,9,7,,4,9,8,9,10,0.00125375,FAIL
1947,,14:36.2,18:46.0,0 days 00:04:09.817166,2,96,8,16,3,5,10,4,10,6,2,5,2,10,,,3,7,10,6,10,9,10,10,5,5,8,10,4,5,4,10,10,,,,,,,,,,,,,,8,3,mixed,mixed,mixed,normal,8,10,7,,4,9,8,9,10,0.004799559,FAIL
1948,,18:46.0,22:56.9,0 days 00:04:10.919797,2,96,8,16,3,5,10,4,10,6,2,5,2,10,,,3,7,10,6,10,10,10,10,5,,8,10,2,5,4,10,10,,,,,,,,,,,,,,8,3,mixed,mixed,mixed,normal,8,9,7,,4,9,8,9,10,0.00452512,FAIL
1949,,22:56.9,27:07.6,0 days 00:04:10.687653,2,96,8,16,3,5,10,4,9,6,2,5,2,9,,,3,7,10,6,10,10,10,10,5,5,8,10,2,5,4,10,10,,,,,,,,,,,,,,8,3,mixed,mixed,mixed,normal,8,10,7,,4,9,2,9,4,0.001262612,FAIL
1950,,27:07.6,31:19.5,0 days 00:04:11.879069,2,96,8,16,3,5,10,4,10,6,2,5,3,10,,,3,7,5,6,10,10,10,10,5,5,8,10,2,5,4,10,10,,,,,,,,,,,,,,8,3,mixed,mixed,mixed,normal,8,10,7,,4,9,8,9,10,0.004792252,FAIL
1951,,31:19.5,35:31.9,0 days 00:04:12.397402,2,96,8,16,3,5,9,4,10,6,2,5,2,10,,,3,7,10,6,10,10,10,10,5,5,8,10,2,5,4,10,10,,,,,,,,,,,,,,8,3,mixed,mixed,mixed,normal,8,10,7,,4,9,8,9,10,0.001213029,FAIL
1952,,35:31.9,39:44.6,0 days 00:04:12.672055,2,96,8,16,3,5,10,4,10,6,2,5,2,10,,,3,7,10,6,10,10,10,10,5,5,8,10,2,5,4,10,10,,,,,,,,,,,,,,8,3,mixed,mixed,mixed,normal,8,10,7,,4,9,8,9,10,0.004586081,FAIL
1953,,39:44.6,43:56.6,0 days 00:04:12.019852,2,96,8,16,3,5,10,4,10,5,2,5,3,10,,,3,7,10,6,10,10,10,10,5,5,8,8,2,5,4,10,10,,,,,,,,,,,,,,8,3,mixed,mixed,mixed,normal,8,10,7,,4,9,8,9,10,0.00286621,FAIL
1954,,43:56.6,48:08.3,0 days 00:04:11.731488,2,96,8,16,3,5,10,4,10,6,2,5,2,10,,,3,7,10,6,10,9,10,10,5,5,8,10,2,5,4,10,10,,,,,,,,,,,,,,8,3,mixed,mixed,mixed,normal,8,10,7,,4,9,8,9,10,0.002817143,FAIL
1955,,48:08.3,52:20.3,0 days 00:04:11.984419,2,96,8,16,3,5,10,4,10,6,2,5,2,10,,,3,7,10,6,10,10,10,10,5,5,8,10,2,5,4,10,10,,,,,,,,,,,,,,8,3,mixed,mixed,mixed,normal,8,10,7,,4,9,8,9,10,0.001221225,FAIL
1956,,52:20.3,56:32.0,0 days 00:04:11.668147,2,96,8,16,3,5,10,4,10,6,2,5,2,10,,,3,7,10,6,10,10,10,10,5,5,8,10,2,5,4,10,10,2,,,,,,,,,,,,,8,3,mixed,mixed,mixed,normal,8,10,8,,4,9,8,9,10,0.00422551,FAIL
1957,,56:32.0,00:44.5,0 days 00:04:12.503087,2,96,8,16,3,5,10,4,9,6,2,5,3,10,,,3,7,10,6,10,10,10,10,5,5,8,10,2,5,4,10,10,,,,,,,,,,,,,,8,3,mixed,mixed,mixed,normal,8,10,7,,4,9,8,9,10,0.004435518,FAIL
1958,,00:44.5,04:55.4,0 days 00:04:10.910489,2,96,8,16,3,5,10,4,10,6,2,10,4,10,,,3,7,10,6,10,10,10,10,5,5,8,10,2,5,4,4,10,,,,,,,,,,,,,,8,3,mixed,mixed,mixed,normal,8,10,7,,4,9,8,9,4,0.00453457,FAIL
1959,,04:55.4,09:06.7,0 days 00:04:11.249936,2,96,8,16,3,5,10,4,9,6,2,10,2,10,,,3,7,10,6,10,10,10,10,5,5,8,10,2,5,4,4,10,,,,,,,,,,,,,,8,3,mixed,mixed,mixed,normal,8,10,7,,4,9,8,9,10,0.004822991,FAIL
1960,,09:06.7,13:18.1,0 days 00:04:11.469601,2,96,8,16,3,5,9,4,10,6,2,10,2,10,,,3,7,10,6,10,10,10,10,5,5,8,10,2,5,5,10,10,,,,,,,,,,,,,,8,3,mixed,mixed,mixed,normal,8,10,7,,4,9,8,9,10,0.004610192,FAIL
1961,,13:18.1,17:29.6,0 days 00:04:11.478068,2,96,8,16,3,5,10,5,10,6,2,5,2,10,,,3,7,10,6,10,10,10,10,6,5,8,10,2,5,4,10,10,,,,,,,,,,,,,,8,3,mixed,mixed,mixed,normal,8,10,7,,4,9,8,9,10,0.00481886,FAIL
1962,,17:29.6,21:41.0,0 days 00:04:11.334963,2,96,8,16,3,5,10,4,10,6,2,5,2,10,,,3,7,10,6,10,10,10,10,5,5,8,10,2,5,4,10,10,,,,,,,,,,,,,,8,3,mixed,mixed,mixed,normal,8,10,7,,4,9,8,9,10,0.001232516,FAIL
1963,,21:41.0,25:52.0,0 days 00:04:11.069303,2,96,8,16,3,5,10,4,10,6,2,5,2,10,,,3,7,10,6,10,9,10,10,5,5,8,10,2,6,4,10,10,,,,,,,,,,,,,,8,4,mixed,mixed,mixed,normal,8,10,7,,4,9,8,9,10,0.001248975,FAIL
1964,,25:52.0,30:02.9,0 days 00:04:10.873882,2,96,8,16,3,5,10,4,10,6,2,5,2,10,,,3,7,10,6,10,10,10,10,5,5,8,10,2,5,4,10,10,,,,,,,,,,,,,,8,3,mixed,mixed,mixed,normal,8,10,7,,4,9,8,9,10,0.004539865,FAIL
1965,,30:02.9,34:13.2,0 days 00:04:10.256628,2,96,8,16,3,5,10,4,10,5,2,5,2,10,,,3,7,10,6,10,9,10,10,5,5,8,10,2,5,4,10,10,,,,,,,,,,,,,,8,3,mixed,mixed,mixed,normal,8,10,7,,4,9,8,9,10,0.004510736,FAIL
1966,,34:13.2,38:23.4,0 days 00:04:10.214688,2,96,8,16,3,5,10,4,10,6,2,5,4,10,,,3,7,10,6,10,10,10,10,5,5,8,10,2,6,4,10,10,,,,,,,,,,,,,,8,3,mixed,mixed,mixed,normal,8,10,7,,4,9,8,9,10,0.004820473,FAIL
1967,,38:23.4,42:34.1,0 days 00:04:10.655385,2,96,8,16,3,5,10,4,10,6,2,5,2,10,,,3,7,10,6,10,10,10,10,5,5,8,10,2,5,4,10,10,,,,,,,,,,,,,,8,3,mixed,mixed,mixed,normal,8,10,7,,4,9,8,9,10,0.004591242,FAIL
1968,,42:34.1,46:44.2,0 days 00:04:10.112444,2,96,8,16,3,5,10,4,8,5,2,5,2,10,,,3,7,10,6,10,10,10,9,5,5,8,10,2,6,4,10,10,,,,,,,,,,,,,,8,3,mixed,mixed,mixed,normal,8,10,7,,4,9,8,9,10,0.002861242,FAIL
1969,,46:44.2,50:53.0,0 days 00:04:08.802856,2,96,8,16,3,5,10,4,10,6,2,5,6,10,,,3,7,10,6,10,10,10,10,5,5,8,10,2,5,4,10,10,,,,,,,,,,,,,,8,3,mixed,mixed,mixed,normal,8,10,7,,4,9,8,9,4,0.004430625,FAIL
1970,,50:53.0,55:00.5,0 days 00:04:07.524473,2,96,8,16,3,5,10,4,10,6,2,5,2,10,,,3,7,10,6,10,9,10,10,5,5,8,10,2,5,4,10,10,,,,,,,,,,,,,,8,3,mixed,mixed,mixed,normal,8,10,7,,4,9,2,9,10,0.004468102,FAIL
1971,,55:00.5,59:07.6,0 days 00:04:07.134556,2,96,8,16,3,5,10,4,10,6,2,5,3,10,,,3,7,10,6,10,10,10,10,5,5,8,10,2,5,4,10,10,,,,,,,,,,,,,,8,3,mixed,mixed,mixed,normal,8,10,7,,4,9,8,9,10,0.001230375,FAIL
1972,,59:07.6,03:14.6,0 days 00:04:06.911752,2,96,8,16,3,5,10,4,10,6,2,5,2,10,,,3,7,10,6,10,9,10,10,5,5,8,10,4,5,4,10,10,,,,,,,,,,,,,,8,3,mixed,mixed,mixed,normal,8,10,7,,4,9,8,9,4,0.004719978,FAIL
1973,,03:14.6,07:24.7,0 days 00:04:10.160691,2,96,8,16,3,5,10,4,10,6,2,5,3,10,,,3,7,5,6,10,10,10,10,5,5,8,10,2,5,4,4,10,,,,,,,,,,,,,,8,3,mixed,mixed,mixed,normal,8,10,7,,4,9,8,9,10,0.004330733,FAIL
1974,,07:24.7,11:33.6,0 days 00:04:08.831619,2,96,8,16,3,5,10,5,10,6,2,5,2,10,,,3,7,10,6,10,9,10,10,5,5,8,10,2,5,4,10,10,,,,,,,,,,,,,,8,3,mixed,mixed,mixed,normal,8,10,7,,4,9,8,9,10,0.004555607,FAIL
1975,,11:33.6,15:48.8,0 days 00:04:15.201647,2,96,8,16,3,5,10,4,10,6,2,5,2,10,,,3,7,5,6,10,10,9,10,5,4,8,10,2,5,4,10,10,,,,,,,,,,,,,,8,3,mixed,mixed,mixed,normal,8,10,7,,4,9,8,9,10,0.001241516,FAIL
1976,,15:48.8,20:00.8,0 days 00:04:12.030705,2,96,8,16,3,5,10,4,9,6,2,5,2,10,,,3,7,10,6,10,9,10,10,5,5,8,10,2,5,4,10,10,,,,,,,,,,,,,,8,3,mixed,mixed,mixed,normal,8,10,7,,4,9,8,9,10,0.004257325,FAIL
1977,,20:00.8,24:13.9,0 days 00:04:13.050123,2,96,8,16,3,5,10,4,10,6,2,5,3,10,,,3,7,10,6,10,10,10,10,5,5,8,10,2,5,4,10,10,,,,,,,,,,,,,,8,3,mixed,mixed,mixed,normal,8,10,7,,4,9,8,9,10,0.005006034,FAIL
1978,,24:13.9,28:27.0,0 days 00:04:13.143060,2,96,8,16,3,5,10,5,10,6,2,5,2,10,,,3,7,10,6,10,10,10,10,5,5,8,10,2,5,4,10,10,,,,,,,,,,,,,,8,3,mixed,mixed,mixed,normal,8,10,7,,4,9,8,9,4,0.003012452,FAIL
1979,,28:27.0,32:38.8,0 days 00:04:11.804802,2,96,8,16,3,5,10,4,10,6,2,5,2,10,,,3,7,5,6,10,10,10,10,5,5,8,10,2,6,4,10,10,10,,,,,,,,,,,,,8,3,mixed,mixed,mixed,normal,8,10,8,,4,9,8,9,10,0.007031805,FAIL
1980,,32:38.8,36:50.8,0 days 00:04:11.937374,2,96,8,16,3,5,10,4,10,6,2,10,2,10,,,3,7,10,6,10,10,10,10,5,5,8,10,2,5,4,10,10,,,,,,,,,,,,,,8,3,mixed,mixed,mixed,normal,8,10,7,,4,9,8,9,10,0.004757239,FAIL
1981,,36:50.8,41:04.4,0 days 00:04:13.693376,2,96,8,16,3,5,10,4,9,6,2,5,2,10,,,3,7,10,6,10,10,10,9,5,5,8,8,2,5,4,10,10,,,,,,,,,,,,,,8,3,mixed,mixed,mixed,normal,8,10,7,,4,9,8,9,10,0.004435748,FAIL
1982,,41:04.5,45:14.3,0 days 00:04:09.798989,2,96,8,16,3,5,10,4,10,6,2,5,2,10,,,3,7,5,6,10,10,10,10,5,5,8,10,2,5,4,10,10,,,,,,,,,,,,,,8,3,mixed,mixed,mixed,normal,8,10,7,,4,9,8,9,10,0.001218172,FAIL
1983,,45:14.3,49:23.6,0 days 00:04:09.318246,2,96,8,16,3,5,10,4,10,6,2,5,2,10,,,3,7,10,6,9,10,10,10,5,5,8,10,2,5,4,10,10,,,,,,,,,,,,,,8,3,mixed,mixed,mixed,normal,8,10,7,,4,9,8,9,4,0.004815742,FAIL
1984,,49:23.6,53:35.7,0 days 00:04:12.113277,2,96,8,16,3,5,10,4,10,6,2,5,2,10,,,3,7,10,6,10,10,10,10,5,5,8,10,2,5,4,4,10,,,,,,,,,,,,,,8,3,mixed,mixed,mixed,normal,8,10,7,,4,9,8,9,10,0.005054724,FAIL
1985,,53:35.7,57:49.3,0 days 00:04:13.653264,2,96,8,16,3,5,10,4,9,5,2,5,2,10,,,3,7,5,5,10,10,10,10,5,5,8,10,2,5,4,10,10,,,,,,,,,,,,,,8,3,mixed,mixed,mixed,normal,8,10,7,,4,9,8,9,10,0.001263651,FAIL
1986,,57:49.4,02:00.4,0 days 00:04:11.024186,2,96,8,16,3,5,10,4,10,6,2,5,2,10,,,3,7,10,6,10,10,10,10,5,5,8,10,2,5,4,10,10,,,,,,,,,,,,,,8,3,mixed,mixed,mixed,normal,8,10,7,,4,9,8,9,10,0.004357295,FAIL
1987,,02:00.4,06:13.2,0 days 00:04:12.843983,2,96,8,16,3,5,10,4,10,6,2,5,3,9,,,3,7,5,6,10,10,10,10,5,5,8,10,2,5,4,10,10,,,,,,,,,,,,,,8,3,mixed,mixed,mixed,normal,8,10,7,,4,9,8,9,10,0.001234235,FAIL
1988,,06:13.2,10:25.4,0 days 00:04:12.131399,2,96,8,16,3,5,10,5,10,6,2,5,2,10,,,3,7,10,6,10,10,10,10,5,5,8,10,2,5,5,4,10,,,,,,,,,,,,,,8,3,mixed,mixed,mixed,normal,8,10,7,,4,9,8,9,10,0.001261353,FAIL
1989,,10:25.4,14:35.1,0 days 00:04:09.770788,2,96,8,16,3,5,10,4,10,6,2,5,3,10,,,3,7,10,6,10,10,10,10,5,5,8,10,2,5,4,10,10,,,,,,,,,,,,,,8,3,mixed,mixed,mixed,normal,8,10,7,,4,9,8,9,10,0.004694954,FAIL
1990,,14:35.1,18:44.4,0 days 00:04:09.225486,2,96,8,16,3,5,10,4,10,6,2,5,2,10,,,3,7,5,6,10,10,10,10,5,5,8,10,2,5,4,10,10,,,,,,,,,,,,,,8,3,mixed,mixed,mixed,normal,8,10,7,,4,9,8,9,10,0.002922652,FAIL
1991,,18:44.4,22:54.3,0 days 00:04:09.893822,2,96,8,16,3,5,10,4,9,6,2,5,2,10,,,3,7,5,6,10,10,10,10,6,5,8,10,2,5,4,10,10,,,,,,,,,,,,,,8,3,mixed,mixed,mixed,,8,10,7,,3,9,8,9,,0.004488838,FAIL
1992,,22:54.3,27:03.3,0 days 00:04:08.989434,2,96,8,16,3,5,10,4,10,6,2,5,3,10,,,3,7,10,6,10,9,10,10,5,5,8,10,2,5,4,10,10,,,,,,,,,,,,,,8,3,mixed,mixed,mixed,normal,8,10,7,,4,9,8,9,10,0.004835867,FAIL
1993,,27:03.3,31:10.2,0 days 00:04:06.969677,2,96,8,16,3,5,10,4,10,6,2,5,3,10,,,3,7,10,6,10,10,10,10,5,5,8,10,2,5,4,10,10,,,,,,,,,,,,,,8,3,mixed,mixed,mixed,normal,8,10,7,,4,9,8,9,10,0.004498009,FAIL
1994,,31:10.2,35:18.2,0 days 00:04:08.010457,2,96,8,16,3,5,10,4,10,6,2,5,2,10,,,3,7,10,6,10,9,10,10,5,5,8,10,2,5,4,10,10,,,,,,,,,,,,,,8,3,mixed,mixed,mixed,normal,8,10,7,,4,9,8,9,10,0.001223943,FAIL
1995,,35:18.2,39:26.6,0 days 00:04:08.387459,2,96,8,16,3,5,10,4,10,6,2,5,3,10,,,3,7,10,6,10,10,10,10,5,5,8,10,2,5,5,10,10,,,,,,,,,,,,,,8,3,mixed,mixed,mixed,normal,8,10,7,,4,9,8,9,10,0.004795812,FAIL
1996,,39:26.6,43:37.9,0 days 00:04:11.303909,2,96,8,16,3,5,10,4,10,6,2,5,2,10,,,3,7,10,6,10,10,10,10,5,5,8,10,2,5,4,10,10,,,,,,,,,,,,,,8,3,mixed,mixed,mixed,normal,8,10,7,,4,9,8,9,10,0.001267871,FAIL
1997,,43:37.9,47:48.8,0 days 00:04:10.840291,2,96,8,16,3,5,10,4,10,6,2,5,2,10,,,3,7,10,6,10,10,10,10,5,5,8,10,2,5,4,10,10,,,,,,,,,,,,,,8,3,mixed,mixed,mixed,normal,8,10,7,,4,9,8,9,10,0.004660573,FAIL
1998,,47:48.8,51:59.1,0 days 00:04:10.340770,2,96,8,16,3,5,10,4,10,6,2,5,2,10,,,3,7,7,6,10,8,10,10,5,5,8,10,2,5,4,10,10,,,,,,,,,,,,,,8,3,mixed,mixed,mixed,normal,8,10,7,,4,9,8,9,4,0.001239611,FAIL
1999,,51:59.1,56:09.8,0 days 00:04:10.669142,2,96,8,16,3,5,10,4,10,6,2,5,2,10,9,,3,7,10,5,10,10,10,10,5,5,8,10,2,5,4,10,10,,,,,,,,,,,,,,8,3,mixed,mixed,mixed,normal,9,10,7,,4,9,8,9,10,0.001244007,FAIL
2000,564.2266846,21:04.5,22:37.0,0 days 00:01:32.428954,4,64,128,32,3,4,,,,,,,,,,,,,,,,,,,,,,,,,,,,,,,,,,,,,,,,,3,6,normal,normal,,,,,,,2,6,10,,,0.001442851,COMPLETE
2001,572.0973511,22:37.0,24:02.9,0 days 00:01:25.907634,1,64,,,1,4,,,,,,,,,,,,,,,,,,,,,,,,,,,,,,,,,,,,,,,,,3,8,normal,,,,,,,,1,4,,,,0.005671422,COMPLETE
2002,845.6004028,24:02.9,25:35.2,0 days 00:01:32.298941,3,128,96,,2,5,3,9,8,,,,,,,,,,,,,,,,,,,,,,,,,,,,,,,,,,,,,,8,5,mixed,normal,,,3,,,,2,4,6,,,0.007397229,COMPLETE
2003,526.2799683,25:35.2,27:09.0,0 days 00:01:33.784376,2,64,96,,2,4,,,,,,,,,,,,,,,,,,,,,,,,,,,,,,,,,,,,,,,,,6,5,normal,normal,normal,normal,,,,,4,5,4,8,5,0.001255684,COMPLETE
2004,590.6845093,27:09.0,28:38.6,0 days 00:01:29.602826,1,16,16,,2,3,4,5,4,10,2,5,9,9,,,,,,,,,,,,,,,,,,,,,,,,,,,,,,,,,5,3,mixed,,,,8,,,,1,7,,,,0.009505394,COMPLETE
2005,,28:38.6,30:09.7,0 days 00:01:31.108432,2,8,,,1,2,7,7,5,5,10,9,,,,,,,,,,,,,,,,,,,,,,,,,,,,,,,,,,,4,6,mixed,,,,6,,,,1,5,,,,0.004647355,FAIL
2006,,30:09.7,31:49.8,0 days 00:01:40.102296,1,32,16,,2,4,10,,,,,,,,,,,,,,,,,,,,,,,,,,,,,,,,,,,,,,,,5,7,mixed,normal,normal,normal,1,,,,4,5,4,10,4,0.004675535,FAIL
2007,1093.695068,31:49.8,33:16.4,0 days 00:01:26.623087,4,128,,,1,2,,,,,,,,,,,,,,,,,,,,,,,,,,,,,,,,,,,,,,,,,5,7,normal,,,,,,,,1,4,,,,0.001323019,COMPLETE
2008,1295.388672,33:16.4,34:44.7,0 days 00:01:28.263535,2,8,,,1,2,,,,,,,,,,,,,,,,,,,,,,,,,,,,,,,,,,,,,,,,,4,5,normal,normal,,,,,,,2,1,7,,,0.004324223,COMPLETE
2009,,34:44.7,36:24.3,0 days 00:01:39.581166,3,8,,,1,3,5,4,7,2,6,3,5,9,4,7,,,,,,,,,,,,,,,,,,,,,,,,,,,,,,,3,6,mixed,normal,normal,,10,,,,3,1,7,9,,0.005747374,FAIL
2010,,36:24.3,37:58.2,0 days 00:01:33.913225,4,16,16,,2,3,6,8,7,9,,,,,,,5,,,,,,,,,,,,,,,,,,,,,,,,,,,,,,8,5,mixed,mixed,,,4,1,,,2,8,4,,,0.002192311,FAIL
2011,,37:58.2,39:47.8,0 days 00:01:49.626334,3,32,128,32,3,4,8,3,3,,,,,,,,2,5,8,7,8,8,6,,,,8,7,6,8,6,8,2,10,6,,8,9,2,10,9,2,9,10,,,6,7,mixed,mixed,mixed,mixed,3,7,9,8,4,1,8,6,2,0.005308656,FAIL
2012,2252.678467,39:47.8,41:13.6,0 days 00:01:25.775303,1,64,64,,2,4,,,,,,,,,,,9,,,,,,,,,,,,,,,,,,,,,,,,,,,,,,3,3,normal,mixed,,,,1,,,2,2,8,,,0.00156992,COMPLETE
2013,,41:13.6,42:39.1,0 days 00:01:25.446388,4,128,,,1,2,10,4,,,,,,,,,,,,,,,,,,,,,,,,,,,,,,,,,,,,,,,6,4,mixed,,,,2,,,,1,3,,,,0.001789241,FAIL
2014,,42:39.1,44:08.3,0 days 00:01:29.229078,3,64,,,1,5,9,10,9,4,2,,,,,,,,,,,,,,,,,,,,,,,,,,,,,,,,,,,,6,6,mixed,,,,5,,,,1,1,,,,0.001430994,FAIL
2015,,44:08.3,45:49.1,0 days 00:01:40.819905,4,96,128,8,3,2,,,,,,,,,,,,,,,,,,,,,7,6,10,,,,,,,,,,,,,,,,,,7,8,normal,normal,mixed,,,,3,,3,3,1,2,,0.007937564,FAIL
2016,410.434082,45:49.1,47:25.9,0 days 00:01:36.794245,3,32,,,1,4,,,,,,,,,,,5,8,6,4,8,10,7,9,5,4,,,,,,,,,,,,,,,,,,,,,7,6,normal,mixed,,,,10,,,2,5,1,,,0.006105543,COMPLETE
2017,3553.286865,47:25.9,49:04.1,0 days 00:01:38.182506,4,16,96,,2,3,5,6,9,9,6,5,9,5,4,9,,,,,,,,,,,,,,,,,,,,,,,,,,,,,,,3,4,mixed,normal,normal,,10,,,,3,6,3,1,,0.002315365,COMPLETE
2018,3855.538574,49:04.1,50:28.4,0 days 00:01:24.272495,2,128,64,,2,2,,,,,,,,,,,,,,,,,,,,,,,,,,,,,,,,,,,,,,,,,3,5,normal,,,,,,,,1,1,,,,0.001025185,COMPLETE
2019,,50:28.4,52:08.5,0 days 00:01:40.122411,2,8,,,1,2,3,5,6,9,8,7,3,,,,5,6,6,3,4,6,6,6,2,6,,,,,,,,,,,,,,,,,,,,,4,3,mixed,mixed,normal,normal,7,10,,,4,4,7,1,1,0.00564692,FAIL
2020,,52:08.5,53:44.5,0 days 00:01:36.016050,3,32,128,64,3,2,6,4,6,,,,,,,,5,4,6,3,8,3,10,6,,,,,,,,,,,,,,,,,,,,,,,7,4,mixed,mixed,,,3,8,,,2,8,8,,,0.008016747,FAIL
2021,,53:44.5,55:14.4,0 days 00:01:29.893770,1,96,,,1,4,4,4,,,,,,,,,10,8,4,3,8,6,,,,,,,,,,,,,,,,,,,,,,,,,4,3,mixed,mixed,,,2,6,,,2,6,10,,,0.003344828,FAIL
2022,,55:14.4,56:48.3,0 days 00:01:33.925937,2,128,16,,2,4,5,5,,,,,,,,,,,,,,,,,,,7,9,6,10,3,8,,,,,,,,,,,,,,,6,3,mixed,normal,mixed,,2,,6,,3,6,7,5,,0.002334567,FAIL
2023,,56:48.3,58:27.3,0 days 00:01:38.968294,1,64,96,,2,2,6,3,2,,,,,,,,5,3,6,10,7,5,,,,,9,2,9,9,8,8,3,10,,,,,,,,,,,,,3,4,mixed,mixed,mixed,,3,6,8,,3,3,10,8,,0.004182569,FAIL
2024,893.4882202,58:27.3,59:55.3,0 days 00:01:27.955148,4,64,,,1,2,,,,,,,,,,,,,,,,,,,,,3,7,,,,,,,,,,,,,,,,,,,3,4,normal,normal,mixed,,,,2,,3,1,4,7,,0.001372765,COMPLETE
2025,,59:55.3,01:24.6,0 days 00:01:29.319408,2,128,,,1,3,5,6,7,3,3,8,5,3,5,,,,,,,,,,,,,,,,,,,,,,,,,,,,,,,,8,5,mixed,,,,9,,,,1,6,,,,0.006187108,FAIL
2026,,01:24.6,03:10.2,0 days 00:01:45.621646,2,96,64,,2,5,3,9,6,3,6,5,4,9,8,,,,,,,,,,,,8,5,8,4,5,7,4,3,10,8,3,10,2,2,8,5,,,,,7,4,mixed,normal,mixed,mixed,9,,10,6,4,7,8,3,9,0.002107431,FAIL
2027,931.210144,03:10.2,04:42.9,0 days 00:01:32.655053,3,32,128,8,3,4,,,,,,,,,,,7,9,2,5,3,8,,,,,,,,,,,,,,,,,,,,,,,,,6,5,normal,mixed,,,,6,,,2,1,8,,,0.001125092,COMPLETE
2028,1199.598755,04:42.9,06:12.5,0 days 00:01:29.646040,4,8,16,,2,4,7,4,5,8,,,,,,,,,,,,,,,,,,,,,,,,,,,,,,,,,,,,,5,5,mixed,normal,,,4,,,,2,8,5,,,0.009897091,COMPLETE
2029,,06:12.5,07:52.6,0 days 00:01:40.086372,2,32,,,1,4,,,,,,,,,,,9,10,10,5,2,,,,,,8,10,9,2,6,,,,,,,,,,,,,,,,3,6,normal,mixed,mixed,,,5,5,,3,10,4,2,,0.003779844,FAIL
2030,,07:52.6,09:31.7,0 days 00:01:39.092421,2,16,8,32,3,3,,,,,,,,,,,5,7,4,10,10,2,6,,,,8,,,,,,,,,,,,,,,,,,,,6,8,normal,mixed,mixed,,,7,1,,3,7,10,9,,0.001071416,FAIL
2031,,09:31.7,11:13.8,0 days 00:01:42.091538,1,96,64,,2,5,,,,,,,,,,,5,9,8,9,7,3,2,,,,8,8,7,9,7,,,,,,,,,,,,,,,,7,7,normal,mixed,mixed,,,7,5,,3,2,3,5,,0.007466913,FAIL
2032,,11:13.8,12:57.2,0 days 00:01:43.349993,2,8,8,,2,4,7,2,9,6,9,3,8,5,,,4,9,7,10,6,,,,,,,,,,,,,,,,,,,,,,,,,,3,8,mixed,mixed,normal,,8,5,,,3,10,10,3,,0.002847087,FAIL
2033,,12:57.2,14:38.6,0 days 00:01:41.476363,4,96,32,8,3,3,4,2,9,8,10,,,,,,6,4,5,10,2,6,8,4,7,10,,,,,,,,,,,,,,,,,,,,,5,6,mixed,mixed,,,5,10,,,2,10,10,,,0.003172964,FAIL
2034,,14:38.6,16:17.6,0 days 00:01:38.938985,2,96,32,128,3,5,2,5,10,9,8,2,3,4,6,10,8,,,,,,,,,,,,,,,,,,,,,,,,,,,,,,4,4,mixed,mixed,normal,,10,1,,,3,6,10,3,,0.002760803,FAIL
2035,693.4052734,16:17.6,17:39.4,0 days 00:01:21.782604,4,16,16,,2,3,,,,,,,,,,,,,,,,,,,,,,,,,,,,,,,,,,,,,,,,,7,3,normal,,,,,,,,1,10,,,,0.001122162,COMPLETE
2036,,17:39.4,19:19.7,0 days 00:01:40.366612,4,16,96,,2,5,2,5,3,2,4,5,3,8,8,,,,,,,,,,,,,,,,,,,,,,,,,,,,,,,,7,8,mixed,normal,normal,,9,,,,3,6,2,3,,0.001252515,FAIL
2037,,19:19.7,20:53.7,0 days 00:01:33.916489,4,32,96,,2,3,4,10,10,2,5,,,,,,,,,,,,,,,,,,,,,,,,,,,,,,,,,,,,6,5,mixed,normal,normal,,5,,,,3,1,6,8,,0.002182923,FAIL
2038,,20:53.7,22:29.9,0 days 00:01:36.256346,3,32,16,8,3,4,,,,,,,,,,,7,9,5,9,,,,,,,,,,,,,,,,,,,,,,,,,,,8,6,normal,mixed,normal,,,4,,,3,2,4,10,,0.002562335,FAIL
2039,,22:29.9,24:10.1,0 days 00:01:40.211493,1,96,,,1,3,3,4,9,3,5,,,,,,,,,,,,,,,,4,10,10,,,,,,,,,,,,,,,,,,5,8,mixed,normal,mixed,normal,5,,3,,4,3,3,3,1,0.009499697,FAIL
2040,,24:10.1,25:45.1,0 days 00:01:34.987661,4,96,16,96,3,2,6,9,2,7,9,8,9,8,,,,,,,,,,,,,,,,,,,,,,,,,,,,,,,,,8,6,mixed,,,,8,,,,1,5,,,,0.008925345,FAIL
2041,,25:45.1,27:25.2,0 days 00:01:40.056750,1,16,8,8,3,3,8,9,5,10,,,,,,,,,,,,,,,,,,,,,,,,,,,5,7,4,,,,,,,,7,6,mixed,normal,normal,mixed,4,,,3,4,8,5,7,10,0.007725206,FAIL
2042,,27:25.2,29:08.4,0 days 00:01:43.262379,4,8,16,128,3,3,3,5,7,7,10,7,9,5,,,7,7,9,4,2,9,4,5,8,,,,,,,,,,,,,,,,,,,,,,4,5,mixed,mixed,,,8,9,,,2,7,7,,,0.005520181,FAIL
2043,,29:08.4,30:48.1,0 days 00:01:39.631324,4,32,96,,2,5,3,10,4,3,4,8,,,,,6,7,2,2,6,9,9,,,,,,,,,,,,,,,,,,,,,,,,6,4,mixed,mixed,,,6,7,,,2,8,1,,,0.001172544,FAIL
2044,,30:48.1,32:21.5,0 days 00:01:33.416454,1,128,128,16,3,2,5,3,4,4,9,6,,,,,,,,,,,,,,,,,,,,,,,,,,,,,,,,,,,7,8,mixed,,,,6,,,,1,2,,,,0.002289516,FAIL
