number,value,datetime_start,datetime_complete,duration,params_gat_heads,params_gat_hidden_0,params_gat_hidden_1,params_gat_hidden_2,params_gat_layers,params_gat_out,params_kan_arity_0_0,params_kan_arity_0_1,params_kan_arity_0_2,params_kan_arity_0_3,params_kan_arity_0_4,params_kan_arity_0_5,params_kan_arity_0_6,params_kan_arity_0_7,params_kan_arity_0_8,params_kan_arity_0_9,params_kan_arity_1_0,params_kan_arity_1_1,params_kan_arity_1_2,params_kan_arity_1_3,params_kan_arity_1_4,params_kan_arity_1_5,params_kan_arity_1_6,params_kan_arity_1_7,params_kan_arity_1_8,params_kan_arity_1_9,params_kan_arity_2_0,params_kan_arity_2_1,params_kan_arity_2_2,params_kan_arity_2_3,params_kan_arity_2_4,params_kan_arity_2_5,params_kan_arity_2_6,params_kan_arity_2_7,params_kan_arity_2_8,params_kan_arity_2_9,params_kan_arity_3_0,params_kan_arity_3_1,params_kan_arity_3_2,params_kan_arity_3_3,params_kan_arity_3_4,params_kan_arity_3_5,params_kan_arity_3_6,params_kan_arity_3_7,params_kan_arity_3_8,params_kan_arity_3_9,params_kan_grid,params_kan_k,params_kan_layer_type_0,params_kan_layer_type_1,params_kan_layer_type_2,params_kan_layer_type_3,params_kan_mult_nodes_0,params_kan_mult_nodes_1,params_kan_mult_nodes_2,params_kan_mult_nodes_3,params_kan_n_layers,params_kan_neurons_0,params_kan_neurons_1,params_kan_neurons_2,params_kan_neurons_3,params_lr,state
1316,,13:51.1,18:02.4,0 days 00:04:11.242527,2,96,8,16,3,5,10,4,9,6,2,5,2,10,,,3,7,10,6,10,10,10,10,5,5,8,10,2,5,4,10,10,,,,,,,,,,,,,,8,3,mixed,mixed,mixed,normal,8,10,7,,4,9,8,9,4,0.004600121,FAIL
1317,,18:02.4,22:11.6,0 days 00:04:09.190431,2,96,8,16,3,5,10,4,10,6,2,5,3,10,,,3,7,10,6,10,10,10,10,5,5,8,10,2,5,4,10,10,,,,,,,,,,,,,,8,3,mixed,mixed,mixed,normal,8,10,7,,4,9,8,9,10,0.004642295,FAIL
1318,,22:11.6,26:23.6,0 days 00:04:12.063262,2,96,8,16,3,5,10,4,9,6,2,5,3,10,,,3,7,10,6,10,8,10,10,5,5,8,10,2,5,4,4,10,,,,,,,,,,,,,,8,3,mixed,mixed,mixed,normal,8,10,7,,4,9,8,9,4,0.001246084,FAIL
1319,,26:23.6,30:33.6,0 days 00:04:09.961033,2,96,8,16,3,5,10,4,10,6,2,5,3,9,,,3,7,10,6,10,9,10,10,5,5,8,10,2,5,4,10,10,,,,,,,,,,,,,,8,3,mixed,mixed,mixed,normal,8,10,7,,4,9,8,9,10,0.004460321,FAIL
1320,,30:33.6,34:46.2,0 days 00:04:12.643267,2,96,8,16,3,5,9,4,10,6,2,5,2,10,,,3,7,10,6,10,10,10,10,5,5,8,10,2,5,4,4,10,,,,,,,,,,,,,,8,3,mixed,mixed,mixed,normal,8,10,7,,4,9,8,9,10,0.001258262,FAIL
1321,,34:46.2,38:58.3,0 days 00:04:12.022520,2,96,8,16,3,5,10,5,10,6,2,5,2,10,,,3,7,10,6,10,10,10,10,5,5,8,10,2,5,4,10,10,,,,,,,,,,,,,,8,3,mixed,mixed,mixed,normal,8,10,7,,4,9,8,9,10,0.004396026,FAIL
1322,,38:58.3,43:11.0,0 days 00:04:12.688335,2,96,8,16,3,5,10,4,10,6,2,5,2,10,,,3,7,10,6,10,10,10,10,5,5,8,10,2,5,4,10,10,,,,,,,,,,,,,,8,3,mixed,mixed,mixed,normal,8,10,7,,4,9,8,9,4,0.004411184,FAIL
1323,,43:11.0,47:22.3,0 days 00:04:11.308407,2,96,8,16,3,5,10,4,10,6,2,5,3,10,,,3,7,10,6,10,10,10,10,5,5,8,10,2,5,4,10,10,10,,,,,,,,,,,,,8,3,mixed,mixed,mixed,normal,8,10,8,,4,9,8,9,10,0.001253842,FAIL
1324,,47:22.3,51:32.7,0 days 00:04:10.395351,2,96,8,16,3,5,9,4,10,6,2,5,2,10,,,3,7,5,6,10,10,10,10,5,5,8,10,2,5,4,10,10,,,,,,,,,,,,,,8,3,mixed,mixed,mixed,normal,8,10,7,,4,9,8,9,10,0.005039169,FAIL
1325,,51:32.7,55:44.1,0 days 00:04:11.439870,2,96,8,16,3,5,10,4,10,6,2,5,2,10,,,3,7,10,6,10,10,10,10,5,5,8,10,2,5,4,10,10,,,,,,,,,,,,,,8,3,mixed,mixed,mixed,normal,8,10,7,,4,9,8,9,4,0.004458888,FAIL
1326,,55:44.1,59:54.8,0 days 00:04:10.714001,2,96,8,16,3,5,10,4,10,6,2,5,3,10,,,3,7,10,6,10,10,10,10,5,5,8,10,2,5,4,10,10,,,,,,,,,,,,,,8,3,mixed,mixed,mixed,normal,8,10,7,,4,9,8,9,10,0.004659725,FAIL
1327,,59:54.8,04:06.2,0 days 00:04:11.385094,2,96,8,16,3,5,10,4,8,6,2,5,2,10,,,3,7,10,6,10,10,10,10,5,,8,10,2,5,4,10,10,,,,,,,,,,,,,,8,3,mixed,mixed,mixed,normal,8,9,7,,4,9,8,9,4,0.001251187,FAIL
1328,,04:06.2,08:16.5,0 days 00:04:10.307079,2,96,8,16,3,5,10,4,9,6,2,5,3,10,,,3,7,5,6,10,10,10,10,5,5,8,10,2,5,4,10,10,,,,,,,,,,,,,,8,3,mixed,mixed,mixed,normal,8,10,7,,4,9,8,9,10,0.004592823,FAIL
1329,,08:16.5,12:30.1,0 days 00:04:13.529478,2,96,8,16,3,5,10,4,10,6,2,5,4,10,,,3,7,5,6,10,10,10,10,5,5,8,10,2,5,4,4,10,,,,,,,,,,,,,,8,3,mixed,mixed,mixed,normal,8,10,7,,4,9,8,9,10,0.007227811,FAIL
1330,,12:30.1,16:41.3,0 days 00:04:11.214573,2,96,8,16,3,5,10,4,9,6,2,5,3,10,,,3,7,10,6,10,10,10,10,5,5,8,10,2,5,4,10,10,,,,,,,,,,,,,,8,3,mixed,mixed,mixed,normal,8,10,7,,4,9,8,9,10,0.001241671,FAIL
1331,,16:41.3,20:53.7,0 days 00:04:12.410753,2,96,8,16,3,5,10,4,10,6,2,5,4,10,,,3,7,10,6,10,10,10,10,5,5,8,10,2,5,4,10,10,,,,,,,,,,,,,,8,3,mixed,mixed,mixed,normal,8,10,7,,4,9,8,9,10,0.002861418,FAIL
1332,,20:53.7,25:04.4,0 days 00:04:10.654752,2,96,8,16,3,5,10,4,9,6,2,5,2,10,,,3,7,10,6,10,9,10,10,5,5,8,10,2,5,4,10,10,,,,,,,,,,,,,,8,3,mixed,mixed,mixed,normal,8,10,7,,4,9,8,9,10,0.004742825,FAIL
1333,,25:04.4,29:16.5,0 days 00:04:12.177572,2,96,8,16,3,5,10,4,10,6,2,5,2,10,,,3,7,10,6,10,10,10,10,5,5,8,10,2,5,4,10,10,,,,,,,,,,,,,,8,3,mixed,mixed,mixed,normal,8,10,7,,4,9,8,9,10,0.004816941,FAIL
1334,,29:16.5,33:28.2,0 days 00:04:11.616821,2,96,8,16,3,5,10,4,10,6,2,5,2,10,,,3,7,10,6,10,9,10,10,5,5,8,10,2,5,4,10,10,,,,,,,,,,,,,,8,3,mixed,mixed,mixed,normal,8,10,7,,4,9,8,9,10,0.004252132,FAIL
1335,,33:28.2,37:43.0,0 days 00:04:14.868741,2,96,8,16,3,5,10,4,10,6,2,5,2,10,,,3,7,10,6,10,10,10,10,5,,8,10,2,5,4,10,10,10,,,,,,,,,,,,,8,3,mixed,mixed,mixed,normal,8,9,8,,4,9,8,9,10,0.004210715,FAIL
1336,,37:43.0,41:54.8,0 days 00:04:11.773162,2,96,8,16,3,5,10,4,10,6,2,5,2,10,,,3,7,10,6,10,10,10,10,6,5,8,10,2,5,4,10,10,,,,,,,,,,,,,,8,3,mixed,mixed,mixed,normal,8,10,7,,4,9,8,9,10,0.004965838,FAIL
1337,,41:54.8,46:05.3,0 days 00:04:10.444089,2,96,8,16,3,5,10,5,10,6,2,5,2,10,,,3,7,10,6,10,10,10,10,5,5,8,10,2,5,4,10,10,,,,,,,,,,,,,,8,3,mixed,mixed,mixed,normal,8,10,7,,4,9,8,9,10,0.004561637,FAIL
1338,,46:05.3,50:16.3,0 days 00:04:11.075543,2,96,8,16,3,5,10,4,9,6,2,5,2,10,,,3,7,10,6,10,10,10,10,5,5,8,10,2,5,4,10,10,,,,,,,,,,,,,,8,3,mixed,mixed,mixed,normal,8,10,7,,4,9,8,9,10,0.004689229,FAIL
1339,,50:16.3,54:30.5,0 days 00:04:14.149692,2,96,8,16,3,5,10,4,10,6,2,5,2,10,,,3,7,10,6,10,9,10,10,5,5,8,10,2,5,4,4,10,,,,,,,,,,,,,,8,3,mixed,mixed,mixed,normal,8,10,7,,4,9,8,9,10,0.005007331,FAIL
1340,,54:30.5,58:44.8,0 days 00:04:14.267734,2,96,8,16,3,5,10,4,8,6,2,5,2,10,8,,3,7,10,6,10,10,10,10,5,5,8,10,2,5,4,10,10,,,,,,,,,,,,,,8,3,mixed,mixed,mixed,normal,9,10,7,,4,9,8,9,10,0.001238268,FAIL
1341,,58:44.8,02:59.5,0 days 00:04:14.690471,2,96,8,16,3,5,10,4,9,6,2,5,2,10,,,3,7,10,6,10,9,10,10,5,5,8,10,2,5,4,10,10,,,,,,,,,,,,,,8,3,mixed,mixed,mixed,normal,8,10,7,,4,9,8,9,10,0.001259899,FAIL
1342,,02:59.5,07:13.2,0 days 00:04:13.772135,2,96,8,16,3,5,10,4,8,6,2,5,2,10,,,3,7,10,6,10,10,10,10,5,5,8,10,4,5,4,10,10,,,,,,,,,,,,,,8,3,mixed,mixed,mixed,normal,8,10,7,,4,9,8,9,10,0.004646367,FAIL
1343,,07:13.2,11:26.4,0 days 00:04:13.190535,2,96,8,16,3,5,10,4,5,6,2,5,2,10,,,3,7,10,6,10,10,10,10,5,5,8,10,2,5,4,10,10,,,,,,,,,,,,,,8,3,mixed,mixed,mixed,normal,8,10,7,,4,9,2,9,10,0.004492301,FAIL
1344,,11:26.4,15:41.2,0 days 00:04:14.715126,2,96,8,16,3,5,10,4,10,6,2,5,2,10,,,3,7,10,6,10,10,10,10,5,5,8,10,2,5,4,10,10,,,,,,,,,,,,,,8,3,mixed,mixed,mixed,normal,8,10,7,,4,9,8,9,10,0.004652789,FAIL
1345,,15:41.2,19:54.7,0 days 00:04:13.497815,2,96,8,16,3,5,10,4,10,6,2,5,2,10,,,3,7,10,6,10,10,10,10,5,5,8,10,2,5,4,10,10,,,,,,,,,,,,,,8,3,mixed,mixed,mixed,normal,8,10,7,,4,9,8,9,10,0.004712716,FAIL
1346,,19:54.7,24:06.1,0 days 00:04:11.438082,2,96,8,16,3,5,10,4,9,6,2,5,2,10,,,3,7,10,5,10,8,10,10,5,5,8,10,4,5,4,10,10,,,,,,,,,,,,,,8,3,mixed,mixed,mixed,normal,8,10,7,,4,10,2,9,10,0.00122586,FAIL
1347,,24:06.1,28:18.5,0 days 00:04:12.392596,2,96,8,16,3,5,10,4,10,6,2,5,2,10,,,3,7,5,6,10,9,10,10,5,5,8,10,2,5,4,10,10,,,,,,,,,,,,,,8,3,mixed,mixed,mixed,normal,8,10,7,,4,9,8,9,4,0.004375642,FAIL
1348,,28:18.5,32:31.2,0 days 00:04:12.733230,2,96,8,16,3,5,10,4,10,6,2,5,2,10,,,3,7,5,6,10,10,10,10,5,5,8,10,2,5,4,10,10,,,,,,,,,,,,,,8,3,mixed,mixed,mixed,normal,8,10,7,,4,9,8,9,10,0.004712162,FAIL
1349,,32:31.2,36:44.5,0 days 00:04:13.280103,2,96,8,16,3,5,10,4,10,6,2,5,2,10,9,,3,7,10,6,10,10,10,10,5,5,8,10,2,5,4,10,10,,,,,,,,,,,,,,8,4,mixed,mixed,mixed,normal,9,10,7,,4,9,8,9,10,0.0042325,FAIL
1350,,36:44.5,40:58.3,0 days 00:04:13.767453,2,96,8,16,3,5,10,4,10,6,2,5,2,10,,,3,7,10,6,10,10,10,10,5,4,8,10,2,5,4,10,10,,,,,,,,,,,,,,8,3,mixed,mixed,mixed,normal,8,10,7,,4,9,8,9,10,0.004670196,FAIL
1351,,40:58.3,45:10.2,0 days 00:04:11.889995,2,96,8,16,3,5,10,4,10,6,2,5,2,10,,,3,7,10,6,10,10,10,10,5,5,8,10,2,5,4,10,10,,,,,,,,,,,,,,8,3,mixed,mixed,mixed,normal,8,10,7,,4,9,8,9,10,0.004666109,FAIL
1352,,45:10.2,49:25.1,0 days 00:04:14.889970,2,96,8,16,3,5,10,4,10,6,2,10,2,10,,,3,7,10,6,10,10,10,10,5,5,8,10,2,5,4,10,10,,,,,,,,,,,,,,8,3,mixed,mixed,mixed,normal,8,10,7,,4,9,8,9,10,0.00459148,FAIL
1353,,49:25.1,53:39.0,0 days 00:04:13.949158,2,96,8,16,3,5,10,4,10,6,2,5,3,10,,,3,7,10,6,10,10,10,10,5,5,8,10,2,5,4,10,10,,,,,,,,,,,,,,8,3,mixed,mixed,mixed,normal,8,10,7,,4,9,8,9,10,0.004723226,FAIL
1354,,53:39.0,57:53.4,0 days 00:04:14.403852,2,96,8,16,3,5,10,4,9,6,2,5,2,10,,,3,7,10,6,10,10,10,10,5,5,8,10,2,5,4,4,10,,,,,,,,,,,,,,8,3,mixed,mixed,mixed,normal,8,10,7,,4,9,8,9,10,0.004551366,FAIL
1355,,57:53.4,02:10.4,0 days 00:04:16.964402,2,96,8,16,3,5,10,4,10,6,2,5,3,10,,,3,7,5,6,10,10,10,10,5,5,8,10,2,5,4,4,10,,,,,,,,,,,,,,8,3,mixed,mixed,mixed,normal,8,10,7,,4,9,8,9,10,0.004626113,FAIL
1356,,02:10.4,06:22.5,0 days 00:04:12.081691,2,96,8,16,3,5,10,4,10,6,2,5,2,10,,,3,7,10,6,10,9,10,10,5,5,8,10,2,5,4,10,10,,,,,,,,,,,,,,8,3,mixed,mixed,mixed,normal,8,10,7,,4,9,8,9,10,0.001266788,FAIL
1357,,06:22.5,10:34.3,0 days 00:04:11.848054,2,96,8,16,3,5,10,4,10,6,2,5,2,10,,,3,7,10,6,10,10,10,10,5,5,8,10,2,5,4,10,10,,,,,,,,,,,,,,8,3,mixed,mixed,mixed,normal,8,10,7,,4,9,8,9,10,0.004614324,FAIL
1358,,10:34.3,14:45.8,0 days 00:04:11.444932,2,96,8,16,3,5,10,4,10,6,2,5,2,10,,,3,7,7,6,10,9,10,10,5,5,8,10,2,5,4,10,10,,,,,,,,,,,,,,8,3,mixed,mixed,mixed,normal,8,10,7,,4,9,8,9,10,0.004429132,FAIL
1359,,14:45.8,18:58.7,0 days 00:04:12.864014,2,96,8,16,3,5,10,4,9,6,2,5,3,10,,,3,7,10,6,10,10,10,10,5,5,8,10,2,5,4,10,10,,,,,,,,,,,,,,8,3,mixed,mixed,mixed,normal,8,10,7,,4,9,8,9,10,0.004407546,FAIL
1360,,18:58.7,23:12.2,0 days 00:04:13.501428,2,96,8,16,3,5,10,5,8,6,2,5,2,10,8,,3,7,5,6,10,9,10,10,5,5,8,10,2,5,4,10,10,,,,,,,,,,,,,,8,3,mixed,mixed,mixed,normal,9,10,7,,4,9,8,9,10,0.00284187,FAIL
1361,,23:12.2,27:23.7,0 days 00:04:11.526542,2,96,8,16,3,5,10,4,10,6,2,5,3,10,,,3,7,5,5,10,10,10,10,5,5,8,10,2,5,4,10,10,,,,,,,,,,,,,,8,3,mixed,mixed,mixed,normal,8,10,7,,4,9,8,9,10,0.004427932,FAIL
1362,,27:23.7,31:39.5,0 days 00:04:15.845857,4,96,8,16,3,5,10,4,10,6,2,5,2,10,,,3,7,10,6,10,10,10,10,5,5,8,10,2,5,4,10,10,,,,,,,,,,,,,,8,3,mixed,mixed,mixed,normal,8,10,7,,4,9,8,9,10,0.003031207,FAIL
1363,,31:39.5,35:51.1,0 days 00:04:11.580635,2,96,8,16,3,5,10,4,9,6,2,5,2,10,,,3,7,10,6,10,10,10,10,5,5,8,10,2,5,4,10,10,,,,,,,,,,,,,,8,3,mixed,mixed,mixed,normal,8,10,7,,4,9,8,9,10,0.004690272,FAIL
1364,,35:51.1,40:03.6,0 days 00:04:12.442129,2,96,8,16,3,5,10,4,10,6,2,5,3,10,,,3,7,10,6,10,10,10,10,5,5,8,10,2,5,4,10,10,,,,,,,,,,,,,,8,3,mixed,mixed,mixed,normal,8,10,7,,4,9,8,9,10,0.004651219,FAIL
1365,,40:03.6,44:15.6,0 days 00:04:12.019347,2,96,8,16,3,5,10,5,10,6,2,10,2,10,,,3,7,10,6,10,10,10,10,5,5,8,10,2,5,4,4,10,,,,,,,,,,,,,,8,3,mixed,mixed,mixed,normal,8,10,7,,4,9,8,9,10,0.004780175,FAIL
1366,,44:15.6,48:28.2,0 days 00:04:12.590360,2,96,8,16,3,5,10,4,10,6,2,5,2,10,,,3,7,10,6,10,10,10,10,5,5,8,10,2,5,4,4,10,,,,,,,,,,,,,,8,3,mixed,mixed,mixed,normal,8,10,7,,4,9,8,9,10,0.004606682,FAIL
1367,,48:28.2,52:39.5,0 days 00:04:11.324033,2,96,8,16,3,5,10,4,10,6,2,5,2,10,,,3,7,10,6,10,9,10,10,5,5,8,10,2,5,4,10,10,,,,,,,,,,,,,,8,3,mixed,mixed,mixed,normal,8,10,7,,4,9,8,9,10,0.001247123,FAIL
1368,,52:39.5,56:53.0,0 days 00:04:13.523270,2,96,8,16,3,5,10,4,9,6,2,5,4,10,,,3,7,10,6,10,10,10,10,5,5,8,10,2,5,4,5,10,,,,,,,,,,,,,,8,3,mixed,mixed,mixed,normal,8,10,7,,4,9,2,9,10,0.001226899,FAIL
1369,,56:53.0,01:04.7,0 days 00:04:11.673016,2,96,8,16,3,5,10,4,10,6,2,5,2,10,,,3,7,5,6,10,10,10,10,5,5,8,10,4,5,4,10,10,,,,,,,,,,,,,,8,3,mixed,mixed,mixed,normal,8,10,7,,4,9,8,9,10,0.004817012,FAIL
1370,,01:04.7,05:16.9,0 days 00:04:12.136762,2,96,8,16,3,5,10,4,10,6,2,5,2,10,,,3,7,10,6,10,10,10,10,5,5,8,10,2,5,4,10,10,,,,,,,,,,,,,,8,3,mixed,mixed,mixed,normal,8,10,7,,4,9,8,9,10,0.004610368,FAIL
1371,,05:16.9,09:28.8,0 days 00:04:11.911039,2,96,8,16,3,5,10,4,9,6,2,5,2,10,,,3,7,10,6,10,10,10,10,5,5,8,10,2,5,4,4,10,,,,,,,,,,,,,,8,3,mixed,mixed,mixed,normal,8,10,7,,4,9,8,9,10,0.004553881,FAIL
1372,,09:28.8,13:41.1,0 days 00:04:12.345048,2,96,8,16,3,5,10,4,10,6,2,5,2,10,,,3,7,10,6,10,10,10,10,5,5,8,10,2,5,4,10,10,,,,,,,,,,,,,,8,3,mixed,mixed,mixed,normal,8,10,7,,4,9,8,9,10,0.004612022,FAIL
1373,,13:41.1,17:54.0,0 days 00:04:12.868085,2,96,8,16,3,5,9,4,9,6,2,5,2,10,,,3,7,10,6,10,9,10,10,5,5,8,10,2,5,5,10,10,,,,,,,,,,,,,,8,3,mixed,mixed,mixed,normal,8,10,7,,4,9,8,9,10,0.001225463,FAIL
1374,,17:54.0,22:07.0,0 days 00:04:12.953242,2,96,8,16,3,5,10,4,10,6,2,5,2,9,,,3,7,10,6,10,10,10,10,5,5,8,10,2,5,4,10,10,,,,,,,,,,,,,,8,3,mixed,mixed,mixed,normal,8,10,7,,4,9,8,9,10,0.004731716,FAIL
1375,,22:07.0,26:14.3,0 days 00:04:07.375924,2,96,8,16,3,5,10,4,10,6,2,10,3,10,,,3,7,10,6,10,10,10,10,5,5,8,10,2,5,4,10,10,,,,,,,,,,,,,,8,3,mixed,mixed,mixed,normal,8,10,7,,4,9,8,9,10,0.002811895,FAIL
1376,,26:14.3,30:24.8,0 days 00:04:10.502386,2,96,8,16,3,5,10,4,10,6,2,5,2,10,,,3,7,5,6,10,10,10,10,5,5,8,10,2,5,4,10,10,,,,,,,,,,,,,,8,3,mixed,mixed,mixed,normal,8,10,7,,4,9,8,9,10,0.001242816,FAIL
1377,,30:24.8,34:36.5,0 days 00:04:11.693584,2,96,8,16,3,5,10,4,10,6,2,5,2,9,,,3,7,10,6,10,9,10,10,5,5,8,10,2,5,4,10,10,,,,,,,,,,,,,,8,3,mixed,mixed,mixed,normal,8,10,7,,4,9,8,9,10,0.002967456,FAIL
1378,,34:36.5,38:47.4,0 days 00:04:10.900776,2,96,8,16,3,5,10,4,8,6,2,5,2,10,,,3,7,10,6,10,9,10,10,5,5,8,10,2,5,4,10,10,,,,,,,,,,,,,,8,3,mixed,mixed,mixed,normal,8,10,7,,4,9,8,9,10,0.00460663,FAIL
1379,,38:47.4,42:57.2,0 days 00:04:09.710764,2,96,8,16,3,5,10,4,10,6,2,5,2,10,10,,3,7,10,6,10,10,10,10,5,5,8,10,2,5,4,10,10,,,,,,,,,,,,,,8,3,mixed,mixed,mixed,normal,9,10,7,,4,9,8,9,10,0.004705121,FAIL
1380,,42:57.2,47:07.8,0 days 00:04:10.593746,2,96,8,16,3,5,10,4,10,6,2,5,2,9,,,3,7,10,6,10,10,10,10,5,5,8,10,2,5,4,10,10,,,,,,,,,,,,,,8,3,mixed,mixed,mixed,normal,8,10,7,,4,9,8,9,10,0.001247439,FAIL
1381,,47:07.8,51:15.8,0 days 00:04:08.034354,2,96,8,16,3,5,10,4,9,6,2,5,2,10,,,3,7,5,6,10,9,10,10,5,4,8,10,4,5,4,10,10,,,,,,,,,,,,,,8,3,mixed,mixed,mixed,normal,8,10,7,,4,9,8,9,10,0.004439895,FAIL
1382,,51:15.8,55:29.1,0 days 00:04:13.292250,2,96,8,16,3,5,10,4,10,6,2,5,2,10,,,3,7,10,6,10,9,10,10,5,5,8,10,2,5,5,4,10,,,,,,,,,,,,,,8,3,mixed,mixed,mixed,normal,8,10,7,,4,9,8,9,10,0.004631671,FAIL
1383,,55:29.1,59:41.6,0 days 00:04:12.481353,2,96,8,16,3,5,10,4,10,6,2,10,2,10,,,3,7,10,6,10,10,10,10,5,5,8,10,2,5,4,10,10,,,,,,,,,,,,,,8,3,mixed,mixed,mixed,normal,8,10,7,,4,9,8,9,10,0.002861961,FAIL
1384,,59:41.6,03:54.0,0 days 00:04:12.453396,2,96,8,16,3,5,10,4,10,6,2,10,2,10,,,3,7,10,6,10,10,10,9,5,5,8,10,2,5,4,10,10,,,,,,,,,,,,,,8,3,mixed,mixed,mixed,normal,8,10,7,,4,9,8,9,10,0.001226785,FAIL
1385,,03:54.0,08:06.8,0 days 00:04:12.765389,2,96,8,16,3,5,10,4,10,6,2,5,2,10,,,3,7,10,6,10,10,10,10,5,5,8,10,2,5,4,10,10,,,,,,,,,,,,,,8,3,mixed,mixed,mixed,normal,8,10,7,,4,9,8,9,10,0.004531115,FAIL
1386,,08:06.8,12:19.1,0 days 00:04:12.329004,2,96,8,16,3,5,10,5,10,6,2,5,2,10,,,4,7,10,,,,,,,,8,10,2,5,4,10,10,,,,,,,,,,,,,,8,3,mixed,mixed,mixed,normal,8,3,7,,4,9,8,9,10,0.004916839,FAIL
1387,,12:19.1,16:33.1,0 days 00:04:13.994353,2,96,8,16,3,5,10,3,9,6,2,5,2,10,,,3,7,10,6,10,8,10,10,5,5,8,10,2,5,4,10,10,,,,,,,,,,,,,,8,3,mixed,mixed,mixed,normal,8,10,7,,4,9,8,9,10,0.00123577,FAIL
1388,,16:33.1,20:45.6,0 days 00:04:12.425790,2,96,8,16,3,5,10,4,10,6,2,5,2,10,,,3,7,10,6,10,9,10,10,5,5,8,10,2,5,4,10,10,,,,,,,,,,,,,,8,3,mixed,mixed,mixed,normal,8,10,7,,4,9,8,9,10,0.00449168,FAIL
1389,,20:45.6,24:57.4,0 days 00:04:11.841209,2,96,8,16,3,5,10,4,10,6,2,5,2,10,,,3,7,10,6,10,10,10,10,5,5,8,10,2,5,4,10,10,,,,,,,,,,,,,,8,3,mixed,mixed,mixed,normal,8,10,7,,4,9,8,9,10,0.001255524,FAIL
1390,,24:57.4,29:07.6,0 days 00:04:10.199260,2,96,8,16,3,5,10,4,9,6,2,5,2,10,,,3,7,10,6,10,10,10,10,5,5,8,10,2,5,4,10,10,,,,,,,,,,,,,,8,3,mixed,mixed,mixed,normal,8,10,7,,4,9,8,9,10,0.001242094,FAIL
1391,,29:07.6,33:19.5,0 days 00:04:11.891437,2,96,8,16,3,5,10,4,9,6,2,5,2,10,,,3,7,10,6,10,10,10,10,5,5,8,10,2,5,4,10,10,,,,,,,,,,,,,,8,3,mixed,mixed,mixed,normal,8,10,7,,4,9,8,9,10,0.002861616,FAIL
1392,,33:19.5,37:32.7,0 days 00:04:13.220786,2,96,8,16,3,5,9,4,10,6,2,5,2,10,,,3,7,10,6,10,9,10,10,5,5,8,10,4,5,4,10,2,,,,,,,,,,,,,,8,3,mixed,mixed,mixed,normal,8,10,7,,4,9,8,9,10,0.004510161,FAIL
1393,,37:32.7,41:45.0,0 days 00:04:12.282578,2,96,8,16,3,5,10,4,10,6,2,5,2,10,,,3,7,10,6,10,10,9,10,5,5,8,10,2,5,4,10,10,,,,,,,,,,,,,,8,3,mixed,mixed,mixed,normal,8,10,7,,4,9,8,9,10,0.004633767,FAIL
1394,,41:45.0,45:58.9,0 days 00:04:13.916576,2,96,8,16,3,5,10,4,10,6,2,5,2,10,,,3,7,5,6,10,10,10,10,5,5,8,10,2,5,4,4,10,,,,,,,,,,,,,,8,3,mixed,mixed,mixed,normal,8,10,7,,4,9,8,9,10,0.004536114,FAIL
1395,,45:58.9,50:08.2,0 days 00:04:09.275437,2,96,8,16,3,5,10,4,10,6,2,5,2,10,,,3,7,10,6,10,10,10,10,5,5,8,10,2,5,4,10,10,,,,,,,,,,,,,,8,3,mixed,mixed,mixed,normal,8,10,7,,4,9,8,9,10,0.004446274,FAIL
1396,,50:08.2,54:19.9,0 days 00:04:11.715111,2,96,8,16,3,5,10,4,10,6,2,5,2,10,,,3,7,5,6,10,10,10,10,5,5,8,10,2,5,4,10,10,,,,,,,,,,,,,,8,3,mixed,mixed,mixed,normal,8,10,7,,4,9,8,9,10,0.004660962,FAIL
1397,,54:19.9,58:32.7,0 days 00:04:12.791660,2,96,8,16,3,5,10,4,10,5,2,5,2,10,,,3,7,10,5,10,10,10,10,5,5,8,10,2,5,4,10,10,,,,,,,,,,,,,,8,3,mixed,mixed,mixed,normal,8,10,7,,4,9,2,9,10,0.002990575,FAIL
1398,,58:32.7,02:46.2,0 days 00:04:13.488489,2,96,8,16,3,5,10,5,10,6,2,5,2,10,,,3,7,5,6,10,10,10,10,5,5,8,10,2,5,5,10,10,,,,,,,,,,,,,,8,3,mixed,mixed,mixed,normal,8,10,7,,4,9,8,9,10,0.004508343,FAIL
1399,,02:46.2,06:59.7,0 days 00:04:13.450542,2,96,8,16,3,5,10,4,10,5,2,5,2,10,9,,3,7,10,6,10,10,10,10,5,5,8,10,2,5,4,10,10,,,,,,,,,,,,,,8,3,mixed,mixed,mixed,normal,9,10,7,,4,10,8,9,10,0.004679869,FAIL
1400,,06:59.7,11:11.5,0 days 00:04:11.811670,2,96,8,16,3,5,10,4,10,6,2,5,3,10,,,3,7,10,6,10,10,10,10,5,,8,10,2,5,4,10,10,,,,,,,,,,,,,,8,3,mixed,mixed,mixed,normal,8,9,7,,4,9,8,9,4,0.00125732,FAIL
1401,,11:11.5,15:22.0,0 days 00:04:10.534787,2,96,8,16,3,5,10,4,10,6,2,5,2,10,,,3,7,10,6,10,9,10,10,5,5,8,10,2,5,4,10,10,,,,,,,,,,,,,,8,3,mixed,mixed,mixed,normal,8,10,7,,4,9,8,9,10,0.004510474,FAIL
1402,,15:22.0,19:32.0,0 days 00:04:09.948703,2,96,8,16,3,5,10,4,10,6,2,5,2,10,,,3,7,10,6,10,9,10,10,5,5,8,10,2,5,4,10,10,,,,,,,,,,,,,,8,3,mixed,mixed,mixed,normal,8,10,7,,4,9,8,9,10,0.004777615,FAIL
1403,,19:32.0,23:44.3,0 days 00:04:12.308114,2,96,8,16,3,5,9,4,9,6,2,5,2,10,,,3,7,10,6,10,10,10,10,5,5,8,10,2,5,5,10,10,,,,,,,,,,,,,,8,3,mixed,mixed,mixed,normal,8,10,7,,4,9,8,9,10,0.004897519,FAIL
1404,,23:44.3,27:56.3,0 days 00:04:11.943986,2,96,8,16,3,5,10,4,10,6,2,5,2,10,,,3,7,10,6,10,10,10,10,5,5,8,10,2,5,4,10,10,,,,,,,,,,,,,,8,3,mixed,mixed,mixed,normal,8,10,7,,4,9,8,9,10,0.004545246,FAIL
1405,,27:56.3,32:08.5,0 days 00:04:12.267994,2,96,8,16,3,5,10,4,9,6,2,5,2,10,,,3,7,10,6,10,10,10,10,5,5,8,10,2,5,4,10,10,,,,,,,,,,,,,,8,4,mixed,mixed,mixed,normal,8,10,7,,4,9,8,9,10,0.001240805,FAIL
1406,,32:08.5,36:14.7,0 days 00:04:06.155925,2,96,8,16,3,5,10,5,10,6,2,5,2,10,,,3,7,10,6,10,10,10,10,5,5,8,10,2,5,4,10,10,,,,,,,,,,,,,,8,3,mixed,mixed,mixed,normal,8,10,7,,4,9,8,9,10,0.004633129,FAIL
1407,,36:14.7,40:21.6,0 days 00:04:06.880215,2,96,8,16,3,5,9,4,10,6,2,5,2,10,,,3,7,10,6,10,9,10,10,5,5,8,10,2,5,4,10,10,,,,,,,,,,,,,,8,3,mixed,mixed,mixed,normal,8,10,7,,4,9,8,9,10,0.004528183,FAIL
1408,,40:21.6,44:29.0,0 days 00:04:07.475055,2,96,8,16,3,5,10,4,9,6,2,5,2,10,,,3,7,10,6,10,8,10,10,5,5,8,10,2,5,4,10,10,,,,,,,,,,,,,,8,3,mixed,mixed,mixed,normal,8,10,7,,4,9,8,9,10,0.002951266,FAIL
1409,,44:29.1,48:36.0,0 days 00:04:06.941968,2,96,8,16,3,5,9,4,10,6,2,5,2,10,,,3,7,10,6,10,10,10,10,5,5,8,10,2,5,4,4,10,,,,,,,,,,,,,,8,3,mixed,mixed,mixed,normal,8,10,7,,4,9,8,9,10,0.004706367,FAIL
1410,,48:36.0,52:49.6,0 days 00:04:13.582394,2,96,8,16,3,5,10,4,10,6,2,5,2,10,,,3,7,5,6,10,8,10,10,5,5,8,10,2,5,4,4,10,,,,,,,,,,,,,,8,3,mixed,mixed,mixed,normal,8,10,7,,4,9,8,9,4,0.004766614,FAIL
1411,,52:49.6,56:59.2,0 days 00:04:09.645457,2,96,8,16,3,5,10,4,10,6,2,5,2,10,,,3,7,10,6,10,10,10,10,5,5,8,10,2,5,4,10,10,,,,,,,,,,,,,,8,3,mixed,mixed,mixed,normal,8,10,7,,4,9,8,9,10,0.001253943,FAIL
1412,,56:59.2,01:12.0,0 days 00:04:12.739927,2,96,8,16,3,5,10,4,10,6,2,5,2,10,,,3,7,10,6,10,9,10,10,5,,8,10,2,5,4,10,10,,,,,,,,,,,,,,8,3,mixed,mixed,mixed,normal,8,9,7,,4,9,8,9,10,0.001219984,FAIL
1413,,01:12.0,05:25.3,0 days 00:04:13.363148,2,96,8,16,3,5,10,5,10,6,2,5,2,10,,,3,7,10,6,10,10,10,10,5,5,8,10,2,5,4,10,10,,,,,,,,,,,,,,8,3,mixed,mixed,mixed,normal,8,10,7,,4,9,8,9,10,0.002887882,FAIL
1414,,05:25.3,09:38.1,0 days 00:04:12.779462,2,96,8,16,3,5,10,4,10,6,2,5,3,10,,,3,7,10,6,10,10,10,10,5,5,8,10,2,5,4,10,10,,,,,,,,,,,,,,8,3,mixed,mixed,mixed,normal,8,10,7,,4,9,8,9,10,0.00452785,FAIL
1415,,09:38.1,13:48.8,0 days 00:04:10.684493,2,96,8,16,3,5,10,4,10,5,2,5,2,7,,,3,7,10,6,10,10,10,10,5,5,8,10,2,5,4,10,10,,,,,,,,,,,,,,8,3,mixed,mixed,mixed,normal,8,10,7,,4,9,8,9,10,0.004673449,FAIL
1416,,13:48.8,18:00.8,0 days 00:04:11.977414,2,96,8,16,3,5,10,4,10,6,2,10,2,10,,,3,7,10,6,10,9,10,10,5,5,8,10,2,5,4,10,10,,,,,,,,,,,,,,8,3,mixed,mixed,mixed,normal,8,10,7,,4,9,8,9,10,0.001240941,FAIL
1417,,18:00.8,22:12.5,0 days 00:04:11.748205,2,96,8,16,3,5,10,4,10,6,2,5,2,10,,,3,7,10,6,10,10,10,10,5,5,8,10,2,5,4,10,10,,,,,,,,,,,,,,8,3,mixed,mixed,mixed,normal,8,10,7,,4,9,2,9,4,0.001242931,FAIL
1418,,22:12.5,26:27.9,0 days 00:04:15.342177,2,96,8,16,3,5,10,4,10,6,2,5,2,10,,,3,7,10,6,10,9,10,10,5,,8,10,2,5,4,4,10,,,,,,,,,,,,,,8,3,mixed,mixed,mixed,normal,8,9,7,,4,9,8,9,10,0.004574126,FAIL
