number,value,datetime_start,datetime_complete,duration,params_gat_heads,params_gat_hidden_0,params_gat_hidden_1,params_gat_hidden_2,params_gat_layers,params_gat_out,params_kan_arity_0_0,params_kan_arity_0_1,params_kan_arity_0_2,params_kan_arity_0_3,params_kan_arity_0_4,params_kan_arity_0_5,params_kan_arity_0_6,params_kan_arity_0_7,params_kan_arity_0_8,params_kan_arity_0_9,params_kan_arity_1_0,params_kan_arity_1_1,params_kan_arity_1_2,params_kan_arity_1_3,params_kan_arity_1_4,params_kan_arity_1_5,params_kan_arity_1_6,params_kan_arity_1_7,params_kan_arity_1_8,params_kan_arity_1_9,params_kan_arity_2_0,params_kan_arity_2_1,params_kan_arity_2_2,params_kan_arity_2_3,params_kan_arity_2_4,params_kan_arity_2_5,params_kan_arity_2_6,params_kan_arity_2_7,params_kan_arity_2_8,params_kan_arity_2_9,params_kan_arity_3_0,params_kan_arity_3_1,params_kan_arity_3_2,params_kan_arity_3_3,params_kan_arity_3_4,params_kan_arity_3_5,params_kan_arity_3_6,params_kan_arity_3_7,params_kan_arity_3_8,params_kan_arity_3_9,params_kan_grid,params_kan_k,params_kan_layer_type_0,params_kan_layer_type_1,params_kan_layer_type_2,params_kan_layer_type_3,params_kan_mult_nodes_0,params_kan_mult_nodes_1,params_kan_mult_nodes_2,params_kan_mult_nodes_3,params_kan_n_layers,params_kan_neurons_0,params_kan_neurons_1,params_kan_neurons_2,params_kan_neurons_3,params_lr,state
1522,,37:28.8,41:33.7,0 days 00:04:04.918472,2,96,8,16,3,5,10,4,10,6,2,5,2,10,,,3,7,10,6,10,10,10,10,5,5,8,8,2,5,4,10,10,,,,,,,,,,,,,,8,3,mixed,mixed,mixed,normal,8,10,7,,4,9,8,9,10,0.004783232,FAIL
1523,,41:33.7,45:40.3,0 days 00:04:06.629218,2,96,8,16,3,5,10,4,10,6,2,5,2,10,,,3,7,10,6,9,10,10,10,5,5,8,10,2,5,4,10,10,10,,,,,,,,,,,,,8,3,mixed,mixed,mixed,normal,8,10,8,,4,9,8,9,4,0.004772762,FAIL
1524,,45:40.3,49:49.7,0 days 00:04:09.415787,2,96,8,16,3,5,10,4,10,6,2,5,3,10,,,3,7,5,6,10,10,10,10,5,5,8,10,2,5,4,10,10,,,,,,,,,,,,,,8,3,mixed,mixed,mixed,normal,8,10,7,,4,9,2,9,10,0.00124332,FAIL
1525,,49:49.7,53:59.1,0 days 00:04:09.334796,2,96,8,16,3,5,10,4,10,6,2,5,3,9,,,3,7,10,6,10,10,10,10,5,5,8,10,4,5,4,10,10,,,,,,,,,,,,,,8,3,mixed,mixed,mixed,normal,8,10,7,,4,9,8,9,10,0.004513874,FAIL
1526,,53:59.1,58:05.9,0 days 00:04:06.792045,2,96,8,16,3,5,10,4,10,6,2,5,2,10,,,3,7,10,6,10,10,10,10,5,5,8,10,2,5,4,10,10,,,,,,,,,,,,,,8,3,mixed,mixed,mixed,normal,8,10,7,,4,9,8,9,10,0.004806155,FAIL
1527,,58:05.9,02:11.7,0 days 00:04:05.841692,2,96,8,16,3,5,10,4,10,6,2,5,3,10,,,3,7,10,6,10,10,10,10,5,5,8,10,2,5,4,10,10,,,,,,,,,,,,,,8,3,mixed,mixed,mixed,normal,8,10,7,,4,9,8,9,10,0.004211369,FAIL
1528,,02:11.7,06:17.6,0 days 00:04:05.887726,2,96,8,16,3,5,10,4,10,6,2,10,2,10,,,3,7,10,6,10,10,10,10,5,5,8,10,2,5,4,10,10,,,,,,,,,,,,,,8,3,mixed,mixed,mixed,normal,8,10,7,,4,9,8,9,10,0.00438325,FAIL
1529,,06:17.6,10:23.3,0 days 00:04:05.727950,2,96,8,16,3,5,9,4,9,6,2,5,2,10,,,3,7,10,6,10,10,10,10,5,5,8,10,2,6,4,10,10,,,,,,,,,,,,,,8,4,mixed,mixed,mixed,,8,10,7,,3,9,8,9,,0.00126341,FAIL
1530,,10:23.4,14:30.5,0 days 00:04:07.126030,2,96,8,16,3,5,10,4,10,5,2,5,2,10,,,3,7,10,6,10,10,10,10,5,5,8,10,2,5,4,10,10,2,,,,,,,,,,,,,8,3,mixed,mixed,mixed,normal,8,10,8,,4,9,2,9,10,0.004461013,FAIL
1531,,14:30.5,18:37.1,0 days 00:04:06.574575,2,96,8,16,3,5,10,4,10,6,2,5,2,10,,,3,7,10,6,10,10,10,10,5,,8,10,2,5,4,10,10,,,,,,,,,,,,,,8,3,mixed,mixed,mixed,normal,8,9,7,,4,9,8,9,4,0.00454481,FAIL
1532,,18:37.1,22:41.8,0 days 00:04:04.692881,2,96,8,16,3,5,10,4,10,6,2,5,2,10,,,3,7,10,6,10,10,10,10,5,5,8,10,2,5,4,10,10,,,,,,,,,,,,,,8,3,mixed,mixed,mixed,normal,8,10,7,,4,9,8,9,10,0.004652637,FAIL
1533,,22:41.8,26:48.6,0 days 00:04:06.888987,2,96,8,16,3,5,10,4,10,6,2,5,2,10,,,3,7,10,6,10,9,10,10,5,5,8,10,2,5,4,10,10,,,,,,,,,,,,,,8,3,mixed,mixed,mixed,normal,8,10,7,,4,9,8,9,10,0.004673079,FAIL
1534,,26:48.7,30:56.0,0 days 00:04:07.391976,2,96,8,16,3,5,10,4,10,6,2,5,2,10,,,3,7,10,6,10,10,10,10,5,5,8,10,2,5,4,10,2,,,,,,,,,,,,,,8,3,mixed,mixed,mixed,normal,8,10,7,,4,9,8,9,10,0.00472103,FAIL
1535,,30:56.0,35:01.8,0 days 00:04:05.722537,2,96,8,16,3,5,10,4,10,6,2,5,2,10,,,3,7,10,6,10,9,10,10,6,5,8,8,2,5,4,10,10,,,,,,,,,,,,,,8,3,mixed,mixed,mixed,normal,8,10,7,,4,9,8,9,10,0.00427263,FAIL
1536,,35:01.8,39:12.2,0 days 00:04:10.468736,2,96,8,16,3,5,10,4,10,6,2,5,3,10,,,3,7,10,6,10,10,10,9,5,5,8,10,2,5,4,10,10,,,,,,,,,,,,,,8,3,mixed,mixed,mixed,normal,8,10,7,,4,9,8,9,10,0.00294212,FAIL
1537,,39:12.2,43:22.7,0 days 00:04:10.496926,2,96,8,16,3,5,10,4,9,6,2,5,2,10,,,3,7,10,6,10,10,10,10,5,5,8,10,2,5,4,10,10,,,,,,,,,,,,,,8,3,mixed,mixed,mixed,normal,8,10,7,,4,9,8,9,10,0.004732251,FAIL
1538,,43:22.7,47:31.4,0 days 00:04:08.644695,2,96,8,16,3,5,10,4,10,6,2,5,2,10,,,3,7,10,6,10,10,10,10,5,5,8,10,4,5,4,10,10,,,,,,,,,,,,,,8,3,mixed,mixed,mixed,normal,8,10,7,,4,9,8,9,10,0.004438774,FAIL
1539,,47:31.4,51:41.2,0 days 00:04:09.828182,2,96,8,16,3,5,10,5,10,6,2,5,2,10,,,3,7,10,6,10,9,10,10,5,5,8,10,4,5,4,10,10,,,,,,,,,,,,,,8,3,mixed,mixed,mixed,normal,8,10,7,,4,9,8,9,4,0.004680769,FAIL
1540,,51:41.2,55:47.1,0 days 00:04:05.869612,2,96,8,16,3,5,10,4,10,6,2,5,2,10,,,3,7,10,6,10,9,10,10,5,5,8,10,2,5,4,10,10,,,,,,,,,,,,,,8,3,mixed,mixed,mixed,normal,8,10,7,,4,9,8,9,10,0.00445406,FAIL
1541,,55:47.1,59:55.9,0 days 00:04:08.794543,2,96,8,16,3,5,10,4,9,6,2,10,3,10,,,3,7,5,6,10,9,10,10,5,5,8,10,2,5,4,10,10,,,,,,,,,,,,,,8,3,mixed,mixed,mixed,normal,8,10,7,,4,9,8,9,10,0.004582531,FAIL
1542,,59:55.9,04:07.3,0 days 00:04:11.400722,2,96,8,16,3,5,10,4,10,6,2,5,3,10,,,3,7,10,6,10,10,10,10,5,5,8,10,2,5,5,10,10,,,,,,,,,,,,,,8,3,mixed,mixed,mixed,normal,8,10,7,,4,9,8,9,10,0.004660539,FAIL
1543,,04:07.3,08:15.3,0 days 00:04:07.963752,2,96,8,16,3,5,10,4,9,6,2,10,2,10,,,3,7,10,6,10,10,10,10,5,5,8,10,2,5,4,4,10,,,,,,,,,,,,,,8,3,mixed,mixed,mixed,normal,8,10,7,,4,9,8,9,10,0.004447923,FAIL
1544,,08:15.3,12:27.8,0 days 00:04:12.504024,2,96,8,16,3,5,10,4,10,6,2,5,2,10,,,3,7,10,6,10,9,10,10,5,5,8,10,2,5,4,10,10,,,,,,,,,,,,,,8,3,mixed,mixed,mixed,normal,8,10,7,,4,9,8,9,10,0.001233121,FAIL
1545,,12:27.8,16:35.3,0 days 00:04:07.507036,2,96,8,16,3,5,10,4,9,5,2,5,2,10,,,3,7,10,6,10,10,10,10,5,,8,10,2,5,4,10,10,,,,,,,,,,,,,,8,3,mixed,mixed,mixed,normal,8,9,7,,4,9,8,9,10,0.002924039,FAIL
1546,,16:35.3,20:44.6,0 days 00:04:09.317247,2,96,8,16,3,5,10,4,10,6,2,5,2,10,,,3,7,10,6,10,10,10,10,5,5,7,10,2,5,4,10,10,,,,,,,,,,,,,,8,3,mixed,mixed,mixed,normal,8,10,7,,4,9,8,9,10,0.001216817,FAIL
1547,,20:44.6,24:53.8,0 days 00:04:09.196917,2,96,8,16,3,5,10,4,9,6,2,5,3,10,,,3,7,5,6,10,10,10,10,5,5,8,10,2,5,5,10,10,,,,,,,,,,,,,,8,3,mixed,mixed,mixed,normal,8,10,7,,4,9,8,9,10,0.004949069,FAIL
1548,,24:53.8,29:02.1,0 days 00:04:08.240037,2,96,8,16,3,5,10,4,10,6,2,10,4,10,,,3,7,10,6,10,10,10,10,5,5,8,10,2,5,5,10,10,,,,,,,,,,,,,,8,3,mixed,mixed,mixed,normal,8,10,7,,4,9,8,9,10,0.007307432,FAIL
1549,,29:02.1,33:09.6,0 days 00:04:07.528338,2,96,8,16,3,5,10,4,9,6,2,5,2,10,,,3,7,5,6,10,10,10,10,5,5,8,10,2,5,4,10,10,,,,,,,,,,,,,,8,3,mixed,mixed,mixed,normal,8,10,7,,4,9,8,9,10,0.004482747,FAIL
1550,,33:09.6,37:18.9,0 days 00:04:09.267356,2,96,8,16,3,5,10,5,10,6,2,5,3,10,,,3,7,10,6,10,10,10,10,5,5,8,10,2,5,4,4,10,,,,,,,,,,,,,,8,3,mixed,mixed,mixed,normal,8,10,7,,4,9,8,9,10,0.004497415,FAIL
1551,,37:18.9,41:25.0,0 days 00:04:06.177600,2,96,8,16,3,5,10,4,10,6,2,5,2,10,,,3,7,10,6,10,10,10,10,5,5,8,10,2,5,4,10,10,,,,,,,,,,,,,,8,3,mixed,mixed,mixed,normal,8,10,7,,4,9,8,9,10,0.001232065,FAIL
1552,,41:25.0,45:31.5,0 days 00:04:06.467523,2,96,8,16,3,5,10,4,10,6,2,5,3,10,,,3,7,10,6,10,10,10,10,5,5,8,10,2,5,4,10,10,,,,,,,,,,,,,,8,3,mixed,mixed,mixed,normal,8,10,7,,4,9,8,9,10,0.004642767,FAIL
1553,,45:31.5,49:40.3,0 days 00:04:08.785503,2,96,8,16,3,5,10,4,10,6,2,5,3,10,,,3,7,10,6,10,10,10,10,5,4,8,10,2,5,4,10,10,,,,,,,,,,,,,,8,3,mixed,mixed,mixed,normal,8,10,7,,4,9,8,9,10,0.001254612,FAIL
1554,,49:40.3,53:51.6,0 days 00:04:11.266160,2,96,8,16,3,5,9,4,10,6,2,5,2,10,,,3,7,10,6,10,10,10,10,5,5,8,10,2,5,4,10,10,,,,,,,,,,,,,,8,3,mixed,mixed,mixed,normal,8,10,7,,4,9,8,9,10,0.004572839,FAIL
1555,,53:51.6,57:58.9,0 days 00:04:07.321851,2,96,8,16,3,5,10,4,10,6,2,5,2,10,,,3,7,10,6,10,10,10,10,5,5,8,10,2,5,4,10,10,,,,,,,,,,,,,,8,3,mixed,mixed,mixed,normal,8,10,7,,4,9,8,9,10,0.001236257,FAIL
1556,,57:58.9,02:01.4,0 days 00:04:02.539568,2,96,8,16,3,5,10,4,10,6,2,5,2,10,,,3,7,10,6,10,10,10,10,5,5,8,10,2,5,4,10,10,,,,,,,,,,,,,,8,3,mixed,mixed,mixed,normal,8,10,7,,4,9,8,9,4,0.001252926,FAIL
1557,,02:01.4,06:09.5,0 days 00:04:08.073434,2,96,8,16,3,5,10,5,10,6,2,5,3,10,,,3,7,5,6,10,10,10,10,6,5,8,10,2,5,4,10,10,,,,,,,,,,,,,,8,3,mixed,mixed,mixed,normal,8,10,7,,4,9,8,9,10,0.005042088,FAIL
1558,,06:09.5,10:15.6,0 days 00:04:06.122279,2,96,8,16,3,5,10,4,10,6,2,5,2,10,,,3,7,10,6,10,9,10,10,5,,8,10,4,5,4,10,10,,,,,,,,,,,,,,8,3,mixed,mixed,mixed,normal,8,9,7,,4,9,8,9,10,0.001223754,FAIL
1559,,10:15.6,14:22.5,0 days 00:04:06.869083,2,96,8,16,3,5,10,4,9,6,2,5,2,10,,,3,7,10,6,10,9,10,10,5,5,8,10,2,5,4,10,10,,,,,,,,,,,,,,8,3,mixed,mixed,mixed,normal,8,10,7,,4,9,8,9,10,0.004386171,FAIL
1560,,14:22.5,18:33.8,0 days 00:04:11.238438,2,96,8,16,3,5,10,4,9,6,2,5,2,10,,,3,7,10,6,10,10,10,10,5,5,8,10,2,5,4,10,10,,,,,,,,,,,,,,8,3,mixed,mixed,mixed,normal,8,10,7,,4,9,8,9,10,0.004564414,FAIL
1561,,18:33.8,22:39.0,0 days 00:04:05.272140,2,96,8,16,3,5,10,4,10,6,2,5,2,10,,,3,7,10,6,10,10,10,10,5,,8,10,2,5,4,10,10,,,,,,,,,,,,,,8,3,mixed,mixed,mixed,normal,8,9,7,,4,9,8,9,10,0.004360794,FAIL
1562,,22:39.0,26:47.2,0 days 00:04:08.134446,2,96,8,16,3,5,10,4,10,6,2,5,2,10,,,3,7,5,,,,,,,,8,10,2,5,4,10,10,,,,,,,,,,,,,,8,3,mixed,mixed,mixed,normal,8,3,7,,4,9,8,9,10,0.002791736,FAIL
1563,,26:47.2,30:58.8,0 days 00:04:11.640176,2,96,8,16,3,5,10,4,10,6,2,5,2,10,,,3,7,10,6,10,10,10,10,5,5,8,10,2,5,4,10,10,,,,,,,,,,,,,,8,3,mixed,mixed,mixed,normal,8,10,7,,4,9,8,9,10,0.004351149,FAIL
1564,,30:58.8,35:06.2,0 days 00:04:07.346240,2,96,8,16,3,5,10,4,9,6,2,5,2,10,,,3,7,10,6,10,9,10,10,5,,8,10,2,5,4,10,10,,,,,,,,,,,,,,8,3,mixed,mixed,mixed,normal,8,9,7,,4,9,8,9,10,0.004251906,FAIL
1565,,35:06.2,39:16.2,0 days 00:04:10.064696,2,96,8,16,3,5,10,4,9,6,2,5,2,10,,,3,7,10,6,10,10,10,10,5,5,8,8,2,5,4,10,10,,,,,,,,,,,,,,8,3,mixed,mixed,mixed,normal,8,10,7,,4,9,8,9,10,0.004847152,FAIL
1566,,39:16.2,43:26.7,0 days 00:04:10.492799,2,96,8,16,3,5,10,4,10,6,2,5,2,10,,,3,7,10,6,10,10,10,10,5,5,8,10,2,5,4,10,10,,,,,,,,,,,,,,8,3,mixed,mixed,mixed,normal,8,10,7,,4,9,8,9,4,0.004811452,FAIL
1567,,43:26.7,47:36.9,0 days 00:04:10.179916,2,96,8,16,3,5,10,4,10,6,2,5,2,10,,,3,7,10,6,10,10,10,10,5,5,8,10,2,5,4,10,10,,,,,,,,,,,,,,8,3,mixed,mixed,mixed,normal,8,10,7,,4,9,8,9,10,0.004982432,FAIL
1568,,47:36.9,51:47.5,0 days 00:04:10.549979,2,96,8,16,3,5,10,4,10,6,2,5,2,9,10,,3,7,10,6,10,10,10,10,5,5,8,10,2,5,4,10,10,,,,,,,,,,,,,,8,3,mixed,mixed,mixed,normal,9,10,7,,4,9,8,9,10,0.002901835,FAIL
1569,,51:47.5,55:56.9,0 days 00:04:09.406344,2,96,8,16,3,5,10,4,10,6,2,5,2,10,,,3,7,10,6,10,10,10,10,5,5,8,10,2,5,4,10,10,,,,,,,,,,,,,,8,3,mixed,mixed,mixed,normal,8,10,7,,4,9,8,9,10,0.004750611,FAIL
1570,,55:56.9,00:03.5,0 days 00:04:06.615893,2,96,8,16,3,5,10,4,10,6,2,5,3,10,,,3,7,10,5,10,10,10,10,5,5,8,10,2,5,4,10,10,,,,,,,,,,,,,,8,3,mixed,mixed,mixed,normal,8,10,7,,4,9,8,9,10,0.001226068,FAIL
1571,,00:03.5,04:13.2,0 days 00:04:09.663551,2,96,8,16,3,5,10,4,10,6,2,5,2,10,,,3,7,10,6,10,10,10,10,5,5,8,10,4,5,5,10,10,,,,,,,,,,,,,,8,3,mixed,mixed,mixed,normal,8,10,7,,4,9,8,9,10,0.004297944,FAIL
1572,,04:13.2,08:22.8,0 days 00:04:09.610941,2,96,8,16,3,5,10,5,10,6,2,10,2,10,,,3,7,10,6,10,10,10,10,5,5,8,10,2,5,4,10,10,,,,,,,,,,,,,,8,3,mixed,mixed,mixed,normal,8,10,7,,4,9,8,9,10,0.005046257,FAIL
1573,,08:22.8,12:32.3,0 days 00:04:09.492874,2,96,8,16,3,5,10,4,8,6,2,5,2,10,,,3,7,10,6,10,8,10,10,5,5,8,10,2,5,4,10,10,10,,,,,,,,,,,,,8,3,mixed,mixed,mixed,normal,8,10,8,,4,9,8,9,10,0.004378729,FAIL
1574,,12:32.3,16:39.9,0 days 00:04:07.577771,2,96,8,16,3,5,10,4,10,6,2,5,2,10,,,3,7,10,6,10,9,10,10,6,5,8,10,2,5,4,10,10,,,,,,,,,,,,,,8,3,mixed,mixed,mixed,normal,8,10,7,,4,9,8,9,10,0.004756936,FAIL
1575,,16:39.9,20:52.0,0 days 00:04:12.125538,2,96,8,16,3,5,10,4,10,6,2,5,2,10,,,3,7,10,6,10,10,10,10,5,5,8,10,2,5,4,10,10,,,,,,,,,,,,,,8,3,mixed,mixed,mixed,,8,10,7,,3,9,8,9,,0.004396185,FAIL
1576,,20:52.0,24:59.7,0 days 00:04:07.702398,2,96,8,16,3,5,9,4,10,6,2,5,2,10,,,3,7,10,6,10,10,10,10,5,5,8,10,2,5,4,10,10,,,,,,,,,,,,,,8,3,mixed,mixed,mixed,normal,8,10,7,,4,9,6,9,10,0.004423919,FAIL
1577,,24:59.7,29:11.0,0 days 00:04:11.287555,2,96,8,16,3,5,10,4,10,6,2,5,3,10,,,3,7,10,6,10,10,10,10,5,5,8,10,2,5,4,10,10,,,,,,,,,,,,,,8,3,mixed,mixed,mixed,normal,8,10,7,,4,9,8,9,10,0.001218653,FAIL
1578,,29:11.0,33:18.4,0 days 00:04:07.451632,2,96,8,16,3,5,10,4,10,6,2,5,2,10,,,3,7,10,6,10,10,10,10,5,5,8,10,2,5,4,10,10,,,,,,,,,,,,,,8,3,mixed,mixed,mixed,normal,8,10,7,,4,9,8,9,10,0.002895085,FAIL
1579,,33:18.5,37:25.2,0 days 00:04:06.703739,2,96,8,16,3,5,10,4,9,6,2,5,2,10,,,3,7,10,6,10,10,10,10,5,5,8,10,2,5,4,4,10,,,,,,,,,,,,,,8,3,mixed,mixed,mixed,normal,8,10,7,,4,9,8,9,10,0.004598279,FAIL
1580,,37:25.2,41:34.6,0 days 00:04:09.411207,2,96,8,16,3,5,10,4,10,6,2,5,2,10,,,3,7,10,6,10,10,10,10,5,,8,10,2,5,4,10,10,,,,,,,,,,,,,,8,3,mixed,mixed,mixed,normal,8,9,7,,4,9,8,9,10,0.001264128,FAIL
1581,,41:34.6,45:44.8,0 days 00:04:10.217095,2,96,8,16,3,5,10,4,10,6,2,5,2,10,,,3,7,10,5,10,9,10,10,5,5,8,10,2,5,4,10,10,,,,,,,,,,,,,,8,3,mixed,mixed,mixed,normal,8,10,7,,4,9,8,9,10,0.004505346,FAIL
1582,,45:44.8,49:49.4,0 days 00:04:04.591499,2,96,8,16,3,5,10,4,10,6,2,5,2,10,,,3,7,10,6,10,10,10,10,6,5,8,8,2,5,4,10,10,,,,,,,,,,,,,,8,3,mixed,mixed,mixed,normal,8,10,7,,4,9,8,9,4,0.004629977,FAIL
1583,,49:49.4,53:59.2,0 days 00:04:09.781266,2,96,8,16,3,5,10,4,10,6,2,5,2,10,,,3,7,10,6,10,10,10,10,5,5,8,10,4,5,4,10,10,,,,,,,,,,,,,,8,3,mixed,mixed,mixed,normal,8,10,7,,4,9,8,9,10,0.004414738,FAIL
1584,,53:59.2,58:07.4,0 days 00:04:08.194388,2,96,8,16,3,5,10,4,10,6,2,5,2,10,,,3,7,10,6,9,10,10,10,5,5,8,10,2,5,4,10,10,,,,,,,,,,,,,,8,3,mixed,mixed,mixed,normal,8,10,7,,4,9,8,9,10,0.004370004,FAIL
1585,,58:07.4,02:18.9,0 days 00:04:11.475068,2,96,8,16,3,5,10,4,9,6,2,5,2,10,,,3,7,7,6,10,10,10,10,5,5,8,10,2,5,4,5,10,,,,,,,,,,,,,,8,3,mixed,mixed,mixed,normal,8,10,7,,4,9,8,9,10,0.004257824,FAIL
1586,,02:18.9,06:27.6,0 days 00:04:08.761659,2,96,8,16,3,5,10,4,10,6,2,5,4,10,,,3,7,10,6,10,10,10,10,5,5,8,10,2,5,4,10,10,,,,,,,,,,,,,,8,3,mixed,mixed,mixed,normal,8,10,7,,4,9,8,9,10,0.004422395,FAIL
1587,,06:27.6,10:34.0,0 days 00:04:06.378311,2,96,8,16,3,5,10,4,10,6,2,5,2,10,,,3,7,10,6,10,10,10,10,5,4,8,10,2,5,4,10,10,,,,,,,,,,,,,,8,3,mixed,mixed,mixed,normal,8,10,7,,4,9,8,9,10,0.00459995,FAIL
1588,,10:34.0,14:42.4,0 days 00:04:08.434361,2,96,8,16,3,5,10,4,9,6,2,5,2,10,,,3,7,10,6,10,10,10,10,5,5,8,10,2,5,4,10,10,,,,,,,,,,,,,,8,3,mixed,mixed,mixed,normal,8,10,7,,4,9,8,9,10,0.004683014,FAIL
1589,,14:42.4,18:54.9,0 days 00:04:12.487187,2,96,8,16,3,5,10,4,10,6,2,5,3,10,,,3,7,10,6,10,10,10,10,6,4,8,10,4,5,4,10,10,,,,,,,,,,,,,,8,3,mixed,mixed,mixed,normal,8,10,7,,4,9,8,9,10,0.001264765,FAIL
1590,,18:54.9,23:05.6,0 days 00:04:10.652134,2,96,8,16,3,5,10,4,10,6,2,5,4,10,,,3,7,10,6,10,10,10,10,5,5,8,10,2,5,4,10,10,,,,,,,,,,,,,,8,3,mixed,mixed,mixed,normal,8,10,7,,4,9,8,9,10,0.004514678,FAIL
1591,,23:05.6,27:14.3,0 days 00:04:08.684615,2,96,8,16,3,5,10,4,10,6,2,5,2,10,,,3,7,10,6,10,9,10,10,5,5,8,10,2,5,4,10,10,,,,,,,,,,,,,,8,3,mixed,mixed,mixed,normal,8,10,7,,4,9,8,9,10,0.00290804,FAIL
1592,,27:14.3,31:24.5,0 days 00:04:10.179696,2,96,8,16,3,5,10,4,10,6,2,5,2,10,,,3,7,10,6,10,10,10,10,5,5,8,10,2,5,4,10,10,,,,,,,,,,,,,,8,3,mixed,mixed,mixed,normal,8,10,7,,4,9,8,9,10,0.004833443,FAIL
1593,,31:24.5,35:34.3,0 days 00:04:09.868066,2,96,8,16,3,5,10,4,10,6,2,5,2,10,,,3,7,10,6,10,10,10,10,5,,8,10,2,5,4,10,10,,,,,,,,,,,,,,8,3,mixed,mixed,mixed,normal,8,9,7,,4,9,8,9,10,0.004612404,FAIL
1594,,35:34.3,39:44.7,0 days 00:04:10.390477,2,96,8,16,3,5,10,4,10,6,2,5,2,10,,,3,7,10,6,10,10,10,10,5,5,8,10,2,5,4,10,10,,,,,,,,,,,,,,8,3,mixed,mixed,mixed,normal,8,10,7,,4,9,8,9,10,0.001247142,FAIL
1595,,39:44.7,43:54.4,0 days 00:04:09.703057,2,96,8,16,3,5,9,4,10,6,2,5,2,10,,,3,7,5,6,10,10,10,10,5,5,7,10,2,5,4,10,10,,,,,,,,,,,,,,8,3,mixed,mixed,mixed,normal,8,10,7,,4,9,8,9,10,0.002914846,FAIL
1596,,43:54.4,48:02.5,0 days 00:04:08.095411,2,96,8,16,3,5,10,4,10,6,2,5,2,10,,,3,7,10,6,10,10,10,10,5,5,8,10,2,5,4,10,10,,,,,,,,,,,,,,8,3,mixed,mixed,mixed,normal,8,10,7,,4,9,8,9,10,0.002826278,FAIL
1597,,48:02.5,52:08.3,0 days 00:04:05.788812,2,96,8,16,3,5,10,4,10,6,2,5,2,10,,,3,7,10,6,10,10,10,10,5,5,8,10,2,5,4,10,10,,,,,,,,,,,,,,8,3,mixed,mixed,mixed,normal,8,10,7,,4,9,8,9,4,0.004839627,FAIL
1598,,52:08.3,56:15.0,0 days 00:04:06.683840,2,96,8,16,3,5,10,4,10,6,2,5,2,10,,,3,7,10,6,10,10,10,10,5,5,8,10,2,5,4,10,10,,,,,,,,,,,,,,8,3,mixed,mixed,mixed,normal,8,10,7,,4,9,8,9,10,0.002923911,FAIL
1599,,56:15.0,01:16.5,0 days 00:05:01.449844,2,96,8,16,3,5,10,4,10,6,2,10,2,10,,,3,7,10,6,10,10,10,10,5,5,8,10,2,5,4,10,10,,,,,,,,,,,,,,8,3,mixed,mixed,mixed,normal,8,10,7,,4,9,8,9,10,0.004617185,FAIL
1600,,01:16.5,05:38.2,0 days 00:04:21.686476,4,96,8,16,3,5,10,4,10,5,7,5,2,10,,,3,7,10,6,10,10,10,10,5,5,8,10,2,5,4,10,10,,,,,,,,,,,,,,8,3,mixed,mixed,mixed,normal,8,10,7,,4,9,8,9,4,0.00460569,FAIL
1601,,05:38.2,09:48.8,0 days 00:04:10.621917,2,96,8,16,3,5,10,4,10,6,2,5,2,10,,,3,7,10,6,10,10,10,10,5,5,8,10,2,5,4,10,10,,,,,,,,,,,,,,8,3,mixed,mixed,mixed,normal,8,10,7,,4,9,8,9,10,0.004802343,FAIL
1602,,09:48.8,14:03.0,0 days 00:04:14.230107,2,96,8,16,3,5,10,4,10,6,2,5,2,10,,,3,7,10,6,10,10,10,10,5,5,8,10,2,5,4,10,2,,,,,,,,,,,,,,8,3,mixed,mixed,mixed,normal,8,10,7,,4,9,8,9,10,0.004424779,FAIL
1603,,14:03.0,19:27.0,0 days 00:05:23.944397,2,96,8,16,3,5,10,4,10,6,2,5,2,10,,,3,7,10,6,10,10,10,10,5,5,8,10,2,5,4,10,10,,,,,,,,,,,,,,8,3,mixed,mixed,mixed,normal,8,10,7,,4,9,8,9,10,0.004489096,FAIL
1604,,19:27.0,25:41.1,0 days 00:06:14.146264,2,96,8,16,3,5,10,4,9,6,2,5,3,10,,,3,7,10,6,10,10,10,10,5,5,8,10,2,5,4,4,10,,,,,,,,,,,,,,8,3,mixed,mixed,mixed,normal,8,10,7,,4,9,8,9,10,0.002969578,FAIL
1605,,25:41.1,32:27.6,0 days 00:06:46.473960,2,96,8,16,3,5,10,4,9,6,2,5,2,10,,,3,7,10,6,10,10,10,10,5,5,8,10,2,5,4,10,10,,,,,,,,,,,,,,8,3,mixed,mixed,mixed,normal,8,10,7,,4,9,8,9,10,0.004517231,FAIL
1606,,32:27.6,38:52.7,0 days 00:06:25.064146,2,96,8,16,3,5,10,4,9,6,2,5,2,10,,,3,7,10,6,10,10,10,10,5,5,8,8,2,5,4,10,10,,,,,,,,,,,,,,8,3,mixed,mixed,mixed,normal,8,10,7,,4,9,8,9,4,0.004792607,FAIL
1607,,38:52.7,44:55.1,0 days 00:06:02.429279,2,96,8,16,3,5,10,4,10,6,2,5,2,10,,,3,7,10,6,10,10,10,10,5,5,8,10,2,5,4,4,10,,,,,,,,,,,,,,8,3,mixed,mixed,mixed,normal,8,10,7,,4,9,8,9,10,0.004611231,FAIL
1608,,44:55.1,50:48.3,0 days 00:05:53.166260,2,96,8,16,3,5,10,4,10,6,2,10,2,10,,,3,7,10,6,10,10,10,10,5,5,8,10,2,5,4,10,10,,,,,,,,,,,,,,8,3,mixed,mixed,mixed,normal,8,10,7,,4,9,8,9,10,0.001217392,FAIL
1609,,50:48.3,57:07.6,0 days 00:06:19.335979,2,96,8,16,3,5,10,4,10,6,2,5,4,9,,,3,7,10,6,10,9,10,10,5,5,8,10,2,5,4,10,10,,,,,,,,,,,,,,8,3,mixed,mixed,mixed,normal,8,10,7,,4,9,8,9,10,0.002861361,FAIL
1610,,57:07.6,03:17.5,0 days 00:06:09.852945,2,96,8,16,3,5,10,4,10,6,2,5,2,10,,,3,7,10,6,10,10,10,10,5,5,8,10,2,5,4,10,10,,,,,,,,,,,,,,8,3,mixed,mixed,mixed,normal,8,10,7,,4,9,8,9,10,0.002906282,FAIL
1611,,03:17.5,09:57.6,0 days 00:06:40.060709,2,96,8,16,3,5,10,4,10,6,2,5,2,10,,,3,7,10,6,10,9,10,10,5,5,8,10,2,5,4,10,10,,,,,,,,,,,,,,8,3,mixed,mixed,mixed,normal,8,10,7,,4,9,8,9,10,0.004538088,FAIL
1612,,09:57.6,16:15.0,0 days 00:06:17.446306,2,96,8,16,3,5,10,4,8,6,2,5,2,10,,,3,7,10,6,10,10,10,10,5,5,8,10,4,5,4,4,10,,,,,,,,,,,,,,8,3,mixed,mixed,mixed,normal,8,10,7,,4,9,8,9,10,0.0045625,FAIL
1613,,16:15.0,22:35.5,0 days 00:06:20.514349,2,96,8,16,3,5,10,4,10,6,2,5,2,10,,,3,7,10,6,10,10,10,10,5,5,8,10,2,5,4,10,10,,,,,,,,,,,,,,8,3,mixed,mixed,mixed,normal,8,10,7,,4,9,8,9,10,0.004569754,FAIL
1614,,22:35.6,29:27.8,0 days 00:06:52.225916,2,96,8,16,3,5,10,4,10,5,2,5,2,10,,,3,7,10,6,10,10,10,10,5,5,8,10,2,5,4,10,10,,,,,,,,,,,,,,8,3,mixed,mixed,mixed,normal,8,10,7,,4,9,8,9,10,0.004552761,FAIL
1615,,29:27.8,35:39.2,0 days 00:06:11.368559,2,96,8,16,3,5,10,4,10,6,2,10,2,10,9,,3,7,10,6,10,10,10,10,5,5,8,10,2,5,4,4,10,,,,,,,,,,,,,,8,3,mixed,mixed,mixed,normal,9,10,7,,4,9,8,9,10,0.004562925,FAIL
1616,,35:39.2,41:59.3,0 days 00:06:20.164262,2,96,8,16,3,5,10,4,10,6,2,5,2,10,,,3,7,10,6,10,10,10,10,5,,8,10,2,5,4,5,10,,,,,,,,,,,,,,8,3,mixed,mixed,mixed,normal,8,9,7,,4,9,8,9,10,0.001250592,FAIL
1617,,41:59.3,48:48.9,0 days 00:06:49.619743,2,96,8,16,3,5,10,4,10,6,2,5,3,10,,,3,7,10,6,10,8,10,10,5,5,8,10,2,5,4,10,10,,,,,,,,,,,,,,8,3,mixed,mixed,mixed,normal,8,10,7,,4,9,8,9,10,0.005049793,FAIL
1618,,48:49.0,55:13.8,0 days 00:06:24.845063,2,96,8,16,3,5,10,4,10,6,2,5,2,10,,,3,7,10,6,10,10,10,10,6,5,8,10,2,5,4,10,10,,,,,,,,,,,,,,8,3,mixed,mixed,mixed,normal,8,10,7,,4,9,8,9,10,0.00441316,FAIL
1619,,55:13.8,02:04.4,0 days 00:06:50.615352,2,96,8,16,3,5,10,4,10,6,2,5,3,10,,,3,7,5,6,10,10,10,10,5,5,8,10,2,5,4,10,10,,,,,,,,,,,,,,8,3,mixed,mixed,mixed,normal,8,10,7,,4,9,8,9,10,0.004370106,FAIL
1620,,02:04.4,08:18.2,0 days 00:06:13.823947,2,96,8,16,3,5,10,4,10,6,2,5,2,10,,,3,7,10,6,10,10,10,10,5,5,8,10,4,5,4,10,10,,,,,,,,,,,,,,8,3,mixed,mixed,mixed,normal,8,10,7,,4,9,8,9,4,0.00125469,FAIL
1621,,08:18.3,14:40.6,0 days 00:06:22.317119,2,96,8,16,3,5,10,5,10,6,2,5,2,10,,,3,7,10,6,10,10,10,10,5,5,8,10,2,5,4,10,10,,,,,,,,,,,,,,8,3,mixed,mixed,mixed,normal,8,10,7,,4,9,8,9,10,0.001250531,FAIL
1622,,14:40.6,20:45.9,0 days 00:06:05.347584,2,96,8,16,3,5,10,4,9,6,2,5,3,10,,,3,7,10,6,10,10,10,10,5,4,8,10,2,5,4,10,10,,,,,,,,,,,,,,8,3,mixed,mixed,mixed,normal,8,10,7,,4,9,8,9,10,0.004796544,FAIL
1623,,20:45.9,27:21.6,0 days 00:06:35.705164,2,96,8,16,3,5,10,4,10,6,2,5,3,10,,,3,7,10,6,10,10,10,10,5,,8,10,2,5,4,10,10,,,,,,,,,,,,,,8,3,mixed,mixed,mixed,normal,8,9,7,,4,9,8,9,10,0.004689026,FAIL
1624,,27:21.6,33:51.0,0 days 00:06:29.401588,2,96,8,16,3,5,10,4,10,6,2,5,2,10,,,3,7,10,6,10,10,10,10,5,5,8,10,2,5,4,4,10,,,,,,,,,,,,,,8,3,mixed,mixed,mixed,normal,8,10,7,,4,9,8,9,10,0.004574664,FAIL
