number,value,datetime_start,datetime_complete,duration,params_gat_heads,params_gat_hidden_0,params_gat_hidden_1,params_gat_hidden_2,params_gat_layers,params_gat_out,params_kan_arity_0_0,params_kan_arity_0_1,params_kan_arity_0_2,params_kan_arity_0_3,params_kan_arity_0_4,params_kan_arity_0_5,params_kan_arity_0_6,params_kan_arity_0_7,params_kan_arity_0_8,params_kan_arity_0_9,params_kan_arity_1_0,params_kan_arity_1_1,params_kan_arity_1_2,params_kan_arity_1_3,params_kan_arity_1_4,params_kan_arity_1_5,params_kan_arity_1_6,params_kan_arity_1_7,params_kan_arity_1_8,params_kan_arity_1_9,params_kan_arity_2_0,params_kan_arity_2_1,params_kan_arity_2_2,params_kan_arity_2_3,params_kan_arity_2_4,params_kan_arity_2_5,params_kan_arity_2_6,params_kan_arity_2_7,params_kan_arity_2_8,params_kan_arity_2_9,params_kan_arity_3_0,params_kan_arity_3_1,params_kan_arity_3_2,params_kan_arity_3_3,params_kan_arity_3_4,params_kan_arity_3_5,params_kan_arity_3_6,params_kan_arity_3_7,params_kan_arity_3_8,params_kan_arity_3_9,params_kan_grid,params_kan_k,params_kan_layer_type_0,params_kan_layer_type_1,params_kan_layer_type_2,params_kan_layer_type_3,params_kan_mult_nodes_0,params_kan_mult_nodes_1,params_kan_mult_nodes_2,params_kan_mult_nodes_3,params_kan_n_layers,params_kan_neurons_0,params_kan_neurons_1,params_kan_neurons_2,params_kan_neurons_3,params_lr,state
2878,,02:08.9,03:50.1,0 days 00:01:41.171679,3,96,96,,2,5,,,,,,,,,,,10,7,10,8,,,,,,,2,2,6,5,10,10,2,7,8,10,,,,,,,,,,,4,6,normal,mixed,mixed,,,4,10,,3,9,8,5,,0.006809654,FAIL
2879,,03:50.1,05:31.1,0 days 00:01:41.029172,3,96,96,,2,5,,,,,,,,,,,10,7,10,8,,,,,,,2,2,6,5,9,10,3,7,8,10,,,,,,,,,,,4,6,normal,mixed,mixed,,,4,10,,3,9,8,5,,0.002601304,FAIL
2880,,05:31.1,07:12.4,0 days 00:01:41.270788,3,96,96,,2,5,,,,,,,,,,,10,7,10,8,,,,,,,2,2,6,5,10,10,2,7,8,10,,,,,,,,,,,4,6,normal,mixed,mixed,,,4,10,,3,9,8,5,,0.008817923,FAIL
2881,,07:12.4,08:53.7,0 days 00:01:41.295475,3,96,96,,2,5,,,,,,,,,,,8,7,10,8,,,,,,,2,2,6,5,10,9,2,7,8,10,,,,,,,,,,,4,6,normal,mixed,mixed,,,4,10,,3,9,8,5,,0.002499181,FAIL
2882,,08:53.7,10:34.7,0 days 00:01:40.996907,3,96,96,,2,5,,,,,,,,,,,10,7,10,8,,,,,,,2,2,6,5,9,10,2,7,8,10,,,,,,,,,,,4,6,normal,mixed,mixed,,,4,10,,3,9,8,5,,0.006958408,FAIL
2883,,10:34.7,12:16.8,0 days 00:01:42.105236,3,96,96,,2,5,,,,,,,,,,,10,7,10,8,,,,,,,2,2,6,4,10,10,2,7,8,10,,,,,,,,,,,4,6,normal,mixed,mixed,,,4,10,,3,9,8,5,,0.006710138,FAIL
2884,,12:16.8,13:59.3,0 days 00:01:42.520126,3,96,96,,2,5,,,,,,,,,,,10,7,10,8,,,,,,,3,2,6,4,10,10,2,7,8,10,,,,,,,,,,,4,6,normal,mixed,mixed,,,4,10,,3,9,8,5,,0.00909462,FAIL
2885,,13:59.3,15:41.4,0 days 00:01:42.080866,3,96,96,,2,5,,,,,,,,,,,10,7,10,8,,,,,,,2,2,6,5,9,10,2,7,8,10,,,,,,,,,,,4,6,normal,mixed,mixed,,,4,10,,3,9,8,5,,0.002642722,FAIL
2886,,15:41.4,17:24.1,0 days 00:01:42.752618,3,96,96,,2,5,,,,,,,,,,,10,7,10,8,,,,,,,2,2,6,5,10,10,2,7,8,10,,,,,,,,,,,4,6,normal,mixed,mixed,,,4,10,,3,9,8,5,,0.006816453,FAIL
2887,,17:24.1,19:06.9,0 days 00:01:42.786357,3,96,96,,2,5,,,,,,,,,,,10,7,10,8,,,,,,,2,2,6,5,10,10,2,7,8,,,,,,,,,,,,4,6,normal,mixed,mixed,,,4,9,,3,9,8,5,,0.00664881,FAIL
2888,,19:06.9,20:50.7,0 days 00:01:43.769286,3,96,96,,2,5,,,,,,,,,,,10,7,10,8,,,,,,,2,2,6,5,10,10,2,7,8,10,,,,,,,,,,,4,6,normal,mixed,mixed,,,4,10,,3,9,8,5,,0.007002777,FAIL
2889,,20:50.7,22:34.2,0 days 00:01:43.535571,3,96,96,,2,5,,,,,,,,,,,10,7,10,8,,,,,,,2,2,6,5,10,10,2,7,8,10,,,,,,,,,,,4,6,normal,mixed,mixed,,,4,10,,3,9,8,5,,0.008822362,FAIL
2890,,22:34.2,24:18.5,0 days 00:01:44.214960,3,96,96,,2,5,,,,,,,,,,,10,7,10,8,,,,,,,2,2,6,5,10,10,2,7,8,10,,,,,,,,,,,4,6,normal,mixed,mixed,,,4,10,,3,9,8,5,,0.00259417,FAIL
2891,,24:18.5,26:02.2,0 days 00:01:43.724958,3,96,96,,2,5,,,,,,,,,,,10,7,10,8,,,,,,,2,2,6,5,10,10,2,7,8,10,,,,,,,,,,,4,6,normal,mixed,mixed,,,4,10,,3,9,8,5,,0.00261299,FAIL
2892,,26:02.2,27:45.6,0 days 00:01:43.393285,3,96,96,,2,5,,,,,,,,,,,10,7,10,8,,,,,,,2,2,6,5,9,10,2,7,8,10,,,,,,,,,,,4,6,normal,mixed,mixed,,,4,10,,3,9,8,5,,0.002569215,FAIL
2893,,27:45.6,29:29.4,0 days 00:01:43.828318,3,96,96,,2,5,,,,,,,,,,,10,7,10,8,,,,,,,2,2,6,5,9,10,2,7,8,10,,,,,,,,,,,4,6,normal,mixed,mixed,,,4,10,,3,9,8,5,,0.006826342,FAIL
2894,,29:29.4,31:13.5,0 days 00:01:44.119329,3,96,96,,2,5,,,,,,,,,,,10,7,10,8,,,,,,,2,2,6,5,10,10,2,7,8,10,,,,,,,,,,,4,6,normal,mixed,mixed,,,4,10,,3,9,8,5,,0.006710534,FAIL
2895,,31:13.5,32:56.3,0 days 00:01:42.744331,3,96,96,,2,5,,,,,,,,,,,10,7,10,8,,,,,,,2,2,6,5,10,10,3,7,8,,,,,,,,,,,,4,6,normal,mixed,mixed,,,4,9,,3,9,10,5,,0.006704323,FAIL
2896,,32:56.3,34:39.9,0 days 00:01:43.613829,3,96,96,,2,5,,,,,,,,,,,10,7,10,8,,,,,,,2,2,6,5,10,10,2,7,8,10,,,,,,,,,,,4,6,normal,mixed,mixed,,,4,10,,3,9,8,5,,0.008815091,FAIL
2897,,34:39.9,36:22.4,0 days 00:01:42.487838,3,96,96,,2,5,,,,,,,,,,,10,7,10,8,,,,,,,2,2,6,5,10,10,2,7,8,,,,,,,,,,,,4,6,normal,mixed,mixed,,,4,9,,3,9,8,5,,0.006773317,FAIL
2898,,36:22.4,38:03.8,0 days 00:01:41.443626,3,96,96,,2,5,,,,,,,,,,,10,7,10,7,,,,,,,2,2,6,5,10,9,2,7,8,10,,,,,,,,,,,4,6,normal,mixed,mixed,,,4,10,,3,9,8,5,,0.008583422,FAIL
2899,,38:03.9,39:46.7,0 days 00:01:42.852955,3,96,96,,2,5,,,,,,,,,,,10,7,10,8,,,,,,,2,2,6,5,10,10,2,7,8,10,,,,,,,,,,,4,6,normal,mixed,mixed,,,4,10,,3,9,8,5,,0.009124817,FAIL
2900,,39:46.7,41:29.9,0 days 00:01:43.205301,3,96,96,,2,5,,,,,,,,,,,10,7,10,8,,,,,,,2,2,6,5,10,10,2,7,8,10,,,,,,,,,,,4,6,normal,mixed,mixed,,,4,10,,3,9,8,5,,0.008290882,FAIL
2901,,41:29.9,43:13.9,0 days 00:01:43.957052,3,96,96,,2,5,,,,,,,,,,,10,7,10,8,,,,,,,2,2,6,5,10,10,2,7,9,10,,,,,,,,,,,4,6,normal,mixed,mixed,,,4,10,,3,9,8,5,,0.006837623,FAIL
2902,,43:13.9,44:57.0,0 days 00:01:43.140829,3,96,96,,2,5,,,,,,,,,,,10,7,10,8,,,,,,,2,2,6,5,10,10,2,7,8,10,,,,,,,,,,,4,6,normal,mixed,mixed,,,4,10,,3,9,8,5,,0.008762674,FAIL
2903,,44:57.0,46:39.7,0 days 00:01:42.668114,3,96,96,,2,5,,,,,,,,,,,10,7,10,8,,,,,,,2,2,6,5,8,8,3,7,8,10,,,,,,,,,,,4,6,normal,mixed,mixed,,,4,10,,3,9,8,5,,0.006911491,FAIL
2904,,46:39.7,48:23.0,0 days 00:01:43.289379,3,96,96,,2,5,,,,,,,,,,,10,7,10,8,,,,,,,2,2,6,5,10,10,3,7,8,10,,,,,,,,,,,4,6,normal,mixed,mixed,,,4,10,,3,9,8,5,,0.00680493,FAIL
2905,,48:23.0,50:05.0,0 days 00:01:42.010800,3,96,96,,2,5,,,,,,,,,,,10,7,10,8,,,,,,,2,2,6,5,10,10,3,7,8,10,,,,,,,,,,,4,6,normal,mixed,mixed,,,4,10,,3,9,8,5,,0.008833685,FAIL
2906,,50:05.0,51:46.3,0 days 00:01:41.317399,3,96,96,,2,5,,,,,,,,,,,10,7,10,8,,,,,,,2,2,6,5,9,10,2,7,8,10,,,,,,,,,,,4,6,normal,mixed,mixed,,,4,10,,3,9,8,5,,0.008291316,FAIL
2907,,51:46.3,53:28.2,0 days 00:01:41.886383,3,96,96,,2,5,,,,,,,,,,,10,7,10,8,,,,,,,2,2,6,5,10,10,2,7,8,10,,,,,,,,,,,4,6,normal,mixed,mixed,,,4,10,,3,9,8,5,,0.006992857,FAIL
2908,,53:28.2,55:11.7,0 days 00:01:43.462220,3,96,96,,2,5,,,,,,,,,,,10,7,10,8,,,,,,,2,2,6,5,10,10,2,7,8,10,,,,,,,,,,,4,6,normal,mixed,mixed,,,4,10,,3,9,8,5,,0.006754414,FAIL
2909,,55:11.7,56:55.5,0 days 00:01:43.810569,3,96,96,,2,5,,,,,,,,,,,10,7,10,8,,,,,,,2,2,6,5,10,10,2,7,8,10,,,,,,,,,,,4,6,normal,mixed,mixed,,,4,10,,3,9,8,5,,0.006710148,FAIL
2910,,56:55.5,58:39.3,0 days 00:01:43.825512,3,96,96,,2,5,,,,,,,,,,,10,7,10,8,,,,,,,2,2,6,5,10,10,2,7,8,10,,,,,,,,,,,4,6,normal,mixed,mixed,,,4,10,,3,9,8,5,,0.006696792,FAIL
2911,,58:39.3,00:23.7,0 days 00:01:44.347512,3,96,96,,2,5,,,,,,,,,,,10,7,10,8,,,,,,,2,2,6,5,10,10,2,7,8,10,,,,,,,,,,,4,6,normal,mixed,mixed,,,4,10,,3,9,8,5,,0.009007736,FAIL
2912,,00:23.7,02:08.1,0 days 00:01:44.453753,3,96,96,,2,5,,,,,,,,,,,8,7,10,8,,,,,,,2,2,6,5,10,10,2,7,8,10,,,,,,,,,,,4,6,normal,mixed,mixed,,,4,10,,3,9,8,5,,0.008935591,FAIL
2913,,02:08.1,03:53.6,0 days 00:01:45.433983,3,96,96,,2,5,,,,,,,,,,,10,7,10,8,,,,,,,3,2,6,5,10,10,3,7,8,10,,,,,,,,,,,4,6,normal,mixed,mixed,,,4,10,,3,9,8,5,,0.006968008,FAIL
2914,,03:53.6,05:37.8,0 days 00:01:44.224146,3,96,96,,2,5,,,,,,,,,,,10,8,10,8,,,,,,,2,2,6,5,10,10,2,7,8,10,,,,,,,,,,,4,6,normal,mixed,mixed,,,4,10,,3,9,8,5,,0.006849538,FAIL
2915,,05:37.8,07:22.6,0 days 00:01:44.793840,3,96,96,,2,5,,,,,,,,,,,10,7,10,8,,,,,,,2,2,6,5,9,10,2,7,8,10,,,,,,,,,,,3,6,normal,mixed,mixed,,,4,10,,3,9,8,5,,0.008581428,FAIL
2916,,07:22.6,09:06.7,0 days 00:01:44.116890,3,96,96,,2,5,,,,,,,,,,,10,7,10,8,,,,,,,2,2,6,4,10,10,2,7,8,9,,,,,,,,,,,4,6,normal,mixed,mixed,,,4,10,,3,9,10,5,,0.009080698,FAIL
2917,,09:06.7,10:49.6,0 days 00:01:42.929261,3,96,96,,2,5,,,,,,,,,,,10,7,10,8,,,,,,,2,2,6,5,10,10,2,7,8,10,,,,,,,,,,,4,6,normal,mixed,mixed,,,4,10,,3,9,8,5,,0.006662761,FAIL
2918,,10:49.7,12:33.5,0 days 00:01:43.806260,3,96,96,,2,5,,,,,,,,,,,10,7,10,8,,,,,,,2,2,6,5,9,10,2,7,8,10,,,,,,,,,,,4,6,normal,mixed,mixed,,,4,10,,3,9,8,5,,0.008568456,FAIL
2919,,12:33.5,14:17.5,0 days 00:01:44.045532,3,96,96,,2,5,,,,,,,,,,,10,7,10,8,,,,,,,2,2,6,5,10,10,3,7,8,9,,,,,,,,,,,4,6,normal,mixed,mixed,,,4,10,,3,9,8,5,,0.00876546,FAIL
2920,,14:17.5,16:01.2,0 days 00:01:43.707563,3,96,96,,2,5,,,,,,,,,,,10,7,10,8,,,,,,,2,2,6,5,10,10,2,7,8,10,,,,,,,,,,,4,6,normal,mixed,mixed,,,4,10,,3,9,8,5,,0.006770665,FAIL
2921,,16:01.2,17:44.6,0 days 00:01:43.342542,3,96,96,,2,5,,,,,,,,,,,10,7,10,8,,,,,,,2,2,6,5,10,10,3,7,8,10,,,,,,,,,,,4,6,normal,mixed,mixed,,,4,10,,3,9,8,5,,0.002556453,FAIL
2922,,17:44.6,19:28.3,0 days 00:01:43.727046,3,96,96,,2,5,,,,,,,,,,,8,7,10,8,,,,,,,2,2,6,5,10,10,3,7,8,10,,,,,,,,,,,4,6,normal,mixed,mixed,,,4,10,,3,9,8,5,,0.002572189,FAIL
2923,,19:28.3,21:12.4,0 days 00:01:44.138116,3,96,96,,2,5,,,,,,,,,,,10,7,9,8,,,,,,,2,2,6,4,10,9,2,7,8,10,,,,,,,,,,,4,6,normal,mixed,mixed,,,4,10,,3,9,8,5,,0.007090123,FAIL
2924,,21:12.4,22:57.2,0 days 00:01:44.728788,3,96,96,,2,5,,,,,,,,,,,10,7,10,8,,,,,,,2,2,6,5,10,10,2,7,8,10,,,,,,,,,,,4,6,normal,mixed,mixed,,,4,10,,3,9,8,5,,0.0085143,FAIL
2925,,22:57.2,24:40.9,0 days 00:01:43.741106,3,96,96,,2,5,,,,,,,,,,,10,7,10,8,,,,,,,2,2,6,5,10,10,3,7,8,10,,,,,,,,,,,4,6,normal,mixed,mixed,,,4,10,,3,9,8,5,,0.00824783,FAIL
2926,,24:40.9,26:25.4,0 days 00:01:44.522014,3,96,96,,2,5,,,,,,,,,,,10,7,10,8,,,,,,,2,2,6,5,10,10,2,7,8,10,,,,,,,,,,,4,6,normal,mixed,mixed,,,4,10,,3,9,8,5,,0.006878735,FAIL
2927,,26:25.4,28:10.5,0 days 00:01:45.029969,3,96,96,,2,5,,,,,,,,,,,8,7,10,8,,,,,,,2,2,6,5,10,10,2,7,8,10,,,,,,,,,,,4,6,normal,mixed,mixed,,,4,10,,3,9,8,5,,0.006751057,FAIL
2928,,28:10.5,29:54.5,0 days 00:01:44.060204,3,96,96,,2,5,,,,,,,,,,,10,7,10,8,,,,,,,2,2,6,4,10,10,2,7,8,10,,,,,,,,,,,4,6,normal,mixed,mixed,,,4,10,,3,9,8,5,,0.008513351,FAIL
2929,,29:54.5,31:37.5,0 days 00:01:42.925719,3,96,96,,2,5,,,,,,,,,,,8,7,10,8,,,,,,,2,2,6,5,9,10,2,7,8,,,,,,,,,,,,4,6,normal,mixed,mixed,,,4,9,,3,9,8,5,,0.002568225,FAIL
2930,,31:37.5,33:20.8,0 days 00:01:43.369264,3,96,96,,2,5,,,,,,,,,,,10,7,10,8,,,,,,,2,2,6,5,10,9,2,7,8,10,,,,,,,,,,,4,6,normal,mixed,mixed,,,4,10,,3,9,8,5,,0.00840242,FAIL
2931,,33:20.8,35:05.0,0 days 00:01:44.124980,3,96,96,,2,5,,,,,,,,,,,10,7,10,8,,,,,,,2,2,6,5,10,10,2,7,8,10,,,,,,,,,,,4,6,normal,mixed,mixed,,,4,10,,3,9,8,5,,0.008935208,FAIL
2932,,35:05.0,36:49.0,0 days 00:01:44.058470,3,96,96,,2,5,,,,,,,,,,,10,7,10,8,,,,,,,2,2,6,5,10,10,2,7,8,10,,,,,,,,,,,4,6,normal,mixed,mixed,,,4,10,,3,9,8,5,,0.002545911,FAIL
2933,,36:49.0,38:33.9,0 days 00:01:44.814766,3,96,96,,2,5,,,,,,,,,,,10,7,10,8,,,,,,,2,2,6,5,10,10,2,7,8,10,,,,,,,,,,,4,6,normal,mixed,mixed,,,4,10,,3,9,8,5,,0.006739089,FAIL
2934,,38:33.9,40:18.7,0 days 00:01:44.884714,3,96,96,,2,5,,,,,,,,,,,10,7,10,8,,,,,,,2,2,6,5,10,10,2,7,8,10,,,,,,,,,,,4,6,normal,mixed,mixed,,,4,10,,3,9,8,5,,0.002662737,FAIL
2935,,40:18.7,42:03.8,0 days 00:01:45.096123,3,96,96,,2,5,,,,,,,,,,,10,7,10,8,,,,,,,2,2,6,5,10,10,2,7,8,10,,,,,,,,,,,4,6,normal,mixed,mixed,,,4,10,,3,9,8,5,,0.007014527,FAIL
2936,,42:03.8,43:48.3,0 days 00:01:44.491014,3,96,96,,2,5,,,,,,,,,,,10,7,10,8,,,,,,,2,2,6,5,10,10,2,7,8,10,,,,,,,,,,,4,6,normal,mixed,mixed,,,4,10,,3,9,8,5,,0.008735252,FAIL
2937,,43:48.3,45:32.7,0 days 00:01:44.345006,3,96,96,,2,5,,,,,,,,,,,10,7,10,8,,,,,,,3,2,6,5,10,9,2,7,8,10,,,,,,,,,,,4,6,normal,mixed,mixed,,,4,10,,3,9,8,5,,0.008460363,FAIL
2938,,45:32.7,47:17.2,0 days 00:01:44.470563,3,96,96,,2,5,,,,,,,,,,,10,7,10,8,,,,,,,2,2,6,5,10,10,3,7,8,10,,,,,,,,,,,4,6,normal,mixed,mixed,,,4,10,,3,9,8,5,,0.002659154,FAIL
2939,,47:17.2,49:00.0,0 days 00:01:42.874341,3,96,96,,2,5,,,,,,,,,,,10,7,10,8,,,,,,,2,2,6,5,10,10,2,7,8,10,,,,,,,,,,,4,6,normal,mixed,mixed,,,4,10,,3,9,8,5,,0.006591506,FAIL
2940,,49:00.0,50:43.6,0 days 00:01:43.510925,3,96,96,,2,5,,,,,,,,,,,10,7,10,8,,,,,,,2,2,6,5,10,10,2,7,8,10,,,,,,,,,,,4,6,normal,mixed,mixed,,,4,10,,3,9,8,5,,0.008777988,FAIL
2941,,50:43.6,52:28.0,0 days 00:01:44.412028,3,96,96,,2,5,,,,,,,,,,,10,7,10,8,,,,,,,2,2,6,5,9,10,2,7,8,10,,,,,,,,,,,4,6,normal,mixed,mixed,,,4,10,,3,9,8,5,,0.007654496,FAIL
2942,,52:28.0,54:12.2,0 days 00:01:44.247005,3,96,96,,2,5,,,,,,,,,,,10,7,10,8,,,,,,,2,2,6,5,9,10,2,7,8,10,,,,,,,,,,,4,6,normal,mixed,mixed,,,4,10,,3,9,8,5,,0.002546056,FAIL
2943,,54:12.2,55:56.6,0 days 00:01:44.362309,3,96,96,,2,5,,,,,,,,,,,10,7,10,8,,,,,,,2,2,6,6,10,10,2,7,8,10,,,,,,,,,,,4,6,normal,mixed,mixed,,,4,10,,3,9,8,5,,0.008517376,FAIL
2944,,55:56.6,57:40.6,0 days 00:01:43.965360,3,96,96,,2,5,,,,,,,,,,,10,7,10,8,,,,,,,2,2,6,5,10,10,2,7,8,10,,,,,,,,,,,4,6,normal,mixed,mixed,,,4,10,,3,9,10,5,,0.008999526,FAIL
2945,,57:40.6,59:23.5,0 days 00:01:42.978004,3,96,96,,2,5,,,,,,,,,,,8,7,10,8,,,,,,,2,2,6,5,10,10,2,7,8,10,,,,,,,,,,,4,6,normal,mixed,mixed,,,4,10,,3,9,8,5,,0.008381081,FAIL
2946,,59:23.5,01:06.4,0 days 00:01:42.906030,3,96,96,,2,5,,,,,,,,,,,10,7,10,8,,,,,,,2,2,6,5,10,10,2,7,8,10,,,,,,,,,,,4,6,normal,mixed,mixed,,,4,10,,3,9,8,5,,0.00867761,FAIL
2947,,01:06.4,02:49.4,0 days 00:01:42.978006,3,96,96,,2,5,,,,,,,,,,,10,7,10,8,,,,,,,3,2,6,5,9,10,2,7,8,10,,,,,,,,,,,4,6,normal,mixed,mixed,,,4,10,,3,9,8,5,,0.008319002,FAIL
2948,,02:49.4,04:32.2,0 days 00:01:42.773214,3,96,96,,2,5,,,,,,,,,,,8,7,10,8,,,,,,,2,2,6,5,9,10,2,7,8,10,,,,,,,,,,,4,6,normal,mixed,mixed,,,4,10,,3,9,8,5,,0.008988702,FAIL
2949,,04:32.2,06:15.1,0 days 00:01:42.943937,3,96,96,,2,5,,,,,,,,,,,10,7,10,8,,,,,,,2,2,6,5,10,10,2,7,8,10,,,,,,,,,,,4,6,normal,mixed,mixed,,,4,10,,3,9,8,5,,0.008778757,FAIL
2950,,06:15.2,07:59.0,0 days 00:01:43.816750,3,96,96,,2,5,,,,,,,,,,,10,7,10,8,,,,,,,2,2,6,5,10,10,2,7,8,10,,,,,,,,,,,4,6,normal,mixed,mixed,,,4,10,,3,9,8,5,,0.002566467,FAIL
2951,,07:59.0,09:42.8,0 days 00:01:43.859506,3,96,96,,2,5,,,,,,,,,,,10,7,10,8,,,,,,,3,2,6,5,10,10,2,7,8,10,,,,,,,,,,,4,6,normal,mixed,mixed,,,4,10,,3,9,8,5,,0.006917492,FAIL
2952,,09:42.8,11:26.9,0 days 00:01:44.103800,3,96,96,,2,5,,,,,,,,,,,10,7,10,8,,,,,,,2,2,6,5,10,10,2,7,8,10,,,,,,,,,,,4,6,normal,mixed,mixed,,,4,10,,3,9,8,5,,0.002983263,FAIL
2953,,11:26.9,13:10.7,0 days 00:01:43.756829,3,96,96,,2,5,,,,,,,,,,,10,7,10,8,,,,,,,2,2,6,5,10,10,3,7,8,10,,,,,,,,,,,4,6,normal,mixed,mixed,,,4,10,,3,9,8,5,,0.002537617,FAIL
2954,,13:10.7,14:54.4,0 days 00:01:43.718511,3,96,96,,2,5,,,,,,,,,,,10,7,10,7,,,,,,,2,2,6,5,10,10,2,7,8,10,,,,,,,,,,,4,6,normal,mixed,mixed,,,4,10,,3,9,8,5,,0.006737818,FAIL
2955,,14:54.4,16:38.3,0 days 00:01:43.870079,3,96,96,,2,5,,,,,,,,,,,10,7,10,8,,,,,,,2,2,6,5,10,10,2,7,8,10,,,,,,,,,,,4,6,normal,mixed,mixed,,,4,10,,3,9,8,6,,0.008950533,FAIL
2956,,16:38.3,18:22.3,0 days 00:01:43.983572,3,96,96,,2,5,,,,,,,,,,,10,7,9,8,,,,,,,2,2,6,5,10,10,2,7,8,10,,,,,,,,,,,4,6,normal,mixed,mixed,,,4,10,,3,9,8,5,,0.008791542,FAIL
2957,,18:22.3,20:06.0,0 days 00:01:43.669390,3,96,96,,2,5,,,,,,,,,,,10,7,10,8,,,,,,,2,2,6,5,10,10,2,7,8,10,,,,,,,,,,,4,6,normal,mixed,mixed,,,4,10,,3,9,8,5,,0.002597007,FAIL
2958,,20:06.0,21:49.6,0 days 00:01:43.604791,3,96,96,,2,5,,,,,,,,,,,8,8,10,8,,,,,,,2,2,6,5,10,10,3,7,8,10,,,,,,,,,,,4,6,normal,mixed,mixed,,,4,10,,3,9,8,5,,0.00256645,FAIL
2959,,21:49.6,23:31.5,0 days 00:01:41.897070,3,96,96,,2,5,,,,,,,,,,,10,7,10,8,,,,,,,2,2,6,5,10,10,2,7,8,10,,,,,,,,,,,3,6,normal,mixed,mixed,,,4,10,,3,9,8,5,,0.008786885,FAIL
2960,,23:31.5,25:13.2,0 days 00:01:41.783148,3,96,96,,2,5,,,,,,,,,,,10,7,10,8,,,,,,,2,2,6,5,10,10,3,7,8,10,,,,,,,,,,,4,6,normal,mixed,mixed,,,4,10,,3,9,8,5,,0.008896624,FAIL
2961,,25:13.3,26:54.6,0 days 00:01:41.369500,3,96,96,,2,5,,,,,,,,,,,10,7,10,8,,,,,,,2,2,6,5,10,10,2,8,8,10,,,,,,,,,,,4,6,normal,mixed,mixed,,,4,10,,3,9,8,5,,0.006749402,FAIL
2962,,26:54.6,28:36.4,0 days 00:01:41.769953,3,96,96,,2,5,,,,,,,,,,,10,7,9,8,4,,,,,,2,2,6,4,10,10,2,7,9,10,,,,,,,,,,,4,6,normal,mixed,mixed,,,5,10,,3,9,8,5,,0.002597786,FAIL
2963,,28:36.4,30:18.0,0 days 00:01:41.618788,3,96,96,,2,5,,,,,,,,,,,10,7,10,8,,,,,,,2,2,6,5,9,10,2,7,8,10,,,,,,,,,,,4,6,normal,mixed,mixed,,,4,10,,3,9,8,5,,0.006612412,FAIL
2964,,30:18.0,32:01.9,0 days 00:01:43.919266,3,96,96,,2,5,,,,,,,,,,,10,7,10,8,,,,,,,2,2,6,5,10,10,2,7,8,10,,,,,,,,,,,4,6,normal,mixed,mixed,,,4,10,,3,9,8,5,,0.009115973,FAIL
2965,,32:01.9,33:45.4,0 days 00:01:43.476795,3,96,96,,2,5,,,,,,,,,,,10,7,10,8,,,,,,,2,2,6,5,10,10,2,7,8,10,,,,,,,,,,,4,6,normal,mixed,mixed,,,4,10,,3,9,8,5,,0.002585272,FAIL
2966,,33:45.4,35:29.1,0 days 00:01:43.701166,3,96,96,,2,5,,,,,,,,,,,10,7,10,8,,,,,,,2,2,6,5,10,10,2,7,8,10,,,,,,,,,,,4,6,normal,mixed,mixed,,,4,10,,3,9,8,5,,0.008899943,FAIL
2967,,35:29.1,37:13.0,0 days 00:01:43.858806,3,96,96,,2,5,,,,,,,,,,,10,7,10,8,,,,,,,2,2,6,5,10,9,2,7,8,10,,,,,,,,,,,4,6,normal,mixed,mixed,,,4,10,,3,8,8,5,,0.008736776,FAIL
2968,,37:13.0,38:56.0,0 days 00:01:43.042194,3,96,96,,2,5,,,,,,,,,,,10,7,10,8,,,,,,,2,2,6,5,10,10,2,7,8,10,,,,,,,,,,,4,6,normal,mixed,mixed,,,4,10,,3,9,8,5,,0.006635257,FAIL
2969,,38:56.0,40:39.5,0 days 00:01:43.481809,3,96,96,,2,5,,,,,,,,,,,8,7,10,8,,,,,,,2,2,6,4,10,10,3,7,8,10,,,,,,,,,,,4,6,normal,mixed,mixed,,,4,10,,3,9,8,5,,0.006728933,FAIL
2970,,40:39.5,42:23.4,0 days 00:01:43.867682,3,96,96,,2,5,,,,,,,,,,,10,7,10,8,,,,,,,2,2,6,5,10,10,2,7,8,10,,,,,,,,,,,4,6,normal,mixed,mixed,,,4,10,,3,9,8,5,,0.006992411,FAIL
2971,,42:23.4,44:07.2,0 days 00:01:43.770741,3,96,96,,2,5,,,,,,,,,,,10,7,10,8,,,,,,,2,2,6,5,10,10,2,7,8,10,,,,,,,,,,,4,6,normal,mixed,mixed,,,4,10,,3,9,8,5,,0.008687091,FAIL
2972,,44:07.2,45:50.8,0 days 00:01:43.644946,3,96,96,,2,5,,,,,,,,,,,10,7,10,8,,,,,,,2,3,6,5,10,10,2,7,8,10,,,,,,,,,,,4,6,normal,mixed,mixed,,,4,10,,3,9,8,5,,0.006884541,FAIL
2973,,45:50.8,47:34.9,0 days 00:01:44.073903,3,96,96,,2,5,,,,,,,,,,,10,7,10,8,,,,,,,2,2,6,5,10,10,2,7,8,10,,,,,,,,,,,4,6,normal,mixed,mixed,,,4,10,,3,9,8,5,,0.008249776,FAIL
2974,,47:34.9,49:18.7,0 days 00:01:43.779481,3,96,96,,2,5,,,,,,,,,,,10,7,10,8,,,,,,,2,2,6,5,10,10,2,7,8,10,,,,,,,,,,,4,6,normal,mixed,mixed,,,4,10,,3,9,8,5,,0.009000528,FAIL
2975,,49:18.7,51:02.4,0 days 00:01:43.701298,3,96,96,,2,5,,,,,,,,,,,10,7,10,8,,,,,,,2,2,6,5,10,10,2,7,8,10,,,,,,,,,,,4,6,normal,mixed,mixed,,,4,10,,3,9,8,5,,0.006871851,FAIL
2976,,51:02.4,52:43.9,0 days 00:01:41.532632,3,96,96,,2,5,,,,,,,,,,,10,7,10,8,,,,,,,2,2,6,5,10,9,2,7,8,10,,,,,,,,,,,4,6,normal,mixed,mixed,,,4,10,,3,9,8,5,,0.008819923,FAIL
2977,,52:43.9,54:23.9,0 days 00:01:39.932330,3,96,96,,2,5,,,,,,,,,,,10,7,10,8,,,,,,,2,2,6,5,10,,,,,,,,,,,,,,,,4,6,normal,mixed,mixed,,,4,5,,3,9,8,5,,0.008373204,FAIL
2978,,54:23.9,56:04.9,0 days 00:01:41.035850,3,96,96,,2,5,,,,,,,,,,,10,7,10,8,4,,,,,,2,2,6,5,10,10,2,7,8,10,,,,,,,,,,,4,6,normal,mixed,mixed,,,5,10,,3,9,8,5,,0.007219799,FAIL
2979,,56:04.9,57:45.7,0 days 00:01:40.832720,3,96,96,,2,5,,,,,,,,,,,10,7,10,8,,,,,,,2,2,6,5,10,10,3,7,8,10,,,,,,,,,,,4,6,normal,mixed,mixed,,,4,10,,3,9,8,5,,0.006764489,FAIL
2980,,57:45.7,59:26.9,0 days 00:01:41.199902,3,96,96,,2,5,,,,,,,,,,,10,7,10,8,,,,,,,2,2,6,5,10,10,3,7,8,10,,,,,,,,,,,4,6,normal,mixed,mixed,,,4,10,,3,9,8,5,,0.002568078,FAIL
2981,,59:26.9,01:07.3,0 days 00:01:40.394124,3,96,96,,2,5,,,,,,,,,,,8,7,10,8,,,,,,,3,2,6,4,9,10,2,7,8,10,,,,,,,,,,,4,6,normal,mixed,mixed,,,4,10,,3,9,8,5,,0.002646337,FAIL
2982,,01:07.3,02:48.2,0 days 00:01:40.826901,3,96,96,,2,5,,,,,,,,,,,10,7,10,8,,,,,,,2,2,6,5,10,10,3,7,8,10,,,,,,,,,,,4,6,normal,mixed,mixed,,,4,10,,3,9,8,6,,0.008687694,FAIL
2983,,02:48.2,04:29.3,0 days 00:01:41.089158,3,96,96,,2,5,,,,,,,,,,,10,7,9,8,,,,,,,2,2,6,5,10,10,3,7,8,10,,,,,,,,,,,4,6,normal,mixed,mixed,,,4,10,,3,9,8,5,,0.006696542,FAIL
2984,,04:29.3,06:10.2,0 days 00:01:40.912025,3,96,96,,2,5,,,,,,,,,,,10,7,10,8,,,,,,,2,2,6,5,9,10,3,7,8,10,,,,,,,,,,,4,6,normal,mixed,mixed,,,4,10,,3,9,8,5,,0.006731239,FAIL
2985,,06:10.2,07:51.2,0 days 00:01:41.038118,3,96,96,,2,5,,,,,,,,,,,10,7,10,8,,,,,,,2,2,6,5,10,10,2,7,8,10,,,,,,,,,,,4,6,normal,mixed,mixed,,,4,10,,3,9,8,5,,0.0025903,FAIL
2986,,07:51.2,09:32.8,0 days 00:01:41.593007,3,96,96,,2,5,,,,,,,,,,,10,7,10,8,,,,,,,2,2,6,4,10,10,2,7,8,10,,,,,,,,,,,4,6,normal,mixed,mixed,,,4,10,,3,9,8,5,,0.00265718,FAIL
2987,,09:32.8,11:14.7,0 days 00:01:41.937085,3,96,96,,2,5,,,,,,,,,,,10,7,10,8,,,,,,,2,2,6,5,10,10,2,7,8,10,,,,,,,,,,,4,6,normal,mixed,mixed,,,4,10,,3,9,8,5,,0.008958271,FAIL
2988,,11:14.7,12:55.3,0 days 00:01:40.567150,3,96,96,,2,5,,,,,,,,,,,10,7,10,8,,,,,,,2,2,6,5,9,10,2,7,8,,,,,,,,,,,,4,6,normal,mixed,mixed,,,4,9,,3,9,8,5,,0.006871126,FAIL
2989,,12:55.3,14:36.8,0 days 00:01:41.468789,3,96,96,,2,5,,,,,,,,,,,10,7,10,8,,,,,,,2,2,6,5,9,10,3,7,8,9,,,,,,,,,,,4,6,normal,mixed,mixed,,,4,10,,3,9,8,5,,0.008967523,FAIL
2990,,14:36.8,16:18.1,0 days 00:01:41.300904,3,96,96,,2,5,,,,,,,,,,,8,7,10,8,,,,,,,2,2,6,5,10,10,2,7,8,10,,,,,,,,,,,4,6,normal,mixed,mixed,,,4,10,,3,9,8,5,,0.009076569,FAIL
2991,,16:18.1,17:59.6,0 days 00:01:41.527809,3,96,96,,2,5,,,,,,,,,,,10,7,10,8,,,,,,,2,2,6,5,10,10,2,7,8,10,,,,,,,,,,,4,6,normal,mixed,mixed,,,4,10,,3,9,8,5,,0.008840424,FAIL
2992,,17:59.6,19:40.5,0 days 00:01:40.840679,3,96,96,,2,5,,,,,,,,,,,10,7,10,8,,,,,,,2,2,6,5,9,10,2,7,8,9,,,,,,,,,,,4,6,normal,mixed,mixed,,,4,10,,3,9,8,5,,0.006639464,FAIL
2993,,19:40.5,21:20.9,0 days 00:01:40.436387,3,96,96,,2,5,,,,,,,,,,,8,7,10,8,,,,,,,2,2,6,5,10,9,2,7,8,10,,,,,,,,,,,4,6,normal,mixed,mixed,,,4,10,,3,9,8,5,,0.008623773,FAIL
2994,,21:20.9,23:01.5,0 days 00:01:40.621575,3,96,96,,2,5,,,,,,,,,,,10,7,10,8,,,,,,,2,2,6,5,10,10,2,7,8,10,,,,,,,,,,,4,6,normal,mixed,mixed,,,4,10,,3,9,8,5,,0.006691729,FAIL
2995,,23:01.5,24:41.4,0 days 00:01:39.823723,3,96,96,,2,5,,,,,,,,,,,10,7,10,8,,,,,,,2,2,6,5,10,10,2,7,9,,,,,,,,,,,,4,6,normal,mixed,mixed,,,4,9,,3,9,8,5,,0.00679057,FAIL
