number,value,datetime_start,datetime_complete,duration,params_gat_heads,params_gat_hidden_0,params_gat_hidden_1,params_gat_hidden_2,params_gat_layers,params_gat_out,params_kan_arity_0_0,params_kan_arity_0_1,params_kan_arity_0_2,params_kan_arity_0_3,params_kan_arity_0_4,params_kan_arity_0_5,params_kan_arity_0_6,params_kan_arity_0_7,params_kan_arity_0_8,params_kan_arity_0_9,params_kan_arity_1_0,params_kan_arity_1_1,params_kan_arity_1_2,params_kan_arity_1_3,params_kan_arity_1_4,params_kan_arity_1_5,params_kan_arity_1_6,params_kan_arity_1_7,params_kan_arity_1_8,params_kan_arity_1_9,params_kan_arity_2_0,params_kan_arity_2_1,params_kan_arity_2_2,params_kan_arity_2_3,params_kan_arity_2_4,params_kan_arity_2_5,params_kan_arity_2_6,params_kan_arity_2_7,params_kan_arity_2_8,params_kan_arity_2_9,params_kan_arity_3_0,params_kan_arity_3_1,params_kan_arity_3_2,params_kan_arity_3_3,params_kan_arity_3_4,params_kan_arity_3_5,params_kan_arity_3_6,params_kan_arity_3_7,params_kan_arity_3_8,params_kan_arity_3_9,params_kan_grid,params_kan_k,params_kan_layer_type_0,params_kan_layer_type_1,params_kan_layer_type_2,params_kan_layer_type_3,params_kan_mult_nodes_0,params_kan_mult_nodes_1,params_kan_mult_nodes_2,params_kan_mult_nodes_3,params_kan_n_layers,params_kan_neurons_0,params_kan_neurons_1,params_kan_neurons_2,params_kan_neurons_3,params_lr,state
355,,51:44.6,52:27.3,0 days 00:00:42.747884,4,64,32,128,3,5,8,2,10,4,2,2,10,10,,,9,6,7,6,6,4,4,8,5,,,,,,,,,,,,,,,,,,,,,,4,4,mixed,mixed,,,8,9,,,2,10,9,,,0.005737258,FAIL
356,,52:27.3,53:10.0,0 days 00:00:42.711469,4,64,32,128,3,5,8,2,10,4,2,2,10,9,,,9,6,7,6,6,4,4,8,5,,,,,,,,,,,,,,,,,,,,,,4,4,mixed,mixed,,,8,9,,,2,10,9,,,0.00112751,FAIL
357,,53:10.0,53:52.4,0 days 00:00:42.375130,4,64,32,128,3,5,8,2,10,4,2,10,10,10,,,9,6,7,6,6,4,4,,,,,,,,,,,,,,,,,,,,,,,,4,4,mixed,mixed,,,8,7,,,2,10,9,,,0.005836315,FAIL
358,,53:52.4,54:35.7,0 days 00:00:43.305364,4,64,32,128,3,5,8,2,10,4,2,10,10,10,,,9,6,7,6,6,4,4,8,8,,,,,,,,,,,,,,,,,,,,,,4,4,mixed,mixed,,,8,9,,,2,10,9,,,0.005904734,FAIL
359,,54:35.7,55:18.8,0 days 00:00:43.073508,4,64,32,128,3,5,8,2,10,4,2,2,10,10,,,9,6,7,6,6,4,4,8,8,,,,,,,,,,,,,,,,,,,,,,4,4,mixed,mixed,,,8,9,,,2,10,9,,,0.004282105,FAIL
360,,55:18.8,56:01.1,0 days 00:00:42.339094,4,64,32,128,3,5,8,6,10,4,2,2,10,9,,,6,6,7,6,6,4,4,5,5,,,,,,,,,,,,,,,,,,,,,,4,4,mixed,mixed,,,8,9,,,2,10,9,,,0.003718978,FAIL
361,169.4204254,56:01.1,56:40.7,0 days 00:00:39.539412,4,64,32,128,3,5,,,,,,,,,,,9,6,7,6,6,4,4,8,5,,,,,,,,,,,,,,,,,,,,,,4,4,normal,mixed,,,,9,,,2,10,9,,,0.00575881,COMPLETE
362,,56:40.7,57:22.7,0 days 00:00:42.013150,4,64,32,32,3,5,8,2,10,4,2,2,10,10,,,6,6,7,10,7,6,5,,,,,,,,,,,,,,,,,,,,,,,,4,4,mixed,mixed,,,8,7,,,2,10,8,,,0.004378509,FAIL
363,,57:22.7,58:04.7,0 days 00:00:41.981494,4,64,32,32,3,5,8,2,10,5,2,2,10,10,,,9,6,7,10,7,6,5,,,,,,,,,,,,,,,,,,,,,,,,4,4,mixed,mixed,,,8,7,,,2,10,8,,,0.00440783,FAIL
364,306.5813904,58:04.7,58:43.5,0 days 00:00:38.856874,4,64,32,32,3,5,,,,,,,,,,,6,6,7,10,7,6,5,,,,,,,,,,,,,,,,,,,,,,,,4,4,normal,mixed,,,,7,,,2,10,8,,,0.003710521,COMPLETE
365,,58:43.5,59:25.3,0 days 00:00:41.714901,4,16,32,128,3,5,9,2,9,4,2,2,10,10,,,9,3,9,6,6,5,4,,,,,,,,,,,,,,,,,,,,,,,,4,4,mixed,mixed,,,8,7,,,2,10,8,,,0.004339248,FAIL
366,,59:25.3,00:06.8,0 days 00:00:41.563065,4,16,32,128,3,5,8,2,10,4,2,2,10,10,,,9,3,9,6,6,5,4,,,,,,,,,,,,,,,,,,,,,,,,4,4,mixed,mixed,,,8,7,,,2,10,8,,,0.004311947,FAIL
367,170.3135986,00:06.8,00:45.7,0 days 00:00:38.907529,4,64,32,128,3,5,,,,,,,,,,,9,3,9,6,6,5,4,,,,,,,,,,,,,,,,,,,,,,,,4,4,normal,mixed,,,,7,,,2,10,8,,,0.004358072,COMPLETE
368,139.6569672,00:45.7,01:23.9,0 days 00:00:38.165469,4,16,32,32,3,5,,,,,,,,,,,9,2,7,10,4,4,3,,,,,,,,,,,,,,,,,,,,,,,,4,4,normal,mixed,,,,7,,,2,10,7,,,0.006678853,COMPLETE
369,,01:23.9,02:04.9,0 days 00:00:41.039973,4,64,32,8,3,5,8,2,10,4,2,2,10,10,,,9,3,7,6,6,3,2,,,,,,,,,,,,,,,,,,,,,,,,4,4,mixed,mixed,,,8,7,,,2,9,8,,,0.005315434,FAIL
370,189.5189362,02:04.9,02:43.3,0 days 00:00:38.400330,4,64,32,32,3,5,,,,,,,,,,,9,10,7,6,6,3,4,,,,,,,,,,,,,,,,,,,,,,,,4,4,normal,mixed,,,,7,,,2,9,8,,,0.005427828,COMPLETE
371,,02:43.3,03:25.1,0 days 00:00:41.767656,4,64,32,8,3,5,8,2,10,4,2,2,10,10,,,10,3,7,10,6,5,,,,,,,,,,,,,,,,,,,,,,,,,4,4,mixed,mixed,,,8,6,,,2,10,8,,,0.004786287,FAIL
372,,03:25.1,04:06.5,0 days 00:00:41.339736,4,64,32,8,3,5,8,2,10,4,2,2,10,10,,,10,3,7,10,5,5,,,,,,,,,,,,,,,,,,,,,,,,,4,4,mixed,mixed,,,8,6,,,2,10,8,,,0.00477543,FAIL
373,,04:06.5,04:47.9,0 days 00:00:41.416960,4,64,32,64,3,5,8,2,10,4,2,2,10,10,,,10,3,7,10,5,5,,,,,,,,,,,,,,,,,,,,,,,,,4,4,mixed,mixed,,,8,6,,,2,10,8,,,0.004420512,FAIL
374,,04:47.9,05:29.4,0 days 00:00:41.560676,4,64,32,8,3,5,8,2,10,4,2,2,10,10,,,10,3,7,10,5,5,,,,,,,,,,,,,,,,,,,,,,,,,4,4,mixed,mixed,,,8,6,,,2,10,8,,,0.003874901,FAIL
375,179.084671,05:29.4,06:08.0,0 days 00:00:38.568798,4,64,32,8,3,5,,,,,,,,,,,10,3,7,10,5,5,,,,,,,,,,,,,,,,,,,,,,,,,4,4,normal,mixed,,,,6,,,2,10,8,,,0.004248953,COMPLETE
376,,06:08.0,06:52.2,0 days 00:00:44.163336,4,64,128,128,3,5,8,2,10,4,2,2,10,10,,,9,6,10,6,4,5,2,5,8,7,,,,,,,,,,,,,,,,,,,,,4,4,mixed,mixed,,,8,10,,,2,10,8,,,0.00382662,FAIL
377,,06:52.2,07:34.2,0 days 00:00:41.995992,4,64,128,64,3,5,8,2,10,4,2,2,10,10,,,9,6,6,6,4,5,2,,,,,,,,,,,,,,,,,,,,,,,,4,4,mixed,mixed,,,8,7,,,2,10,8,,,0.004845372,FAIL
378,,07:34.2,08:17.9,0 days 00:00:43.671891,4,64,16,64,3,5,8,2,10,4,2,2,10,10,,,9,6,10,6,3,5,7,5,8,7,,,,,,,,,,,,,,,,,,,,,4,4,mixed,mixed,,,8,10,,,2,10,8,,,0.00479089,FAIL
379,,08:17.9,08:59.8,0 days 00:00:41.960245,4,64,32,64,3,5,9,2,10,4,2,2,10,10,,,9,6,6,6,4,5,7,,,,,,,,,,,,,,,,,,,,,,,,4,4,mixed,mixed,,,8,7,,,2,10,8,,,0.004770316,FAIL
380,,08:59.8,09:42.0,0 days 00:00:42.206258,4,64,16,64,3,5,8,2,9,4,2,10,10,10,,,9,6,10,6,3,5,4,,,,,,,,,,,,,,,,,,,,,,,,4,4,mixed,mixed,,,8,7,,,2,10,8,,,0.004733338,FAIL
381,137.745636,09:42.0,10:21.1,0 days 00:00:39.049818,4,64,128,64,3,5,,,,,,,,,,,9,6,10,6,3,5,2,,,,,,,,,,,,,,,,,,,,,,,,4,4,normal,mixed,,,,7,,,2,10,8,,,0.004856826,COMPLETE
382,169.6921234,10:21.1,11:00.7,0 days 00:00:39.579563,4,64,32,128,3,5,,,,,,,,,,,8,2,6,6,6,5,7,5,8,,,,,,,,,,,,,,,,,,,,,,4,4,normal,mixed,,,,9,,,2,10,8,,,0.003744527,COMPLETE
383,,11:00.7,11:43.5,0 days 00:00:42.821736,4,64,32,16,3,5,9,2,10,4,2,2,10,10,,,9,3,7,7,4,5,4,5,7,7,,,,,,,,,,,,,,,,,,,,,4,4,mixed,mixed,,,8,10,,,2,10,9,,,0.006161196,FAIL
384,171.1691742,11:43.5,12:21.9,0 days 00:00:38.412820,4,64,16,16,3,5,,,,,,,,,,,9,3,7,7,4,5,5,,,,,,,,,,,,,,,,,,,,,,,,4,4,normal,mixed,,,,7,,,2,10,9,,,0.005958182,COMPLETE
385,114.7307587,12:21.9,13:00.6,0 days 00:00:38.706290,4,8,32,32,3,5,,,,,,,,,,,9,6,8,10,6,3,4,,,,,,,,,,,,,,,,,,,,,,,,4,4,normal,mixed,,,,7,,,2,10,8,,,0.004563504,COMPLETE
386,,13:00.6,13:42.5,0 days 00:00:41.841201,4,8,32,32,3,5,8,2,10,4,2,2,10,10,,,10,6,10,6,6,3,4,,,,,,,,,,,,,,,,,,,,,,,,4,4,mixed,mixed,,,8,7,,,2,10,8,,,0.004654253,FAIL
387,269.6997986,13:42.5,14:21.1,0 days 00:00:38.588822,4,64,32,32,3,5,,,,,,,,,,,10,6,10,6,6,3,4,,,,,,,,,,,,,,,,,,,,,,,,4,4,normal,mixed,,,,7,,,2,10,8,,,0.004678981,COMPLETE
388,,14:21.1,15:02.0,0 days 00:00:40.944439,4,8,64,32,3,5,8,2,10,4,2,2,10,10,,,9,3,7,6,6,2,,,,,,,,,,,,,,,,,,,,,,,,,4,4,mixed,mixed,,,8,6,,,2,10,9,,,0.00499529,FAIL
389,880.4059448,15:02.0,15:40.0,0 days 00:00:38.008915,4,8,64,32,3,5,,,,,,,,,,,9,3,7,6,6,3,,,,,,,,,,,,,,,,,,,,,,,,,4,4,normal,mixed,,,,6,,,2,10,9,,,0.005020041,COMPLETE
390,,15:40.0,16:21.8,0 days 00:00:41.790398,4,64,32,32,3,5,9,2,10,4,2,2,10,10,,,9,6,7,6,7,3,4,,,,,,,,,,,,,,,,,,,,,,,,4,4,mixed,mixed,,,8,7,,,2,10,8,,,0.004300953,FAIL
391,129.1306305,16:21.8,17:00.3,0 days 00:00:38.535372,4,8,32,32,3,5,,,,,,,,,,,9,6,7,6,7,3,4,,,,,,,,,,,,,,,,,,,,,,,,4,4,normal,mixed,,,,7,,,2,10,8,,,0.004360753,COMPLETE
392,,17:00.3,17:41.9,0 days 00:00:41.525446,4,8,32,32,3,5,8,2,10,5,2,2,10,9,,,9,6,7,6,7,3,4,,,,,,,,,,,,,,,,,,,,,,,,4,4,mixed,mixed,,,8,7,,,2,10,8,,,0.005383411,FAIL
393,,17:41.9,18:23.2,0 days 00:00:41.294521,4,8,32,32,3,5,8,2,10,4,2,2,10,10,,,9,6,7,6,7,3,4,,,,,,,,,,,,,,,,,,,,,,,,4,4,mixed,mixed,,,8,7,,,2,9,8,,,0.005324542,FAIL
394,315.0119629,18:23.2,19:01.5,0 days 00:00:38.373352,4,8,32,32,3,5,,,,,,,,,,,9,6,7,6,7,3,4,,,,,,,,,,,,,,,,,,,,,,,,4,4,normal,mixed,,,,7,,,2,9,8,,,0.004155572,COMPLETE
395,,19:01.5,19:42.5,0 days 00:00:40.996074,4,8,32,32,3,5,8,2,10,4,2,2,10,10,,,9,6,8,10,7,3,4,,,,,,,,,,,,,,,,,,,,,,,,4,4,mixed,mixed,,,8,7,,,2,10,8,,,0.0054166,FAIL
396,,19:42.5,20:23.9,0 days 00:00:41.312252,4,64,32,32,3,5,8,2,10,4,2,2,10,10,,,9,6,7,10,7,3,6,,,,,,,,,,,,,,,,,,,,,,,,4,4,mixed,mixed,,,8,7,,,2,10,8,,,0.005289562,FAIL
397,,20:23.9,21:05.2,0 days 00:00:41.350249,4,8,32,32,3,5,9,2,9,4,2,2,10,10,,,9,6,8,10,7,3,6,,,,,,,,,,,,,,,,,,,,,,,,4,4,mixed,mixed,,,8,7,,,2,10,8,,,0.00115331,FAIL
398,,21:05.2,21:45.6,0 days 00:00:40.356148,4,8,32,96,3,5,8,2,9,4,2,2,3,10,10,,9,6,7,,,,,,,,,,,,,,,,,,,,,,,,,,,,4,4,mixed,mixed,,,9,3,,,2,10,8,,,0.005334778,FAIL
399,,21:45.6,22:27.9,0 days 00:00:42.370232,4,8,32,96,3,5,8,6,10,4,2,2,10,10,,,9,6,8,10,7,3,6,,,,,,,,,,,,,,,,,,,,,,,,4,4,mixed,mixed,,,8,7,,,2,10,8,,,0.005465146,FAIL
400,,22:28.0,23:09.3,0 days 00:00:41.380120,4,8,32,96,3,5,8,2,10,4,2,2,10,10,,,9,6,8,10,7,3,6,,,,,,,,,,,,,,,,,,,,,,,,4,4,mixed,mixed,,,8,7,,,2,10,8,,,0.005419985,FAIL
401,,23:09.3,23:51.3,0 days 00:00:41.967565,4,8,32,96,3,5,8,2,10,4,2,10,10,10,,,9,6,8,10,7,3,4,,,,,,,,,,,,,,,,,,,,,,,,4,4,mixed,mixed,,,8,7,,,2,10,8,,,0.00526405,FAIL
402,,23:51.3,24:31.9,0 days 00:00:40.628852,4,8,32,96,3,5,8,2,10,4,2,2,10,10,10,,9,6,8,,,,,,,,,,,,,,,,,,,,,,,,,,,,4,4,mixed,mixed,,,9,3,,,2,10,8,,,0.005538433,FAIL
403,,24:31.9,25:14.1,0 days 00:00:42.195147,4,8,32,96,3,5,8,2,10,4,2,2,10,10,10,,9,6,8,10,7,3,6,,,,,,,,,,,,,,,,,,,,,,,,4,4,mixed,mixed,,,9,7,,,2,10,8,,,0.005559221,FAIL
404,,25:14.1,25:56.2,0 days 00:00:42.039272,4,8,32,96,3,5,8,6,10,4,2,2,10,10,,,9,6,8,10,7,3,6,,,,,,,,,,,,,,,,,,,,,,,,4,4,mixed,mixed,,,8,7,,,2,10,8,,,0.005680072,FAIL
405,,25:56.2,26:37.9,0 days 00:00:41.677556,4,8,32,96,3,5,8,2,10,4,3,2,10,9,,,9,6,7,10,7,3,6,,,,,,,,,,,,,,,,,,,,,,,,4,4,mixed,mixed,,,8,7,,,2,10,8,,,0.005393914,FAIL
406,,26:37.9,27:19.2,0 days 00:00:41.299667,4,8,32,32,3,5,8,2,10,4,2,2,10,10,,,9,6,8,10,7,3,6,,,,,,,,,,,,,,,,,,,,,,,,4,4,mixed,mixed,,,8,7,,,2,10,8,,,0.005511905,FAIL
407,,27:19.2,28:00.4,0 days 00:00:41.249165,4,8,32,96,3,5,8,2,10,5,2,2,10,10,,,9,6,8,10,7,3,6,,,,,,,,,,,,,,,,,,,,,,,,4,4,mixed,mixed,,,8,7,,,2,10,8,,,0.005489423,FAIL
408,,28:00.4,28:41.8,0 days 00:00:41.357128,4,8,32,32,3,5,8,2,10,4,2,2,10,10,,,9,6,7,10,7,3,6,,,,,,,,,,,,,,,,,,,,,,,,4,4,mixed,mixed,,,8,7,,,2,10,8,,,0.005454815,FAIL
409,160.0037231,28:41.8,29:20.2,0 days 00:00:38.418603,4,8,32,96,3,5,,,,,,,,,,,9,6,8,10,7,3,6,,,,,,,,,,,,,,,,,,,,,,,,4,4,normal,mixed,,,,7,,,2,10,8,,,0.005390851,COMPLETE
410,,29:20.2,30:01.0,0 days 00:00:40.815740,4,64,32,32,3,5,8,2,10,4,2,2,10,10,,,9,6,7,6,8,3,4,,,,,,,,,,,,,,,,,,,,,,,,4,4,mixed,mixed,,,8,7,,,2,10,8,,,0.005826085,FAIL
411,194.1039581,30:01.0,30:39.0,0 days 00:00:37.961544,4,8,32,32,3,5,,,,,,,,,,,9,6,7,6,7,3,4,,,,,,,,,,,,,,,,,,,,,,,,4,4,normal,mixed,,,,7,,,2,10,8,,,0.005819577,COMPLETE
412,,30:39.0,31:20.8,0 days 00:00:41.816374,4,8,96,16,3,5,8,2,10,4,2,10,10,10,,,9,5,7,5,5,3,4,,,,,,,,,,,,,,,,,,,,,,,,4,4,mixed,mixed,,,8,7,,,2,10,7,,,0.003975205,FAIL
413,,31:20.8,32:02.4,0 days 00:00:41.592716,4,8,96,16,3,5,8,2,10,4,2,2,10,10,,,9,5,7,10,5,3,4,,,,,,,,,,,,,,,,,,,,,,,,4,4,mixed,mixed,,,8,7,,,2,10,7,,,0.003137918,FAIL
414,,32:02.4,32:44.7,0 days 00:00:42.253640,4,8,96,16,3,5,8,2,10,4,3,2,10,10,10,,9,5,7,10,5,3,4,,,,,,,,,,,,,,,,,,,,,,,,4,4,mixed,mixed,,,9,7,,,2,10,7,,,0.003980693,FAIL
415,,32:44.7,33:26.2,0 days 00:00:41.499195,4,8,96,16,3,5,8,2,10,4,2,2,10,10,,,9,6,7,5,5,3,4,,,,,,,,,,,,,,,,,,,,,,,,4,4,mixed,mixed,,,8,7,,,2,10,7,,,0.005152255,FAIL
416,,33:26.2,34:07.9,0 days 00:00:41.755697,4,8,96,16,3,5,8,2,10,4,2,2,10,10,,,9,6,7,10,5,3,4,,,,,,,,,,,,,,,,,,,,,,,,4,4,mixed,mixed,,,8,7,,,2,10,7,,,0.003970156,FAIL
417,,34:07.9,34:49.6,0 days 00:00:41.674627,4,16,96,16,3,5,8,2,10,5,2,2,10,10,,,9,6,7,10,5,3,4,,,,,,,,,,,,,,,,,,,,,,,,4,4,mixed,mixed,,,8,7,,,2,10,7,,,0.001165267,FAIL
418,,34:49.6,35:30.9,0 days 00:00:41.267658,4,8,96,16,3,5,9,2,10,4,2,2,10,10,,,9,5,7,10,5,3,4,,,,,,,,,,,,,,,,,,,,,,,,4,4,mixed,mixed,,,8,7,,,2,10,8,,,0.004338674,FAIL
419,,35:30.9,36:12.3,0 days 00:00:41.453173,4,8,96,16,3,5,8,2,10,4,2,2,10,10,,,9,6,7,5,5,3,4,,,,,,,,,,,,,,,,,,,,,,,,4,4,mixed,mixed,,,8,7,,,2,10,7,,,0.003092115,FAIL
420,125.9646835,36:12.3,36:51.1,0 days 00:00:38.744015,4,8,96,16,3,5,,,,,,,,,,,9,5,7,10,5,3,4,,,,,,,,,,,,,,,,,,,,,,,,4,4,normal,mixed,,,,7,,,2,10,7,,,0.00312102,COMPLETE
421,,36:51.1,37:32.0,0 days 00:00:40.898547,4,8,96,16,3,5,8,2,10,4,2,2,10,10,,,8,5,7,10,5,3,4,,,,,,,,,,,,,,,,,,,,,,,,4,4,mixed,mixed,,,8,7,,,2,10,6,,,0.003094585,FAIL
422,,37:32.0,38:13.3,0 days 00:00:41.324248,4,8,96,16,3,5,8,2,10,4,3,2,10,10,,,8,5,7,10,5,3,4,,,,,,,,,,,,,,,,,,,,,,,,4,4,mixed,mixed,,,8,7,,,2,10,6,,,0.003156054,FAIL
423,367.5317383,38:13.3,38:51.6,0 days 00:00:38.299027,4,8,96,16,3,5,,,,,,,,,,,8,5,7,10,5,3,4,,,,,,,,,,,,,,,,,,,,,,,,4,4,normal,mixed,,,,7,,,2,10,6,,,0.003232837,COMPLETE
424,,38:51.6,39:31.8,0 days 00:00:40.243727,4,8,96,16,3,5,8,2,10,5,2,2,10,10,,,10,5,6,10,,,,,,,,,,,,,,,,,,,,,,,,,,,4,4,mixed,mixed,,,8,4,,,2,10,7,,,0.003122009,FAIL
425,,39:31.8,40:12.5,0 days 00:00:40.625727,4,8,96,16,3,5,8,2,10,4,2,2,10,9,,,10,5,6,10,,,,,,,,,,,,,,,,,,,,,,,,,,,4,4,mixed,mixed,,,8,4,,,2,10,7,,,0.003034156,FAIL
426,,40:12.5,40:54.1,0 days 00:00:41.624837,4,8,96,16,3,5,9,2,10,4,2,2,10,10,10,,10,5,6,10,5,3,,,,,,,,,,,,,,,,,,,,,,,,,4,4,mixed,mixed,,,9,6,,,2,10,7,,,0.003553442,FAIL
427,,40:54.1,41:34.9,0 days 00:00:40.788147,4,8,96,16,3,5,8,2,10,4,2,2,10,10,,,10,5,6,10,5,2,,,,,,,,,,,,,,,,,,,,,,,,,4,4,mixed,mixed,,,8,6,,,2,10,7,,,0.003468727,FAIL
428,,41:34.9,42:15.7,0 days 00:00:40.783481,4,8,96,16,3,5,8,2,10,4,2,2,10,10,,,10,5,6,10,5,2,,,,,,,,,,,,,,,,,,,,,,,,,4,4,mixed,mixed,,,8,6,,,2,10,7,,,0.003911625,FAIL
429,,42:15.7,42:56.6,0 days 00:00:40.942267,4,8,96,16,3,5,8,2,10,4,2,2,10,10,,,10,5,7,10,5,2,,,,,,,,,,,,,,,,,,,,,,,,,4,4,mixed,mixed,,,8,6,,,2,10,7,,,0.003007999,FAIL
430,,42:56.6,43:38.0,0 days 00:00:41.320908,4,8,96,16,3,5,8,2,10,4,2,2,10,10,,,10,5,6,10,5,2,,,,,,,,,,,,,,,,,,,,,,,,,4,4,mixed,mixed,,,8,6,,,2,10,7,,,0.003966937,FAIL
431,,43:38.0,44:18.8,0 days 00:00:40.843194,4,8,96,16,3,5,8,2,10,4,3,2,10,10,,,10,5,6,10,5,2,,,,,,,,,,,,,,,,,,,,,,,,,4,4,mixed,mixed,,,8,6,,,2,10,7,,,0.003015637,FAIL
432,118.3106079,44:18.8,44:56.7,0 days 00:00:37.876304,4,8,96,16,3,5,,,,,,,,,,,10,5,6,10,5,2,,,,,,,,,,,,,,,,,,,,,,,,,4,4,normal,mixed,,,,6,,,2,10,7,,,0.003120312,COMPLETE
433,,44:56.7,45:37.6,0 days 00:00:40.932753,4,8,96,16,3,5,8,2,10,4,2,2,10,10,,,10,5,4,10,5,3,,,,,,,,,,,,,,,,,,,,,,,,,3,4,mixed,mixed,,,8,6,,,2,10,7,,,0.003075628,FAIL
434,,45:37.6,46:18.6,0 days 00:00:40.941908,4,8,96,16,3,5,8,2,10,4,2,2,10,10,,,10,5,6,10,5,2,,,,,,,,,,,,,,,,,,,,,,,,,3,4,mixed,mixed,,,8,6,,,2,10,6,,,0.003042899,FAIL
435,,46:18.6,46:59.9,0 days 00:00:41.318116,4,8,96,16,3,5,8,6,10,4,2,2,10,9,,,10,5,6,10,5,2,,,,,,,,,,,,,,,,,,,,,,,,,3,4,mixed,mixed,,,8,6,,,2,10,7,,,0.003001673,FAIL
436,,46:59.9,47:40.8,0 days 00:00:40.909384,4,8,96,16,3,5,8,2,10,4,2,2,10,10,,,10,5,6,10,5,2,,,,,,,,,,,,,,,,,,,,,,,,,3,4,mixed,mixed,,,8,6,,,2,10,7,,,0.00305627,FAIL
437,203.7356262,47:40.8,48:18.6,0 days 00:00:37.848822,4,8,96,16,3,5,,,,,,,,,,,10,4,6,10,5,2,,,,,,,,,,,,,,,,,,,,,,,,,3,4,normal,mixed,,,,6,,,2,10,7,,,0.00307637,COMPLETE
438,,48:18.6,48:59.7,0 days 00:00:41.034547,4,8,96,16,3,5,8,2,10,4,2,2,10,10,,,10,5,6,8,5,2,,,,,,,,,,,,,,,,,,,,,,,,,4,4,mixed,mixed,,,8,6,,,2,9,6,,,0.002840803,FAIL
439,,48:59.7,49:40.6,0 days 00:00:40.910918,4,8,96,16,3,5,8,2,10,4,2,2,10,10,,,10,5,10,8,5,2,,,,,,,,,,,,,,,,,,,,,,,,,4,4,mixed,mixed,,,8,6,,,2,9,6,,,0.001153688,FAIL
440,,49:40.6,50:21.6,0 days 00:00:41.003295,4,8,96,16,3,5,8,2,10,4,2,2,10,10,,,10,5,6,8,5,2,,,,,,,,,,,,,,,,,,,,,,,,,4,4,mixed,mixed,,,8,6,,,2,9,6,,,0.003526654,FAIL
441,,50:21.6,51:02.4,0 days 00:00:40.820322,4,8,96,16,3,5,8,2,10,4,2,2,10,10,,,10,5,6,8,5,2,,,,,,,,,,,,,,,,,,,,,,,,,4,4,mixed,mixed,,,8,6,,,2,9,7,,,0.003481719,FAIL
442,,51:02.4,51:43.4,0 days 00:00:40.937717,4,8,96,16,3,5,8,2,10,4,2,2,10,10,,,10,5,6,8,5,2,,,,,,,,,,,,,,,,,,,,,,,,,4,4,mixed,mixed,,,8,6,,,2,9,6,,,0.002955451,FAIL
443,214.5704041,51:43.4,52:21.1,0 days 00:00:37.710320,4,8,96,16,3,5,,,,,,,,,,,10,5,6,8,5,2,,,,,,,,,,,,,,,,,,,,,,,,,4,4,normal,mixed,,,,6,,,2,9,7,,,0.002980577,COMPLETE
444,,52:21.1,53:02.4,0 days 00:00:41.307698,4,8,96,16,3,5,8,2,10,4,2,2,10,10,,,10,5,10,10,5,2,,,,,,,,,,,,,,,,,,,,,,,,,4,4,mixed,mixed,,,8,6,,,2,10,6,,,0.003323018,FAIL
445,,53:02.4,53:44.4,0 days 00:00:41.971296,4,8,96,16,3,5,8,2,10,4,2,2,10,10,10,,10,5,4,10,5,2,,,,,,,,,,,,,,,,,,,,,,,,,4,4,mixed,mixed,,,9,6,,,2,10,6,,,0.00350047,FAIL
446,155.5862732,53:44.4,54:22.5,0 days 00:00:38.087047,4,8,96,16,3,5,,,,,,,,,,,10,5,3,10,8,2,,,,,,,,,,,,,,,,,,,,,,,,,4,4,normal,mixed,,,,6,,,2,10,6,,,0.003473021,COMPLETE
447,150.5508881,54:22.5,55:01.1,0 days 00:00:38.614125,4,8,96,16,3,5,,,,,,,,,,,10,6,8,10,5,3,3,,,,,,,,,,,,,,,,,,,,,,,,4,4,normal,mixed,,,,7,,,2,10,7,,,0.003861217,COMPLETE
448,142.4595184,55:01.1,55:39.7,0 days 00:00:38.664454,4,8,96,16,3,5,,,,,,,,,,,9,4,10,10,5,3,5,,,,,,,,,,,,,,,,,,,,,,,,4,4,normal,mixed,,,,7,,,2,10,6,,,0.002871416,COMPLETE
449,,55:39.7,56:21.3,0 days 00:00:41.597556,4,8,96,16,3,5,8,2,10,4,2,2,10,10,,,9,6,5,10,5,2,4,,,,,,,,,,,,,,,,,,,,,,,,4,4,mixed,mixed,,,8,7,,,2,10,9,,,0.001065534,FAIL
450,,56:21.3,57:03.4,0 days 00:00:42.076759,4,8,96,16,3,5,8,2,9,4,2,10,10,10,,,9,6,7,10,5,2,4,,,,,,,,,,,,,,,,,,,,,,,,4,4,mixed,mixed,,,8,7,,,2,10,9,,,0.003288204,FAIL
451,201.1785278,57:03.4,57:42.1,0 days 00:00:38.665733,4,8,96,16,3,5,,,,,,,,,,,9,6,7,10,5,2,4,,,,,,,,,,,,,,,,,,,,,,,,4,4,normal,mixed,,,,7,,,2,10,9,,,0.003306437,COMPLETE
452,232.8427429,57:42.1,58:19.8,0 days 00:00:37.744489,4,8,96,64,3,5,,,,,,,,,,,10,5,5,6,5,,,,,,,,,,,,,,,,,,,,,,,,,,4,4,normal,mixed,,,,5,,,2,10,9,,,0.00107799,COMPLETE
453,,58:19.8,59:01.6,0 days 00:00:41.799580,4,8,96,16,3,5,8,2,10,4,2,2,10,9,10,,9,6,7,5,7,3,,,,,,,,,,,,,,,,,,,,,,,,,4,4,mixed,mixed,,,9,6,,,2,10,7,,,0.003574263,FAIL
454,,59:01.6,59:43.3,0 days 00:00:41.676678,4,8,96,16,3,5,8,6,10,4,2,2,10,10,,,9,6,7,10,7,3,,,,,,,,,,,,,,,,,,,,,,,,,4,4,mixed,mixed,,,8,6,,,2,10,7,,,0.003585182,FAIL
455,,59:43.3,00:24.6,0 days 00:00:41.281125,4,8,96,16,3,5,8,2,10,4,2,2,10,10,,,9,6,7,5,7,3,,,,,,,,,,,,,,,,,,,,,,,,,4,4,mixed,mixed,,,8,6,,,2,10,7,,,0.003565727,FAIL
456,,00:24.6,01:06.1,0 days 00:00:41.515973,4,64,96,16,3,5,8,2,10,4,2,2,10,10,,,9,6,7,10,5,3,,,,,,,,,,,,,,,,,,,,,,,,,4,4,mixed,mixed,,,8,6,,,2,10,7,,,0.003514239,FAIL
457,,01:06.1,01:47.7,0 days 00:00:41.597479,4,8,96,16,3,5,8,2,10,4,2,2,10,10,,,9,6,7,10,7,3,,,,,,,,,,,,,,,,,,,,,,,,,4,4,mixed,mixed,,,8,6,,,2,10,7,,,0.003555221,FAIL
458,142.0522766,01:47.7,02:26.0,0 days 00:00:38.247297,4,8,96,16,3,5,,,,,,,,,,,9,6,7,5,7,3,,,,,,,,,,,,,,,,,,,,,,,,,4,4,normal,mixed,,,,6,,,2,10,7,,,0.004027479,COMPLETE
459,,02:26.0,03:07.4,0 days 00:00:41.370617,4,8,96,16,3,5,8,2,10,5,3,2,10,10,,,6,4,7,9,6,4,4,,,,,,,,,,,,,,,,,,,,,,,,4,4,mixed,mixed,,,8,7,,,2,10,7,,,0.0035327,FAIL
460,166.8953857,03:07.4,03:46.3,0 days 00:00:38.957926,4,8,96,16,3,5,,,,,,,,,,,9,4,7,9,6,4,4,,,,,,,,,,,,,,,,,,,,,,,,4,4,normal,mixed,,,,7,,,2,10,7,,,0.003656032,COMPLETE
461,,03:46.3,04:27.9,0 days 00:00:41.561512,4,8,96,32,3,5,8,2,10,4,2,2,10,10,,,9,6,9,10,5,3,5,,,,,,,,,,,,,,,,,,,,,,,,4,4,mixed,mixed,,,8,7,,,2,10,8,,,0.003151324,FAIL
462,,04:27.9,05:09.8,0 days 00:00:41.893527,4,8,96,32,3,5,8,2,10,4,2,2,10,10,,,9,6,9,10,5,3,5,,,,,,,,,,,,,,,,,,,,,,,,4,4,mixed,mixed,,,8,7,,,2,10,8,,,0.004360034,FAIL
463,,05:09.8,05:51.5,0 days 00:00:41.746658,4,8,96,32,3,5,8,2,10,4,2,2,10,10,,,9,6,9,10,5,3,5,,,,,,,,,,,,,,,,,,,,,,,,4,4,mixed,mixed,,,8,7,,,2,10,8,,,0.004262871,FAIL
464,182.5008087,05:51.5,06:30.1,0 days 00:00:38.607380,4,8,96,32,3,5,,,,,,,,,,,6,6,9,10,5,3,5,,,,,,,,,,,,,,,,,,,,,,,,4,4,normal,mixed,,,,7,,,2,10,8,,,0.003219172,COMPLETE
465,214.890625,06:30.1,07:08.7,0 days 00:00:38.561982,4,8,96,32,3,5,,,,,,,,,,,9,6,7,7,6,2,4,,,,,,,,,,,,,,,,,,,,,,,,4,4,normal,mixed,,,,7,,,2,10,8,,,0.004574344,COMPLETE
466,,07:08.7,07:49.8,0 days 00:00:41.126122,4,16,32,16,3,5,8,2,10,4,2,2,10,9,,,9,6,7,6,7,3,4,,,,,,,,,,,,,,,,,,,,,,,,4,4,mixed,mixed,,,8,7,,,2,10,9,,,0.004279452,FAIL
467,,07:49.8,08:30.0,0 days 00:00:40.160010,4,16,32,64,3,5,8,6,10,4,2,2,10,10,,,9,6,4,,,,,,,,,,,,,,,,,,,,,,,,,,,,4,4,mixed,mixed,,,8,3,,,2,10,9,,,0.004283687,FAIL
468,,08:30.0,09:11.5,0 days 00:00:41.485124,4,16,32,64,3,5,8,2,10,4,2,2,10,10,,,9,6,4,6,7,3,4,,,,,,,,,,,,,,,,,,,,,,,,4,4,mixed,mixed,,,8,7,,,2,10,9,,,0.004280003,FAIL
469,142.0158234,09:11.5,09:49.8,0 days 00:00:38.282614,4,8,32,16,3,5,,,,,,,,,,,9,6,7,6,7,3,4,,,,,,,,,,,,,,,,,,,,,,,,4,4,normal,mixed,,,,7,,,2,10,9,,,0.003547549,COMPLETE
470,,09:49.8,10:31.9,0 days 00:00:42.090497,4,16,96,64,3,5,8,2,10,4,2,2,10,9,,,9,6,10,8,4,3,6,,,,,,,,,,,,,,,,,,,,,,,,4,4,mixed,mixed,,,8,7,,,2,9,8,,,0.004033773,FAIL
471,,10:31.9,11:14.4,0 days 00:00:42.550901,4,8,96,64,3,5,8,6,10,4,2,2,10,10,,,9,6,10,8,4,3,6,,,,,,,,,,,,,,,,,,,,,,,,4,4,mixed,mixed,,,8,7,,,2,9,8,,,0.002872806,FAIL
472,,11:14.4,11:57.1,0 days 00:00:42.645464,4,16,96,64,3,5,8,2,10,4,3,2,10,10,,,9,6,10,10,4,3,3,,,,,,,,,,,,,,,,,,,,,,,,4,4,mixed,mixed,,,8,7,,,2,9,8,,,0.002983593,FAIL
473,,11:57.1,12:39.3,0 days 00:00:42.246791,4,8,96,64,3,5,8,2,10,4,2,2,10,9,,,9,6,10,10,4,3,6,,,,,,,,,,,,,,,,,,,,,,,,4,4,mixed,mixed,,,8,7,,,2,9,8,,,0.004362045,FAIL
474,,12:39.3,13:21.2,0 days 00:00:41.842609,4,16,96,64,3,5,8,2,10,4,2,10,10,10,,,9,6,4,8,4,3,6,,,,,,,,,,,,,,,,,,,,,,,,4,4,mixed,mixed,,,8,7,,,2,9,8,,,0.002928628,FAIL
475,195.0827332,13:21.2,14:00.0,0 days 00:00:38.807535,4,16,96,64,3,5,,,,,,,,,,,9,6,10,10,4,3,6,,,,,,,,,,,,,,,,,,,,,,,,4,4,normal,mixed,,,,7,,,2,9,8,,,0.004283873,COMPLETE
476,,14:00.0,14:41.3,0 days 00:00:41.291151,4,8,128,32,3,5,9,2,9,4,3,2,10,10,,,10,5,6,6,5,4,3,,,,,,,,,,,,,,,,,,,,,,,,4,4,mixed,mixed,,,8,7,,,2,10,8,,,0.002960892,FAIL
