number,value,datetime_start,datetime_complete,duration,params_gat_heads,params_gat_hidden_0,params_gat_hidden_1,params_gat_hidden_2,params_gat_layers,params_gat_out,params_kan_arity_0_0,params_kan_arity_0_1,params_kan_arity_0_2,params_kan_arity_0_3,params_kan_arity_0_4,params_kan_arity_0_5,params_kan_arity_0_6,params_kan_arity_0_7,params_kan_arity_0_8,params_kan_arity_0_9,params_kan_arity_1_0,params_kan_arity_1_1,params_kan_arity_1_2,params_kan_arity_1_3,params_kan_arity_1_4,params_kan_arity_1_5,params_kan_arity_1_6,params_kan_arity_1_7,params_kan_arity_1_8,params_kan_arity_1_9,params_kan_arity_2_0,params_kan_arity_2_1,params_kan_arity_2_2,params_kan_arity_2_3,params_kan_arity_2_4,params_kan_arity_2_5,params_kan_arity_2_6,params_kan_arity_2_7,params_kan_arity_2_8,params_kan_arity_2_9,params_kan_arity_3_0,params_kan_arity_3_1,params_kan_arity_3_2,params_kan_arity_3_3,params_kan_arity_3_4,params_kan_arity_3_5,params_kan_arity_3_6,params_kan_arity_3_7,params_kan_arity_3_8,params_kan_arity_3_9,params_kan_grid,params_kan_k,params_kan_layer_type_0,params_kan_layer_type_1,params_kan_layer_type_2,params_kan_layer_type_3,params_kan_mult_nodes_0,params_kan_mult_nodes_1,params_kan_mult_nodes_2,params_kan_mult_nodes_3,params_kan_n_layers,params_kan_neurons_0,params_kan_neurons_1,params_kan_neurons_2,params_kan_neurons_3,params_lr,state
599,,41:00.1,41:44.2,0 days 00:00:44.114703,4,96,96,128,3,5,8,2,10,4,2,2,10,10,,,4,2,10,9,7,9,8,10,,,,,,,,,,,,,,,,,,,,,,,3,4,mixed,mixed,,,8,8,,,2,10,6,,,0.003488013,FAIL
600,,41:44.2,42:26.8,0 days 00:00:42.581684,4,96,96,128,3,5,8,2,10,4,2,2,3,10,,,3,2,5,9,7,6,3,6,,,,,,,,,,,,,,,,,,,,,,,4,4,mixed,mixed,,,8,8,,,2,10,9,,,0.002908448,FAIL
601,149.7149658,42:26.8,43:07.5,0 days 00:00:40.645637,4,96,96,128,3,5,,,,,,,,,,,10,2,5,9,7,6,8,10,,,,,,,,,,,,,,,,,,,,,,,3,4,normal,mixed,,,,8,,,2,10,9,,,0.002535631,COMPLETE
602,,43:07.5,43:51.2,0 days 00:00:43.752910,4,96,32,32,3,5,8,2,10,4,2,2,10,10,,,4,6,10,10,6,9,,,,,,,,,,,,,,,,,,,,,,,,,4,4,mixed,mixed,,,8,6,,,2,10,6,,,0.003509452,FAIL
603,156.6878815,43:51.2,44:29.5,0 days 00:00:38.293498,4,96,16,32,3,5,,,,,,,,,,,2,6,10,10,6,5,,,,,,,,,,,,,,,,,,,,,,,,,4,4,normal,mixed,,,,6,,,2,10,8,,,0.003483093,COMPLETE
604,,44:29.5,45:12.5,0 days 00:00:42.946176,4,96,32,32,3,5,8,2,10,4,2,2,10,10,,,8,6,6,10,4,4,6,,,,,,,,,,,,,,,,,,,,,,,,4,4,mixed,mixed,,,8,7,,,2,10,6,,,0.002954885,FAIL
605,227.6536102,45:12.5,45:50.8,0 days 00:00:38.297475,4,96,64,8,3,5,,,,,,,,,,,8,6,6,3,4,4,6,,,,,,,,,,,,,,,,,,,,,,,,4,4,normal,mixed,,,,7,,,2,10,6,,,0.002865522,COMPLETE
606,,45:50.8,46:33.1,0 days 00:00:42.327762,4,32,32,32,3,5,8,2,10,4,3,2,10,10,,,3,5,8,9,6,5,3,,,,,,,,,,,,,,,,,,,,,,,,4,4,mixed,mixed,,,8,7,,,2,10,9,,,0.004133502,FAIL
607,,46:33.1,47:15.9,0 days 00:00:42.769956,4,8,32,32,3,5,8,2,10,4,2,2,10,10,,,9,5,8,9,6,5,3,,,,,,,,,,,,,,,,,,,,,,,,4,4,mixed,mixed,,,8,7,,,2,10,9,,,0.004243652,FAIL
608,131.9724731,47:15.9,47:54.5,0 days 00:00:38.646185,4,8,32,32,3,5,,,,,,,,,,,9,5,8,9,6,5,4,,,,,,,,,,,,,,,,,,,,,,,,4,4,normal,mixed,,,,7,,,2,10,9,,,0.004160356,COMPLETE
609,,47:54.5,48:37.9,0 days 00:00:43.326599,4,8,32,32,3,5,8,2,10,4,2,2,10,10,,,9,5,8,9,6,5,3,,,,,,,,,,,,,,,,,,,,,,,,4,5,mixed,mixed,,,8,7,,,2,10,8,,,0.00430685,FAIL
610,,48:37.9,49:20.7,0 days 00:00:42.776294,4,8,32,32,3,5,8,2,10,4,2,2,10,10,,,9,5,8,9,6,5,3,,,,,,,,,,,,,,,,,,,,,,,,4,4,mixed,mixed,,,8,7,,,2,10,8,,,0.004239185,FAIL
611,,49:20.7,50:03.4,0 days 00:00:42.774414,4,8,32,32,3,5,8,2,10,4,2,2,10,10,,,9,5,8,9,6,5,3,,,,,,,,,,,,,,,,,,,,,,,,4,4,mixed,mixed,,,8,7,,,2,10,8,,,0.004183902,FAIL
612,,50:03.4,50:46.3,0 days 00:00:42.910920,4,8,32,32,3,5,8,2,10,4,2,2,10,10,,,3,5,8,9,6,5,3,,,,,,,,,,,,,,,,,,,,,,,,4,5,mixed,mixed,,,8,7,,,2,10,8,,,0.004222404,FAIL
613,,50:46.3,51:29.7,0 days 00:00:43.330061,4,8,32,32,3,5,8,2,10,4,2,2,10,10,,,9,5,8,9,6,5,3,,,,,,,,,,,,,,,,,,,,,,,,4,4,mixed,mixed,,,8,7,,,2,10,8,,,0.004221028,FAIL
614,139.4022369,51:29.7,52:09.4,0 days 00:00:39.733835,4,8,32,32,3,5,,,,,,,,,,,9,5,8,9,6,5,3,,,,,,,,,,,,,,,,,,,,,,,,4,4,normal,mixed,,,,7,,,2,10,8,,,0.004145254,COMPLETE
615,224.4200134,52:09.4,52:49.6,0 days 00:00:40.146379,4,8,32,32,3,5,,,,,,,,,,,9,5,8,9,6,6,4,,,,,,,,,,,,,,,,,,,,,,,,4,4,normal,mixed,,,,7,,,2,10,7,,,0.001351793,COMPLETE
616,,52:49.6,53:33.3,0 days 00:00:43.747614,4,8,32,32,3,5,8,2,10,4,2,2,10,10,,,9,5,8,9,5,9,5,,,,,,,,,,,,,,,,,,,,,,,,4,5,mixed,mixed,,,8,7,,,2,10,8,,,0.004656915,FAIL
617,143.0186615,53:33.3,54:13.5,0 days 00:00:40.227218,4,8,32,32,3,5,,,,,,,,,,,3,5,8,9,5,5,5,,,,,,,,,,,,,,,,,,,,,,,,4,5,normal,mixed,,,,7,,,2,10,8,,,0.004694038,COMPLETE
618,,54:13.6,54:57.5,0 days 00:00:43.930339,4,8,32,32,3,5,8,2,10,4,2,10,10,10,,,4,5,8,10,6,9,3,7,9,2,,,,,,,,,,,,,,,,,,,,,4,4,mixed,mixed,,,8,10,,,2,10,9,,,0.003055299,FAIL
619,,54:57.5,55:40.7,0 days 00:00:43.164251,4,8,32,32,3,5,8,2,10,4,2,2,3,10,,,9,5,8,10,6,5,,,,,,,,,,,,,,,,,,,,,,,,,4,4,mixed,mixed,,,8,6,,,2,10,9,,,0.004260042,FAIL
620,,55:40.7,56:24.0,0 days 00:00:43.335019,4,8,32,32,3,5,9,2,10,4,2,2,10,10,,,4,5,8,10,6,9,3,7,9,2,,,,,,,,,,,,,,,,,,,,,4,4,mixed,mixed,,,8,10,,,2,10,9,,,0.004183134,FAIL
621,,56:24.0,57:08.1,0 days 00:00:44.088143,4,8,32,32,3,5,8,2,10,4,2,2,10,10,,,4,5,8,10,6,5,3,7,9,2,,,,,,,,,,,,,,,,,,,,,4,4,mixed,mixed,,,8,10,,,2,10,9,,,0.004202378,FAIL
622,,57:08.1,57:51.9,0 days 00:00:43.827259,4,8,32,32,3,5,8,2,10,4,2,2,10,10,,,4,5,8,10,6,5,3,7,9,2,,,,,,,,,,,,,,,,,,,,,4,4,mixed,mixed,,,8,10,,,2,10,9,,,0.004142819,FAIL
623,,57:51.9,58:35.3,0 days 00:00:43.343568,4,8,32,32,3,5,8,2,10,4,2,2,10,10,,,9,5,8,10,6,5,3,7,9,2,,,,,,,,,,,,,,,,,,,,,4,4,mixed,mixed,,,8,10,,,2,10,9,,,0.003124501,FAIL
624,197.6872406,58:35.3,59:14.9,0 days 00:00:39.584328,4,8,32,32,3,5,,,,,,,,,,,9,5,8,10,6,5,,,,,,,,,,,,,,,,,,,,,,,,,4,4,normal,mixed,,,,6,,,2,10,9,,,0.004277212,COMPLETE
625,,59:14.9,59:59.7,0 days 00:00:44.875816,4,8,32,32,3,5,8,2,10,4,2,2,10,10,,,9,2,7,10,4,5,3,7,9,2,,,,,,,,,,,,,,,,,,,,,4,4,mixed,mixed,,,8,10,,,2,9,8,,,0.003122185,FAIL
626,,59:59.7,00:43.3,0 days 00:00:43.545268,4,8,32,32,3,5,8,2,10,4,2,2,10,10,,,9,2,7,10,4,9,3,,,,,,,,,,,,,,,,,,,,,,,,4,4,mixed,mixed,,,8,7,,,2,9,8,,,0.003059476,FAIL
627,172.7381134,00:43.3,01:22.1,0 days 00:00:38.773665,4,8,32,32,3,5,,,,,,,,,,,9,2,7,10,4,5,3,,,,,,,,,,,,,,,,,,,,,,,,4,4,normal,mixed,,,,7,,,2,10,6,,,0.003461876,COMPLETE
628,,01:22.1,02:05.7,0 days 00:00:43.659968,4,32,32,16,3,5,2,2,10,4,2,2,10,10,,,9,5,7,10,7,5,5,7,9,,,,,,,,,,,,,,,,,,,,,,4,4,mixed,mixed,,,8,9,,,2,9,8,,,0.002938455,FAIL
629,,02:05.7,02:48.5,0 days 00:00:42.763627,4,32,32,16,3,5,8,2,10,4,2,2,10,10,,,9,5,7,10,7,5,5,6,9,,,,,,,,,,,,,,,,,,,,,,4,4,mixed,mixed,,,8,9,,,2,9,8,,,0.003207359,FAIL
630,,02:48.5,03:31.6,0 days 00:00:43.075936,4,8,32,16,3,5,8,2,10,5,2,2,10,10,,,9,5,7,10,7,5,10,7,9,,,,,,,,,,,,,,,,,,,,,,4,4,mixed,mixed,,,8,9,,,2,10,8,,,0.003069911,FAIL
631,,03:31.6,04:15.1,0 days 00:00:43.543508,4,32,32,16,3,5,8,2,10,4,2,2,10,10,,,4,5,7,10,7,5,5,7,9,,,,,,,,,,,,,,,,,,,,,,4,4,mixed,mixed,,,8,9,,,2,9,8,,,0.003883243,FAIL
632,,04:15.1,04:59.5,0 days 00:00:44.381261,4,8,32,16,3,5,8,2,10,4,2,2,10,10,,,4,5,7,10,7,5,4,7,9,,,,,,,,,,,,,,,,,,,,,,4,4,mixed,mixed,,,8,9,,,2,9,8,,,0.003012658,FAIL
633,,04:59.5,05:43.5,0 days 00:00:44.017972,4,32,32,16,3,5,9,2,9,4,2,2,10,10,,,4,5,7,10,7,5,5,7,9,,,,,,,,,,,,,,,,,,,,,,4,4,mixed,mixed,,,8,9,,,2,9,8,,,0.003997775,FAIL
634,,05:43.5,06:26.6,0 days 00:00:43.056761,4,32,32,16,3,5,8,2,10,4,2,2,10,10,,,9,5,7,10,7,5,10,6,9,,,,,,,,,,,,,,,,,,,,,,4,4,mixed,mixed,,,8,9,,,2,9,8,,,0.003059422,FAIL
635,,06:26.6,07:09.9,0 days 00:00:43.294049,4,16,32,16,3,5,8,2,10,4,3,2,10,10,,,9,5,7,10,9,5,5,7,9,,,,,,,,,,,,,,,,,,,,,,4,4,mixed,mixed,,,8,9,,,2,10,8,,,0.003030179,FAIL
636,,07:09.9,07:53.6,0 days 00:00:43.678102,4,32,32,16,3,5,8,2,10,4,2,2,10,10,,,4,5,7,10,7,5,5,,,,,,,,,,,,,,,,,,,,,,,,4,4,mixed,mixed,,,8,7,,,2,9,8,,,0.003086071,FAIL
637,185.1416779,07:53.6,08:35.0,0 days 00:00:41.416412,4,32,32,16,3,5,,,,,,,,,,,9,5,7,10,7,5,5,7,9,,,,,,,,,,,,,,,,,,,,,,4,4,normal,mixed,,,,9,,,2,9,8,,,0.003913088,COMPLETE
638,185.9004211,08:35.0,09:15.0,0 days 00:00:39.995744,4,16,32,32,3,5,,,,,,,,,,,4,2,8,9,5,9,6,5,,,,,,,,,,,,,,,,,,,,,,,4,4,normal,mixed,,,,8,,,2,10,8,,,0.003156515,COMPLETE
639,,09:15.0,09:58.8,0 days 00:00:43.768325,4,8,32,128,3,5,8,2,10,4,2,2,10,10,,,7,4,7,9,6,5,4,,,,,,,,,,,,,,,,,,,,,,,,4,4,mixed,mixed,,,8,7,,,2,10,10,,,0.004870767,FAIL
640,,09:58.8,10:42.8,0 days 00:00:44.084705,4,8,32,128,3,5,8,2,10,4,2,2,10,10,,,9,4,7,9,6,5,10,,,,,,,,,,,,,,,,,,,,,,,,4,4,mixed,mixed,,,8,7,,,2,10,10,,,0.004772066,FAIL
641,145.4353333,10:42.8,11:22.3,0 days 00:00:39.420219,4,8,32,128,3,5,,,,,,,,,,,4,4,7,9,6,5,10,,,,,,,,,,,,,,,,,,,,,,,,4,4,normal,mixed,,,,7,,,2,10,10,,,0.004682122,COMPLETE
642,,11:22.3,12:05.6,0 days 00:00:43.302653,4,8,32,96,3,5,8,2,10,4,2,2,10,10,,,9,2,5,10,5,4,8,,,,,,,,,,,,,,,,,,,,,,,,4,4,mixed,mixed,,,8,7,,,2,10,8,,,0.003019969,FAIL
643,,12:05.6,12:48.9,0 days 00:00:43.322690,4,8,32,96,3,5,8,2,10,4,2,2,10,10,,,9,2,5,10,5,4,8,,,,,,,,,,,,,,,,,,,,,,,,4,4,mixed,mixed,,,8,7,,,2,10,8,,,0.002425266,FAIL
644,,12:48.9,13:31.9,0 days 00:00:42.950223,4,8,32,32,3,5,8,2,10,4,2,2,10,10,,,9,2,7,10,5,4,4,,,,,,,,,,,,,,,,,,,,,,,,4,4,mixed,mixed,,,8,7,,,2,10,8,,,0.003067952,FAIL
645,,13:31.9,14:14.7,0 days 00:00:42.855493,4,8,32,32,3,5,8,2,10,4,2,2,10,9,,,9,2,5,10,5,4,8,,,,,,,,,,,,,,,,,,,,,,,,4,4,mixed,mixed,,,8,7,,,2,10,8,,,0.002965802,FAIL
646,,14:14.7,14:57.8,0 days 00:00:43.080184,4,8,32,32,3,5,8,6,10,4,2,2,10,10,,,9,2,7,10,5,4,4,,,,,,,,,,,,,,,,,,,,,,,,4,4,mixed,mixed,,,8,7,,,2,10,8,,,0.004238095,FAIL
647,,14:57.8,15:40.7,0 days 00:00:42.880585,3,8,32,32,3,5,8,2,10,4,2,2,10,10,,,9,2,5,10,5,4,8,,,,,,,,,,,,,,,,,,,,,,,,4,4,mixed,mixed,,,8,7,,,2,10,8,,,0.004214866,FAIL
648,,15:40.7,16:24.5,0 days 00:00:43.850203,4,8,32,96,3,5,8,2,10,4,2,10,10,10,,,9,2,5,10,5,4,4,,,,,,,,,,,,,,,,,,,,,,,,4,4,mixed,mixed,,,8,7,,,2,10,8,,,0.000841399,FAIL
649,283.5422974,16:24.5,17:03.5,0 days 00:00:38.949340,4,8,32,32,3,5,,,,,,,,,,,9,2,7,10,5,4,4,,,,,,,,,,,,,,,,,,,,,,,,4,4,normal,mixed,,,,7,,,2,10,8,,,0.002949049,COMPLETE
650,,17:03.5,17:46.1,0 days 00:00:42.620427,4,8,32,96,3,5,8,2,10,4,2,2,10,10,,,3,7,7,6,9,,,,,,,,,,,,,,,,,,,,,,,,,,4,4,mixed,mixed,,,8,5,,,2,10,9,,,0.004143198,FAIL
651,,17:46.1,18:29.0,0 days 00:00:42.905334,4,8,32,96,3,5,8,2,10,4,2,2,10,10,,,9,7,7,6,6,,,,,,,,,,,,,,,,,,,,,,,,,,4,4,mixed,mixed,,,8,5,,,2,10,9,,,0.004365553,FAIL
652,,18:29.0,19:11.6,0 days 00:00:42.547058,4,8,32,96,3,5,8,2,10,4,2,2,10,10,,,3,7,7,6,6,,,,,,,,,,,,,,,,,,,,,,,,,,4,4,mixed,mixed,,,8,5,,,2,10,9,,,0.004263318,FAIL
653,164.2380981,19:11.6,19:50.7,0 days 00:00:39.116438,4,8,32,16,3,5,,,,,,,,,,,9,7,5,6,6,5,4,,,,,,,,,,,,,,,,,,,,,,,,4,4,normal,mixed,,,,7,,,2,10,9,,,0.004262818,COMPLETE
654,,19:50.7,20:34.0,0 days 00:00:43.278425,4,96,32,32,3,5,8,2,10,4,2,2,10,10,,,9,5,7,10,4,5,,,,,,,,,,,,,,,,,,,,,,,,,4,4,mixed,mixed,,,8,6,,,2,10,8,,,0.005408897,FAIL
655,,20:34.0,21:17.6,0 days 00:00:43.589756,4,96,32,32,3,5,8,2,10,4,3,2,3,10,10,,9,5,7,10,4,5,,,,,,,,,,,,,,,,,,,,,,,,,4,4,mixed,mixed,,,9,6,,,2,10,8,,,0.00238956,FAIL
656,,21:17.6,21:59.9,0 days 00:00:42.324571,3,96,32,32,3,5,8,2,10,4,2,2,10,,,,9,5,7,10,4,5,,,,,,,,,,,,,,,,,,,,,,,,,4,4,mixed,mixed,,,7,6,,,2,10,8,,,0.005579849,FAIL
657,,21:59.9,22:42.3,0 days 00:00:42.427565,3,96,32,32,3,5,8,2,10,4,2,2,10,10,,,3,5,7,10,4,5,,,,,,,,,,,,,,,,,,,,,,,,,4,4,mixed,mixed,,,8,6,,,2,10,8,,,0.005468598,FAIL
658,,22:42.3,23:25.6,0 days 00:00:43.310117,3,96,32,96,3,5,8,2,10,4,3,2,10,10,,,9,5,7,10,4,5,,,,,,,,,,,,,,,,,,,,,,,,,4,4,mixed,mixed,,,8,6,,,2,10,8,,,0.005081484,FAIL
659,,23:25.6,24:09.1,0 days 00:00:43.445077,4,96,32,96,3,5,8,2,10,4,2,2,10,10,,,9,2,7,10,6,5,,,,,,,,,,,,,,,,,,,,,,,,,4,4,mixed,mixed,,,8,6,,,2,10,8,,,0.005583058,FAIL
660,,24:09.1,24:51.8,0 days 00:00:42.737571,3,96,32,32,3,5,9,6,9,4,2,2,3,10,,,9,5,7,10,4,5,,,,,,,,,,,,,,,,,,,,,,,,,4,4,mixed,mixed,,,8,6,,,2,10,8,,,0.002422369,FAIL
661,,24:51.8,25:34.9,0 days 00:00:43.029920,4,96,32,32,3,5,8,2,10,4,2,2,10,10,,,9,5,7,10,4,5,,,,,,,,,,,,,,,,,,,,,,,,,4,4,mixed,mixed,,,8,6,,,2,10,8,,,0.000861322,FAIL
662,,25:34.9,26:17.9,0 days 00:00:43.074533,4,96,32,32,3,5,8,2,10,4,2,2,10,10,,,9,5,7,10,4,5,,,,,,,,,,,,,,,,,,,,,,,,,4,4,mixed,mixed,,,8,6,,,2,10,8,,,0.002418034,FAIL
663,,26:18.0,27:01.4,0 days 00:00:43.416989,4,96,32,96,3,5,8,2,10,4,2,2,10,10,,,9,5,7,10,4,5,,,,,,,,,,,,,,,,,,,,,,,,,4,4,mixed,mixed,,,8,6,,,2,10,8,,,0.005023917,FAIL
664,,27:01.4,27:44.0,0 days 00:00:42.614856,4,96,32,32,3,5,8,2,10,4,2,2,10,10,,,3,5,7,10,4,5,,,,,,,,,,,,,,,,,,,,,,,,,4,4,mixed,mixed,,,8,6,,,2,10,8,,,0.00522414,FAIL
665,,27:44.0,28:27.2,0 days 00:00:43.220580,4,96,32,96,3,5,8,2,10,4,2,2,10,10,,,9,5,7,10,4,5,,,,,,,,,,,,,,,,,,,,,,,,,4,4,mixed,mixed,,,8,6,,,2,10,8,,,0.005063913,FAIL
666,,28:27.2,29:10.3,0 days 00:00:43.050791,3,96,32,96,3,5,8,2,10,4,2,2,10,10,,,9,5,7,10,4,5,,,,,,,,,,,,,,,,,,,,,,,,,4,4,mixed,mixed,,,8,6,,,2,10,8,,,0.005132991,FAIL
667,395.8084412,29:10.3,29:48.9,0 days 00:00:38.657096,3,96,32,96,3,5,,,,,,,,,,,3,5,7,10,4,5,,,,,,,,,,,,,,,,,,,,,,,,,4,4,normal,mixed,,,,6,,,2,10,8,,,0.005115312,COMPLETE
668,,29:48.9,30:31.4,0 days 00:00:42.473320,4,64,8,32,3,5,8,2,10,4,2,2,10,10,,,9,6,8,6,6,,,,,,,,,,,,,,,,,,,,,,,,,,4,4,mixed,mixed,,,8,5,,,2,10,7,,,0.005640397,FAIL
669,,30:31.4,31:13.9,0 days 00:00:42.465458,4,64,8,32,3,5,8,2,10,4,2,2,10,10,,,9,6,8,6,6,,,,,,,,,,,,,,,,,,,,,,,,,,4,4,mixed,mixed,,,8,5,,,2,10,7,,,0.002452639,FAIL
670,,31:13.9,31:57.0,0 days 00:00:43.152149,4,64,32,32,3,5,8,2,10,4,2,10,10,10,,,9,6,8,6,6,,,,,,,,,,,,,,,,,,,,,,,,,,4,4,mixed,mixed,,,8,5,,,2,10,7,,,0.002462703,FAIL
671,,31:57.0,32:41.0,0 days 00:00:44.012553,4,64,32,32,3,5,8,2,10,4,3,2,10,10,,,9,6,8,6,6,2,4,8,,,,,,,,,,,,,,,,,,,,,,,4,4,mixed,mixed,,,8,8,,,2,10,7,,,0.002449742,FAIL
672,147.1461487,32:41.1,33:19.5,0 days 00:00:38.422657,4,64,8,32,3,5,,,,,,,,,,,9,6,8,6,6,,,,,,,,,,,,,,,,,,,,,,,,,,4,4,normal,mixed,,,,5,,,2,10,7,,,0.005668273,COMPLETE
673,,33:19.5,34:02.2,0 days 00:00:42.697497,4,8,32,128,3,5,8,2,10,4,2,2,3,10,,,9,4,6,9,7,2,4,,,,,,,,,,,,,,,,,,,,,,,,4,4,mixed,mixed,,,8,7,,,2,9,8,,,0.003646002,FAIL
674,334.7417603,34:02.2,34:41.8,0 days 00:00:39.651569,4,8,32,128,3,5,,,,,,,,,,,9,4,7,9,7,2,8,,,,,,,,,,,,,,,,,,,,,,,,4,4,normal,mixed,,,,7,,,2,9,8,,,0.002387751,COMPLETE
675,,34:41.8,35:25.9,0 days 00:00:44.065254,4,128,32,32,3,5,8,2,10,4,2,2,10,10,10,,8,2,6,10,6,5,4,,,,,,,,,,,,,,,,,,,,,,,,4,4,mixed,mixed,,,9,7,,,2,10,8,,,0.002619669,FAIL
676,,35:25.9,36:10.3,0 days 00:00:44.406950,4,128,32,32,3,5,8,2,10,4,3,2,10,10,,,8,2,6,10,6,5,4,8,5,2,,,,,,,,,,,,,,,,,,,,,4,4,mixed,mixed,,,8,10,,,2,10,8,,,0.003607287,FAIL
677,,36:10.3,36:53.4,0 days 00:00:43.104556,4,128,32,32,3,5,8,2,9,4,2,2,10,10,,,8,2,6,10,6,5,4,,,,,,,,,,,,,,,,,,,,,,,,4,4,mixed,mixed,,,8,7,,,2,10,8,,,0.002714861,FAIL
678,,36:53.4,37:36.8,0 days 00:00:43.338759,4,128,32,32,3,5,8,2,10,4,2,2,10,10,,,8,2,6,10,6,5,4,,,,,,,,,,,,,,,,,,,,,,,,4,4,mixed,mixed,,,8,7,,,2,10,8,,,0.003563674,FAIL
679,191.9637451,37:36.8,38:15.9,0 days 00:00:39.170890,4,128,32,32,3,5,,,,,,,,,,,9,2,6,10,6,5,4,,,,,,,,,,,,,,,,,,,,,,,,4,4,normal,mixed,,,,7,,,2,10,8,,,0.003823436,COMPLETE
680,,38:15.9,38:59.9,0 days 00:00:43.946642,4,96,32,16,3,5,8,2,10,4,2,2,10,10,,,9,6,7,6,6,6,3,8,,,,,,,,,,,,,,,,,,,,,,,4,4,mixed,mixed,,,8,8,,,2,10,8,,,0.002670751,FAIL
681,,38:59.9,39:43.1,0 days 00:00:43.259697,4,96,32,16,3,5,8,6,10,4,2,2,10,10,,,9,6,7,6,6,6,3,8,,,,,,,,,,,,,,,,,,,,,,,4,4,mixed,mixed,,,8,8,,,2,10,8,,,0.002664457,FAIL
682,,39:43.2,40:25.9,0 days 00:00:42.745484,4,96,32,16,3,5,8,2,10,4,2,2,10,10,,,9,6,7,6,6,6,3,8,5,2,,,,,,,,,,,,,,,,,,,,,4,4,mixed,mixed,,,8,10,,,2,10,8,,,0.002653902,FAIL
683,335.4693604,40:25.9,41:06.8,0 days 00:00:40.870984,4,96,32,16,3,5,,,,,,,,,,,9,6,7,6,6,6,3,8,8,2,,,,,,,,,,,,,,,,,,,,,4,4,normal,mixed,,,,10,,,2,10,8,,,0.003472388,COMPLETE
684,,41:06.8,41:46.4,0 days 00:00:39.652737,4,64,32,32,3,5,8,2,10,4,2,2,10,10,,,,,,,,,,,,,,,,,,,,,,,,,,,,,,,,,4,4,mixed,normal,,,8,,,,2,10,8,,,0.004510997,FAIL
685,,41:46.4,42:26.0,0 days 00:00:39.565885,4,64,32,32,3,5,8,2,10,4,2,2,10,10,,,,,,,,,,,,,,,,,,,,,,,,,,,,,,,,,4,4,mixed,normal,,,8,,,,2,10,8,,,0.002675,FAIL
686,3.71E+17,42:26.0,43:05.8,0 days 00:00:39.750270,4,64,32,32,3,5,8,2,10,5,2,2,10,10,,,,,,,,,,,,,,,,,,,,,,,,,,,,,,,,,4,4,mixed,normal,,,8,,,,2,10,8,,,0.004797358,COMPLETE
687,,43:05.8,43:48.5,0 days 00:00:42.767357,4,96,32,32,3,5,9,6,2,4,10,10,3,9,,,8,3,7,10,8,5,7,6,,,,,,,,,,,,,,,,,,,,,,,4,4,mixed,mixed,,,8,8,,,2,10,9,,,0.002759018,FAIL
688,175.3544617,43:48.5,44:28.9,0 days 00:00:40.395293,4,96,32,32,3,5,,,,,,,,,,,8,3,7,10,8,5,7,9,,,,,,,,,,,,,,,,,,,,,,,4,4,normal,mixed,,,,8,,,2,10,9,,,0.002752245,COMPLETE
689,114.2774658,44:28.9,45:08.5,0 days 00:00:39.540021,4,96,96,16,3,5,,,,,,,,,,,9,5,8,9,5,4,4,,,,,,,,,,,,,,,,,,,,,,,,4,4,normal,mixed,,,,7,,,2,10,8,,,0.003084441,COMPLETE
690,155.0774078,45:08.5,45:48.2,0 days 00:00:39.696009,4,64,96,16,3,5,,,,,,,,,,,9,5,8,9,5,4,4,,,,,,,,,,,,,,,,,,,,,,,,4,4,normal,mixed,,,,7,,,2,10,7,,,0.00316426,COMPLETE
691,132.2531433,45:48.2,46:27.4,0 days 00:00:39.236916,4,8,96,16,3,5,,,,,,,,,,,7,5,8,9,5,4,4,,,,,,,,,,,,,,,,,,,,,,,,4,4,normal,mixed,,,,7,,,2,10,8,,,0.006093259,COMPLETE
692,151.7993317,46:27.4,47:08.6,0 days 00:00:41.176563,4,96,96,16,3,5,,,,,,,,,,,9,5,8,9,5,4,4,6,6,,,,,,,,,,,,,,,,,,,,,,4,4,normal,mixed,,,,9,,,2,9,8,,,0.004225421,COMPLETE
693,,47:08.6,47:52.3,0 days 00:00:43.662929,4,64,96,16,3,5,9,6,2,4,10,10,3,9,,,9,5,8,9,5,4,,,,,,,,,,,,,,,,,,,,,,,,,4,4,mixed,mixed,,,8,6,,,2,10,8,,,0.003680538,FAIL
694,199.7584229,47:52.3,48:30.9,0 days 00:00:38.614627,4,64,96,16,3,5,,,,,,,,,,,9,5,8,9,5,4,,,,,,,,,,,,,,,,,,,,,,,,,4,3,normal,mixed,,,,6,,,2,10,8,,,0.000870108,COMPLETE
695,,48:30.9,49:14.8,0 days 00:00:43.925313,4,96,96,16,3,5,9,6,2,4,10,10,4,9,,,9,5,8,6,5,2,4,,,,,,,,,,,,,,,,,,,,,,,,4,4,mixed,mixed,,,8,7,,,2,10,9,,,0.003069211,FAIL
696,,49:14.8,49:57.9,0 days 00:00:43.105001,4,96,96,16,3,5,9,6,2,4,10,10,3,,,,9,5,9,6,5,2,4,,,,,,,,,,,,,,,,,,,,,,,,4,4,mixed,mixed,,,7,7,,,2,10,9,,,0.003673743,FAIL
697,127.0755539,49:57.9,50:37.7,0 days 00:00:39.788249,4,96,96,16,3,5,,,,,,,,,,,9,5,9,6,5,4,4,,,,,,,,,,,,,,,,,,,,,,,,4,4,normal,mixed,,,,7,,,2,10,9,,,0.003602336,COMPLETE
698,,50:37.7,51:20.7,0 days 00:00:43.019806,4,96,96,16,3,5,8,6,2,4,10,10,3,9,,,9,2,7,5,5,,,,,,,,,,,,,,,,,,,,,,,,,,4,4,mixed,mixed,,,8,5,,,2,10,8,,,0.003054575,FAIL
699,,51:20.7,52:03.9,0 days 00:00:43.195649,4,96,96,16,3,5,9,6,2,4,10,10,3,9,,,9,2,9,6,5,,,,,,,,,,,,,,,,,,,,,,,,,,4,4,mixed,mixed,,,8,5,,,2,10,8,,,0.00303633,FAIL
700,185.2215881,52:03.9,52:42.4,0 days 00:00:38.433449,4,96,96,16,3,5,,,,,,,,,,,9,2,9,5,5,,,,,,,,,,,,,,,,,,,,,,,,,,4,4,normal,mixed,,,,5,,,2,10,8,,,0.00311107,COMPLETE
701,278.0060425,52:42.4,53:21.8,0 days 00:00:39.470170,4,96,96,16,3,5,,,,,,,,,,,9,6,9,4,5,4,5,,,,,,,,,,,,,,,,,,,,,,,,5,4,normal,mixed,,,,7,,,2,10,7,,,0.003505093,COMPLETE
702,155.1225586,53:21.8,54:01.5,0 days 00:00:39.640575,4,96,96,16,3,5,,,,,,,,,,,8,6,9,6,5,4,4,,,,,,,,,,,,,,,,,,,,,,,,4,4,normal,mixed,,,,7,,,2,10,8,,,0.003004277,COMPLETE
703,,54:01.5,54:44.8,0 days 00:00:43.312516,4,96,96,16,3,5,9,6,2,4,10,10,3,9,,,9,4,7,5,5,4,,,,,,,,,,,,,,,,,,,,,,,,,4,4,mixed,mixed,,,8,6,,,2,10,9,,,0.003684907,FAIL
704,,54:44.8,55:28.2,0 days 00:00:43.433225,4,96,96,16,3,5,8,6,2,4,10,10,3,9,,,9,4,7,5,5,4,,,,,,,,,,,,,,,,,,,,,,,,,4,6,mixed,mixed,,,8,6,,,2,10,9,,,0.003673431,FAIL
705,192.7445068,55:28.2,56:07.0,0 days 00:00:38.791141,4,96,96,16,3,5,,,,,,,,,,,9,3,7,7,5,4,,,,,,,,,,,,,,,,,,,,,,,,,4,4,normal,mixed,,,,6,,,2,10,9,,,0.00351327,COMPLETE
706,,56:07.0,56:50.2,0 days 00:00:43.124159,4,96,96,16,3,5,9,6,2,4,10,10,3,,,,9,4,7,6,5,3,4,,,,,,,,,,,,,,,,,,,,,,,,4,4,mixed,mixed,,,7,7,,,2,10,3,,,0.00533917,FAIL
707,,56:50.2,57:33.4,0 days 00:00:43.218585,4,96,96,16,3,5,9,6,2,4,4,10,3,9,,,9,4,7,6,5,3,4,,,,,,,,,,,,,,,,,,,,,,,,4,4,mixed,mixed,,,8,7,,,2,10,8,,,0.003739763,FAIL
708,,57:33.4,58:16.5,0 days 00:00:43.076911,4,96,96,16,3,5,9,6,2,4,10,10,3,9,,,9,4,7,6,5,3,4,,,,,,,,,,,,,,,,,,,,,,,,4,6,mixed,mixed,,,8,7,,,2,10,8,,,0.005320147,FAIL
709,199.0994873,58:16.5,58:56.9,0 days 00:00:40.468619,4,96,96,16,3,5,,,,,,,,,,,9,4,7,6,5,3,4,,,,,,,,,,,,,,,,,,,,,,,,4,6,normal,mixed,,,,7,,,2,10,8,,,0.007690649,COMPLETE
710,,58:56.9,59:41.1,0 days 00:00:44.174241,4,96,96,16,3,5,9,6,2,4,10,10,3,9,,,9,2,9,5,5,4,4,5,,,,,,,,,,,,,,,,,,,,,,,4,4,mixed,mixed,,,8,8,,,2,10,8,,,0.003826752,FAIL
711,,59:41.1,00:25.0,0 days 00:00:43.879798,4,96,96,16,3,5,9,6,2,4,10,10,3,9,,,9,2,9,5,5,4,4,5,,,,,,,,,,,,,,,,,,,,,,,4,4,mixed,mixed,,,8,8,,,2,10,8,,,0.005367088,FAIL
712,197.4681549,00:25.0,01:04.3,0 days 00:00:39.266494,4,96,96,16,3,5,,,,,,,,,,,9,2,7,6,5,4,4,5,,,,,,,,,,,,,,,,,,,,,,,4,4,normal,mixed,,,,8,,,2,10,8,,,0.005236265,COMPLETE
713,,01:04.3,01:45.5,0 days 00:00:41.259041,4,96,96,16,3,5,9,6,2,4,10,10,3,9,,,9,4,,,,,,,,,,,,,,,,,,,,,,,,,,,,,4,4,mixed,mixed,,,8,2,,,2,10,8,,,0.003750966,FAIL
714,,01:45.5,02:27.0,0 days 00:00:41.494913,4,96,96,16,3,5,9,6,2,4,10,10,3,9,,,9,4,,,,,,,,,,,,,,,,,,,,,,,,,,,,,4,4,mixed,mixed,,,8,2,,,2,10,3,,,0.003843561,FAIL
715,250.5135956,02:27.0,03:06.0,0 days 00:00:38.984746,4,96,96,16,3,5,,,,,,,,,,,9,4,7,5,7,2,3,,,,,,,,,,,,,,,,,,,,,,,,4,4,normal,mixed,,,,7,,,2,10,8,,,0.002702067,COMPLETE
716,,03:06.0,03:49.8,0 days 00:00:43.735253,4,32,96,16,3,5,9,6,2,4,10,10,3,9,,,8,6,7,6,5,4,5,,,,,,,,,,,,,,,,,,,,,,,,4,4,mixed,mixed,,,8,7,,,2,10,7,,,0.003760083,FAIL
717,,03:49.8,04:33.8,0 days 00:00:44.051412,4,32,96,16,3,5,9,6,2,4,10,10,3,9,,,8,6,7,6,9,4,5,,,,,,,,,,,,,,,,,,,,,,,,4,4,mixed,mixed,,,8,7,,,2,10,3,,,0.003774256,FAIL
718,423.1221924,04:33.8,05:10.8,0 days 00:00:36.982221,4,64,96,16,3,5,,,,,,,,,,,8,6,,,,,,,,,,,,,,,,,,,,,,,,,,,,,4,4,normal,mixed,,,,2,,,2,10,7,,,0.003769207,COMPLETE
719,,05:10.8,05:54.7,0 days 00:00:43.944102,4,96,128,8,3,5,9,6,2,4,10,10,3,9,,,9,5,7,6,5,4,5,,,,,,,,,,,,,,,,,,,,,,,,3,4,mixed,mixed,,,8,7,,,2,10,9,,,0.00330228,FAIL
720,,05:54.7,06:38.5,0 days 00:00:43.741610,4,96,64,8,3,5,9,6,2,4,10,10,3,9,,,9,5,7,8,5,4,5,,,,,,,,,,,,,,,,,,,,,,,,3,4,mixed,mixed,,,8,7,,,2,10,9,,,0.003249192,FAIL
