number,value,datetime_start,datetime_complete,duration,params_gat_heads,params_gat_hidden_0,params_gat_hidden_1,params_gat_hidden_2,params_gat_layers,params_gat_out,params_kan_arity_0_0,params_kan_arity_0_1,params_kan_arity_0_2,params_kan_arity_0_3,params_kan_arity_0_4,params_kan_arity_0_5,params_kan_arity_0_6,params_kan_arity_0_7,params_kan_arity_0_8,params_kan_arity_0_9,params_kan_arity_1_0,params_kan_arity_1_1,params_kan_arity_1_2,params_kan_arity_1_3,params_kan_arity_1_4,params_kan_arity_1_5,params_kan_arity_1_6,params_kan_arity_1_7,params_kan_arity_1_8,params_kan_arity_1_9,params_kan_arity_2_0,params_kan_arity_2_1,params_kan_arity_2_2,params_kan_arity_2_3,params_kan_arity_2_4,params_kan_arity_2_5,params_kan_arity_2_6,params_kan_arity_2_7,params_kan_arity_2_8,params_kan_arity_2_9,params_kan_arity_3_0,params_kan_arity_3_1,params_kan_arity_3_2,params_kan_arity_3_3,params_kan_arity_3_4,params_kan_arity_3_5,params_kan_arity_3_6,params_kan_arity_3_7,params_kan_arity_3_8,params_kan_arity_3_9,params_kan_grid,params_kan_k,params_kan_layer_type_0,params_kan_layer_type_1,params_kan_layer_type_2,params_kan_layer_type_3,params_kan_mult_nodes_0,params_kan_mult_nodes_1,params_kan_mult_nodes_2,params_kan_mult_nodes_3,params_kan_n_layers,params_kan_neurons_0,params_kan_neurons_1,params_kan_neurons_2,params_kan_neurons_3,params_lr,state
721,222.3074951,06:38.5,07:17.9,0 days 00:00:39.405397,4,32,128,8,3,5,,,,,,,,,,,9,5,7,8,5,4,5,,,,,,,,,,,,,,,,,,,,,,,,3,4,normal,mixed,,,,7,,,2,10,9,,,0.003324087,COMPLETE
722,138.5367432,07:17.9,07:56.8,0 days 00:00:38.888905,4,16,64,32,3,5,,,,,,,,,,,9,3,9,6,6,3,4,,,,,,,,,,,,,,,,,,,,,,,,4,4,normal,mixed,,,,7,,,2,10,8,,,0.004495895,COMPLETE
723,573.8798828,07:56.8,08:36.8,0 days 00:00:40.046885,4,96,16,16,3,4,9,6,2,4,10,10,4,9,,,,,,,,,,,,,,,,,,,,,,,,,,,,,,,,,4,4,mixed,normal,,,8,,,,2,10,3,,,0.003006248,COMPLETE
724,,08:36.8,09:17.8,0 days 00:00:40.930669,4,96,96,32,3,5,2,2,9,,,,,,,,9,6,7,6,5,2,4,,,,,,,,,,,,,,,,,,,,,,,,4,5,mixed,mixed,,,3,7,,,2,9,8,,,0.005468781,FAIL
725,,09:17.8,09:58.2,0 days 00:00:40.396183,4,96,96,32,3,5,2,5,9,,,,,,,,9,6,7,6,5,2,4,,,,,,,,,,,,,,,,,,,,,,,,4,4,mixed,mixed,,,3,7,,,2,9,8,,,0.00566612,FAIL
726,387.7975159,09:58.2,10:37.5,0 days 00:00:39.278128,4,96,96,32,3,5,,,,,,,,,,,9,6,7,6,5,2,4,,,,,,,,,,,,,,,,,,,,,,,,4,4,normal,mixed,,,,7,,,2,9,8,,,0.00571361,COMPLETE
727,120.9733658,10:37.5,11:16.5,0 days 00:00:39.010876,4,64,96,32,3,5,,,,,,,,,,,9,3,10,6,7,4,,,,,,,,,,,,,,,,,,,,,,,,,4,4,normal,mixed,,,,6,,,2,10,8,,,0.003919075,COMPLETE
728,,11:16.5,11:56.5,0 days 00:00:40.054324,4,96,96,16,3,5,2,2,9,,,,,,,,9,2,10,7,6,4,,,,,,,,,,,,,,,,,,,,,,,,,4,4,mixed,mixed,,,3,6,,,2,10,8,,,0.004016493,FAIL
729,144.5519562,11:56.5,12:35.3,0 days 00:00:38.798019,4,96,96,16,3,5,,,,,,,,,,,9,2,8,7,6,4,,,,,,,,,,,,,,,,,,,,,,,,,4,4,normal,mixed,,,,6,,,2,10,8,,,0.00390439,COMPLETE
730,,12:35.3,13:16.1,0 days 00:00:40.765770,4,64,96,96,3,5,2,2,9,,,,,,,,10,6,10,6,5,4,,,,,,,,,,,,,,,,,,,,,,,,,4,4,mixed,mixed,,,3,6,,,2,10,7,,,0.003740189,FAIL
731,,13:16.1,13:56.5,0 days 00:00:40.441991,4,64,96,96,3,5,2,2,9,,,,,,,,10,6,10,6,5,4,,,,,,,,,,,,,,,,,,,,,,,,,4,4,mixed,mixed,,,3,6,,,2,10,7,,,0.003602481,FAIL
732,,13:56.6,14:37.2,0 days 00:00:40.672087,4,64,96,96,3,5,2,5,9,,,,,,,,10,6,10,6,5,4,,,,,,,,,,,,,,,,,,,,,,,,,4,4,mixed,mixed,,,3,6,,,2,10,7,,,0.003582127,FAIL
733,389.3978882,14:37.2,15:16.5,0 days 00:00:39.260779,4,64,96,96,3,5,,,,,,,,,,,10,6,10,6,5,4,,,,,,,,,,,,,,,,,,,,,,,,,4,4,normal,mixed,,,,6,,,2,10,7,,,0.003552841,COMPLETE
734,133.7989502,15:16.5,15:55.7,0 days 00:00:39.171637,4,96,96,32,3,5,,,,,,,,,,,7,2,10,10,6,4,,,,,,,,,,,,,,,,,,,,,,,,,4,4,normal,mixed,,,,6,,,2,10,8,,,0.003985537,COMPLETE
735,,15:55.7,16:35.7,0 days 00:00:40.010104,4,64,96,32,3,5,2,2,9,,,,,,,,9,3,10,6,7,3,,,,,,,,,,,,,,,,,,,,,,,,,4,4,mixed,mixed,,,3,6,,,2,10,9,,,0.003225127,FAIL
736,,16:35.7,17:16.9,0 days 00:00:41.194218,4,64,96,32,3,5,8,2,9,,,,,,,,9,3,10,6,7,3,,,,,,,,,,,,,,,,,,,,,,,,,4,5,mixed,mixed,,,3,6,,,2,10,9,,,0.003267504,FAIL
737,,17:16.9,17:58.1,0 days 00:00:41.219691,4,64,96,32,3,5,8,2,9,,,,,,,,9,3,10,6,7,3,,,,,,,,,,,,,,,,,,,,,,,,,4,5,mixed,mixed,,,3,6,,,2,8,9,,,0.003309611,FAIL
738,,17:58.1,18:39.0,0 days 00:00:40.918338,4,64,96,32,3,5,2,2,9,,,,,,,,9,3,10,6,7,3,,,,,,,,,,,,,,,,,,,,,,,,,4,5,mixed,mixed,,,3,6,,,2,10,9,,,0.00335482,FAIL
739,,18:39.0,19:19.8,0 days 00:00:40.819629,4,64,96,32,3,5,2,2,9,,,,,,,,9,3,10,6,7,3,,,,,,,,,,,,,,,,,,,,,,,,,4,5,mixed,mixed,,,3,6,,,2,10,9,,,0.003277286,FAIL
740,,19:19.8,19:59.9,0 days 00:00:40.020016,4,64,96,32,3,5,2,2,9,,,,,,,,9,3,10,6,7,3,,,,,,,,,,,,,,,,,,,,,,,,,4,4,mixed,mixed,,,3,6,,,2,10,9,,,0.003143238,FAIL
741,,19:59.9,20:40.8,0 days 00:00:40.897134,4,64,96,32,3,5,2,5,8,,,,,,,,9,3,10,6,7,3,,,,,,,,,,,,,,,,,,,,,,,,,4,5,mixed,mixed,,,3,6,,,2,10,9,,,0.003345925,FAIL
742,,20:40.8,21:21.1,0 days 00:00:40.311914,4,64,96,32,3,5,2,2,9,,,,,,,,9,3,10,6,7,3,,,,,,,,,,,,,,,,,,,,,,,,,4,4,mixed,mixed,,,3,6,,,2,10,9,,,0.003294419,FAIL
743,128.2009735,21:21.1,22:00.8,0 days 00:00:39.745755,4,64,96,32,3,5,,,,,,,,,,,9,3,10,6,7,3,,,,,,,,,,,,,,,,,,,,,,,,,4,5,normal,mixed,,,,6,,,2,10,9,,,0.003245511,COMPLETE
744,,22:00.8,22:41.8,0 days 00:00:41.008462,4,64,96,16,3,5,2,2,9,,,,,,,,9,3,10,6,7,3,,,,,,,,,,,,,,,,,,,,,,,,,4,5,mixed,mixed,,,3,6,,,2,10,9,,,0.002593894,FAIL
745,105.3205566,22:41.9,23:21.7,0 days 00:00:39.835714,4,64,96,16,3,5,,,,,,,,,,,9,3,10,6,7,3,,,,,,,,,,,,,,,,,,,,,,,,,4,5,normal,mixed,,,,6,,,2,10,9,,,0.004473147,COMPLETE
746,,23:21.7,24:01.1,0 days 00:00:39.447383,4,64,96,16,3,5,2,2,9,,,,,,,,9,3,10,6,7,3,,,,,,,,,,,,,,,,,,,,,,,,,4,3,mixed,mixed,,,3,6,,,2,8,9,,,0.002638933,FAIL
747,,24:01.1,24:42.2,0 days 00:00:41.065422,4,64,96,16,3,5,2,2,9,,,,,,,,9,3,10,6,7,3,,,,,,,,,,,,,,,,,,,,,,,,,4,5,mixed,mixed,,,3,6,,,2,10,9,,,0.004687282,FAIL
748,,24:42.2,25:22.0,0 days 00:00:39.743267,4,64,96,16,3,5,,,,,,,,,,,9,3,10,6,7,3,,,,,,,,,,,,,,,,,,,,,,,,,4,5,normal,mixed,,,,6,,,2,8,9,,,0.004536081,FAIL
749,547.3706665,25:22.0,26:02.8,0 days 00:00:40.887151,4,64,96,16,3,5,,,,,,,,,,,9,3,10,6,7,3,5,6,5,,,,,,,,,,,,,,,,,,,,,,4,5,normal,mixed,,,,9,,,2,8,9,,,0.004672057,COMPLETE
750,,26:02.9,26:46.1,0 days 00:00:43.282308,4,64,96,16,3,5,2,2,9,7,4,7,5,7,,,9,3,10,6,7,3,,,,,,,,,,,,,,,,,,,,,,,,,4,5,mixed,mixed,,,8,6,,,2,9,9,,,0.002563392,FAIL
751,337.0166931,26:46.1,27:25.9,0 days 00:00:39.734929,4,64,96,16,3,5,,,,,,,,,,,9,3,10,6,7,3,,,,,,,,,,,,,,,,,,,,,,,,,4,5,normal,mixed,,,,6,,,2,9,9,,,0.002843372,COMPLETE
752,169.4475861,27:25.9,28:05.4,0 days 00:00:39.555988,4,64,96,16,3,5,,,,,,,,,,,9,3,10,6,7,3,,,,,,,,,,,,,,,,,,,,,,,,,4,5,normal,mixed,,,,6,,,2,10,9,,,0.002516042,COMPLETE
753,,28:05.4,28:46.3,0 days 00:00:40.850037,4,64,96,16,3,5,2,2,9,,,,,,,,9,3,10,6,7,3,,,,,,,,,,,,,,,,,,,,,,,,,4,5,mixed,mixed,,,3,6,,,2,10,9,,,0.00493044,FAIL
754,,28:46.3,29:26.9,0 days 00:00:40.607298,4,64,96,16,3,5,2,2,9,,,,,,,,9,3,10,6,7,,,,,,,,,,,,,,,,,,,,,,,,,,4,5,mixed,mixed,,,3,5,,,2,10,9,,,0.003162982,FAIL
755,,29:26.9,30:08.1,0 days 00:00:41.233003,4,64,96,16,3,5,2,5,9,,,,,,,,9,3,10,6,7,,,,,,,,,,,,,,,,,,,,,,,,,,4,5,mixed,mixed,,,3,5,,,2,10,9,,,0.004434681,FAIL
756,,30:08.1,30:48.8,0 days 00:00:40.617195,4,64,96,16,3,5,2,2,8,,,,,,,,9,3,10,6,7,,,,,,,,,,,,,,,,,,,,,,,,,,4,5,mixed,mixed,,,3,5,,,2,10,9,,,0.004940026,FAIL
757,266.9425354,30:48.8,31:28.3,0 days 00:00:39.504147,4,64,96,16,3,5,,,,,,,,,,,9,3,10,6,7,,,,,,,,,,,,,,,,,,,,,,,,,,4,5,normal,mixed,,,,5,,,2,10,9,,,0.003226261,COMPLETE
758,198.9661102,31:28.3,32:08.0,0 days 00:00:39.710312,4,64,96,16,3,5,,,,,,,,,,,8,3,10,6,7,3,,,,,,,,,,,,,,,,,,,,,,,,,4,5,normal,mixed,,,,6,,,2,10,9,,,0.004418711,COMPLETE
759,,32:08.0,32:49.9,0 days 00:00:41.892389,4,64,96,16,3,5,2,2,9,,,,,,,,9,3,10,6,7,3,,,,,,,,,,,,,,,,,,,,,,,,,4,6,mixed,mixed,,,3,6,,,2,10,10,,,0.004928796,FAIL
760,150.5371704,32:49.9,33:30.4,0 days 00:00:40.546930,4,64,96,16,3,5,,,,,,,,,,,9,3,10,6,7,3,,,,,,,,,,,,,,,,,,,,,,,,,4,6,normal,mixed,,,,6,,,2,10,10,,,0.004978919,COMPLETE
761,,33:30.4,34:11.1,0 days 00:00:40.642360,4,64,96,16,3,5,2,2,9,,,,,,,,9,3,10,3,7,3,,,,,,,,,,,,,,,,,,,,,,,,,4,5,mixed,mixed,,,3,6,,,2,10,9,,,0.003740761,FAIL
762,,34:11.1,34:51.9,0 days 00:00:40.794586,4,64,96,16,3,5,2,2,9,,,,,,,,9,3,10,6,7,3,,,,,,,,,,,,,,,,,,,,,,,,,4,5,mixed,mixed,,,3,6,,,2,10,9,,,0.003714433,FAIL
763,,34:51.9,35:32.9,0 days 00:00:41.078677,4,64,96,16,3,5,2,2,9,,,,,,,,9,3,10,8,7,3,,,,,,,,,,,,,,,,,,,,,,,,,4,5,mixed,mixed,,,3,6,,,2,10,9,,,0.003752903,FAIL
764,143.0947418,35:33.0,36:12.3,0 days 00:00:39.369670,4,64,96,16,3,5,,,,,,,,,,,9,3,10,3,7,3,,,,,,,,,,,,,,,,,,,,,,,,,4,5,normal,mixed,,,,6,,,2,10,9,,,0.003705616,COMPLETE
765,,36:12.3,36:53.0,0 days 00:00:40.704004,4,64,96,16,3,5,2,2,9,,,,,,,,9,3,10,5,7,3,,,,,,,,,,,,,,,,,,,,,,,,,3,5,mixed,mixed,,,3,6,,,2,10,9,,,0.003052127,FAIL
766,118.6281281,36:53.0,37:33.6,0 days 00:00:40.574809,4,64,96,16,3,5,,,,,,,,,,,9,3,10,9,7,3,,,,,,,,,,,,,,,,,,,,,,,,,4,6,normal,mixed,,,,6,,,2,10,9,,,0.003039068,COMPLETE
767,,37:33.6,38:15.5,0 days 00:00:41.920713,4,64,96,16,3,5,2,2,9,,,,,,,,10,3,10,8,7,3,,,,,,,,,,,,,,,,,,,,,,,,,4,6,mixed,mixed,,,3,6,,,2,10,9,,,0.002627566,FAIL
768,123.1379929,38:15.5,38:55.1,0 days 00:00:39.604713,4,64,96,16,3,5,,,,,,,,,,,10,3,10,5,7,3,,,,,,,,,,,,,,,,,,,,,,,,,4,5,normal,mixed,,,,6,,,2,10,9,,,0.002656139,COMPLETE
769,,38:55.1,39:36.6,0 days 00:00:41.443160,3,64,96,16,3,5,2,2,9,,,,,,,,10,3,10,5,7,3,,,,,,,,,,,,,,,,,,,,,,,,,4,6,mixed,mixed,,,3,6,,,2,10,9,,,0.002484023,FAIL
770,,39:36.6,40:18.1,0 days 00:00:41.557094,4,64,96,16,3,5,2,2,9,,,,,,,,10,3,10,5,7,3,,,,,,,,,,,,,,,,,,,,,,,,,4,6,mixed,mixed,,,3,6,,,2,10,9,,,0.002582713,FAIL
771,,40:18.2,40:59.6,0 days 00:00:41.408368,3,64,96,16,3,5,2,2,9,,,,,,,,10,3,10,5,7,3,,,,,,,,,,,,,,,,,,,,,,,,,4,6,mixed,mixed,,,3,6,,,2,10,9,,,0.002642381,FAIL
772,,40:59.6,41:41.3,0 days 00:00:41.708658,3,64,96,16,3,5,2,2,9,,,,,,,,10,3,10,5,7,3,,,,,,,,,,,,,,,,,,,,,,,,,4,6,mixed,mixed,,,3,6,,,2,10,9,,,0.002352216,FAIL
773,,41:41.3,42:22.0,0 days 00:00:40.747013,3,64,96,16,3,5,2,2,9,,,,,,,,10,3,10,5,7,3,,,,,,,,,,,,,,,,,,,,,,,,,4,5,mixed,mixed,,,3,6,,,2,10,9,,,0.002637708,FAIL
774,,42:22.0,43:02.8,0 days 00:00:40.745008,4,64,96,16,3,5,2,2,9,,,,,,,,10,3,10,5,7,3,,,,,,,,,,,,,,,,,,,,,,,,,4,5,mixed,mixed,,,3,6,,,2,10,9,,,0.002617157,FAIL
775,,43:02.8,43:44.2,0 days 00:00:41.397214,3,64,96,16,3,5,2,2,9,,,,,,,,10,3,10,5,7,3,,,,,,,,,,,,,,,,,,,,,,,,,4,6,mixed,mixed,,,3,6,,,2,10,9,,,0.002662275,FAIL
776,179.158783,43:44.2,44:24.6,0 days 00:00:40.407287,3,64,96,16,3,5,,,,,,,,,,,10,3,10,5,7,3,,,,,,,,,,,,,,,,,,,,,,,,,4,6,normal,mixed,,,,6,,,2,10,9,,,0.00255988,COMPLETE
777,230.5204468,44:24.6,45:05.0,0 days 00:00:40.380679,4,64,96,16,3,5,,,,,,,,,,,10,3,10,5,7,3,,,,,,,,,,,,,,,,,,,,,,,,,4,6,normal,mixed,,,,6,,,2,10,9,,,0.002656193,COMPLETE
778,,45:05.0,45:45.9,0 days 00:00:40.936604,4,64,96,16,3,5,2,2,9,,,,,,,,10,3,10,7,7,3,,,,,,,,,,,,,,,,,,,,,,,,,4,5,mixed,mixed,,,3,6,,,2,9,9,,,0.002325665,FAIL
779,,45:45.9,46:27.3,0 days 00:00:41.425735,4,64,96,16,3,5,8,2,9,,,,,,,,10,3,10,7,7,3,,,,,,,,,,,,,,,,,,,,,,,,,4,5,mixed,mixed,,,3,6,,,2,7,9,,,0.00299532,FAIL
780,,46:27.3,47:08.4,0 days 00:00:41.095989,4,64,96,16,3,5,2,2,9,,,,,,,,10,3,10,7,7,3,,,,,,,,,,,,,,,,,,,,,,,,,4,5,mixed,mixed,,,3,6,,,2,7,9,,,0.002929316,FAIL
781,,47:08.4,47:49.4,0 days 00:00:40.906062,4,64,96,16,3,5,2,2,9,,,,,,,,10,3,10,7,7,3,,,,,,,,,,,,,,,,,,,,,,,,,4,5,mixed,mixed,,,3,6,,,2,9,9,,,0.002388987,FAIL
782,,47:49.4,48:29.9,0 days 00:00:40.538928,4,64,96,16,3,5,2,2,8,,,,,,,,10,3,10,4,7,3,,,,,,,,,,,,,,,,,,,,,,,,,4,5,mixed,mixed,,,3,6,,,2,9,9,,,0.002864447,FAIL
783,,48:29.9,49:10.8,0 days 00:00:40.894341,4,64,96,16,3,5,2,2,9,,,,,,,,10,3,10,7,7,3,,,,,,,,,,,,,,,,,,,,,,,,,4,5,mixed,mixed,,,3,6,,,2,9,9,,,0.002855726,FAIL
784,,49:10.8,49:51.6,0 days 00:00:40.767692,4,64,96,16,3,5,2,2,9,,,,,,,,10,3,10,4,7,3,,,,,,,,,,,,,,,,,,,,,,,,,4,5,mixed,mixed,,,3,6,,,2,9,9,,,0.002901457,FAIL
785,,49:51.6,50:32.5,0 days 00:00:40.931203,4,64,96,16,3,5,2,2,9,,,,,,,,10,3,10,7,7,3,,,,,,,,,,,,,,,,,,,,,,,,,4,5,mixed,mixed,,,3,6,,,2,9,9,,,0.002235093,FAIL
786,,50:32.5,51:13.4,0 days 00:00:40.928800,4,64,96,16,3,5,2,2,9,,,,,,,,10,3,10,7,7,3,,,,,,,,,,,,,,,,,,,,,,,,,4,5,mixed,mixed,,,3,6,,,2,9,9,,,0.002174249,FAIL
787,,51:13.4,51:55.7,0 days 00:00:42.237594,4,64,96,16,3,5,2,2,9,,,,,,,,10,3,10,7,7,3,,,,,,,,,,,,,,,,,,,,,,,,,4,5,mixed,mixed,,,3,6,,,2,9,9,,,0.002368732,FAIL
788,,51:55.7,52:37.5,0 days 00:00:41.830647,4,64,96,16,3,5,2,2,9,,,,,,,,10,3,10,7,8,3,,,,,,,,,,,,,,,,,,,,,,,,,4,5,mixed,mixed,,,3,6,,,2,9,9,,,0.002343104,FAIL
789,,52:37.5,53:18.7,0 days 00:00:41.197056,4,64,96,16,3,5,2,2,9,,,,,,,,10,3,10,7,7,3,,,,,,,,,,,,,,,,,,,,,,,,,4,5,mixed,mixed,,,3,6,,,2,9,9,,,0.002391447,FAIL
790,641.3948364,53:18.7,53:58.8,0 days 00:00:40.043557,4,64,96,16,3,5,,,,,,,,,,,10,3,10,7,7,3,,,,,,,,,,,,,,,,,,,,,,,,,4,5,normal,mixed,,,,6,,,2,9,9,,,0.002743707,COMPLETE
791,,53:58.8,54:39.7,0 days 00:00:40.910175,4,64,96,16,3,5,2,2,9,,,,,,,,10,3,10,4,7,3,,,,,,,,,,,,,,,,,,,,,,,,,4,5,mixed,mixed,,,3,6,,,2,10,9,,,0.002970075,FAIL
792,313.0742188,54:39.7,55:17.5,0 days 00:00:37.781204,4,64,96,16,3,5,2,2,9,,,,,,,,,,,,,,,,,,,,,,,,,,,,,,,,,,,,,,4,5,mixed,normal,,,3,,,,2,10,9,,,0.002182247,COMPLETE
793,217.7239532,55:17.5,55:58.4,0 days 00:00:40.906536,4,64,96,16,3,5,,,,,,,,,,,10,3,10,9,7,3,,,,,,,,,,,,,,,,,,,,,,,,,4,6,normal,mixed,,,,6,,,2,10,9,,,0.002398609,COMPLETE
794,,55:58.4,56:42.4,0 days 00:00:44.017480,4,64,96,16,3,5,8,5,5,7,4,6,6,7,,,10,3,10,4,7,3,,,,,,,,,,,,,,,,,,,,,,,,,4,5,mixed,mixed,,,8,6,,,2,10,9,,,0.002941742,FAIL
795,,56:42.4,57:25.5,0 days 00:00:43.080365,4,64,96,16,3,5,8,5,5,7,4,6,6,6,10,3,10,3,10,9,7,3,,,,,,,,,,,,,,,,,,,,,,,,,4,5,mixed,mixed,,,10,6,,,2,10,9,,,0.002967795,FAIL
796,,57:25.5,58:09.6,0 days 00:00:44.156786,4,64,96,16,3,5,8,5,5,7,4,6,7,7,,,10,3,10,4,8,3,,,,,,,,,,,,,,,,,,,,,,,,,3,5,mixed,mixed,,,8,6,,,2,10,9,,,0.003061285,FAIL
797,,58:09.6,58:53.7,0 days 00:00:44.096488,4,64,96,16,3,5,8,5,5,7,4,6,6,7,,,10,3,10,5,8,3,,,,,,,,,,,,,,,,,,,,,,,,,4,5,mixed,mixed,,,8,6,,,2,10,9,,,0.002994938,FAIL
798,,58:53.7,59:37.7,0 days 00:00:43.983685,4,64,96,16,3,5,8,5,5,7,4,6,6,7,,,10,3,10,5,8,3,,,,,,,,,,,,,,,,,,,,,,,,,3,5,mixed,mixed,,,8,6,,,2,10,9,,,0.003087024,FAIL
799,,59:37.7,00:21.9,0 days 00:00:44.172513,4,64,96,16,3,5,8,5,5,7,4,6,6,7,,,10,3,10,8,8,3,,,,,,,,,,,,,,,,,,,,,,,,,4,5,mixed,mixed,,,8,6,,,2,10,9,,,0.002972196,FAIL
800,,00:21.9,01:06.1,0 days 00:00:44.162818,4,64,96,16,3,5,8,5,5,7,4,6,6,7,,,10,3,10,5,8,3,,,,,,,,,,,,,,,,,,,,,,,,,4,5,mixed,mixed,,,8,6,,,2,10,9,,,0.002921649,FAIL
801,,01:06.1,01:50.1,0 days 00:00:44.007961,4,64,96,16,3,5,8,5,5,7,4,6,6,7,,,10,3,10,4,8,3,,,,,,,,,,,,,,,,,,,,,,,,,4,5,mixed,mixed,,,8,6,,,2,10,9,,,0.003060786,FAIL
802,124.081131,01:50.1,02:30.0,0 days 00:00:39.897387,4,64,96,16,3,5,,,,,,,,,,,10,3,10,5,8,3,,,,,,,,,,,,,,,,,,,,,,,,,4,5,normal,mixed,,,,6,,,2,10,9,,,0.002969251,COMPLETE
803,158.0273743,02:30.0,03:09.0,0 days 00:00:39.035289,4,64,96,16,3,5,,,,,,,,,,,10,3,10,4,9,3,,,,,,,,,,,,,,,,,,,,,,,,,4,4,normal,mixed,,,,6,,,2,10,10,,,0.002847964,COMPLETE
804,132.634903,03:09.0,03:48.4,0 days 00:00:39.407029,4,64,96,16,3,5,,,,,,,,,,,10,3,10,5,4,,,,,,,,,,,,,,,,,,,,,,,,,,4,5,normal,mixed,,,,5,,,2,10,9,,,0.002971424,COMPLETE
805,,03:48.4,04:31.2,0 days 00:00:42.722247,4,64,96,16,3,5,8,5,5,7,4,6,6,7,,,10,3,10,5,8,4,,,,,,,,,,,,,,,,,,,,,,,,,4,6,mixed,mixed,,,8,6,,,2,10,9,,,0.002446501,FAIL
806,,04:31.2,05:12.7,0 days 00:00:41.500364,4,64,96,16,3,5,,,,,,,,,,,10,3,10,5,8,4,,,,,,,,,,,,,,,,,,,,,,,,,4,7,normal,mixed,,,,6,,,2,10,9,,,0.002332167,FAIL
807,,05:12.7,05:56.3,0 days 00:00:43.663054,4,64,96,16,3,5,8,5,5,7,5,6,6,7,10,2,10,3,10,5,9,4,,,,,,,,,,,,,,,,,,,,,,,,,4,6,mixed,mixed,,,10,6,,,2,10,9,,,0.002412128,FAIL
808,286.4938965,05:56.3,06:36.8,0 days 00:00:40.476596,4,64,96,16,3,5,,,,,,,,,,,10,3,10,8,9,4,,,,,,,,,,,,,,,,,,,,,,,,,4,5,normal,mixed,,,,6,,,2,10,9,,,0.002505964,COMPLETE
809,,06:36.8,07:19.8,0 days 00:00:42.987396,4,64,96,16,3,5,8,5,8,7,4,6,6,7,,,10,4,10,5,8,2,,,,,,,,,,,,,,,,,,,,,,,,,4,6,mixed,mixed,,,8,6,,,2,10,9,,,0.003011301,FAIL
810,482.3095703,07:19.8,08:00.5,0 days 00:00:40.669929,4,64,96,16,3,5,,,,,,,,,,,10,4,10,5,8,2,,,,,,,,,,,,,,,,,,,,,,,,,4,6,normal,mixed,,,,6,,,2,10,9,,,0.003014124,COMPLETE
811,,08:00.5,08:44.8,0 days 00:00:44.349981,4,64,96,16,3,5,8,7,8,7,4,6,6,7,,,10,3,10,5,8,3,,,,,,,,,,,,,,,,,,,,,,,,,4,5,mixed,mixed,,,8,6,,,2,10,9,,,0.001163038,FAIL
812,,08:44.8,09:28.0,0 days 00:00:43.159674,4,64,96,16,3,5,9,5,5,7,4,6,7,7,10,2,10,3,10,4,8,3,,,,,,,,,,,,,,,,,,,,,,,,,4,5,mixed,mixed,,,10,6,,,2,10,9,,,0.002690265,FAIL
813,,09:28.0,10:11.4,0 days 00:00:43.378808,4,64,96,16,3,5,8,5,5,7,4,6,6,7,,,10,3,10,5,9,3,,,,,,,,,,,,,,,,,,,,,,,,,4,7,mixed,mixed,,,8,6,,,2,10,9,,,0.002679269,FAIL
814,,10:11.4,10:52.8,0 days 00:00:41.461269,4,64,96,16,3,5,,,,,,,,,,,10,3,10,4,9,3,,,,,,,,,,,,,,,,,,,,,,,,,4,7,normal,mixed,,,,6,,,2,10,9,,,0.002283464,FAIL
815,,10:52.8,11:36.9,0 days 00:00:44.010338,4,64,96,16,3,5,8,5,5,7,4,6,6,7,,,10,3,10,5,8,3,,,,,,,,,,,,,,,,,,,,,,,,,4,5,mixed,mixed,,,8,6,,,2,10,9,,,0.002704273,FAIL
816,,11:36.9,12:21.0,0 days 00:00:44.162632,4,64,96,16,3,5,8,5,5,7,4,6,6,6,,,10,3,10,5,8,3,,,,,,,,,,,,,,,,,,,,,,,,,4,5,mixed,mixed,,,8,6,,,2,10,9,,,0.00275752,FAIL
817,,12:21.0,13:05.1,0 days 00:00:44.080135,4,64,96,16,3,5,8,5,5,7,4,6,6,7,,,10,3,10,5,8,3,,,,,,,,,,,,,,,,,,,,,,,,,4,5,mixed,mixed,,,8,6,,,2,10,9,,,0.002347729,FAIL
818,,13:05.1,13:49.4,0 days 00:00:44.323839,4,64,96,16,3,5,8,5,8,7,4,6,6,7,,,10,3,10,4,9,3,,,,,,,,,,,,,,,,,,,,,,,,,4,5,mixed,mixed,,,8,6,,,2,10,9,,,0.002197457,FAIL
819,,13:49.4,14:33.6,0 days 00:00:44.124206,4,64,96,16,3,5,8,5,5,7,5,6,6,7,,,10,3,10,4,9,3,,,,,,,,,,,,,,,,,,,,,,,,,4,5,mixed,mixed,,,8,6,,,2,10,9,,,0.002669577,FAIL
820,,14:33.6,15:17.8,0 days 00:00:44.287401,4,64,96,16,3,5,8,5,5,7,5,6,6,7,,,10,3,10,5,8,3,,,,,,,,,,,,,,,,,,,,,,,,,4,5,mixed,mixed,,,8,6,,,2,10,9,,,0.00271525,FAIL
821,,15:17.9,16:01.9,0 days 00:00:44.022163,4,64,96,16,3,5,8,5,5,7,4,6,6,7,,,10,3,10,4,8,3,,,,,,,,,,,,,,,,,,,,,,,,,4,5,mixed,mixed,,,8,6,,,2,10,9,,,0.002702144,FAIL
822,,16:01.9,16:45.9,0 days 00:00:43.995921,4,64,96,16,3,5,8,5,5,7,4,6,6,7,,,10,3,10,4,8,3,,,,,,,,,,,,,,,,,,,,,,,,,4,5,mixed,mixed,,,8,6,,,2,10,9,,,0.002824065,FAIL
823,,16:45.9,17:29.8,0 days 00:00:43.970929,4,64,96,16,3,5,8,5,5,7,4,6,6,7,,,10,3,10,5,5,3,,,,,,,,,,,,,,,,,,,,,,,,,4,5,mixed,mixed,,,8,6,,,2,10,9,,,0.003072245,FAIL
824,,17:29.9,18:11.4,0 days 00:00:41.533364,4,64,96,16,3,5,,,,,,,,,,,10,3,10,5,9,3,,,,,,,,,,,,,,,,,,,,,,,,,4,7,normal,mixed,,,,6,,,2,10,9,,,0.002238868,FAIL
825,,18:11.4,18:55.4,0 days 00:00:44.039355,4,64,96,16,3,5,8,5,5,7,4,6,6,7,,,10,3,10,5,9,3,,,,,,,,,,,,,,,,,,,,,,,,,4,5,mixed,mixed,,,8,6,,,2,10,9,,,0.002679173,FAIL
826,,18:55.4,19:39.3,0 days 00:00:43.866775,4,64,96,16,3,5,8,5,5,7,4,6,6,7,,,10,3,10,4,8,3,,,,,,,,,,,,,,,,,,,,,,,,,4,5,mixed,mixed,,,8,6,,,2,10,9,,,0.002778833,FAIL
827,,19:39.3,20:20.9,0 days 00:00:41.575996,4,64,96,16,3,5,,,,,,,,,,,10,3,10,5,9,3,,,,,,,,,,,,,,,,,,,,,,,,,4,7,normal,mixed,,,,6,,,2,10,9,,,0.002707744,FAIL
828,,20:20.9,21:05.0,0 days 00:00:44.138279,4,64,96,16,3,5,8,5,5,7,4,6,6,7,,,10,3,10,5,8,3,,,,,,,,,,,,,,,,,,,,,,,,,4,5,mixed,mixed,,,8,6,,,2,10,9,,,0.002217154,FAIL
829,,21:05.0,21:49.1,0 days 00:00:44.084375,4,64,96,16,3,5,8,5,5,7,4,6,6,7,,,10,3,10,5,8,3,,,,,,,,,,,,,,,,,,,,,,,,,4,5,mixed,mixed,,,8,6,,,2,10,9,,,0.002211651,FAIL
830,,21:49.1,22:33.3,0 days 00:00:44.136340,4,64,96,16,3,5,8,5,5,7,4,6,6,7,,,10,3,10,5,9,3,,,,,,,,,,,,,,,,,,,,,,,,,4,5,mixed,mixed,,,8,6,,,2,10,9,,,0.002326623,FAIL
831,,22:33.3,23:17.3,0 days 00:00:44.047638,4,64,96,16,3,5,8,5,5,7,4,6,6,7,,,10,3,10,5,8,3,,,,,,,,,,,,,,,,,,,,,,,,,4,5,mixed,mixed,,,8,6,,,2,10,9,,,0.002732106,FAIL
832,,23:17.3,23:59.9,0 days 00:00:42.628567,4,64,96,16,3,5,8,5,5,4,4,6,6,7,,,10,3,10,4,8,3,,,,,,,,,,,,,,,,,,,,,,,,,4,7,mixed,mixed,,,8,6,,,2,10,9,,,0.002275041,FAIL
833,,23:59.9,24:41.3,0 days 00:00:41.321491,4,64,96,16,3,5,,,,,,,,,,,10,3,10,5,8,3,,,,,,,,,,,,,,,,,,,,,,,,,4,7,normal,mixed,,,,6,,,2,10,9,,,0.002306898,FAIL
834,,24:41.3,25:22.7,0 days 00:00:41.401711,4,64,96,16,3,5,,,,,,,,,,,10,3,10,4,8,3,,,,,,,,,,,,,,,,,,,,,,,,,4,7,normal,mixed,,,,6,,,2,10,9,,,0.002296093,FAIL
835,,25:22.7,26:06.3,0 days 00:00:43.644354,4,64,96,16,3,5,9,5,5,7,4,6,6,7,,,10,3,10,5,8,3,,,,,,,,,,,,,,,,,,,,,,,,,4,7,mixed,mixed,,,8,6,,,2,10,9,,,0.002680489,FAIL
836,,26:06.3,26:50.7,0 days 00:00:44.334877,4,64,96,16,3,5,8,5,8,7,4,6,7,7,,,10,3,10,4,8,3,,,,,,,,,,,,,,,,,,,,,,,,,4,5,mixed,mixed,,,8,6,,,2,10,9,,,0.00268465,FAIL
837,,26:50.7,27:33.5,0 days 00:00:42.824279,4,64,96,16,3,5,8,5,5,7,4,6,6,7,10,2,10,3,10,5,8,3,,,,,,,,,,,,,,,,,,,,,,,,,4,5,mixed,mixed,,,10,6,,,2,10,9,,,0.002238846,FAIL
838,205.755661,27:33.5,28:13.3,0 days 00:00:39.858564,4,64,96,16,3,5,,,,,,,,,,,10,3,10,4,9,3,,,,,,,,,,,,,,,,,,,,,,,,,4,5,normal,mixed,,,,6,,,2,10,9,,,0.002340097,COMPLETE
839,,28:13.3,28:57.9,0 days 00:00:44.519795,4,64,96,16,3,5,8,5,5,7,4,6,6,7,,,10,3,10,5,8,,,,,,,,,,,,,,,,,,,,,,,,,,5,6,mixed,mixed,,,8,5,,,2,10,10,,,0.003033441,FAIL
840,,28:57.9,29:41.1,0 days 00:00:43.240626,4,64,96,16,3,5,8,5,5,7,4,7,6,7,,,10,3,10,5,8,,,,,,,,,,,,,,,,,,,,,,,,,,5,7,mixed,mixed,,,8,5,,,2,10,10,,,0.001149659,FAIL
841,,29:41.1,30:23.8,0 days 00:00:42.666004,4,64,96,16,3,5,8,5,5,7,4,6,6,7,10,2,10,3,10,5,8,,,,,,,,,,,,,,,,,,,,,,,,,,4,5,mixed,mixed,,,10,5,,,2,10,9,,,0.00280683,FAIL
842,,30:23.8,31:04.1,0 days 00:00:40.351622,4,64,96,16,3,5,,,,,,,,,,,10,3,10,5,8,,,,,,,,,,,,,,,,,,,,,,,,,,5,6,normal,mixed,,,,5,,,2,10,10,,,0.002667719,FAIL
843,119.6516342,31:04.1,31:44.7,0 days 00:00:40.518383,4,64,96,16,3,5,,,,,,,,,,,10,3,10,5,8,,,,,,,,,,,,,,,,,,,,,,,,,,4,6,normal,mixed,,,,5,,,2,10,10,,,0.002716702,COMPLETE
844,,31:44.7,32:28.9,0 days 00:00:44.257908,4,64,96,16,3,5,8,5,5,4,4,6,6,7,,,10,3,10,5,8,,,,,,,,,,,,,,,,,,,,,,,,,,5,6,mixed,mixed,,,8,5,,,2,10,10,,,0.002646537,FAIL
845,,32:28.9,33:12.5,0 days 00:00:43.540485,4,64,96,16,3,5,8,5,5,7,4,6,6,7,10,3,10,3,10,5,8,4,,,,,,,,,,,,,,,,,,,,,,,,,4,6,mixed,mixed,,,10,6,,,2,10,10,,,0.002679273,FAIL
