number,value,datetime_start,datetime_complete,duration,params_gat_heads,params_gat_hidden_0,params_gat_hidden_1,params_gat_hidden_2,params_gat_layers,params_gat_out,params_kan_arity_0_0,params_kan_arity_0_1,params_kan_arity_0_2,params_kan_arity_0_3,params_kan_arity_0_4,params_kan_arity_0_5,params_kan_arity_0_6,params_kan_arity_0_7,params_kan_arity_0_8,params_kan_arity_0_9,params_kan_arity_1_0,params_kan_arity_1_1,params_kan_arity_1_2,params_kan_arity_1_3,params_kan_arity_1_4,params_kan_arity_1_5,params_kan_arity_1_6,params_kan_arity_1_7,params_kan_arity_1_8,params_kan_arity_1_9,params_kan_arity_2_0,params_kan_arity_2_1,params_kan_arity_2_2,params_kan_arity_2_3,params_kan_arity_2_4,params_kan_arity_2_5,params_kan_arity_2_6,params_kan_arity_2_7,params_kan_arity_2_8,params_kan_arity_2_9,params_kan_arity_3_0,params_kan_arity_3_1,params_kan_arity_3_2,params_kan_arity_3_3,params_kan_arity_3_4,params_kan_arity_3_5,params_kan_arity_3_6,params_kan_arity_3_7,params_kan_arity_3_8,params_kan_arity_3_9,params_kan_grid,params_kan_k,params_kan_layer_type_0,params_kan_layer_type_1,params_kan_layer_type_2,params_kan_layer_type_3,params_kan_mult_nodes_0,params_kan_mult_nodes_1,params_kan_mult_nodes_2,params_kan_mult_nodes_3,params_kan_n_layers,params_kan_neurons_0,params_kan_neurons_1,params_kan_neurons_2,params_kan_neurons_3,params_lr,state
1831,,10:33.6,15:04.9,0 days 00:04:31.388839,2,96,8,16,3,5,10,5,10,6,2,5,3,10,,,3,7,5,6,10,9,10,10,5,5,8,10,2,5,4,4,10,,,,,,,,,,,,,,8,3,mixed,mixed,mixed,normal,8,10,7,,4,9,8,9,10,0.002950719,FAIL
1832,,15:05.0,19:20.6,0 days 00:04:15.658874,2,96,8,16,3,5,10,4,10,6,2,5,2,10,,,3,7,10,6,10,10,10,10,5,5,8,10,2,5,4,4,10,,,,,,,,,,,,,,8,3,mixed,mixed,mixed,normal,8,10,7,,4,9,8,9,10,0.001236068,FAIL
1833,,19:20.6,23:35.6,0 days 00:04:14.997945,2,96,8,16,3,5,10,4,10,6,2,5,2,10,,,3,7,10,6,10,10,10,10,5,5,8,10,2,5,4,10,10,,,,,,,,,,,,,,8,3,mixed,mixed,mixed,normal,8,10,7,,4,9,8,9,10,0.004554878,FAIL
1834,,23:35.6,27:49.1,0 days 00:04:13.467608,2,96,8,16,3,5,10,4,10,6,2,5,2,9,,,3,7,10,6,10,10,10,10,5,5,8,10,2,5,4,10,10,,,,,,,,,,,,,,8,3,mixed,mixed,mixed,normal,8,10,7,,4,9,8,9,10,0.004404943,FAIL
1835,,27:49.1,32:00.8,0 days 00:04:11.675299,2,96,8,16,3,5,10,4,10,6,2,5,2,10,9,,3,7,10,6,10,9,10,10,5,5,8,10,2,5,4,10,10,,,,,,,,,,,,,,8,3,mixed,mixed,mixed,normal,9,10,7,,4,9,8,9,10,0.004719348,FAIL
1836,,32:00.8,36:12.5,0 days 00:04:11.779139,2,96,8,16,3,5,10,4,9,6,2,5,2,10,,,3,7,10,6,10,9,10,10,5,5,8,10,2,5,4,10,10,,,,,,,,,,,,,,8,3,mixed,mixed,mixed,normal,8,10,7,,4,9,8,8,10,0.004690472,FAIL
1837,,36:12.5,40:21.7,0 days 00:04:09.146467,2,96,8,16,3,5,10,4,10,6,7,5,2,10,,,3,7,10,6,10,10,10,10,5,5,8,8,2,5,4,10,10,,,,,,,,,,,,,,8,3,mixed,mixed,mixed,normal,8,10,7,,4,9,8,9,10,0.00460662,FAIL
1838,,40:21.7,44:34.0,0 days 00:04:12.341296,2,96,8,16,3,5,10,4,10,6,2,5,4,10,,,3,7,10,6,10,10,10,10,5,5,8,10,2,5,4,10,10,,,,,,,,,,,,,,8,3,mixed,mixed,mixed,normal,8,10,7,,4,9,8,9,10,0.004753475,FAIL
1839,,44:34.0,48:45.2,0 days 00:04:11.175561,2,96,8,16,3,5,10,4,9,6,2,5,3,10,,,3,7,10,6,10,10,10,10,5,5,8,10,2,5,4,10,10,,,,,,,,,,,,,,8,3,mixed,mixed,mixed,normal,8,10,7,,4,9,8,9,10,0.004356659,FAIL
1840,,48:45.2,52:55.7,0 days 00:04:10.460410,2,96,8,16,3,5,10,4,10,6,2,5,2,10,,,3,7,10,6,10,9,10,10,5,5,8,10,2,5,4,10,10,,,,,,,,,,,,,,8,3,mixed,mixed,mixed,normal,8,10,7,,4,9,8,9,10,0.004570712,FAIL
1841,,52:55.7,57:07.6,0 days 00:04:11.893731,2,96,8,16,3,5,10,4,10,6,2,5,3,10,,,3,7,10,6,10,10,10,10,5,5,7,10,2,5,4,10,10,,,,,,,,,,,,,,8,3,mixed,mixed,mixed,normal,8,10,7,,4,9,8,9,10,0.004535642,FAIL
1842,,57:07.6,01:19.8,0 days 00:04:12.190036,2,96,8,16,3,5,10,4,10,6,2,5,2,9,,,3,7,10,6,10,10,10,10,5,5,8,10,2,5,4,10,10,,,,,,,,,,,,,,8,3,mixed,mixed,mixed,normal,8,10,7,,4,9,8,9,4,0.004322417,FAIL
1843,,01:19.8,05:28.2,0 days 00:04:08.464936,2,96,8,16,3,5,10,5,10,6,2,5,3,10,,,3,7,5,6,10,10,10,10,5,5,8,10,2,5,4,10,10,,,,,,,,,,,,,,8,3,mixed,mixed,mixed,normal,8,10,7,,4,9,8,9,10,0.005071905,FAIL
1844,,05:28.2,09:37.0,0 days 00:04:08.730114,2,96,8,16,3,5,10,4,10,6,2,10,2,10,,,3,7,10,6,10,10,10,10,5,5,8,10,2,5,4,10,10,,,,,,,,,,,,,,8,3,mixed,mixed,mixed,normal,8,10,7,,4,9,8,9,10,0.001216931,FAIL
1845,,09:37.0,13:45.3,0 days 00:04:08.337055,2,96,8,16,3,5,10,4,10,6,2,5,2,10,,,3,7,10,6,10,10,10,10,5,5,8,10,2,5,4,10,10,,,,,,,,,,,,,,8,3,mixed,mixed,mixed,normal,8,10,7,,4,9,8,9,4,0.004645006,FAIL
1846,,13:45.3,17:55.1,0 days 00:04:09.791180,2,96,8,16,3,5,10,4,10,6,2,10,2,9,,,3,7,10,6,10,10,10,10,5,5,8,10,2,5,4,10,10,,,,,,,,,,,,,,8,3,mixed,mixed,mixed,normal,8,10,7,,4,9,8,9,10,0.004782169,FAIL
1847,,17:55.1,22:04.3,0 days 00:04:09.146324,2,96,8,16,3,5,10,4,10,6,2,5,2,10,,,3,7,10,6,10,9,10,10,5,5,8,10,2,5,4,4,10,,,,,,,,,,,,,,8,3,mixed,mixed,mixed,normal,8,10,7,,4,9,8,9,10,0.004810765,FAIL
1848,,22:04.3,26:13.4,0 days 00:04:09.094720,2,96,8,16,3,5,10,5,10,6,2,5,2,10,,,3,7,10,6,10,10,10,10,5,5,8,10,2,5,4,10,10,,,,,,,,,,,,,,8,3,mixed,mixed,mixed,normal,8,10,7,,4,9,8,9,10,0.004579401,FAIL
1849,,26:13.4,30:22.4,0 days 00:04:09.051098,2,96,8,16,3,5,10,4,10,6,2,5,2,9,,,3,7,5,6,10,9,10,10,5,5,8,10,2,5,4,10,10,,,,,,,,,,,,,,8,3,mixed,mixed,mixed,normal,8,10,7,,4,9,2,9,10,0.004467278,FAIL
1850,,30:22.4,34:31.8,0 days 00:04:09.346470,2,96,8,16,3,5,10,4,9,6,2,5,4,10,,,3,7,10,6,10,10,10,10,5,5,8,10,2,5,4,10,10,,,,,,,,,,,,,,8,3,mixed,mixed,mixed,normal,8,10,7,,4,9,8,9,4,0.004807412,FAIL
1851,,34:31.8,38:40.4,0 days 00:04:08.600352,2,96,8,16,3,5,10,4,10,6,2,5,4,10,,,3,7,10,6,10,9,10,10,5,5,8,10,2,5,4,10,10,,,,,,,,,,,,,,8,3,mixed,mixed,mixed,normal,8,10,7,,4,9,8,9,10,0.001231364,FAIL
1852,,38:40.4,42:48.6,0 days 00:04:08.179506,2,96,8,16,3,5,10,4,10,6,2,5,3,10,,,3,7,10,6,10,10,10,10,5,,8,10,2,5,4,10,10,,,,,,,,,,,,,,8,3,mixed,mixed,mixed,normal,8,9,7,,4,9,8,9,10,0.004513079,FAIL
1853,,42:48.6,46:56.3,0 days 00:04:07.743404,2,96,8,16,3,5,10,4,10,6,2,10,2,10,10,,3,7,5,6,10,10,10,10,5,5,8,10,2,5,4,10,10,,,,,,,,,,,,,,8,3,mixed,mixed,mixed,normal,9,10,7,,4,9,8,9,4,0.004400713,FAIL
1854,,46:56.3,51:05.1,0 days 00:04:08.816956,2,96,8,16,3,5,10,4,10,6,2,5,2,10,,,3,7,10,6,10,9,10,10,5,5,8,10,2,5,4,4,10,,,,,,,,,,,,,,8,3,mixed,mixed,mixed,normal,8,10,7,,4,9,8,9,4,0.001230194,FAIL
1855,,51:05.1,55:15.6,0 days 00:04:10.472951,2,96,8,16,3,5,10,4,10,6,2,5,2,9,,,3,7,10,5,10,9,10,10,5,5,8,10,2,5,4,10,10,,,,,,,,,,,,,,8,3,mixed,mixed,mixed,normal,8,10,7,,4,9,8,9,10,0.00445021,FAIL
1856,,55:15.6,59:23.0,0 days 00:04:07.408012,2,96,8,16,3,5,10,4,9,6,2,5,3,10,,,3,7,10,6,10,10,10,10,5,,8,10,2,5,4,10,10,,,,,,,,,,,,,,8,3,mixed,mixed,mixed,normal,8,9,7,,4,9,8,9,10,0.004640863,FAIL
1857,,59:23.0,03:37.0,0 days 00:04:14.011924,2,96,8,16,3,5,10,4,10,6,2,5,3,10,,,3,7,10,6,10,9,10,10,5,,8,10,4,5,4,10,10,,,,,,,,,,,,,,8,3,mixed,mixed,mixed,normal,8,9,7,,4,9,8,9,4,0.001223791,FAIL
1858,,03:37.0,07:47.1,0 days 00:04:10.093655,2,96,8,16,3,5,10,4,10,6,2,10,3,10,,,3,7,10,6,10,10,10,10,5,5,8,10,2,5,4,10,10,,,,,,,,,,,,,,8,3,mixed,mixed,mixed,normal,8,10,7,,4,9,8,9,10,0.00123322,FAIL
1859,,07:47.1,12:01.4,0 days 00:04:14.241002,2,96,8,16,3,5,10,4,10,6,2,5,2,10,,,3,7,10,6,10,10,10,10,5,5,8,10,2,5,4,10,10,,,,,,,,,,,,,,8,3,mixed,mixed,mixed,normal,8,10,7,,4,9,8,9,10,0.004910471,FAIL
1860,,12:01.4,16:15.4,0 days 00:04:14.038618,2,96,8,16,3,5,10,4,10,6,2,5,2,10,,,3,7,10,6,10,10,10,10,5,5,8,10,2,5,4,10,10,,,,,,,,,,,,,,8,3,mixed,mixed,mixed,normal,8,10,7,,4,9,8,9,10,0.001243912,FAIL
1861,,16:15.4,20:25.6,0 days 00:04:10.153123,2,96,8,16,3,5,10,4,10,6,2,5,3,10,,,3,7,10,6,10,10,10,10,5,5,8,10,2,5,4,10,10,,,,,,,,,,,,,,8,3,mixed,mixed,mixed,normal,8,10,7,,4,9,8,9,10,0.004692711,FAIL
1862,,20:25.6,24:33.1,0 days 00:04:07.491991,2,96,8,16,3,5,10,4,9,6,2,5,2,10,,,3,7,10,6,10,10,10,10,5,5,8,10,2,5,4,10,10,,,,,,,,,,,,,,8,3,mixed,mixed,mixed,normal,8,10,7,,4,9,8,9,10,0.001247981,FAIL
1863,,24:33.1,28:40.7,0 days 00:04:07.612140,2,96,8,16,3,5,10,4,10,6,2,5,2,10,,,3,7,10,6,10,10,10,10,5,5,8,10,2,5,4,10,10,,,,,,,,,,,,,,8,3,mixed,mixed,mixed,normal,8,10,7,,4,9,8,9,10,0.002902383,FAIL
1864,,28:40.7,32:48.4,0 days 00:04:07.722488,2,96,8,16,3,5,10,4,10,6,2,5,2,10,,,3,7,10,6,10,10,10,10,5,5,8,10,2,5,4,10,10,,,,,,,,,,,,,,8,3,mixed,mixed,mixed,normal,8,10,7,,4,9,8,9,10,0.00291804,FAIL
1865,,32:48.4,36:54.8,0 days 00:04:06.361133,2,96,8,16,3,5,10,4,10,6,2,5,3,10,,,3,7,10,6,10,10,10,10,5,5,8,10,4,5,4,10,10,,,,,,,,,,,,,,8,3,mixed,mixed,mixed,normal,8,10,7,,4,9,8,9,4,0.004546185,FAIL
1866,,36:54.8,41:02.0,0 days 00:04:07.180829,2,96,8,16,3,5,10,4,9,6,7,5,2,10,,,3,7,10,6,10,8,10,9,5,5,8,10,2,5,4,10,10,,,,,,,,,,,,,,8,3,mixed,mixed,mixed,normal,8,10,7,,4,9,8,9,10,0.004865733,FAIL
1867,,41:02.0,45:10.0,0 days 00:04:08.075551,2,96,8,16,3,5,10,4,10,6,2,5,2,10,,,3,7,10,6,10,10,10,10,5,5,8,10,2,5,4,10,10,,,,,,,,,,,,,,8,3,mixed,mixed,mixed,normal,8,10,7,,4,9,8,8,10,0.001256172,FAIL
1868,,45:10.0,49:18.5,0 days 00:04:08.455764,2,96,8,16,3,5,10,4,10,6,2,5,2,10,,,3,7,10,6,10,10,10,10,5,5,8,8,4,5,4,10,10,,,,,,,,,,,,,,8,3,mixed,mixed,mixed,normal,8,10,7,,4,9,8,9,10,0.004657475,FAIL
1869,,49:18.5,53:25.8,0 days 00:04:07.301421,2,96,8,16,3,5,10,4,10,5,2,5,2,10,,,3,7,10,6,10,9,10,10,5,5,8,10,2,5,4,10,10,,,,,,,,,,,,,,8,3,mixed,mixed,mixed,normal,8,10,7,,4,9,8,9,4,0.00460065,FAIL
1870,,53:25.8,57:35.2,0 days 00:04:09.369050,2,96,8,16,3,5,10,4,10,6,2,5,2,10,,,3,7,10,6,10,9,10,10,5,5,8,10,2,5,4,10,10,,,,,,,,,,,,,,8,3,mixed,mixed,mixed,normal,8,10,7,,4,9,8,9,10,0.004645872,FAIL
1871,,57:35.2,01:45.8,0 days 00:04:10.594981,2,96,8,16,3,5,10,4,10,6,2,5,2,9,,,3,7,10,6,10,10,10,10,5,5,8,10,2,5,4,10,10,,,,,,,,,,,,,,8,3,mixed,mixed,mixed,normal,8,10,7,,4,9,8,9,10,0.004657244,FAIL
1872,,01:45.8,05:53.5,0 days 00:04:07.751550,2,96,8,16,3,5,10,4,10,6,2,5,2,10,,,3,7,10,6,10,10,10,10,5,,8,10,2,5,4,10,10,,,,,,,,,,,,,,8,3,mixed,mixed,mixed,normal,8,9,7,,4,9,8,9,10,0.005032524,FAIL
1873,,05:53.5,10:02.0,0 days 00:04:08.510070,2,96,8,16,3,5,10,4,10,6,2,5,3,9,,,3,7,10,6,10,10,10,10,5,5,8,10,2,5,4,10,10,,,,,,,,,,,,,,8,3,mixed,mixed,mixed,normal,8,10,7,,4,9,8,9,10,0.004514037,FAIL
1874,,10:02.0,14:09.5,0 days 00:04:07.465275,2,96,8,16,3,5,10,4,10,6,2,5,2,10,,,3,7,10,6,10,10,10,10,5,5,8,10,2,5,4,10,10,,,,,,,,,,,,,,8,3,mixed,mixed,mixed,normal,8,10,7,,4,9,8,9,10,0.002856133,FAIL
1875,,14:09.5,18:16.9,0 days 00:04:07.332629,2,96,8,16,3,5,9,4,10,6,2,10,3,10,,,3,7,10,6,9,10,10,10,5,5,8,10,2,5,4,4,10,,,,,,,,,,,,,,8,3,mixed,mixed,mixed,normal,8,10,7,,4,9,2,9,10,0.004370554,FAIL
1876,,18:16.9,22:27.8,0 days 00:04:10.908177,2,96,8,16,3,5,10,4,10,6,2,5,2,10,,,3,7,10,6,10,10,10,10,5,,8,10,2,5,4,4,10,,,,,,,,,,,,,,7,3,mixed,mixed,mixed,normal,8,9,7,,4,9,8,9,10,0.004605955,FAIL
1877,,22:27.8,26:36.8,0 days 00:04:09.023772,2,96,8,16,3,5,10,4,10,6,2,5,2,10,,,3,7,5,6,10,10,10,10,5,5,8,10,2,5,4,10,10,,,,,,,,,,,,,,8,3,mixed,mixed,mixed,normal,8,10,7,,4,9,8,9,10,0.004548996,FAIL
1878,,26:36.8,30:44.6,0 days 00:04:07.834386,2,96,8,16,3,5,10,4,10,6,2,5,2,10,,,3,5,10,6,10,10,10,10,5,5,8,10,2,5,4,10,10,,,,,,,,,,,,,,8,3,mixed,mixed,mixed,normal,8,10,7,,4,9,8,9,10,0.004278139,FAIL
1879,,30:44.6,34:55.3,0 days 00:04:10.669556,2,96,8,16,3,5,10,4,9,6,2,5,3,10,,,3,7,10,6,10,10,10,10,5,,8,10,2,5,4,10,10,,,,,,,,,,,,,,8,3,mixed,mixed,mixed,normal,8,9,7,,4,9,8,9,10,0.004735433,FAIL
1880,,34:55.3,39:03.8,0 days 00:04:08.516372,2,96,8,16,3,5,10,4,10,6,2,5,2,9,,,3,7,10,6,10,9,10,10,5,5,8,10,2,5,4,10,10,,,,,,,,,,,,,,8,3,mixed,mixed,mixed,normal,8,10,7,,4,9,8,9,10,0.004815266,FAIL
1881,,39:03.8,43:12.1,0 days 00:04:08.272712,2,96,8,16,3,5,9,4,10,6,2,5,2,10,,,3,7,10,6,10,9,10,10,5,5,8,8,2,5,4,10,10,,,,,,,,,,,,,,8,3,mixed,mixed,mixed,normal,8,10,7,,4,9,8,9,10,0.004476969,FAIL
1882,,43:12.1,47:22.1,0 days 00:04:09.961471,2,96,8,16,3,5,9,4,10,6,2,5,2,10,,,3,7,10,6,10,10,10,10,5,5,8,10,2,5,4,10,10,,,,,,,,,,,,,,8,4,mixed,mixed,mixed,normal,8,10,7,,4,9,8,9,10,0.002937374,FAIL
1883,,47:22.1,51:31.0,0 days 00:04:08.892511,2,96,8,16,3,5,10,4,9,6,2,5,2,10,,,3,7,10,6,10,10,10,10,5,5,8,10,2,5,4,10,10,,,,,,,,,,,,,,8,3,mixed,mixed,mixed,normal,8,10,7,,4,9,8,9,10,0.004603385,FAIL
1884,,51:31.0,55:40.4,0 days 00:04:09.408303,2,96,8,16,3,5,10,4,10,6,2,5,2,10,,,3,7,10,6,10,10,10,10,5,5,8,10,2,5,4,10,10,,,,,,,,,,,,,,8,3,mixed,mixed,mixed,normal,8,10,7,,4,9,8,9,10,0.001223516,FAIL
1885,,55:40.4,59:49.9,0 days 00:04:09.477982,2,96,8,16,3,5,10,4,10,6,2,10,3,10,,,3,7,10,6,10,10,10,10,5,5,8,10,2,5,4,10,10,,,,,,,,,,,,,,8,3,mixed,mixed,mixed,normal,8,10,7,,4,9,8,9,10,0.004552689,FAIL
1886,,59:49.9,04:04.1,0 days 00:04:14.280190,2,96,8,16,3,5,10,4,10,6,2,5,2,10,,,3,7,10,6,10,10,10,10,5,5,8,10,2,5,5,4,10,,,,,,,,,,,,,,8,3,mixed,mixed,mixed,normal,8,10,7,,4,9,8,9,10,0.001252853,FAIL
1887,,04:04.1,08:17.1,0 days 00:04:12.944887,2,96,8,16,3,5,10,4,9,6,2,5,2,10,,,3,7,10,5,10,10,10,10,5,5,8,10,2,5,4,10,10,,,,,,,,,,,,,,8,3,mixed,mixed,mixed,normal,8,10,7,,4,9,8,9,10,0.001253446,FAIL
1888,,08:17.1,12:31.0,0 days 00:04:13.935135,2,96,8,16,3,5,10,4,9,6,2,5,2,10,,,3,7,5,6,10,10,10,10,5,5,8,10,2,6,4,10,10,,,,,,,,,,,,,,8,3,mixed,mixed,mixed,normal,8,10,7,,4,9,8,9,10,0.004633483,FAIL
1889,,12:31.0,16:45.1,0 days 00:04:14.053773,2,96,8,16,3,5,10,4,10,6,2,5,2,10,,,3,7,10,6,10,9,10,10,5,5,8,8,2,5,4,10,10,,,,,,,,,,,,,,8,3,mixed,mixed,mixed,normal,8,10,7,,4,9,2,9,10,0.004557892,FAIL
1890,,16:45.1,20:56.0,0 days 00:04:10.932024,2,96,8,16,3,5,10,4,10,6,2,10,2,10,,,3,7,10,6,10,10,10,10,5,5,8,10,2,5,4,10,10,,,,,,,,,,,,,,8,3,mixed,mixed,mixed,normal,8,10,7,,4,9,8,9,10,0.004630437,FAIL
1891,,20:56.0,25:07.0,0 days 00:04:10.939705,2,96,8,16,3,5,9,4,9,6,2,5,2,10,,,3,7,10,6,10,10,10,10,5,5,8,10,2,5,4,10,10,,,,,,,,,,,,,,8,3,mixed,mixed,mixed,normal,8,10,7,,4,9,8,9,10,0.001222107,FAIL
1892,,25:07.0,29:14.3,0 days 00:04:07.319394,2,96,8,16,3,5,10,4,9,6,2,10,4,10,,,3,7,10,6,10,10,10,10,5,5,8,10,4,5,4,10,10,,,,,,,,,,,,,,8,3,mixed,mixed,mixed,normal,8,10,7,,4,9,8,9,10,0.004378847,FAIL
1893,,29:14.3,33:23.1,0 days 00:04:08.792528,2,96,8,16,3,5,10,4,10,6,2,10,3,10,,,3,7,5,6,10,9,10,10,5,5,8,10,2,5,4,10,10,,,,,,,,,,,,,,8,3,mixed,mixed,mixed,normal,8,10,7,,4,9,8,9,10,0.004674715,FAIL
1894,,33:23.1,37:37.4,0 days 00:04:14.359361,2,96,8,16,3,5,10,4,10,6,2,5,2,9,,,3,7,10,6,10,9,10,10,5,,8,10,2,5,4,10,10,,,,,,,,,,,,,,8,3,mixed,mixed,mixed,normal,8,9,7,,4,9,8,9,10,0.004596284,FAIL
1895,,37:37.5,41:47.7,0 days 00:04:10.235651,2,96,8,16,3,5,10,4,10,6,2,5,2,10,,,3,7,10,6,10,10,10,10,5,5,8,10,2,5,4,10,10,,,,,,,,,,,,,,8,3,mixed,mixed,mixed,normal,8,10,7,,4,9,8,9,10,0.004675282,FAIL
1896,,41:47.7,45:57.8,0 days 00:04:10.106595,2,96,8,16,3,5,9,4,10,6,2,10,2,10,,,3,7,10,6,10,10,10,10,5,5,8,10,2,5,4,10,10,,,,,,,,,,,,,,8,3,mixed,mixed,mixed,normal,8,10,7,,4,9,8,9,4,0.004794929,FAIL
1897,,45:57.8,50:10.6,0 days 00:04:12.746767,2,96,8,16,3,5,10,4,10,6,2,5,3,10,,,3,7,10,6,10,10,10,10,5,5,8,10,2,5,4,4,10,,,,,,,,,,,,,,8,3,mixed,mixed,mixed,normal,8,10,7,,4,9,8,9,10,0.004507209,FAIL
1898,,50:10.6,54:20.0,0 days 00:04:09.405194,2,96,8,16,3,5,10,4,10,6,2,5,2,10,,,3,7,10,6,10,10,10,10,5,5,8,10,2,5,4,10,10,,,,,,,,,,,,,,8,3,mixed,mixed,mixed,normal,8,10,7,,4,9,2,9,10,0.004739098,FAIL
1899,,54:20.0,58:28.3,0 days 00:04:08.321367,2,96,8,16,3,5,10,4,10,5,2,5,3,10,,,3,7,10,6,10,10,10,10,5,5,8,10,2,5,4,4,10,,,,,,,,,,,,,,8,3,mixed,mixed,mixed,normal,8,10,7,,4,9,8,9,10,0.004577848,FAIL
1900,,58:28.3,02:37.8,0 days 00:04:09.558455,2,96,8,16,3,5,10,4,10,6,2,10,2,10,,,3,7,10,6,10,9,10,10,5,5,8,10,4,5,4,4,10,,,,,,,,,,,,,,8,3,mixed,mixed,mixed,normal,8,10,7,,4,9,8,9,10,0.005054279,FAIL
1901,,02:37.9,06:47.7,0 days 00:04:09.873095,2,96,8,16,3,5,,,,,,,,,,,3,7,10,6,10,9,10,10,5,5,8,10,2,5,4,10,10,,,,,,,,,,,,,,8,3,normal,mixed,mixed,normal,,10,7,,4,9,8,9,10,0.004361387,FAIL
1902,,06:47.7,10:58.2,0 days 00:04:10.504820,2,96,8,16,3,5,10,4,10,6,2,5,4,10,,,3,7,10,6,10,10,10,10,5,,8,10,2,5,4,4,10,,,,,,,,,,,,,,8,3,mixed,mixed,mixed,normal,8,9,7,,4,9,8,9,10,0.002922682,FAIL
1903,,10:58.2,15:10.2,0 days 00:04:11.932205,2,96,8,16,3,5,10,4,10,6,2,5,2,9,,,3,7,10,6,10,10,10,10,5,5,8,10,2,5,5,4,10,,,,,,,,,,,,,,8,3,mixed,mixed,mixed,normal,8,10,7,,4,9,8,9,10,0.004848154,FAIL
1904,,15:10.2,19:20.9,0 days 00:04:10.731147,2,96,8,16,3,5,10,4,10,6,2,5,2,10,,,3,7,10,6,10,9,10,10,5,5,8,10,2,5,4,10,10,,,,,,,,,,,,,,8,3,mixed,mixed,mixed,normal,8,10,7,,4,9,8,9,10,0.004524568,FAIL
1905,,19:20.9,23:29.8,0 days 00:04:08.865550,2,96,8,16,3,5,10,4,10,6,2,5,3,10,,,3,7,10,6,10,10,10,10,5,5,8,10,2,5,4,10,10,,,,,,,,,,,,,,8,3,mixed,mixed,mixed,normal,8,10,7,,4,9,8,9,10,0.002894537,FAIL
1906,,23:29.8,27:41.3,0 days 00:04:11.540659,2,96,8,16,3,5,10,4,10,6,2,5,2,10,,,3,7,10,6,10,10,10,10,5,5,8,10,2,5,4,10,10,,,,,,,,,,,,,,8,3,mixed,mixed,mixed,normal,8,10,7,,4,9,8,9,10,0.004652623,FAIL
1907,,27:41.3,31:53.6,0 days 00:04:12.303216,2,96,8,16,3,5,10,4,10,6,2,5,2,10,,,3,7,10,6,10,10,10,10,5,5,8,10,2,5,4,10,10,,,,,,,,,,,,,,8,3,mixed,mixed,mixed,normal,8,10,7,,4,9,8,9,10,0.004679012,FAIL
1908,,31:53.6,36:05.2,0 days 00:04:11.572508,2,96,8,16,3,5,10,4,10,6,2,5,2,10,,,3,7,10,6,10,10,10,10,5,5,8,10,2,5,4,10,10,,,,,,,,,,,,,,8,3,mixed,mixed,mixed,normal,8,10,7,,4,9,8,9,10,0.001264722,FAIL
1909,,36:05.2,40:17.1,0 days 00:04:11.932307,2,96,8,16,3,5,10,4,9,6,2,5,2,10,,,3,7,10,6,10,10,10,10,5,5,8,10,2,5,4,10,10,,,,,,,,,,,,,,8,3,mixed,mixed,mixed,normal,8,10,7,,4,9,8,9,10,0.004419387,FAIL
1910,,40:17.1,44:29.4,0 days 00:04:12.247811,2,96,8,16,3,5,10,4,10,6,2,5,2,9,,,3,7,10,6,10,10,10,10,5,5,8,10,2,5,4,10,10,,,,,,,,,,,,,,8,3,mixed,mixed,mixed,normal,8,10,7,,4,9,8,9,10,0.004431484,FAIL
1911,,44:29.4,48:42.2,0 days 00:04:12.763386,2,96,8,16,3,5,10,4,10,5,2,5,3,10,,,3,7,10,6,10,10,10,10,5,5,8,10,2,5,4,10,10,,,,,,,,,,,,,,8,3,mixed,mixed,mixed,normal,8,10,7,,4,9,8,9,10,0.004448148,FAIL
1912,,48:42.2,52:55.3,0 days 00:04:13.091461,2,96,8,16,3,5,10,4,10,6,2,5,4,10,,,3,7,10,6,10,10,10,10,5,,8,8,2,5,4,10,10,,,,,,,,,,,,,,8,3,mixed,mixed,mixed,normal,8,9,7,,4,9,8,9,10,0.004303662,FAIL
1913,,52:55.3,57:07.9,0 days 00:04:12.692390,2,96,8,16,3,5,10,4,9,6,2,5,3,10,,,3,7,5,6,10,10,10,10,5,5,8,10,2,5,4,10,10,,,,,,,,,,,,,,8,3,mixed,mixed,mixed,normal,8,10,7,,4,9,8,9,10,0.001258877,FAIL
1914,,57:08.0,01:21.3,0 days 00:04:13.341740,2,96,8,16,3,5,10,4,10,5,2,5,3,10,,,3,7,10,6,10,10,10,10,5,5,8,10,2,5,4,10,10,,,,,,,,,,,,,,8,3,mixed,mixed,mixed,normal,8,10,7,,4,9,8,9,4,0.00285528,FAIL
1915,,01:21.3,05:29.5,0 days 00:04:08.186443,2,96,8,16,3,5,10,4,10,6,2,5,2,10,,,3,7,10,6,10,10,10,10,5,5,8,10,4,5,4,10,10,,,,,,,,,,,,,,8,3,mixed,mixed,mixed,normal,8,10,7,,4,9,8,9,4,0.004808319,FAIL
1916,,05:29.5,09:38.8,0 days 00:04:09.267851,2,96,8,16,3,5,10,4,10,6,2,5,2,10,,,3,7,10,6,10,9,10,10,5,5,8,10,2,5,4,10,10,,,,,,,,,,,,,,8,3,mixed,mixed,mixed,normal,8,10,7,,4,9,8,9,10,0.004810328,FAIL
1917,,09:38.8,13:48.5,0 days 00:04:09.749192,2,96,8,16,3,5,10,4,10,6,2,5,2,10,,,3,7,10,6,10,10,10,10,5,5,8,10,2,5,4,10,10,,,,,,,,,,,,,,8,3,mixed,mixed,mixed,normal,8,10,7,,4,9,8,9,10,0.001236955,FAIL
1918,,13:48.5,17:58.7,0 days 00:04:10.145466,2,96,8,16,3,5,10,4,9,6,2,5,2,10,,,3,7,10,6,10,10,10,10,5,5,8,10,2,5,4,10,10,,,,,,,,,,,,,,8,3,mixed,mixed,mixed,normal,8,10,7,,4,9,8,9,10,0.004442025,FAIL
1919,,17:58.7,22:09.0,0 days 00:04:10.311739,2,96,8,16,3,5,10,4,9,6,2,10,3,10,,,3,7,10,6,10,10,10,10,6,5,8,10,2,5,4,10,10,,,,,,,,,,,,,,8,3,mixed,mixed,mixed,normal,8,10,7,,4,9,8,9,10,0.0046476,FAIL
1920,,22:09.0,26:18.3,0 days 00:04:09.296507,2,96,8,16,3,5,10,4,10,6,2,5,2,9,,,3,7,10,6,10,10,10,10,5,5,8,10,2,5,4,10,10,,,,,,,,,,,,,,8,3,mixed,mixed,mixed,normal,8,10,7,,4,9,8,9,10,0.002870229,FAIL
1921,,26:18.3,30:31.8,0 days 00:04:13.475932,2,96,8,16,3,5,10,4,10,6,2,5,3,10,,,3,7,10,6,10,10,10,10,5,5,7,10,2,5,4,4,10,,,,,,,,,,,,,,8,3,mixed,mixed,mixed,normal,8,10,7,,4,9,8,9,10,0.004766363,FAIL
1922,,30:31.8,34:41.0,0 days 00:04:09.238100,2,96,8,16,3,5,10,4,10,6,2,5,3,10,,,3,7,10,5,10,10,10,10,5,5,8,10,2,5,5,10,10,,,,,,,,,,,,,,8,3,mixed,mixed,mixed,normal,8,10,7,,4,9,8,9,10,0.00282896,FAIL
1923,,34:41.0,38:54.0,0 days 00:04:13.039705,2,96,8,16,3,5,10,4,9,6,2,5,2,10,,,3,7,10,6,10,10,10,10,5,,8,10,2,5,4,10,10,,,,,,,,,,,,,,8,3,mixed,mixed,mixed,normal,8,9,7,,4,9,8,9,10,0.005044813,FAIL
1924,,38:54.0,43:04.5,0 days 00:04:10.427666,2,96,8,16,3,5,10,4,10,6,2,5,2,10,,,3,7,10,6,10,10,10,9,5,5,8,10,2,5,4,10,10,,,,,,,,,,,,,,8,3,mixed,mixed,mixed,normal,8,10,7,,4,9,8,9,4,0.004712126,FAIL
1925,,43:04.5,47:13.8,0 days 00:04:09.325532,2,96,8,16,3,5,10,4,10,6,2,5,2,10,,,3,7,10,6,10,10,10,10,6,5,8,10,2,5,4,10,10,,,,,,,,,,,,,,8,3,mixed,mixed,mixed,normal,8,10,7,,4,9,8,9,10,0.004651078,FAIL
1926,,47:13.8,51:25.0,0 days 00:04:11.154005,2,96,8,16,3,5,10,4,10,6,2,5,2,10,,,3,7,10,6,10,9,10,10,5,5,8,10,2,5,4,4,10,,,,,,,,,,,,,,8,3,mixed,mixed,mixed,normal,8,10,7,,4,9,8,9,4,0.004732473,FAIL
1927,,51:25.0,55:34.6,0 days 00:04:09.674690,2,96,8,16,3,5,10,4,9,6,2,5,2,10,,,3,7,10,6,10,10,10,10,5,5,8,10,4,5,4,10,10,,,,,,,,,,,,,,8,3,mixed,mixed,mixed,normal,8,10,7,,4,9,8,9,10,0.004557141,FAIL
1928,,55:34.6,59:43.8,0 days 00:04:09.198786,2,96,8,16,3,5,10,4,10,6,2,5,2,10,,,3,7,10,6,10,10,10,10,5,5,8,10,2,5,4,10,10,,,,,,,,,,,,,,8,3,mixed,mixed,mixed,normal,8,10,7,,4,9,8,9,10,0.001258718,FAIL
1929,,59:43.8,03:52.9,0 days 00:04:09.100301,2,96,8,16,3,5,10,4,9,6,2,5,2,10,,,3,7,10,6,10,10,10,10,5,5,8,10,2,5,4,10,10,,,,,,,,,,,,,,8,3,mixed,mixed,mixed,normal,8,10,7,,4,9,8,9,10,0.004472672,FAIL
1930,,03:53.0,08:01.5,0 days 00:04:08.514496,2,96,8,16,3,5,10,4,10,6,2,10,2,9,,,3,7,10,6,10,10,10,10,5,5,8,10,2,5,4,10,10,,,,,,,,,,,,,,8,3,mixed,mixed,mixed,normal,8,10,7,,4,9,8,9,10,0.001229302,FAIL
1931,,08:01.5,12:10.1,0 days 00:04:08.634481,2,96,8,16,3,5,10,4,10,6,2,5,2,10,,,3,7,10,6,10,9,10,10,5,5,8,10,2,5,4,10,10,,,,,,,,,,,,,,8,3,mixed,mixed,mixed,normal,8,10,7,,4,9,8,9,10,0.001229739,FAIL
1932,,12:10.1,16:23.3,0 days 00:04:13.238678,2,96,8,16,3,5,10,4,9,6,2,5,2,10,,,3,7,5,6,10,10,10,10,5,5,8,10,2,5,4,10,10,,,,,,,,,,,,,,8,3,mixed,mixed,mixed,normal,8,10,7,,4,9,8,9,10,0.001229336,FAIL
1933,,16:23.4,20:31.9,0 days 00:04:08.537430,2,96,8,16,3,5,10,4,10,6,2,5,3,10,,,3,7,10,6,10,10,10,10,5,5,8,10,2,5,4,10,10,,,,,,,,,,,,,,8,3,mixed,mixed,mixed,normal,8,10,7,,4,9,8,9,10,0.00468354,FAIL
